date,scheme_code,scheme_name,nav
2013-07-01,118939,DWS Investment Opportunity Fund - Direct Plan - Growth,37.23
2013-07-01,118940,DWS Investment Opportunity Fund - Direct Plan - Dividend,25.8
2013-07-01,118946,DWS Tax Saving Fund - Direct Plan - Growth,13.9265
2013-07-01,118947,DWS Tax Saving Fund - Direct Plan - Dividend,12.8815
2013-07-01,118949,HDFC Focused Fund - IDCW Option - Direct Plan,14.123
2013-07-01,118950,HDFC Focused Fund - Growth Option - Direct Plan,34.198
2013-07-01,118951,DWS Top Euroland Offshore Fund - Direct Plan - Growth,11.04
2013-07-01,118954,HDFC Flexi Cap Fund - IDCW Option - Direct Plan,37.903
2013-07-01,118955,HDFC Flexi Cap Fund - Growth Option - Direct Plan,273.327
2013-07-01,118957,DWS Global Agribusiness Offshore Fund - Direct Plan - Dividend,14.87
2013-07-01,118958,DWS Global Agribusiness Offshore Fund - Direct Plan - Growth,14.88
2013-07-01,118968,HDFC Balanced Advantage Fund - Growth Plan - Direct Plan,86.809
2013-07-01,118969,HDFC Balanced Advantage Fund - IDCW Plan - Direct Plan,24.893
2013-07-01,118978,HDFC Infrastructure Fund - IDCW Option - Direct Plan,8.864
2013-07-01,118979,HDFC Infrastructure Fund - Growth Option - Direct Plan,8.864
2013-07-01,118988,HDFC Mid Cap Fund - IDCW Option - Direct Plan,14.667
2013-07-01,118989,HDFC Mid Cap Fund - Growth Option - Direct Plan,17.452
2013-07-01,118990,HDFC Prudence Fund -Direct Plan - Dividend Option,24.082
2013-07-01,118991,HDFC Prudence Fund -Direct Plan - Growth Option,225.751
2013-07-01,118997,DWS Insta Cash Plus Fund - Direct Plan - Annual Dividend,107.1143
2013-07-01,118998,DWS Insta Cash Plus Fund - Direct Plan - Daily Dividend,100.304
2013-07-01,119000,DWS Insta Cash Plus Fund - Direct Plan - Growth,155.7731
2013-07-01,119003,DWS Insta Cash Plus Fund - Direct Plan -  Regular Bonus,106.4391
2013-07-01,119008,DWS Treasury Fund - Cash Plan - Direct Plan - Daily Dividend,100.391
2013-07-01,119009,DWS Treasury Fund - Cash Plan - Direct Plan - Growth,129.3818
2013-07-01,119013,DWS Treasury Fund - Cash Plan - Direct Plan - Weekly Dividend,109.6237
2013-07-01,119014,DWS Treasury Fund - Cash Plan - Direct Plan - Bonus,175.8701
2013-07-01,119017,HDFC Large Cap Fund - IDCW Option - Direct Plan,38.254
2013-07-01,119018,HDFC Large Cap Fund - Growth Option - Direct Plan,214.49
2013-07-01,119019,DSP Aggressive Hybrid Fund - Direct Plan - Growth,68.265
2013-07-01,119020,DSP Aggressive Hybrid Fund - Direct Plan - IDCW,20.924
2013-07-01,119028,DSP Natural Resources and New Energy Fund - Direct Plan - Growth,11.239
2013-07-01,119029,DSP Natural Resources and New Energy Fund - Direct Plan - IDCW,9.183
2013-07-01,119053,Tata Aggressive Hybrid Fund -Direct Plan- Growth Option,97.32
2013-07-01,119057,Tata Aggressive Hybrid Fund- Direct Plan - Monthly Payout of IDCW Option,45.0622
2013-07-01,119058,Tata Aggressive Hybrid Fund- Direct Plan - Periodic Payout of IDCW Option,52.6443
2013-07-01,119059,HDFC ELSS Tax saver - IDCW Option - Direct Plan,45.258
2013-07-01,119060,HDFC ELSS Tax saver - Growth Option - Direct Plan,224.422
2013-07-01,119061,HDFC Hybrid Equity Fund - IDCW Option - Direct Plan,9.952
2013-07-01,119062,HDFC Hybrid Equity Fund - Growth Option - Direct Plan,24.724
2013-07-01,119063,HDFC Nifty 50 Index Fund - Direct Plan,51.1922
2013-07-01,119064,HDFC Index Fund Sensex Plus Plan-Direct Plan,250.5604
2013-07-01,119065,HDFC BSE Sensex Index Fund - Direct Plan,164.7073
2013-07-01,119066,HDFC Childrens Fund - Direct Plan,50.082
2013-07-01,119070,DSP Midcap Fund - Direct Plan - IDCW,13.235
2013-07-01,119071,DSP Midcap Fund - Direct Plan - Growth,16.985
2013-07-01,119076,DSP Flexi Cap Fund - Direct Plan - Growth,16.309
2013-07-01,119077,DSP Flexi Cap Fund - Direct Plan - IDCW,46.308
2013-07-01,119088,HDFC Liquid Fund - IDCW Weekly - Direct Plan,10.3267
2013-07-01,119089,HDFC Liquid Fund - IDCW Daily - Direct Plan,10.1982
2013-07-01,119090,HDFC Liquid Fund - IDCW Monthly - Direct Plan,10.2793
2013-07-01,119091,HDFC Liquid Fund - Growth Option - Direct Plan,23.6427
2013-07-01,119092,HDFC Money Market Fund - Growth Option - Direct Plan,25.0444
2013-07-01,119093,HDFC Money Market Fund - Daily IDCW Option - Direct Plan,10.6364
2013-07-01,119094,HDFC Money Market Fund - Weekly IDCW Option -Direct Plan,10.6327
2013-07-01,119095,DSP Focused Fund - Direct Plan - IDCW,10.146
2013-07-01,119096,DSP Focused Fund - Direct Plan - Growth,10.146
2013-07-01,119102,Tata Corporate Bond Fund- Direct Plan-Daily Dividend,1008.5144
2013-07-01,119109,HDFC Overnight Fund - Daily IDCW Option - Direct Plan,10.4266
2013-07-01,119110,HDFC Overnight Fund - Growth Option - Direct Plan,19.14
2013-07-01,119123,DSP Liquidity Fund - Direct Plan - IDCW - Weekly,1001.1264
2013-07-01,119124,DSP Liquidity Fund - Direct Plan - IDCW - Daily,1000.3161
2013-07-01,119125,DSP Liquidity Fund - Direct Plan - Growth,1715.1822
2013-07-01,119132,HDFC Gold ETF Fund of Fund - Direct Plan,9.2367
2013-07-01,119133,Groww Largecap Fund (formerly known as Indiabulls Blue Chip Fund) - Direct Plan - Growth Option,10.63
2013-07-01,119134,Groww Largecap Fund (formerly known as Indiabulls Bluechip Fund)- Direct Plan- - Income Distribution cum capital withdrawal Option (Payout & Reinvestment),10.63
2013-07-01,119135,Groww Liquid Fund ( formerly known as Indiabulls Liquid )Fund - Direct Plan - Growth Option,1166.365
2013-07-01,119136,Groww Liquid Fund (formerly known as Indiabulls Liquid Fund) - Direct Plan- - Income Distribution cum capital withdrawal Option ( Reinvestment),1000.0434
2013-07-01,119140,Morgan Stanley Growth Fund - Direct Growth Plan,66.387
2013-07-01,119141,Morgan Stanley Growth Fund -  Direct Dividend Plan,20.265
2013-07-01,119148,Navi Large Cap Equity Fund-Direct Plan-Growth Option,11.7807
2013-07-01,119149,Navi Large Cap Equity Fund - Direct Plan Normal IDCW Payout,11.774
2013-07-01,119150,Morgan Stanley A.C.E. Fund-Direct Growth Plan,15.215
2013-07-01,119154,Morgan Stanley A.C.E. Fund-Direct Dividend Plan,14.323
2013-07-01,119159,Tata Large Cap Fund- Direct Plan - Payout of IDCW Option,34.4141
2013-07-01,119160,Tata Large Cap Fund -Direct Plan Growth Option,107.0174
2013-07-01,119161,Navi Liquid Fund - Direct Plan Monthly IDCW - Payout,10.0129
2013-07-01,119162,Navi Liquid Fund - Direct Plan Weekly IDCW - Payout,10.0216
2013-07-01,119163,Navi Liquid Fund - Direct Plan Daily IDCW - ReInvestment,10.0047
2013-07-01,119164,Navi Liquid Fund-Direct Plan-Growth Option,13.1201
2013-07-01,119171,Tata Ethical Fund- Direct Plan - Payout of IDCW Option,44.8243
2013-07-01,119172,Tata Ethical Fund -Direct Plan- Growth Option,74.4957
2013-07-01,119173,Morgan Stanley Liquid Fund - Direct Growth Plan,1177.2179
2013-07-01,119177,Tata Mid Cap Fund - Direct Plan- IDCW Option,18.3216
2013-07-01,119178,Tata Mid Cap Fund - Direct Plan- Growth Option,45.6347
2013-07-01,119179,Daiwa Liquid Fund - Direct - Daily Dividend,1000.52
2013-07-01,119181,Daiwa Liquid Fund - Direct - Growth,1336.1813
2013-07-01,119193,Daiwa Industry Leaders Fund - Direct - Dividend,12.34
2013-07-01,119194,Daiwa Industry Leaders Fund - Direct - Growth,12.34
2013-07-01,119197,Morgan Stanley Liquid Fund - Direct Daily Dividend,1000.4971
2013-07-01,119198,Morgan Stanley Liquid Fund - Direct Weekly Dividend,1001.3927
2013-07-01,119200,Morgan Stanley Liquid Fund - Direct Monthly Dividend,1003.2338
2013-07-01,119201,Tata Large & Mid Cap Fund Direct Plan - Payout of IDCW Option,21.3442
2013-07-01,119202,Tata Large & MId Cap Fund -Direct Plan- Growth Option,87.708
2013-07-01,119212,DSP Small Cap Fund - Direct Plan - Growth,15.225
2013-07-01,119213,DSP Small Cap Fund - Direct Plan - IDCW,9.246
2013-07-01,119218,DSP Large & Mid Cap Fund - Direct Plan - Growth,88.033
2013-07-01,119219,DSP Large & Mid Cap Fund - Direct Plan - IDCW,24.899
2013-07-01,119231,Tata Value Fund -Direct Plan Growth Option,44.4336
2013-07-01,119232,Tata Value Fund- Direct Plan -Payout of IDCW-Option A(5%),25.2135
2013-07-01,119233,Tata Value Fund- Direct Plan - Payout of IDCW -Option B(10%),25.6712
2013-07-01,119234,Tata Dividend Yield Fund-Direct Plan Growth,35.125
2013-07-01,119235,Tata Dividend Yield Fund-Direct Plan Dividend,17.1868
2013-07-01,119241,DSP ELSS Tax Saver Fund - Direct Plan - IDCW,13.019
2013-07-01,119242,DSP ELSS Tax Saver Fund - Direct Plan - Growth,18.226
2013-07-01,119243,Tata Infrastructure Fund -Direct Plan -Growth Option,26.0219
2013-07-01,119244,Tata Infrastructure Fund- Direct Plan - Payout of IDCW Option,17.1407
2013-07-01,119245,DSP BlackRock Technology.com Fund - Direct Plan - Growth,30.529
2013-07-01,119246,DSP BlackRock Technology.com Fund - Direct Plan - Dividend,21.857
2013-07-01,119247,DSP India T.I.G.E.R. Fund - Direct Plan - Growth,40.258
2013-07-01,119248,DSP India T.I.G.E.R. Fund - Direct Plan - IDCW,14.486
2013-07-01,119249,DSP Large Cap Fund - Direct Plan - IDCW,19.029
2013-07-01,119250,DSP Large Cap Fund - Direct Plan - Growth,105.697
2013-07-01,119251,Tata Retirement Savings Fund- Progressive Plan -Direct Plan-Growth Option,11.6746
2013-07-01,119255,Tata Retirement Savings Fund- Moderate Plan -Direct Plan-Growth Option,11.7641
2013-07-01,119258,Tata Indo-Global Infrastructure Fund-Direct Plan Dividend,6.8576
2013-07-01,119259,Tata Indo-Global Infrastructure Fund-Direct Plan Growth,6.8676
2013-07-01,119269,Tata Growing Economies Infrastructure Fund Scheme A-Direct Plan Growth,13.4498
2013-07-01,119270,Tata Growing Economies Infrastructure Fund Scheme A-Direct Plan Dividend,13.4414
2013-07-01,119273,Tata Growing Economies Infrastructure Fund Scheme B-Direct Plan Growth,10.8062
2013-07-01,119274,Tata Growing Economies Infrastructure Fund Scheme B-Direct Plan Dividend,10.7998
2013-07-01,119281,Tata ELSS Fund- Direct Plan - Payout of IDCW Option,44.6491
2013-07-01,119282,L&T Overnight Fund - Direct Plan- Monthly IDCW,1009.7735
2013-07-01,119283,L&T Overnight Fund - Direct Plan - Growth,1629.7351
2013-07-01,119284,L&T Overnight Fund - Direct Plan- Daily IDCW,1023.3
2013-07-01,119285,L&T Overnight Fund - Direct Plan- Weekly IDCW,1000.2373
2013-07-01,119287,Tata S&P BSE Sensex Index Fund - Direct Plan,47.7466
2013-07-01,119288,Tata Nifty 50 Index Fund -Direct Plan,36.401
2013-07-01,119290,L&T Flexicap Fund-Direct Plan-IDCW,20.511
2013-07-01,119291,L&T Flexicap Fund-Direct Plan-Growth,36.609
2013-07-01,119292,Union Flexi Cap Fund - Direct Plan - Growth Option,10.71
2013-07-01,119293,Union Flexi Cap Fund - Direct Plan - IDCW Option,10.71
2013-07-01,119294,Franklin India Conservative Hybrid Fund - Direct - Bonus,11.3387
2013-07-01,119301,Union Liquid Fund - Direct Plan - Daily IDCW Option,1000.6506
2013-07-01,119302,Union Liquid Fund - Direct Plan - Monthly IDCW Option,1001.6255
2013-07-01,119303,Union Liquid Fund - Direct Plan - Growth Option,1200.5272
2013-07-01,119304,Union Liquid Fund - Direct Plan - Weekly IDCW Option,1001.8469
2013-07-01,119305,Union Liquid Fund - Direct Plan - Fortnightly IDCW Option,1001.6373
2013-07-01,119306,Union ELSS Tax Saver Fund - Direct Plan - IDCW Option,13.18
2013-07-01,119307,Union ELSS Tax Saver Fund - Direct Plan - Growth Option,13.18
2013-07-01,119308,L&T India Large Cap Fund - Direct Plan - Growth,12.682
2013-07-01,119312,Tata Childrens Fund-Direct Plan-Growth Option,15.019
2013-07-01,119314,L&T India Large Cap Fund - Direct Plan- IDCW,12.682
2013-07-01,119325,BARODA HYBRID EQUITY FUND - Plan B (Direct) - IDCW Option,28.14
2013-07-01,119326,BARODA HYBRID EQUITY FUND - Plan B (Direct) - Growth Option,30.11
2013-07-01,119331,PineBridge India Equity Fund- Direct Plan- Growth Option,13.073
2013-07-01,119332,PineBridge India Equity Fund- Direct Plan- Dividend Option,13.073
2013-07-01,119333,Baroda BNP Paribas Banking and Financial Services Fund - Direct - Growth Option,10.98
2013-07-01,119334,Baroda BNP Paribas Banking and Financial Services Fund - Direct - IDCW Option,10.98
2013-07-01,119339,BARODA ELSS 96 - Plan B (Direct) - IDCW,22.3
2013-07-01,119342,PineBridge Infrastructure & Economic Reform Fund- Direct Plan- Dividend Option,7.971
2013-07-01,119343,PineBridge Infrastructure & Economic Reform Fund- Direct Plan- Growth Option,7.971
2013-07-01,119346,BANK OF INDIA Large & Mid Cap Fund Direct Plan-Regular IDCW,12.59
2013-07-01,119349,BANK OF INDIA Large & Mid Cap Fund Direct  Plan- Quarterly IDCW,11.34
2013-07-01,119350,BANK OF INDIA Large & Mid Cap Fund Direct Plan-Growth,17.84
2013-07-01,119351,BANK OF INDIA ELSS Tax Saver -Direct Plan- Growth,22.88
2013-07-01,119352,BANK OF INDIA ELSS Tax Saver -Direct Plan-IDCW,12.43
2013-07-01,119353,Baroda BNP Paribas MULTI CAP FUND - Direct Plan - IDCW Option,26.2
2013-07-01,119354,Baroda BNP Paribas MULTI CAP FUND - Direct Plan - Growth Option,48.61
2013-07-01,119360,PineBridge India Liquid Fund- Direct Plan- Growth Option,1512.6911
2013-07-01,119364,BANK OF INDIA Manufacturing & Infrastructure Fund-Direct Plan-Growth,7.43
2013-07-01,119366,Baroda Large cap Fund - Plan B (Direct) - IDCW Option,7.09
2013-07-01,119367,Baroda Large cap Fund - Plan B (Direct) - Growth Option,7.09
2013-07-01,119368,BANK OF INDIA Liquid Fund- Direct Plan- Daily IDCW,1002.6483
2013-07-01,119369,BANK OF INDIA Liquid Fund- Direct Plan- Growth,1378.7428
2013-07-01,119371,IIFL Dividend Opportunities Index Fund- Direct Plan - Dividend,11.0031
2013-07-01,119372,IIFL Dividend Opportunities Index Fund-Direct Plan - Growth,11.0031
2013-07-01,119392,Baroda Mid-cap Fund- Plan B (Direct) - Growth Option,6.43
2013-07-01,119397,L&T Large and Midcap Fund-Direct Plan-Growth,20.682
2013-07-01,119398,L&T Large and Midcap Fund- Direct Plan -IDCW,18.753
2013-07-01,119403,L&T India Value Fund-Direct Plan-IDCW,11.837
2013-07-01,119404,L&T India Value Fund-Direct Plan-Growth,11.837
2013-07-01,119407,L&T Indo Asia Fund-Direct Plan-Growth Option,14.908
2013-07-01,119408,L&T Indo Asia Fund-Direct Plan-Dividend Option,14.908
2013-07-01,119412,L&T Infrastructure Fund-Direct Plan-IDCW,5.65
2013-07-01,119413,L&T Infrastructure Fund -Direct Plan-Growth,5.65
2013-07-01,119414,Baroda BNP Paribas LIQUID FUND - DIRECT PLAN - DAILY IDCW OPTION,1000.63
2013-07-01,119415,Baroda BNP Paribas LIQUID FUND - DIRECT PLAN - GROWTH OPTION,1373.7501
2013-07-01,119416,Baroda BNP Paribas LIQUID FUND - DIRECT PLAN - WEEKLY IDCW OPTION,1002.0307
2013-07-01,119417,L&T  Tax Advantage Fund-Direct Plan-Growth,22.74
2013-07-01,119418,L&T Tax Advantage Fund-Direct Plan-IDCW,17.803
2013-07-01,119421,Tata Money Market Fund- Direct Plan - Daily Reinvestment of IDCW Option,1114.52
2013-07-01,119422,Tata Liquid Fund- Direct Plan- Weekly Dividend,1002.0558
2013-07-01,119423,Tata Liquid Fund- Direct Plan- Monthly Dividend,1000.717
2013-07-01,119424,Tata Money Market Fund- Direct Plan- Growth Option,2213.0355
2013-07-01,119433,Aditya Birla Sun Life Large & Mid Cap Fund -Direct - IDCW,68.42
2013-07-01,119434,Principal Retail Equity Savings Fund - Direct Plan - Growth Option,84.93
2013-07-01,119436,Aditya Birla Sun Life Large & Mid Cap Fund - Growth - Direct Plan,150.26
2013-07-01,119437,Principal Dividend Yield Fund- Direct Plan - Half Yearly Income Distribution CUM Capital Withdrawal Option,17.11
2013-07-01,119438,Principal Dividend Yield Fund - Direct Plan - Growth Option,23.17
2013-07-01,119440,Principal Emerging Bluechip Fund - Direct Plan - Half Yearly Income Distribution CUM Capital Withdrawal Option,24.15
2013-07-01,119441,Principal Emerging Bluechip Fund - Direct Plan - Growth Option,31.71
2013-07-01,119443,Tata Liquidity Management Fund- Direct Plan-Daily Dividend,1002.6089
2013-07-01,119444,Tata Liquidity Management Fund- Direct Plan-Growth,1619.7
2013-07-01,119451,Principal Multi Cap Growth Fund - Direct Plan -Half Yearly Income Distribution CUM Capital Withdrawal Option,24.56
2013-07-01,119452,Principal Multi Cap Growth Fund-Direct Plan - Growth Option,54.18
2013-07-01,119457,Principal Global Opportunities Fund-Direct Plan - Growth Option,20.5863
2013-07-01,119458,Principal Global Opportunities Fund- Direct Plan - Income Distribution CUM Capital Withdrawal Option,20.5863
2013-07-01,119464,Principal Focused Multicap Fund- Direct Plan - Growth Option,28.58
2013-07-01,119465,Principal Focused Multicap Fund- Direct Plan - Half Yearly Income Distribution CUM Capital Withdrawal Option,19.57
2013-07-01,119466,Principal Cash Management Fund -Direct Plan - Income Distribution CUM Capital Withdrawal Option - Monthly,1023.4468
2013-07-01,119467,Principal Cash Management Fund - Direct Plan - Income Distribution CUM Capital Withdrawal Option - Daily,1000.07
2013-07-01,119468,Principal Cash Management Fund - Direct Plan - Growth Option,1165.413
2013-07-01,119469,Principal Cash Management Fund - Direct Plan - Income Distribution CUM Capital Withdrawal Option - Weekly,1007.0919
2013-07-01,119474,Principal Ultra Short Term Fund- Direct Plan -Growth Option,1345.2597
2013-07-01,119475,Principal Ultra Short Term Fund- Direct Plan - Income Distribution CUM Capital Withdrawal Option - Monthly,1059.5823
2013-07-01,119482,Principal Balanced Advantage Fund - Direct Plan - Growth Option,10.91
2013-07-01,119483,Principal Balanced Advantage Fund - Direct Plan - Monthly Income Distribution CUM Capital Withdrawal Option,10.91
2013-07-01,119484,Principal Hybrid Equity Fund- Direct Plan - Growth Option,33.39
2013-07-01,119485,Principal Hybrid Equity Fund-Direct Plan - Monthly Income Distribution CUM Capital Withdrawal Option,16.89
2013-07-01,119486,Principal Personal Tax Saver Fund - Direct Plan,93.95
2013-07-01,119487,Principal Nifty 100 Equal Weight Fund- Direct Plan - Income Distribution CUM Capital Withdrawal Option,23.8932
2013-07-01,119488,Principal Nifty 100 Equal Weight Fund - Direct Plan - Growth Option,40.6542
2013-07-01,119489,Principal Tax Savings Fund - Direct Plan,79.92
2013-07-01,119506,Aditya Birla Sun Life Dividend Yield Fund -DIRECT - IDCW,12.16
2013-07-01,119507,Aditya Birla Sun Life Dividend Yield Fund - Growth - Direct Plan,84.53
2013-07-01,119511,Aditya Birla Sun Life Money Manager Fund - Growth - Direct Plan,159.2663
2013-07-01,119512,Aditya Birla Sun Life Money Manager Fund - Direct - weekly IDCW,100.1459
2013-07-01,119513,Aditya Birla Sun Life Money Manager Fund - Direct - daily IDCW,100.02
2013-07-01,119514,Aditya Birla Sun Life Infrastructure Fund - Growth - Direct Plan,13.98
2013-07-01,119515,Aditya Birla Sun Life Infrastructure Fund -  Direct - IDCW,9.63
2013-07-01,119516,Aditya Birla Sun Life International Equity Fund - Direct - IDCW,13.5443
2013-07-01,119517,Aditya Birla Sun Life International Equity Fund - Growth - Direct Plan,13.5441
2013-07-01,119518,Aditya Birla Sun Life International Equity Fund - Plan B - Growth - Direct Plan,9.7902
2013-07-01,119519,Aditya Birla Sun Life International Equity Fund - Plan B - Direct - IDCW,9.7902
2013-07-01,119520,Aditya Birla Sun Life Long Term Advantage - Growth - Direct Plan,14.9
2013-07-01,119521,Aditya Birla Sun Life Long Term Advantage - Dividend - Direct Plan,13.76
2013-07-01,119526,Aditya Birla Sun Life Arbitrage Fund - Growth - Direct Plan,12.9461
2013-07-01,119527,Aditya Birla Sun Life Large Cap Fund-DIRECT - IDCW,22.0
2013-07-01,119528,Aditya Birla Sun Life Large Cap Fund - Growth - Direct Plan,98.65
2013-07-01,119536,Aditya Birla Sun Life India Reforms Fund - Growth - Direct Plan,8.31
2013-07-01,119537,Aditya Birla Sun Life India Reforms Fund - Dividend - Direct Plan,8.32
2013-07-01,119542,Sundaram Equity Hybrid Fund Direct Plan - Growth,48.6177
2013-07-01,119543,Aditya Birla Sun Life ELSS Tax Saver Fund-DIRECT - IDCW,78.95
2013-07-01,119544,Aditya Birla Sun Life ELSS Tax Saver Fund - Growth - Direct Plan,11.44
2013-07-01,119545,Sundaram Equity Hybrid Fund Direct Plan - Income Distribution cum Capital Withdrawal (IDCW),10.8217
2013-07-01,119546,Aditya Birla Sun Life Special Situations Fund - Growth - Direct Plan,9.2753
2013-07-01,119547,Aditya Birla Sun Life Special Situations Fund - Dividend - Direct Plan,9.2711
2013-07-01,119548,Sundaram Value Fund Direct Plan - Income Distribution cum Capital Withdrawal (IDCW),10.735
2013-07-01,119549,Sundaram Value Fund Direct Plan - Growth,45.5489
2013-07-01,119554,Sundaram Select Thematic Funds Capex Opportunities - Direct Plan - Dividend Option,7.3258
2013-07-01,119555,Sundaram Select Thematic Funds Capex Opportunities -Direct Plan - Growth Option,14.1395
2013-07-01,119556,Aditya Birla Sun Life Small Cap Fund - Growth - Direct Plan,12.2018
2013-07-01,119557,Aditya Birla Sun Life Small Cap Fund -Direct - IDCW,11.8302
2013-07-01,119558,Sundaram Select Thematic Funds Energy Opportunities - Direct Plan - Dividend Option,6.6076
2013-07-01,119559,Sundaram Select Thematic Funds Energy Opportunities -Direct Plan - Growth Option,6.6144
2013-07-01,119563,Aditya Birla Sun Life Focused Fund -Direct - IDCW,14.3064
2013-07-01,119564,Aditya Birla Sun Life Focused Fund - Growth - Direct Plan,25.113
2013-07-01,119565,Sundaram Large and Midcap Direct Plan - Income Distribution cum Capital Withdrawal (IDCW),10.7781
2013-07-01,119566,Sundaram Large and Midcap Fund Direct Plan - Growth,13.2553
2013-07-01,119567,SBI Arbitrage Opportunities Fund - Direct Plan - Income Distribution cum Capital Withdrawal Option (IDCW),12.5174
2013-07-01,119568,Aditya Birla Sun Life Liquid Fund - Growth - Direct Plan,192.0586
2013-07-01,119569,Aditya Birla Sun Life Liquid Fund -Direct - daily IDCW,100.195
2013-07-01,119570,Aditya Birla Sun Life Liquid Fund -Direct - weekly IDCW,100.3022
2013-07-01,119571,Aditya Birla Sun Life Liquid Fund -DIRECT - IDCW,102.4962
2013-07-01,119572,Sundaram Multi Asset Fund Direct Growth,10.7061
2013-07-01,119573,Sundaram Multi Asset Fund Direct Dividend,10.6938
2013-07-01,119574,SBI Arbitrage Opportunities Fund - Direct Plan - Gr,16.3561
2013-07-01,119575,Aditya Birla Sun Life Commodity Equities Fund - Global Agri Plan -Direct - IDCW,16.4307
2013-07-01,119576,Aditya Birla Sun Life Commodity Equities Fund - Global Agri Plan - Growth - Direct Plan,17.544
2013-07-01,119577,Sundaram Select Focus Direct Plan - Income Distribution cum Capital Withdrawal (IDCW),9.3404
2013-07-01,119578,Sundaram Select Focus Direct Plan - Growth,86.3517
2013-07-01,119579,Birla Sun Life Commodities Equities Fund Global Multi Commodity Plan - Dividend - Direct Plan,12.5909
2013-07-01,119580,Birla Sun Life Commodities Equities Fund Global Multi Commodity Plan - Growth - Direct Plan,13.4142
2013-07-01,119581,Sundaram Mid Cap Fund Direct Plan - Growth,157.927
2013-07-01,119582,Sundaram Mid Cap Fund Direct Plan - Income Distribution cum Capital Withdrawal (IDCW),17.8924
2013-07-01,119583,Birla Sun Life Commodities Equities Fund Global Precious Metals Plan - Dividend - Direct Plan,7.1124
2013-07-01,119584,Birla Sun Life Commodities Equities Fund Global Precious Metals Plan - Growth - Direct Plan,7.1348
2013-07-01,119585,SBI Large Cap Fund - Direct Plan - Income Distribution cum Capital Withdrawal Option (IDCW),12.8424
2013-07-01,119586,Sundaram Select Thematic Funds PSU Opportunities -Direct Plan - Growth Option,8.7311
2013-07-01,119587,Sundaram Select Thematic Funds PSU Opportunities - Direct Plan - Dividend Option,7.9585
2013-07-01,119588,Sundaram Small Cap Fund Direct Plan - Income Distribution cum Capital Withdrawal (IDCW),9.7093
2013-07-01,119589,Sundaram Small Cap Fund Direct Plan - Growth,27.176
2013-07-01,119590,Aditya Birla Sun Life Consumption Fund -DIRECT - IDCW,16.82
2013-07-01,119591,Aditya Birla Sun Life Consumption Fund - Growth - Direct Plan,32.14
2013-07-01,119592,Sundaram Growth Fund - Direct Plan - Growth Option,89.6338
2013-07-01,119593,Sundaram Growth Fund - Direct Plan - Dividend Option,12.1181
2013-07-01,119594,Sundaram Consumption Fund (Formerly Known asSundaram Rural and Consumption Fund Direct Plan - Income Distribution cum Capital Withdrawal (IDCW),11.4313
2013-07-01,119595,Sundaram Consumption Fund (Formerly Known as Sundaram Rural and Consumption Fund Direct Plan - Growth),15.7795
2013-07-01,119596,Sundaram Financial Services Opportunities Fund Direct Plan - Income Distribution cum Capital Withdrawal (IDCW),12.1598
2013-07-01,119597,Sundaram Financial Services Opportunities Fund Direct Plan - Growth,18.9762
2013-07-01,119598,SBI Large Cap FUND-DIRECT PLAN -GROWTH,16.4126
2013-07-01,119599,Sundaram Entertainment Opportunities Fund -Direct Plan - Growth Option,12.8183
2013-07-01,119600,Sundaram Entertainment Opportunities Fund - Direct Plan - Dividend Option,10.1217
2013-07-01,119601,Sundaram Global Brand Theme-Equity Active FOF - Direct IDCW,13.4171
2013-07-01,119602,Sundaram Global Brand Theme-Equity Active FOF - Direct Growth,13.7998
2013-07-01,119604,SBI Equity Hybrid Fund - Direct Plan - Income Distribution cum Capital Withdrawal Option (IDCW),25.3908
2013-07-01,119609,SBI EQUITY HYBRID FUND - DIRECT PLAN - Growth,56.6799
2013-07-01,119613,SBI Comma Fund - Direct Plan - Income Distribution cum Capital Withdrawal Option (IDCW),11.7743
2013-07-01,119617,Aditya Birla Sun Life India Opportunities Fund - Dividend - Direct Plan,15.31
2013-07-01,119618,Aditya Birla Sun Life India Opportunities Fund - Growth - Direct Plan,50.76
2013-07-01,119619,Aditya Birla Sun Life Midcap Fund -DIRECT - IDCW,20.38
2013-07-01,119620,Aditya Birla Sun Life Midcap Fund - Growth - Direct Plan,108.52
2013-07-01,119646,Aditya Birla Sun Life MNC Fund - Growth - Direct Plan,259.22
2013-07-01,119647,Aditya Birla Sun Life MNC Fund - DIRECT - IDCW,87.95
2013-07-01,119648,Aditya Birla Sun Life Nifty 50 Index Fund - Growth - Direct Plan,57.6761
2013-07-01,119649,Aditya Birla Sun Life Nifty 50 Index Fund -DIRECT - IDCW,20.328
2013-07-01,119658,Aditya Birla Sun Life Value Fund - Direct - IDCW,14.9672
2013-07-01,119659,Aditya Birla Sun Life Value Fund - Growth - Direct Plan,17.1252
2013-07-01,119660,Aditya Birla Sun Life Tax Plan -DIRECT - IDCW,48.61
2013-07-01,119661,Aditya Birla Sun Life Tax Plan - Direct Plan - Growth Option,14.76
2013-07-01,119686,Sundaram Money Fund Direct Plan - Growth,25.272
2013-07-01,119687,Sundaram Money Fund Direct Plan - Monthly Income Distribution cum Capital Withdrawal (IDCW),10.5443
