date,scheme_code,scheme_name,nav
2013-01-25,100033,Aditya Birla Sun Life Large & Mid Cap Fund - Regular Growth,161.31
2013-01-25,100034,Aditya Birla Sun Life Large & Mid Cap Fund -Regular - IDCW,77.67
2013-01-25,100063,Aditya Birla Sun Life MNC Fund - Regular - IDCW,87.19
2013-01-25,100064,Aditya Birla Sun Life MNC Fund - Growth - Regular Plan,257.21
2013-01-25,100065,Aditya Birla Sun Life India Opportunities Fund - Dividend - Regular Plan,15.93
2013-01-25,100066,Aditya Birla Sun Life India Opportunities Fund - Growth - Regular Plan,52.83
2013-01-25,100067,Aditya Birla Sun Life Tax Plan -Regular - IDCW,50.45
2013-01-25,100068,BARODA ELSS 96 - Plan A - IDCW,24.68
2013-01-25,100080,DSP Flexi Cap Fund - Regular Plan - IDCW,50.546
2013-01-25,100081,DSP Aggressive Hybrid Fund- Regular Plan - Growth,72.333
2013-01-25,100082,DSP Aggressive Hybrid Fund- Regular Plan - IDCW,22.165
2013-01-25,100090,DSP BlackRock Technology.com   Fund - Regular Plan - Growth,32.272
2013-01-25,100119,HDFC Balanced Advantage Fund - Growth Plan,96.974
2013-01-25,100120,HDFC Balanced Advantage Fund - IDCW Plan,30.985
2013-01-25,100121,HDFC Balanced Fund - Dividend Option,20.154
2013-01-25,100122,HDFC Balanced Fund - Growth Option,64.553
2013-01-25,100151,Principal Retail Equity Savings Fund - Growth Option,89.92
2013-01-25,100152,Principal Nifty 100 Equal Weight Fund-Income Distribution CUM Capital Withdrawal,24.3558
2013-01-25,100153,Principal Nifty 100 Equal Weight Fund-Growth,41.4411
2013-01-25,100156,Principal Tax Savings Fund,85.7
2013-01-25,100171,Quant Dynamic Bond-Dividend,11.7599
2013-01-25,100172,Quant Dynamic Bond-Growth,38.2179
2013-01-25,100173,Quant Dynamic Bond-Bonus,20.1259
2013-01-25,100174,quant ELSS Tax Saver Fund - IDCW Option - Regular Plan,8.006
2013-01-25,100175,quant ELSS Tax Saver Fund - Growth Option - Regular Plan,37.2356
2013-01-25,100176,quant Small Cap Fund - IDCW Option - Regular Plan,32.1633
2013-01-25,100177,quant Small Cap Fund - Growth - Regular Plan,34.2847
2013-01-25,100188,ING Core Equity Fund-Dividend Option,17.25
2013-01-25,100189,ING Core Equity Fund-Growth Option,43.27
2013-01-25,100190,ING Liquid Fund-Regular Growth Option,23.8642
2013-01-25,100191,ING Liquid Fund-Regular Weekly Dividend Option,10.8331
2013-01-25,100192,ING Liquid Fund-Regular Daily Dividend Option,10.7873
2013-01-25,100196,ING Liquid Fund-Institutional Growth Option,17.9824
2013-01-25,100197,ING Liquid Fund-Institutional Weekly Dividend Option,10.0626
2013-01-25,100198,ING Liquid Fund-Institutional Daily Dividend Option,10.0121
2013-01-25,100199,ING Liquid Fund-Super Institutional Growth Option,17.1932
2013-01-25,100200,ING Liquid Fund-Super Institutional Daily Dividend Option,10.0048
2013-01-25,100201,ING Liquid Fund-Super Institutional Weekly Dividend Option,10.011
2013-01-25,100202,ING Balanced Fund-Dividend Option,19.4
2013-01-25,100203,ING Balanced Fund-Growth Option,27.74
2013-01-25,100218,JM Large Cap Fund (Regular) - IDCW,14.8267
2013-01-25,100219,JM Large Cap Fund (Regular) - Growth Option,36.4245
2013-01-25,100220,JM Aggressive Hybrid Fund (Regular) - IDCW,17.5647
2013-01-25,100221,JM Aggressive Hybrid Fund (Regular) -Growth Option,24.6263
2013-01-25,100233,JM Liquid Fund (Regular) - Weekly IDCW,11.0112
2013-01-25,100234,JM Liquid Fund - Growth Option,31.4959
2013-01-25,100237,JM High Liquidity Fund-- Institutional Plan - Growth,19.0268
2013-01-25,100238,JM High Liquidity Fund-Institutional Plan - Daily Dividend,10.0159
2013-01-25,100241,JM High Liquidity Fund-- Institutional Plan - Dividend,10.7633
2013-01-25,100244,JM Liquid Fund (Regular) - Quarterly IDCW,17.827
2013-01-25,100245,JM High Liquidity Fund-Super Institutional Plan- Daily Dividend,10.0165
2013-01-25,100246,JM High Liquidity Fund-Super Institutional Plan- Weekly  Dividend,10.1572
2013-01-25,100247,JM Liquid Fund (Regular) - Super Institutional Plan - Growth Option,18.1139
2013-01-25,100254,JM Value Fund (Regular) - Growth Option,14.0977
2013-01-25,100286,Kotak Aggressive Hybrid Fund - Regular Plan - IDCW - Payout & Reinvestment of Income Distribution cum capital withdrawal option,23.788
2013-01-25,100337,SaharaTax Gain-Dividend,15.107
2013-01-25,100338,SaharaTax Gain-Growth,40.2519
2013-01-25,100347,Morgan Stanley Growth Fund- Regular Growth Plan,66.863
2013-01-25,100348,ICICI Prudential Large & Mid Cap Fund - IDCW,15.83
2013-01-25,100349,ICICI Prudential Large & Mid Cap Fund - Growth,160.04
2013-01-25,100350,ICICI Prudential Large & Mid Cap Fund - Institutional Option - I - Growth,23.23
2013-01-25,100351,ICICI Prudential FMCG Fund - IDCW,52.15
2013-01-25,100352,ICICI Prudential FMCG Fund - Growth,104.71
2013-01-25,100353,ICICI Prudential ELSS Tax Saver Fund - IDCW,20.42
2013-01-25,100354,ICICI Prudential ELSS Tax Saver Fund - Growth,160.71
2013-01-25,100355,ICICI Prudential Equity & Debt Fund - Monthly IDCW,17.38
2013-01-25,100356,ICICI Prudential Equity & Debt Fund - Growth,57.33
2013-01-25,100363,ICICI Prudential Technology Fund - Growth,21.21
2013-01-25,100375,NIPPON INDIA GROWTH MID CAP FUND - IDCW Option,54.3518
2013-01-25,100376,Nippon India Growth Mid Cap Fund-Growth Plan-Bonus Option,82.7676
2013-01-25,100377,Nippon India Growth Mid Cap Fund-Growth Plan-Growth Option,498.8726
2013-01-25,100378,Nippon India Vision Large & Midcap Fund - IDCW Option,38.2779
2013-01-25,100379,Nippon India Vision Large & Midcap Fund-GROWTH PLAN-Bonus Option,45.6564
2013-01-25,100380,Nippon India Vision Large & Midcap Fund-GROWTH PLAN-Growth Option,271.2893
2013-01-25,100414,Tata Aggressive Hybrid Fund- Regular Plan - Growth Option,98.714
2013-01-25,100415,Tata Ethical Fund-Regular Plan - Growth Option,74.6182
2013-01-25,100470,Franklin India Large Cap Fund - IDCW,40.0689
2013-01-25,100471,Franklin India Large Cap Fund-Growth,243.516
2013-01-25,100472,Franklin India Mid Cap Fund - IDCW,38.5227
2013-01-25,100473,Franklin India Mid Cap Fund-Growth,326.5162
2013-01-25,100474,Tata ELSS Fund- Regular Plan - Payout of IDCW Option,46.3492
2013-01-25,100475,Tata Large Cap Fund -Regular Plan - Growth Option,109.366
2013-01-25,100476,Taurus Flexi Cap Fund - Regular Plan - Growth,64.37
2013-01-25,100477,Taurus Mid Cap Fund - Regular Plan - Growth,17.53
2013-01-25,100480,Taurus ELSS Tax Saver Fund - Regular Plan - Growth,38.96
2013-01-25,100484,Franklin India Index Fund- NSE Nifty 50 Index Fund - Growth,47.8001
2013-01-25,100496,Templeton India Value Fund - Growth Plan,127.43
2013-01-25,100497,Templeton India Value Fund - IDCW,51.2541
2013-01-25,100519,Franklin India Flexi Cap Fund - IDCW,27.9231
2013-01-25,100520,Franklin India Flexi Cap Fund - Growth,257.1993
2013-01-25,100521,Franklin India Technology Fund - IDCW,18.2324
2013-01-25,100522,Franklin India Technology Fund-Growth,67.9028
2013-01-25,100524,Franklin INDIA OPPORTUNITIES FUND - IDCW,13.5642
2013-01-25,100525,Franklin India ELSS Tax Saver Fund - IDCW,30.198
2013-01-25,100526,Franklin India ELSS Tax Saver Fund-Growth,246.0988
2013-01-25,100535,Franklin India Retirement Fund - IDCW,14.2258
2013-01-25,100536,Franklin India Retirement Fund - Growth,69.1471
2013-01-25,100549,Franklin India Aggressive Hybrid Fund - IDCW,18.0728
2013-01-25,100550,Franklin India Aggressive Hybrid Fund - Growth Plan,55.915
2013-01-25,100551,Templeton India Children’s Asset Plan-Education Plan,36.5062
2013-01-25,100552,Templeton India Children’s Asset Plan-Gift Plan - Growth,50.3675
2013-01-25,100553,Templeton India Children’s Asset Plan-Gift Plan - Dividend,50.3675
2013-01-25,100593,CANARA ROBECO ELSS TAX SAVER - REGULAR PLAN -IDCW (Payout),19.94
2013-01-25,100612,Sundaram Growth Fund-Dividend,13.1055
2013-01-25,100613,Sundaram Growth Fund-Growth,96.9503
2013-01-25,100614,Sundaram Value Fund Regular Plan - Income Distribution cum Capital Withdrawal (IDCW),11.4948
2013-01-25,100617,Sundaram Equity Hybrid Fund Regular Plan - Growth,50.9461
2013-01-25,100618,Sundaram Money Fund Retail Plan - Growth,22.7626
2013-01-25,100619,Sundaram Money Fund Retail Plan - Quarterly Reinvestment of Income Distribution cum Capital Withdrawal (IDCW),12.7382
2013-01-25,100620,Sundaram Money Fund Retail Plan - Daily Reinvestment of Income Distribution cum Capital Withdrawal (IDCW),10.0953
2013-01-25,100621,Sundaram Money Fund Retail Plan - Weekly Reinvestment of Income Distribution cum Capital Withdrawal (IDCW),10.9259
2013-01-25,100622,Sundaram Money Fund Retail Plan - Fortnightly Reinvestment of Income Distribution cum Capital Withdrawal (IDCW),10.571
2013-01-25,100623,Sundaram Money Fund Retail Plan - Monthly Income Distribution cum Capital Withdrawal (IDCW),10.3974
2013-01-25,100630,quant Multi Cap Fund-IDCW Option - Regular Plan,10.9471
2013-01-25,100631,quant Multi Cap Fund-GROWTH OPTION - Regular Plan,70.6742
2013-01-25,100641,SBI ULTRA SHORT DURATION FUND - REGULAR PLAN - GROWTH,2552.4658
2013-01-25,100643,SBI Technology Opportunities Fund - Regular Plan - Income Distribution cum Capital Withdrawal Option (IDCW),25.45
2013-01-25,100644,SBI Healthcare Opportunities Fund - Regular Plan - Income Distribution cum Capital Withdrawal Option (IDCW),48.97
2013-01-25,100645,SBI Consumption Opportunities Fund - Regular Plan - Income Distribution cum Capital Withdrawal Option (IDCW),49.46
2013-01-25,100646,UTI - Unit Linked Insurance Plan,17.9273
2013-01-25,100650,UTI Large Cap Fund - Regular Plan - IDCW,26.7006
2013-01-25,100651,UTI Large Cap Fund - Regular Plan - Growth Option,58.6856
2013-01-25,100656,UTI - Master Plus Unit Scheme-Growth Option,94.2425
2013-01-25,100657,UTI - Master Plus Unit Scheme-Income Option,65.8377
2013-01-25,100663,UTI Large & Mid Cap Fund - Regular Plan - IDCW,24.3161
2013-01-25,100664,UTI Large & Mid Cap Fund - Regular Plan - Growth Option,31.3052
2013-01-25,100668,UTI Flexi Cap Fund - Regular Plan - IDCW,56.048
2013-01-25,100669,UTI - Flexi Cap Fund-Growth Option,63.3855
2013-01-25,100678,UTI Children's Hybrid Fund - Regular Plan,14.7907
2013-01-25,100682,UTI Retirement Fund - Regular Plan,18.3362
2013-01-25,100684,UTI Aggressive Hybrid Fund - Regular Plan - Growth,88.7875
2013-01-25,100685,UTI Aggressive Hybrid Fund - Regular Plan - IDCW,22.8796
2013-01-25,100723,UTI MMF-Discontinued - Regular Plan -Growth,3179.569
2013-01-25,100724,UTI MMF- Discontinued - Regular Plan - Flexi Dividend Option,2032.7097
2013-01-25,100725,UTI MMF- Discontinued - Regular Plan - Periodic Dividend Option,2023.1223
2013-01-25,100739,UTI MNC Fund - Regular Plan - IDCW,44.2523
2013-01-25,100740,UTI - MNC Fund - Regular Plan - Growth Option,71.951
2013-01-25,100750,UTI - Master Value Fund-Income Option,23.103
2013-01-25,100751,UTI - Master Value Fund-Growth Option,55.0963
2013-01-25,100794,Sundaram Small Cap Fund Regular Plan - Income Distribution cum Capital Withdrawal (IDCW),11.7113
2013-01-25,100795,Sundaram Small Cap Fund Regular Plan - Growth,32.7911
2013-01-25,100796,Sahara Midcap Fund-Growth Plan,31.2926
2013-01-25,100797,Sahara Midcap Fund-Dividend Plan,13.8443
2013-01-25,100798,Sahara Midcap Fund-Auto Payout,31.2926
2013-01-25,100799,Sahara Midcap Fund-Bonus,31.2926
2013-01-25,100804,UTI Energy Fund-Income Option,11.0563
2013-01-25,100805,UTI Energy Fund-Growth Option,9.7467
2013-01-25,100806,UTI Healthcare Fund - Regular Plan - IDCW,35.8691
2013-01-25,100807,UTI Healthcare Fund - Regular Plan - Growth Option,46.4111
2013-01-25,100808,UTI Services Industries Fund-Income Option,27.9893
2013-01-25,100809,UTI Services Industries Fund-Growth Option,65.0849
2013-01-25,100820,UTI ELSS Tax Saver Fund - Regular Plan - IDCW,16.969
2013-01-25,100821,UTI ELSS Tax Saver Fund - Regular Plan - Growth Option,42.516
2013-01-25,100822,UTI Nifty 50 Index Fund - Regular Plan - Growth Option,37.8777
2013-01-25,100823,UTI Nifty 50 Index Fund - Regular Plan - IDCW,19.2827
2013-01-25,100899,HDFC Childrens Fund-Savings,26.6514
2013-01-25,100900,HDFC Childrens Fund - Growth Plan,50.572
2013-01-25,100915,SBI Contra Fund - Regular Plan - Income Distribution cum Capital Withdrawal Option (IDCW),17.78
2013-01-25,100948,Franklin India Conservative Hybrid Fund - Growth,32.7692
2013-01-25,100949,Franklin India Conservative Hybrid Fund - Plan A - Monthly - IDCW,12.5068
2013-01-25,100950,Franklin India Conservative Hybrid Fund - Plan A - Quarterly - IDCW,12.2335
2013-01-25,100951,Franklin India Conservative Hybrid Fund - Monthly Bonus,11.414
2013-01-25,100966,Principal Multi Cap Growth Fund- Half Yearly Income Distribution CUM Capital Withdrawal Option,26.37
2013-01-25,100967,Principal Multi Cap Growth Fund-Growth Option,58.21
2013-01-25,100997,HDFC Long Term Advantage Plan - IDCW Plan,35.205
2013-01-25,100998,HDFC Long Term Advantage Plan - Growth Plan,152.174
2013-01-25,101065,quant Mid Cap Fund - Growth Option - Regular Plan,30.6611
2013-01-25,101066,quant Mid Cap Fund - IDCW Option - Regular Plan,10.8536
2013-01-25,101069,quant Aggressive Hybrid Fund-IDCW Option - Regular Plan,11.4779
2013-01-25,101070,quant Aggressive Hybrid Fund - Growth Option - Regular Plan,61.2134
2013-01-25,101071,quant Multi Asset Allocation Fund - IDCW Option - Regular Plan,22.4563
2013-01-25,101072,quant Multi Asset Allocation Fund-GROWTH OPTION - Regular Plan,24.5158
2013-01-25,101078,JM Liquid Fund (Regular) - Daily IDCW,10.4302
2013-01-25,101127,ICICI Prudential Children's Fund - Regular Plan,64.34
2013-01-25,101143,ICICI Prudential Multi-Asset Fund - IDCW,17.536
2013-01-25,101144,ICICI Prudential Multi-Asset Fund - Growth,120.2393
2013-01-25,101161,Nippon India Multi Cap Fund-Growth Plan-Growth Option,44.2501
2013-01-25,101162,Nippon India Multi Cap Fund-Growth Plan-Bonus Option,44.2501
2013-01-25,101163,NIPPON INDIA MULTI CAP FUND - IDCW Option,26.7842
2013-01-25,101184,LIC MF Liquid Fund-Regular Plan-Daily IDCW,1098.0
2013-01-25,101185,LIC MF Liquid Fund-Regular Plan-Growth,2096.6441
2013-01-25,101206,SBI OVERNIGHT FUND - REGULAR PLAN - GROWTH,1984.7091
2013-01-25,101209,Taurus Large Cap Fund - Regular Plan - Growth,45.09
2013-01-25,101222,Tata Aggressive Hybrid Fund- Regular Plan - Periodic Payout of IDCW Option,59.0587
2013-01-25,101228,ICICI Prudential Multicap Fund - Growth,123.53
2013-01-25,101262,Nippon India Power & Infra Fund-Growth Plan -Growth Option,57.6861
2013-01-25,101263,Nippon India Power & Infra Fund-Growth Plan-Bonus Option,57.686
2013-01-25,101264,NIPPON INDIA POWER & INFRA FUND - IDCW Option,32.7631
2013-01-25,101265,Principal Hybrid Equity Fund-Growth,34.52
2013-01-25,101266,Principal Hybrid Equity Fund- Monthly Income Distribution CUM Capital Withdrawal,17.44
2013-01-25,101281,HDFC BSE Sensex Index Fund - Growth Plan,167.9175
2013-01-25,101282,HDFC Index Fund-Sensex Plus( FV-Rs32.161),256.017
2013-01-25,101295,SBI ESG Exclusionary Strategy Fund - Regular Plan - Income Distribution cum Capital Withdrawal Option (IDCW),29.3
2013-01-25,101313,Aditya Birla Sun Life Nifty 50 Index Fund -REGULAR - IDCW,22.9184
2013-01-25,101314,Aditya Birla Sun Life Nifty 50 Index Fund - Growth - Regular Plan,59.2886
2013-01-25,101349,ICICI Prudential Nifty 50 Index Fund - Cumulative Option,56.5825
2013-01-25,101361,Canara Robeco Liquid Fund- INSTITUTIONAL-Weekly dividend,1000.0
2013-01-25,101362,Canara Robeco Liquid Fund- INSTITUTIONAL-Growth,2080.2249
2013-01-25,101363,Canara Robeco Liquid Fund- INSTITUTIONAL-Daily Dividend Reinvestment,1005.5
2013-01-25,101364,Canara Robeco Liquid Fund-Retail-DRI,1007.0
2013-01-25,101365,Canara Robeco Liquid Fund-Retail-Growth,2050.782
2013-01-25,101393,Sahara Liquid Fund-Fixed Pricing - Daily Dividend Option,1030.0494
2013-01-25,101394,Sahara Liquid Fund-Fixed Pricing - Growth option,2088.0039
2013-01-25,101397,Sahara Liquid Fund-Fixed Pricing -  Weekly Dividend Option,1027.4373
2013-01-25,101398,Sahara Liquid Fund-Fixed Pricing - Monthly Dividend Option,1028.1957
2013-01-25,101399,Sahara Liquid Fund-Variable Pricing - Daily Dividend option,1030.0622
2013-01-25,101400,Sahara Liquid Fund-Variable Pricing - Weekly Dividend Option,1032.0712
2013-01-25,101401,Sahara Liquid Fund-Variable Pricing- Monthly Dividend Option,1032.5658
2013-01-25,101402,Sahara Liquid Fund-Variable Pricing - Growth option,2106.4118
2013-01-25,101420,JM Floater Short Term Fund - Daily Dividend Option,10.0883
2013-01-25,101421,JM Floater Short Term Fund - Growth Option,18.1431
2013-01-25,101472,Sundaram Equity Hybrid Fund Regular Plan - Income Distribution cum Capital Withdrawal (IDCW),11.3109
2013-01-25,101489,Tata Young Citizen Fund [Upto 3 years] Regular Plan,14.8991
2013-01-25,101490,Tata Young Citizen Fund [>3 years upto 7 years] Regular Plan,14.8991
2013-01-25,101491,Tata Childrens Fund -Regular Plan-Growth Option,14.8991
2013-01-25,101525,HDFC Nifty 50 Index Fund - Growth Plan,52.4135
2013-01-25,101528,Sahara Growth Fund-Growth,87.1156
2013-01-25,101529,Sahara Growth Fund-Dividend,25.284
2013-01-25,101530,SBI Large & Midcap Fund - Regular Plan - Income Distribution cum Capital Withdrawal Option (IDCW),55.46
2013-01-25,101536,Sundaram Select Focus Regular Plan - Income Distribution cum Capital Withdrawal (IDCW),9.8428
2013-01-25,101537,Sundaram Select Focus Regular Plan - Growth,90.9742
2013-01-25,101538,Sundaram Mid Cap Fund Regular Plan - Income Distribution cum Capital Withdrawal (IDCW),19.0112
2013-01-25,101539,Sundaram Mid Cap Fund Regular Plan - Growth,168.0377
2013-01-25,101549,JM Liquid Fund (Regular) - Bonus Option - Principal Units,10.0852
2013-01-25,101551,SBI Equity Hybrid Fund - Regular Plan - Income Distribution cum Capital Withdrawal Option (IDCW),25.76
2013-01-25,101591,Aditya Birla Sun Life Midcap Fund -REGULAR - IDCW,21.95
2013-01-25,101592,Aditya Birla Sun Life MIDCAP Fund-Growth,117.07
2013-01-25,101593,HSBC Large Cap Fund - Regular IDCW,27.3889
2013-01-25,101594,HSBC Large Cap Fund - Regular Growth,108.8849
2013-01-25,101628,DWS Alpha Equity Fund - Dividend,17.36
2013-01-25,101629,DWS Alpha Equity Fund - Growth,79.79
2013-01-25,101635,DSP Large Cap Fund - Regular Plan - Growth,112.518
2013-01-25,101636,DSP Large Cap Fund - Regular Plan - IDCW,22.124
2013-01-25,101659,Tata Nifty 50 Index Fund -Regular Plan,36.3375
2013-01-25,101672,Tata Value Fund - Regular Plan -Growth Option,51.025
2013-01-25,101705,ICICI Prudential BSE Sensex ETF,217.9388
2013-01-25,101706,ICICI Prudential Multicap Fund - IDCW,16.58
2013-01-25,101714,Tata Liquid Fund- Regular Plan - Daily Reinvestment of IDCW Option,10.0152
2013-01-25,101737,Aditya Birla Sun Life Dividend Yield Fund -REGULAR - IDCW,13.54
2013-01-25,101738,Aditya Birla Sun Life Dividend Yield Fund - Growth - Regular Plan,94.08
2013-01-25,101746,Tata S&P BSE Sensex Index Fund -Regular Plan,48.8396
2013-01-25,101747,Tata Index Fund - Sensex B,16.1966
2013-01-25,101762,HDFC Flexi Cap Fund - Growth Plan,300.79
2013-01-25,101763,HDFC Flexi Cap Fund - IDCW Plan,46.186
2013-01-25,101764,HDFC Value Fund - Growth Plan,120.321
2013-01-25,101765,HDFC Value Fund - IDCW Plan,23.322
2013-01-25,101766,Tata Infrastructure Fund-Regular Plan- Growth Option,29.2562
2013-01-25,101815,Principal Personal Tax Saver Fund,103.07
2013-01-25,101823,Tata Large & Mid Cap Fund Regular Plan - Payout of IDCW Option,21.8582
2013-01-25,101824,Tata Large & Mid Cap Fund- Regular Plan - Growth Option,89.8156
2013-01-25,101833,Tata Ethical Fund- Regular Plan - Payout of IDCW Option,44.7862
2013-01-25,101834,UTI - Master Equity Plan Unit Scheme,55.0924
2013-01-25,101847,Tata Money Market Fund-Regular Plan - Growth Option,2132.9673
2013-01-25,101852,TATA Infrastructure Fund Regular Plan - Payout of IDCW Option,19.2834
2013-01-25,101853,Sundaram Value Fund Regular Plan - Growth,48.7422
2013-01-25,101858,Tata Liquid Retail Investment Plan - Growth,2607.6816
2013-01-25,101859,Tata Liquid High Investment Plan - Weekly,1147.261
2013-01-25,101860,Tata Liquid High Investment Plan - Growth,1897.3481
2013-01-25,101861,Tata Liquid Fund-Regular Plan  - Weekly Dividend,1001.3597
2013-01-25,101862,Nippon India Banking & Financial Services Fund-Growth Plan-Growth Option,121.1462
2013-01-25,101863,Nippon India Banking & Financial Services Fund-Growth Plan-Bonus Option,121.1463
2013-01-25,101864,Nippon India Banking & Financial Services Fund - IDCW Option,40.0006
2013-01-25,101912,BARODA  HYBRID EQUITY FUND - Plan A - Growth Option,30.82
2013-01-25,101913,BARODA HYBRID EQUITY FUND - Plan A - IDCW Option,30.82
2013-01-25,101922,CANARA ROBECO FLEXICAP FUND - REGULAR PLAN - GROWTH OPTION,64.39
2013-01-25,101923,CANARA ROBECO FLEXICAP FUND - REGULAR PLAN - IDCW (Payout/Reinvestment),28.06
2013-01-25,101924,Canara Robeco Equity Diversified-Bonus Option,28.1
2013-01-25,101977,HDFC Prudence Fund - Growth Option,242.649
2013-01-25,101978,HDFC Prudence Fund - Dividend Option,29.115
2013-01-25,101979,HDFC ELSS Tax saver - Growth Plan,247.966
2013-01-25,101980,HDFC ELSS Tax saver - IDCW Plan,56.349
2013-01-25,101982,Tata Liquid Retail Investment PLan - Daily,1116.8143
2013-01-25,101983,Tata Liquid Retail Investment Plan - Fortnightly,1147.3699
2013-01-25,101984,Tata Liquid High Investment Plan - Daily,1114.3379
2013-01-25,101985,Tata Liquid High Investment Plan - Monthly,1025.2788
2013-01-25,101986,Tata Money Market Fund- Regular Plan - Daily Reinvestment of IDCW Option,1114.52
2013-01-25,101987,Tata Liquid Fund Reglar Plan - Monthly Dividend,1005.7588
2013-01-25,102000,HDFC Large Cap Fund - Growth Option - Regular Plan,232.636
2013-01-25,102001,HDFC Large Cap Fund - IDCW Option - Regular Plan,45.661
2013-01-25,102007,UTI-  Liquid Cash Plan- Discontinued -Regular Plan Periodic Dividend Option,1152.1829
2013-01-25,102008,UTI-  Liquid Cash Plan- Discontinued - Regular Plan - Monthly Dividend Option,1126.8093
2013-01-25,102009,UTI-  Liquid Cash Plan- Discontinued - Regular Plan -Growth,1838.5986
2013-01-25,102010,UTI Liquid Fund - Regular Plan - Daily IDCW (Reinvestment),1019.4457
2013-01-25,102011,UTI Liquid Fund - Regular Plan - Monthly IDCW,1030.8295
2013-01-25,102012,UTI-  Liquid Cash Plan - Regular Plan - Growth Option,1894.7623
2013-01-25,102013,UTI Liquid Fund - Regular Plan - Weekly IDCW,1053.4744
2013-01-25,102020,Baroda BNP Paribas MULTI CAP FUND - Regular Plan - Growth Option,51.41
2013-01-25,102021,Baroda BNP Paribas MULTI CAP FUND - Regular Plan - IDCW Option,28.96
2013-01-25,102036,Tata Large Cap Fund- Regular Plan - Payout of IDCW Option,38.2529
2013-01-25,102133,ICICI Prudential Multi Sector Passive FOF - Growth,35.8398
2013-01-25,102134,ICICI Prudential Multi Sector Passive FOF - IDCW,35.8398
2013-01-25,102135,ICICI Prudential Aggressive Hybrid Active FOF - Growth,39.312
2013-01-25,102136,ICICI Prudential Aggressive Hybrid Active FOF - IDCW,39.312
2013-01-25,102137,ICICI Prudential Dynamic Asset Allocation Active FOF - Growth,29.194
2013-01-25,102138,ICICI Prudential Dynamic Asset Allocation Active FOF - IDCW,29.194
2013-01-25,102142,Sundaram Consumption Fund(Formerly Known as Sundaram Rural and Consumption Fund Regular Plan - Growth),16.8174
2013-01-25,102152,Tata Money Market Fund Regular (Bonus / Dividend),10.1552
2013-01-25,102153,Tata Money Market Fund Regular (Growth),18.263
2013-01-25,102203,DWS Investment Opportunity Fund - Dividend Option,25.92
2013-01-25,102204,DWS Investment Opportunity Fund - Growth Option,37.4
2013-01-25,102242,ING Large Cap Equity Fund-Growth Option,31.33
2013-01-25,102243,ING Large Cap Equity Fund-Dividend Option,20.88
2013-01-25,102251,HSBC Flexi Cap Fund - Regular IDCW,17.9782
2013-01-25,102252,HSBC Flexi Cap Fund - Regular Growth,38.1634
2013-01-25,102266,UTI Children's Equity Fund - Regular Plan - IDCW,17.8859
2013-01-25,102267,UTI Children's Equity Fund - Regular Plan - Growth Option,17.8859
2013-01-25,102272,SBI NIFTY INDEX FUND - REGULAR PLAN - GROWTH,51.9552
2013-01-25,102273,SBI Nifty Index Fund - Regular Plan - Income Distribution cum Capital Withdrawal Option (IDCW),26.61
2013-01-25,102315,ING Tax Savings Fund-Growth Option,31.08
2013-01-25,102316,ING Tax Savings Fund-Dividend Option,15.33
2013-01-25,102317,ING Tax Savings Fund-Bonus Option,31.13
2013-01-25,102320,Franklin India Index Fund - BSE Plan - Growth Plan,56.7514
2013-01-25,102326,Tata Mid Cap Fund-Regular Plan - IDCW Option,19.2583
2013-01-25,102328,Tata Mid Cap Fund Regular Plan- Growth Option,47.9769
2013-01-25,102329,Tata Mid Cap Growth Fund Regular Plan  - Bonus (Growth),43.6531
2013-01-25,102336,Principal Global Opportunities Fund- Income Distribution CUM Capital Withdrawal Option,21.756
2013-01-25,102337,Principal Global Opportunities Fund-Growth Option,21.756
2013-01-25,102393,UTI Mid Cap Fund - Regular Plan - IDCW,23.7794
2013-01-25,102394,UTI Mid Cap Fund-Growth Option,34.8806
2013-01-25,102395,UTI Infrastructure Fund-Growth Option,30.2152
2013-01-25,102396,UTI Infrastructure Fund - Regular Plan - IDCW,17.1747
2013-01-25,102397,UTI Transportation and Logistics Fund - Regular Plan - IDCW,16.1035
2013-01-25,102398,UTI-Transportation and Logistics  Fund-Growth Option,32.171
2013-01-25,102401,UTI Banking and Financial Services Fund - Regular Plan - Growth Option,49.3043
2013-01-25,102402,UTI Banking and Financial Services Fund - Regular Plan - IDCW,22.7177
2013-01-25,102414,SBI CONTRA FUND - REGULAR PLAN -GROWTH,60.82
2013-01-25,102428,Tata Value Fund Regular Plan - Payout of IDCW-Option B(10%),30.2427
2013-01-25,102431,Nippon India Pharma Fund-Growth Plan-Growth Option,66.557
2013-01-25,102432,Nippon India Pharma Fund-Growth Plan-Bonus Option,66.5572
2013-01-25,102433,NIPPON INDIA PHARMA FUND - IDCW Option,41.6791
2013-01-25,102434,DSP India T.I.G.E.R. Fund - Regular Plan - Growth,46.366
2013-01-25,102435,DSP India T.I.G.E.R. Fund - Regular Plan - IDCW,16.198
2013-01-25,102528,ICICI Prudential MidCap Fund - Growth,33.84
2013-01-25,102529,ICICI Prudential MidCap Fund - IDCW,14.88
2013-01-25,102530,ICICI Prudential MidCap Fund - Institutional Option - I,14.25
2013-01-25,102573,Kotak Multi Asset Omni FOF - Payout of Income Distribution cum capital withdrawal option,38.293
2013-01-25,102574,Kotak Multi Asset Omni FOF - Growth- Regular,39.339
2013-01-25,102594,ICICI Prudential Value Fund (erstwhile Value Discovery Fund) - Growth,58.12
