date,scheme_code,scheme_name,nav
2013-01-25,118668,Nippon India Growth Mid Cap Fund - Direct Plan Growth Plan - Growth Option,498.976
2013-01-25,118675,Nippon India Vision Large & Mid Cap Fund - Direct Plan Growth Plan - Bonus Option,45.6649
2013-01-25,118676,NIPPON INDIA VISION LARGE & MID CAP  FUND - DIRECT Plan - IDCW Option,38.3132
2013-01-25,118678,Nippon India Vision Large & Mid Cap Fund - Direct Plan Growth Plan - Growth Option,271.3362
2013-01-25,118692,Nippon India Focused Fund - Direct Plan Growth Plan - Growth Option,16.5754
2013-01-25,118693,NIPPON INDIA FOCUSED  FUND - DIRECT Plan - IDCW Option,13.6691
2013-01-25,118722,Nippon India Consumption Fund - Direct Plan Growth Plan - Bonus,39.357
2013-01-25,118724,Nippon India Consumption Fund - Direct Plan Growth Plan - Growth Option,39.3571
2013-01-25,118725,NIPPON INDIA CONSUMPTION FUND - DIRECT Plan - IDCW Option,22.8353
2013-01-25,118736,Nippon India Balanced Advantage Fund - Direct Plan Growth Plan - Growth Option,45.0545
2013-01-25,118737,Nippon India Balanced Advantage Fund - Direct Plan Growth Plan - Bonus Option,45.0546
2013-01-25,118738,NIPPON INDIA BALANCED ADVANTAGE FUND - DIRECT Plan - IDCW Option,22.7195
2013-01-25,118740,NIPPON INDIA INDEX FUND - NIFTY 50 PLAN - DIRECT Plan - QUARTERLY - IDCW Option,10.0392
2013-01-25,118741,Nippon India Index Fund - Nifty 50 Plan - Direct Plan Growth Plan - Growth Option,10.0392
2013-01-25,118742,Nippon India Index Fund - Nifty 50 Plan - Direct Plan Growth Plan - Bonus Option,10.0391
2013-01-25,118743,NIPPON INDIA INDEX FUND - NIFTY 50 PLAN - DIRECT Plan - ANNUAL - IDCW Option,10.0392
2013-01-25,118745,NIPPON INDIA INDEX FUND - NIFTY 50 PLAN - DIRECT Plan - HALF YEARLY - IDCW Option,10.0391
2013-01-25,118752,Reliance Natural Resources Fund - Direct Plan Dividend Plan - Dividend Payout Option,10.4442
2013-01-25,118753,Reliance Natural Resources Fund - Direct Plan Growth Plan - Growth Option - Growth,10.4436
2013-01-25,118755,Reliance Natural Resources Fund - Direct Plan Bonus Plan - Bonus,10.4444
2013-01-25,118756,NIPPON INDIA PHARMA FUND - DIRECT Plan - IDCW Option,45.0618
2013-01-25,118758,Nippon India Pharma Fund - Direct Plan Growth Plan - Bonus Option,66.6134
2013-01-25,118759,Nippon India Pharma Fund - Direct Plan Growth Plan - Growth Option,66.6105
2013-01-25,118760,NIPPON INDIA POWER & INFRA FUND - DIRECT Plan - IDCW Option,32.781
2013-01-25,118762,Nippon India Power & Infra Fund - Direct Plan Growth Plan - Bonus Option,57.6919
2013-01-25,118763,Nippon India Power & Infra Fund - Direct Plan Growth Plan - Growth Option,57.6789
2013-01-25,118767,NIPPON INDIA QUANT FUND - DIRECT Plan - IDCW Option,12.0092
2013-01-25,118769,Nippon India Quant Fund - Direct Plan Growth Plan - Growth Option,14.6868
2013-01-25,118770,Nippon India Quant Fund - Direct Plan Growth Plan - Bonus Option,14.6869
2013-01-25,118771,Reliance Infrastructure Fund - Direct Plan Dividend Plan - Dividend Payout Option,7.0672
2013-01-25,118773,Reliance Infrastructure Fund - Direct Plan Growth Plan - Growth,7.064
2013-01-25,118774,Reliance Infrastructure Fund - Direct Plan Growth Plan - Bonus Option - Bonus,7.0664
2013-01-25,118775,NIPPON INDIA SMALL CAP FUND - Direct Plan - IDCW Option,10.3742
2013-01-25,118777,Nippon India Small Cap Fund - Direct Plan Growth Plan - Bonus Option,10.3759
2013-01-25,118778,Nippon India Small Cap Fund - Direct Plan Growth Plan - Growth Option,10.3737
2013-01-25,118782,NIPPON INDIA VALUE FUND - DIRECT Plan - IDCW Option,21.9713
2013-01-25,118784,Nippon India Value Fund - Direct Plan Growth Plan,33.611
2013-01-25,118785,Nippon India Index Fund - BSE Sensex Plan - Direct Plan Growth Plan - Bonus Option,9.8438
2013-01-25,118786,NIPPON INDIA INDEX FUND - BSE SENSEX PLAN - DIRECT Plan - ANNUAL - IDCW Option,9.8438
2013-01-25,118788,NIPPON INDIA INDEX FUND - BSE SENSEX PLAN - DIRECT Plan - HALF YEARLY - IDCW Option,9.8437
2013-01-25,118790,NIPPON INDIA INDEX FUND - BSE SENSEX PLAN - DIRECT Plan - QUARTERLY - IDCW Option,9.8438
2013-01-25,118791,Nippon India Index Fund - BSE Sensex Plan - Direct Plan Growth Plan - Growth Option,9.8438
2013-01-25,118793,NIPPON INDIA AGGRESSIVE HYBRID FUND - DIRECT Plan - IDCW Option,14.5292
2013-01-25,118794,Nippon India Aggressive Hybrid Fund  - Direct Plan Growth Plan,25.8554
2013-01-25,118801,NIPPON INDIA ELSS TAX SAVER FUND - DIRECT Plan - IDCW Option,15.3088
2013-01-25,118803,Nippon India ELSS Tax Saver Fund - Direct Plan Growth Plan - Growth Option,24.1696
2013-01-25,118825,Mirae Asset Large Cap Fund - Direct Plan - Growth,19.098
2013-01-25,118826,Mirae Asset Large Cap Fund Direct IDCW,14.221
2013-01-25,118828,Mirae Asset Global Commodity Stocks - Direct Plan - Growth,12.647
2013-01-25,118829,Mirae Asset Global Commodity Stocks - Direct Plan - Dividend,12.647
2013-01-25,118831,Mirae Asset China Advantage Fund - Direct Plan - Growth,11.848
2013-01-25,118832,Mirae Asset China Advantage Fund - Direct Plan - Dividend,11.848
2013-01-25,118834,Mirae Asset Large & Midcap Fund - Direct Plan - Growth,13.882
2013-01-25,118835,Mirae Asset Large & Midcap Fund - Direct Plan - IDCW,12.688
2013-01-25,118837,Mirae Asset Great Consumer Fund - Direct Plan - Growth,13.39
2013-01-25,118838,Mirae Asset Great Consumer Fund Direct IDCW,13.39
2013-01-25,118866,Taurus ELSS Tax Saver Fund - Direct Plan - Growth,39.24
2013-01-25,118867,Taurus ELSS Tax Saver Fund - Direct Plan - Payout of Income Distribution cum Capital Withdrawal option,18.11
2013-01-25,118868,Taurus Banking & Financial Services Fund - Direct Plan - Growth,13.62
2013-01-25,118869,Taurus Banking & Financial Services Fund - Direct Plan - Payout of Income Distribution cum Capital Withdrawal option,13.63
2013-01-25,118870,Taurus Large Cap Fund - Direct Plan - Growth,45.09
2013-01-25,118871,Taurus Large Cap Fund - Direct Plan - Payout of Income Distribution cum Capital Withdrawal option,45.09
2013-01-25,118872,Taurus Mid Cap Fund - Direct Plan - Growth,17.52
2013-01-25,118873,Taurus Mid Cap Fund - Direct Plan - Payout of Income Distribution cum Capital Withdrawal option,17.52
2013-01-25,118876,Taurus Ethical Fund - Direct Plan - Growth,23.84
2013-01-25,118877,Taurus Ethical Fund - Direct Plan - Payout of Income Distribution cum Capital Withdrawal option,16.11
2013-01-25,118879,Taurus Infrastructure Fund - Direct Plan - Growth,12.84
2013-01-25,118880,Taurus Infrastructure Fund - Direct Plan - Payout of Income Distribution cum Capital Withdrawal option,12.08
2013-01-25,118881,Taurus Nifty 50 Index Fund - Direct Plan - Growth,11.3738
2013-01-25,118882,Taurus Nifty 50 Index Fund - Direct Plan - Payout of Income Distribution cum Capital Withdrawal option,11.3738
2013-01-25,118883,Taurus Flexi Cap Fund - Direct Plan - Growth,64.37
2013-01-25,118884,Taurus Flexi Cap Fund - Direct Plan -  Payout of Income Distribution cum Capital Withdrawal option,45.32
2013-01-25,118891,Taurus Liquid Fund-Direct Plan-SI Daily Dividend Option,1000.0905
2013-01-25,118892,Taurus Liquid Fund-Direct Plan-SI Weekly Dividend Option,1000.2361
2013-01-25,118893,Taurus Liquid Fund-Direct Plan-SI Growth Option,1246.2683
2013-01-25,118926,HDFC Focused Large-Cap Fund -Direct Plan - Dividend Option,12.376
2013-01-25,118927,HDFC Focused Large-Cap Fund -Direct Plan - Growth Option,17.657
2013-01-25,118928,HDFC Long Term Advantage Plan - IDCW Option - Direct Plan,35.218
2013-01-25,118929,HDFC Long Term Advantage Plan - Growth Option - Direct Plan,152.229
2013-01-25,118930,HDFC ARBITRAGE FUND - Quarterly IDCW Option - Direct Plan,10.916
2013-01-25,118931,HDFC ARBITRAGE FUND - Growth Option - Direct Plan,14.418
2013-01-25,118932,HDFC Balanced Fund -Direct Plan - Dividend Option,20.163
2013-01-25,118933,HDFC Balanced Fund -Direct Plan - Growth Option,64.58
2013-01-25,118934,HDFC Value Fund - IDCW Option - Direct Plan,23.329
2013-01-25,118935,HDFC Value Fund - Growth Option - Direct Plan,120.363
2013-01-25,118936,DWS Alpha Equity Fund - Direct Plan - Growth,79.87
2013-01-25,118937,DWS Alpha Equity Fund - Direct Plan - Dividend,17.37
2013-01-25,118939,DWS Investment Opportunity Fund - Direct Plan - Growth,37.43
2013-01-25,118940,DWS Investment Opportunity Fund - Direct Plan - Dividend,25.94
2013-01-25,118946,DWS Tax Saving Fund - Direct Plan - Growth,13.7844
2013-01-25,118947,DWS Tax Saving Fund - Direct Plan - Dividend,12.8646
2013-01-25,118949,HDFC Focused Fund - IDCW Option - Direct Plan,18.585
2013-01-25,118950,HDFC Focused Fund - Growth Option - Direct Plan,39.988
2013-01-25,118951,DWS Top Euroland Offshore Fund - Direct Plan - Growth,10.24
2013-01-25,118954,HDFC Flexi Cap Fund - IDCW Option - Direct Plan,46.207
2013-01-25,118955,HDFC Flexi Cap Fund - Growth Option - Direct Plan,300.922
2013-01-25,118957,DWS Global Agribusiness Offshore Fund - Direct Plan - Dividend,14.91
2013-01-25,118958,DWS Global Agribusiness Offshore Fund - Direct Plan - Growth,14.92
2013-01-25,118968,HDFC Balanced Advantage Fund - Growth Plan - Direct Plan,97.009
2013-01-25,118969,HDFC Balanced Advantage Fund - IDCW Plan - Direct Plan,30.996
2013-01-25,118978,HDFC Infrastructure Fund - IDCW Option - Direct Plan,10.99
2013-01-25,118979,HDFC Infrastructure Fund - Growth Option - Direct Plan,10.99
2013-01-25,118988,HDFC Mid Cap Fund - IDCW Option - Direct Plan,16.85
2013-01-25,118989,HDFC Mid Cap Fund - Growth Option - Direct Plan,18.591
2013-01-25,118990,HDFC Prudence Fund -Direct Plan - Dividend Option,29.127
2013-01-25,118991,HDFC Prudence Fund -Direct Plan - Growth Option,242.746
2013-01-25,119017,HDFC Large Cap Fund - IDCW Option - Direct Plan,45.68
2013-01-25,119018,HDFC Large Cap Fund - Growth Option - Direct Plan,232.733
2013-01-25,119019,DSP Aggressive Hybrid Fund - Direct Plan - Growth,72.364
2013-01-25,119020,DSP Aggressive Hybrid Fund - Direct Plan - IDCW,22.175
2013-01-25,119028,DSP Natural Resources and New Energy Fund - Direct Plan - Growth,13.22
2013-01-25,119029,DSP Natural Resources and New Energy Fund - Direct Plan - IDCW,10.806
2013-01-25,119053,Tata Aggressive Hybrid Fund -Direct Plan- Growth Option,98.7328
2013-01-25,119057,Tata Aggressive Hybrid Fund- Direct Plan - Monthly Payout of IDCW Option,47.4997
2013-01-25,119058,Tata Aggressive Hybrid Fund- Direct Plan - Periodic Payout of IDCW Option,59.0769
2013-01-25,119059,HDFC ELSS Tax saver - IDCW Option - Direct Plan,56.375
2013-01-25,119060,HDFC ELSS Tax saver - Growth Option - Direct Plan,248.082
2013-01-25,119061,HDFC Hybrid Equity Fund - IDCW Option - Direct Plan,13.329
2013-01-25,119062,HDFC Hybrid Equity Fund - Growth Option - Direct Plan,29.221
2013-01-25,119063,HDFC Nifty 50 Index Fund - Direct Plan,52.4268
2013-01-25,119064,HDFC Index Fund Sensex Plus Plan-Direct Plan,256.0816
2013-01-25,119065,HDFC BSE Sensex Index Fund - Direct Plan,167.9549
2013-01-25,119066,HDFC Childrens Fund - Direct Plan,50.594
2013-01-25,119067,HDFC Childrens Fund Savings Plan-Direct Plan,26.6654
2013-01-25,119070,DSP Midcap Fund - Direct Plan - IDCW,15.319
2013-01-25,119071,DSP Midcap Fund - Direct Plan - Growth,19.653
2013-01-25,119076,DSP Flexi Cap Fund - Direct Plan - Growth,17.809
2013-01-25,119077,DSP Flexi Cap Fund - Direct Plan - IDCW,50.565
2013-01-25,119095,DSP Focused Fund - Direct Plan - IDCW,11.158
2013-01-25,119096,DSP Focused Fund - Direct Plan - Growth,11.158
2013-01-25,119102,Tata Corporate Bond Fund- Direct Plan-Daily Dividend,1009.4394
2013-01-25,119132,HDFC Gold ETF Fund of Fund - Direct Plan,10.956
2013-01-25,119133,Groww Largecap Fund (formerly known as Indiabulls Blue Chip Fund) - Direct Plan - Growth Option,10.94
2013-01-25,119134,Groww Largecap Fund (formerly known as Indiabulls Bluechip Fund)- Direct Plan- - Income Distribution cum capital withdrawal Option (Payout & Reinvestment),10.94
2013-01-25,119140,Morgan Stanley Growth Fund - Direct Growth Plan,66.876
2013-01-25,119141,Morgan Stanley Growth Fund -  Direct Dividend Plan,20.414
2013-01-25,119148,Navi Large Cap Equity Fund-Direct Plan-Growth Option,11.8084
2013-01-25,119149,Navi Large Cap Equity Fund - Direct Plan Normal IDCW Payout,11.8016
2013-01-25,119150,Morgan Stanley A.C.E. Fund-Direct Growth Plan,16.058
2013-01-25,119154,Morgan Stanley A.C.E. Fund-Direct Dividend Plan,15.117
2013-01-25,119159,Tata Large Cap Fund- Direct Plan - Payout of IDCW Option,38.2635
2013-01-25,119160,Tata Large Cap Fund -Direct Plan Growth Option,109.4087
2013-01-25,119171,Tata Ethical Fund- Direct Plan - Payout of IDCW Option,44.7938
2013-01-25,119172,Tata Ethical Fund -Direct Plan- Growth Option,74.6495
2013-01-25,119177,Tata Mid Cap Fund - Direct Plan- IDCW Option,19.2665
2013-01-25,119178,Tata Mid Cap Fund - Direct Plan- Growth Option,47.9895
2013-01-25,119189,Tata Equity Management Fund - Direct Plan Growth,16.883
2013-01-25,119190,Tata Equity Management Fund - Direct Plan Dividend,14.59
2013-01-25,119193,Daiwa Industry Leaders Fund - Direct - Dividend,13.01
2013-01-25,119194,Daiwa Industry Leaders Fund - Direct - Growth,13.01
2013-01-25,119201,Tata Large & Mid Cap Fund Direct Plan - Payout of IDCW Option,21.8658
2013-01-25,119202,Tata Large & MId Cap Fund -Direct Plan- Growth Option,89.8603
2013-01-25,119212,DSP Small Cap Fund - Direct Plan - Growth,17.244
2013-01-25,119213,DSP Small Cap Fund - Direct Plan - IDCW,10.473
2013-01-25,119218,DSP Large & Mid Cap Fund - Direct Plan - Growth,91.921
2013-01-25,119219,DSP Large & Mid Cap Fund - Direct Plan - IDCW,26.692
2013-01-25,119231,Tata Value Fund -Direct Plan Growth Option,51.0404
2013-01-25,119232,Tata Value Fund- Direct Plan -Payout of IDCW-Option A(5%),29.4347
2013-01-25,119233,Tata Value Fund- Direct Plan - Payout of IDCW -Option B(10%),30.2495
2013-01-25,119234,Tata Dividend Yield Fund-Direct Plan Growth,37.8529
2013-01-25,119235,Tata Dividend Yield Fund-Direct Plan Dividend,19.5118
2013-01-25,119241,DSP ELSS Tax Saver Fund - Direct Plan - IDCW,13.629
2013-01-25,119242,DSP ELSS Tax Saver Fund - Direct Plan - Growth,19.089
2013-01-25,119243,Tata Infrastructure Fund -Direct Plan -Growth Option,29.2535
2013-01-25,119244,Tata Infrastructure Fund- Direct Plan - Payout of IDCW Option,19.2661
2013-01-25,119245,DSP BlackRock Technology.com Fund - Direct Plan - Growth,32.282
2013-01-25,119246,DSP BlackRock Technology.com Fund - Direct Plan - Dividend,23.114
2013-01-25,119247,DSP India T.I.G.E.R. Fund - Direct Plan - Growth,46.381
2013-01-25,119248,DSP India T.I.G.E.R. Fund - Direct Plan - IDCW,16.692
2013-01-25,119249,DSP Large Cap Fund - Direct Plan - IDCW,22.133
2013-01-25,119250,DSP Large Cap Fund - Direct Plan - Growth,112.562
2013-01-25,119251,Tata Retirement Savings Fund- Progressive Plan -Direct Plan-Growth Option,12.2075
2013-01-25,119255,Tata Retirement Savings Fund- Moderate Plan -Direct Plan-Growth Option,12.0811
2013-01-25,119258,Tata Indo-Global Infrastructure Fund-Direct Plan Dividend,7.3406
2013-01-25,119259,Tata Indo-Global Infrastructure Fund-Direct Plan Growth,7.334
2013-01-25,119269,Tata Growing Economies Infrastructure Fund Scheme A-Direct Plan Growth,13.1547
2013-01-25,119273,Tata Growing Economies Infrastructure Fund Scheme B-Direct Plan Growth,11.4558
2013-01-25,119281,Tata ELSS Fund- Direct Plan - Payout of IDCW Option,45.5299
2013-01-25,119287,Tata S&P BSE Sensex Index Fund - Direct Plan,48.8591
2013-01-25,119288,Tata Nifty 50 Index Fund -Direct Plan,37.4053
2013-01-25,119290,L&T Flexicap Fund-Direct Plan-IDCW,21.569
2013-01-25,119291,L&T Flexicap Fund-Direct Plan-Growth,38.496
2013-01-25,119292,Union Flexi Cap Fund - Direct Plan - Growth Option,11.02
2013-01-25,119293,Union Flexi Cap Fund - Direct Plan - IDCW Option,11.02
2013-01-25,119294,Franklin India Conservative Hybrid Fund - Direct - Bonus,11.4184
2013-01-25,119306,Union ELSS Tax Saver Fund - Direct Plan - IDCW Option,13.38
2013-01-25,119307,Union ELSS Tax Saver Fund - Direct Plan - Growth Option,13.38
2013-01-25,119308,L&T India Large Cap Fund - Direct Plan - Growth,13.159
2013-01-25,119312,Tata Childrens Fund-Direct Plan-Growth Option,14.9055
2013-01-25,119314,L&T India Large Cap Fund - Direct Plan- IDCW,13.159
2013-01-25,119323,Tata Contra Fund -Direct Plan Growth,19.648
2013-01-25,119324,Tata Contra Fund -Direct Plan Dividend,16.1998
2013-01-25,119325,BARODA HYBRID EQUITY FUND - Plan B (Direct) - IDCW Option,30.82
2013-01-25,119326,BARODA HYBRID EQUITY FUND - Plan B (Direct) - Growth Option,30.82
2013-01-25,119331,PineBridge India Equity Fund- Direct Plan- Growth Option,13.305
2013-01-25,119332,PineBridge India Equity Fund- Direct Plan- Dividend Option,13.305
2013-01-25,119333,Baroda BNP Paribas Banking and Financial Services Fund - Direct - Growth Option,12.09
2013-01-25,119334,Baroda BNP Paribas Banking and Financial Services Fund - Direct - IDCW Option,12.09
2013-01-25,119339,BARODA ELSS 96 - Plan B (Direct) - IDCW,24.96
2013-01-25,119342,PineBridge Infrastructure & Economic Reform Fund- Direct Plan- Dividend Option,8.662
2013-01-25,119343,PineBridge Infrastructure & Economic Reform Fund- Direct Plan- Growth Option,8.662
2013-01-25,119344,PineBridge World Gold Fund- Direct Plan- Growth Option,12.799
2013-01-25,119345,PineBridge World Gold Fund- Direct Plan- Dividend Option,10.61
2013-01-25,119346,BANK OF INDIA Large & Mid Cap Fund Direct Plan-Regular IDCW,12.97
2013-01-25,119349,BANK OF INDIA Large & Mid Cap Fund Direct  Plan- Quarterly IDCW,11.68
2013-01-25,119350,BANK OF INDIA Large & Mid Cap Fund Direct Plan-Growth,18.37
2013-01-25,119351,BANK OF INDIA ELSS Tax Saver -Direct Plan- Growth,23.29
2013-01-25,119352,BANK OF INDIA ELSS Tax Saver -Direct Plan-IDCW,12.66
2013-01-25,119353,Baroda BNP Paribas MULTI CAP FUND - Direct Plan - IDCW Option,28.92
2013-01-25,119354,Baroda BNP Paribas MULTI CAP FUND - Direct Plan - Growth Option,51.66
2013-01-25,119355,PineBridge India Liquid Fund- Direct Plan- Daily Dividend Option,1001.0
2013-01-25,119356,PineBridge India Liquid Fund- Direct Plan- Bonus Option,1018.4915
2013-01-25,119357,PineBridge India Liquid Fund- Direct Plan- Quarterly Dividend Option,1006.3439
2013-01-25,119358,PineBridge India Liquid Fund- Direct Plan- Weekly Dividend Option,1003.1521
2013-01-25,119359,PineBridge India Liquid Fund- Direct Plan- Monthly Dividend Option,1007.3612
2013-01-25,119360,PineBridge India Liquid Fund- Direct Plan- Growth Option,1464.8082
2013-01-25,119363,BANK OF INDIA Manufacturing & Infrastructure Fund-Direct Plan-Regular IDCW,8.34
2013-01-25,119364,BANK OF INDIA Manufacturing & Infrastructure Fund-Direct Plan-Growth,8.35
2013-01-25,119366,Baroda Large cap Fund - Plan B (Direct) - IDCW Option,8.06
2013-01-25,119367,Baroda Large cap Fund - Plan B (Direct) - Growth Option,8.06
2013-01-25,119371,IIFL Dividend Opportunities Index Fund- Direct Plan - Dividend,11.6655
2013-01-25,119372,IIFL Dividend Opportunities Index Fund-Direct Plan - Growth,11.6655
2013-01-25,119392,Baroda Mid-cap Fund- Plan B (Direct) - Growth Option,7.67
2013-01-25,119397,L&T Large and Midcap Fund-Direct Plan-Growth,21.87
2013-01-25,119398,L&T Large and Midcap Fund- Direct Plan -IDCW,19.829
2013-01-25,119403,L&T India Value Fund-Direct Plan-IDCW,12.514
2013-01-25,119404,L&T India Value Fund-Direct Plan-Growth,12.514
2013-01-25,119407,L&T Indo Asia Fund-Direct Plan-Growth Option,15.208
2013-01-25,119408,L&T Indo Asia Fund-Direct Plan-Dividend Option,15.208
2013-01-25,119412,L&T Infrastructure Fund-Direct Plan-IDCW,6.58
2013-01-25,119413,L&T Infrastructure Fund -Direct Plan-Growth,6.58
2013-01-25,119417,L&T  Tax Advantage Fund-Direct Plan-Growth,23.876
2013-01-25,119418,L&T Tax Advantage Fund-Direct Plan-IDCW,18.693
2013-01-25,119421,Tata Money Market Fund- Direct Plan - Daily Reinvestment of IDCW Option,1114.52
2013-01-25,119422,Tata Liquid Fund- Direct Plan- Weekly Dividend,1001.3668
2013-01-25,119423,Tata Liquid Fund- Direct Plan- Monthly Dividend,1005.7877
2013-01-25,119424,Tata Money Market Fund- Direct Plan- Growth Option,2133.0827
2013-01-25,119433,Aditya Birla Sun Life Large & Mid Cap Fund -Direct - IDCW,77.69
2013-01-25,119434,Principal Retail Equity Savings Fund - Direct Plan - Growth Option,89.96
2013-01-25,119435,Principal Retail Equity Savings Fund - Direct Plan - Dividend Option,10.33
2013-01-25,119436,Aditya Birla Sun Life Large & Mid Cap Fund - Growth - Direct Plan,161.34
2013-01-25,119437,Principal Dividend Yield Fund- Direct Plan - Half Yearly Income Distribution CUM Capital Withdrawal Option,19.41
2013-01-25,119438,Principal Dividend Yield Fund - Direct Plan - Growth Option,26.29
2013-01-25,119440,Principal Emerging Bluechip Fund - Direct Plan - Half Yearly Income Distribution CUM Capital Withdrawal Option,25.95
2013-01-25,119441,Principal Emerging Bluechip Fund - Direct Plan - Growth Option,34.08
2013-01-25,119442,Tata Liquidity Management Fund- Direct Plan-Weekly Dividend,1006.2171
2013-01-25,119444,Tata Liquidity Management Fund- Direct Plan-Growth,1561.8417
2013-01-25,119451,Principal Multi Cap Growth Fund - Direct Plan -Half Yearly Income Distribution CUM Capital Withdrawal Option,26.39
2013-01-25,119452,Principal Multi Cap Growth Fund-Direct Plan - Growth Option,58.23
2013-01-25,119457,Principal Global Opportunities Fund-Direct Plan - Growth Option,21.7615
2013-01-25,119458,Principal Global Opportunities Fund- Direct Plan - Income Distribution CUM Capital Withdrawal Option,21.7615
2013-01-25,119464,Principal Focused Multicap Fund- Direct Plan - Growth Option,31.4
2013-01-25,119465,Principal Focused Multicap Fund- Direct Plan - Half Yearly Income Distribution CUM Capital Withdrawal Option,21.51
2013-01-25,119482,Principal Balanced Advantage Fund - Direct Plan - Growth Option,11.7
2013-01-25,119483,Principal Balanced Advantage Fund - Direct Plan - Monthly Income Distribution CUM Capital Withdrawal Option,11.7
2013-01-25,119484,Principal Hybrid Equity Fund- Direct Plan - Growth Option,34.53
2013-01-25,119485,Principal Hybrid Equity Fund-Direct Plan - Monthly Income Distribution CUM Capital Withdrawal Option,17.47
2013-01-25,119486,Principal Personal Tax Saver Fund - Direct Plan,103.1
2013-01-25,119487,Principal Nifty 100 Equal Weight Fund- Direct Plan - Income Distribution CUM Capital Withdrawal Option,24.3575
2013-01-25,119488,Principal Nifty 100 Equal Weight Fund - Direct Plan - Growth Option,41.444
2013-01-25,119489,Principal Tax Savings Fund - Direct Plan,85.75
2013-01-25,119506,Aditya Birla Sun Life Dividend Yield Fund -DIRECT - IDCW,13.54
2013-01-25,119507,Aditya Birla Sun Life Dividend Yield Fund - Growth - Direct Plan,94.12
2013-01-25,119514,Aditya Birla Sun Life Infrastructure Fund - Growth - Direct Plan,16.06
2013-01-25,119515,Aditya Birla Sun Life Infrastructure Fund -  Direct - IDCW,11.06
2013-01-25,119516,Aditya Birla Sun Life International Equity Fund - Direct - IDCW,12.1597
2013-01-25,119517,Aditya Birla Sun Life International Equity Fund - Growth - Direct Plan,12.1597
2013-01-25,119518,Aditya Birla Sun Life International Equity Fund - Plan B - Growth - Direct Plan,10.2951
2013-01-25,119519,Aditya Birla Sun Life International Equity Fund - Plan B - Direct - IDCW,10.2951
2013-01-25,119520,Aditya Birla Sun Life Long Term Advantage - Growth - Direct Plan,15.62
2013-01-25,119526,Aditya Birla Sun Life Arbitrage Fund - Growth - Direct Plan,12.3525
2013-01-25,119527,Aditya Birla Sun Life Large Cap Fund-DIRECT - IDCW,22.67
2013-01-25,119528,Aditya Birla Sun Life Large Cap Fund - Growth - Direct Plan,101.64
2013-01-25,119536,Aditya Birla Sun Life India Reforms Fund - Growth - Direct Plan,9.87
2013-01-25,119537,Aditya Birla Sun Life India Reforms Fund - Dividend - Direct Plan,9.87
2013-01-25,119542,Sundaram Equity Hybrid Fund Direct Plan - Growth,50.9539
2013-01-25,119543,Aditya Birla Sun Life ELSS Tax Saver Fund-DIRECT - IDCW,81.83
2013-01-25,119544,Aditya Birla Sun Life ELSS Tax Saver Fund - Growth - Direct Plan,11.86
2013-01-25,119545,Sundaram Equity Hybrid Fund Direct Plan - Income Distribution cum Capital Withdrawal (IDCW),11.3133
2013-01-25,119546,Aditya Birla Sun Life Special Situations Fund - Growth - Direct Plan,10.1679
2013-01-25,119547,Aditya Birla Sun Life Special Situations Fund - Dividend - Direct Plan,10.1679
2013-01-25,119548,Sundaram Value Fund Direct Plan - Income Distribution cum Capital Withdrawal (IDCW),11.4967
2013-01-25,119549,Sundaram Value Fund Direct Plan - Growth,48.7753
2013-01-25,119554,Sundaram Select Thematic Funds Capex Opportunities - Direct Plan - Dividend Option,9.0447
2013-01-25,119555,Sundaram Select Thematic Funds Capex Opportunities -Direct Plan - Growth Option,17.4857
2013-01-25,119556,Aditya Birla Sun Life Small Cap Fund - Growth - Direct Plan,13.0357
2013-01-25,119557,Aditya Birla Sun Life Small Cap Fund -Direct - IDCW,12.6357
2013-01-25,119558,Sundaram Select Thematic Funds Energy Opportunities - Direct Plan - Dividend Option,7.4698
2013-01-25,119559,Sundaram Select Thematic Funds Energy Opportunities -Direct Plan - Growth Option,7.4713
2013-01-25,119563,Aditya Birla Sun Life Focused Fund -Direct - IDCW,15.0152
2013-01-25,119564,Aditya Birla Sun Life Focused Fund - Growth - Direct Plan,26.3616
2013-01-25,119565,Sundaram Large and Midcap Direct Plan - Income Distribution cum Capital Withdrawal (IDCW),12.1007
2013-01-25,119566,Sundaram Large and Midcap Fund Direct Plan - Growth,14.8818
2013-01-25,119572,Sundaram Multi Asset Fund Direct Growth,11.3251
2013-01-25,119573,Sundaram Multi Asset Fund Direct Dividend,11.3247
2013-01-25,119574,SBI Arbitrage Opportunities Fund - Direct Plan - Gr,15.7637
2013-01-25,119575,Aditya Birla Sun Life Commodity Equities Fund - Global Agri Plan -Direct - IDCW,17.2977
2013-01-25,119576,Aditya Birla Sun Life Commodity Equities Fund - Global Agri Plan - Growth - Direct Plan,18.475
2013-01-25,119577,Sundaram Select Focus Direct Plan - Income Distribution cum Capital Withdrawal (IDCW),9.8446
2013-01-25,119578,Sundaram Select Focus Direct Plan - Growth,90.9979
2013-01-25,119579,Birla Sun Life Commodities Equities Fund Global Multi Commodity Plan - Dividend - Direct Plan,13.3648
2013-01-25,119580,Birla Sun Life Commodities Equities Fund Global Multi Commodity Plan - Growth - Direct Plan,14.2159
