date,scheme_code,scheme_name,nav
2022-05-16,100033,Aditya Birla Sun Life Large & Mid Cap Fund - Regular Growth,556.16
2022-05-16,100034,Aditya Birla Sun Life Large & Mid Cap Fund -Regular - IDCW,105.93
2022-05-16,100041,Aditya Birla Sun Life Liquid Fund -Institutional - IDCW,108.023
2022-05-16,100042,Aditya Birla Sun Life Liquid Fund-Retail (Growth),554.6238
2022-05-16,100043,Aditya Birla Sun Life Liquid Fund-Institutional (Growth),569.1588
2022-05-16,100044,Aditya Birla Sun Life Liquid Fund -Retail - IDCW,163.694
2022-05-16,100046,Aditya Birla Sun Life Liquid Fund -Daily IDCW,100.195
2022-05-16,100047,Aditya Birla Sun Life Liquid Fund - Growth,341.7725
2022-05-16,100048,Aditya Birla Sun Life Liquid Fund -Institutional - weekly  IDCW,108.1079
2022-05-16,100051,Aditya Birla Sun Life Liquid Fund -weekly IDCW,100.262
2022-05-16,100063,Aditya Birla Sun Life MNC Fund - Regular - IDCW,150.47
2022-05-16,100064,Aditya Birla Sun Life MNC Fund - Growth - Regular Plan,871.23
2022-05-16,100067,Aditya Birla Sun Life Tax Plan -Regular - IDCW,83.97
2022-05-16,100080,DSP Flexi Cap Fund - Regular Plan - IDCW,45.013
2022-05-16,100081,DSP Aggressive Hybrid Fund- Regular Plan - Growth,209.607
2022-05-16,100082,DSP Aggressive Hybrid Fund- Regular Plan - IDCW,23.386
2022-05-16,100119,HDFC Balanced Advantage Fund - Growth Plan,276.857
2022-05-16,100120,HDFC Balanced Advantage Fund - IDCW Plan,27.634
2022-05-16,100174,quant ELSS Tax Saver Fund - IDCW Option - Regular Plan,28.7046
2022-05-16,100175,quant ELSS Tax Saver Fund - Growth Option - Regular Plan,206.8965
2022-05-16,100176,quant Small Cap Fund - IDCW Option - Regular Plan,92.8804
2022-05-16,100177,quant Small Cap Fund - Growth - Regular Plan,116.8483
2022-05-16,100218,JM Large Cap Fund (Regular) - IDCW,17.264
2022-05-16,100219,JM Large Cap Fund (Regular) - Growth Option,88.9306
2022-05-16,100220,JM Aggressive Hybrid Fund (Regular) - IDCW,17.4158
2022-05-16,100221,JM Aggressive Hybrid Fund (Regular) -Growth Option,62.2664
2022-05-16,100233,JM Liquid Fund (Regular) - Weekly IDCW,11.011
2022-05-16,100234,JM Liquid Fund - Growth Option,58.0284
2022-05-16,100244,JM Liquid Fund (Regular) - Quarterly IDCW,32.8445
2022-05-16,100247,JM Liquid Fund (Regular) - Super Institutional Plan - Growth Option,33.3626
2022-05-16,100254,JM Value Fund (Regular) - Growth Option,45.6256
2022-05-16,100286,Kotak Aggressive Hybrid Fund - Regular Plan - IDCW - Payout & Reinvestment of Income Distribution cum capital withdrawal option,22.024
2022-05-16,100312,LIC MF Flexi Cap Fund-Regular Plan-IDCW,19.3988
2022-05-16,100313,LIC MF Flexi Cap Fund-Regular Plan-Growth,59.2733
2022-05-16,100321,LIC MF Aggressive Hybrid Fund-Regular Plan-IDCW,13.3217
2022-05-16,100323,LIC MF Aggressive Hybrid Fund-Regular Plan-Growth,125.036
2022-05-16,100325,LIC MF ULIS (5 Yrs. Single Premium)-Regular Plan-IDCW Reinvestment,24.8474
2022-05-16,100332,LIC MF Large Cap Fund-Regular Plan-IDCW,21.7632
2022-05-16,100348,ICICI Prudential Large & Mid Cap Fund - IDCW,21.03
2022-05-16,100349,ICICI Prudential Large & Mid Cap Fund - Growth,500.25
2022-05-16,100351,ICICI Prudential FMCG Fund - IDCW,78.36
2022-05-16,100352,ICICI Prudential FMCG Fund - Growth,328.22
2022-05-16,100353,ICICI Prudential ELSS Tax Saver Fund - IDCW,20.49
2022-05-16,100354,ICICI Prudential ELSS Tax Saver Fund - Growth,535.49
2022-05-16,100355,ICICI Prudential Equity & Debt Fund - Monthly IDCW,28.45
2022-05-16,100356,ICICI Prudential Equity & Debt Fund - Growth,215.21
2022-05-16,100357,ICICI Prudential Liquid Fund -Quarterly IDCW,100.7864
2022-05-16,100363,ICICI Prudential Technology Fund - Growth,135.05
2022-05-16,100375,NIPPON INDIA GROWTH MID CAP FUND - IDCW Option,69.3117
2022-05-16,100376,Nippon India Growth Mid Cap Fund-Growth Plan-Bonus Option,312.1665
2022-05-16,100377,Nippon India Growth Mid Cap Fund-Growth Plan-Growth Option,1875.2353
2022-05-16,100378,Nippon India Vision Large & Midcap Fund - IDCW Option,41.5661
2022-05-16,100379,Nippon India Vision Large & Midcap Fund-GROWTH PLAN-Bonus Option,124.6634
2022-05-16,100380,Nippon India Vision Large & Midcap Fund-GROWTH PLAN-Growth Option,740.1696
2022-05-16,100414,Tata Aggressive Hybrid Fund- Regular Plan - Growth Option,280.9551
2022-05-16,100415,Tata Ethical Fund-Regular Plan - Growth Option,258.8724
2022-05-16,100470,Franklin India Large Cap Fund - IDCW,38.6186
2022-05-16,100471,Franklin India Large Cap Fund-Growth,626.5311
2022-05-16,100472,Franklin India Mid Cap Fund - IDCW,62.4611
2022-05-16,100473,Franklin India Mid Cap Fund-Growth,1296.3684
2022-05-16,100474,Tata ELSS Fund- Regular Plan - Payout of IDCW Option,69.2969
2022-05-16,100475,Tata Large Cap Fund -Regular Plan - Growth Option,301.4226
2022-05-16,100476,Taurus Flexi Cap Fund - Regular Plan - Growth,138.33
2022-05-16,100477,Taurus Mid Cap Fund - Regular Plan - Growth,66.58
2022-05-16,100480,Taurus ELSS Tax Saver Fund - Regular Plan - Growth,104.0
2022-05-16,100484,Franklin India Index Fund- NSE Nifty 50 Index Fund - Growth,125.4576
2022-05-16,100496,Templeton India Value Fund - Growth Plan,377.4821
2022-05-16,100497,Templeton India Value Fund - IDCW,69.6179
2022-05-16,100519,Franklin India Flexi Cap Fund - IDCW,42.6734
2022-05-16,100520,Franklin India Flexi Cap Fund - Growth,867.6644
2022-05-16,100521,Franklin India Technology Fund - IDCW,34.9825
2022-05-16,100522,Franklin India Technology Fund-Growth,283.192
2022-05-16,100524,Franklin INDIA OPPORTUNITIES FUND - IDCW,19.9493
2022-05-16,100525,Franklin India ELSS Tax Saver Fund - IDCW,44.1531
2022-05-16,100526,Franklin India ELSS Tax Saver Fund-Growth,780.4128
2022-05-16,100535,Franklin India Retirement Fund - IDCW,16.0288
2022-05-16,100536,Franklin India Retirement Fund - Growth,152.3307
2022-05-16,100537,Franklin India Liquid Fund - Regular Plan - Weekly - IDCW,1244.2967
2022-05-16,100538,Franklin India Liquid Fund - Regular Plan - Growth,4903.4551
2022-05-16,100541,Franklin India Liquid Fund - Regular Plan - Daily - IDCW,1509.6201
2022-05-16,100546,Franklin India Liquid Fund - Super Institutional Plan - Growth,3193.2623
2022-05-16,100547,Franklin India Liquid Fund - Super Institutional Plan - Daily - IDCW,1000.0
2022-05-16,100548,Franklin India Liquid Fund - Super Institutional Plan - Weekly - IDCW,1021.9243
2022-05-16,100549,Franklin India Aggressive Hybrid Fund - IDCW,24.053
2022-05-16,100550,Franklin India Aggressive Hybrid Fund - Growth Plan,162.1125
2022-05-16,100593,CANARA ROBECO ELSS TAX SAVER - REGULAR PLAN -IDCW (Payout),32.17
2022-05-16,100614,Sundaram Value Fund Regular Plan - Income Distribution cum Capital Withdrawal (IDCW),12.3367
2022-05-16,100630,quant Multi Cap Fund-IDCW Option - Regular Plan,43.6142
2022-05-16,100631,quant Multi Cap Fund-GROWTH OPTION - Regular Plan,380.7133
2022-05-16,100643,SBI Technology Opportunities Fund - Regular Plan - Income Distribution cum Capital Withdrawal Option (IDCW),79.222
2022-05-16,100644,SBI Healthcare Opportunities Fund - Regular Plan - Income Distribution cum Capital Withdrawal Option (IDCW),127.7119
2022-05-16,100645,SBI Consumption Opportunities Fund - Regular Plan - Income Distribution cum Capital Withdrawal Option (IDCW),108.7112
2022-05-16,100646,UTI - Unit Linked Insurance Plan,30.9502
2022-05-16,100650,UTI Large Cap Fund - Regular Plan - IDCW,38.2771
2022-05-16,100651,UTI Large Cap Fund - Regular Plan - Growth Option,174.5484
2022-05-16,100663,UTI Large & Mid Cap Fund - Regular Plan - IDCW,43.4532
2022-05-16,100664,UTI Large & Mid Cap Fund - Regular Plan - Growth Option,89.1979
2022-05-16,100668,UTI Flexi Cap Fund - Regular Plan - IDCW,147.2406
2022-05-16,100669,UTI - Flexi Cap Fund-Growth Option,216.7765
2022-05-16,100678,UTI Children's Hybrid Fund - Regular Plan,29.0924
2022-05-16,100682,UTI Retirement Fund - Regular Plan,33.2444
2022-05-16,100684,UTI Aggressive Hybrid Fund - Regular Plan - Growth,233.2967
2022-05-16,100685,UTI Aggressive Hybrid Fund - Regular Plan - IDCW,31.0387
2022-05-16,100739,UTI MNC Fund - Regular Plan - IDCW,125.1659
2022-05-16,100740,UTI - MNC Fund - Regular Plan - Growth Option,242.765
2022-05-16,100794,Sundaram Small Cap Fund Regular Plan - Income Distribution cum Capital Withdrawal (IDCW),22.1134
2022-05-16,100795,Sundaram Small Cap Fund Regular Plan - Growth,129.6467
2022-05-16,100806,UTI Healthcare Fund - Regular Plan - IDCW,111.2649
2022-05-16,100807,UTI Healthcare Fund - Regular Plan - Growth Option,143.9652
2022-05-16,100813,UTI Overnight Fund - Regular Plan - Periodic IDCW,1492.2679
2022-05-16,100814,UTI - Overnight  Fund - Regular Plan - Growth Option,2896.6795
2022-05-16,100820,UTI ELSS Tax Saver Fund - Regular Plan - IDCW,24.243
2022-05-16,100821,UTI ELSS Tax Saver Fund - Regular Plan - Growth Option,126.8996
2022-05-16,100822,UTI Nifty 50 Index Fund - Regular Plan - Growth Option,105.6749
2022-05-16,100823,UTI Nifty 50 Index Fund - Regular Plan - IDCW,53.2388
2022-05-16,100833,Kotak Liquid Fund - Regular  - Daily Reinvestment of Income Distribution cum capital withdrawal option,1222.81
2022-05-16,100835,Kotak Liquid Fund - Regular Plan - Growth,4296.3234
2022-05-16,100837,Nippon India Liquid Fund - Retail Option - Growth Plan,4675.7053
2022-05-16,100838,NIPPON INDIA LIQUID FUND - RETAIL Plan - WEEKLY IDCW OPTION,1034.489
2022-05-16,100842,NIPPON INDIA LIQUID FUND - RETAIL Plan - DAILY IDCW OPTION,1524.28
2022-05-16,100843,NIPPON INDIA LIQUID FUND - RETAIL plan - MONTHLY IDCW OPTION,1327.765
2022-05-16,100844,NIPPON INDIA LIQUID FUND - RETAIL Plan - QUARTERLY IDCW OPTION,1218.3292
2022-05-16,100851,Nippon India Liquid Fund -Growth Plan,5184.1228
2022-05-16,100852,NIPPON INDIA LIQUID FUND - DAILY IDCW OPTION,1528.74
2022-05-16,100853,NIPPON INDIA LIQUID FUND - WEEKLY IDCW OPTION,1530.8562
2022-05-16,100855,NIPPON INDIA LIQUID FUND - MONTHLY IDCW OPTION,1585.9515
2022-05-16,100864,LIC MF ELSS Tax Saver-Regular Plan-IDCW,20.0379
2022-05-16,100865,LIC MF ELSS Tax Saver-Regular Plan-Growth,89.141
2022-05-16,100868,HDFC Liquid Fund - Growth Plan,4168.2648
2022-05-16,100874,HDFC Liquid Fund - IDCW Plan Weekly,1031.8422
2022-05-16,100875,HDFC Liquid Fund - IDCW Daily,1019.82
2022-05-16,100876,HDFC Liquid Fund - IDCW Monthly,1027.8376
2022-05-16,100900,HDFC Childrens Fund - Growth Plan,172.793
2022-05-16,100915,SBI Contra Fund - Regular Plan - Income Distribution cum Capital Withdrawal Option (IDCW),33.3242
2022-05-16,100948,Franklin India Conservative Hybrid Fund - Growth,66.2837
2022-05-16,100949,Franklin India Conservative Hybrid Fund - Plan A - Monthly - IDCW,12.5097
2022-05-16,100950,Franklin India Conservative Hybrid Fund - Plan A - Quarterly - IDCW,11.8448
2022-05-16,101065,quant Mid Cap Fund - Growth Option - Regular Plan,115.1958
2022-05-16,101066,quant Mid Cap Fund - IDCW Option - Regular Plan,40.8822
2022-05-16,101069,quant Aggressive Hybrid Fund-IDCW Option - Regular Plan,36.5997
2022-05-16,101070,quant Aggressive Hybrid Fund - Growth Option - Regular Plan,265.2418
2022-05-16,101071,quant Multi Asset Allocation Fund - IDCW Option - Regular Plan,69.1643
2022-05-16,101072,quant Multi Asset Allocation Fund-GROWTH OPTION - Regular Plan,75.3749
2022-05-16,101078,JM Liquid Fund (Regular) - Daily IDCW,10.4302
2022-05-16,101127,ICICI Prudential Children's Fund - Regular Plan,181.54
2022-05-16,101143,ICICI Prudential Multi-Asset Fund - IDCW,23.5579
2022-05-16,101144,ICICI Prudential Multi-Asset Fund - Growth,421.9888
2022-05-16,101161,Nippon India Multi Cap Fund-Growth Plan-Growth Option,138.0513
2022-05-16,101162,Nippon India Multi Cap Fund-Growth Plan-Bonus Option,138.0513
2022-05-16,101163,NIPPON INDIA MULTI CAP FUND - IDCW Option,37.888
2022-05-16,101184,LIC MF Liquid Fund-Regular Plan-Daily IDCW,1000.1
2022-05-16,101185,LIC MF Liquid Fund-Regular Plan-Growth,3841.5174
2022-05-16,101198,LIC MF BSE Sensex Index Fund-Regular Plan-IDCW,33.6782
2022-05-16,101199,LIC MF BSE Sensex Index Fund-Regular Plan-Growth,98.2567
2022-05-16,101200,LIC MF Nifty 50 Index Fund-Regular Plan-IDCW,32.117
2022-05-16,101201,LIC MF Nifty 50 Index Fund-Regular Plan-Growth,87.063
2022-05-16,101206,SBI OVERNIGHT FUND - REGULAR PLAN - GROWTH,3440.7574
2022-05-16,101209,Taurus Large Cap Fund - Regular Plan - Growth,94.4
2022-05-16,101222,Tata Aggressive Hybrid Fund- Regular Plan - Periodic Payout of IDCW Option,77.5118
2022-05-16,101228,ICICI Prudential Multicap Fund - Growth,402.01
2022-05-16,101262,Nippon India Power & Infra Fund-Growth Plan -Growth Option,142.1435
2022-05-16,101263,Nippon India Power & Infra Fund-Growth Plan-Bonus Option,142.1435
2022-05-16,101264,NIPPON INDIA POWER & INFRA FUND - IDCW Option,34.5434
2022-05-16,101271,LIC MF Children's Fund-Regular Plan-Growth,21.4605
2022-05-16,101281,HDFC BSE Sensex Index Fund - Growth Plan,476.1487
2022-05-16,101295,SBI ESG Exclusionary Strategy Fund - Regular Plan - Income Distribution cum Capital Withdrawal Option (IDCW),45.4996
2022-05-16,101313,Aditya Birla Sun Life Nifty 50 Index Fund -REGULAR - IDCW,16.0228
2022-05-16,101314,Aditya Birla Sun Life Nifty 50 Index Fund - Growth - Regular Plan,156.793
2022-05-16,101349,ICICI Prudential Nifty 50 Index Fund - Cumulative Option,155.1532
2022-05-16,101407,Baroda BNP Paribas LIQUID FUND-Defunct Plan- IDCW Option,2965.0723
2022-05-16,101408,Baroda BNP Paribas LIQUID FUND- Defunct Plan -Growth Option,3593.5692
2022-05-16,101409,Baroda BNP Paribas LIQUID FUND-Defunct Plan-Daily IDCW Option,1006.0602
2022-05-16,101491,Tata Childrens Fund -Regular Plan-Growth Option,37.0246
2022-05-16,101525,HDFC Nifty 50 Index Fund - Growth Plan,146.2208
2022-05-16,101530,SBI Large & Midcap Fund - Regular Plan - Income Distribution cum Capital Withdrawal Option (IDCW),153.0461
2022-05-16,101538,Sundaram Mid Cap Fund Regular Plan - Income Distribution cum Capital Withdrawal (IDCW),39.3163
2022-05-16,101539,Sundaram Mid Cap Fund Regular Plan - Growth,635.5549
2022-05-16,101549,JM Liquid Fund (Regular) - Bonus Option - Principal Units,18.5808
2022-05-16,101551,SBI Equity Hybrid Fund - Regular Plan - Income Distribution cum Capital Withdrawal Option (IDCW),40.4915
2022-05-16,101585,HDFC Equity Savings Fund - GROWTH PLAN,46.902
2022-05-16,101586,HDFC Equity Savings Fund - IDCW PLAN,11.567
2022-05-16,101591,Aditya Birla Sun Life Midcap Fund -REGULAR - IDCW,38.27
2022-05-16,101592,Aditya Birla Sun Life MIDCAP Fund-Growth,420.04
2022-05-16,101593,HSBC Large Cap Fund - Regular IDCW,35.3684
2022-05-16,101594,HSBC Large Cap Fund - Regular Growth,278.2648
2022-05-16,101609,TATA Equity Savings Fund- Regular Plan -Monthly Payout of IDCW option,14.6091
2022-05-16,101635,DSP Large Cap Fund - Regular Plan - Growth,257.811
2022-05-16,101636,DSP Large Cap Fund - Regular Plan - IDCW,18.46
2022-05-16,101659,Tata Nifty 50 Index Fund -Regular Plan,96.4855
2022-05-16,101672,Tata Value Fund - Regular Plan -Growth Option,181.5814
2022-05-16,101705,ICICI Prudential BSE Sensex ETF,577.4133
2022-05-16,101706,ICICI Prudential Multicap Fund - IDCW,23.07
2022-05-16,101714,Tata Liquid Fund- Regular Plan - Daily Reinvestment of IDCW Option,1001.5157
2022-05-16,101737,Aditya Birla Sun Life Dividend Yield Fund -REGULAR - IDCW,17.0
2022-05-16,101738,Aditya Birla Sun Life Dividend Yield Fund - Growth - Regular Plan,229.74
2022-05-16,101746,Tata S&P BSE Sensex Index Fund -Regular Plan,130.2153
2022-05-16,101762,HDFC Flexi Cap Fund - Growth Plan,948.768
2022-05-16,101763,HDFC Flexi Cap Fund - IDCW Plan,50.518
2022-05-16,101764,HDFC Value Fund - Growth Plan,390.88
2022-05-16,101765,HDFC Value Fund - IDCW Plan,23.562
2022-05-16,101766,Tata Infrastructure Fund-Regular Plan- Growth Option,84.7941
2022-05-16,101823,Tata Large & Mid Cap Fund Regular Plan - Payout of IDCW Option,48.065
2022-05-16,101824,Tata Large & Mid Cap Fund- Regular Plan - Growth Option,297.9933
2022-05-16,101833,Tata Ethical Fund- Regular Plan - Payout of IDCW Option,105.5727
2022-05-16,101834,UTI - Master Equity Plan Unit Scheme,142.5691
2022-05-16,101852,TATA Infrastructure Fund Regular Plan - Payout of IDCW Option,40.2172
2022-05-16,101853,Sundaram Value Fund Regular Plan - Growth,134.6005
2022-05-16,101862,Nippon India Banking & Financial Services Fund-Growth Plan-Growth Option,324.5339
2022-05-16,101863,Nippon India Banking & Financial Services Fund-Growth Plan-Bonus Option,324.5339
2022-05-16,101864,Nippon India Banking & Financial Services Fund - IDCW Option,47.7878
2022-05-16,101906,Tata Equity Savings Fund -Regular Plan-Growth Option,40.3315
2022-05-16,101922,CANARA ROBECO FLEXICAP FUND - REGULAR PLAN - GROWTH OPTION,199.95
2022-05-16,101923,CANARA ROBECO FLEXICAP FUND - REGULAR PLAN - IDCW (Payout/Reinvestment),41.18
2022-05-16,101979,HDFC ELSS Tax saver - Growth Plan,691.646
2022-05-16,101980,HDFC ELSS Tax saver - IDCW Plan,49.918
2022-05-16,101996,HDFC Overnight Fund - Growth Option,3149.9401
2022-05-16,101997,HDFC Overnight Fund - IDCW Option (Daily),1042.66
2022-05-16,102000,HDFC Large Cap Fund - Growth Option - Regular Plan,643.095
2022-05-16,102001,HDFC Large Cap Fund - IDCW Option - Regular Plan,43.757
2022-05-16,102007,UTI-  Liquid Cash Plan- Discontinued -Regular Plan Periodic Dividend Option,1132.5441
2022-05-16,102008,UTI-  Liquid Cash Plan- Discontinued - Regular Plan - Monthly Dividend Option,1088.9718
2022-05-16,102009,UTI-  Liquid Cash Plan- Discontinued - Regular Plan -Growth,3199.6404
2022-05-16,102010,UTI Liquid Fund - Regular Plan - Daily IDCW (Reinvestment),1085.7009
2022-05-16,102011,UTI Liquid Fund - Regular Plan - Monthly IDCW,1032.6472
2022-05-16,102012,UTI-  Liquid Cash Plan - Regular Plan - Growth Option,3481.1418
2022-05-16,102013,UTI Liquid Fund - Regular Plan - Weekly IDCW,1053.4879
2022-05-16,102020,Baroda BNP Paribas MULTI CAP FUND - Regular Plan - Growth Option,152.2655
2022-05-16,102021,Baroda BNP Paribas MULTI CAP FUND - Regular Plan - IDCW Option,37.8117
2022-05-16,102036,Tata Large Cap Fund- Regular Plan - Payout of IDCW Option,65.7209
2022-05-16,102118,Tata Equity Savings Fund- Regular Plan - Periodic Payout of IDCW Option,19.3251
2022-05-16,102133,ICICI Prudential Multi Sector Passive FOF - Growth,89.9264
2022-05-16,102134,ICICI Prudential Multi Sector Passive FOF - IDCW,81.8401
2022-05-16,102135,ICICI Prudential Aggressive Hybrid Active FOF - Growth,120.3681
2022-05-16,102136,ICICI Prudential Aggressive Hybrid Active FOF - IDCW,109.7914
2022-05-16,102142,Sundaram Consumption Fund(Formerly Known as Sundaram Rural and Consumption Fund Regular Plan - Growth),52.7973
2022-05-16,102251,HSBC Flexi Cap Fund - Regular IDCW,31.2722
2022-05-16,102252,HSBC Flexi Cap Fund - Regular Growth,116.1418
2022-05-16,102266,UTI Children's Equity Fund - Regular Plan - IDCW,52.8259
2022-05-16,102267,UTI Children's Equity Fund - Regular Plan - Growth Option,52.8229
2022-05-16,102272,SBI NIFTY INDEX FUND - REGULAR PLAN - GROWTH,136.6961
2022-05-16,102273,SBI Nifty Index Fund - Regular Plan - Income Distribution cum Capital Withdrawal Option (IDCW),70.1324
2022-05-16,102326,Tata Mid Cap Fund-Regular Plan - IDCW Option,60.1497
2022-05-16,102328,Tata Mid Cap Fund Regular Plan- Growth Option,217.7237
2022-05-16,102393,UTI Mid Cap Fund - Regular Plan - IDCW,77.9209
2022-05-16,102394,UTI Mid Cap Fund-Growth Option,164.6649
2022-05-16,102395,UTI Infrastructure Fund-Growth Option,70.0769
2022-05-16,102396,UTI Infrastructure Fund - Regular Plan - IDCW,36.6253
2022-05-16,102397,UTI Transportation and Logistics Fund - Regular Plan - IDCW,58.5013
2022-05-16,102398,UTI-Transportation and Logistics  Fund-Growth Option,126.8708
2022-05-16,102401,UTI Banking and Financial Services Fund - Regular Plan - Growth Option,102.8129
2022-05-16,102402,UTI Banking and Financial Services Fund - Regular Plan - IDCW,40.0142
2022-05-16,102414,SBI CONTRA FUND - REGULAR PLAN -GROWTH,192.1765
2022-05-16,102428,Tata Value Fund Regular Plan - Payout of IDCW-Option B(10%),68.9665
2022-05-16,102431,Nippon India Pharma Fund-Growth Plan-Growth Option,267.324
2022-05-16,102432,Nippon India Pharma Fund-Growth Plan-Bonus Option,267.324
2022-05-16,102433,NIPPON INDIA PHARMA FUND - IDCW Option,74.231
2022-05-16,102434,DSP India T.I.G.E.R. Fund - Regular Plan - Growth,136.743
2022-05-16,102435,DSP India T.I.G.E.R. Fund - Regular Plan - IDCW,16.559
2022-05-16,102442,Franklin India Liquid Fund - Institutional Plan - Weekly - IDCW,1054.7184
2022-05-16,102443,Franklin India Liquid Fund - Institutional Plan - Daily - IDCW,1000.0
2022-05-16,102528,ICICI Prudential MidCap Fund - Growth,144.41
2022-05-16,102529,ICICI Prudential MidCap Fund - IDCW,26.55
2022-05-16,102573,Kotak Multi Asset Omni FOF - Payout of Income Distribution cum capital withdrawal option,125.209
2022-05-16,102574,Kotak Multi Asset Omni FOF - Growth- Regular,128.63
2022-05-16,102594,ICICI Prudential Value Fund (erstwhile Value Discovery Fund) - Growth,240.28
2022-05-16,102595,ICICI Prudential Value Fund (erstwhile Value Discovery Fund) - IDCW,28.28
2022-05-16,102672,Tata Liquid Fund -Regular Plan - Growth Option,3346.0835
2022-05-16,102751,Nippon India Consumption Fund-Growth Plan-Growth Option,106.95
2022-05-16,102752,Nippon India Consumption Fund-Growth Plan-Bonus Option,106.95
2022-05-16,102753,NIPPON INDIA CONSUMPTION FUND - IDCW Option,26.6595
2022-05-16,102756,SBI FOCUSED FUND - REGULAR PLAN -GROWTH,212.2255
2022-05-16,102760,HDFC Focused Fund - GROWTH PLAN,110.631
2022-05-16,102761,HDFC Focused Fund - IDCW PLAN,16.5
2022-05-16,102765,SBI Focused Fund - Regular Plan - Income Distribution cum Capital Withdrawal Option (IDCW),38.8175
2022-05-16,102823,SBI HEALTHCARE OPPORTUNITIES FUND - REGULAR PLAN -GROWTH,202.7351
2022-05-16,102846,Nippon India Balanced Advantage Fund-Growth Plan-Growth Option,116.3908
2022-05-16,102847,Nippon India Balanced Advantage Fund-Growth Plan-Bonus Option,116.3908
2022-05-16,102848,NIPPON INDIA BALANCED ADVANTAGE FUND - IDCW Option,27.312
2022-05-16,102874,Kotak-Small Cap Fund - Payout of Income Distribution cum capital withdrawal option,65.183
2022-05-16,102875,Kotak-Small Cap Fund - Growth,149.41
2022-05-16,102883,Franklin India Large & Mid Cap Fund - Growth Plan,110.2103
2022-05-16,102884,Franklin India Large & Mid Cap Fund - IDCW,16.2297
2022-05-16,102885,SBI EQUITY HYBRID FUND - REGULAR PLAN -Growth,191.085
2022-05-16,102920,CANARA ROBECO LARGE AND MID CAP FUND - REGULAR PLAN - GROWTH OPTION,144.04
2022-05-16,102921,CANARA ROBECO LARGE AND MID CAP FUND - REGULAR PLAN - IDCW (Payout/Reinvestment),54.95
2022-05-16,102941,SBI MIDCAP FUND - REGULAR PLAN - GROWTH,130.1603
2022-05-16,102942,SBI Midcap Fund - Regular Plan - Income Distribution cum Capital Withdrawal Option (IDCW),53.1841
2022-05-16,102947,HDFC Hybrid Equity Fund - IDCW Plan,13.093
2022-05-16,102948,HDFC Hybrid Equity Fund - Growth Plan,74.676
2022-05-16,103024,SBI LARGE & MIDCAP FUND- REGULAR PLAN -Growth,338.7636
2022-05-16,103025,UTI Dividend Yield Fund - Regular Plan - IDCW,19.9751
2022-05-16,103026,UTI-Dividend Yield Fund.-Growth,95.8471
2022-05-16,103034,SBI MNC FUND - REGULAR PLAN -GROWTH,246.4397
2022-05-16,103039,Kotak Contra Fund - Regular Plan - IDCW - Payout & Re-investment of Income Distribution cum capital withdrawal option,26.046
2022-05-16,103040,Kotak Contra Fund - Regular Plan - Growth,75.562
2022-05-16,103085,Nippon India Value Fund- Growth Plan,110.5877
2022-05-16,103086,NIPPON INDIA VALUE FUND - IDCW Option,27.9431
2022-05-16,103097,UTI Value Fund - Regular Plan - IDCW,26.2771
2022-05-16,103098,UTI Value Fund - Regular Plan - Growth Option,90.1672
2022-05-16,103110,Aditya Birla Sun Life Consumption Fund -Regular - IDCW,29.94
2022-05-16,103111,Aditya Birla Sun Life Consumption Fund-Growth Option,123.51
2022-05-16,103114,SBI MNC Fund - Regular Plan - Income Distribution cum Capital Withdrawal Option (IDCW),75.2852
2022-05-16,103130,HDFC Multi-Asset Fund - IDCW Option,13.845
2022-05-16,103131,HDFC Multi-Asset Fund - Growth Option,45.326
2022-05-16,103140,SBI Overnight Fund - Regular Plan - Weekly Income Distribution cum Capital Withdrawal Option (IDCW),1100.4203
2022-05-16,103145,SBI COMMA Fund - REGULAR PLAN - Growth,63.4025
2022-05-16,103146,SBI Comma Fund - Regular Plan - Income Distribution cum Capital Withdrawal Option (IDCW),35.9868
2022-05-16,103149,ICICI Prudential Infrastructure Fund - Growth,80.76
2022-05-16,103150,ICICI Prudential Infrastructure Fund - IDCW,16.08
2022-05-16,103151,Franklin India Opportunities Fund - Growth,98.2327
2022-05-16,103154,Aditya Birla Sun Life Equity Hybrid'95 Fund -Regular - IDCW,144.51
2022-05-16,103155,Aditya Birla Sun Life Equity Hybrid'95 Fund - Regular Plan-Growth,986.06
2022-05-16,103164,Aditya Birla Sun Life ELSS Tax Saver Fund-Regular - IDCW,144.61
2022-05-16,103165,Aditya Birla Sun Life Flexi Cap Fund -Regular - IDCW,114.06
2022-05-16,103166,Aditya Birla Sun Life Flexi Cap Fund - Growth - Regular Plan,1014.62
2022-05-16,103167,Aditya Birla Sun Life Digital India Fund -Regular - IDCW,37.43
2022-05-16,103168,Aditya Birla Sun Life Digital India Fund - Growth - Regular Plan,115.07
2022-05-16,103173,Aditya Birla Sun Life Large Cap Fund-Regular - IDCW,29.93
2022-05-16,103174,Aditya Birla Sun Life Large Cap Fund-Growth,306.84
2022-05-16,103196,Nippon India ELSS Tax Saver Fund-Growth Plan-Growth Option,70.1037
2022-05-16,103197,NIPPON INDIA ELSS TAX SAVER FUND - IDCW Option,23.2599
2022-05-16,103215,SBI Flexicap Fund - REGULAR PLAN -Growth Option,69.2758
2022-05-16,103216,SBI Flexicap Fund - Regular Plan - Income Distribution cum Capital Withdrawal Option (IDCW),31.02
2022-05-16,103225,quant Liquid Fund - Growth Option - Regular Plan,33.8379
2022-05-16,103226,quant Liquid Fund-Daily IDCW Option - Regular Plan,13.0216
2022-05-16,103227,quant Liquid Fund - Weekly IDCW Option - Regular Plan,13.4199
2022-05-16,103228,quant Liquid Fund - Monthly IDCW Option - Regular Plan,15.1948
2022-05-16,103233,Kotak Large & Midcap Fund - IDCW-Regular,31.419
2022-05-16,103234,Kotak Large & Midcap Fund - Growth-Regular,180.092
2022-05-16,103308,Aditya Birla Sun Life Focused Fund -Regular - IDCW,18.3797
2022-05-16,103309,Aditya Birla Sun Life Focused Fund -Growth Option,82.2862
