date,scheme_code,scheme_name,nav
2006-09-01,100785,Sundaram Corporate Bond Fund Regular Plan -Income Distribution cum Capital Withdrawal(IDCW),10.2147
2006-09-01,100786,Sundaram Corporate Bond Fund Regular Plan - Income Distribution cum Capital Withdrawal (IDCW ),10.1041
2006-09-01,100787,Sundaram Corporate Bond Fund Regular Plan-Income Distribution cum Capital Withdrawal (IDCW),10.1047
2006-09-01,100788,Sundaram Corporate Bond Fund Regular Plan- Income Distribution cum Capital Withdrawal (IDCW),10.1011
2006-09-01,100789,Sundaram Corporate Bond Fund Regular Plan- Growth,10.8913
2006-09-01,100790,Sundaram Corporate Bond Fund Institutional Plan - Income Distribution cum Capital Withdrawal (IDCW),10.2156
2006-09-01,100792,Sundaram Corporate Bond Fund Institutional Plan - Growth,10.8899
2006-09-01,100793,Sundaram Banking & PSU Fund (Formerly Known as Sundaram Banking and PSU Debt Fund) Regular Plan - Income Distribution cum Capital Withdrawal (IDCW),10.179
2006-09-01,100794,Sundaram Small Cap Fund Regular Plan - Income Distribution cum Capital Withdrawal (IDCW),13.9806
2006-09-01,100795,Sundaram Small Cap Fund Regular Plan - Growth,16.1904
2006-09-01,100796,Sahara Midcap Fund-Growth Plan,15.7328
2006-09-01,100797,Sahara Midcap Fund-Dividend Plan,14.0444
2006-09-01,100798,Sahara Midcap Fund-Auto Payout,15.7328
2006-09-01,100799,Sahara Midcap Fund-Bonus,15.7328
2006-09-01,100800,UTI Growth Sector Funds-UTI - GSF - Brand Value-Income Option,18.3
2006-09-01,100801,UTI Growth Sector Funds-UTI - GSF - Brand Value-Growth Option,23.92
2006-09-01,100802,UTI Software Fund-Growth Option,21.28
2006-09-01,100803,UTI Software Fund-Income Option,19.51
2006-09-01,100804,UTI Energy Fund-Income Option,19.19
2006-09-01,100805,UTI Energy Fund-Growth Option,24.64
2006-09-01,100806,UTI Healthcare Fund - Regular Plan - IDCW,18.82
2006-09-01,100807,UTI Healthcare Fund - Regular Plan - Growth Option,21.33
2006-09-01,100808,UTI Services Industries Fund-Income Option,28.84
2006-09-01,100809,UTI Services Industries Fund-Growth Option,38.98
2006-09-01,100811,UTI - G-Sec Fund-Income,10.4655
2006-09-01,100812,UTI - G-Sec Fund-GrowthN,18.6132
2006-09-01,100813,UTI Overnight Fund - Regular Plan - Periodic IDCW,10.6105
2006-09-01,100814,UTI - Overnight  Fund - Regular Plan - Growth Option,11.3427
2006-09-01,100820,UTI ELSS Tax Saver Fund - Regular Plan - IDCW,16.59
2006-09-01,100821,UTI ELSS Tax Saver Fund - Regular Plan - Growth Option,27.0
2006-09-01,100822,UTI Nifty 50 Index Fund - Regular Plan - Growth Option,21.8803
2006-09-01,100823,UTI Nifty 50 Index Fund - Regular Plan - IDCW,21.8803
2006-09-01,100828,Kotak Liquid-Regular (Dividend),10.0258
2006-09-01,100829,Kotak Liquid-Regular (Growth),14.2401
2006-09-01,100830,Kotak Liquid-Institutional Plan  (Growth),14.4303
2006-09-01,100831,Kotak Liquid Fund -Institutional Plan - (Daily Dividend),12.2281
2006-09-01,100832,Kotak Liquid-Institutional Plan (Weekly Dividend),10.0287
2006-09-01,100833,Kotak Liquid Fund - Regular  - Daily Reinvestment of Income Distribution cum capital withdrawal option,12.2281
2006-09-01,100834,Kotak Liquid Fund Regular Plan Weekly Reinvestment of Income Distribution cum capital withdrawal option Dividend,10.0417
2006-09-01,100835,Kotak Liquid Fund - Regular Plan - Growth,14.5071
2006-09-01,100836,Kotak Liquid Fund -Sweep Daily Dividend,10.0071
2006-09-01,100837,Nippon India Liquid Fund - Retail Option - Growth Plan,17.3481
2006-09-01,100838,NIPPON INDIA LIQUID FUND - RETAIL Plan - WEEKLY IDCW OPTION,10.3405
2006-09-01,100842,NIPPON INDIA LIQUID FUND - RETAIL Plan - DAILY IDCW OPTION,15.24
2006-09-01,100843,NIPPON INDIA LIQUID FUND - RETAIL plan - MONTHLY IDCW OPTION,10.949
2006-09-01,100844,NIPPON INDIA LIQUID FUND - RETAIL Plan - QUARTERLY IDCW OPTION,17.2259
2006-09-01,100845,Reliance Liquid Fund-Cash Plan-Growth Plan,12.5778
2006-09-01,100848,Reliance Liquid Fund-Cash Plan-Weekly Dividend Reinvestment Option,10.9163
2006-09-01,100849,Reliance Liquid Fund-Cash Plan-Daily Dividend Reinvestment Option,11.1411
2006-09-01,100851,Nippon India Liquid Fund -Growth Plan,17.484
2006-09-01,100852,NIPPON INDIA LIQUID FUND - DAILY IDCW OPTION,15.2845
2006-09-01,100853,NIPPON INDIA LIQUID FUND - WEEKLY IDCW OPTION,15.3011
2006-09-01,100855,NIPPON INDIA LIQUID FUND - MONTHLY IDCW OPTION,15.2276
2006-09-01,100856,Nippon India Corporate Bond Fund - Growth Plan - Growth Option,15.1529
2006-09-01,100857,NIPPON INDIA CORPORATE BOND FUND - MONTHLY IDCW Option,10.2354
2006-09-01,100858,NIPPON INDIA CORPORATE BOND FUND - QUARTERLY IDCW Option,10.4699
2006-09-01,100859,Nippon India Corporate Bond Fund - Growth Plan - Bonus Option,10.824
2006-09-01,100864,LIC MF ELSS Tax Saver-Regular Plan-IDCW,12.3696
2006-09-01,100865,LIC MF ELSS Tax Saver-Regular Plan-Growth,22.8506
2006-09-01,100868,HDFC Liquid Fund - Growth Plan,14.2532
2006-09-01,100872,HDFC Liquid Fund-PREMIUM PLUS- Growth,14.3697
2006-09-01,100873,HDFC Liquid Fund-PREMIUM- Growth,14.3388
2006-09-01,100874,HDFC Liquid Fund - IDCW Plan Weekly,10.3177
2006-09-01,100875,HDFC Liquid Fund - IDCW Daily,10.1982
2006-09-01,100876,HDFC Liquid Fund - IDCW Monthly,10.2703
2006-09-01,100877,HDFC Liquid Fund-Premium Plan - Dividend-Daily,12.2598
2006-09-01,100878,HDFC Liquid Fund-Premium Plan - Dividend-Weekly,12.4849
2006-09-01,100881,HDFC Liquid Fund-Premium Plus Plan - Dividend-Weekly,12.4265
2006-09-01,100887,Principal Cash Management-Liquid Option-Dividend Plan,10.1218
2006-09-01,100888,Principal Cash Management-Liquid Option-Growth Plan,14.1377
2006-09-01,100889,Principal Cash Management-Liquid Option-Monthly Dividend,10.0063
2006-09-01,100890,Principal Cash Management-Liquid Option-Institutional - Weekly Dividend Plan,10.0035
2006-09-01,100891,Principal Cash Management-Liquid Option-Institutional - Monthly Dividend Plan,10.0066
2006-09-01,100892,Principal Cash Management-Liquid Option-Daily Dividend,10.0022
2006-09-01,100893,Principal Cash Management-Liquid Option-Institutional - Growth Plan,11.8689
2006-09-01,100894,Principal Cash Management-Liquid Option-Institutional - Daily Dividend Plan,10.0022
2006-09-01,100895,Principal Cash Management Fund - Daily Income Distribution CUM Capital Withdrawal,10.0007
2006-09-01,100896,Principal Cash Management Fund - Weekly Income Distribution CUM Capital Withdrawal Option,10.0027
2006-09-01,100897,Principal Cash Management Fund - Monthly Income Distribution CUM Capital Withdrawal Option,10.0062
2006-09-01,100898,Principal Cash Management Fund -Growth Option,11.195
2006-09-01,100899,HDFC Childrens Fund-Savings,14.552
2006-09-01,100900,HDFC Childrens Fund - Growth Plan,23.065
2006-09-01,100902,Franklin Pharma Fund - Growth,27.76
2006-09-01,100906,DBS Chola Opportunities Fund-Regular Quarterly Dividend,13.55
2006-09-01,100907,DBS Chola Opportunities Fund-Cumulative,20.84
2006-09-01,100915,SBI Contra Fund - Regular Plan - Income Distribution cum Capital Withdrawal Option (IDCW),23.88
2006-09-01,100927,SBI Conservative Hybrid Fund - Regular Plan - Monthly Income Distribution cum Capital Withdrawal Option (IDCW),10.667
2006-09-01,100928,SBI Conservative Hybrid Fund - Regular Plan - Quarterly Income Distribution cum Capital Withdrawal Option (IDCW),10.7197
2006-09-01,100929,SBI Conservative Hybrid Fund - Regular Plan - Annual Income Distribution cum Capital Withdrawal Option (IDCW),10.7818
2006-09-01,100940,DSP BlackRock Liquidity Fund - Regular Plan - Growth,17.5995
2006-09-01,100941,DSP BlackRock Liquidity Fund - Regular Plan Weekly Dividend,12.4
2006-09-01,100943,DSP BlackRock Liquidity Fund - Regular Plan - Daily Dividend,10.01
2006-09-01,100948,Franklin India Conservative Hybrid Fund - Growth,19.6689
2006-09-01,100949,Franklin India Conservative Hybrid Fund - Plan A - Monthly - IDCW,11.8868
2006-09-01,100950,Franklin India Conservative Hybrid Fund - Plan A - Quarterly - IDCW,11.9437
2006-09-01,100951,Franklin India Conservative Hybrid Fund - Monthly Bonus,14.5252
2006-09-01,100952,ICICI Prudential MIP - Growth,18.0768
2006-09-01,100953,ICICI Prudential MIP - Dividend Monthly,11.3902
2006-09-01,100954,ICICI Prudential MIP - Dividend Quarterly,11.6342
2006-09-01,100955,ICICI Prudential MIP - Dividend Half Yearly,11.4237
2006-09-01,100956,Aditya Birla Tax Plan 98,173.4
2006-09-01,100957,Principal Income Fund-Dividend Plan-Half Yearly,10.666
2006-09-01,100958,Principal Income Fund-Dividend Plan-Quaterly,10.5148
2006-09-01,100960,Principal Dynamic Bond Fund - Dividend Option -Annual,10.8535
2006-09-01,100961,Principal Dynamic Bond Fund -Dividend Option - Quarterly,10.7892
2006-09-01,100962,Principal Income Fund-Growth Plan-growth,16.9513
2006-09-01,100963,Principal Dynamic Bond Fund - Growth Option,11.9463
2006-09-01,100966,Principal Multi Cap Growth Fund- Half Yearly Income Distribution CUM Capital Withdrawal Option,20.72
2006-09-01,100967,Principal Multi Cap Growth Fund-Growth Option,42.83
2006-09-01,100968,SBI Conservative Hybrid Fund - Regular Plan - Growth,16.2578
2006-09-01,100970,Aditya Birla Sun Life MIP - Regular Plan - Growth,18.279
2006-09-01,100971,Aditya Birla Sun Life MIP - Regular Plan - Monthly Dividend,10.9133
2006-09-01,100972,Aditya Birla Sun Life MIP - Regular Plan - Monthly Payment,18.279
2006-09-01,100975,DBS Chola Liquid Fund-Regular Cumulative,14.5415
2006-09-01,100978,DBS Chola Liquid Fund-Daily Dividend Reinvestment Plan,10.0315
2006-09-01,100989,DBS Chola Liquid Fund-Cum -Institutional Plus,14.6223
2006-09-01,100997,HDFC Long Term Advantage Plan - IDCW Plan,40.256
2006-09-01,100998,HDFC Long Term Advantage Plan - Growth Plan,80.637
2006-09-01,100999,SBI Gilt Fund - Regular Plan - Income Distribution cum Capital Withdrawal Option (IDCW),10.2009
2006-09-01,101000,Tata Life Sciences & Technology Fund - Growth,41.0669
2006-09-01,101001,SBI GILT FUND - REGULAR PLAN - GROWTH,16.6606
2006-09-01,101002,SBI CONSTANT MATURITY 10 Year GILT FUND - REGULAR PLAN - GROWTH,14.3103
2006-09-01,101003,SBI Constant Maturity 10 Year Gilt Fund - Regular Plan - Income Distribution cum Capital Withdrawal Option (IDCW),10.0011
2006-09-01,101037,Franklin India Index Tax Fund,26.8184
2006-09-01,101042,Tata Gilt Securities Fund -Regular Plan- Growth Option,22.4725
2006-09-01,101044,Franklin India Floating Rate Fund - IDCW,10.0
2006-09-01,101048,Franklin India Floating Rate Fund - Growth Plan,13.1337
2006-09-01,101049,Tata Gilt Securities Fund - Regular Plan - Payout of IDCW Option,11.6574
2006-09-01,101059,SUNDARAM GILT FUND (DIV. OPTION),10.4548
2006-09-01,101065,quant Mid Cap Fund - Growth Option - Regular Plan,23.3875
2006-09-01,101066,quant Mid Cap Fund - IDCW Option - Regular Plan,13.5889
2006-09-01,101069,quant Aggressive Hybrid Fund-IDCW Option - Regular Plan,13.545
2006-09-01,101070,quant Aggressive Hybrid Fund - Growth Option - Regular Plan,41.8382
2006-09-01,101071,quant Multi Asset Allocation Fund - IDCW Option - Regular Plan,13.2289
2006-09-01,101072,quant Multi Asset Allocation Fund-GROWTH OPTION - Regular Plan,14.458
2006-09-01,101078,JM Liquid Fund (Regular) - Daily IDCW,10.4302
2006-09-01,101081,HDFC Gilt Fund-Short Term-Dividend,10.532
2006-09-01,101082,HDFC Gilt Fund-Short Term-Growth,13.3115
2006-09-01,101083,HDFC Gilt Fund - Growth Plan,15.3278
2006-09-01,101084,HDFC Gilt Fund - IDCW Plan,10.1552
2006-09-01,101092,SUNDARAM GILT FUND (Growth. OPTION),13.0725
2006-09-01,101094,Taurus Gilt Fund-Dividend,12.3211
2006-09-01,101095,Taurus Gilt Fund-Growth,12.6412
2006-09-01,101098,ICICI Prudential Child Care Plan Study - Cumulative,18.2062
2006-09-01,101099,Grindlays Cash Fund-Growth,13.2739
2006-09-01,101100,Grindlays Cash Fund-Dividend (Daily),10.5819
2006-09-01,101113,Taurus Short Term Income Fund- Regular Plan - Dividend Option,13.1058
2006-09-01,101114,Taurus Short Term Income Fund- Regular Plan - Growth Option,13.4787
2006-09-01,101116,Principal Government Securities Fund-Investment-Dividend - Half Yearly,11.308
2006-09-01,101117,Principal Government Securities Fund-Dividend Option - Quarterly,11.219
2006-09-01,101118,Principal Government Securities Fund-Growth,15.7861
2006-09-01,101119,Principal Government Securities Fund-Dividend Option- Annually,13.6627
2006-09-01,101120,Principal Gilt Fund-Savings-Growth,13.7389
2006-09-01,101121,Principal Gilt Fund-Savings-Dividend,10.3111
2006-09-01,101122,Principal Gilt Fund-Provident-Growth,10.6818
2006-09-01,101123,Principal Gilt Fund-Provident-Haly Yearly,10.3236
2006-09-01,101124,Principal Gilt Fund-Provident-Annual,10.7016
2006-09-01,101126,Principal Gilt Fund-Provident-Annual Rebalancing 2005,10.636
2006-09-01,101127,ICICI Prudential Children's Fund - Regular Plan,34.41
2006-09-01,101131,DBS Chola Growth Fund-Quarterly Dividend,14.24
2006-09-01,101132,DBS Chola Growth Fund-Cumulative,26.47
2006-09-01,101143,ICICI Prudential Multi-Asset Fund - IDCW,18.1937
2006-09-01,101144,ICICI Prudential Multi-Asset Fund - Growth,53.1833
2006-09-01,101154,BARODA INCOME FUND - Plan A - Growth Option,12.3574
2006-09-01,101155,BARODA INCOME FUND - Plan A - Dividend Option,12.3574
2006-09-01,101161,Nippon India Multi Cap Fund-Growth Plan-Growth Option,17.9936
2006-09-01,101162,Nippon India Multi Cap Fund-Growth Plan-Bonus Option,17.9936
2006-09-01,101163,NIPPON INDIA MULTI CAP FUND - IDCW Option,16.8885
2006-09-01,101165,ICICI Prudential Short Term Fund - Monthly IDCW,10.7635
2006-09-01,101169,SBI Children's Fund - Savings Plan - REGULAR PLAN - GROWTH,16.4291
2006-09-01,101170,Sahara Gilt Fund-Growth,12.0414
2006-09-01,101171,Sahara Gilt Fund-Dividend,11.0117
2006-09-01,101172,ING Vysya Equity Fund-Dividend Option,13.44
2006-09-01,101173,ING Vysya Equity Fund-Growth Option,28.19
2006-09-01,101177,Grindlays Government Securities Fund - IP (Qtr.Dividend),10.1986
2006-09-01,101178,Grindlays Government Securities Fund - ST (Monthly Dividend),10.006
2006-09-01,101179,Grindlays Government Securities Fund-IP(Annual Dividend),10.3345
2006-09-01,101180,Grindlays Government Securities Fund-ST (Quarterly Dividend),10.2115
2006-09-01,101181,JM Medium to Long Duration Fund (Regular) - Bonus Option- Principal Units,11.5088
2006-09-01,101184,LIC MF Liquid Fund-Regular Plan-Daily IDCW,10.9801
2006-09-01,101185,LIC MF Liquid Fund-Regular Plan-Growth,13.0173
2006-09-01,101186,Tata Income Fund- Regular Plan - Periodic Payout of IDCW Option,14.0764
2006-09-01,101187,Baroda BNP Paribas GILT FUND - Regular Plan - Growth Option,10.9826
2006-09-01,101188,Baroda BNP Paribas GILT FUND - Regular Plan - IDCW Option,10.9838
2006-09-01,101190,BOB GILT FUND-PF Plan (Growth),10.3422
2006-09-01,101192,DBS Chola Freedom Income-STF Regular-Semi Annual Dividend,11.2839
2006-09-01,101198,LIC MF BSE Sensex Index Fund-Regular Plan-IDCW,16.1387
2006-09-01,101199,LIC MF BSE Sensex Index Fund-Regular Plan-Growth,25.3988
2006-09-01,101200,LIC MF Nifty 50 Index Fund-Regular Plan-IDCW,14.07
2006-09-01,101201,LIC MF Nifty 50 Index Fund-Regular Plan-Growth,22.0836
2006-09-01,101202,LIC MF Index Fund-Sensex Advantage-Dividend,12.4917
2006-09-01,101203,LIC MF Index Fund-Sensex Advantage-Growth,24.5543
2006-09-01,101206,SBI OVERNIGHT FUND - REGULAR PLAN - GROWTH,12.422
2006-09-01,101207,UTI-Fixed Maturity Plan Yearly Series - July 2005-Dividend Option,10.0459
2006-09-01,101208,UTI-Fixed Maturity Plan Yearly Series - July 2005-Growth Option,10.6398
2006-09-01,101209,Taurus Large Cap Fund - Regular Plan - Growth,30.46
2006-09-01,101221,ICICI Prudential Money Market Fund Retail Growth (erstwhile Cash Option),12.1973
2006-09-01,101222,Tata Aggressive Hybrid Fund- Regular Plan - Periodic Payout of IDCW Option,35.0726
2006-09-01,101224,Tata Dynamic Bond Fund- Regular Plan - Payout of IDCW Option,10.3006
2006-09-01,101228,ICICI Prudential Multicap Fund - Growth,69.21
2006-09-01,101229,ICICI Prudential Short Term Fund - Institutional Plan - Dividend Monthly,11.024
2006-09-01,101230,ICICI Prudential Short Term Fund-Institutional Plan-Dividend Fortnightly,11.0177
2006-09-01,101231,ICICI Prudential Short Term Fund-Institutional Growth,13.792
2006-09-01,101232,Franklin India Short-Term Income Plan-Growth,1320.0109
2006-09-01,101236,Franklin India Short Term Income Plan -  Retail Plan - Monthly - IDCW,1011.7864
2006-09-01,101237,Franklin India Short-Term Income Plan-Weekly Bonus,1049.6013
2006-09-01,101238,Franklin India Short Term Income Plan -  Retail Plan - Quarterly - IDCW,1026.6691
2006-09-01,101242,Franklin India Short Term Income Plan -  Retail Plan - Weekly - IDCW,1095.6747
2006-09-01,101244,Franklin India Short-Term Income Plan-Institutional Plan - Growth,1054.5744
2006-09-01,101245,Templeton India Short-Term Income Plan-Institutional Plan - Weekly Dividend,1006.2065
2006-09-01,101246,Franklin India Short-Term Income Plan-Institutional Plan - Monthly Dividend,1044.3385
2006-09-01,101248,Grindlays Cash Fund - Plan B (G) (Institutional Plan),13.342
2006-09-01,101258,Grindlays Dynamic Bond Fund - GDBF (Annual Dividend),10.4034
2006-09-01,101262,Nippon India Power & Infra Fund-Growth Plan -Growth Option,27.2364
2006-09-01,101263,Nippon India Power & Infra Fund-Growth Plan-Bonus Option,27.2364
2006-09-01,101264,NIPPON INDIA POWER & INFRA FUND - IDCW Option,22.5368
2006-09-01,101265,Principal Hybrid Equity Fund-Growth,19.93
2006-09-01,101266,Principal Hybrid Equity Fund- Monthly Income Distribution CUM Capital Withdrawal,16.04
2006-09-01,101271,LIC MF Children's Fund-Regular Plan-Growth,14.0947
2006-09-01,101279,Grindlays Dynamic Bond Fund - GDBF (Growth),13.0621
2006-09-01,101281,HDFC BSE Sensex Index Fund - Growth Plan,111.6731
2006-09-01,101282,HDFC Index Fund-Sensex Plus( FV-Rs32.161),124.9534
2006-09-01,101288,ING Short Term Income Fund-Growth Option,12.7329
2006-09-01,101294,Birla Sun Life Cash Plus Sweep Plan-Dividend Option,10.0496
2006-09-01,101295,SBI ESG Exclusionary Strategy Fund - Regular Plan - Income Distribution cum Capital Withdrawal Option (IDCW),27.87
2006-09-01,101296,Banking Index Benchmark Exchange Traded Scheme (Bank BeES),472.8834
2006-09-01,101303,DSP Short Term Fund - Regular Plan - Regular Plan - IDCW - Weekly,10.18
2006-09-01,101304,DSP Short Term Fund - Regular Plan - Growth,12.5644
2006-09-01,101305,DSP Short Term Fund - Regular Plan - IDCW,10.6037
2006-09-01,101306,DSP Short Term Fund - IDCW - Monthly,10.3743
2006-09-01,101307,DBS Chola Liquid Fund - Regular Weekly Dividend,11.9108
2006-09-01,101313,Aditya Birla Sun Life Nifty 50 Index Fund -REGULAR - IDCW,19.6503
2006-09-01,101314,Aditya Birla Sun Life Nifty 50 Index Fund - Growth - Regular Plan,35.5278
2006-09-01,101315,Aditya Birla Sun Life Savings Fund-Insititutional Fortnightly Dividend,10.5126
2006-09-01,101316,Aditya Birla Sun Life Savings Fund-Retail Growth,13.3877
2006-09-01,101317,Aditya Birla Sun Life Savings Fund - Growth - Regular Plan,13.5014
2006-09-01,101318,Aditya Birla Sun Life Savings Fund-Retail Fortnightly Dividend,11.2768
2006-09-01,101319,Grindlays Cash Fund - Dividend (Weekly),10.1915
2006-09-01,101325,Nifty Benchmark Exchange Traded Scheme- Nifty BeES,349.9908
2006-09-01,101349,ICICI Prudential Nifty 50 Index Fund - Cumulative Option,30.6361
2006-09-01,101350,ICICI Prudential All Seasons Bond Fund Retail - Cumulative,15.0303
2006-09-01,101351,ICICI Prudential All Seasons Bond Fund - Weekly IDCW,10.4499
2006-09-01,101352,Templeton Floating Rate Income Fund-Short Term Plan-Dividend Option,10.0173
2006-09-01,101353,Templeton Floating Rate Income Fund-Short Term Plan-Growth Option,12.9226
2006-09-01,101354,Templeton Floating Rate Income Fund-Short Term Plan-Institutional Option - Growth,10.5826
2006-09-01,101355,Templeton Floating Rate Income Fund-Short Term Plan-Institutional Option - Dividend,10.0174
2006-09-01,101356,Franklin India Money Market Fund Retail Option - Quarterly - IDCW,10.4483
2006-09-01,101357,Franklin India Money Market Fund - Growth Option,12.9235
2006-09-01,101358,Franklin India Money Market Fund - Institutional Option - Growth,10.5552
2006-09-01,101359,Franklin India Money Market Fund - Institutional Option - Dividend,10.3257
2006-09-01,101361,Canara Robeco Liquid Fund- INSTITUTIONAL-Weekly dividend,10.0428
2006-09-01,101362,Canara Robeco Liquid Fund- INSTITUTIONAL-Growth,13.1097
2006-09-01,101363,Canara Robeco Liquid Fund- INSTITUTIONAL-Daily Dividend Reinvestment,10.041
2006-09-01,101364,Canara Robeco Liquid Fund-Retail-DRI,10.041
2006-09-01,101365,Canara Robeco Liquid Fund-Retail-Growth,13.0973
2006-09-01,101372,Kotak Bond Short Term Plan-(Payout of Income Distribution cum capital withdrawal option),10.0909
2006-09-01,101373,Kotak Bond Short Term Plan-(Growth),12.967
2006-09-01,101393,Sahara Liquid Fund-Fixed Pricing - Daily Dividend Option,1024.4626
2006-09-01,101394,Sahara Liquid Fund-Fixed Pricing - Growth option,1287.3272
2006-09-01,101397,Sahara Liquid Fund-Fixed Pricing -  Weekly Dividend Option,1024.6207
2006-09-01,101398,Sahara Liquid Fund-Fixed Pricing - Monthly Dividend Option,1024.2087
2006-09-01,101399,Sahara Liquid Fund-Variable Pricing - Daily Dividend option,1024.4752
2006-09-01,101400,Sahara Liquid Fund-Variable Pricing - Weekly Dividend Option,1024.6371
2006-09-01,101401,Sahara Liquid Fund-Variable Pricing- Monthly Dividend Option,1024.8034
2006-09-01,101402,Sahara Liquid Fund-Variable Pricing - Growth option,1289.9818
2006-09-01,101403,Sahara Income Fund-Dividend,11.2004
2006-09-01,101404,Sahara Income Fund-Growth,12.444
2006-09-01,101405,ING Gilt Fund-Growth Option,11.9144
2006-09-01,101406,ING Gilt Fund-Dividend Option,11.9144
2006-09-01,101407,Baroda BNP Paribas LIQUID FUND-Defunct Plan- IDCW Option,11.0467
2006-09-01,101408,Baroda BNP Paribas LIQUID FUND- Defunct Plan -Growth Option,12.8807
2006-09-01,101409,Baroda BNP Paribas LIQUID FUND-Defunct Plan-Daily IDCW Option,10.0339
2006-09-01,101419,Tata Long Term Debt Fund - Regular Plan  -Bonus,12.1644
2006-09-01,101420,JM Floater Short Term Fund - Daily Dividend Option,10.0883
2006-09-01,101421,JM Floater Short Term Fund - Growth Option,11.8493
2006-09-01,101430,HDFC Regular Savings Fund-GROWTH,12.929
2006-09-01,101431,HDFC Regular Savings Fund-Monthly Dividend Option,10.358
2006-09-01,101455,Grindlays Government Securities Fund - IP (Growth),13.2243
2006-09-01,101456,Grindlays Government Securities Fund - ST (Growth),12.2494
2006-09-01,101458,Grindlays Government Securities Fund-IP(H.Yrly Dividend),10.2954
2006-09-01,101462,Principal Short Term Plan-Dividend,10.1334
2006-09-01,101463,Principal Short Term Plan-Growth,12.994
2006-09-01,101465,Principal Short Term Debt Fund- Growth Plan,12.0594
2006-09-01,101466,Principal Short Term Debt Fund - Income Distribution CUM Capital Withdrawal Option - Monthly,10.1709
2006-09-01,101467,Principal Income Fund - Short Term Plan-Institutional - Weekly Dividend Plan,10.9309
2006-09-01,101471,Tata Gilt Retirement Plan (28/2/2008) Growth,10.1511
2006-09-01,101472,Sundaram Equity Hybrid Fund Regular Plan - Income Distribution cum Capital Withdrawal (IDCW),14.1021
2006-09-01,101481,HDFC Floating Rate Debt Fund - Retail Growth Option,12.0771
2006-09-01,101482,HDFC Floating Rate Debt Fund - Retail Weekly Div Option,10.1428
2006-09-01,101483,HDFC Floating Rate Debt Fund - Retail Daily Div Option,10.0809
2006-09-01,101484,HDFC Floating Rate Debt Fund - Retail Monthly Div option,10.1515
2006-09-01,101489,Tata Young Citizen Fund [Upto 3 years] Regular Plan,19.9957
2006-09-01,101490,Tata Young Citizen Fund [>3 years upto 7 years] Regular Plan,19.9957
2006-09-01,101491,Tata Childrens Fund -Regular Plan-Growth Option,19.9957
2006-09-01,101498,Principal Equity Savings Fund - Growth Option,14.5613
2006-09-01,101499,Principal Equity Savings Fund - Half Yearly Income Distribution CUM Capital Withdrawal,10.4857
2006-09-01,101500,Principal Equity Savings Fund -Quaterly Income Distribution CUM Capital Withdrawal,10.6144
2006-09-01,101516,Grindlays Dynamic Bond Fund - GDBF (Quarterly Dividend),10.2672
2006-09-01,101519,JM Short Term Fund - Regular Plan - Dividend Option,10.9521
2006-09-01,101520,JM Short Term Fund - Regular Plan - Growth Option,12.8479
2006-09-01,101521,JM Short Term Fund - Growth Option,12.123
2006-09-01,101524,JM Short Term Fund - Dividend Option,10.3
2006-09-01,101525,HDFC Nifty 50 Index Fund - Growth Plan,33.692
2006-09-01,101528,Sahara Growth Fund-Growth,42.5037
2006-09-01,101529,Sahara Growth Fund-Dividend,21.5038
2006-09-01,101530,SBI Large & Midcap Fund - Regular Plan - Income Distribution cum Capital Withdrawal Option (IDCW),40.5
2006-09-01,101536,Sundaram Select Focus Regular Plan - Income Distribution cum Capital Withdrawal (IDCW),13.9712
2006-09-01,101537,Sundaram Select Focus Regular Plan - Growth,50.4632
2006-09-01,101538,Sundaram Mid Cap Fund Regular Plan - Income Distribution cum Capital Withdrawal (IDCW),19.0702
2006-09-01,101539,Sundaram Mid Cap Fund Regular Plan - Growth,77.9728
2006-09-01,101544,Sundaram Short Term Credit Risk Fund -Dividend,10.2773
2006-09-01,101545,Sundaram Short Term Credit Risk Fund-Appreciation,12.4787
2006-09-01,101547,Tata Short Term Bond Fund- Regular Plan - Monthly Payout of IDCW Option,10.9554
2006-09-01,101548,Tata Short Term Bond Fund -Regular Plan- Growth Option,12.755
2006-09-01,101549,JM Liquid Fund (Regular) - Bonus Option - Principal Units,12.3292
2006-09-01,101550,ING Short Term Income Fund -Dividend Option,11.1442
2006-09-01,101551,SBI Equity Hybrid Fund - Regular Plan - Income Distribution cum Capital Withdrawal Option (IDCW),22.48
2006-09-01,101560,Sundaram Short Term Debt Fund Regular Plan -Income Distribution cum Capital Withdrawal ( IDCW ),10.1834
2006-09-01,101561,Sundaram Short Term Debt Fund Regular Plan- Income Distribution cum Capital Withdrawal (IDCW ),10.183
2006-09-01,101562,Sundaram Short Term Debt Fund Regular Plan- Income Distribution cum Capital Withdrawal (IDCW),10.1871
2006-09-01,101563,Sundaram Short Term Debt Fund Regular Plan - Growth,12.539
2006-09-01,101564,Sundaram Short Term Debt Fund Regular Plan - Weekly Income Distribution cum Capital Withdrawal (IDCW),10.9416
2006-09-01,101565,Sundaram Short Term Debt Fund Regular Plan - Fortnightly Income Distribution cum Capital Withdrawal (IDCW),10.5863
