date,scheme_code,scheme_name,nav
2006-09-01,100027,Grindlays Super Saver Income Fund-GSSIF-Half Yearly Dividend,10.2971
2006-09-01,100028,Grindlays Super Saver Income Fund-GSSIF-Quaterly Dividend,10.2012
2006-09-01,100029,Grindlays Super Saver Income Fund-GSSIF-Growth,16.4053
2006-09-01,100030,Grindlays Super Saver Income Fund-GSSIF-Annual Dividend,10.3102
2006-09-01,100031,Grindlays Super Saver Income Fund-GSSIF - ST-Dividend,10.0168
2006-09-01,100032,Grindlays Super Saver Income Fund-GSSIF - ST-Growth,14.3166
2006-09-01,100033,Aditya Birla Sun Life Large & Mid Cap Fund - Regular Growth,106.31
2006-09-01,100034,Aditya Birla Sun Life Large & Mid Cap Fund -Regular - IDCW,76.27
2006-09-01,100035,Birla Sun Life Freedom Fund-Plan A (Dividend),16.49
2006-09-01,100036,Birla Sun Life Freedom Fund-Plan B (Growth),24.8
2006-09-01,100037,Aditya Birla Sun Life Income Fund - Regular - Quarterly IDCW,10.2413
2006-09-01,100038,Aditya Birla Sun Life Income Fund - Growth - Regular Plan,29.6768
2006-09-01,100041,Aditya Birla Sun Life Liquid Fund -Institutional - IDCW,10.8023
2006-09-01,100042,Aditya Birla Sun Life Liquid Fund-Retail (Growth),19.336
2006-09-01,100043,Aditya Birla Sun Life Liquid Fund-Institutional (Growth),19.4606
2006-09-01,100044,Aditya Birla Sun Life Liquid Fund -Retail - IDCW,16.3694
2006-09-01,100046,Aditya Birla Sun Life Liquid Fund -Daily IDCW,10.0195
2006-09-01,100047,Aditya Birla Sun Life Liquid Fund - Growth,11.4163
2006-09-01,100048,Aditya Birla Sun Life Liquid Fund -Institutional - weekly  IDCW,10.8068
2006-09-01,100049,Aditya Birla Sun Life Cash Plus-Institutional - Fortnightly Dividend,10.8345
2006-09-01,100051,Aditya Birla Sun Life Liquid Fund -weekly IDCW,10.0225
2006-09-01,100052,Aditya Birla Sun Life Cash Plus-Institutional Premium - Fortnightly Dividend,10.0715
2006-09-01,100053,Aditya Birla Sun Life Cash Plus-Institutional Premium Plan-Monthly Dividend,10.0019
2006-09-01,100054,Aditya Birla Sun Life Gilt Plus - Liquid Plan - Quarterly Dividend - Regular Plan,10.6961
2006-09-01,100055,Aditya Birla Sun Life Gilt Plus - Liquid Plan - Growth - Regular Plan,17.4608
2006-09-01,100056,Aditya Birla Sun Life Gilt Plus - Liquid Plan - Annual Dividend - Regular Plan,11.6271
2006-09-01,100057,Aditya Birla Sun Life Govenment Securities Fund -Regular - Quarterly IDCW,10.586
2006-09-01,100058,Aditya Birla Sun Life Government Securities Fund  - Growth - Regular Plan,20.0011
2006-09-01,100059,Aditya Birla Sun Life Gilt Plus-PF Plan (Annual Dividend),20.002
2006-09-01,100060,Aditya Birla Sun Life Constant Maturity 10 Year Gilt Fund - Quarterly Dividend - Regular Plan,11.0319
2006-09-01,100061,Aditya Birla Sun Life Constant Maturity 10 Year Gilt Fund - Growth - Regular Plan,22.2383
2006-09-01,100062,Aditya Birla Sun Life Gilt Plus-Regular Plan (Annual Dividend),22.2838
2006-09-01,100063,Aditya Birla Sun Life MNC Fund - Regular - IDCW,53.57
2006-09-01,100064,Aditya Birla Sun Life MNC Fund - Growth - Regular Plan,106.86
2006-09-01,100065,Aditya Birla Sun Life India Opportunities Fund - Dividend - Regular Plan,18.82
2006-09-01,100066,Aditya Birla Sun Life India Opportunities Fund - Growth - Regular Plan,43.81
2006-09-01,100067,Aditya Birla Sun Life Tax Plan -Regular - IDCW,48.33
2006-09-01,100068,BARODA ELSS 96 - Plan A - IDCW,22.34
2006-09-01,100069,BARODA PIONEER DIVERSIFIED FUND,28.23
2006-09-01,100077,DSP Bond Fund - IDCW,11.1615
2006-09-01,100078,DSP Bond Fund - Growth,24.2896
2006-09-01,100079,DSP Bond Fund - IDCW - Monthly,10.436
2006-09-01,100080,DSP Flexi Cap Fund - Regular Plan - IDCW,37.95
2006-09-01,100081,DSP Aggressive Hybrid Fund- Regular Plan - Growth,33.93
2006-09-01,100082,DSP Aggressive Hybrid Fund- Regular Plan - IDCW,19.68
2006-09-01,100084,DSP Gilt Fund - Regular Plan - Growth,22.5617
2006-09-01,100085,DSP Gilt Fund - Regular Plan - IDCW,11.5414
2006-09-01,100086,DSP Gilt Fund - Regular Plan - IDCW - Monthly,10.1369
2006-09-01,100087,DSP Savings Fund - Regular Plan - Growth,16.4076
2006-09-01,100088,DSP Savings Fund - Regular Plan - IDCW,11.1711
2006-09-01,100089,DSP Savings Fund - Regular Plan - IDCW - Monthly,10.0729
2006-09-01,100090,DSP BlackRock Technology.com   Fund - Regular Plan - Growth,17.24
2006-09-01,100119,HDFC Balanced Advantage Fund - Growth Plan,40.931
2006-09-01,100120,HDFC Balanced Advantage Fund - IDCW Plan,25.171
2006-09-01,100121,HDFC Balanced Fund - Dividend Option,18.642
2006-09-01,100122,HDFC Balanced Fund - Growth Option,28.99
2006-09-01,100123,HDFC Income Fund - Quarterly IDCW Option,10.2606
2006-09-01,100124,HDFC Income Fund - Growth Option,16.4159
2006-09-01,100136,Principal Deposit Fund-Plan 54EA/EB-Plan 54EA /EB,17.3985
2006-09-01,100150,Principal Child Benefit Fund-Super Saver-Future Guard Plan,43.58
2006-09-01,100151,Principal Retail Equity Savings Fund - Growth Option,44.16
2006-09-01,100152,Principal Nifty 100 Equal Weight Fund-Income Distribution CUM Capital Withdrawal,19.2725
2006-09-01,100153,Principal Nifty 100 Equal Weight Fund-Growth,24.9205
2006-09-01,100156,Principal Tax Savings Fund,64.71
2006-09-01,100171,Quant Dynamic Bond-Dividend,10.0765
2006-09-01,100172,Quant Dynamic Bond-Growth,22.1274
2006-09-01,100173,Quant Dynamic Bond-Bonus,11.654
2006-09-01,100174,quant ELSS Tax Saver Fund - IDCW Option - Regular Plan,13.1546
2006-09-01,100175,quant ELSS Tax Saver Fund - Growth Option - Regular Plan,37.367
2006-09-01,100176,quant Small Cap Fund - IDCW Option - Regular Plan,15.5553
2006-09-01,100177,quant Small Cap Fund - Growth - Regular Plan,18.4266
2006-09-01,100178,ING Income Fund-Regular Plan -Dividend Option (Quarterly),10.1923
2006-09-01,100179,ING Income Fund-Regular Plan -Dividend Option (Half Yearly),10.3118
2006-09-01,100180,ING Income Fund- Regular Plan - Dividend Option (Annual),10.4469
2006-09-01,100181,ING Income Fund-Regular Plan -Growth Option,17.7587
2006-09-01,100182,ING Income Fund-Institutional Plan - Dividend Option (Half Yearly),10.0
2006-09-01,100183,ING Income Fund-Institutional Plan - Dividend Option (Quarterly),10.0
2006-09-01,100184,ING Income Fund-Institutional Plan -Dividend Option (Annual),10.4273
2006-09-01,100185,ING Income Fund-Bonus Option,10.828
2006-09-01,100186,ING Income Fund-Institutional Bonus Option,11.0128
2006-09-01,100187,ING Income Fund-Institutional Plan - Growth Option,18.3967
2006-09-01,100188,ING Core Equity Fund-Dividend Option,12.54
2006-09-01,100189,ING Core Equity Fund-Growth Option,23.7
2006-09-01,100190,ING Liquid Fund-Regular Growth Option,15.2362
2006-09-01,100191,ING Liquid Fund-Regular Weekly Dividend Option,10.8318
2006-09-01,100192,ING Liquid Fund-Regular Daily Dividend Option,10.7849
2006-09-01,100194,ING Liquid Fund-Auto Sweep Growth Option,10.0
2006-09-01,100195,ING Liquid Fund-Auto Sweep Weekly Dividend Option,10.0
2006-09-01,100196,ING Liquid Fund-Institutional Growth Option,11.2832
2006-09-01,100197,ING Liquid Fund-Institutional Weekly Dividend Option,10.0612
2006-09-01,100198,ING Liquid Fund-Institutional Daily Dividend Option,10.0103
2006-09-01,100199,ING Liquid Fund-Super Institutional Growth Option,10.6744
2006-09-01,100200,ING Liquid Fund-Super Institutional Daily Dividend Option,10.0024
2006-09-01,100201,ING Liquid Fund-Super Institutional Weekly Dividend Option,10.0917
2006-09-01,100202,ING Balanced Fund-Dividend Option,11.37
2006-09-01,100203,ING Balanced Fund-Growth Option,16.25
2006-09-01,100218,JM Large Cap Fund (Regular) - IDCW,14.84
2006-09-01,100219,JM Large Cap Fund (Regular) - Growth Option,33.03
2006-09-01,100220,JM Aggressive Hybrid Fund (Regular) - IDCW,15.21
2006-09-01,100221,JM Aggressive Hybrid Fund (Regular) -Growth Option,20.02
2006-09-01,100222,JM Medium to Long Duration Fund (Regular) - Quarterly IDCW,10.1487
2006-09-01,100223,JM Medium to Long Duration Fund (Regular) - Growth Option,28.1315
2006-09-01,100233,JM Liquid Fund (Regular) - Weekly IDCW,10.3458
2006-09-01,100234,JM Liquid Fund - Growth Option,19.7288
2006-09-01,100237,JM High Liquidity Fund-- Institutional Plan - Growth,11.9021
2006-09-01,100238,JM High Liquidity Fund-Institutional Plan - Daily Dividend,10.0159
2006-09-01,100241,JM High Liquidity Fund-- Institutional Plan - Dividend,10.1117
2006-09-01,100243,JM High Liquidity Fund-- Premium Plan - Daily Dividend Option,10.0
2006-09-01,100244,JM Liquid Fund (Regular) - Quarterly IDCW,11.3587
2006-09-01,100245,JM High Liquidity Fund-Super Institutional Plan- Daily Dividend,10.0165
2006-09-01,100246,JM High Liquidity Fund-Super Institutional Plan- Weekly  Dividend,10.0993
2006-09-01,100247,JM Liquid Fund (Regular) - Super Institutional Plan - Growth Option,11.3175
2006-09-01,100249,JM G-Sec Fund - Quarterly Dividend Option,10.1526
2006-09-01,100250,JM G-Sec Fund - Growth Option,20.7667
2006-09-01,100251,JM G-Sec Fund-PF Plan - Growth Plan,21.6171
2006-09-01,100252,JM G-Sec Fund-PF Plan -Dividend Plan,19.8078
2006-09-01,100253,JM G-Sec Fund - Bonus Option - Principal Units,10.1018
2006-09-01,100254,JM Value Fund (Regular) - Growth Option,15.67
2006-09-01,100261,Kotak Gilt-Savings-Monthly Dividend,10.4678
2006-09-01,100262,Kotak Gilt-Savings-Growth,17.6301
2006-09-01,100263,Kotak Gilt-Savings-Annual Dividend,11.7897
2006-09-01,100264,Kotak Gilt-Investment Regular-Payout of Income Distribution cum capital withdrawal option,11.1317
2006-09-01,100265,Kotak Gilt-Investment Regular-Growth,23.1435
2006-09-01,100280,Kotak Gilt-Investment  Provident Fund and Trust-Payout of Income Distribution cum capital withdrawal option,11.0148
2006-09-01,100281,Kotak Gilt-Investment  Provident Fund and Trust-Growth,23.3935
2006-09-01,100286,Kotak Aggressive Hybrid Fund - Regular Plan - IDCW - Payout & Reinvestment of Income Distribution cum capital withdrawal option,22.325
2006-09-01,100289,Kotak Tech,8.477
2006-09-01,100290,Kotak MNC,24.24
2006-09-01,100291,Kotak Bond-Deposit-Dividend,11.4691
2006-09-01,100292,Kotak Bond-Deposit-Growth,18.1471
2006-09-01,100298,Kotak Bond Regular Plan Quaterly Payout of Income Distribution cum capital withdrawal option,10.5191
2006-09-01,100299,Kotak Bond Fund - Regular Plan Growth,18.9008
2006-09-01,100300,Kotak Bond Fund - Regular Plan - Standard IDCW Option,12.6317
2006-09-01,100301,Kotak Bond Regular Plan Bonus Plan,12.5983
2006-09-01,100312,LIC MF Flexi Cap Fund-Regular Plan-IDCW,12.1916
2006-09-01,100313,LIC MF Flexi Cap Fund-Regular Plan-Growth,17.861
2006-09-01,100314,LIC MF Medium to Long Duration Fund-Regular Plan-IDCW,10.5599
2006-09-01,100315,LIC MF Medium to Long Duration Fund-Regular Plan-Growth,19.6944
2006-09-01,100316,LIC MF Gilt Fund-Regular Plan-IDCW,10.7265
2006-09-01,100317,LIC MF Gilt Fund-Regular Plan-Growth,18.4562
2006-09-01,100318,LIC MF Gilt Fund-PF Plan-IDCW,10.6426
2006-09-01,100319,LIC MF Gilt Fund-PF Plan-Growth,10.6426
2006-09-01,100321,LIC MF Aggressive Hybrid Fund-Regular Plan-IDCW,11.8822
2006-09-01,100323,LIC MF Aggressive Hybrid Fund-Regular Plan-Growth,40.492
2006-09-01,100325,LIC MF ULIS (5 Yrs. Single Premium)-Regular Plan-IDCW Reinvestment,12.2868
2006-09-01,100332,LIC MF Large Cap Fund-Regular Plan-IDCW,9.4701
2006-09-01,100337,SaharaTax Gain-Dividend,15.9582
2006-09-01,100338,SaharaTax Gain-Growth,18.2649
2006-09-01,100347,Morgan Stanley Growth Fund- Regular Growth Plan,45.12
2006-09-01,100348,ICICI Prudential Large & Mid Cap Fund - IDCW,22.03
2006-09-01,100349,ICICI Prudential Large & Mid Cap Fund - Growth,80.97
2006-09-01,100350,ICICI Prudential Large & Mid Cap Fund - Institutional Option - I - Growth,10.69
2006-09-01,100351,ICICI Prudential FMCG Fund - IDCW,30.88
2006-09-01,100352,ICICI Prudential FMCG Fund - Growth,36.82
2006-09-01,100353,ICICI Prudential ELSS Tax Saver Fund - IDCW,27.67
2006-09-01,100354,ICICI Prudential ELSS Tax Saver Fund - Growth,86.18
2006-09-01,100355,ICICI Prudential Equity & Debt Fund - Monthly IDCW,17.11
2006-09-01,100356,ICICI Prudential Equity & Debt Fund - Growth,30.58
2006-09-01,100357,ICICI Prudential Liquid Fund -Quarterly IDCW,10.8385
2006-09-01,100359,ICICI Prudential Liquid Institutional Plus Fund - Div - Daily,11.8515
2006-09-01,100360,ICICI Prudential Liquid Institutional Plus Fund - Div - Weekly,11.8619
2006-09-01,100361,ICICI Prudential Liquid Fund-Dividend-Institutional Plus - Monthly,11.9191
2006-09-01,100362,ICICI Prudential Liquid Institutional Plus Fund - Growth,17.8337
2006-09-01,100363,ICICI Prudential Technology Fund - Growth,10.95
2006-09-01,100364,ICICI Prudential Long Term Bond Fund - Half Yearly IDCW,10.5183
2006-09-01,100365,ICICI Prudential Long Term Bond Fund - Growth,20.8969
2006-09-01,100366,ICICI Prudential Long Term Bond Fund-Institutional Quarterly Dividend,10.0908
2006-09-01,100367,ICICI Prudential Long Term Bond Fund - Quarterly IDCW,10.9785
2006-09-01,100368,ICICI Prudential Gilt Fund - IDCW,10.4843
2006-09-01,100369,ICICI Prudential Gilt Fund - Growth,21.3624
2006-09-01,100370,ICICI Prudential Short Term Gilt Fund - Dividend,10.4583
2006-09-01,100371,ICICI Prudential Short Term Gilt Fund - Growth,17.524
2006-09-01,100372,ICICI Prudential Short Term Gilt Fund - Half Yearly Dividend,10.2052
2006-09-01,100375,NIPPON INDIA GROWTH MID CAP FUND - IDCW Option,48.82
2006-09-01,100376,Nippon India Growth Mid Cap Fund-Growth Plan-Bonus Option,36.17
2006-09-01,100377,Nippon India Growth Mid Cap Fund-Growth Plan-Growth Option,218.12
2006-09-01,100378,Nippon India Vision Large & Midcap Fund - IDCW Option,47.22
2006-09-01,100379,Nippon India Vision Large & Midcap Fund-GROWTH PLAN-Bonus Option,25.5
2006-09-01,100380,Nippon India Vision Large & Midcap Fund-GROWTH PLAN-Growth Option,152.2
2006-09-01,100381,UTI Large Cap Fund-Income Option,15.66
2006-09-01,100382,UTI Large Cap Fund-Growth Option,17.96
2006-09-01,100383,NIPPON INDIA MEDIUM TO LONG DURATION FUND - MONTHLY IDCW Option,10.9859
2006-09-01,100384,NIPPON INDIA MEDIUM TO LONG DURATION  FUND - QUARTERLY IDCW Option,11.5529
2006-09-01,100385,NIPPON INDIA MEDIUM TO LONG DURATION  FUND - HALF YEARLY IDCW Option,11.223
2006-09-01,100386,NIPPON INDIA MEDIUM TO LONG DURATION  FUND - ANNUAL IDCW Option,11.7025
2006-09-01,100387,Nippon India Medium to Long Duration  Fund - Growth Plan Growth Option,22.5307
2006-09-01,100388,Nippon India Medium to Long Duration  Fund - Growth Plan Bonus Option,10.616
2006-09-01,100414,Tata Aggressive Hybrid Fund- Regular Plan - Growth Option,42.7383
2006-09-01,100415,Tata Ethical Fund-Regular Plan - Growth Option,40.1912
2006-09-01,100416,Tata Long Term Debt Fund - Regular Plan - Quarterly Dividend,10.5417
2006-09-01,100417,Tata Income Fund-Regular Plan - Half Yearly Payout of IDCW Option,10.838
2006-09-01,100418,Tata Income Fund -Regular Plan - Growth Option,24.3073
2006-09-01,100470,Franklin India Large Cap Fund - IDCW,37.07
2006-09-01,100471,Franklin India Large Cap Fund-Growth,111.75
2006-09-01,100472,Franklin India Mid Cap Fund - IDCW,49.02
2006-09-01,100473,Franklin India Mid Cap Fund-Growth,176.04
2006-09-01,100474,Tata ELSS Fund- Regular Plan - Payout of IDCW Option,37.2002
2006-09-01,100475,Tata Large Cap Fund -Regular Plan - Growth Option,52.8025
2006-09-01,100476,Taurus Flexi Cap Fund - Regular Plan - Growth,32.17
2006-09-01,100477,Taurus Mid Cap Fund - Regular Plan - Growth,13.16
2006-09-01,100480,Taurus ELSS Tax Saver Fund - Regular Plan - Growth,15.91
2006-09-01,100481,Franklin India Balanced Fund-Growth,30.91
2006-09-01,100482,Franklin India Balanced Fund-Div,26.71
2006-09-01,100483,Franklin India Growth Fund,24.4
2006-09-01,100484,Franklin India Index Fund- NSE Nifty 50 Index Fund - Growth,27.2917
2006-09-01,100485,Franklin India Govt.Sec. Fund-Composite Plan - Growth,23.5583
2006-09-01,100486,Franklin India Govt.Sec. Fund-Composite Plan - Dividend,10.823
2006-09-01,100487,Franklin India Govt.Sec. Fund-Treasury Plan(Dividend Option),10.734
2006-09-01,100489,Franklin India Govt.Sec. Fund-Treasury Plan(Growth Option),13.5193
2006-09-01,100490,Franklin India Govt.Sec. Fund-PF Plan - Growth,10.3463
2006-09-01,100491,Franklin India Govt.Sec. Fund-PF Plan - Dividend,10.3463
2006-09-01,100493,Franklin India Government Securities Fund - Growth,15.9408
2006-09-01,100494,Franklin India Government Securities Fund - IDCW,11.0048
2006-09-01,100495,Franklin India Govt.Sec. Fund-Long Term Plan - Bonus,12.2941
2006-09-01,100496,Templeton India Value Fund - Growth Plan,58.04
2006-09-01,100497,Templeton India Value Fund - IDCW,37.95
2006-09-01,100498,Franklin India Dynamic Accrual Fund - IDCW,10.5579
2006-09-01,100499,Franklin India Dynamic Accrual Fund-Growth,25.0971
2006-09-01,100503,Franklin India Low Duration Fund - Monthly - IDCW,10.2165
2006-09-01,100504,Franklin India Low Duration Fund - Quarterly - IDCW,10.2954
2006-09-01,100505,Templeton Monthly Income Plan-Half Yearly Dividend,12.211
2006-09-01,100506,Templeton Monthly Income Plan-Growth,19.0518
2006-09-01,100519,Franklin India Flexi Cap Fund - IDCW,33.14
2006-09-01,100520,Franklin India Flexi Cap Fund - Growth,113.03
2006-09-01,100521,Franklin India Technology Fund - IDCW,22.19
2006-09-01,100522,Franklin India Technology Fund-Growth,44.94
2006-09-01,100523,Franklin FMCG Fund - Growth,34.9
2006-09-01,100524,Franklin INDIA OPPORTUNITIES FUND - IDCW,18.25
2006-09-01,100525,Franklin India ELSS Tax Saver Fund - IDCW,35.41
2006-09-01,100526,Franklin India ELSS Tax Saver Fund-Growth,112.29
2006-09-01,100527,Franklin India Corporate Debt Fund - Plan A - Annual - IDCW,10.3608
2006-09-01,100528,Franklin India Corporate Debt Fund - Growth,24.3054
2006-09-01,100529,Franklin India Corporate Debt Fund - Plan B - Monthly - IDCW,13.9301
2006-09-01,100530,Franklin India Corporate Debt Fund - Plan B - Quarterly - IDCW,14.0523
2006-09-01,100531,Franklin India Corporate Debt Fund - Plan B - Half yearly - IDCW,14.2411
2006-09-01,100532,Franklin India Corporate Debt Fund - Monthly Bonus,19.3639
2006-09-01,100535,Franklin India Retirement Fund - IDCW,17.4116
2006-09-01,100536,Franklin India Retirement Fund - Growth,39.8181
2006-09-01,100537,Franklin India Liquid Fund - Regular Plan - Weekly - IDCW,1245.4172
2006-09-01,100538,Franklin India Liquid Fund - Regular Plan - Growth,1788.5893
2006-09-01,100541,Franklin India Liquid Fund - Regular Plan - Daily - IDCW,1512.34
2006-09-01,100542,Franklin India Liquid Fund - Liquid Plan - Weekly Dividend,1001.4145
2006-09-01,100543,Franklin India Liquid Fund - Liquid Plan - Daily IDCW,1000.25
2006-09-01,100544,Franklin India Liquid Fund - Liquid Plan - Growth,1101.6347
2006-09-01,100546,Franklin India Liquid Fund - Super Institutional Plan - Growth,1061.1857
2006-09-01,100547,Franklin India Liquid Fund - Super Institutional Plan - Daily - IDCW,1000.25
2006-09-01,100548,Franklin India Liquid Fund - Super Institutional Plan - Weekly - IDCW,1017.0915
2006-09-01,100549,Franklin India Aggressive Hybrid Fund - IDCW,20.3811
2006-09-01,100550,Franklin India Aggressive Hybrid Fund - Growth Plan,28.6168
2006-09-01,100551,Templeton India Children’s Asset Plan-Education Plan,23.8406
2006-09-01,100552,Templeton India Children’s Asset Plan-Gift Plan - Growth,26.8523
2006-09-01,100553,Templeton India Children’s Asset Plan-Gift Plan - Dividend,26.8523
2006-09-01,100556,Franklin India Taxshield 97,106.59
2006-09-01,100557,Franklin India Taxshield 98,105.48
2006-09-01,100558,Franklin India Taxshield 99,62.12
2006-09-01,100561,Templeton India Money Market Account - Bonus Plan,1.0
2006-09-01,100563,DBS Chola Triple Ace-Regular -Cumulative,23.7762
2006-09-01,100567,DBS Chola Triple Ace-Regular - Quarterly Dividend,11.1949
2006-09-01,100569,DBS Chola Triple Ace-Semi Annual Dividend,11.5054
2006-09-01,100573,DBS Chola Triple Ace-Regular Bonus,13.211
2006-09-01,100574,DBS Chola Freedom Income -Short Term Fund-Regular-Monthly Dividend,10.9418
2006-09-01,100575,DBS Chola Freedom Income -Short Term Fund-Regular - Cumulative,11.374
2006-09-01,100576,DBS Chola Freedom Income -Short Term Fund-Cum- Institutional Plan,11.5093
2006-09-01,100579,DBS Chola Gilt-Investment-Quarterly Dividend,10.0017
2006-09-01,100580,DBS Chola Gilt-Investment-Cumulative,18.1843
2006-09-01,100589,Canara Robeco Expo-Income Plan,17.78
2006-09-01,100590,Canara Robeco Expo-Growth Plan,46.71
2006-09-01,100593,CANARA ROBECO ELSS TAX SAVER - REGULAR PLAN -IDCW (Payout),17.83
2006-09-01,100596,CANARA ROBECO GILT FUND - REGULAR PLAN - IDCW (Payout/Reinvestment),10.2881
2006-09-01,100597,CANARA ROBECO GILT FUND - REGULAR PLAN - GROWTH OPTION,18.0263
2006-09-01,100600,CANARA ROBECO CONSERVATIVE HYBRID FUND - REGULAR PLAN - MONTHLY IDCW (Payout/Reinvestment),11.42
2006-09-01,100601,CANARA ROBECO CONSERVATIVE HYBRID FUND - REGULAR PLAN - GROWTH OPTION,17.75
2006-09-01,100602,Sundaram Medium Duration Fund (Formerly Known as Sundaram Medium Term Bond Fund) Regular Plan-Income Distribution cum Capital Withdrawal(IDCW),10.2232
2006-09-01,100603,Sundaram Medium Duration Fund (Formerly Known as Sundaram Medium Term Bond Fund) Regular Plan - Growth,22.2368
2006-09-01,100604,Sundaram Medium Duration Fund (Formerly Known as Sundaram Medium Term Bond Fund) Regular Plan -Growth,11.7092
2006-09-01,100609,Sundaram Medium Duration Fund (Formerly Known as Sundaram Medium Term Bond Fund) Regular Plan- Income Distribution cum Capital Withdrawal(IDCW),10.2169
2006-09-01,100610,Sundaram Medium Duration Fund (Formerly Known as Sundaram Medium Term Bond Fund) Regular Plan -Income Distribution cum Capital Withdrawal (IDCW),10.2221
2006-09-01,100611,Sundaram Medium Duration Fund (Formerly Known as Sundaram Medium Term Bond Fund) Institutional Plan -Growth,11.3454
2006-09-01,100612,Sundaram Growth Fund-Dividend,12.7444
2006-09-01,100613,Sundaram Growth Fund-Growth,58.2759
2006-09-01,100614,Sundaram Value Fund Regular Plan - Income Distribution cum Capital Withdrawal (IDCW),14.5291
2006-09-01,100617,Sundaram Equity Hybrid Fund Regular Plan - Growth,28.8028
2006-09-01,100618,Sundaram Money Fund Retail Plan - Growth,15.0882
2006-09-01,100619,Sundaram Money Fund Retail Plan - Quarterly Reinvestment of Income Distribution cum Capital Withdrawal (IDCW),10.1123
2006-09-01,100620,Sundaram Money Fund Retail Plan - Daily Reinvestment of Income Distribution cum Capital Withdrawal (IDCW),10.0953
2006-09-01,100621,Sundaram Money Fund Retail Plan - Weekly Reinvestment of Income Distribution cum Capital Withdrawal (IDCW),10.2708
2006-09-01,100622,Sundaram Money Fund Retail Plan - Fortnightly Reinvestment of Income Distribution cum Capital Withdrawal (IDCW),10.1815
2006-09-01,100623,Sundaram Money Fund Retail Plan - Monthly Income Distribution cum Capital Withdrawal (IDCW),10.1062
2006-09-01,100630,quant Multi Cap Fund-IDCW Option - Regular Plan,14.3277
2006-09-01,100631,quant Multi Cap Fund-GROWTH OPTION - Regular Plan,48.6489
2006-09-01,100638,SBI Medium to Long Duration Fund - Regular Plan - Half Yearly - Income Distribution cum Capital Withdrawal Option (IDCW),10.3224
2006-09-01,100639,SBI Medium to Long Duration Fund-REGULAR PLAN-Growth,19.3265
2006-09-01,100640,SBI Medium to Long Duration Fund-REGULAR PLAN-Bonus,11.7069
2006-09-01,100641,SBI ULTRA SHORT DURATION FUND - REGULAR PLAN - GROWTH,16.1241
2006-09-01,100643,SBI Technology Opportunities Fund - Regular Plan - Income Distribution cum Capital Withdrawal Option (IDCW),20.03
2006-09-01,100644,SBI Healthcare Opportunities Fund - Regular Plan - Income Distribution cum Capital Withdrawal Option (IDCW),27.63
2006-09-01,100645,SBI Consumption Opportunities Fund - Regular Plan - Income Distribution cum Capital Withdrawal Option (IDCW),14.36
2006-09-01,100646,UTI - Unit Linked Insurance Plan,14.8548
2006-09-01,100648,UTI - CRTS 81 - Dividend Option,111.8035
2006-09-01,100650,UTI Large Cap Fund - Regular Plan - IDCW,26.73
2006-09-01,100651,UTI Large Cap Fund - Regular Plan - Growth Option,29.9
2006-09-01,100656,UTI - Master Plus Unit Scheme-Growth Option,54.64
2006-09-01,100657,UTI - Master Plus Unit Scheme-Income Option,48.55
2006-09-01,100663,UTI Large & Mid Cap Fund - Regular Plan - IDCW,35.61
2006-09-01,100664,UTI Large & Mid Cap Fund - Regular Plan - Growth Option,38.63
2006-09-01,100668,UTI Flexi Cap Fund - Regular Plan - IDCW,26.84
2006-09-01,100669,UTI - Flexi Cap Fund-Growth Option,29.07
2006-09-01,100678,UTI Children's Hybrid Fund - Regular Plan,14.1187
2006-09-01,100682,UTI Retirement Fund - Regular Plan,19.1698
2006-09-01,100684,UTI Aggressive Hybrid Fund - Regular Plan - Growth,50.49
2006-09-01,100685,UTI Aggressive Hybrid Fund - Regular Plan - IDCW,19.96
2006-09-01,100711,UTI - INDEX SELECT FUND-Income Option,30.56
2006-09-01,100712,UTI - INDEX SELECT FUND-Growth Option,30.56
2006-09-01,100715,DBS Chola Multi-Cap Fund-Dividend Option,12.67
2006-09-01,100716,DBS Chola Multi-Cap Fund-Cumulative Option,15.89
2006-09-01,100723,UTI MMF-Discontinued - Regular Plan -Growth,20.1516
2006-09-01,100724,UTI MMF- Discontinued - Regular Plan - Flexi Dividend Option,17.5681
2006-09-01,100725,UTI MMF- Discontinued - Regular Plan - Periodic Dividend Option,17.4398
2006-09-01,100739,UTI MNC Fund - Regular Plan - IDCW,26.37
2006-09-01,100740,UTI - MNC Fund - Regular Plan - Growth Option,31.75
2006-09-01,100741,UTI Medium to Long Duration Fund- Regular Plan - Growth,21.1273
2006-09-01,100742,UTI Medium to Long Duration Fund - Regular Plan - Quarterly IDCW,10.9297
2006-09-01,100748,UTI - Master Index Fund-Income Option,37.0544
2006-09-01,100749,UTI - Master Index Fund-Growth Option,37.0543
2006-09-01,100750,UTI - Master Value Fund-Income Option,17.15
2006-09-01,100751,UTI - Master Value Fund-Growth Option,26.27
2006-09-01,100780,Sundaram Banking & PSU Fund (Formerly Known as Sundaram Banking and PSU Debt Fund) Retail Plan - Monthly Income Distribution cum Capital Withdrawal (IDCW),10.1572
2006-09-01,100781,Sundaram Banking & PSU Fund (Formerly Known as Sundaram Banking and PSU Debt Fund) Retail Plan - Growth,10.9186
2006-09-01,100782,Sundaram Banking & PSU Fund (Formerly Known as Sundaram Banking and PSU Debt Fund) Regular Plan - Daily Reinvestment of Income Distribution cum Capital Withdrawal (IDCW),10.0519
2006-09-01,100784,Sundaram Banking & PSU Fund (Formerly Known as Sundaram Banking and PSU Debt Fund) Regular Plan - Growth,11.0118
