date,scheme_code,scheme_name,nav
2006-09-27,100027,Grindlays Super Saver Income Fund-GSSIF-Half Yearly Dividend,10.372
2006-09-27,100028,Grindlays Super Saver Income Fund-GSSIF-Quaterly Dividend,10.2754
2006-09-27,100029,Grindlays Super Saver Income Fund-GSSIF-Growth,16.5245
2006-09-27,100030,Grindlays Super Saver Income Fund-GSSIF-Annual Dividend,10.3851
2006-09-27,100031,Grindlays Super Saver Income Fund-GSSIF - ST-Dividend,10.0617
2006-09-27,100032,Grindlays Super Saver Income Fund-GSSIF - ST-Growth,14.3805
2006-09-27,100033,Aditya Birla Sun Life Large & Mid Cap Fund - Regular Growth,111.1
2006-09-27,100034,Aditya Birla Sun Life Large & Mid Cap Fund -Regular - IDCW,79.7
2006-09-27,100035,Birla Sun Life Freedom Fund-Plan A (Dividend),17.22
2006-09-27,100036,Birla Sun Life Freedom Fund-Plan B (Growth),25.9
2006-09-27,100037,Aditya Birla Sun Life Income Fund - Regular - Quarterly IDCW,10.1883
2006-09-27,100038,Aditya Birla Sun Life Income Fund - Growth - Regular Plan,29.8816
2006-09-27,100041,Aditya Birla Sun Life Liquid Fund -Institutional - IDCW,10.8023
2006-09-27,100042,Aditya Birla Sun Life Liquid Fund-Retail (Growth),19.4253
2006-09-27,100043,Aditya Birla Sun Life Liquid Fund-Institutional (Growth),19.552
2006-09-27,100044,Aditya Birla Sun Life Liquid Fund -Retail - IDCW,16.3694
2006-09-27,100046,Aditya Birla Sun Life Liquid Fund -Daily IDCW,10.0195
2006-09-27,100047,Aditya Birla Sun Life Liquid Fund - Growth,11.472
2006-09-27,100048,Aditya Birla Sun Life Liquid Fund -Institutional - weekly  IDCW,10.817
2006-09-27,100049,Aditya Birla Sun Life Cash Plus-Institutional - Fortnightly Dividend,10.8312
2006-09-27,100051,Aditya Birla Sun Life Liquid Fund -weekly IDCW,10.0323
2006-09-27,100052,Aditya Birla Sun Life Cash Plus-Institutional Premium - Fortnightly Dividend,10.0683
2006-09-27,100053,Aditya Birla Sun Life Cash Plus-Institutional Premium Plan-Monthly Dividend,10.0506
2006-09-27,100054,Aditya Birla Sun Life Gilt Plus - Liquid Plan - Quarterly Dividend - Regular Plan,10.6367
2006-09-27,100055,Aditya Birla Sun Life Gilt Plus - Liquid Plan - Growth - Regular Plan,17.5659
2006-09-27,100056,Aditya Birla Sun Life Gilt Plus - Liquid Plan - Annual Dividend - Regular Plan,11.6971
2006-09-27,100057,Aditya Birla Sun Life Govenment Securities Fund -Regular - Quarterly IDCW,10.6247
2006-09-27,100058,Aditya Birla Sun Life Government Securities Fund  - Growth - Regular Plan,20.3418
2006-09-27,100059,Aditya Birla Sun Life Gilt Plus-PF Plan (Annual Dividend),20.3427
2006-09-27,100060,Aditya Birla Sun Life Constant Maturity 10 Year Gilt Fund - Quarterly Dividend - Regular Plan,11.0969
2006-09-27,100061,Aditya Birla Sun Life Constant Maturity 10 Year Gilt Fund - Growth - Regular Plan,22.6907
2006-09-27,100062,Aditya Birla Sun Life Gilt Plus-Regular Plan (Annual Dividend),22.7371
2006-09-27,100063,Aditya Birla Sun Life MNC Fund - Regular - IDCW,56.09
2006-09-27,100064,Aditya Birla Sun Life MNC Fund - Growth - Regular Plan,111.89
2006-09-27,100065,Aditya Birla Sun Life India Opportunities Fund - Dividend - Regular Plan,19.45
2006-09-27,100066,Aditya Birla Sun Life India Opportunities Fund - Growth - Regular Plan,45.28
2006-09-27,100067,Aditya Birla Sun Life Tax Plan -Regular - IDCW,51.71
2006-09-27,100068,BARODA ELSS 96 - Plan A - IDCW,22.82
2006-09-27,100069,BARODA PIONEER DIVERSIFIED FUND,28.71
2006-09-27,100077,DSP Bond Fund - IDCW,11.238
2006-09-27,100078,DSP Bond Fund - Growth,24.456
2006-09-27,100079,DSP Bond Fund - IDCW - Monthly,10.5075
2006-09-27,100080,DSP Flexi Cap Fund - Regular Plan - IDCW,39.55
2006-09-27,100081,DSP Aggressive Hybrid Fund- Regular Plan - Growth,35.03
2006-09-27,100082,DSP Aggressive Hybrid Fund- Regular Plan - IDCW,20.32
2006-09-27,100084,DSP Gilt Fund - Regular Plan - Growth,22.8729
2006-09-27,100085,DSP Gilt Fund - Regular Plan - IDCW,11.6998
2006-09-27,100086,DSP Gilt Fund - Regular Plan - IDCW - Monthly,10.2754
2006-09-27,100087,DSP Savings Fund - Regular Plan - Growth,16.5554
2006-09-27,100088,DSP Savings Fund - Regular Plan - IDCW,11.2713
2006-09-27,100089,DSP Savings Fund - Regular Plan - IDCW - Monthly,10.1605
2006-09-27,100090,DSP BlackRock Technology.com   Fund - Regular Plan - Growth,17.98
2006-09-27,100119,HDFC Balanced Advantage Fund - Growth Plan,42.977
2006-09-27,100120,HDFC Balanced Advantage Fund - IDCW Plan,26.429
2006-09-27,100121,HDFC Balanced Fund - Dividend Option,19.252
2006-09-27,100122,HDFC Balanced Fund - Growth Option,29.938
2006-09-27,100123,HDFC Income Fund - Quarterly IDCW Option,10.2119
2006-09-27,100124,HDFC Income Fund - Growth Option,16.5205
2006-09-27,100136,Principal Deposit Fund-Plan 54EA/EB-Plan 54EA /EB,17.4648
2006-09-27,100150,Principal Child Benefit Fund-Super Saver-Future Guard Plan,45.92
2006-09-27,100151,Principal Retail Equity Savings Fund - Growth Option,46.53
2006-09-27,100152,Principal Nifty 100 Equal Weight Fund-Income Distribution CUM Capital Withdrawal,20.1185
2006-09-27,100153,Principal Nifty 100 Equal Weight Fund-Growth,26.0126
2006-09-27,100156,Principal Tax Savings Fund,67.68
2006-09-27,100171,Quant Dynamic Bond-Dividend,10.0885
2006-09-27,100172,Quant Dynamic Bond-Growth,22.2307
2006-09-27,100173,Quant Dynamic Bond-Bonus,11.7084
2006-09-27,100174,quant ELSS Tax Saver Fund - IDCW Option - Regular Plan,13.8392
2006-09-27,100175,quant ELSS Tax Saver Fund - Growth Option - Regular Plan,39.3171
2006-09-27,100176,quant Small Cap Fund - IDCW Option - Regular Plan,15.9504
2006-09-27,100177,quant Small Cap Fund - Growth - Regular Plan,18.8946
2006-09-27,100178,ING Income Fund-Regular Plan -Dividend Option (Quarterly),10.1365
2006-09-27,100179,ING Income Fund-Regular Plan -Dividend Option (Half Yearly),10.1565
2006-09-27,100180,ING Income Fund- Regular Plan - Dividend Option (Annual),10.4922
2006-09-27,100181,ING Income Fund-Regular Plan -Growth Option,17.8357
2006-09-27,100182,ING Income Fund-Institutional Plan - Dividend Option (Half Yearly),10.0
2006-09-27,100183,ING Income Fund-Institutional Plan - Dividend Option (Quarterly),10.0
2006-09-27,100184,ING Income Fund-Institutional Plan -Dividend Option (Annual),10.4803
2006-09-27,100185,ING Income Fund-Bonus Option,10.8749
2006-09-27,100186,ING Income Fund-Institutional Bonus Option,11.0688
2006-09-27,100187,ING Income Fund-Institutional Plan - Growth Option,18.4903
2006-09-27,100188,ING Core Equity Fund-Dividend Option,13.07
2006-09-27,100189,ING Core Equity Fund-Growth Option,24.71
2006-09-27,100190,ING Liquid Fund-Regular Growth Option,15.3058
2006-09-27,100191,ING Liquid Fund-Regular Weekly Dividend Option,10.828
2006-09-27,100192,ING Liquid Fund-Regular Daily Dividend Option,10.7849
2006-09-27,100194,ING Liquid Fund-Auto Sweep Growth Option,10.0
2006-09-27,100195,ING Liquid Fund-Auto Sweep Weekly Dividend Option,10.0
2006-09-27,100196,ING Liquid Fund-Institutional Growth Option,11.3368
2006-09-27,100197,ING Liquid Fund-Institutional Weekly Dividend Option,10.0575
2006-09-27,100198,ING Liquid Fund-Institutional Daily Dividend Option,10.0103
2006-09-27,100199,ING Liquid Fund-Super Institutional Growth Option,10.7262
2006-09-27,100200,ING Liquid Fund-Super Institutional Daily Dividend Option,10.0024
2006-09-27,100201,ING Liquid Fund-Super Institutional Weekly Dividend Option,10.088
2006-09-27,100202,ING Balanced Fund-Dividend Option,11.78
2006-09-27,100203,ING Balanced Fund-Growth Option,16.83
2006-09-27,100218,JM Large Cap Fund (Regular) - IDCW,15.29
2006-09-27,100219,JM Large Cap Fund (Regular) - Growth Option,34.03
2006-09-27,100220,JM Aggressive Hybrid Fund (Regular) - IDCW,15.78
2006-09-27,100221,JM Aggressive Hybrid Fund (Regular) -Growth Option,20.76
2006-09-27,100222,JM Medium to Long Duration Fund (Regular) - Quarterly IDCW,10.194
2006-09-27,100223,JM Medium to Long Duration Fund (Regular) - Growth Option,28.257
2006-09-27,100233,JM Liquid Fund (Regular) - Weekly IDCW,10.3498
2006-09-27,100234,JM Liquid Fund - Growth Option,19.8229
2006-09-27,100237,JM High Liquidity Fund-- Institutional Plan - Growth,11.9588
2006-09-27,100238,JM High Liquidity Fund-Institutional Plan - Daily Dividend,10.0159
2006-09-27,100241,JM High Liquidity Fund-- Institutional Plan - Dividend,10.1156
2006-09-27,100243,JM High Liquidity Fund-- Premium Plan - Daily Dividend Option,10.0
2006-09-27,100244,JM Liquid Fund (Regular) - Quarterly IDCW,11.4128
2006-09-27,100245,JM High Liquidity Fund-Super Institutional Plan- Daily Dividend,10.0165
2006-09-27,100246,JM High Liquidity Fund-Super Institutional Plan- Weekly  Dividend,10.1032
2006-09-27,100247,JM Liquid Fund (Regular) - Super Institutional Plan - Growth Option,11.3714
2006-09-27,100249,JM G-Sec Fund - Quarterly Dividend Option,10.1664
2006-09-27,100250,JM G-Sec Fund - Growth Option,20.795
2006-09-27,100251,JM G-Sec Fund-PF Plan - Growth Plan,21.6363
2006-09-27,100252,JM G-Sec Fund-PF Plan -Dividend Plan,19.8254
2006-09-27,100253,JM G-Sec Fund - Bonus Option - Principal Units,10.1155
2006-09-27,100254,JM Value Fund (Regular) - Growth Option,16.59
2006-09-27,100261,Kotak Gilt-Savings-Monthly Dividend,10.4615
2006-09-27,100262,Kotak Gilt-Savings-Growth,17.735
2006-09-27,100263,Kotak Gilt-Savings-Annual Dividend,11.8599
2006-09-27,100264,Kotak Gilt-Investment Regular-Payout of Income Distribution cum capital withdrawal option,11.3117
2006-09-27,100265,Kotak Gilt-Investment Regular-Growth,23.5161
2006-09-27,100280,Kotak Gilt-Investment  Provident Fund and Trust-Payout of Income Distribution cum capital withdrawal option,10.8983
2006-09-27,100281,Kotak Gilt-Investment  Provident Fund and Trust-Growth,23.7784
2006-09-27,100286,Kotak Aggressive Hybrid Fund - Regular Plan - IDCW - Payout & Reinvestment of Income Distribution cum capital withdrawal option,22.87
2006-09-27,100289,Kotak Tech,8.636
2006-09-27,100290,Kotak MNC,24.993
2006-09-27,100291,Kotak Bond-Deposit-Dividend,11.5581
2006-09-27,100292,Kotak Bond-Deposit-Growth,18.2879
2006-09-27,100298,Kotak Bond Regular Plan Quaterly Payout of Income Distribution cum capital withdrawal option,10.3982
2006-09-27,100299,Kotak Bond Fund - Regular Plan Growth,19.0713
2006-09-27,100300,Kotak Bond Fund - Regular Plan - Standard IDCW Option,12.7456
2006-09-27,100301,Kotak Bond Regular Plan Bonus Plan,12.712
2006-09-27,100312,LIC MF Flexi Cap Fund-Regular Plan-IDCW,12.5528
2006-09-27,100313,LIC MF Flexi Cap Fund-Regular Plan-Growth,18.3903
2006-09-27,100314,LIC MF Medium to Long Duration Fund-Regular Plan-IDCW,10.6017
2006-09-27,100315,LIC MF Medium to Long Duration Fund-Regular Plan-Growth,19.7724
2006-09-27,100316,LIC MF Gilt Fund-Regular Plan-IDCW,10.8235
2006-09-27,100317,LIC MF Gilt Fund-Regular Plan-Growth,18.623
2006-09-27,100318,LIC MF Gilt Fund-PF Plan-IDCW,10.7388
2006-09-27,100319,LIC MF Gilt Fund-PF Plan-Growth,10.7388
2006-09-27,100321,LIC MF Aggressive Hybrid Fund-Regular Plan-IDCW,11.2811
2006-09-27,100323,LIC MF Aggressive Hybrid Fund-Regular Plan-Growth,41.9165
2006-09-27,100325,LIC MF ULIS (5 Yrs. Single Premium)-Regular Plan-IDCW Reinvestment,11.6622
2006-09-27,100332,LIC MF Large Cap Fund-Regular Plan-IDCW,9.8372
2006-09-27,100337,SaharaTax Gain-Dividend,16.5323
2006-09-27,100338,SaharaTax Gain-Growth,18.9221
2006-09-27,100347,Morgan Stanley Growth Fund- Regular Growth Plan,46.71
2006-09-27,100348,ICICI Prudential Large & Mid Cap Fund - IDCW,22.83
2006-09-27,100349,ICICI Prudential Large & Mid Cap Fund - Growth,83.93
2006-09-27,100350,ICICI Prudential Large & Mid Cap Fund - Institutional Option - I - Growth,11.09
2006-09-27,100351,ICICI Prudential FMCG Fund - IDCW,32.12
2006-09-27,100352,ICICI Prudential FMCG Fund - Growth,38.31
2006-09-27,100353,ICICI Prudential ELSS Tax Saver Fund - IDCW,28.48
2006-09-27,100354,ICICI Prudential ELSS Tax Saver Fund - Growth,88.71
2006-09-27,100355,ICICI Prudential Equity & Debt Fund - Monthly IDCW,17.53
2006-09-27,100356,ICICI Prudential Equity & Debt Fund - Growth,31.34
2006-09-27,100357,ICICI Prudential Liquid Fund -Quarterly IDCW,10.8875
2006-09-27,100359,ICICI Prudential Liquid Institutional Plus Fund - Div - Daily,11.8515
2006-09-27,100360,ICICI Prudential Liquid Institutional Plus Fund - Div - Weekly,11.8579
2006-09-27,100361,ICICI Prudential Liquid Fund-Dividend-Institutional Plus - Monthly,11.9759
2006-09-27,100362,ICICI Prudential Liquid Institutional Plus Fund - Growth,17.9188
2006-09-27,100363,ICICI Prudential Technology Fund - Growth,10.97
2006-09-27,100364,ICICI Prudential Long Term Bond Fund - Half Yearly IDCW,10.6671
2006-09-27,100365,ICICI Prudential Long Term Bond Fund - Growth,21.1926
2006-09-27,100366,ICICI Prudential Long Term Bond Fund-Institutional Quarterly Dividend,10.2375
2006-09-27,100367,ICICI Prudential Long Term Bond Fund - Quarterly IDCW,11.1339
2006-09-27,100368,ICICI Prudential Gilt Fund - IDCW,10.6702
2006-09-27,100369,ICICI Prudential Gilt Fund - Growth,21.7411
2006-09-27,100370,ICICI Prudential Short Term Gilt Fund - Dividend,10.5294
2006-09-27,100371,ICICI Prudential Short Term Gilt Fund - Growth,17.643
2006-09-27,100372,ICICI Prudential Short Term Gilt Fund - Half Yearly Dividend,10.2746
2006-09-27,100375,NIPPON INDIA GROWTH MID CAP FUND - IDCW Option,51.78
2006-09-27,100376,Nippon India Growth Mid Cap Fund-Growth Plan-Bonus Option,38.36
2006-09-27,100377,Nippon India Growth Mid Cap Fund-Growth Plan-Growth Option,231.37
2006-09-27,100378,Nippon India Vision Large & Midcap Fund - IDCW Option,49.54
2006-09-27,100379,Nippon India Vision Large & Midcap Fund-GROWTH PLAN-Bonus Option,26.75
2006-09-27,100380,Nippon India Vision Large & Midcap Fund-GROWTH PLAN-Growth Option,159.66
2006-09-27,100381,UTI Large Cap Fund-Income Option,16.28
2006-09-27,100382,UTI Large Cap Fund-Growth Option,18.68
2006-09-27,100383,NIPPON INDIA MEDIUM TO LONG DURATION FUND - MONTHLY IDCW Option,11.0348
2006-09-27,100384,NIPPON INDIA MEDIUM TO LONG DURATION  FUND - QUARTERLY IDCW Option,11.6672
2006-09-27,100385,NIPPON INDIA MEDIUM TO LONG DURATION  FUND - HALF YEARLY IDCW Option,11.1093
2006-09-27,100386,NIPPON INDIA MEDIUM TO LONG DURATION  FUND - ANNUAL IDCW Option,11.8184
2006-09-27,100387,Nippon India Medium to Long Duration  Fund - Growth Plan Growth Option,22.7536
2006-09-27,100388,Nippon India Medium to Long Duration  Fund - Growth Plan Bonus Option,10.721
2006-09-27,100414,Tata Aggressive Hybrid Fund- Regular Plan - Growth Option,44.1197
2006-09-27,100415,Tata Ethical Fund-Regular Plan - Growth Option,41.9001
2006-09-27,100416,Tata Long Term Debt Fund - Regular Plan - Quarterly Dividend,10.3367
2006-09-27,100417,Tata Income Fund-Regular Plan - Half Yearly Payout of IDCW Option,10.7423
2006-09-27,100418,Tata Income Fund -Regular Plan - Growth Option,24.4318
2006-09-27,100470,Franklin India Large Cap Fund - IDCW,38.7
2006-09-27,100471,Franklin India Large Cap Fund-Growth,116.68
2006-09-27,100472,Franklin India Mid Cap Fund - IDCW,50.63
2006-09-27,100473,Franklin India Mid Cap Fund-Growth,181.85
2006-09-27,100474,Tata ELSS Fund- Regular Plan - Payout of IDCW Option,37.9427
2006-09-27,100475,Tata Large Cap Fund -Regular Plan - Growth Option,54.6357
2006-09-27,100476,Taurus Flexi Cap Fund - Regular Plan - Growth,35.02
2006-09-27,100477,Taurus Mid Cap Fund - Regular Plan - Growth,13.76
2006-09-27,100480,Taurus ELSS Tax Saver Fund - Regular Plan - Growth,16.19
2006-09-27,100481,Franklin India Balanced Fund-Growth,32.12
2006-09-27,100482,Franklin India Balanced Fund-Div,27.76
2006-09-27,100483,Franklin India Growth Fund,25.55
2006-09-27,100484,Franklin India Index Fund- NSE Nifty 50 Index Fund - Growth,28.4482
2006-09-27,100485,Franklin India Govt.Sec. Fund-Composite Plan - Growth,23.7447
2006-09-27,100486,Franklin India Govt.Sec. Fund-Composite Plan - Dividend,10.9086
2006-09-27,100487,Franklin India Govt.Sec. Fund-Treasury Plan(Dividend Option),10.7925
2006-09-27,100489,Franklin India Govt.Sec. Fund-Treasury Plan(Growth Option),13.5928
2006-09-27,100490,Franklin India Govt.Sec. Fund-PF Plan - Growth,10.4281
2006-09-27,100491,Franklin India Govt.Sec. Fund-PF Plan - Dividend,10.4281
2006-09-27,100493,Franklin India Government Securities Fund - Growth,16.1645
2006-09-27,100494,Franklin India Government Securities Fund - IDCW,11.1592
2006-09-27,100495,Franklin India Govt.Sec. Fund-Long Term Plan - Bonus,12.4666
2006-09-27,100496,Templeton India Value Fund - Growth Plan,60.11
2006-09-27,100497,Templeton India Value Fund - IDCW,39.3
2006-09-27,100498,Franklin India Dynamic Accrual Fund - IDCW,10.6141
2006-09-27,100499,Franklin India Dynamic Accrual Fund-Growth,25.2308
2006-09-27,100503,Franklin India Low Duration Fund - Monthly - IDCW,10.2659
2006-09-27,100504,Franklin India Low Duration Fund - Quarterly - IDCW,10.3452
2006-09-27,100505,Templeton Monthly Income Plan-Half Yearly Dividend,12.3689
2006-09-27,100506,Templeton Monthly Income Plan-Growth,19.2983
2006-09-27,100519,Franklin India Flexi Cap Fund - IDCW,34.71
2006-09-27,100520,Franklin India Flexi Cap Fund - Growth,118.37
2006-09-27,100521,Franklin India Technology Fund - IDCW,22.47
2006-09-27,100522,Franklin India Technology Fund-Growth,45.53
2006-09-27,100523,Franklin FMCG Fund - Growth,35.2
2006-09-27,100524,Franklin INDIA OPPORTUNITIES FUND - IDCW,16.07
2006-09-27,100525,Franklin India ELSS Tax Saver Fund - IDCW,36.91
2006-09-27,100526,Franklin India ELSS Tax Saver Fund-Growth,117.05
2006-09-27,100527,Franklin India Corporate Debt Fund - Plan A - Annual - IDCW,10.4487
2006-09-27,100528,Franklin India Corporate Debt Fund - Growth,24.5116
2006-09-27,100529,Franklin India Corporate Debt Fund - Plan B - Monthly - IDCW,14.0483
2006-09-27,100530,Franklin India Corporate Debt Fund - Plan B - Quarterly - IDCW,14.1716
2006-09-27,100531,Franklin India Corporate Debt Fund - Plan B - Half yearly - IDCW,14.3619
2006-09-27,100532,Franklin India Corporate Debt Fund - Monthly Bonus,19.5282
2006-09-27,100535,Franklin India Retirement Fund - IDCW,17.7808
2006-09-27,100536,Franklin India Retirement Fund - Growth,40.6625
2006-09-27,100537,Franklin India Liquid Fund - Regular Plan - Weekly - IDCW,1245.0246
2006-09-27,100538,Franklin India Liquid Fund - Regular Plan - Growth,1796.6507
2006-09-27,100541,Franklin India Liquid Fund - Regular Plan - Daily - IDCW,1512.34
2006-09-27,100542,Franklin India Liquid Fund - Liquid Plan - Weekly Dividend,1001.1179
2006-09-27,100543,Franklin India Liquid Fund - Liquid Plan - Daily IDCW,1000.25
2006-09-27,100544,Franklin India Liquid Fund - Liquid Plan - Growth,1106.409
2006-09-27,100546,Franklin India Liquid Fund - Super Institutional Plan - Growth,1066.3156
2006-09-27,100547,Franklin India Liquid Fund - Super Institutional Plan - Daily - IDCW,1000.25
2006-09-27,100548,Franklin India Liquid Fund - Super Institutional Plan - Weekly - IDCW,1016.7508
2006-09-27,100549,Franklin India Aggressive Hybrid Fund - IDCW,21.1793
2006-09-27,100550,Franklin India Aggressive Hybrid Fund - Growth Plan,29.7376
2006-09-27,100551,Templeton India Children’s Asset Plan-Education Plan,24.1173
2006-09-27,100552,Templeton India Children’s Asset Plan-Gift Plan - Growth,27.6438
2006-09-27,100553,Templeton India Children’s Asset Plan-Gift Plan - Dividend,27.6438
2006-09-27,100556,Franklin India Taxshield 97,112.03
2006-09-27,100557,Franklin India Taxshield 98,109.43
2006-09-27,100558,Franklin India Taxshield 99,64.09
2006-09-27,100561,Templeton India Money Market Account - Bonus Plan,1.0
2006-09-27,100563,DBS Chola Triple Ace-Regular -Cumulative,23.869
2006-09-27,100567,DBS Chola Triple Ace-Regular - Quarterly Dividend,11.2385
2006-09-27,100569,DBS Chola Triple Ace-Semi Annual Dividend,11.5502
2006-09-27,100573,DBS Chola Triple Ace-Regular Bonus,13.2626
2006-09-27,100574,DBS Chola Freedom Income -Short Term Fund-Regular-Monthly Dividend,10.906
2006-09-27,100575,DBS Chola Freedom Income -Short Term Fund-Regular - Cumulative,11.4408
2006-09-27,100576,DBS Chola Freedom Income -Short Term Fund-Cum- Institutional Plan,11.5769
2006-09-27,100579,DBS Chola Gilt-Investment-Quarterly Dividend,10.1115
2006-09-27,100580,DBS Chola Gilt-Investment-Cumulative,18.384
2006-09-27,100589,Canara Robeco Expo-Income Plan,18.28
2006-09-27,100590,Canara Robeco Expo-Growth Plan,48.03
2006-09-27,100593,CANARA ROBECO ELSS TAX SAVER - REGULAR PLAN -IDCW (Payout),18.71
2006-09-27,100596,CANARA ROBECO GILT FUND - REGULAR PLAN - IDCW (Payout/Reinvestment),10.3329
2006-09-27,100597,CANARA ROBECO GILT FUND - REGULAR PLAN - GROWTH OPTION,18.1048
2006-09-27,100600,CANARA ROBECO CONSERVATIVE HYBRID FUND - REGULAR PLAN - MONTHLY IDCW (Payout/Reinvestment),11.65
2006-09-27,100601,CANARA ROBECO CONSERVATIVE HYBRID FUND - REGULAR PLAN - GROWTH OPTION,18.1
2006-09-27,100602,Sundaram Medium Duration Fund (Formerly Known as Sundaram Medium Term Bond Fund) Regular Plan-Income Distribution cum Capital Withdrawal(IDCW),10.2935
2006-09-27,100603,Sundaram Medium Duration Fund (Formerly Known as Sundaram Medium Term Bond Fund) Regular Plan - Growth,22.3899
2006-09-27,100604,Sundaram Medium Duration Fund (Formerly Known as Sundaram Medium Term Bond Fund) Regular Plan -Growth,11.7896
2006-09-27,100609,Sundaram Medium Duration Fund (Formerly Known as Sundaram Medium Term Bond Fund) Regular Plan- Income Distribution cum Capital Withdrawal(IDCW),10.2871
2006-09-27,100610,Sundaram Medium Duration Fund (Formerly Known as Sundaram Medium Term Bond Fund) Regular Plan -Income Distribution cum Capital Withdrawal (IDCW),10.2924
2006-09-27,100611,Sundaram Medium Duration Fund (Formerly Known as Sundaram Medium Term Bond Fund) Institutional Plan -Growth,11.4293
2006-09-27,100612,Sundaram Growth Fund-Dividend,13.2558
2006-09-27,100613,Sundaram Growth Fund-Growth,60.6147
2006-09-27,100614,Sundaram Value Fund Regular Plan - Income Distribution cum Capital Withdrawal (IDCW),15.1996
2006-09-27,100617,Sundaram Equity Hybrid Fund Regular Plan - Growth,29.4631
2006-09-27,100618,Sundaram Money Fund Retail Plan - Growth,15.1576
2006-09-27,100619,Sundaram Money Fund Retail Plan - Quarterly Reinvestment of Income Distribution cum Capital Withdrawal (IDCW),10.1588
2006-09-27,100620,Sundaram Money Fund Retail Plan - Daily Reinvestment of Income Distribution cum Capital Withdrawal (IDCW),10.0953
2006-09-27,100621,Sundaram Money Fund Retail Plan - Weekly Reinvestment of Income Distribution cum Capital Withdrawal (IDCW),10.284
2006-09-27,100622,Sundaram Money Fund Retail Plan - Fortnightly Reinvestment of Income Distribution cum Capital Withdrawal (IDCW),10.2033
2006-09-27,100623,Sundaram Money Fund Retail Plan - Monthly Income Distribution cum Capital Withdrawal (IDCW),10.1526
2006-09-27,100630,quant Multi Cap Fund-IDCW Option - Regular Plan,14.9488
2006-09-27,100631,quant Multi Cap Fund-GROWTH OPTION - Regular Plan,50.7592
2006-09-27,100638,SBI Medium to Long Duration Fund - Regular Plan - Half Yearly - Income Distribution cum Capital Withdrawal Option (IDCW),10.4095
2006-09-27,100639,SBI Medium to Long Duration Fund-REGULAR PLAN-Growth,19.4895
2006-09-27,100640,SBI Medium to Long Duration Fund-REGULAR PLAN-Bonus,11.8056
2006-09-27,100641,SBI ULTRA SHORT DURATION FUND - REGULAR PLAN - GROWTH,16.1985
2006-09-27,100643,SBI Technology Opportunities Fund - Regular Plan - Income Distribution cum Capital Withdrawal Option (IDCW),20.64
2006-09-27,100644,SBI Healthcare Opportunities Fund - Regular Plan - Income Distribution cum Capital Withdrawal Option (IDCW),28.57
2006-09-27,100645,SBI Consumption Opportunities Fund - Regular Plan - Income Distribution cum Capital Withdrawal Option (IDCW),14.49
2006-09-27,100646,UTI - Unit Linked Insurance Plan,15.1539
2006-09-27,100648,UTI - CRTS 81 - Dividend Option,112.9976
2006-09-27,100650,UTI Large Cap Fund - Regular Plan - IDCW,27.56
2006-09-27,100651,UTI Large Cap Fund - Regular Plan - Growth Option,30.81
2006-09-27,100656,UTI - Master Plus Unit Scheme-Growth Option,57.78
2006-09-27,100657,UTI - Master Plus Unit Scheme-Income Option,51.4
2006-09-27,100663,UTI Large & Mid Cap Fund - Regular Plan - IDCW,36.62
2006-09-27,100664,UTI Large & Mid Cap Fund - Regular Plan - Growth Option,39.71
2006-09-27,100668,UTI Flexi Cap Fund - Regular Plan - IDCW,28.03
2006-09-27,100669,UTI - Flexi Cap Fund-Growth Option,30.34
2006-09-27,100676,Benchmark Derivative Fund - Growth Plan,1116.6189
2006-09-27,100678,UTI Children's Hybrid Fund - Regular Plan,14.5737
2006-09-27,100682,UTI Retirement Fund - Regular Plan,19.516
2006-09-27,100684,UTI Aggressive Hybrid Fund - Regular Plan - Growth,52.63
2006-09-27,100685,UTI Aggressive Hybrid Fund - Regular Plan - IDCW,20.81
2006-09-27,100711,UTI - INDEX SELECT FUND-Income Option,21.26
2006-09-27,100712,UTI - INDEX SELECT FUND-Growth Option,31.52
2006-09-27,100715,DBS Chola Multi-Cap Fund-Dividend Option,13.58
2006-09-27,100716,DBS Chola Multi-Cap Fund-Cumulative Option,17.03
2006-09-27,100723,UTI MMF-Discontinued - Regular Plan -Growth,20.2473
2006-09-27,100724,UTI MMF- Discontinued - Regular Plan - Flexi Dividend Option,17.5737
2006-09-27,100725,UTI MMF- Discontinued - Regular Plan - Periodic Dividend Option,17.4515
2006-09-27,100739,UTI MNC Fund - Regular Plan - IDCW,27.13
2006-09-27,100740,UTI - MNC Fund - Regular Plan - Growth Option,32.67
2006-09-27,100741,UTI Medium to Long Duration Fund- Regular Plan - Growth,21.2782
2006-09-27,100742,UTI Medium to Long Duration Fund - Regular Plan - Quarterly IDCW,11.0079
2006-09-27,100748,UTI - Master Index Fund-Income Option,38.8798
2006-09-27,100749,UTI - Master Index Fund-Growth Option,38.8798
2006-09-27,100750,UTI - Master Value Fund-Income Option,17.97
2006-09-27,100751,UTI - Master Value Fund-Growth Option,27.55
2006-09-27,100780,Sundaram Banking & PSU Fund (Formerly Known as Sundaram Banking and PSU Debt Fund) Retail Plan - Monthly Income Distribution cum Capital Withdrawal (IDCW),10.2027
2006-09-27,100781,Sundaram Banking & PSU Fund (Formerly Known as Sundaram Banking and PSU Debt Fund) Retail Plan - Growth,10.9676
2006-09-27,100782,Sundaram Banking & PSU Fund (Formerly Known as Sundaram Banking and PSU Debt Fund) Regular Plan - Daily Reinvestment of Income Distribution cum Capital Withdrawal (IDCW),10.0519
