date,scheme_code,scheme_name,nav
2007-03-08,100027,Grindlays Super Saver Income Fund-GSSIF-Half Yearly Dividend,10.307
2007-03-08,100028,Grindlays Super Saver Income Fund-GSSIF-Quaterly Dividend,10.2203
2007-03-08,100029,Grindlays Super Saver Income Fund-GSSIF-Growth,16.7602
2007-03-08,100030,Grindlays Super Saver Income Fund-GSSIF-Annual Dividend,10.5333
2007-03-08,100031,Grindlays Super Saver Income Fund-GSSIF - ST-Dividend,10.0133
2007-03-08,100032,Grindlays Super Saver Income Fund-GSSIF - ST-Growth,14.6675
2007-03-08,100033,Aditya Birla Sun Life Large & Mid Cap Fund - Regular Growth,116.78
2007-03-08,100034,Aditya Birla Sun Life Large & Mid Cap Fund -Regular - IDCW,83.77
2007-03-08,100035,Birla Sun Life Freedom Fund-Plan A (Dividend),17.81
2007-03-08,100036,Birla Sun Life Freedom Fund-Plan B (Growth),26.78
2007-03-08,100037,Aditya Birla Sun Life Income Fund - Regular - Quarterly IDCW,10.1498
2007-03-08,100038,Aditya Birla Sun Life Income Fund - Growth - Regular Plan,30.2821
2007-03-08,100041,Aditya Birla Sun Life Liquid Fund -Institutional - IDCW,10.8023
2007-03-08,100042,Aditya Birla Sun Life Liquid Fund-Retail (Growth),20.048
2007-03-08,100043,Aditya Birla Sun Life Liquid Fund-Institutional (Growth),20.1887
2007-03-08,100044,Aditya Birla Sun Life Liquid Fund -Retail - IDCW,16.3694
2007-03-08,100046,Aditya Birla Sun Life Liquid Fund -Daily IDCW,10.0195
2007-03-08,100047,Aditya Birla Sun Life Liquid Fund - Growth,11.8584
2007-03-08,100048,Aditya Birla Sun Life Liquid Fund -Institutional - weekly  IDCW,10.8201
2007-03-08,100049,Aditya Birla Sun Life Cash Plus-Institutional - Fortnightly Dividend,10.85
2007-03-08,100051,Aditya Birla Sun Life Liquid Fund -weekly IDCW,10.0352
2007-03-08,100052,Aditya Birla Sun Life Cash Plus-Institutional Premium - Fortnightly Dividend,10.0864
2007-03-08,100053,Aditya Birla Sun Life Cash Plus-Institutional Premium Plan-Monthly Dividend,10.017
2007-03-08,100054,Aditya Birla Sun Life Gilt Plus - Liquid Plan - Quarterly Dividend - Regular Plan,10.7874
2007-03-08,100055,Aditya Birla Sun Life Gilt Plus - Liquid Plan - Growth - Regular Plan,18.1459
2007-03-08,100056,Aditya Birla Sun Life Gilt Plus - Liquid Plan - Annual Dividend - Regular Plan,12.0833
2007-03-08,100057,Aditya Birla Sun Life Govenment Securities Fund -Regular - Quarterly IDCW,10.5807
2007-03-08,100058,Aditya Birla Sun Life Government Securities Fund  - Growth - Regular Plan,20.6017
2007-03-08,100059,Aditya Birla Sun Life Gilt Plus-PF Plan (Annual Dividend),20.6022
2007-03-08,100060,Aditya Birla Sun Life Constant Maturity 10 Year Gilt Fund - Quarterly Dividend - Regular Plan,11.1619
2007-03-08,100061,Aditya Birla Sun Life Constant Maturity 10 Year Gilt Fund - Growth - Regular Plan,23.2607
2007-03-08,100062,Aditya Birla Sun Life Gilt Plus-Regular Plan (Annual Dividend),23.3082
2007-03-08,100063,Aditya Birla Sun Life MNC Fund - Regular - IDCW,56.77
2007-03-08,100064,Aditya Birla Sun Life MNC Fund - Growth - Regular Plan,113.27
2007-03-08,100065,Aditya Birla Sun Life India Opportunities Fund - Dividend - Regular Plan,21.19
2007-03-08,100066,Aditya Birla Sun Life India Opportunities Fund - Growth - Regular Plan,49.34
2007-03-08,100067,Aditya Birla Sun Life Tax Plan -Regular - IDCW,53.18
2007-03-08,100068,BARODA ELSS 96 - Plan A - IDCW,18.44
2007-03-08,100069,BARODA PIONEER DIVERSIFIED FUND,27.99
2007-03-08,100077,DSP Bond Fund - IDCW,10.723
2007-03-08,100078,DSP Bond Fund - Growth,25.0005
2007-03-08,100079,DSP Bond Fund - IDCW - Monthly,10.3962
2007-03-08,100080,DSP Flexi Cap Fund - Regular Plan - IDCW,36.589
2007-03-08,100081,DSP Aggressive Hybrid Fund- Regular Plan - Growth,36.651
2007-03-08,100082,DSP Aggressive Hybrid Fund- Regular Plan - IDCW,21.264
2007-03-08,100084,DSP Gilt Fund - Regular Plan - Growth,22.9622
2007-03-08,100085,DSP Gilt Fund - Regular Plan - IDCW,11.4443
2007-03-08,100086,DSP Gilt Fund - Regular Plan - IDCW - Monthly,10.0753
2007-03-08,100087,DSP Savings Fund - Regular Plan - Growth,16.8534
2007-03-08,100088,DSP Savings Fund - Regular Plan - IDCW,11.1184
2007-03-08,100089,DSP Savings Fund - Regular Plan - IDCW - Monthly,10.0704
2007-03-08,100090,DSP BlackRock Technology.com   Fund - Regular Plan - Growth,24.927
2007-03-08,100119,HDFC Balanced Advantage Fund - Growth Plan,43.913
2007-03-08,100120,HDFC Balanced Advantage Fund - IDCW Plan,23.839
2007-03-08,100121,HDFC Balanced Fund - Dividend Option,16.188
2007-03-08,100122,HDFC Balanced Fund - Growth Option,28.656
2007-03-08,100123,HDFC Income Fund - Quarterly IDCW Option,10.1061
2007-03-08,100124,HDFC Income Fund - Growth Option,16.5315
2007-03-08,100150,Principal Child Benefit Fund-Super Saver-Future Guard Plan,53.96
2007-03-08,100151,Principal Retail Equity Savings Fund - Growth Option,54.68
2007-03-08,100152,Principal Nifty 100 Equal Weight Fund-Income Distribution CUM Capital Withdrawal,20.8187
2007-03-08,100153,Principal Nifty 100 Equal Weight Fund-Growth,26.9093
2007-03-08,100156,Principal Tax Savings Fund,71.08
2007-03-08,100171,Quant Dynamic Bond-Dividend,10.0889
2007-03-08,100172,Quant Dynamic Bond-Growth,22.6209
2007-03-08,100173,Quant Dynamic Bond-Bonus,11.9148
2007-03-08,100174,quant ELSS Tax Saver Fund - IDCW Option - Regular Plan,13.9673
2007-03-08,100175,quant ELSS Tax Saver Fund - Growth Option - Regular Plan,39.6649
2007-03-08,100176,quant Small Cap Fund - IDCW Option - Regular Plan,16.1904
2007-03-08,100177,quant Small Cap Fund - Growth - Regular Plan,19.18
2007-03-08,100178,ING Income Fund-Regular Plan -Dividend Option (Quarterly),10.1769
2007-03-08,100179,ING Income Fund-Regular Plan -Dividend Option (Half Yearly),10.3244
2007-03-08,100180,ING Income Fund- Regular Plan - Dividend Option (Annual),10.6656
2007-03-08,100181,ING Income Fund-Regular Plan -Growth Option,18.1306
2007-03-08,100182,ING Income Fund-Institutional Plan - Dividend Option (Half Yearly),10.0
2007-03-08,100183,ING Income Fund-Institutional Plan - Dividend Option (Quarterly),10.0
2007-03-08,100184,ING Income Fund-Institutional Plan -Dividend Option (Annual),10.7031
2007-03-08,100185,ING Income Fund-Bonus Option,11.0547
2007-03-08,100186,ING Income Fund-Institutional Bonus Option,11.3044
2007-03-08,100187,ING Income Fund-Institutional Plan - Growth Option,18.8838
2007-03-08,100188,ING Core Equity Fund-Dividend Option,13.34
2007-03-08,100189,ING Core Equity Fund-Growth Option,25.24
2007-03-08,100190,ING Liquid Fund-Regular Growth Option,15.7903
2007-03-08,100191,ING Liquid Fund-Regular Weekly Dividend Option,10.8307
2007-03-08,100192,ING Liquid Fund-Regular Daily Dividend Option,10.7873
2007-03-08,100194,ING Liquid Fund-Auto Sweep Growth Option,10.0
2007-03-08,100195,ING Liquid Fund-Auto Sweep Weekly Dividend Option,10.0
2007-03-08,100196,ING Liquid Fund-Institutional Growth Option,11.713
2007-03-08,100197,ING Liquid Fund-Institutional Weekly Dividend Option,10.0602
2007-03-08,100198,ING Liquid Fund-Institutional Daily Dividend Option,10.0121
2007-03-08,100199,ING Liquid Fund-Super Institutional Growth Option,11.0872
2007-03-08,100200,ING Liquid Fund-Super Institutional Daily Dividend Option,10.0048
2007-03-08,100201,ING Liquid Fund-Super Institutional Weekly Dividend Option,10.0907
2007-03-08,100202,ING Balanced Fund-Dividend Option,12.44
2007-03-08,100203,ING Balanced Fund-Growth Option,17.77
2007-03-08,100218,JM Large Cap Fund (Regular) - IDCW,14.72
2007-03-08,100219,JM Large Cap Fund (Regular) - Growth Option,32.76
2007-03-08,100220,JM Aggressive Hybrid Fund (Regular) - IDCW,16.49
2007-03-08,100221,JM Aggressive Hybrid Fund (Regular) -Growth Option,21.71
2007-03-08,100222,JM Medium to Long Duration Fund (Regular) - Quarterly IDCW,10.3431
2007-03-08,100223,JM Medium to Long Duration Fund (Regular) - Growth Option,28.6703
2007-03-08,100233,JM Liquid Fund (Regular) - Weekly IDCW,10.3996
2007-03-08,100234,JM Liquid Fund - Growth Option,20.4748
2007-03-08,100237,JM High Liquidity Fund-- Institutional Plan - Growth,12.3524
2007-03-08,100238,JM High Liquidity Fund-Institutional Plan - Daily Dividend,10.0159
2007-03-08,100241,JM High Liquidity Fund-- Institutional Plan - Dividend,10.1643
2007-03-08,100243,JM High Liquidity Fund-- Premium Plan - Daily Dividend Option,10.0
2007-03-08,100244,JM Liquid Fund (Regular) - Quarterly IDCW,11.7885
2007-03-08,100245,JM High Liquidity Fund-Super Institutional Plan- Daily Dividend,10.0165
2007-03-08,100246,JM High Liquidity Fund-Super Institutional Plan- Weekly  Dividend,10.152
2007-03-08,100247,JM Liquid Fund (Regular) - Super Institutional Plan - Growth Option,11.7457
2007-03-08,100249,JM G-Sec Fund - Quarterly Dividend Option,10.3311
2007-03-08,100250,JM G-Sec Fund - Growth Option,21.1317
2007-03-08,100251,JM G-Sec Fund-PF Plan - Growth Plan,22.0197
2007-03-08,100252,JM G-Sec Fund-PF Plan -Dividend Plan,20.1767
2007-03-08,100253,JM G-Sec Fund - Bonus Option - Principal Units,10.2793
2007-03-08,100254,JM Value Fund (Regular) - Growth Option,17.9
2007-03-08,100261,Kotak Gilt-Savings-Monthly Dividend,10.4585
2007-03-08,100262,Kotak Gilt-Savings-Growth,18.0985
2007-03-08,100263,Kotak Gilt-Savings-Annual Dividend,12.103
2007-03-08,100264,Kotak Gilt-Investment Regular-Payout of Income Distribution cum capital withdrawal option,11.2811
2007-03-08,100265,Kotak Gilt-Investment Regular-Growth,23.4525
2007-03-08,100280,Kotak Gilt-Investment  Provident Fund and Trust-Payout of Income Distribution cum capital withdrawal option,10.724
2007-03-08,100281,Kotak Gilt-Investment  Provident Fund and Trust-Growth,23.7562
2007-03-08,100286,Kotak Aggressive Hybrid Fund - Regular Plan - IDCW - Payout & Reinvestment of Income Distribution cum capital withdrawal option,22.46
2007-03-08,100289,Kotak Tech,10.216
2007-03-08,100290,Kotak MNC,24.632
2007-03-08,100291,Kotak Bond-Deposit-Dividend,11.7309
2007-03-08,100292,Kotak Bond-Deposit-Growth,18.5614
2007-03-08,100298,Kotak Bond Regular Plan Quaterly Payout of Income Distribution cum capital withdrawal option,10.4255
2007-03-08,100299,Kotak Bond Fund - Regular Plan Growth,19.5074
2007-03-08,100300,Kotak Bond Fund - Regular Plan - Standard IDCW Option,13.0371
2007-03-08,100301,Kotak Bond Regular Plan Bonus Plan,13.0027
2007-03-08,100312,LIC MF Flexi Cap Fund-Regular Plan-IDCW,10.4454
2007-03-08,100313,LIC MF Flexi Cap Fund-Regular Plan-Growth,18.8803
2007-03-08,100314,LIC MF Medium to Long Duration Fund-Regular Plan-IDCW,10.1661
2007-03-08,100315,LIC MF Medium to Long Duration Fund-Regular Plan-Growth,19.8955
2007-03-08,100316,LIC MF Gilt Fund-Regular Plan-IDCW,10.9742
2007-03-08,100317,LIC MF Gilt Fund-Regular Plan-Growth,18.8824
2007-03-08,100318,LIC MF Gilt Fund-PF Plan-IDCW,10.8883
2007-03-08,100319,LIC MF Gilt Fund-PF Plan-Growth,10.8883
2007-03-08,100321,LIC MF Aggressive Hybrid Fund-Regular Plan-IDCW,9.8501
2007-03-08,100323,LIC MF Aggressive Hybrid Fund-Regular Plan-Growth,41.6135
2007-03-08,100325,LIC MF ULIS (5 Yrs. Single Premium)-Regular Plan-IDCW Reinvestment,10.1582
2007-03-08,100332,LIC MF Large Cap Fund-Regular Plan-IDCW,9.8327
2007-03-08,100337,SaharaTax Gain-Dividend,16.5098
2007-03-08,100338,SaharaTax Gain-Growth,18.9234
2007-03-08,100347,Morgan Stanley Growth Fund- Regular Growth Plan,47.22
2007-03-08,100348,ICICI Prudential Large & Mid Cap Fund - IDCW,21.37
2007-03-08,100349,ICICI Prudential Large & Mid Cap Fund - Growth,87.28
2007-03-08,100350,ICICI Prudential Large & Mid Cap Fund - Institutional Option - I - Growth,11.6
2007-03-08,100351,ICICI Prudential FMCG Fund - IDCW,29.94
2007-03-08,100352,ICICI Prudential FMCG Fund - Growth,37.62
2007-03-08,100353,ICICI Prudential ELSS Tax Saver Fund - IDCW,19.54
2007-03-08,100354,ICICI Prudential ELSS Tax Saver Fund - Growth,81.4
2007-03-08,100355,ICICI Prudential Equity & Debt Fund - Monthly IDCW,17.23
2007-03-08,100356,ICICI Prudential Equity & Debt Fund - Growth,33.05
2007-03-08,100357,ICICI Prudential Liquid Fund -Quarterly IDCW,10.8729
2007-03-08,100359,ICICI Prudential Liquid Institutional Plus Fund - Div - Daily,11.8515
2007-03-08,100360,ICICI Prudential Liquid Institutional Plus Fund - Div - Weekly,11.8613
2007-03-08,100361,ICICI Prudential Liquid Fund-Dividend-Institutional Plus - Monthly,11.9376
2007-03-08,100362,ICICI Prudential Liquid Institutional Plus Fund - Growth,18.5078
2007-03-08,100363,ICICI Prudential Technology Fund - Growth,14.78
2007-03-08,100364,ICICI Prudential Long Term Bond Fund - Half Yearly IDCW,10.5388
2007-03-08,100365,ICICI Prudential Long Term Bond Fund - Growth,21.4408
2007-03-08,100366,ICICI Prudential Long Term Bond Fund-Institutional Quarterly Dividend,10.1526
2007-03-08,100367,ICICI Prudential Long Term Bond Fund - Quarterly IDCW,10.9635
2007-03-08,100368,ICICI Prudential Gilt Fund - IDCW,10.5532
2007-03-08,100369,ICICI Prudential Gilt Fund - Growth,22.3092
2007-03-08,100370,ICICI Prudential Short Term Gilt Fund - Dividend,10.3973
2007-03-08,100371,ICICI Prudential Short Term Gilt Fund - Growth,17.8413
2007-03-08,100372,ICICI Prudential Short Term Gilt Fund - Half Yearly Dividend,10.0903
2007-03-08,100375,NIPPON INDIA GROWTH MID CAP FUND - IDCW Option,54.18
2007-03-08,100376,Nippon India Growth Mid Cap Fund-Growth Plan-Bonus Option,42.03
2007-03-08,100377,Nippon India Growth Mid Cap Fund-Growth Plan-Growth Option,253.48
2007-03-08,100378,Nippon India Vision Large & Midcap Fund - IDCW Option,42.99
2007-03-08,100379,Nippon India Vision Large & Midcap Fund-GROWTH PLAN-Bonus Option,28.23
2007-03-08,100380,Nippon India Vision Large & Midcap Fund-GROWTH PLAN-Growth Option,168.43
2007-03-08,100381,UTI Large Cap Fund-Income Option,16.31
2007-03-08,100382,UTI Large Cap Fund-Growth Option,18.71
2007-03-08,100383,NIPPON INDIA MEDIUM TO LONG DURATION FUND - MONTHLY IDCW Option,10.9292
2007-03-08,100384,NIPPON INDIA MEDIUM TO LONG DURATION  FUND - QUARTERLY IDCW Option,11.8588
2007-03-08,100385,NIPPON INDIA MEDIUM TO LONG DURATION  FUND - HALF YEARLY IDCW Option,11.2919
2007-03-08,100386,NIPPON INDIA MEDIUM TO LONG DURATION  FUND - ANNUAL IDCW Option,12.058
2007-03-08,100387,Nippon India Medium to Long Duration  Fund - Growth Plan Growth Option,23.1233
2007-03-08,100388,Nippon India Medium to Long Duration  Fund - Growth Plan Bonus Option,10.8972
2007-03-08,100414,Tata Aggressive Hybrid Fund- Regular Plan - Growth Option,47.4339
2007-03-08,100415,Tata Ethical Fund-Regular Plan - Growth Option,43.4638
2007-03-08,100416,Tata Long Term Debt Fund - Regular Plan - Quarterly Dividend,10.4018
2007-03-08,100417,Tata Income Fund-Regular Plan - Half Yearly Payout of IDCW Option,10.9593
2007-03-08,100418,Tata Income Fund -Regular Plan - Growth Option,24.9243
2007-03-08,100470,Franklin India Large Cap Fund - IDCW,35.3
2007-03-08,100471,Franklin India Large Cap Fund-Growth,122.48
2007-03-08,100472,Franklin India Mid Cap Fund - IDCW,51.64
2007-03-08,100473,Franklin India Mid Cap Fund-Growth,185.48
2007-03-08,100474,Tata ELSS Fund- Regular Plan - Payout of IDCW Option,39.1472
2007-03-08,100475,Tata Large Cap Fund -Regular Plan - Growth Option,57.7347
2007-03-08,100476,Taurus Flexi Cap Fund - Regular Plan - Growth,37.0
2007-03-08,100477,Taurus Mid Cap Fund - Regular Plan - Growth,14.17
2007-03-08,100480,Taurus ELSS Tax Saver Fund - Regular Plan - Growth,15.39
2007-03-08,100481,Franklin India Balanced Fund-Growth,34.35
2007-03-08,100482,Franklin India Balanced Fund-Div,29.68
2007-03-08,100484,Franklin India Index Fund- NSE Nifty 50 Index Fund - Growth,29.9748
2007-03-08,100485,Franklin India Govt.Sec. Fund-Composite Plan - Growth,24.1901
2007-03-08,100486,Franklin India Govt.Sec. Fund-Composite Plan - Dividend,10.7708
2007-03-08,100487,Franklin India Govt.Sec. Fund-Treasury Plan(Dividend Option),10.762
2007-03-08,100489,Franklin India Govt.Sec. Fund-Treasury Plan(Growth Option),13.9256
2007-03-08,100490,Franklin India Govt.Sec. Fund-PF Plan - Growth,10.6251
2007-03-08,100491,Franklin India Govt.Sec. Fund-PF Plan - Dividend,10.6251
2007-03-08,100493,Franklin India Government Securities Fund - Growth,16.5408
2007-03-08,100494,Franklin India Government Securities Fund - IDCW,10.8013
2007-03-08,100495,Franklin India Govt.Sec. Fund-Long Term Plan - Bonus,11.9821
2007-03-08,100496,Templeton India Value Fund - Growth Plan,61.06
2007-03-08,100497,Templeton India Value Fund - IDCW,36.1
2007-03-08,100498,Franklin India Dynamic Accrual Fund - IDCW,10.4883
2007-03-08,100499,Franklin India Dynamic Accrual Fund-Growth,25.6537
2007-03-08,100503,Franklin India Low Duration Fund - Monthly - IDCW,10.1807
2007-03-08,100504,Franklin India Low Duration Fund - Quarterly - IDCW,10.1705
2007-03-08,100505,Templeton Monthly Income Plan-Half Yearly Dividend,12.1904
2007-03-08,100506,Templeton Monthly Income Plan-Growth,19.6547
2007-03-08,100521,Franklin India Technology Fund - IDCW,24.85
2007-03-08,100522,Franklin India Technology Fund-Growth,53.4
2007-03-08,100523,Franklin FMCG Fund - Growth,31.79
2007-03-08,100524,Franklin INDIA OPPORTUNITIES FUND - IDCW,13.86
2007-03-08,100525,Franklin India ELSS Tax Saver Fund - IDCW,29.91
2007-03-08,100526,Franklin India ELSS Tax Saver Fund-Growth,118.1
2007-03-08,100527,Franklin India Corporate Debt Fund - Plan A - Annual - IDCW,10.6164
2007-03-08,100528,Franklin India Corporate Debt Fund - Growth,24.9041
2007-03-08,100529,Franklin India Corporate Debt Fund - Plan B - Monthly - IDCW,13.4332
2007-03-08,100530,Franklin India Corporate Debt Fund - Plan B - Quarterly - IDCW,13.7946
2007-03-08,100531,Franklin India Corporate Debt Fund - Plan B - Half yearly - IDCW,13.9827
2007-03-08,100532,Franklin India Corporate Debt Fund - Monthly Bonus,18.9905
2007-03-08,100535,Franklin India Retirement Fund - IDCW,16.4952
2007-03-08,100536,Franklin India Retirement Fund - Growth,42.9166
2007-03-08,100537,Franklin India Liquid Fund - Regular Plan - Weekly - IDCW,1245.3476
2007-03-08,100538,Franklin India Liquid Fund - Regular Plan - Growth,1852.4308
2007-03-08,100541,Franklin India Liquid Fund - Regular Plan - Daily - IDCW,1512.34
2007-03-08,100542,Franklin India Liquid Fund - Liquid Plan - Weekly Dividend,1001.3706
2007-03-08,100543,Franklin India Liquid Fund - Liquid Plan - Daily IDCW,1000.25
2007-03-08,100544,Franklin India Liquid Fund - Liquid Plan - Growth,1139.492
2007-03-08,100546,Franklin India Liquid Fund - Super Institutional Plan - Growth,1101.6499
2007-03-08,100547,Franklin India Liquid Fund - Super Institutional Plan - Daily - IDCW,1000.25
2007-03-08,100548,Franklin India Liquid Fund - Super Institutional Plan - Weekly - IDCW,1017.0326
2007-03-08,100549,Franklin India Aggressive Hybrid Fund - IDCW,22.6497
2007-03-08,100550,Franklin India Aggressive Hybrid Fund - Growth Plan,31.8022
2007-03-08,100551,Templeton India Children’s Asset Plan-Education Plan,25.3138
2007-03-08,100552,Templeton India Children’s Asset Plan-Gift Plan - Growth,30.1543
2007-03-08,100553,Templeton India Children’s Asset Plan-Gift Plan - Dividend,30.1543
2007-03-08,100556,Franklin India Taxshield 97,115.83
2007-03-08,100557,Franklin India Taxshield 98,117.01
2007-03-08,100558,Franklin India Taxshield 99,69.51
2007-03-08,100561,Templeton India Money Market Account - Bonus Plan,1.0
2007-03-08,100563,DBS Chola Triple Ace-Regular -Cumulative,23.9339
2007-03-08,100567,DBS Chola Triple Ace-Regular - Quarterly Dividend,11.2691
2007-03-08,100569,DBS Chola Triple Ace-Semi Annual Dividend,11.5816
2007-03-08,100573,DBS Chola Triple Ace-Regular Bonus,13.2986
2007-03-08,100574,DBS Chola Freedom Income -Short Term Fund-Regular-Monthly Dividend,10.9578
2007-03-08,100575,DBS Chola Freedom Income -Short Term Fund-Regular - Cumulative,11.8288
2007-03-08,100576,DBS Chola Freedom Income -Short Term Fund-Cum- Institutional Plan,11.9709
2007-03-08,100579,DBS Chola Gilt-Investment-Quarterly Dividend,10.1984
2007-03-08,100580,DBS Chola Gilt-Investment-Cumulative,18.5419
2007-03-08,100589,Canara Robeco Expo-Income Plan,18.87
2007-03-08,100590,Canara Robeco Expo-Growth Plan,49.57
2007-03-08,100593,CANARA ROBECO ELSS TAX SAVER - REGULAR PLAN -IDCW (Payout),20.64
2007-03-08,100596,CANARA ROBECO GILT FUND - REGULAR PLAN - IDCW (Payout/Reinvestment),10.4778
2007-03-08,100597,CANARA ROBECO GILT FUND - REGULAR PLAN - GROWTH OPTION,18.3587
2007-03-08,100600,CANARA ROBECO CONSERVATIVE HYBRID FUND - REGULAR PLAN - MONTHLY IDCW (Payout/Reinvestment),11.37
2007-03-08,100601,CANARA ROBECO CONSERVATIVE HYBRID FUND - REGULAR PLAN - GROWTH OPTION,18.77
2007-03-08,100602,Sundaram Medium Duration Fund (Formerly Known as Sundaram Medium Term Bond Fund) Regular Plan-Income Distribution cum Capital Withdrawal(IDCW),10.1908
2007-03-08,100603,Sundaram Medium Duration Fund (Formerly Known as Sundaram Medium Term Bond Fund) Regular Plan - Growth,22.7161
2007-03-08,100604,Sundaram Medium Duration Fund (Formerly Known as Sundaram Medium Term Bond Fund) Regular Plan -Growth,11.9571
2007-03-08,100609,Sundaram Medium Duration Fund (Formerly Known as Sundaram Medium Term Bond Fund) Regular Plan- Income Distribution cum Capital Withdrawal(IDCW),10.4369
2007-03-08,100610,Sundaram Medium Duration Fund (Formerly Known as Sundaram Medium Term Bond Fund) Regular Plan -Income Distribution cum Capital Withdrawal (IDCW),10.4386
2007-03-08,100611,Sundaram Medium Duration Fund (Formerly Known as Sundaram Medium Term Bond Fund) Institutional Plan -Growth,11.629
2007-03-08,100612,Sundaram Growth Fund-Dividend,13.4359
2007-03-08,100613,Sundaram Growth Fund-Growth,61.4274
2007-03-08,100614,Sundaram Value Fund Regular Plan - Income Distribution cum Capital Withdrawal (IDCW),14.1131
2007-03-08,100617,Sundaram Equity Hybrid Fund Regular Plan - Growth,30.5439
2007-03-08,100618,Sundaram Money Fund Retail Plan - Growth,15.6295
2007-03-08,100619,Sundaram Money Fund Retail Plan - Quarterly Reinvestment of Income Distribution cum Capital Withdrawal (IDCW),10.199
2007-03-08,100620,Sundaram Money Fund Retail Plan - Daily Reinvestment of Income Distribution cum Capital Withdrawal (IDCW),10.0953
2007-03-08,100621,Sundaram Money Fund Retail Plan - Weekly Reinvestment of Income Distribution cum Capital Withdrawal (IDCW),10.3375
2007-03-08,100622,Sundaram Money Fund Retail Plan - Fortnightly Reinvestment of Income Distribution cum Capital Withdrawal (IDCW),10.2221
2007-03-08,100623,Sundaram Money Fund Retail Plan - Monthly Income Distribution cum Capital Withdrawal (IDCW),10.136
2007-03-08,100630,quant Multi Cap Fund-IDCW Option - Regular Plan,14.389
2007-03-08,100631,quant Multi Cap Fund-GROWTH OPTION - Regular Plan,48.854
2007-03-08,100638,SBI Medium to Long Duration Fund - Regular Plan - Half Yearly - Income Distribution cum Capital Withdrawal Option (IDCW),10.2194
2007-03-08,100639,SBI Medium to Long Duration Fund-REGULAR PLAN-Growth,19.7825
2007-03-08,100640,SBI Medium to Long Duration Fund-REGULAR PLAN-Bonus,11.9829
2007-03-08,100641,SBI ULTRA SHORT DURATION FUND - REGULAR PLAN - GROWTH,16.7238
2007-03-08,100643,SBI Technology Opportunities Fund - Regular Plan - Income Distribution cum Capital Withdrawal Option (IDCW),27.33
2007-03-08,100644,SBI Healthcare Opportunities Fund - Regular Plan - Income Distribution cum Capital Withdrawal Option (IDCW),26.43
2007-03-08,100645,SBI Consumption Opportunities Fund - Regular Plan - Income Distribution cum Capital Withdrawal Option (IDCW),12.58
2007-03-08,100646,UTI - Unit Linked Insurance Plan,15.158
2007-03-08,100648,UTI - CRTS 81 - Dividend Option,107.6524
2007-03-08,100650,UTI Large Cap Fund - Regular Plan - IDCW,25.92
2007-03-08,100651,UTI Large Cap Fund - Regular Plan - Growth Option,32.19
2007-03-08,100656,UTI - Master Plus Unit Scheme-Growth Option,61.43
2007-03-08,100657,UTI - Master Plus Unit Scheme-Income Option,47.12
2007-03-08,100663,UTI Large & Mid Cap Fund - Regular Plan - IDCW,37.51
2007-03-08,100664,UTI Large & Mid Cap Fund - Regular Plan - Growth Option,40.69
2007-03-08,100668,UTI Flexi Cap Fund - Regular Plan - IDCW,27.87
2007-03-08,100669,UTI - Flexi Cap Fund-Growth Option,30.13
2007-03-08,100678,UTI Children's Hybrid Fund - Regular Plan,14.4346
2007-03-08,100682,UTI Retirement Fund - Regular Plan,19.1297
2007-03-08,100684,UTI Aggressive Hybrid Fund - Regular Plan - Growth,51.87
2007-03-08,100685,UTI Aggressive Hybrid Fund - Regular Plan - IDCW,20.5
2007-03-08,100711,UTI - INDEX SELECT FUND-Income Option,21.82
2007-03-08,100712,UTI - INDEX SELECT FUND-Growth Option,32.33
2007-03-08,100715,DBS Chola Multi-Cap Fund-Dividend Option,13.58
2007-03-08,100716,DBS Chola Multi-Cap Fund-Cumulative Option,17.03
2007-03-08,100723,UTI MMF-Discontinued - Regular Plan -Growth,20.9212
2007-03-08,100724,UTI MMF- Discontinued - Regular Plan - Flexi Dividend Option,17.6714
2007-03-08,100725,UTI MMF- Discontinued - Regular Plan - Periodic Dividend Option,17.5479
2007-03-08,100739,UTI MNC Fund - Regular Plan - IDCW,26.42
2007-03-08,100740,UTI - MNC Fund - Regular Plan - Growth Option,31.8
2007-03-08,100741,UTI Medium to Long Duration Fund- Regular Plan - Growth,21.5756
2007-03-08,100742,UTI Medium to Long Duration Fund - Regular Plan - Quarterly IDCW,10.8589
2007-03-08,100748,UTI - Master Index Fund-Income Option,40.9301
2007-03-08,100749,UTI - Master Index Fund-Growth Option,40.9301
2007-03-08,100750,UTI - Master Value Fund-Income Option,17.61
2007-03-08,100751,UTI - Master Value Fund-Growth Option,27.0
2007-03-08,100780,Sundaram Banking & PSU Fund (Formerly Known as Sundaram Banking and PSU Debt Fund) Retail Plan - Monthly Income Distribution cum Capital Withdrawal (IDCW),10.1863
2007-03-08,100781,Sundaram Banking & PSU Fund (Formerly Known as Sundaram Banking and PSU Debt Fund) Retail Plan - Growth,11.2912
2007-03-08,100782,Sundaram Banking & PSU Fund (Formerly Known as Sundaram Banking and PSU Debt Fund) Regular Plan - Daily Reinvestment of Income Distribution cum Capital Withdrawal (IDCW),10.0519
2007-03-08,100784,Sundaram Banking & PSU Fund (Formerly Known as Sundaram Banking and PSU Debt Fund) Regular Plan - Growth,11.42
2007-03-08,100785,Sundaram Corporate Bond Fund Regular Plan -Income Distribution cum Capital Withdrawal(IDCW),10.242
2007-03-08,100786,Sundaram Corporate Bond Fund Regular Plan - Income Distribution cum Capital Withdrawal (IDCW ),10.192
