date,scheme_code,scheme_name,nav
2007-03-13,102222,ING Dynamic Duration Fund-Growth Option,11.6695
2007-03-13,102223,ING Dynamic Duration Fund-Annual Dividend Option,10.772
2007-03-13,102224,ING Dynamic Duration Fund-Monthly Dividend Option,10.1355
2007-03-13,102225,ING Dynamic Duration Fund-Quarterly Dividend Option,10.2908
2007-03-13,102226,ING Dynamic Duration Fund-Half Yearly Dividend Option,10.4254
2007-03-13,102231,ING Dynamic Duration Fund-Bonus Option,11.6695
2007-03-13,102232,ING MIP Fund-Growth Option,12.0977
2007-03-13,102233,ING MIP Fund-Monthly Dividend Option,10.4173
2007-03-13,102234,ING MIP Fund-Quarterly Dividend Option,10.5872
2007-03-13,102235,ING MIP Fund-Half Yearly Dividend Option,10.6439
2007-03-13,102236,ING MIP Fund-Annual Dividend Option,10.9006
2007-03-13,102240,ING MIP Fund-Bonus Option,12.0977
2007-03-13,102242,ING Large Cap Equity Fund-Growth Option,19.54
2007-03-13,102243,ING Large Cap Equity Fund-Dividend Option,13.0
2007-03-13,102245,ING Large Cap Equity Fund-Bonus Option,19.54
2007-03-13,102248,ICICI Prudential Gilt Fund Treasury Plan PF Option - Growth,11.3888
2007-03-13,102251,HSBC Flexi Cap Fund - Regular IDCW,17.5136
2007-03-13,102252,HSBC Flexi Cap Fund - Regular Growth,26.2993
2007-03-13,102257,HSBC MIP - Regular -  Dividend - Monthly,10.4081
2007-03-13,102258,HSBC MIP - Regular - Dividend - Quarterly,10.5994
2007-03-13,102259,HSBC MIP - Regular - Growth,12.2306
2007-03-13,102260,HSBC Conservative Hybrid Fund - Regular Monthly IDCW,10.6494
2007-03-13,102261,HSBC Conservative Hybrid Fund - Regular Quarterly IDCW,10.9158
2007-03-13,102262,HSBC Conservative Hybrid Fund - Regular Growth,13.0509
2007-03-13,102263,Tata Gilt Securities Fund RIP ( Bonus),11.5566
2007-03-13,102266,UTI Children's Equity Fund - Regular Plan - IDCW,11.0927
2007-03-13,102267,UTI Children's Equity Fund - Regular Plan - Growth Option,11.0927
2007-03-13,102268,LIC NOMURA MF Floating Rate Fund - Short Term Plan-Growth,11.9204
2007-03-13,102269,LIC NOMURA MF Floating Rate Fund - Short Term Plan-Weekly Dividend,10.1486
2007-03-13,102270,Franklin FMCG Fund - Dividend,20.31
2007-03-13,102271,Franklin Pharma Fund - Dividend,16.96
2007-03-13,102272,SBI NIFTY INDEX FUND - REGULAR PLAN - GROWTH,34.4086
2007-03-13,102273,SBI Nifty Index Fund - Regular Plan - Income Distribution cum Capital Withdrawal Option (IDCW),17.0276
2007-03-13,102280,Tata M I P Plus Fund - Regular Plan-Monthly Dividend,10.2409
2007-03-13,102281,Tata M I P Plus Fund -Regular Plan- Quarterly Dividend,10.4171
2007-03-13,102282,Tata M I P Plus Fund -Regular Plan- Half Yearly Dividend,10.6136
2007-03-13,102283,Tata MIP Plus Fund -Regular Plan - Growth,11.8058
2007-03-13,102300,Grindlays Government Securities Fund-Provident fund Plan-Regular- Plan A-Growth/Appreciation,11.0835
2007-03-13,102304,Grindlays Government Securities Fund-Provident fund Plan-Regular- Plan A-Annual Dividend,10.7207
2007-03-13,102305,Grindlays Government Securities Fund-Provident fund Plan-Regular- Plan A-Quarterly Dividend,10.3711
2007-03-13,102306,Grindlays Government Securities Fund-Provident fund Plan-Institutional Plan-Plan B-Growth/Appreciation,11.1128
2007-03-13,102311,Grindlays Government Securities Fund-Provident fund Plan-Institutional Plan-Plan B-Quarterly Dividend,10.3618
2007-03-13,102315,ING Tax Savings Fund-Growth Option,24.91
2007-03-13,102316,ING Tax Savings Fund-Dividend Option,16.24
2007-03-13,102317,ING Tax Savings Fund-Bonus Option,24.95
2007-03-13,102320,Franklin India Index Fund - BSE Plan - Growth Plan,35.99
2007-03-13,102326,Tata Mid Cap Fund-Regular Plan - IDCW Option,26.2652
2007-03-13,102328,Tata Mid Cap Fund Regular Plan- Growth Option,30.3584
2007-03-13,102329,Tata Mid Cap Growth Fund Regular Plan  - Bonus (Growth),26.343
2007-03-13,102330,ICICI Prudential Regular Savings Fund - Plan - Growth,14.3334
2007-03-13,102331,ICICI Prudential Regular Savings Fund - Plan - Monthly IDCW,12.0998
2007-03-13,102336,Principal Global Opportunities Fund- Income Distribution CUM Capital Withdrawal Option,14.5362
2007-03-13,102337,Principal Global Opportunities Fund-Growth Option,14.5362
2007-03-13,102340,GCF-Plan C-Growth,11.7782
2007-03-13,102341,GCF-Plan C-weekly Dividend,10.0083
2007-03-13,102342,GCF-Plan C-Daily Dividend,10.0005
2007-03-13,102347,GFRF-Plan C-Growth,11.778
2007-03-13,102348,GFRF-Plan C-Daily Dividend,10.0005
2007-03-13,102363,GSSIF-ST-Plan C-Growth,10.8749
2007-03-13,102365,GSSIF-ST-Plan D-Growth,10.2866
2007-03-13,102381,ING Gilt Fund Provident Fund - Dynamic Plan-Growth Option,11.4627
2007-03-13,102382,ING Gilt Fund Provident Fund - Dynamic Plan-Growth Auto Income Payout Option,11.4627
2007-03-13,102383,ING Gilt Fund Provident Fund - Dynamic Plan-Half Yearly Dividend Option,10.3247
2007-03-13,102384,ING Gilt Fund Provident Fund - Dynamic Plan-Annual Dividend Option,10.5512
2007-03-13,102387,ING Gilt Fund Provident Fund - Dynamic Plan-Cyclical Series Option 2006,10.4258
2007-03-13,102393,UTI Mid Cap Fund - Regular Plan - IDCW,16.91
2007-03-13,102394,UTI Mid Cap Fund-Growth Option,19.98
2007-03-13,102395,UTI Infrastructure Fund-Growth Option,25.69
2007-03-13,102396,UTI Infrastructure Fund - Regular Plan - IDCW,18.77
2007-03-13,102397,UTI Transportation and Logistics Fund - Regular Plan - IDCW,13.78
2007-03-13,102398,UTI-Transportation and Logistics  Fund-Growth Option,17.22
2007-03-13,102401,UTI Banking and Financial Services Fund - Regular Plan - Growth Option,19.51
2007-03-13,102402,UTI Banking and Financial Services Fund - Regular Plan - IDCW,16.4
2007-03-13,102403,UTI PSU Fund-Income Option,13.88
2007-03-13,102404,UTI PSU Fund-Growth Option,15.3
2007-03-13,102409,Reliance Gilt Securities Fund-Long Term-P F -Plan-Automatic Capital Appreciation Payout,12.7311
2007-03-13,102410,Reliance Gilt Securities Fund-Long Term-P F -Plan-Defined Maturity Debt,12.7311
2007-03-13,102414,SBI CONTRA FUND - REGULAR PLAN -GROWTH,35.04
2007-03-13,102416,ICICI Prudential Fixed Maturity Plan - 1 Year-Series 12-Retail,11.4629
2007-03-13,102421,ICICI Prudential Fixed Maturity Plan - 1 Year-Series 12-Institutional,11.5378
2007-03-13,102422,ICICI Prudential Fixed Maturity Plan - 1 Year-Series 12-Retail Dividend - 1,10.6284
2007-03-13,102423,ICICI Prudential Fixed Maturity Plan - 1 Year-Series 12-Institutional Dividend - 1,10.636
2007-03-13,102424,ICICI Prudential Fixed Maturity Plan - 1 Year-Series 12-Retail Growth - 1,10.6284
2007-03-13,102425,ICICI Prudential Fixed Maturity Plan - 1 Year-Series 12-Institutional Growth - 1,10.6467
2007-03-13,102426,Principal Resurgent India Equity Fund-Growth,69.85
2007-03-13,102427,Principal Resurgent India Equity Fund-Dividend,13.33
2007-03-13,102428,Tata Value Fund Regular Plan - Payout of IDCW-Option B(10%),22.6732
2007-03-13,102431,Nippon India Pharma Fund-Growth Plan-Growth Option,19.4489
2007-03-13,102432,Nippon India Pharma Fund-Growth Plan-Bonus Option,19.4489
2007-03-13,102433,NIPPON INDIA PHARMA FUND - IDCW Option,16.8651
2007-03-13,102434,DSP India T.I.G.E.R. Fund - Regular Plan - Growth,30.96
2007-03-13,102435,DSP India T.I.G.E.R. Fund - Regular Plan - IDCW,21.937
2007-03-13,102441,Franklin India Liquid Fund - Institution-Growth,1166.6551
2007-03-13,102442,Franklin India Liquid Fund - Institutional Plan - Weekly - IDCW,1001.0329
2007-03-13,102443,Franklin India Liquid Fund - Institutional Plan - Daily - IDCW,1000.25
2007-03-13,102445,DSP BlackRock Savings Manager Fund - Conservative - Growth,12.0609
2007-03-13,102446,DSP BlackRock Savings Manager Fund - Conservative - Monthly Dividend,10.2335
2007-03-13,102447,DSP BlackRock Savings Manager Fund - Conservative - Quarterly Dividend,10.4607
2007-03-13,102448,DSP Regular Savings Fund- Regular Plan - Growth,13.7865
2007-03-13,102450,DSP Regular Savings Fund - Regular Plan - IDCW - Monthly,10.4064
2007-03-13,102451,DSP Regular Savings Fund - Regular Plan - IDCW - Quarterly,10.9744
2007-03-13,102452,HDFC Low Duration  Fund - Growth,16.1792
2007-03-13,102453,HDFC Low Duration  Fund - Weekly IDCW,10.0163
2007-03-13,102478,JM Mid Cap Fund-Dividend,15.49
2007-03-13,102479,JM Mid Cap Fund-Growth,20.22
2007-03-13,102480,JM Large Cap Fund-Dividend,13.15
2007-03-13,102481,JM Large Cap Fund-Growth,16.58
2007-03-13,102482,Sundaram India Leadership Fund-Growth,27.1243
2007-03-13,102483,Sundaram India Leadership Fund-Dividend,13.2304
2007-03-13,102491,UTI - GROWTH & VALUE FUND-ANNUAL DIVIDEND,21.82
2007-03-13,102494,UTI - GROWTH & VALUE FUND-GROWTH,53.96
2007-03-13,102495,UTI - GROWTH & VALUE FUND-SEMI ANNUAL DIVIDEND,15.23
2007-03-13,102496,UTI - INDIA ADVANTAGE EQUITY FUND-DIVIDEND,7.84
2007-03-13,102497,UTI - INDIA ADVANTAGE EQUITY FUND-GROWTH,7.84
2007-03-13,102503,SBI  SAVINGS FUND - REGULAR PLAN - GROWTH,11.5525
2007-03-13,102504,SBI Savings Fund - Regular Plan - Income Distribution cum Capital Withdrawal Option (IDCW),10.0801
2007-03-13,102505,SBI CREDIT RISK FUND - REGULAR PLAN - GROWTH,11.4892
2007-03-13,102506,SBI Credit Risk Fund - Regular Plan - Income Distribution cum Capital Withdrawal Option (IDCW),10.3991
2007-03-13,102507,OLD-SBI Magnum Income Fund - F R P - Long Term - Inst. (G),11.6056
2007-03-13,102508,SBI Magnum Income Fund - F R P - Long Term - Inst. (D),10.7172
2007-03-13,102509,UTI Gilt Fund - Regular Plan - IDCW,10.6804
2007-03-13,102510,UTI - GILT FUND - Regular Plan - Growth Option,15.2076
2007-03-13,102511,UTI - GILT FUND -Discontinued PF Plan -Dividend Option,10.6333
2007-03-13,102512,UTI - GILT FUND - Discontinued PF Plan - Growth Option,11.3088
2007-03-13,102513,UTI - GILT ADVANTAGE-LONG TERM PF-( PRESCRIBED APPRECIATION AUTO REDEMPTION,11.3267
2007-03-13,102514,UTI - GILT FUND - Discontinued PF Plan Prescribed Date Auto Redemption Option,11.3127
2007-03-13,102517,UTI - DYNAMIC EQUITY FUND-GROWTH,32.25
2007-03-13,102518,UTI - DYNAMIC EQUITY FUND-DIVIDEND,17.61
2007-03-13,102528,ICICI Prudential MidCap Fund - Growth,26.62
2007-03-13,102529,ICICI Prudential MidCap Fund - IDCW,19.4
2007-03-13,102530,ICICI Prudential MidCap Fund - Institutional Option - I,10.44
2007-03-13,102531,UTI Ultra Short Duration Fund - Regular Plan - Weekly IDCW (Reinvestment),1017.2086
2007-03-13,102532,UTI Ultra Short Duration Fund - Regular Plan - Growth Option,1218.4338
2007-03-13,102533,UTI Conservative Hybrd Fund - Regular Plan - Monthly Payment Option,13.7606
2007-03-13,102534,UTI Conservative Hybrid Fund - Regular Plan - Flexi IDCW,13.7744
2007-03-13,102535,UTI Conservative Hybrid Fund - Regular Plan - Growth Option,13.7728
2007-03-13,102536,UTI Conservative Hybrid Fund - Regular Plan - Monthly IDCW,11.6766
2007-03-13,102538,UTI Low Duration Fund - Discontinued - Annaul Dividend Option,11.4765
2007-03-13,102539,UTI Low Duration Fund - Discontinued Bonus Option,12.5653
2007-03-13,102540,UTI Low Duration Fund - Discontinued Growth Option,18.8502
2007-03-13,102541,UTI Low Duration Fund - Discontinued - Quarterly Dividend Option,11.1301
2007-03-13,102545,UTI Low Duration Fund - Regular Plan - Bonus Option,11.547
2007-03-13,102546,Franklin India Life Stage Fund Of Funds - 50's Plus Floating Rate Plan - IDCW,11.9587
2007-03-13,102547,Franklin India Life Stage Fund of Funds - The 50s Plus Flo (Gro),13.4754
2007-03-13,102556,GFRF Long Term-Plan A-Growth,11.4712
2007-03-13,102557,GFRF Long Term-Plan A-Dividend Quarterly,10.3688
2007-03-13,102558,GFRF Long Term-Plan A-Dividend Annual,10.4585
2007-03-13,102559,GFRF Long Term-Plan A-Dividend Monthly,10.0386
2007-03-13,102560,GFRF Long Term-Plan B-Growth,11.5295
2007-03-13,102561,GFRF Long Term-Plan B-Dividend Quarterly,10.4152
2007-03-13,102573,Kotak Multi Asset Omni FOF - Payout of Income Distribution cum capital withdrawal option,23.74
2007-03-13,102574,Kotak Multi Asset Omni FOF - Growth- Regular,23.74
2007-03-13,102577,DBS Chola Mid Cap Fund-Dividend,14.06
2007-03-13,102578,DBS Chola Mid Cap Fund-Cumulative,24.36
2007-03-13,102585,ICICI Prudential FMP-15 Month - Series 25-Retail Plan-Cumulative Option,11.4425
2007-03-13,102587,ICICI Prudential FMP-15 Month - Series 25-Institutional Plan-Cumulative Option,11.5449
2007-03-13,102590,Kotak Savings Fund -Weekly Weekly Reinvestment of Income Distribution cum capital withdrawal option,10.0353
2007-03-13,102591,Kotak Savings Fund -Growth,11.6231
2007-03-13,102592,Kotak Savings Fund -Monthly Payout of Income Distribution cum capital withdrawal option,10.0033
2007-03-13,102594,ICICI Prudential Value Fund (erstwhile Value Discovery Fund) - Growth,24.2
2007-03-13,102595,ICICI Prudential Value Fund (erstwhile Value Discovery Fund) - IDCW,16.73
2007-03-13,102596,ICICI Prudential Value Discovery Fund - Institutional Option - I - Growth,10.3
2007-03-13,102619,ABN AMRO Flexi Debt Fund-Regular Plan-Growth Option,11.5325
2007-03-13,102620,ABN AMRO Flexi Debt Fund-Regular Plan-Quarterly Dividend Option,10.2505
2007-03-13,102621,ABN AMRO Flexi Debt Fund-Regular Plan-Half-Yearly Dividend Option,10.4673
2007-03-13,102622,ABN AMRO Flexi Debt Fund-Regular Plan-Daily Dividend Option,10.0001
2007-03-13,102623,ABN AMRO Flexi Debt Fund-Regular Plan-Weekly Dividend Option,10.0085
2007-03-13,102639,ABN AMRO  Equity Fund-Growth Plan,24.67
2007-03-13,102640,ABN AMRO  Equity Fund-Dividend Plan,13.5
2007-03-13,102641,ABN AMRO  Short Term Income Fund-Regular Plan-Growth Option,11.4098
2007-03-13,102642,ABN AMRO  Short Term Income Fund-Regular Plan-Monthly Dividend Option,10.0238
2007-03-13,102643,ABN AMRO  Short Term Income Fund-Regular Plan-Weekly Dividend Option,10.0085
2007-03-13,102644,ABN AMRO  Short Term Income Fund-Institutional Plan-Growth Option,11.5338
2007-03-13,102645,ABN AMRO  Short Term Income Fund-Institutional Plan-Daily Dividend Option,10.0
2007-03-13,102646,ABN AMRO  Short Term Income Fund-Institutional Plan-Monthly Dividend Option,10.025
2007-03-13,102647,ABN AMRO  Short Term Income Fund-Institutional Plan-Weekly Dividend Option,10.0088
2007-03-13,102649,ABN AMRO  Short Term Income Fund-Institutional Plus Plan-Daily Dividend Option,10.0
2007-03-13,102652,ABN AMRO  Monthly Income Plan-Regular Plan-Growth Option,12.9596
2007-03-13,102653,ABN AMRO  Monthly Income Plan-Regular Plan-Monthly Dividend Option,10.773
2007-03-13,102654,ABN AMRO  Monthly Income Plan-Regular Plan-Quarterly Dividend Option,10.8445
2007-03-13,102659,DBS Chola Floating Rate Fund-Dividend,10.3942
2007-03-13,102660,DBS Chola Floating Rate Fund-Cumulative,11.4342
2007-03-13,102661,BARODA CONSERVATIVE HYBRID FUND - Plan A - Growth Option,11.779
2007-03-13,102662,BARODA CONSERVATIVE HYBRID FUND - Plan A - Monthly IDCW Option,11.7839
2007-03-13,102663,BARODA CONSERVATIVE HYBRID FUND - Plan A - Quarterly IDCW Option,11.7795
2007-03-13,102670,BARODA PIONEER CHILDREN FUND-GIFT PLAN,10.6185
2007-03-13,102672,Tata Liquid Fund -Regular Plan - Growth Option,11.6514
2007-03-13,102673,Nippon India Floater Fund - Growth Plan-Growth Option,11.6224
2007-03-13,102675,NIPPON INDIA FLOATER FUND - MONTHLY IDCW Option,10.1602
2007-03-13,102676,NIPPON INDIA FLOATER FUND - DAILY IDCW REINVESTMENT Option,10.0631
2007-03-13,102677,NIPPON INDIA FLOATER FUND - WEEKLY IDCW Option,10.0861
2007-03-13,102682,Birla Sun Life Fixed Maturity Plan - Quarterly Series II-Dividend,10.209
2007-03-13,102683,Birla Sun Life Fixed Maturity Plan - Quarterly Series II-Growth,11.7114
2007-03-13,102701,Sundaram Money Fund Institutional Plan - Daily Reinvestment of Income Distribution cum Capital Withdrawal (IDCW),10.0953
2007-03-13,102703,Sundaram Money Fund Institutional Plan - Growth,15.7006
2007-03-13,102704,Sundaram Money Fund Institutional Plan - Monthly Income Distribution cum Capital Withdrawal (IDCW),10.1895
2007-03-13,102705,Sundaram Money Fund Institutional Plan - Quarterly Reinvestment of Income Distribution cum Capital Withdrawal (IDCW),10.4889
2007-03-13,102706,Sundaram Money Fund Institutional Plan - Weekly Reinvestment of Income Distribution cum Capital Withdrawal (IDCW),10.3697
2007-03-13,102711,ING Select Debt Fund-Growth Option,11.1643
2007-03-13,102712,ING Select Debt Fund-Quarterly Dividend Option,10.2017
2007-03-13,102713,ING Select Debt Fund-Half Yearly Dividend Option,10.33
2007-03-13,102714,ING Select Debt Fund-Annual Dividend Option,10.4749
2007-03-13,102715,ING Select Debt Fund-Bonus Option,11.1643
2007-03-13,102716,ING Domestic Opportunities Fund-Growth Option,25.14
2007-03-13,102717,ING Domestic Opportunities Fund-Dividend Option,11.56
2007-03-13,102718,ING Domestic Opportunities Fund-Bonus Option,25.14
2007-03-13,102719,Principal Low Duration Fund - Growth,11.6253
2007-03-13,102720,Principal Floating Rate Fund - FMP-Weekly Dividend,10.0118
2007-03-13,102721,Principal Floating Rate Fund - FMP-Monthly Dividend,10.2866
2007-03-13,102722,Principal Low Duration Fund- Growth Option,11.6648
2007-03-13,102723,Principal Low Duration Fund - Weekly Income Distribution CUM Capital Withdrawal Option,10.0117
2007-03-13,102724,Principal Low Duration Fund- Monthly Income Distribution CUM Capital Withdrawal Option,10.1106
2007-03-13,102725,Principal Floating Rate Fund - SMP-Growth,11.5824
2007-03-13,102726,Principal Floating Rate Fund - SMP-Daily Dividend,10.0007
2007-03-13,102727,Principal Floating Rate Fund - SMP-Weekly Dividend,10.0115
2007-03-13,102728,Principal Floating Rate Fund - SMP-Monthly Dividend,10.202
2007-03-13,102729,Principal Credit Risk Fund - Regular Plan - Growth Option,11.6243
2007-03-13,102730,Principal Floating Rate Fund - SMP-Insti. Daily Dividend,10.0007
2007-03-13,102731,Principal Floating Rate Fund - SMP-Insti. Weekly Dividend,10.0116
2007-03-13,102732,Principal Credit Risk Fund - Regular Plan - Monthly Dividend Option,10.4397
2007-03-13,102733,Standard Chartered All Seasons Bond Fund-Plan A-Dividend - Quarterly,10.3824
2007-03-13,102734,Standard Chartered All Seasons Bond Fund-Plan A-Growth,11.4064
2007-03-13,102735,Standard Chartered All Seasons Bond Fund-Plan A-Dividend - Half Yearly,10.5179
2007-03-13,102736,Standard Chartered All Seasons Bond Fund-Plan A-Dividend - Annual,10.8018
2007-03-13,102741,ICICI Prudential Medium Term Bond Fund - Growth,11.4752
2007-03-13,102742,ICICI Prudential Medium Term Bond Fund - Dividend,10.133
2007-03-13,102743,ICICI Prudential Medium Term Bond Fund-Plan B-Growth,11.5958
2007-03-13,102744,ICICI Prudential Medium Term Bond Fund-Plan B-Dividend,10.1563
2007-03-13,102751,Nippon India Consumption Fund-Growth Plan-Growth Option,23.8138
2007-03-13,102752,Nippon India Consumption Fund-Growth Plan-Bonus Option,23.8138
2007-03-13,102753,NIPPON INDIA CONSUMPTION FUND - IDCW Option,19.888
2007-03-13,102754,Birla Sun Life Fixed Maturity Plan - Annual Series 1-Dividend,10.3318
2007-03-13,102755,Birla Sun Life Fixed Maturity Plan - Annual Series 1-Growth,11.5884
2007-03-13,102756,SBI FOCUSED FUND - REGULAR PLAN -GROWTH,27.53
2007-03-13,102760,HDFC Focused Fund - GROWTH PLAN,23.602
2007-03-13,102761,HDFC Focused Fund - IDCW PLAN,18.182
2007-03-13,102765,SBI Focused Fund - Regular Plan - Income Distribution cum Capital Withdrawal Option (IDCW),16.92
2007-03-13,102766,Aditya Birla Sun Life Dynamic Bond Fund -Regular - Quarterly IDCW,10.1972
2007-03-13,102767,Aditya Birla Sun Life Dynamic Bond Fund - Growth - Regular Plan,11.3987
2007-03-13,102798,ING Treasury Management Fund-Growth Option,11.5208
2007-03-13,102799,ING Treasury Management Fund-Weekly Dividend Option,10.344
2007-03-13,102800,ING Treasury Management Fund-Quarterly Dividend Option,10.3706
2007-03-13,102801,ING Treasury Management Fund-Half Yearly Dividend Option,10.5098
2007-03-13,102802,ING Treasury Management Fund-Annual Dividend Option,10.7991
2007-03-13,102803,ING Treasury Management Fund-Bonus Option,11.5208
2007-03-13,102804,ING Treasury Management Fund-Daily Dividend Option,10.0557
2007-03-13,102805,Canara Robeco Nifty Index - Regular Plan - Growth,20.25
2007-03-13,102806,Canara Robeco Nifty Index - Regular Plan - Dividend,13.05
2007-03-13,102807,Principal Dividend Yield Fund-Growth Plan,14.13
2007-03-13,102808,Principal Dividend Yield Fund- Half Yearly Income Distribution CUM Capital Withdrawal Plan,11.52
2007-03-13,102813,LIC NOMURA MF Floater MIP - Monthly Dividend,9.9617
2007-03-13,102814,LIC NOMURA MF Floater MIP - Quarterly Dividend,10.1119
2007-03-13,102815,LIC NOMURA MF Floater MIP - Yearly Dividend,11.0171
2007-03-13,102816,LIC NOMURA MF Floater MIP - Growth,12.5826
2007-03-13,102823,SBI HEALTHCARE OPPORTUNITIES FUND - REGULAR PLAN -GROWTH,32.43
2007-03-13,102827,HSBC Floating Rate Fund - Long Term - Regular - Growth,11.4023
2007-03-13,102828,HSBC Floating Rate Fund - Long Term - Regular - Dividend - Monthly,10.0412
2007-03-13,102829,HSBC Floating Rate Fund - Long Term - Growth,11.457
2007-03-13,102830,HSBC Floating Rate Fund - Long Term - Dividend - Weekly,10.5161
2007-03-13,102831,HSBC Floating Rate Fund - Long Term - Dividend - Monthly,10.0706
2007-03-13,102832,HSBC Floating Rate Fund - Short Term - Regular - Growth,11.4252
2007-03-13,102833,HSBC Floating Rate Fund - Short Term - Regular - Dividend - Daily,10.0
2007-03-13,102834,HSBC Floating Rate Fund - Short Term - Regular - Dividend - Weekly,10.0101
2007-03-13,102835,HSBC Floating Rate Fund - Short Term - Inst. - Growth,11.48
2007-03-13,102836,HSBC Floating Rate Fund - Short Term - Inst. - Dividend - Daily,10.0133
2007-03-13,102837,HSBC Floating Rate Fund - Short Term - Inst. - Dividend - Weekly,10.0385
2007-03-13,102838,HSBC Floating Rate Fund - Short Term - Inst. - Dividend - Monthly,10.0579
2007-03-13,102840,HSBC Floating Rate Fund - Short Term - Inst. Plus - Dividend - Daily,10.0262
2007-03-13,102846,Nippon India Balanced Advantage Fund-Growth Plan-Growth Option,23.0456
2007-03-13,102847,Nippon India Balanced Advantage Fund-Growth Plan-Bonus Option,23.0456
2007-03-13,102848,NIPPON INDIA BALANCED ADVANTAGE FUND - IDCW Option,19.5695
2007-03-13,102849,Nippon India Dynamic Bond Fund-Growth Plan-Growth Option,11.3475
2007-03-13,102851,NIPPON INDIA DYNAMIC BOND FUND - IDCW Option,11.3475
2007-03-13,102855,Birla Sun Life Fixed Maturity Plan - Annual  Series 3-Dividend,10.2521
2007-03-13,102856,Birla Sun Life Fixed Maturity Plan - Annual  Series 3-Growth,11.6464
2007-03-13,102858,Tata Dividend Yield Fund  Regular Plan -( Div),13.2429
2007-03-13,102859,Tata Dividend Yield Fund Regular Plan,16.1207
2007-03-13,102860,SBI Savings Fund - Regular Plan Weekly Income Distribution cum Capital Withdrawal Option (IDCW),10.1966
2007-03-13,102867,Kotak Flexi-Debt - Regular Plan - Dividend,10.2519
2007-03-13,102868,Kotak Flexi-Debt - Regular Plan - Growth,11.5846
2007-03-13,102869,Kotak Flexi-Debt- Regular Plan - Daily Dividend,10.0311
2007-03-13,102870,Z-OLD-SBI Magnum Inst. Income Fund -  Savings - Wkly(D)(Upto 22/03/07) Renamed as SBI Premier Liquid Fund,10.572
2007-03-13,102874,Kotak-Small Cap Fund - Payout of Income Distribution cum capital withdrawal option,14.512
2007-03-13,102875,Kotak-Small Cap Fund - Growth,18.915
2007-03-13,102883,Franklin India Large & Mid Cap Fund - Growth Plan,19.35
2007-03-13,102884,Franklin India Large & Mid Cap Fund - IDCW,17.16
2007-03-13,102885,SBI EQUITY HYBRID FUND - REGULAR PLAN -Growth,33.71
2007-03-13,102896,Principal Focussed Advantage Fund-Dividend,15.38
2007-03-13,102897,Principal Focussed Advantage Fund-Growth,15.38
2007-03-13,102900,LIC NOMURA MF Opportunities Fund-Dividend,10.9435
2007-03-13,102901,LIC NOMURA MF Opportunities Fund-Growth,15.7719
2007-03-13,102902,JM Equity & Derivative Fund-Growth-growth option,11.4786
2007-03-13,102903,JM Equity & Derivative Fund-Dividend-dividend option,10.4447
2007-03-13,102904,JM Equity & Derivative Fund-Bonus-Bonus option,10.6289
2007-03-13,102905,Reliance Index Fund-Sensex Plan-Growth Option,19.163
2007-03-13,102906,Reliance Index Fund-Sensex Plan-Bonus Option,19.163
2007-03-13,102907,Reliance Index Fund-Sensex Plan-Dividend Option,19.163
2007-03-13,102908,Reliance Index Fund-Nifty Plan-Growth Option,15.2046
2007-03-13,102909,Reliance Index Fund-Nifty Plan-Bonus Option,15.2046
2007-03-13,102910,Reliance Index Fund-Nifty Plan-Dividend Option,15.2046
2007-03-13,102913,CANARA ROBECO SAVINGS FUND - REGULAR PLAN - GROWTH OPTION,11.4002
2007-03-13,102914,CANARA ROBECO SAVINGS FUND - REGULAR PLAN - IDCW (Payout/Reinvestment),10.9642
2007-03-13,102915,CANARA ROBECO SAVINGS FUND - REGULAR PLAN - WEEKLY IDCW (Payout/Reinvestment),10.2704
2007-03-13,102920,CANARA ROBECO LARGE AND MID CAP FUND - REGULAR PLAN - GROWTH OPTION,14.39
2007-03-13,102921,CANARA ROBECO LARGE AND MID CAP FUND - REGULAR PLAN - IDCW (Payout/Reinvestment),12.27
2007-03-13,102922,Canara Robeco Large and Mid Cap Fund -BONUS OPTION,14.39
2007-03-13,102929,Tata Service Industries Fund - Dividend,19.0796
2007-03-13,102930,Tata Service Industries Fund - Appreciation,19.0129
2007-03-13,102931,ING Midcap Fund-Growth Option,15.71
2007-03-13,102932,ING Midcap Fund-Dividend Option,14.37
2007-03-13,102933,ING Midcap Fund-Bonus Option,15.71
2007-03-13,102941,SBI MIDCAP FUND - REGULAR PLAN - GROWTH,20.71
2007-03-13,102942,SBI Midcap Fund - Regular Plan - Income Distribution cum Capital Withdrawal Option (IDCW),17.8
2007-03-13,102947,HDFC Hybrid Equity Fund - IDCW Plan,13.441
2007-03-13,102948,HDFC Hybrid Equity Fund - Growth Plan,17.214
2007-03-13,102951,ABN  AMRO Opportunities Fund-Growth,19.173
2007-03-13,102952,ABN  AMRO Opportunities Fund-Dividend,16.501
2007-03-13,102957,ICICI Prudential Multicap Fund - Institutional Option - I,20.46
2007-03-13,102960,Z-OLD-SBI Magnum Inst. Income Fund -  Savings - Fortnightly(D)(Upto 22/03/07) Renamed as SBI Premier Liquid Fund,10.0987
2007-03-13,102961,Fidelity Equity Fund-Growth Option,20.224
2007-03-13,102962,Fidelity Equity Fund-Dividend Option,17.847
2007-03-13,103001,Kotak Dynamic FOF---Growth,16.28
2007-03-13,103024,SBI LARGE & MIDCAP FUND- REGULAR PLAN -Growth,49.63
2007-03-13,103025,UTI Dividend Yield Fund - Regular Plan - IDCW,11.12
2007-03-13,103026,UTI-Dividend Yield Fund.-Growth,15.13
2007-03-13,103027,ICICI Prudential Blended Plan A - Growth,11.4857
2007-03-13,103028,ICICI Prudential Blended Plan A -  Dividend,10.9338
