date,scheme_code,scheme_name,nav
2007-03-13,100027,Grindlays Super Saver Income Fund-GSSIF-Half Yearly Dividend,10.3162
2007-03-13,100028,Grindlays Super Saver Income Fund-GSSIF-Quaterly Dividend,10.2294
2007-03-13,100029,Grindlays Super Saver Income Fund-GSSIF-Growth,16.7751
2007-03-13,100030,Grindlays Super Saver Income Fund-GSSIF-Annual Dividend,10.5426
2007-03-13,100031,Grindlays Super Saver Income Fund-GSSIF - ST-Dividend,10.0166
2007-03-13,100032,Grindlays Super Saver Income Fund-GSSIF - ST-Growth,14.6722
2007-03-13,100033,Aditya Birla Sun Life Large & Mid Cap Fund - Regular Growth,117.67
2007-03-13,100034,Aditya Birla Sun Life Large & Mid Cap Fund -Regular - IDCW,84.41
2007-03-13,100035,Birla Sun Life Freedom Fund-Plan A (Dividend),17.77
2007-03-13,100036,Birla Sun Life Freedom Fund-Plan B (Growth),26.73
2007-03-13,100037,Aditya Birla Sun Life Income Fund - Regular - Quarterly IDCW,10.1448
2007-03-13,100038,Aditya Birla Sun Life Income Fund - Growth - Regular Plan,30.267
2007-03-13,100041,Aditya Birla Sun Life Liquid Fund -Institutional - IDCW,10.8023
2007-03-13,100042,Aditya Birla Sun Life Liquid Fund-Retail (Growth),20.0684
2007-03-13,100043,Aditya Birla Sun Life Liquid Fund-Institutional (Growth),20.2095
2007-03-13,100044,Aditya Birla Sun Life Liquid Fund -Retail - IDCW,16.3694
2007-03-13,100046,Aditya Birla Sun Life Liquid Fund -Daily IDCW,10.0195
2007-03-13,100047,Aditya Birla Sun Life Liquid Fund - Growth,11.8711
2007-03-13,100048,Aditya Birla Sun Life Liquid Fund -Institutional - weekly  IDCW,10.8157
2007-03-13,100049,Aditya Birla Sun Life Cash Plus-Institutional - Fortnightly Dividend,10.8299
2007-03-13,100051,Aditya Birla Sun Life Liquid Fund -weekly IDCW,10.031
2007-03-13,100052,Aditya Birla Sun Life Cash Plus-Institutional Premium - Fortnightly Dividend,10.0671
2007-03-13,100053,Aditya Birla Sun Life Cash Plus-Institutional Premium Plan-Monthly Dividend,10.0277
2007-03-13,100054,Aditya Birla Sun Life Gilt Plus - Liquid Plan - Quarterly Dividend - Regular Plan,10.7953
2007-03-13,100055,Aditya Birla Sun Life Gilt Plus - Liquid Plan - Growth - Regular Plan,18.1591
2007-03-13,100056,Aditya Birla Sun Life Gilt Plus - Liquid Plan - Annual Dividend - Regular Plan,12.092
2007-03-13,100057,Aditya Birla Sun Life Govenment Securities Fund -Regular - Quarterly IDCW,10.5885
2007-03-13,100058,Aditya Birla Sun Life Government Securities Fund  - Growth - Regular Plan,20.6169
2007-03-13,100059,Aditya Birla Sun Life Gilt Plus-PF Plan (Annual Dividend),20.6173
2007-03-13,100060,Aditya Birla Sun Life Constant Maturity 10 Year Gilt Fund - Quarterly Dividend - Regular Plan,11.1672
2007-03-13,100061,Aditya Birla Sun Life Constant Maturity 10 Year Gilt Fund - Growth - Regular Plan,23.2718
2007-03-13,100062,Aditya Birla Sun Life Gilt Plus-Regular Plan (Annual Dividend),23.3193
2007-03-13,100063,Aditya Birla Sun Life MNC Fund - Regular - IDCW,57.23
2007-03-13,100064,Aditya Birla Sun Life MNC Fund - Growth - Regular Plan,114.16
2007-03-13,100065,Aditya Birla Sun Life India Opportunities Fund - Dividend - Regular Plan,21.48
2007-03-13,100066,Aditya Birla Sun Life India Opportunities Fund - Growth - Regular Plan,50.01
2007-03-13,100067,Aditya Birla Sun Life Tax Plan -Regular - IDCW,53.64
2007-03-13,100068,BARODA ELSS 96 - Plan A - IDCW,18.44
2007-03-13,100069,BARODA PIONEER DIVERSIFIED FUND,28.33
2007-03-13,100077,DSP Bond Fund - IDCW,10.7294
2007-03-13,100078,DSP Bond Fund - Growth,25.0155
2007-03-13,100079,DSP Bond Fund - IDCW - Monthly,10.4024
2007-03-13,100080,DSP Flexi Cap Fund - Regular Plan - IDCW,36.898
2007-03-13,100081,DSP Aggressive Hybrid Fund- Regular Plan - Growth,36.907
2007-03-13,100082,DSP Aggressive Hybrid Fund- Regular Plan - IDCW,21.412
2007-03-13,100084,DSP Gilt Fund - Regular Plan - Growth,23.0282
2007-03-13,100085,DSP Gilt Fund - Regular Plan - IDCW,11.4772
2007-03-13,100086,DSP Gilt Fund - Regular Plan - IDCW - Monthly,10.1042
2007-03-13,100087,DSP Savings Fund - Regular Plan - Growth,16.8756
2007-03-13,100088,DSP Savings Fund - Regular Plan - IDCW,11.1331
2007-03-13,100089,DSP Savings Fund - Regular Plan - IDCW - Monthly,10.0836
2007-03-13,100090,DSP BlackRock Technology.com   Fund - Regular Plan - Growth,25.369
2007-03-13,100119,HDFC Balanced Advantage Fund - Growth Plan,44.04
2007-03-13,100120,HDFC Balanced Advantage Fund - IDCW Plan,23.909
2007-03-13,100121,HDFC Balanced Fund - Dividend Option,16.24
2007-03-13,100122,HDFC Balanced Fund - Growth Option,28.748
2007-03-13,100123,HDFC Income Fund - Quarterly IDCW Option,10.1161
2007-03-13,100124,HDFC Income Fund - Growth Option,16.5479
2007-03-13,100150,Principal Child Benefit Fund-Super Saver-Future Guard Plan,54.45
2007-03-13,100151,Principal Retail Equity Savings Fund - Growth Option,55.18
2007-03-13,100152,Principal Nifty 100 Equal Weight Fund-Income Distribution CUM Capital Withdrawal,20.8629
2007-03-13,100153,Principal Nifty 100 Equal Weight Fund-Growth,26.9666
2007-03-13,100156,Principal Tax Savings Fund,72.14
2007-03-13,100171,Quant Dynamic Bond-Dividend,10.0709
2007-03-13,100172,Quant Dynamic Bond-Growth,22.5805
2007-03-13,100173,Quant Dynamic Bond-Bonus,11.8936
2007-03-13,100174,quant ELSS Tax Saver Fund - IDCW Option - Regular Plan,14.0957
2007-03-13,100175,quant ELSS Tax Saver Fund - Growth Option - Regular Plan,40.0296
2007-03-13,100176,quant Small Cap Fund - IDCW Option - Regular Plan,16.2295
2007-03-13,100177,quant Small Cap Fund - Growth - Regular Plan,19.2263
2007-03-13,100178,ING Income Fund-Regular Plan -Dividend Option (Quarterly),10.189
2007-03-13,100179,ING Income Fund-Regular Plan -Dividend Option (Half Yearly),10.3367
2007-03-13,100180,ING Income Fund- Regular Plan - Dividend Option (Annual),10.6783
2007-03-13,100181,ING Income Fund-Regular Plan -Growth Option,18.1521
2007-03-13,100182,ING Income Fund-Institutional Plan - Dividend Option (Half Yearly),10.0
2007-03-13,100183,ING Income Fund-Institutional Plan - Dividend Option (Quarterly),10.0
2007-03-13,100184,ING Income Fund-Institutional Plan -Dividend Option (Annual),10.7174
2007-03-13,100185,ING Income Fund-Bonus Option,11.0678
2007-03-13,100186,ING Income Fund-Institutional Bonus Option,11.3194
2007-03-13,100187,ING Income Fund-Institutional Plan - Growth Option,18.9089
2007-03-13,100188,ING Core Equity Fund-Dividend Option,13.42
2007-03-13,100189,ING Core Equity Fund-Growth Option,25.39
2007-03-13,100190,ING Liquid Fund-Regular Growth Option,15.8055
2007-03-13,100191,ING Liquid Fund-Regular Weekly Dividend Option,10.8264
2007-03-13,100192,ING Liquid Fund-Regular Daily Dividend Option,10.7873
2007-03-13,100194,ING Liquid Fund-Auto Sweep Growth Option,10.0
2007-03-13,100195,ING Liquid Fund-Auto Sweep Weekly Dividend Option,10.0
2007-03-13,100196,ING Liquid Fund-Institutional Growth Option,11.7251
2007-03-13,100197,ING Liquid Fund-Institutional Weekly Dividend Option,10.0559
2007-03-13,100198,ING Liquid Fund-Institutional Daily Dividend Option,10.0121
2007-03-13,100199,ING Liquid Fund-Super Institutional Growth Option,11.0988
2007-03-13,100200,ING Liquid Fund-Super Institutional Daily Dividend Option,10.0048
2007-03-13,100201,ING Liquid Fund-Super Institutional Weekly Dividend Option,10.0865
2007-03-13,100202,ING Balanced Fund-Dividend Option,12.46
2007-03-13,100203,ING Balanced Fund-Growth Option,17.81
2007-03-13,100218,JM Large Cap Fund (Regular) - IDCW,14.9
2007-03-13,100219,JM Large Cap Fund (Regular) - Growth Option,33.15
2007-03-13,100220,JM Aggressive Hybrid Fund (Regular) - IDCW,16.64
2007-03-13,100221,JM Aggressive Hybrid Fund (Regular) -Growth Option,21.89
2007-03-13,100222,JM Medium to Long Duration Fund (Regular) - Quarterly IDCW,10.3515
2007-03-13,100223,JM Medium to Long Duration Fund (Regular) - Growth Option,28.6935
2007-03-13,100233,JM Liquid Fund (Regular) - Weekly IDCW,10.3976
2007-03-13,100234,JM Liquid Fund - Growth Option,20.4963
2007-03-13,100237,JM High Liquidity Fund-- Institutional Plan - Growth,12.3654
2007-03-13,100238,JM High Liquidity Fund-Institutional Plan - Daily Dividend,10.0159
2007-03-13,100241,JM High Liquidity Fund-- Institutional Plan - Dividend,10.1622
2007-03-13,100243,JM High Liquidity Fund-- Premium Plan - Daily Dividend Option,10.0
2007-03-13,100244,JM Liquid Fund (Regular) - Quarterly IDCW,11.8009
2007-03-13,100245,JM High Liquidity Fund-Super Institutional Plan- Daily Dividend,10.0165
2007-03-13,100246,JM High Liquidity Fund-Super Institutional Plan- Weekly  Dividend,10.15
2007-03-13,100247,JM Liquid Fund (Regular) - Super Institutional Plan - Growth Option,11.758
2007-03-13,100249,JM G-Sec Fund - Quarterly Dividend Option,10.3575
2007-03-13,100250,JM G-Sec Fund - Growth Option,21.1857
2007-03-13,100251,JM G-Sec Fund-PF Plan - Growth Plan,22.0311
2007-03-13,100252,JM G-Sec Fund-PF Plan -Dividend Plan,20.187
2007-03-13,100253,JM G-Sec Fund - Bonus Option - Principal Units,10.3056
2007-03-13,100254,JM Value Fund (Regular) - Growth Option,18.31
2007-03-13,100261,Kotak Gilt-Savings-Monthly Dividend,10.4233
2007-03-13,100262,Kotak Gilt-Savings-Growth,18.1308
2007-03-13,100263,Kotak Gilt-Savings-Annual Dividend,12.1246
2007-03-13,100264,Kotak Gilt-Investment Regular-Payout of Income Distribution cum capital withdrawal option,11.3254
2007-03-13,100265,Kotak Gilt-Investment Regular-Growth,23.5446
2007-03-13,100280,Kotak Gilt-Investment  Provident Fund and Trust-Payout of Income Distribution cum capital withdrawal option,10.7668
2007-03-13,100281,Kotak Gilt-Investment  Provident Fund and Trust-Growth,23.8508
2007-03-13,100286,Kotak Aggressive Hybrid Fund - Regular Plan - IDCW - Payout & Reinvestment of Income Distribution cum capital withdrawal option,22.534
2007-03-13,100289,Kotak Tech,10.368
2007-03-13,100290,Kotak MNC,25.008
2007-03-13,100291,Kotak Bond-Deposit-Dividend,11.7469
2007-03-13,100292,Kotak Bond-Deposit-Growth,18.5865
2007-03-13,100298,Kotak Bond Regular Plan Quaterly Payout of Income Distribution cum capital withdrawal option,10.4421
2007-03-13,100299,Kotak Bond Fund - Regular Plan Growth,19.5385
2007-03-13,100300,Kotak Bond Fund - Regular Plan - Standard IDCW Option,13.0579
2007-03-13,100301,Kotak Bond Regular Plan Bonus Plan,13.0234
2007-03-13,100312,LIC MF Flexi Cap Fund-Regular Plan-IDCW,10.6193
2007-03-13,100313,LIC MF Flexi Cap Fund-Regular Plan-Growth,19.1946
2007-03-13,100314,LIC MF Medium to Long Duration Fund-Regular Plan-IDCW,10.1745
2007-03-13,100315,LIC MF Medium to Long Duration Fund-Regular Plan-Growth,19.912
2007-03-13,100316,LIC MF Gilt Fund-Regular Plan-IDCW,10.9826
2007-03-13,100317,LIC MF Gilt Fund-Regular Plan-Growth,18.8969
2007-03-13,100318,LIC MF Gilt Fund-PF Plan-IDCW,10.8967
2007-03-13,100319,LIC MF Gilt Fund-PF Plan-Growth,10.8967
2007-03-13,100321,LIC MF Aggressive Hybrid Fund-Regular Plan-IDCW,9.8624
2007-03-13,100323,LIC MF Aggressive Hybrid Fund-Regular Plan-Growth,41.6654
2007-03-13,100325,LIC MF ULIS (5 Yrs. Single Premium)-Regular Plan-IDCW Reinvestment,10.1804
2007-03-13,100332,LIC MF Large Cap Fund-Regular Plan-IDCW,9.9138
2007-03-13,100337,SaharaTax Gain-Dividend,16.5105
2007-03-13,100338,SaharaTax Gain-Growth,18.9242
2007-03-13,100347,Morgan Stanley Growth Fund- Regular Growth Plan,47.57
2007-03-13,100348,ICICI Prudential Large & Mid Cap Fund - IDCW,21.4
2007-03-13,100349,ICICI Prudential Large & Mid Cap Fund - Growth,87.4
2007-03-13,100350,ICICI Prudential Large & Mid Cap Fund - Institutional Option - I - Growth,11.61
2007-03-13,100351,ICICI Prudential FMCG Fund - IDCW,30.25
2007-03-13,100352,ICICI Prudential FMCG Fund - Growth,38.02
2007-03-13,100353,ICICI Prudential ELSS Tax Saver Fund - IDCW,19.81
2007-03-13,100354,ICICI Prudential ELSS Tax Saver Fund - Growth,82.51
2007-03-13,100355,ICICI Prudential Equity & Debt Fund - Monthly IDCW,17.3
2007-03-13,100356,ICICI Prudential Equity & Debt Fund - Growth,33.18
2007-03-13,100357,ICICI Prudential Liquid Fund -Quarterly IDCW,10.8843
2007-03-13,100359,ICICI Prudential Liquid Institutional Plus Fund - Div - Daily,11.8515
2007-03-13,100360,ICICI Prudential Liquid Institutional Plus Fund - Div - Weekly,11.8564
2007-03-13,100361,ICICI Prudential Liquid Fund-Dividend-Institutional Plus - Monthly,11.9507
2007-03-13,100362,ICICI Prudential Liquid Institutional Plus Fund - Growth,18.5282
2007-03-13,100363,ICICI Prudential Technology Fund - Growth,15.15
2007-03-13,100364,ICICI Prudential Long Term Bond Fund - Half Yearly IDCW,10.5443
2007-03-13,100365,ICICI Prudential Long Term Bond Fund - Growth,21.452
2007-03-13,100366,ICICI Prudential Long Term Bond Fund-Institutional Quarterly Dividend,10.1587
2007-03-13,100367,ICICI Prudential Long Term Bond Fund - Quarterly IDCW,10.9693
2007-03-13,100368,ICICI Prudential Gilt Fund - IDCW,10.5602
2007-03-13,100369,ICICI Prudential Gilt Fund - Growth,22.324
2007-03-13,100370,ICICI Prudential Short Term Gilt Fund - Dividend,10.4059
2007-03-13,100371,ICICI Prudential Short Term Gilt Fund - Growth,17.8561
2007-03-13,100372,ICICI Prudential Short Term Gilt Fund - Half Yearly Dividend,10.0986
2007-03-13,100375,NIPPON INDIA GROWTH MID CAP FUND - IDCW Option,47.16
2007-03-13,100376,Nippon India Growth Mid Cap Fund-Growth Plan-Bonus Option,42.4
2007-03-13,100377,Nippon India Growth Mid Cap Fund-Growth Plan-Growth Option,255.74
2007-03-13,100378,Nippon India Vision Large & Midcap Fund - IDCW Option,42.98
2007-03-13,100379,Nippon India Vision Large & Midcap Fund-GROWTH PLAN-Bonus Option,28.22
2007-03-13,100380,Nippon India Vision Large & Midcap Fund-GROWTH PLAN-Growth Option,168.37
2007-03-13,100381,UTI Large Cap Fund-Income Option,16.33
2007-03-13,100382,UTI Large Cap Fund-Growth Option,18.73
2007-03-13,100383,NIPPON INDIA MEDIUM TO LONG DURATION FUND - MONTHLY IDCW Option,10.9379
2007-03-13,100384,NIPPON INDIA MEDIUM TO LONG DURATION  FUND - QUARTERLY IDCW Option,11.8683
2007-03-13,100385,NIPPON INDIA MEDIUM TO LONG DURATION  FUND - HALF YEARLY IDCW Option,11.3009
2007-03-13,100386,NIPPON INDIA MEDIUM TO LONG DURATION  FUND - ANNUAL IDCW Option,12.0677
2007-03-13,100387,Nippon India Medium to Long Duration  Fund - Growth Plan Growth Option,23.1418
2007-03-13,100388,Nippon India Medium to Long Duration  Fund - Growth Plan Bonus Option,10.9059
2007-03-13,100414,Tata Aggressive Hybrid Fund- Regular Plan - Growth Option,47.7956
2007-03-13,100415,Tata Ethical Fund-Regular Plan - Growth Option,44.3293
2007-03-13,100416,Tata Long Term Debt Fund - Regular Plan - Quarterly Dividend,10.4101
2007-03-13,100417,Tata Income Fund-Regular Plan - Half Yearly Payout of IDCW Option,10.968
2007-03-13,100418,Tata Income Fund -Regular Plan - Growth Option,24.9443
2007-03-13,100470,Franklin India Large Cap Fund - IDCW,34.91
2007-03-13,100471,Franklin India Large Cap Fund-Growth,121.13
2007-03-13,100472,Franklin India Mid Cap Fund - IDCW,51.78
2007-03-13,100473,Franklin India Mid Cap Fund-Growth,185.96
2007-03-13,100474,Tata ELSS Fund- Regular Plan - Payout of IDCW Option,39.7803
2007-03-13,100475,Tata Large Cap Fund -Regular Plan - Growth Option,58.0878
2007-03-13,100476,Taurus Flexi Cap Fund - Regular Plan - Growth,36.92
2007-03-13,100477,Taurus Mid Cap Fund - Regular Plan - Growth,14.4
2007-03-13,100480,Taurus ELSS Tax Saver Fund - Regular Plan - Growth,15.8
2007-03-13,100481,Franklin India Balanced Fund-Growth,34.47
2007-03-13,100482,Franklin India Balanced Fund-Div,29.79
2007-03-13,100483,Franklin India Growth Fund,28.38
2007-03-13,100484,Franklin India Index Fund- NSE Nifty 50 Index Fund - Growth,30.0425
2007-03-13,100485,Franklin India Govt.Sec. Fund-Composite Plan - Growth,24.2048
2007-03-13,100486,Franklin India Govt.Sec. Fund-Composite Plan - Dividend,10.7774
2007-03-13,100487,Franklin India Govt.Sec. Fund-Treasury Plan(Dividend Option),10.7712
2007-03-13,100489,Franklin India Govt.Sec. Fund-Treasury Plan(Growth Option),13.9374
2007-03-13,100490,Franklin India Govt.Sec. Fund-PF Plan - Growth,10.6316
2007-03-13,100491,Franklin India Govt.Sec. Fund-PF Plan - Dividend,10.6316
2007-03-13,100493,Franklin India Government Securities Fund - Growth,16.5566
2007-03-13,100494,Franklin India Government Securities Fund - IDCW,10.8116
2007-03-13,100495,Franklin India Govt.Sec. Fund-Long Term Plan - Bonus,11.9936
2007-03-13,100496,Templeton India Value Fund - Growth Plan,61.02
2007-03-13,100497,Templeton India Value Fund - IDCW,36.08
2007-03-13,100498,Franklin India Dynamic Accrual Fund - IDCW,10.4915
2007-03-13,100499,Franklin India Dynamic Accrual Fund-Growth,25.6615
2007-03-13,100503,Franklin India Low Duration Fund - Monthly - IDCW,10.1925
2007-03-13,100504,Franklin India Low Duration Fund - Quarterly - IDCW,10.1823
2007-03-13,100505,Templeton Monthly Income Plan-Half Yearly Dividend,12.2103
2007-03-13,100506,Templeton Monthly Income Plan-Growth,19.6868
2007-03-13,100519,Franklin India Flexi Cap Fund - IDCW,29.47
2007-03-13,100520,Franklin India Flexi Cap Fund - Growth,131.46
2007-03-13,100521,Franklin India Technology Fund - IDCW,25.02
2007-03-13,100522,Franklin India Technology Fund-Growth,53.77
2007-03-13,100523,Franklin FMCG Fund - Growth,31.6
2007-03-13,100524,Franklin INDIA OPPORTUNITIES FUND - IDCW,14.18
2007-03-13,100525,Franklin India ELSS Tax Saver Fund - IDCW,30.19
2007-03-13,100526,Franklin India ELSS Tax Saver Fund-Growth,119.21
2007-03-13,100527,Franklin India Corporate Debt Fund - Plan A - Annual - IDCW,10.6135
2007-03-13,100528,Franklin India Corporate Debt Fund - Growth,24.8974
2007-03-13,100529,Franklin India Corporate Debt Fund - Plan B - Monthly - IDCW,13.4296
2007-03-13,100530,Franklin India Corporate Debt Fund - Plan B - Quarterly - IDCW,13.7909
2007-03-13,100531,Franklin India Corporate Debt Fund - Plan B - Half yearly - IDCW,13.9789
2007-03-13,100532,Franklin India Corporate Debt Fund - Monthly Bonus,18.9855
2007-03-13,100535,Franklin India Retirement Fund - IDCW,16.5006
2007-03-13,100536,Franklin India Retirement Fund - Growth,42.9305
2007-03-13,100537,Franklin India Liquid Fund - Regular Plan - Weekly - IDCW,1244.8387
2007-03-13,100538,Franklin India Liquid Fund - Regular Plan - Growth,1854.3412
2007-03-13,100541,Franklin India Liquid Fund - Regular Plan - Daily - IDCW,1512.34
2007-03-13,100542,Franklin India Liquid Fund - Liquid Plan - Weekly Dividend,1000.9752
2007-03-13,100543,Franklin India Liquid Fund - Liquid Plan - Daily IDCW,1000.25
2007-03-13,100544,Franklin India Liquid Fund - Liquid Plan - Growth,1140.6283
2007-03-13,100546,Franklin India Liquid Fund - Super Institutional Plan - Growth,1102.8617
2007-03-13,100547,Franklin India Liquid Fund - Super Institutional Plan - Daily - IDCW,1000.25
2007-03-13,100548,Franklin India Liquid Fund - Super Institutional Plan - Weekly - IDCW,1016.5891
2007-03-13,100549,Franklin India Aggressive Hybrid Fund - IDCW,22.7313
2007-03-13,100550,Franklin India Aggressive Hybrid Fund - Growth Plan,31.9167
2007-03-13,100551,Templeton India Children’s Asset Plan-Education Plan,25.3506
2007-03-13,100552,Templeton India Children’s Asset Plan-Gift Plan - Growth,30.2564
2007-03-13,100553,Templeton India Children’s Asset Plan-Gift Plan - Dividend,30.2564
2007-03-13,100556,Franklin India Taxshield 97,115.76
2007-03-13,100557,Franklin India Taxshield 98,117.79
2007-03-13,100558,Franklin India Taxshield 99,69.69
2007-03-13,100561,Templeton India Money Market Account - Bonus Plan,1.0
2007-03-13,100563,DBS Chola Triple Ace-Regular -Cumulative,23.9432
2007-03-13,100567,DBS Chola Triple Ace-Regular - Quarterly Dividend,11.2734
2007-03-13,100569,DBS Chola Triple Ace-Semi Annual Dividend,11.5861
2007-03-13,100573,DBS Chola Triple Ace-Regular Bonus,13.3038
2007-03-13,100574,DBS Chola Freedom Income -Short Term Fund-Regular-Monthly Dividend,10.9696
2007-03-13,100575,DBS Chola Freedom Income -Short Term Fund-Regular - Cumulative,11.8416
2007-03-13,100576,DBS Chola Freedom Income -Short Term Fund-Cum- Institutional Plan,11.9838
2007-03-13,100579,DBS Chola Gilt-Investment-Quarterly Dividend,10.201
2007-03-13,100580,DBS Chola Gilt-Investment-Cumulative,18.5467
2007-03-13,100589,Canara Robeco Expo-Income Plan,19.08
2007-03-13,100590,Canara Robeco Expo-Growth Plan,50.13
2007-03-13,100593,CANARA ROBECO ELSS TAX SAVER - REGULAR PLAN -IDCW (Payout),20.8
2007-03-13,100596,CANARA ROBECO GILT FUND - REGULAR PLAN - IDCW (Payout/Reinvestment),10.4858
2007-03-13,100597,CANARA ROBECO GILT FUND - REGULAR PLAN - GROWTH OPTION,18.3727
2007-03-13,100600,CANARA ROBECO CONSERVATIVE HYBRID FUND - REGULAR PLAN - MONTHLY IDCW (Payout/Reinvestment),11.5
2007-03-13,100601,CANARA ROBECO CONSERVATIVE HYBRID FUND - REGULAR PLAN - GROWTH OPTION,18.98
2007-03-13,100602,Sundaram Medium Duration Fund (Formerly Known as Sundaram Medium Term Bond Fund) Regular Plan-Income Distribution cum Capital Withdrawal(IDCW),10.1999
2007-03-13,100603,Sundaram Medium Duration Fund (Formerly Known as Sundaram Medium Term Bond Fund) Regular Plan - Growth,22.7364
2007-03-13,100604,Sundaram Medium Duration Fund (Formerly Known as Sundaram Medium Term Bond Fund) Regular Plan -Growth,11.9678
2007-03-13,100609,Sundaram Medium Duration Fund (Formerly Known as Sundaram Medium Term Bond Fund) Regular Plan- Income Distribution cum Capital Withdrawal(IDCW),10.4462
2007-03-13,100610,Sundaram Medium Duration Fund (Formerly Known as Sundaram Medium Term Bond Fund) Regular Plan -Income Distribution cum Capital Withdrawal (IDCW),10.448
2007-03-13,100611,Sundaram Medium Duration Fund (Formerly Known as Sundaram Medium Term Bond Fund) Institutional Plan -Growth,11.6406
2007-03-13,100612,Sundaram Growth Fund-Dividend,13.569
2007-03-13,100613,Sundaram Growth Fund-Growth,62.0361
2007-03-13,100614,Sundaram Value Fund Regular Plan - Income Distribution cum Capital Withdrawal (IDCW),14.2102
2007-03-13,100617,Sundaram Equity Hybrid Fund Regular Plan - Growth,30.8968
2007-03-13,100618,Sundaram Money Fund Retail Plan - Growth,15.6453
2007-03-13,100619,Sundaram Money Fund Retail Plan - Quarterly Reinvestment of Income Distribution cum Capital Withdrawal (IDCW),10.2093
2007-03-13,100620,Sundaram Money Fund Retail Plan - Daily Reinvestment of Income Distribution cum Capital Withdrawal (IDCW),10.0953
2007-03-13,100621,Sundaram Money Fund Retail Plan - Weekly Reinvestment of Income Distribution cum Capital Withdrawal (IDCW),10.3355
2007-03-13,100622,Sundaram Money Fund Retail Plan - Fortnightly Reinvestment of Income Distribution cum Capital Withdrawal (IDCW),10.2324
2007-03-13,100623,Sundaram Money Fund Retail Plan - Monthly Income Distribution cum Capital Withdrawal (IDCW),10.1462
2007-03-13,100630,quant Multi Cap Fund-IDCW Option - Regular Plan,14.5235
2007-03-13,100631,quant Multi Cap Fund-GROWTH OPTION - Regular Plan,49.3107
2007-03-13,100638,SBI Medium to Long Duration Fund - Regular Plan - Half Yearly - Income Distribution cum Capital Withdrawal Option (IDCW),10.2192
2007-03-13,100639,SBI Medium to Long Duration Fund-REGULAR PLAN-Growth,19.7821
2007-03-13,100640,SBI Medium to Long Duration Fund-REGULAR PLAN-Bonus,11.9827
2007-03-13,100641,SBI ULTRA SHORT DURATION FUND - REGULAR PLAN - GROWTH,16.7425
2007-03-13,100643,SBI Technology Opportunities Fund - Regular Plan - Income Distribution cum Capital Withdrawal Option (IDCW),27.74
2007-03-13,100644,SBI Healthcare Opportunities Fund - Regular Plan - Income Distribution cum Capital Withdrawal Option (IDCW),26.7
2007-03-13,100645,SBI Consumption Opportunities Fund - Regular Plan - Income Distribution cum Capital Withdrawal Option (IDCW),12.63
2007-03-13,100646,UTI - Unit Linked Insurance Plan,15.2654
2007-03-13,100648,UTI - CRTS 81 - Dividend Option,107.7866
2007-03-13,100650,UTI Large Cap Fund - Regular Plan - IDCW,26.05
2007-03-13,100651,UTI Large Cap Fund - Regular Plan - Growth Option,32.35
2007-03-13,100656,UTI - Master Plus Unit Scheme-Growth Option,61.02
2007-03-13,100657,UTI - Master Plus Unit Scheme-Income Option,46.82
2007-03-13,100663,UTI Large & Mid Cap Fund - Regular Plan - IDCW,38.0
2007-03-13,100664,UTI Large & Mid Cap Fund - Regular Plan - Growth Option,41.22
2007-03-13,100668,UTI Flexi Cap Fund - Regular Plan - IDCW,28.03
2007-03-13,100669,UTI - Flexi Cap Fund-Growth Option,30.31
2007-03-13,100678,UTI Children's Hybrid Fund - Regular Plan,14.4479
2007-03-13,100682,UTI Retirement Fund - Regular Plan,19.1422
2007-03-13,100684,UTI Aggressive Hybrid Fund - Regular Plan - Growth,51.79
2007-03-13,100685,UTI Aggressive Hybrid Fund - Regular Plan - IDCW,20.47
2007-03-13,100711,UTI - INDEX SELECT FUND-Income Option,21.85
2007-03-13,100712,UTI - INDEX SELECT FUND-Growth Option,32.37
2007-03-13,100715,DBS Chola Multi-Cap Fund-Dividend Option,13.48
2007-03-13,100716,DBS Chola Multi-Cap Fund-Cumulative Option,16.91
2007-03-13,100723,UTI MMF-Discontinued - Regular Plan -Growth,20.9412
2007-03-13,100724,UTI MMF- Discontinued - Regular Plan - Flexi Dividend Option,17.6663
2007-03-13,100725,UTI MMF- Discontinued - Regular Plan - Periodic Dividend Option,17.5491
2007-03-13,100739,UTI MNC Fund - Regular Plan - IDCW,26.61
2007-03-13,100740,UTI - MNC Fund - Regular Plan - Growth Option,32.04
2007-03-13,100741,UTI Medium to Long Duration Fund- Regular Plan - Growth,21.593
2007-03-13,100742,UTI Medium to Long Duration Fund - Regular Plan - Quarterly IDCW,10.8676
2007-03-13,100748,UTI - Master Index Fund-Income Option,40.7201
2007-03-13,100749,UTI - Master Index Fund-Growth Option,40.72
2007-03-13,100750,UTI - Master Value Fund-Income Option,17.63
2007-03-13,100751,UTI - Master Value Fund-Growth Option,27.04
2007-03-13,100780,Sundaram Banking & PSU Fund (Formerly Known as Sundaram Banking and PSU Debt Fund) Retail Plan - Monthly Income Distribution cum Capital Withdrawal (IDCW),10.1965
2007-03-13,100781,Sundaram Banking & PSU Fund (Formerly Known as Sundaram Banking and PSU Debt Fund) Retail Plan - Growth,11.3026
2007-03-13,100782,Sundaram Banking & PSU Fund (Formerly Known as Sundaram Banking and PSU Debt Fund) Regular Plan - Daily Reinvestment of Income Distribution cum Capital Withdrawal (IDCW),10.0519
2007-03-13,100784,Sundaram Banking & PSU Fund (Formerly Known as Sundaram Banking and PSU Debt Fund) Regular Plan - Growth,11.4324
