date,scheme_code,scheme_name,nav
2007-04-16,100027,Grindlays Super Saver Income Fund-GSSIF-Half Yearly Dividend,10.1842
2007-04-16,100028,Grindlays Super Saver Income Fund-GSSIF-Quaterly Dividend,10.1972
2007-04-16,100029,Grindlays Super Saver Income Fund-GSSIF-Growth,16.887
2007-04-16,100030,Grindlays Super Saver Income Fund-GSSIF-Annual Dividend,10.2116
2007-04-16,100031,Grindlays Super Saver Income Fund-GSSIF - ST-Dividend,10.0539
2007-04-16,100032,Grindlays Super Saver Income Fund-GSSIF - ST-Growth,14.892
2007-04-16,100033,Aditya Birla Sun Life Large & Mid Cap Fund - Regular Growth,124.56
2007-04-16,100034,Aditya Birla Sun Life Large & Mid Cap Fund -Regular - IDCW,89.36
2007-04-16,100035,Birla Sun Life Freedom Fund-Plan A (Dividend),18.44
2007-04-16,100036,Birla Sun Life Freedom Fund-Plan B (Growth),27.74
2007-04-16,100037,Aditya Birla Sun Life Income Fund - Regular - Quarterly IDCW,10.0927
2007-04-16,100038,Aditya Birla Sun Life Income Fund - Growth - Regular Plan,30.4308
2007-04-16,100041,Aditya Birla Sun Life Liquid Fund -Institutional - IDCW,10.8023
2007-04-16,100042,Aditya Birla Sun Life Liquid Fund-Retail (Growth),20.2325
2007-04-16,100043,Aditya Birla Sun Life Liquid Fund-Institutional (Growth),20.3766
2007-04-16,100044,Aditya Birla Sun Life Liquid Fund -Retail - IDCW,16.3694
2007-04-16,100046,Aditya Birla Sun Life Liquid Fund -Daily IDCW,10.0195
2007-04-16,100047,Aditya Birla Sun Life Liquid Fund - Growth,11.9721
2007-04-16,100048,Aditya Birla Sun Life Liquid Fund -Institutional - weekly  IDCW,10.8142
2007-04-16,100049,Aditya Birla Sun Life Cash Plus-Institutional - Fortnightly Dividend,10.8284
2007-04-16,100051,Aditya Birla Sun Life Liquid Fund -weekly IDCW,10.0296
2007-04-16,100052,Aditya Birla Sun Life Cash Plus-Institutional Premium - Fortnightly Dividend,10.0656
2007-04-16,100053,Aditya Birla Sun Life Cash Plus-Institutional Premium Plan-Monthly Dividend,10.0417
2007-04-16,100054,Aditya Birla Sun Life Gilt Plus - Liquid Plan - Quarterly Dividend - Regular Plan,10.6423
2007-04-16,100055,Aditya Birla Sun Life Gilt Plus - Liquid Plan - Growth - Regular Plan,18.235
2007-04-16,100056,Aditya Birla Sun Life Gilt Plus - Liquid Plan - Annual Dividend - Regular Plan,11.2913
2007-04-16,100057,Aditya Birla Sun Life Govenment Securities Fund -Regular - Quarterly IDCW,10.4398
2007-04-16,100058,Aditya Birla Sun Life Government Securities Fund  - Growth - Regular Plan,20.687
2007-04-16,100059,Aditya Birla Sun Life Gilt Plus-PF Plan (Annual Dividend),19.212
2007-04-16,100060,Aditya Birla Sun Life Constant Maturity 10 Year Gilt Fund - Quarterly Dividend - Regular Plan,11.0226
2007-04-16,100061,Aditya Birla Sun Life Constant Maturity 10 Year Gilt Fund - Growth - Regular Plan,23.3743
2007-04-16,100062,Aditya Birla Sun Life Gilt Plus-Regular Plan (Annual Dividend),21.7851
2007-04-16,100063,Aditya Birla Sun Life MNC Fund - Regular - IDCW,59.89
2007-04-16,100064,Aditya Birla Sun Life MNC Fund - Growth - Regular Plan,119.49
2007-04-16,100065,Aditya Birla Sun Life India Opportunities Fund - Dividend - Regular Plan,22.43
2007-04-16,100066,Aditya Birla Sun Life India Opportunities Fund - Growth - Regular Plan,52.23
2007-04-16,100067,Aditya Birla Sun Life Tax Plan -Regular - IDCW,57.0
2007-04-16,100068,BARODA ELSS 96 - Plan A - IDCW,19.37
2007-04-16,100069,BARODA PIONEER DIVERSIFIED FUND,31.34
2007-04-16,100077,DSP Bond Fund - IDCW,10.6454
2007-04-16,100078,DSP Bond Fund - Growth,25.0532
2007-04-16,100079,DSP Bond Fund - IDCW - Monthly,10.4181
2007-04-16,100080,DSP Flexi Cap Fund - Regular Plan - IDCW,39.093
2007-04-16,100081,DSP Aggressive Hybrid Fund- Regular Plan - Growth,38.437
2007-04-16,100082,DSP Aggressive Hybrid Fund- Regular Plan - IDCW,22.3
2007-04-16,100084,DSP Gilt Fund - Regular Plan - Growth,22.9524
2007-04-16,100085,DSP Gilt Fund - Regular Plan - IDCW,11.3897
2007-04-16,100086,DSP Gilt Fund - Regular Plan - IDCW - Monthly,10.071
2007-04-16,100087,DSP Savings Fund - Regular Plan - Growth,16.9142
2007-04-16,100088,DSP Savings Fund - Regular Plan - IDCW,10.9583
2007-04-16,100089,DSP Savings Fund - Regular Plan - IDCW - Monthly,10.1067
2007-04-16,100090,DSP BlackRock Technology.com   Fund - Regular Plan - Growth,26.683
2007-04-16,100119,HDFC Balanced Advantage Fund - Growth Plan,47.93
2007-04-16,100120,HDFC Balanced Advantage Fund - IDCW Plan,26.02
2007-04-16,100121,HDFC Balanced Fund - Dividend Option,17.31
2007-04-16,100122,HDFC Balanced Fund - Growth Option,30.636
2007-04-16,100123,HDFC Income Fund - Quarterly IDCW Option,10.136
2007-04-16,100124,HDFC Income Fund - Growth Option,16.5804
2007-04-16,100150,Principal Child Benefit Fund-Super Saver-Future Guard Plan,56.76
2007-04-16,100151,Principal Retail Equity Savings Fund - Growth Option,57.52
2007-04-16,100152,Principal Nifty 100 Equal Weight Fund-Income Distribution CUM Capital Withdrawal,22.1845
2007-04-16,100153,Principal Nifty 100 Equal Weight Fund-Growth,28.6748
2007-04-16,100156,Principal Tax Savings Fund,76.62
2007-04-16,100171,Quant Dynamic Bond-Dividend,10.0987
2007-04-16,100172,Quant Dynamic Bond-Growth,22.7232
2007-04-16,100173,Quant Dynamic Bond-Bonus,11.9683
2007-04-16,100174,quant ELSS Tax Saver Fund - IDCW Option - Regular Plan,12.4743
2007-04-16,100175,quant ELSS Tax Saver Fund - Growth Option - Regular Plan,42.8992
2007-04-16,100176,quant Small Cap Fund - IDCW Option - Regular Plan,16.5724
2007-04-16,100177,quant Small Cap Fund - Growth - Regular Plan,19.6325
2007-04-16,100178,ING Income Fund-Regular Plan -Dividend Option (Quarterly),10.1576
2007-04-16,100179,ING Income Fund-Regular Plan -Dividend Option (Half Yearly),10.2256
2007-04-16,100180,ING Income Fund- Regular Plan - Dividend Option (Annual),10.3679
2007-04-16,100181,ING Income Fund-Regular Plan -Growth Option,18.2213
2007-04-16,100182,ING Income Fund-Institutional Plan - Dividend Option (Half Yearly),10.0
2007-04-16,100183,ING Income Fund-Institutional Plan - Dividend Option (Quarterly),10.0
2007-04-16,100184,ING Income Fund-Institutional Plan -Dividend Option (Annual),10.3171
2007-04-16,100185,ING Income Fund-Bonus Option,11.11
2007-04-16,100186,ING Income Fund-Institutional Bonus Option,11.3737
2007-04-16,100187,ING Income Fund-Institutional Plan - Growth Option,18.9995
2007-04-16,100188,ING Core Equity Fund-Dividend Option,14.17
2007-04-16,100189,ING Core Equity Fund-Growth Option,26.81
2007-04-16,100190,ING Liquid Fund-Regular Growth Option,15.9289
2007-04-16,100191,ING Liquid Fund-Regular Weekly Dividend Option,10.84
2007-04-16,100192,ING Liquid Fund-Regular Daily Dividend Option,10.7873
2007-04-16,100194,ING Liquid Fund-Auto Sweep Growth Option,10.0
2007-04-16,100195,ING Liquid Fund-Auto Sweep Weekly Dividend Option,10.0
2007-04-16,100196,ING Liquid Fund-Institutional Growth Option,11.8206
2007-04-16,100197,ING Liquid Fund-Institutional Weekly Dividend Option,10.0691
2007-04-16,100198,ING Liquid Fund-Institutional Daily Dividend Option,10.0121
2007-04-16,100199,ING Liquid Fund-Super Institutional Growth Option,11.1908
2007-04-16,100200,ING Liquid Fund-Super Institutional Daily Dividend Option,10.0048
2007-04-16,100201,ING Liquid Fund-Super Institutional Weekly Dividend Option,10.0166
2007-04-16,100202,ING Balanced Fund-Dividend Option,12.95
2007-04-16,100203,ING Balanced Fund-Growth Option,18.51
2007-04-16,100218,JM Large Cap Fund (Regular) - IDCW,15.76
2007-04-16,100219,JM Large Cap Fund (Regular) - Growth Option,35.07
2007-04-16,100220,JM Aggressive Hybrid Fund (Regular) - IDCW,17.83
2007-04-16,100221,JM Aggressive Hybrid Fund (Regular) -Growth Option,23.47
2007-04-16,100222,JM Medium to Long Duration Fund (Regular) - Quarterly IDCW,10.1945
2007-04-16,100223,JM Medium to Long Duration Fund (Regular) - Growth Option,28.8149
2007-04-16,100233,JM Liquid Fund (Regular) - Weekly IDCW,10.4215
2007-04-16,100234,JM Liquid Fund - Growth Option,20.676
2007-04-16,100237,JM High Liquidity Fund-- Institutional Plan - Growth,12.474
2007-04-16,100238,JM High Liquidity Fund-Institutional Plan - Daily Dividend,10.0159
2007-04-16,100241,JM High Liquidity Fund-- Institutional Plan - Dividend,10.1854
2007-04-16,100243,JM High Liquidity Fund-- Premium Plan - Daily Dividend Option,10.0
2007-04-16,100244,JM Liquid Fund (Regular) - Quarterly IDCW,11.9043
2007-04-16,100245,JM High Liquidity Fund-Super Institutional Plan- Daily Dividend,10.0165
2007-04-16,100246,JM High Liquidity Fund-Super Institutional Plan- Weekly  Dividend,10.0
2007-04-16,100247,JM Liquid Fund (Regular) - Super Institutional Plan - Growth Option,11.8611
2007-04-16,100249,JM G-Sec Fund - Quarterly Dividend Option,10.1518
2007-04-16,100250,JM G-Sec Fund - Growth Option,21.2369
2007-04-16,100251,JM G-Sec Fund-PF Plan - Growth Plan,22.1394
2007-04-16,100252,JM G-Sec Fund-PF Plan -Dividend Plan,20.2863
2007-04-16,100253,JM G-Sec Fund - Bonus Option - Principal Units,10.3305
2007-04-16,100254,JM Value Fund (Regular) - Growth Option,20.01
2007-04-16,100261,Kotak Gilt-Savings-Monthly Dividend,10.4312
2007-04-16,100262,Kotak Gilt-Savings-Growth,18.2012
2007-04-16,100263,Kotak Gilt-Savings-Annual Dividend,12.1717
2007-04-16,100264,Kotak Gilt-Investment Regular-Payout of Income Distribution cum capital withdrawal option,11.3107
2007-04-16,100265,Kotak Gilt-Investment Regular-Growth,23.5141
2007-04-16,100280,Kotak Gilt-Investment  Provident Fund and Trust-Payout of Income Distribution cum capital withdrawal option,10.7568
2007-04-16,100281,Kotak Gilt-Investment  Provident Fund and Trust-Growth,23.8287
2007-04-16,100286,Kotak Aggressive Hybrid Fund - Regular Plan - IDCW - Payout & Reinvestment of Income Distribution cum capital withdrawal option,23.518
2007-04-16,100289,Kotak Tech,10.648
2007-04-16,100290,Kotak MNC,26.41
2007-04-16,100291,Kotak Bond-Deposit-Dividend,11.7717
2007-04-16,100292,Kotak Bond-Deposit-Growth,18.6258
2007-04-16,100298,Kotak Bond Regular Plan Quaterly Payout of Income Distribution cum capital withdrawal option,10.3527
2007-04-16,100299,Kotak Bond Fund - Regular Plan Growth,19.6118
2007-04-16,100300,Kotak Bond Fund - Regular Plan - Standard IDCW Option,13.1068
2007-04-16,100301,Kotak Bond Regular Plan Bonus Plan,13.0722
2007-04-16,100312,LIC MF Flexi Cap Fund-Regular Plan-IDCW,11.2865
2007-04-16,100313,LIC MF Flexi Cap Fund-Regular Plan-Growth,20.4006
2007-04-16,100314,LIC MF Medium to Long Duration Fund-Regular Plan-IDCW,10.1547
2007-04-16,100315,LIC MF Medium to Long Duration Fund-Regular Plan-Growth,20.0703
2007-04-16,100316,LIC MF Gilt Fund-Regular Plan-IDCW,11.0341
2007-04-16,100317,LIC MF Gilt Fund-Regular Plan-Growth,18.9855
2007-04-16,100318,LIC MF Gilt Fund-PF Plan-IDCW,10.9478
2007-04-16,100319,LIC MF Gilt Fund-PF Plan-Growth,10.9478
2007-04-16,100321,LIC MF Aggressive Hybrid Fund-Regular Plan-IDCW,10.2239
2007-04-16,100323,LIC MF Aggressive Hybrid Fund-Regular Plan-Growth,43.1924
2007-04-16,100325,LIC MF ULIS (5 Yrs. Single Premium)-Regular Plan-IDCW Reinvestment,10.6865
2007-04-16,100332,LIC MF Large Cap Fund-Regular Plan-IDCW,10.4151
2007-04-16,100337,SaharaTax Gain-Dividend,17.6279
2007-04-16,100338,SaharaTax Gain-Growth,20.2047
2007-04-16,100347,Morgan Stanley Growth Fund- Regular Growth Plan,49.71
2007-04-16,100348,ICICI Prudential Large & Mid Cap Fund - IDCW,22.89
2007-04-16,100349,ICICI Prudential Large & Mid Cap Fund - Growth,93.49
2007-04-16,100350,ICICI Prudential Large & Mid Cap Fund - Institutional Option - I - Growth,12.43
2007-04-16,100351,ICICI Prudential FMCG Fund - IDCW,31.83
2007-04-16,100352,ICICI Prudential FMCG Fund - Growth,40.0
2007-04-16,100353,ICICI Prudential ELSS Tax Saver Fund - IDCW,20.45
2007-04-16,100354,ICICI Prudential ELSS Tax Saver Fund - Growth,85.17
2007-04-16,100355,ICICI Prudential Equity & Debt Fund - Monthly IDCW,17.02
2007-04-16,100356,ICICI Prudential Equity & Debt Fund - Growth,34.69
2007-04-16,100357,ICICI Prudential Liquid Fund -Quarterly IDCW,10.7314
2007-04-16,100359,ICICI Prudential Liquid Institutional Plus Fund - Div - Daily,11.8515
2007-04-16,100360,ICICI Prudential Liquid Institutional Plus Fund - Div - Weekly,11.8747
2007-04-16,100361,ICICI Prudential Liquid Fund-Dividend-Institutional Plus - Monthly,11.9758
2007-04-16,100362,ICICI Prudential Liquid Institutional Plus Fund - Growth,18.7015
2007-04-16,100363,ICICI Prudential Technology Fund - Growth,16.08
2007-04-16,100364,ICICI Prudential Long Term Bond Fund - Half Yearly IDCW,10.3312
2007-04-16,100365,ICICI Prudential Long Term Bond Fund - Growth,21.5292
2007-04-16,100366,ICICI Prudential Long Term Bond Fund-Institutional Quarterly Dividend,10.1508
2007-04-16,100367,ICICI Prudential Long Term Bond Fund - Quarterly IDCW,10.9586
2007-04-16,100368,ICICI Prudential Gilt Fund - IDCW,10.6315
2007-04-16,100369,ICICI Prudential Gilt Fund - Growth,22.4748
2007-04-16,100370,ICICI Prudential Short Term Gilt Fund - Dividend,10.4989
2007-04-16,100371,ICICI Prudential Short Term Gilt Fund - Growth,18.0155
2007-04-16,100372,ICICI Prudential Short Term Gilt Fund - Half Yearly Dividend,10.1888
2007-04-16,100375,NIPPON INDIA GROWTH MID CAP FUND - IDCW Option,49.92
2007-04-16,100376,Nippon India Growth Mid Cap Fund-Growth Plan-Bonus Option,44.88
2007-04-16,100377,Nippon India Growth Mid Cap Fund-Growth Plan-Growth Option,270.7
2007-04-16,100378,Nippon India Vision Large & Midcap Fund - IDCW Option,45.47
2007-04-16,100379,Nippon India Vision Large & Midcap Fund-GROWTH PLAN-Bonus Option,29.85
2007-04-16,100380,Nippon India Vision Large & Midcap Fund-GROWTH PLAN-Growth Option,178.15
2007-04-16,100383,NIPPON INDIA MEDIUM TO LONG DURATION FUND - MONTHLY IDCW Option,10.9327
2007-04-16,100384,NIPPON INDIA MEDIUM TO LONG DURATION  FUND - QUARTERLY IDCW Option,11.8899
2007-04-16,100385,NIPPON INDIA MEDIUM TO LONG DURATION  FUND - HALF YEARLY IDCW Option,11.151
2007-04-16,100386,NIPPON INDIA MEDIUM TO LONG DURATION  FUND - ANNUAL IDCW Option,12.0896
2007-04-16,100387,Nippon India Medium to Long Duration  Fund - Growth Plan Growth Option,23.184
2007-04-16,100388,Nippon India Medium to Long Duration  Fund - Growth Plan Bonus Option,10.9264
2007-04-16,100414,Tata Aggressive Hybrid Fund- Regular Plan - Growth Option,50.9428
2007-04-16,100415,Tata Ethical Fund-Regular Plan - Growth Option,47.4972
2007-04-16,100416,Tata Long Term Debt Fund - Regular Plan - Quarterly Dividend,10.3339
2007-04-16,100417,Tata Income Fund-Regular Plan - Half Yearly Payout of IDCW Option,10.8037
2007-04-16,100418,Tata Income Fund -Regular Plan - Growth Option,25.1114
2007-04-16,100470,Franklin India Large Cap Fund - IDCW,36.9288
2007-04-16,100471,Franklin India Large Cap Fund-Growth,128.1234
2007-04-16,100472,Franklin India Mid Cap Fund - IDCW,54.2488
2007-04-16,100473,Franklin India Mid Cap Fund-Growth,194.8265
2007-04-16,100474,Tata ELSS Fund- Regular Plan - Payout of IDCW Option,42.6529
2007-04-16,100475,Tata Large Cap Fund -Regular Plan - Growth Option,61.4646
2007-04-16,100476,Taurus Flexi Cap Fund - Regular Plan - Growth,39.6
2007-04-16,100477,Taurus Mid Cap Fund - Regular Plan - Growth,15.41
2007-04-16,100480,Taurus ELSS Tax Saver Fund - Regular Plan - Growth,16.99
2007-04-16,100481,Franklin India Balanced Fund-Growth,35.6142
2007-04-16,100482,Franklin India Balanced Fund-Div,30.7815
2007-04-16,100483,Franklin India Growth Fund,30.02
2007-04-16,100484,Franklin India Index Fund- NSE Nifty 50 Index Fund - Growth,31.9527
2007-04-16,100485,Franklin India Govt.Sec. Fund-Composite Plan - Growth,24.1958
2007-04-16,100486,Franklin India Govt.Sec. Fund-Composite Plan - Dividend,10.6237
2007-04-16,100487,Franklin India Govt.Sec. Fund-Treasury Plan(Dividend Option),10.5483
2007-04-16,100489,Franklin India Govt.Sec. Fund-Treasury Plan(Growth Option),13.9726
2007-04-16,100490,Franklin India Govt.Sec. Fund-PF Plan - Growth,10.6276
2007-04-16,100491,Franklin India Govt.Sec. Fund-PF Plan - Dividend,10.6276
2007-04-16,100493,Franklin India Government Securities Fund - Growth,16.4863
2007-04-16,100494,Franklin India Government Securities Fund - IDCW,10.517
2007-04-16,100495,Franklin India Govt.Sec. Fund-Long Term Plan - Bonus,11.8244
2007-04-16,100496,Templeton India Value Fund - Growth Plan,65.7433
2007-04-16,100497,Templeton India Value Fund - IDCW,38.8708
2007-04-16,100498,Franklin India Dynamic Accrual Fund - IDCW,10.3639
2007-04-16,100499,Franklin India Dynamic Accrual Fund-Growth,25.7168
2007-04-16,100503,Franklin India Low Duration Fund - Monthly - IDCW,10.2327
2007-04-16,100504,Franklin India Low Duration Fund - Quarterly - IDCW,10.203
2007-04-16,100505,Templeton Monthly Income Plan-Half Yearly Dividend,12.0946
2007-04-16,100506,Templeton Monthly Income Plan-Growth,19.9066
2007-04-16,100519,Franklin India Flexi Cap Fund - IDCW,31.1906
2007-04-16,100520,Franklin India Flexi Cap Fund - Growth,139.1284
2007-04-16,100521,Franklin India Technology Fund - IDCW,25.3454
2007-04-16,100522,Franklin India Technology Fund-Growth,54.4733
2007-04-16,100523,Franklin FMCG Fund - Growth,33.6262
2007-04-16,100524,Franklin INDIA OPPORTUNITIES FUND - IDCW,15.2031
2007-04-16,100525,Franklin India ELSS Tax Saver Fund - IDCW,31.5828
2007-04-16,100526,Franklin India ELSS Tax Saver Fund-Growth,124.716
2007-04-16,100527,Franklin India Corporate Debt Fund - Plan A - Annual - IDCW,10.2584
2007-04-16,100528,Franklin India Corporate Debt Fund - Growth,24.7657
2007-04-16,100529,Franklin India Corporate Debt Fund - Plan B - Monthly - IDCW,13.239
2007-04-16,100530,Franklin India Corporate Debt Fund - Plan B - Quarterly - IDCW,13.3592
2007-04-16,100531,Franklin India Corporate Debt Fund - Plan B - Half yearly - IDCW,13.2075
2007-04-16,100532,Franklin India Corporate Debt Fund - Monthly Bonus,18.7166
2007-04-16,100535,Franklin India Retirement Fund - IDCW,16.7057
2007-04-16,100536,Franklin India Retirement Fund - Growth,43.4642
2007-04-16,100537,Franklin India Liquid Fund - Regular Plan - Weekly - IDCW,1244.6338
2007-04-16,100538,Franklin India Liquid Fund - Regular Plan - Growth,1870.3935
2007-04-16,100541,Franklin India Liquid Fund - Regular Plan - Daily - IDCW,1512.34
2007-04-16,100542,Franklin India Liquid Fund - Liquid Plan - Weekly Dividend,1000.8172
2007-04-16,100543,Franklin India Liquid Fund - Liquid Plan - Daily IDCW,1000.25
2007-04-16,100544,Franklin India Liquid Fund - Liquid Plan - Growth,1150.2368
2007-04-16,100546,Franklin India Liquid Fund - Super Institutional Plan - Growth,1112.8565
2007-04-16,100547,Franklin India Liquid Fund - Super Institutional Plan - Daily - IDCW,1000.25
2007-04-16,100548,Franklin India Liquid Fund - Super Institutional Plan - Weekly - IDCW,1016.4066
2007-04-16,100549,Franklin India Aggressive Hybrid Fund - IDCW,23.4866
2007-04-16,100550,Franklin India Aggressive Hybrid Fund - Growth Plan,32.9772
2007-04-16,100551,Templeton India Children’s Asset Plan-Education Plan,25.687
2007-04-16,100552,Templeton India Children’s Asset Plan-Gift Plan - Growth,31.0687
2007-04-16,100553,Templeton India Children’s Asset Plan-Gift Plan - Dividend,31.0687
2007-04-16,100557,Franklin India Taxshield 98,124.4035
2007-04-16,100558,Franklin India Taxshield 99,72.8916
2007-04-16,100561,Templeton India Money Market Account - Bonus Plan,1.0
2007-04-16,100563,DBS Chola Triple Ace-Regular -Cumulative,24.2519
2007-04-16,100567,DBS Chola Triple Ace-Regular - Quarterly Dividend,11.4188
2007-04-16,100569,DBS Chola Triple Ace-Semi Annual Dividend,11.7355
2007-04-16,100573,DBS Chola Triple Ace-Regular Bonus,13.4753
2007-04-16,100574,DBS Chola Freedom Income -Short Term Fund-Regular-Monthly Dividend,10.9373
2007-04-16,100575,DBS Chola Freedom Income -Short Term Fund-Regular - Cumulative,11.8723
2007-04-16,100576,DBS Chola Freedom Income -Short Term Fund-Cum- Institutional Plan,12.0147
2007-04-16,100579,DBS Chola Gilt-Investment-Quarterly Dividend,10.2634
2007-04-16,100580,DBS Chola Gilt-Investment-Cumulative,18.6601
2007-04-16,100589,Canara Robeco Expo-Income Plan,20.27
2007-04-16,100590,Canara Robeco Expo-Growth Plan,53.25
2007-04-16,100593,CANARA ROBECO ELSS TAX SAVER - REGULAR PLAN -IDCW (Payout),15.71
2007-04-16,100596,CANARA ROBECO GILT FUND - REGULAR PLAN - IDCW (Payout/Reinvestment),10.5785
2007-04-16,100597,CANARA ROBECO GILT FUND - REGULAR PLAN - GROWTH OPTION,18.5351
2007-04-16,100600,CANARA ROBECO CONSERVATIVE HYBRID FUND - REGULAR PLAN - MONTHLY IDCW (Payout/Reinvestment),11.72
2007-04-16,100601,CANARA ROBECO CONSERVATIVE HYBRID FUND - REGULAR PLAN - GROWTH OPTION,19.34
2007-04-16,100602,Sundaram Medium Duration Fund (Formerly Known as Sundaram Medium Term Bond Fund) Regular Plan-Income Distribution cum Capital Withdrawal(IDCW),10.2517
2007-04-16,100603,Sundaram Medium Duration Fund (Formerly Known as Sundaram Medium Term Bond Fund) Regular Plan - Growth,22.8517
2007-04-16,100604,Sundaram Medium Duration Fund (Formerly Known as Sundaram Medium Term Bond Fund) Regular Plan -Growth,12.0285
2007-04-16,100609,Sundaram Medium Duration Fund (Formerly Known as Sundaram Medium Term Bond Fund) Regular Plan- Income Distribution cum Capital Withdrawal(IDCW),10.4991
2007-04-16,100610,Sundaram Medium Duration Fund (Formerly Known as Sundaram Medium Term Bond Fund) Regular Plan -Income Distribution cum Capital Withdrawal (IDCW),10.5009
2007-04-16,100611,Sundaram Medium Duration Fund (Formerly Known as Sundaram Medium Term Bond Fund) Institutional Plan -Growth,11.7075
2007-04-16,100612,Sundaram Growth Fund-Dividend,14.26
2007-04-16,100613,Sundaram Growth Fund-Growth,65.1937
2007-04-16,100614,Sundaram Value Fund Regular Plan - Income Distribution cum Capital Withdrawal (IDCW),12.9196
2007-04-16,100617,Sundaram Equity Hybrid Fund Regular Plan - Growth,32.4043
2007-04-16,100618,Sundaram Money Fund Retail Plan - Growth,15.7772
2007-04-16,100619,Sundaram Money Fund Retail Plan - Quarterly Reinvestment of Income Distribution cum Capital Withdrawal (IDCW),10.2894
2007-04-16,100620,Sundaram Money Fund Retail Plan - Daily Reinvestment of Income Distribution cum Capital Withdrawal (IDCW),10.0953
2007-04-16,100621,Sundaram Money Fund Retail Plan - Weekly Reinvestment of Income Distribution cum Capital Withdrawal (IDCW),10.3556
2007-04-16,100622,Sundaram Money Fund Retail Plan - Fortnightly Reinvestment of Income Distribution cum Capital Withdrawal (IDCW),10.2292
2007-04-16,100623,Sundaram Money Fund Retail Plan - Monthly Income Distribution cum Capital Withdrawal (IDCW),10.1765
2007-04-16,100630,quant Multi Cap Fund-IDCW Option - Regular Plan,12.431
2007-04-16,100631,quant Multi Cap Fund-GROWTH OPTION - Regular Plan,52.9311
2007-04-16,100638,SBI Medium to Long Duration Fund - Regular Plan - Half Yearly - Income Distribution cum Capital Withdrawal Option (IDCW),10.0425
2007-04-16,100639,SBI Medium to Long Duration Fund-REGULAR PLAN-Growth,19.7282
2007-04-16,100640,SBI Medium to Long Duration Fund-REGULAR PLAN-Bonus,11.9501
2007-04-16,100641,SBI ULTRA SHORT DURATION FUND - REGULAR PLAN - GROWTH,16.8885
2007-04-16,100643,SBI Technology Opportunities Fund - Regular Plan - Income Distribution cum Capital Withdrawal Option (IDCW),28.81
2007-04-16,100644,SBI Healthcare Opportunities Fund - Regular Plan - Income Distribution cum Capital Withdrawal Option (IDCW),28.5
2007-04-16,100645,SBI Consumption Opportunities Fund - Regular Plan - Income Distribution cum Capital Withdrawal Option (IDCW),13.62
2007-04-16,100646,UTI - Unit Linked Insurance Plan,14.1671
2007-04-16,100648,UTI - CRTS 81 - Dividend Option,109.5844
2007-04-16,100650,UTI Large Cap Fund - Regular Plan - IDCW,27.44
2007-04-16,100651,UTI Large Cap Fund - Regular Plan - Growth Option,34.07
2007-04-16,100656,UTI - Master Plus Unit Scheme-Growth Option,64.16
2007-04-16,100657,UTI - Master Plus Unit Scheme-Income Option,49.23
2007-04-16,100663,UTI Large & Mid Cap Fund - Regular Plan - IDCW,37.36
2007-04-16,100664,UTI Large & Mid Cap Fund - Regular Plan - Growth Option,43.25
2007-04-16,100668,UTI Flexi Cap Fund - Regular Plan - IDCW,29.44
2007-04-16,100669,UTI - Flexi Cap Fund-Growth Option,31.82
2007-04-16,100678,UTI Children's Hybrid Fund - Regular Plan,13.3692
2007-04-16,100682,UTI Retirement Fund - Regular Plan,17.8522
2007-04-16,100684,UTI Aggressive Hybrid Fund - Regular Plan - Growth,54.29
2007-04-16,100685,UTI Aggressive Hybrid Fund - Regular Plan - IDCW,19.31
2007-04-16,100711,UTI - INDEX SELECT FUND-Income Option,22.89
2007-04-16,100712,UTI - INDEX SELECT FUND-Growth Option,33.91
2007-04-16,100715,DBS Chola Multi-Cap Fund-Dividend Option,14.37
2007-04-16,100716,DBS Chola Multi-Cap Fund-Cumulative Option,18.02
2007-04-16,100723,UTI MMF-Discontinued - Regular Plan -Growth,21.1375
2007-04-16,100724,UTI MMF- Discontinued - Regular Plan - Flexi Dividend Option,17.7205
2007-04-16,100725,UTI MMF- Discontinued - Regular Plan - Periodic Dividend Option,17.6102
2007-04-16,100741,UTI Medium to Long Duration Fund- Regular Plan - Growth,21.6974
2007-04-16,100742,UTI Medium to Long Duration Fund - Regular Plan - Quarterly IDCW,10.8703
2007-04-16,100748,UTI - Master Index Fund-Income Option,42.9717
2007-04-16,100749,UTI - Master Index Fund-Growth Option,42.9717
2007-04-16,100750,UTI - Master Value Fund-Income Option,18.14
2007-04-16,100751,UTI - Master Value Fund-Growth Option,27.83
2007-04-16,100780,Sundaram Banking & PSU Fund (Formerly Known as Sundaram Banking and PSU Debt Fund) Retail Plan - Monthly Income Distribution cum Capital Withdrawal (IDCW),10.2198
2007-04-16,100781,Sundaram Banking & PSU Fund (Formerly Known as Sundaram Banking and PSU Debt Fund) Retail Plan - Growth,11.3907
2007-04-16,100782,Sundaram Banking & PSU Fund (Formerly Known as Sundaram Banking and PSU Debt Fund) Regular Plan - Daily Reinvestment of Income Distribution cum Capital Withdrawal (IDCW),10.0519
2007-04-16,100784,Sundaram Banking & PSU Fund (Formerly Known as Sundaram Banking and PSU Debt Fund) Regular Plan - Growth,11.5278
2007-04-16,100785,Sundaram Corporate Bond Fund Regular Plan -Income Distribution cum Capital Withdrawal(IDCW),10.2562
2007-04-16,100786,Sundaram Corporate Bond Fund Regular Plan - Income Distribution cum Capital Withdrawal (IDCW ),10.266
