date,scheme_code,scheme_name,nav
2009-03-27,100033,Aditya Birla Sun Life Large & Mid Cap Fund - Regular Growth,78.89
2009-03-27,100034,Aditya Birla Sun Life Large & Mid Cap Fund -Regular - IDCW,53.81
2009-03-27,100035,Birla Sun Life Freedom Fund-Plan A (Dividend),17.7
2009-03-27,100036,Birla Sun Life Freedom Fund-Plan B (Growth),26.62
2009-03-27,100063,Aditya Birla Sun Life MNC Fund - Regular - IDCW,42.76
2009-03-27,100064,Aditya Birla Sun Life MNC Fund - Growth - Regular Plan,85.29
2009-03-27,100065,Aditya Birla Sun Life India Opportunities Fund - Dividend - Regular Plan,10.02
2009-03-27,100066,Aditya Birla Sun Life India Opportunities Fund - Growth - Regular Plan,23.34
2009-03-27,100067,Aditya Birla Sun Life Tax Plan -Regular - IDCW,29.94
2009-03-27,100068,BARODA ELSS 96 - Plan A - IDCW,13.29
2009-03-27,100069,BARODA PIONEER DIVERSIFIED FUND,22.04
2009-03-27,100080,DSP Flexi Cap Fund - Regular Plan - IDCW,29.296
2009-03-27,100081,DSP Aggressive Hybrid Fund- Regular Plan - Growth,36.018
2009-03-27,100082,DSP Aggressive Hybrid Fund- Regular Plan - IDCW,14.797
2009-03-27,100090,DSP BlackRock Technology.com   Fund - Regular Plan - Growth,13.653
2009-03-27,100119,HDFC Balanced Advantage Fund - Growth Plan,39.003
2009-03-27,100120,HDFC Balanced Advantage Fund - IDCW Plan,16.8
2009-03-27,100121,HDFC Balanced Fund - Dividend Option,11.558
2009-03-27,100122,HDFC Balanced Fund - Growth Option,26.138
2009-03-27,100123,HDFC Income Fund - Quarterly IDCW Option,10.6083
2009-03-27,100124,HDFC Income Fund - Growth Option,19.9445
2009-03-27,100150,Principal Child Benefit Fund-Super Saver-Future Guard Plan,47.72
2009-03-27,100151,Principal Retail Equity Savings Fund - Growth Option,48.43
2009-03-27,100152,Principal Nifty 100 Equal Weight Fund-Income Distribution CUM Capital Withdrawal,12.6257
2009-03-27,100153,Principal Nifty 100 Equal Weight Fund-Growth,21.4989
2009-03-27,100156,Principal Tax Savings Fund,41.81
2009-03-27,100171,Quant Dynamic Bond-Dividend,11.0585
2009-03-27,100172,Quant Dynamic Bond-Growth,27.0285
2009-03-27,100173,Quant Dynamic Bond-Bonus,14.2321
2009-03-27,100174,quant ELSS Tax Saver Fund - IDCW Option - Regular Plan,6.1142
2009-03-27,100175,quant ELSS Tax Saver Fund - Growth Option - Regular Plan,26.0613
2009-03-27,100176,quant Small Cap Fund - IDCW Option - Regular Plan,19.3007
2009-03-27,100177,quant Small Cap Fund - Growth - Regular Plan,22.8684
2009-03-27,100188,ING Core Equity Fund-Dividend Option,10.28
2009-03-27,100189,ING Core Equity Fund-Growth Option,19.43
2009-03-27,100190,ING Liquid Fund-Regular Growth Option,18.5206
2009-03-27,100191,ING Liquid Fund-Regular Weekly Dividend Option,10.8312
2009-03-27,100192,ING Liquid Fund-Regular Daily Dividend Option,10.7873
2009-03-27,100196,ING Liquid Fund-Institutional Growth Option,13.8412
2009-03-27,100197,ING Liquid Fund-Institutional Weekly Dividend Option,10.0606
2009-03-27,100198,ING Liquid Fund-Institutional Daily Dividend Option,10.0121
2009-03-27,100199,ING Liquid Fund-Super Institutional Growth Option,13.1398
2009-03-27,100200,ING Liquid Fund-Super Institutional Daily Dividend Option,10.0048
2009-03-27,100201,ING Liquid Fund-Super Institutional Weekly Dividend Option,10.0
2009-03-27,100202,ING Balanced Fund-Dividend Option,10.56
2009-03-27,100203,ING Balanced Fund-Growth Option,15.1
2009-03-27,100218,JM Large Cap Fund (Regular) - IDCW,9.29
2009-03-27,100219,JM Large Cap Fund (Regular) - Growth Option,20.6482
2009-03-27,100220,JM Aggressive Hybrid Fund (Regular) - IDCW,10.4851
2009-03-27,100221,JM Aggressive Hybrid Fund (Regular) -Growth Option,13.7924
2009-03-27,100233,JM Liquid Fund (Regular) - Weekly IDCW,10.6426
2009-03-27,100234,JM Liquid Fund - Growth Option,24.0323
2009-03-27,100237,JM High Liquidity Fund-- Institutional Plan - Growth,14.4994
2009-03-27,100238,JM High Liquidity Fund-Institutional Plan - Daily Dividend,10.0159
2009-03-27,100241,JM High Liquidity Fund-- Institutional Plan - Dividend,10.4006
2009-03-27,100243,JM High Liquidity Fund-- Premium Plan - Daily Dividend Option,10.0
2009-03-27,100244,JM Liquid Fund (Regular) - Quarterly IDCW,13.8368
2009-03-27,100245,JM High Liquidity Fund-Super Institutional Plan- Daily Dividend,10.0165
2009-03-27,100246,JM High Liquidity Fund-Super Institutional Plan- Weekly  Dividend,10.0
2009-03-27,100247,JM Liquid Fund (Regular) - Super Institutional Plan - Growth Option,13.7866
2009-03-27,100254,JM Value Fund (Regular) - Growth Option,8.4056
2009-03-27,100286,Kotak Aggressive Hybrid Fund - Regular Plan - IDCW - Payout & Reinvestment of Income Distribution cum capital withdrawal option,15.787
2009-03-27,100289,Kotak Tech,4.32
2009-03-27,100290,Kotak MNC,19.134
2009-03-27,100337,SaharaTax Gain-Dividend,9.5477
2009-03-27,100338,SaharaTax Gain-Growth,16.766
2009-03-27,100347,Morgan Stanley Growth Fund- Regular Growth Plan,31.555
2009-03-27,100348,ICICI Prudential Large & Mid Cap Fund - IDCW,13.03
2009-03-27,100349,ICICI Prudential Large & Mid Cap Fund - Growth,74.74
2009-03-27,100350,ICICI Prudential Large & Mid Cap Fund - Institutional Option - I - Growth,10.29
2009-03-27,100351,ICICI Prudential FMCG Fund - IDCW,19.35
2009-03-27,100352,ICICI Prudential FMCG Fund - Growth,31.07
2009-03-27,100353,ICICI Prudential ELSS Tax Saver Fund - IDCW,10.32
2009-03-27,100354,ICICI Prudential ELSS Tax Saver Fund - Growth,56.29
2009-03-27,100355,ICICI Prudential Equity & Debt Fund - Monthly IDCW,10.69
2009-03-27,100356,ICICI Prudential Equity & Debt Fund - Growth,26.55
2009-03-27,100357,ICICI Prudential Liquid Fund -Quarterly IDCW,10.1619
2009-03-27,100359,ICICI Prudential Liquid Institutional Plus Fund - Div - Daily,11.8515
2009-03-27,100360,ICICI Prudential Liquid Institutional Plus Fund - Div - Weekly,11.8626
2009-03-27,100362,ICICI Prudential Liquid Institutional Plus Fund - Growth,21.8832
2009-03-27,100363,ICICI Prudential Technology Fund - Growth,6.08
2009-03-27,100375,NIPPON INDIA GROWTH MID CAP FUND - IDCW Option,29.6406
2009-03-27,100376,Nippon India Growth Mid Cap Fund-Growth Plan-Bonus Option,34.6414
2009-03-27,100377,Nippon India Growth Mid Cap Fund-Growth Plan-Growth Option,208.8355
2009-03-27,100378,Nippon India Vision Large & Midcap Fund - IDCW Option,26.5822
2009-03-27,100379,Nippon India Vision Large & Midcap Fund-GROWTH PLAN-Bonus Option,23.0234
2009-03-27,100380,Nippon India Vision Large & Midcap Fund-GROWTH PLAN-Growth Option,137.0845
2009-03-27,100414,Tata Aggressive Hybrid Fund- Regular Plan - Growth Option,42.9434
2009-03-27,100415,Tata Ethical Fund-Regular Plan - Growth Option,29.1081
2009-03-27,100470,Franklin India Large Cap Fund - IDCW,22.6801
2009-03-27,100471,Franklin India Large Cap Fund-Growth,103.4046
2009-03-27,100472,Franklin India Mid Cap Fund - IDCW,24.2512
2009-03-27,100473,Franklin India Mid Cap Fund-Growth,110.082
2009-03-27,100474,Tata ELSS Fund- Regular Plan - Payout of IDCW Option,27.7985
2009-03-27,100475,Tata Large Cap Fund -Regular Plan - Growth Option,49.5921
2009-03-27,100476,Taurus Flexi Cap Fund - Regular Plan - Growth,25.19
2009-03-27,100477,Taurus Mid Cap Fund - Regular Plan - Growth,6.96
2009-03-27,100480,Taurus ELSS Tax Saver Fund - Regular Plan - Growth,16.72
2009-03-27,100484,Franklin India Index Fund- NSE Nifty 50 Index Fund - Growth,24.4699
2009-03-27,100496,Templeton India Value Fund - Growth Plan,55.3787
2009-03-27,100497,Templeton India Value Fund - IDCW,27.6601
2009-03-27,100505,Templeton Monthly Income Plan-Half Yearly Dividend,11.5721
2009-03-27,100506,Templeton Monthly Income Plan-Growth,21.8144
2009-03-27,100519,Franklin India Flexi Cap Fund - IDCW,18.2255
2009-03-27,100520,Franklin India Flexi Cap Fund - Growth,109.4199
2009-03-27,100521,Franklin India Technology Fund - IDCW,8.5337
2009-03-27,100522,Franklin India Technology Fund-Growth,24.6116
2009-03-27,100523,Franklin FMCG Fund - Growth,30.7758
2009-03-27,100524,Franklin INDIA OPPORTUNITIES FUND - IDCW,8.5208
2009-03-27,100525,Franklin India ELSS Tax Saver Fund - IDCW,17.9141
2009-03-27,100526,Franklin India ELSS Tax Saver Fund-Growth,99.1642
2009-03-27,100535,Franklin India Retirement Fund - IDCW,12.6762
2009-03-27,100536,Franklin India Retirement Fund - Growth,42.5034
2009-03-27,100537,Franklin India Liquid Fund - Regular Plan - Weekly - IDCW,1245.3687
2009-03-27,100538,Franklin India Liquid Fund - Regular Plan - Growth,2175.7246
2009-03-27,100541,Franklin India Liquid Fund - Regular Plan - Daily - IDCW,1512.34
2009-03-27,100542,Franklin India Liquid Fund - Liquid Plan - Weekly Dividend,1001.3808
2009-03-27,100543,Franklin India Liquid Fund - Liquid Plan - Daily IDCW,1000.673
2009-03-27,100544,Franklin India Liquid Fund - Liquid Plan - Growth,1331.5317
2009-03-27,100546,Franklin India Liquid Fund - Super Institutional Plan - Growth,1305.8871
2009-03-27,100547,Franklin India Liquid Fund - Super Institutional Plan - Daily - IDCW,1000.673
2009-03-27,100548,Franklin India Liquid Fund - Super Institutional Plan - Weekly - IDCW,1022.0448
2009-03-27,100549,Franklin India Aggressive Hybrid Fund - IDCW,16.178
2009-03-27,100550,Franklin India Aggressive Hybrid Fund - Growth Plan,29.4707
2009-03-27,100551,Templeton India Children’s Asset Plan-Education Plan,26.8496
2009-03-27,100552,Templeton India Children’s Asset Plan-Gift Plan - Growth,26.3897
2009-03-27,100553,Templeton India Children’s Asset Plan-Gift Plan - Dividend,26.3897
2009-03-27,100558,Franklin India Taxshield 99,42.0896
2009-03-27,100561,Templeton India Money Market Account - Bonus Plan,1.0
2009-03-27,100563,DBS Chola Triple Ace-Regular -Cumulative,23.3341
2009-03-27,100567,DBS Chola Triple Ace-Regular - Quarterly Dividend,10.9925
2009-03-27,100569,DBS Chola Triple Ace-Semi Annual Dividend,9.9022
2009-03-27,100573,DBS Chola Triple Ace-Regular Bonus,12.9784
2009-03-27,100574,DBS Chola Freedom Income -Short Term Fund-Regular-Monthly Dividend,11.2788
2009-03-27,100575,DBS Chola Freedom Income -Short Term Fund-Regular - Cumulative,13.9169
2009-03-27,100576,DBS Chola Freedom Income -Short Term Fund-Cum- Institutional Plan,14.1096
2009-03-27,100579,DBS Chola Gilt-Investment-Quarterly Dividend,10.8609
2009-03-27,100580,DBS Chola Gilt-Investment-Cumulative,20.0547
2009-03-27,100593,CANARA ROBECO ELSS TAX SAVER - REGULAR PLAN -IDCW (Payout),11.01
2009-03-27,100596,CANARA ROBECO GILT FUND - REGULAR PLAN - IDCW (Payout/Reinvestment),11.8383
2009-03-27,100597,CANARA ROBECO GILT FUND - REGULAR PLAN - GROWTH OPTION,24.8444
2009-03-27,100600,CANARA ROBECO CONSERVATIVE HYBRID FUND - REGULAR PLAN - MONTHLY IDCW (Payout/Reinvestment),12.5
2009-03-27,100601,CANARA ROBECO CONSERVATIVE HYBRID FUND - REGULAR PLAN - GROWTH OPTION,23.07
2009-03-27,100612,Sundaram Growth Fund-Dividend,7.2733
2009-03-27,100613,Sundaram Growth Fund-Growth,45.8452
2009-03-27,100614,Sundaram Value Fund Regular Plan - Income Distribution cum Capital Withdrawal (IDCW),8.5285
2009-03-27,100617,Sundaram Equity Hybrid Fund Regular Plan - Growth,26.4321
2009-03-27,100618,Sundaram Money Fund Retail Plan - Growth,18.2659
2009-03-27,100619,Sundaram Money Fund Retail Plan - Quarterly Reinvestment of Income Distribution cum Capital Withdrawal (IDCW),10.6942
2009-03-27,100620,Sundaram Money Fund Retail Plan - Daily Reinvestment of Income Distribution cum Capital Withdrawal (IDCW),10.0953
2009-03-27,100621,Sundaram Money Fund Retail Plan - Weekly Reinvestment of Income Distribution cum Capital Withdrawal (IDCW),10.6009
2009-03-27,100622,Sundaram Money Fund Retail Plan - Fortnightly Reinvestment of Income Distribution cum Capital Withdrawal (IDCW),10.4105
2009-03-27,100623,Sundaram Money Fund Retail Plan - Monthly Income Distribution cum Capital Withdrawal (IDCW),10.3068
2009-03-27,100630,quant Multi Cap Fund-IDCW Option - Regular Plan,6.687
2009-03-27,100631,quant Multi Cap Fund-GROWTH OPTION - Regular Plan,34.8581
2009-03-27,100638,SBI Medium to Long Duration Fund - Regular Plan - Half Yearly - Income Distribution cum Capital Withdrawal Option (IDCW),10.3811
2009-03-27,100639,SBI Medium to Long Duration Fund-REGULAR PLAN-Growth,21.0897
2009-03-27,100640,SBI Medium to Long Duration Fund-REGULAR PLAN-Bonus,12.7751
2009-03-27,100641,SBI ULTRA SHORT DURATION FUND - REGULAR PLAN - GROWTH,19.632
2009-03-27,100643,SBI Technology Opportunities Fund - Regular Plan - Income Distribution cum Capital Withdrawal Option (IDCW),7.97
2009-03-27,100644,SBI Healthcare Opportunities Fund - Regular Plan - Income Distribution cum Capital Withdrawal Option (IDCW),13.94
2009-03-27,100645,SBI Consumption Opportunities Fund - Regular Plan - Income Distribution cum Capital Withdrawal Option (IDCW),12.47
2009-03-27,100646,UTI - Unit Linked Insurance Plan,13.8345
2009-03-27,100648,UTI - CRTS 81 - Dividend Option,101.5616
2009-03-27,100650,UTI Large Cap Fund - Regular Plan - IDCW,18.82
2009-03-27,100651,UTI Large Cap Fund - Regular Plan - Growth Option,28.8
2009-03-27,100656,UTI - Master Plus Unit Scheme-Growth Option,45.65
2009-03-27,100657,UTI - Master Plus Unit Scheme-Income Option,32.91
2009-03-27,100663,UTI Large & Mid Cap Fund - Regular Plan - IDCW,27.7
2009-03-27,100664,UTI Large & Mid Cap Fund - Regular Plan - Growth Option,32.08
2009-03-27,100668,UTI Flexi Cap Fund - Regular Plan - IDCW,24.46
2009-03-27,100669,UTI - Flexi Cap Fund-Growth Option,26.61
2009-03-27,100676,Benchmark Derivative Fund - Growth Plan,1339.8687
2009-03-27,100678,UTI Children's Hybrid Fund - Regular Plan,11.8703
2009-03-27,100682,UTI Retirement Fund - Regular Plan,18.6763
2009-03-27,100684,UTI Aggressive Hybrid Fund - Regular Plan - Growth,45.3
2009-03-27,100685,UTI Aggressive Hybrid Fund - Regular Plan - IDCW,14.43
2009-03-27,100711,UTI - INDEX SELECT FUND-Income Option,12.07
2009-03-27,100712,UTI - INDEX SELECT FUND-Growth Option,27.59
2009-03-27,100715,DBS Chola Multi-Cap Fund-Dividend Option,7.74
2009-03-27,100716,DBS Chola Multi-Cap Fund-Cumulative Option,9.71
2009-03-27,100723,UTI MMF-Discontinued - Regular Plan -Growth,24.6014
2009-03-27,100724,UTI MMF- Discontinued - Regular Plan - Flexi Dividend Option,18.337
2009-03-27,100725,UTI MMF- Discontinued - Regular Plan - Periodic Dividend Option,18.2244
2009-03-27,100739,UTI MNC Fund - Regular Plan - IDCW,18.18
2009-03-27,100740,UTI - MNC Fund - Regular Plan - Growth Option,27.05
2009-03-27,100748,UTI - Master Index Fund-Income Option,31.0801
2009-03-27,100749,UTI - Master Index Fund-Growth Option,31.08
2009-03-27,100750,UTI - Master Value Fund-Income Option,11.09
2009-03-27,100751,UTI - Master Value Fund-Growth Option,19.33
2009-03-27,100794,Sundaram Small Cap Fund Regular Plan - Income Distribution cum Capital Withdrawal (IDCW),7.5206
2009-03-27,100795,Sundaram Small Cap Fund Regular Plan - Growth,13.3398
2009-03-27,100796,Sahara Midcap Fund-Growth Plan,11.6068
2009-03-27,100797,Sahara Midcap Fund-Dividend Plan,7.8809
2009-03-27,100798,Sahara Midcap Fund-Auto Payout,11.6068
2009-03-27,100799,Sahara Midcap Fund-Bonus,11.6068
2009-03-27,100804,UTI Energy Fund-Income Option,7.41
2009-03-27,100805,UTI Energy Fund-Growth Option,6.55
2009-03-27,100806,UTI Healthcare Fund - Regular Plan - IDCW,14.53
2009-03-27,100807,UTI Healthcare Fund - Regular Plan - Growth Option,17.78
2009-03-27,100808,UTI Services Industries Fund-Income Option,13.16
2009-03-27,100809,UTI Services Industries Fund-Growth Option,28.11
2009-03-27,100820,UTI ELSS Tax Saver Fund - Regular Plan - IDCW,10.1
2009-03-27,100821,UTI ELSS Tax Saver Fund - Regular Plan - Growth Option,21.65
2009-03-27,100822,UTI Nifty 50 Index Fund - Regular Plan - Growth Option,19.5849
2009-03-27,100823,UTI Nifty 50 Index Fund - Regular Plan - IDCW,9.9724
2009-03-27,100868,HDFC Liquid Fund - Growth Plan,17.4505
2009-03-27,100872,HDFC Liquid Fund-PREMIUM PLUS- Growth,17.6507
2009-03-27,100873,HDFC Liquid Fund-PREMIUM- Growth,17.6138
2009-03-27,100874,HDFC Liquid Fund - IDCW Plan Weekly,10.3173
2009-03-27,100875,HDFC Liquid Fund - IDCW Daily,10.1982
2009-03-27,100876,HDFC Liquid Fund - IDCW Monthly,10.319
2009-03-27,100877,HDFC Liquid Fund-Premium Plan - Dividend-Daily,12.2598
2009-03-27,100881,HDFC Liquid Fund-Premium Plus Plan - Dividend-Weekly,12.4264
2009-03-27,100887,Principal Cash Management-Liquid Option-Dividend Plan,10.1218
2009-03-27,100888,Principal Cash Management-Liquid Option-Growth Plan,17.1204
2009-03-27,100889,Principal Cash Management-Liquid Option-Monthly Dividend,10.0475
2009-03-27,100890,Principal Cash Management-Liquid Option-Institutional - Weekly Dividend Plan,10.0036
2009-03-27,100891,Principal Cash Management-Liquid Option-Institutional - Monthly Dividend Plan,10.0492
2009-03-27,100892,Principal Cash Management-Liquid Option-Daily Dividend,10.0022
2009-03-27,100893,Principal Cash Management-Liquid Option-Institutional - Growth Plan,14.4431
2009-03-27,100894,Principal Cash Management-Liquid Option-Institutional - Daily Dividend Plan,10.0022
2009-03-27,100895,Principal Cash Management Fund - Daily Income Distribution CUM Capital Withdrawal,10.0007
2009-03-27,100896,Principal Cash Management Fund - Weekly Income Distribution CUM Capital Withdrawal Option,10.0411
2009-03-27,100897,Principal Cash Management Fund - Monthly Income Distribution CUM Capital Withdrawal Option,10.0552
2009-03-27,100898,Principal Cash Management Fund -Growth Option,13.7316
2009-03-27,100899,HDFC Childrens Fund-Savings,16.259
2009-03-27,100900,HDFC Childrens Fund - Growth Plan,19.329
2009-03-27,100902,Franklin Pharma Fund - Growth,21.5859
2009-03-27,100906,DBS Chola Opportunities Fund-Regular Quarterly Dividend,8.73
2009-03-27,100907,DBS Chola Opportunities Fund-Cumulative,20.15
2009-03-27,100915,SBI Contra Fund - Regular Plan - Income Distribution cum Capital Withdrawal Option (IDCW),17.24
2009-03-27,100927,SBI Conservative Hybrid Fund - Regular Plan - Monthly Income Distribution cum Capital Withdrawal Option (IDCW),9.8841
2009-03-27,100928,SBI Conservative Hybrid Fund - Regular Plan - Quarterly Income Distribution cum Capital Withdrawal Option (IDCW),9.5542
2009-03-27,100929,SBI Conservative Hybrid Fund - Regular Plan - Annual Income Distribution cum Capital Withdrawal Option (IDCW),10.1616
2009-03-27,100948,Franklin India Conservative Hybrid Fund - Growth,22.2904
2009-03-27,100949,Franklin India Conservative Hybrid Fund - Plan A - Monthly - IDCW,10.3434
2009-03-27,100950,Franklin India Conservative Hybrid Fund - Plan A - Quarterly - IDCW,10.3619
2009-03-27,100951,Franklin India Conservative Hybrid Fund - Monthly Bonus,12.1831
2009-03-27,100966,Principal Multi Cap Growth Fund- Half Yearly Income Distribution CUM Capital Withdrawal Option,13.17
2009-03-27,100967,Principal Multi Cap Growth Fund-Growth Option,29.07
2009-03-27,100968,SBI Conservative Hybrid Fund - Regular Plan - Growth,16.799
2009-03-27,100975,DBS Chola Liquid Fund-Regular Cumulative,17.611
2009-03-27,100978,DBS Chola Liquid Fund-Daily Dividend Reinvestment Plan,10.0927
2009-03-27,100989,DBS Chola Liquid Fund-Cum -Institutional Plus,17.7944
2009-03-27,100997,HDFC Long Term Advantage Plan - IDCW Plan,19.411
2009-03-27,100998,HDFC Long Term Advantage Plan - Growth Plan,59.509
2009-03-27,100999,SBI Gilt Fund - Regular Plan - Income Distribution cum Capital Withdrawal Option (IDCW),10.2624
2009-03-27,101000,Tata Life Sciences & Technology Fund - Growth,27.8704
2009-03-27,101001,SBI GILT FUND - REGULAR PLAN - GROWTH,18.9998
2009-03-27,101002,SBI CONSTANT MATURITY 10 Year GILT FUND - REGULAR PLAN - GROWTH,18.0968
2009-03-27,101003,SBI Constant Maturity 10 Year Gilt Fund - Regular Plan - Income Distribution cum Capital Withdrawal Option (IDCW),11.0853
2009-03-27,101037,Franklin India Index Tax Fund,24.163
2009-03-27,101044,Franklin India Floating Rate Fund - IDCW,10.0
2009-03-27,101048,Franklin India Floating Rate Fund - Growth Plan,15.4992
2009-03-27,101065,quant Mid Cap Fund - Growth Option - Regular Plan,23.1197
2009-03-27,101066,quant Mid Cap Fund - IDCW Option - Regular Plan,9.7208
2009-03-27,101069,quant Aggressive Hybrid Fund-IDCW Option - Regular Plan,8.2353
2009-03-27,101070,quant Aggressive Hybrid Fund - Growth Option - Regular Plan,36.8698
2009-03-27,101071,quant Multi Asset Allocation Fund - IDCW Option - Regular Plan,17.9668
2009-03-27,101072,quant Multi Asset Allocation Fund-GROWTH OPTION - Regular Plan,19.6866
2009-03-27,101078,JM Liquid Fund (Regular) - Daily IDCW,10.4302
2009-03-27,101081,HDFC Gilt Fund-Short Term-Dividend,10.591
2009-03-27,101082,HDFC Gilt Fund-Short Term-Growth,15.3892
2009-03-27,101083,HDFC Gilt Fund - Growth Plan,17.9514
2009-03-27,101084,HDFC Gilt Fund - IDCW Plan,10.2466
2009-03-27,101127,ICICI Prudential Children's Fund - Regular Plan,24.76
2009-03-27,101131,DBS Chola Growth Fund-Quarterly Dividend,9.33
2009-03-27,101132,DBS Chola Growth Fund-Cumulative,19.74
2009-03-27,101143,ICICI Prudential Multi-Asset Fund - IDCW,10.903
2009-03-27,101144,ICICI Prudential Multi-Asset Fund - Growth,50.0442
2009-03-27,101161,Nippon India Multi Cap Fund-Growth Plan-Growth Option,13.6103
2009-03-27,101162,Nippon India Multi Cap Fund-Growth Plan-Bonus Option,13.6103
2009-03-27,101163,NIPPON INDIA MULTI CAP FUND - IDCW Option,10.8732
2009-03-27,101169,SBI Children's Fund - Savings Plan - REGULAR PLAN - GROWTH,17.928
2009-03-27,101192,DBS Chola Freedom Income-STF Regular-Semi Annual Dividend,13.2289
2009-03-27,101206,SBI OVERNIGHT FUND - REGULAR PLAN - GROWTH,15.2001
2009-03-27,101209,Taurus Large Cap Fund - Regular Plan - Growth,22.44
2009-03-27,101221,ICICI Prudential Money Market Fund Retail Growth (erstwhile Cash Option),14.6667
2009-03-27,101222,Tata Aggressive Hybrid Fund- Regular Plan - Periodic Payout of IDCW Option,29.7141
2009-03-27,101228,ICICI Prudential Multicap Fund - Growth,56.28
2009-03-27,101262,Nippon India Power & Infra Fund-Growth Plan -Growth Option,40.8327
2009-03-27,101263,Nippon India Power & Infra Fund-Growth Plan-Bonus Option,40.8327
2009-03-27,101264,NIPPON INDIA POWER & INFRA FUND - IDCW Option,25.3848
2009-03-27,101265,Principal Hybrid Equity Fund-Growth,17.97
2009-03-27,101266,Principal Hybrid Equity Fund- Monthly Income Distribution CUM Capital Withdrawal,9.08
2009-03-27,101281,HDFC BSE Sensex Index Fund - Growth Plan,85.3969
2009-03-27,101282,HDFC Index Fund-Sensex Plus( FV-Rs32.161),114.5818
2009-03-27,101295,SBI ESG Exclusionary Strategy Fund - Regular Plan - Income Distribution cum Capital Withdrawal Option (IDCW),18.28
2009-03-27,101296,Banking Index Benchmark Exchange Traded Scheme (Bank BeES),442.6595
2009-03-27,101307,DBS Chola Liquid Fund - Regular Weekly Dividend,11.9917
2009-03-27,101313,Aditya Birla Sun Life Nifty 50 Index Fund -REGULAR - IDCW,12.083
2009-03-27,101314,Aditya Birla Sun Life Nifty 50 Index Fund - Growth - Regular Plan,31.2286
2009-03-27,101325,Nifty Benchmark Exchange Traded Scheme- Nifty BeES,314.3306
2009-03-27,101349,ICICI Prudential Nifty 50 Index Fund - Cumulative Option,28.8178
2009-03-27,101352,Templeton Floating Rate Income Fund-Short Term Plan-Dividend Option,10.059
2009-03-27,101353,Templeton Floating Rate Income Fund-Short Term Plan-Growth Option,15.9511
2009-03-27,101354,Templeton Floating Rate Income Fund-Short Term Plan-Institutional Option - Growth,13.1414
2009-03-27,101355,Templeton Floating Rate Income Fund-Short Term Plan-Institutional Option - Dividend,10.161
2009-03-27,101361,Canara Robeco Liquid Fund- INSTITUTIONAL-Weekly dividend,10.041
2009-03-27,101362,Canara Robeco Liquid Fund- INSTITUTIONAL-Growth,16.0657
2009-03-27,101363,Canara Robeco Liquid Fund- INSTITUTIONAL-Daily Dividend Reinvestment,10.041
2009-03-27,101364,Canara Robeco Liquid Fund-Retail-DRI,10.041
2009-03-27,101365,Canara Robeco Liquid Fund-Retail-Growth,16.0403
2009-03-27,101393,Sahara Liquid Fund-Fixed Pricing - Daily Dividend Option,1024.9045
2009-03-27,101394,Sahara Liquid Fund-Fixed Pricing - Growth option,1578.54
2009-03-27,101397,Sahara Liquid Fund-Fixed Pricing -  Weekly Dividend Option,1026.2355
2009-03-27,101398,Sahara Liquid Fund-Fixed Pricing - Monthly Dividend Option,1024.6771
2009-03-27,101399,Sahara Liquid Fund-Variable Pricing - Daily Dividend option,1024.9262
2009-03-27,101400,Sahara Liquid Fund-Variable Pricing - Weekly Dividend Option,1024.9241
2009-03-27,101401,Sahara Liquid Fund-Variable Pricing- Monthly Dividend Option,1025.0024
2009-03-27,101402,Sahara Liquid Fund-Variable Pricing - Growth option,1589.9247
2009-03-27,101420,JM Floater Short Term Fund - Daily Dividend Option,10.0883
2009-03-27,101421,JM Floater Short Term Fund - Growth Option,14.2722
2009-03-27,101430,HDFC Regular Savings Fund-GROWTH,16.6849
2009-03-27,101431,HDFC Regular Savings Fund-Monthly Dividend Option,10.3168
2009-03-27,101472,Sundaram Equity Hybrid Fund Regular Plan - Income Distribution cum Capital Withdrawal (IDCW),11.1847
2009-03-27,101481,HDFC Floating Rate Debt Fund - Retail Growth Option,14.8473
2009-03-27,101482,HDFC Floating Rate Debt Fund - Retail Weekly Div Option,10.1428
2009-03-27,101483,HDFC Floating Rate Debt Fund - Retail Daily Div Option,10.0809
2009-03-27,101484,HDFC Floating Rate Debt Fund - Retail Monthly Div option,10.2025
2009-03-27,101489,Tata Young Citizen Fund [Upto 3 years] Regular Plan,13.2788
2009-03-27,101490,Tata Young Citizen Fund [>3 years upto 7 years] Regular Plan,13.2788
2009-03-27,101491,Tata Childrens Fund -Regular Plan-Growth Option,13.2788
2009-03-27,101525,HDFC Nifty 50 Index Fund - Growth Plan,27.9958
2009-03-27,101528,Sahara Growth Fund-Growth,47.1062
2009-03-27,101529,Sahara Growth Fund-Dividend,17.6739
2009-03-27,101530,SBI Large & Midcap Fund - Regular Plan - Income Distribution cum Capital Withdrawal Option (IDCW),32.79
2009-03-27,101536,Sundaram Select Focus Regular Plan - Income Distribution cum Capital Withdrawal (IDCW),7.568
2009-03-27,101537,Sundaram Select Focus Regular Plan - Growth,49.349
2009-03-27,101538,Sundaram Mid Cap Fund Regular Plan - Income Distribution cum Capital Withdrawal (IDCW),9.6443
2009-03-27,101539,Sundaram Mid Cap Fund Regular Plan - Growth,56.2781
2009-03-27,101549,JM Liquid Fund (Regular) - Bonus Option - Principal Units,12.6203
2009-03-27,101551,SBI Equity Hybrid Fund - Regular Plan - Income Distribution cum Capital Withdrawal Option (IDCW),18.87
