date,scheme_code,scheme_name,nav
2009-03-27,101585,HDFC Equity Savings Fund - GROWTH PLAN,13.3417
2009-03-27,101586,HDFC Equity Savings Fund - IDCW PLAN,10.1054
2009-03-27,101587,CANARA ROBECO INCOME FUND - REGULAR PLAN - QUARTERLY IDCW (Payout/Reinvestment),14.9434
2009-03-27,101588,CANARA ROBECO INCOME FUND - REGULAR PLAN - GROWTH OPTION,18.0626
2009-03-27,101589,Canara Robeco Income Fund-Bonus option,15.1703
2009-03-27,101591,Aditya Birla Sun Life Midcap Fund -REGULAR - IDCW,12.05
2009-03-27,101592,Aditya Birla Sun Life MIDCAP Fund-Growth,43.46
2009-03-27,101593,HSBC Large Cap Fund - Regular IDCW,19.1714
2009-03-27,101594,HSBC Large Cap Fund - Regular Growth,61.3302
2009-03-27,101607,UTI - MIS-Income,10.954
2009-03-27,101608,UTI - MIS-Growth,15.8591
2009-03-27,101621,Nifty Junior Benchmark Exchange Traded Scheme (Junior BeES),44.8892
2009-03-27,101628,DWS Alpha Equity Fund - Dividend,11.04
2009-03-27,101629,DWS Alpha Equity Fund - Growth,44.66
2009-03-27,101635,DSP Large Cap Fund - Regular Plan - Growth,53.035
2009-03-27,101636,DSP Large Cap Fund - Regular Plan - IDCW,13.291
2009-03-27,101659,Tata Nifty 50 Index Fund -Regular Plan,18.7183
2009-03-27,101661,UTI - Variable Investment Scheme-Income Option,8.945
2009-03-27,101662,UTI - Variable Investment Scheme-Growth Option,11.8868
2009-03-27,101670,HDFC Floating Rate Income Fund-Long Term Plan-Weekly Dividend Option,10.1774
2009-03-27,101671,HDFC Floating Rate Income Fund-Long Term Plan-GROWTH,14.7225
2009-03-27,101672,Tata Value Fund - Regular Plan -Growth Option,21.31
2009-03-27,101705,ICICI Prudential BSE Sensex ETF,105.1893
2009-03-27,101706,ICICI Prudential Multicap Fund - IDCW,10.08
2009-03-27,101714,Tata Liquid Fund- Regular Plan - Daily Reinvestment of IDCW Option,10.0152
2009-03-27,101733,Kotak 30-(Dividend),20.582
2009-03-27,101734,Kotak 30-(Growth),56.228
2009-03-27,101737,Aditya Birla Sun Life Dividend Yield Fund -REGULAR - IDCW,8.02
2009-03-27,101738,Aditya Birla Sun Life Dividend Yield Fund - Growth - Regular Plan,35.71
2009-03-27,101746,Tata S&P BSE Sensex Index Fund -Regular Plan,24.6431
2009-03-27,101748,ICICI Prudential Liquid Fund - Institutional - Daily - Div,11.8502
2009-03-27,101749,ICICI Prudential Liquid Fund - Institutional - Monthly - Div,10.195
2009-03-27,101750,ICICI Prudential Liquid Fund Retail Growth,21.4395
2009-03-27,101751,ICICI Prudential Liquid Institutional Fund - Growth,21.7677
2009-03-27,101752,ICICI Prudential Liquid Fund Retail Weekly Dividend,11.8582
2009-03-27,101753,ICICI Prudential Liquid Fund - Institutional - Weekly - Div,11.8497
2009-03-27,101754,ICICI Prudential Liquid Fund Retail Daily Dividend,11.8514
2009-03-27,101755,ICICI Prudential Liquid Fund Retail Monthly Dividend,10.0049
2009-03-27,101762,HDFC Flexi Cap Fund - Growth Plan,109.63
2009-03-27,101763,HDFC Flexi Cap Fund - IDCW Plan,22.011
2009-03-27,101764,HDFC Value Fund - Growth Plan,46.342
2009-03-27,101765,HDFC Value Fund - IDCW Plan,12.379
2009-03-27,101766,Tata Infrastructure Fund-Regular Plan- Growth Option,18.4126
2009-03-27,101784,DBS CholaFreedom Income-STF-Institutional Monthly Dividend,12.4685
2009-03-27,101815,Principal Personal Tax Saver Fund,48.09
2009-03-27,101823,Tata Large & Mid Cap Fund Regular Plan - Payout of IDCW Option,12.7355
2009-03-27,101824,Tata Large & Mid Cap Fund- Regular Plan - Growth Option,38.4689
2009-03-27,101833,Tata Ethical Fund- Regular Plan - Payout of IDCW Option,22.085
2009-03-27,101834,UTI - Master Equity Plan Unit Scheme,29.85
2009-03-27,101847,Tata Money Market Fund-Regular Plan - Growth Option,1625.7711
2009-03-27,101852,TATA Infrastructure Fund Regular Plan - Payout of IDCW Option,13.049
2009-03-27,101853,Sundaram Value Fund Regular Plan - Growth,23.2518
2009-03-27,101858,Tata Liquid Retail Investment Plan - Growth,2030.1638
2009-03-27,101859,Tata Liquid High Investment Plan - Weekly,1147.1012
2009-03-27,101860,Tata Liquid High Investment Plan - Growth,1466.3252
2009-03-27,101861,Tata Liquid Fund-Regular Plan  - Weekly Dividend,1151.1145
2009-03-27,101862,Nippon India Banking & Financial Services Fund-Growth Plan-Growth Option,37.5471
2009-03-27,101863,Nippon India Banking & Financial Services Fund-Growth Plan-Bonus Option,37.5471
2009-03-27,101864,Nippon India Banking & Financial Services Fund - IDCW Option,16.1721
2009-03-27,101871,Tata Life Science & Technology Fund - Dividend Option,16.1351
2009-03-27,101872,HDFC Dynamic Debt Fund - Growth Option,29.0486
2009-03-27,101873,HDFC Dynamic Debt Fund - Quarterly IDCW Option,10.8266
2009-03-27,101874,HDFC Dynamic Debt Fund - Half Yearly IDCW Option,10.5495
2009-03-27,101875,HDFC Dynamic Debt Fund - Yearly IDCW Option,11.0606
2009-03-27,101884,Liquid Benchmark Exchange Traded Scheme (Liquid BeES),1000.0
2009-03-27,101895,DBS Chola Monthly Income Plan-Regular-Monthly Dividend Plan,11.2509
2009-03-27,101898,UTI Sunder,326.9328
2009-03-27,101912,BARODA  HYBRID EQUITY FUND - Plan A - Growth Option,17.47
2009-03-27,101913,BARODA HYBRID EQUITY FUND - Plan A - IDCW Option,17.65
2009-03-27,101922,CANARA ROBECO FLEXICAP FUND - REGULAR PLAN - GROWTH OPTION,24.13
2009-03-27,101923,CANARA ROBECO FLEXICAP FUND - REGULAR PLAN - IDCW (Payout/Reinvestment),13.06
2009-03-27,101924,Canara Robeco Equity Diversified-Bonus Option,13.06
2009-03-27,101932,SBI GILT FUND -  GROWTH - PF (Regular) Option,12.1668
2009-03-27,101933,SBI GILT FUND -  GROWTH - PF (Fixed Period - 2 Yrs) Option,11.8832
2009-03-27,101934,SBI GILT FUND -  GROWTH - PF (Fixed Period - 3 Yrs) Option,11.7208
2009-03-27,101935,SBI Gilt Fund - Income Distribution cum Capital Withdrawal Option (IDCW) - PF (Regular),10.3212
2009-03-27,101950,SBI Gilt Fund - Income Distribution cum Capital Withdrawal Option (IDCW) - PF (Fixed Period - 1 Yr),10.2266
2009-03-27,101951,SBI Gilt Fund - Income Distribution cum Capital Withdrawal Option (IDCW) - PF (Fixed Period - 2 Yrs),10.3049
2009-03-27,101952,SBI Gilt Fund - Income Distribution cum Capital Withdrawal Option (IDCW) - PF (Fixed Period - 3 Yrs),10.1707
2009-03-27,101958,DBS Chola Liquid Fund - Institutional Plus Weekly Dividend,11.9831
2009-03-27,101977,HDFC Prudence Fund - Growth Option,91.468
2009-03-27,101978,HDFC Prudence Fund - Dividend Option,15.822
2009-03-27,101979,HDFC ELSS Tax saver - Growth Plan,97.417
2009-03-27,101980,HDFC ELSS Tax saver - IDCW Plan,30.304
2009-03-27,101982,Tata Liquid Retail Investment PLan - Daily,1116.8143
2009-03-27,101983,Tata Liquid Retail Investment Plan - Fortnightly,1146.9947
2009-03-27,101984,Tata Liquid High Investment Plan - Daily,1114.3379
2009-03-27,101985,Tata Liquid High Investment Plan - Monthly,1024.3761
2009-03-27,101986,Tata Money Market Fund- Regular Plan - Daily Reinvestment of IDCW Option,1114.52
2009-03-27,101987,Tata Liquid Fund Reglar Plan - Monthly Dividend,1154.7452
2009-03-27,101989,HDFC Medium Term Debt Fund - Growth Option,16.9057
2009-03-27,101990,HDFC Medium Term Debt Fund - Fornightly IDCW Option,10.5792
2009-03-27,101993,HDFC Money Market Fund - Growth Option,18.3709
2009-03-27,101994,HDFC Money Market Fund - Daily IDCW Option,10.6364
2009-03-27,101995,HDFC Money Market Fund - Weekly IDCW Option,10.638
2009-03-27,101996,HDFC Overnight Fund - Growth Option,14.7919
2009-03-27,101997,HDFC Overnight Fund - IDCW Option (Daily),10.4266
2009-03-27,102000,HDFC Large Cap Fund - Growth Option - Regular Plan,94.327
2009-03-27,102001,HDFC Large Cap Fund - IDCW Option - Regular Plan,24.392
2009-03-27,102007,UTI-  Liquid Cash Plan- Discontinued -Regular Plan Periodic Dividend Option,1047.308
2009-03-27,102008,UTI-  Liquid Cash Plan- Discontinued - Regular Plan - Monthly Dividend Option,1060.0775
2009-03-27,102009,UTI-  Liquid Cash Plan- Discontinued - Regular Plan -Growth,1429.9773
2009-03-27,102010,UTI Liquid Fund - Regular Plan - Daily IDCW (Reinvestment),1019.4457
2009-03-27,102011,UTI Liquid Fund - Regular Plan - Monthly IDCW,1029.666
2009-03-27,102012,UTI-  Liquid Cash Plan - Regular Plan - Growth Option,1444.8361
2009-03-27,102013,UTI Liquid Fund - Regular Plan - Weekly IDCW,1023.7663
2009-03-27,102018,DBS Chola Monthly Income Plan -Regular - Cumulative Plan,16.6869
2009-03-27,102019,DBS Chola Monthly Income Plan -Reg.-Quarterly Dividend Plan,11.2577
2009-03-27,102020,Baroda BNP Paribas MULTI CAP FUND - Regular Plan - Growth Option,27.47
2009-03-27,102021,Baroda BNP Paribas MULTI CAP FUND - Regular Plan - IDCW Option,17.31
2009-03-27,102036,Tata Large Cap Fund- Regular Plan - Payout of IDCW Option,21.4983
2009-03-27,102053,SBI MEDIUM DURATION FUND - REGULAR PLAN - GROWTH,13.6394
2009-03-27,102054,SBI Medium Duration Fund - Regular Plan - Income Distribution cum Capital Withdrawal Option (IDCW),10.0898
2009-03-27,102055,SBI Magnum Income Plus Fund - Savings Plan (G),10.5463
2009-03-27,102056,SBI Magnum Income Plus Fund - Savings Plan (D),10.203
2009-03-27,102061,SBI GILT FUND -  GROWTH - PF (Fixed Period - 1 Yr) Option,11.9915
2009-03-27,102133,ICICI Prudential Multi Sector Passive FOF - Growth,17.6735
2009-03-27,102134,ICICI Prudential Multi Sector Passive FOF - IDCW,17.6735
2009-03-27,102135,ICICI Prudential Aggressive Hybrid Active FOF - Growth,19.2102
2009-03-27,102136,ICICI Prudential Aggressive Hybrid Active FOF - IDCW,19.2102
2009-03-27,102137,ICICI Prudential Dynamic Asset Allocation Active FOF - Growth,16.2051
2009-03-27,102138,ICICI Prudential Dynamic Asset Allocation Active FOF - IDCW,16.2051
2009-03-27,102142,Sundaram Consumption Fund(Formerly Known as Sundaram Rural and Consumption Fund Regular Plan - Growth),7.0245
2009-03-27,102144,HDFC MF Monthly Income Plan-Short Term Plan-Growth Option,13.6767
2009-03-27,102145,HDFC MF Monthly Income Plan-Short Term Plan-Monthly Dividend Option,10.0038
2009-03-27,102146,HDFC MF Monthly Income Plan-Short Term Plan-Quarterly Dividend Option,10.2585
2009-03-27,102147,HDFC Hybrid Debt Fund - Growth Plan,15.8854
2009-03-27,102148,HDFC Hybrid Debt Fund - IDCW Monthly,10.1763
2009-03-27,102149,HDFC Hybrid Debt Fund - IDCW Quarterly,10.3786
2009-03-27,102152,Tata Money Market Fund Regular (Bonus / Dividend),10.1544
2009-03-27,102153,Tata Money Market Fund Regular (Growth),14.1736
2009-03-27,102182,Kotak Global-India-Dividend,9.877
2009-03-27,102183,Kotak Global-India-Growth,13.937
2009-03-27,102201,SBI MAGNUM NRI - SHORT TERM BOND PLAN-GROWTH,10.9143
2009-03-27,102202,SBI MAGNUM NRI - SHORT TERM BOND PLAN-DIVIDEND,10.6174
2009-03-27,102203,DWS Investment Opportunity Fund - Dividend Option,15.6
2009-03-27,102204,DWS Investment Opportunity Fund - Growth Option,20.43
2009-03-27,102205,SBI Dynamic Bond Fund - REGULAR PLAN - Growth,10.552
2009-03-27,102206,SBI Dynamic Bond Fund - Regular Plan - Income Distribution cum Capital Withdrawal Option (IDCW),9.9668
2009-03-27,102207,SBI MAGNUM NRI FLEXIASSET PLAN-GROWTH,16.8909
2009-03-27,102208,SBI MAGNUM NRI FLEXIASSET PLAN-DIVIDEND,16.9925
2009-03-27,102242,ING Large Cap Equity Fund-Growth Option,15.64
2009-03-27,102243,ING Large Cap Equity Fund-Dividend Option,10.42
2009-03-27,102245,ING Large Cap Equity Fund-Bonus Option,15.64
2009-03-27,102251,HSBC Flexi Cap Fund - Regular IDCW,10.6014
2009-03-27,102252,HSBC Flexi Cap Fund - Regular Growth,20.0107
2009-03-27,102266,UTI Children's Equity Fund - Regular Plan - IDCW,10.2284
2009-03-27,102267,UTI Children's Equity Fund - Regular Plan - Growth Option,10.2283
2009-03-27,102270,Franklin FMCG Fund - Dividend,19.3162
2009-03-27,102271,Franklin Pharma Fund - Dividend,11.4232
2009-03-27,102272,SBI NIFTY INDEX FUND - REGULAR PLAN - GROWTH,26.5811
2009-03-27,102273,SBI Nifty Index Fund - Regular Plan - Income Distribution cum Capital Withdrawal Option (IDCW),13.6297
2009-03-27,102315,ING Tax Savings Fund-Growth Option,12.81
2009-03-27,102316,ING Tax Savings Fund-Dividend Option,6.32
2009-03-27,102317,ING Tax Savings Fund-Bonus Option,12.83
2009-03-27,102320,Franklin India Index Fund - BSE Plan - Growth Plan,28.3569
2009-03-27,102326,Tata Mid Cap Fund-Regular Plan - IDCW Option,8.5273
2009-03-27,102328,Tata Mid Cap Fund Regular Plan- Growth Option,19.1119
2009-03-27,102329,Tata Mid Cap Growth Fund Regular Plan  - Bonus (Growth),17.1396
2009-03-27,102336,Principal Global Opportunities Fund- Income Distribution CUM Capital Withdrawal Option,10.9069
2009-03-27,102337,Principal Global Opportunities Fund-Growth Option,10.9069
2009-03-27,102393,UTI Mid Cap Fund - Regular Plan - IDCW,10.51
2009-03-27,102394,UTI Mid Cap Fund-Growth Option,12.44
2009-03-27,102395,UTI Infrastructure Fund-Growth Option,21.45
2009-03-27,102396,UTI Infrastructure Fund - Regular Plan - IDCW,13.21
2009-03-27,102397,UTI Transportation and Logistics Fund - Regular Plan - IDCW,8.55
2009-03-27,102398,UTI-Transportation and Logistics  Fund-Growth Option,10.62
2009-03-27,102401,UTI Banking and Financial Services Fund - Regular Plan - Growth Option,17.39
2009-03-27,102402,UTI Banking and Financial Services Fund - Regular Plan - IDCW,11.91
2009-03-27,102414,SBI CONTRA FUND - REGULAR PLAN -GROWTH,30.29
2009-03-27,102426,Principal Resurgent India Equity Fund-Growth,49.14
2009-03-27,102427,Principal Resurgent India Equity Fund-Dividend,6.98
2009-03-27,102428,Tata Value Fund Regular Plan - Payout of IDCW-Option B(10%),20.3037
2009-03-27,102431,Nippon India Pharma Fund-Growth Plan-Growth Option,18.3451
2009-03-27,102432,Nippon India Pharma Fund-Growth Plan-Bonus Option,18.3451
2009-03-27,102433,NIPPON INDIA PHARMA FUND - IDCW Option,14.5429
2009-03-27,102434,DSP India T.I.G.E.R. Fund - Regular Plan - Growth,25.659
2009-03-27,102435,DSP India T.I.G.E.R. Fund - Regular Plan - IDCW,11.847
2009-03-27,102441,Franklin India Liquid Fund - Institution-Growth,1375.8385
2009-03-27,102442,Franklin India Liquid Fund - Institutional Plan - Weekly - IDCW,1055.6403
2009-03-27,102443,Franklin India Liquid Fund - Institutional Plan - Daily - IDCW,1000.673
2009-03-27,102452,HDFC Low Duration  Fund - Growth,19.0658
2009-03-27,102453,HDFC Low Duration  Fund - Weekly IDCW,10.0235
2009-03-27,102478,JM Mid Cap Fund-Dividend,9.2592
2009-03-27,102479,JM Mid Cap Fund-Growth,12.0972
2009-03-27,102480,JM Large Cap Fund-Dividend,8.7544
2009-03-27,102481,JM Large Cap Fund-Growth,11.0405
2009-03-27,102482,Sundaram India Leadership Fund-Growth,20.6457
2009-03-27,102483,Sundaram India Leadership Fund-Dividend,7.5076
2009-03-27,102503,SBI  SAVINGS FUND - REGULAR PLAN - GROWTH,13.5064
2009-03-27,102504,SBI Savings Fund - Regular Plan - Income Distribution cum Capital Withdrawal Option (IDCW),10.4973
2009-03-27,102505,SBI CREDIT RISK FUND - REGULAR PLAN - GROWTH,13.2922
2009-03-27,102506,SBI Credit Risk Fund - Regular Plan - Income Distribution cum Capital Withdrawal Option (IDCW),10.9059
2009-03-27,102528,ICICI Prudential MidCap Fund - Growth,13.65
2009-03-27,102529,ICICI Prudential MidCap Fund - IDCW,7.45
2009-03-27,102530,ICICI Prudential MidCap Fund - Institutional Option - I,5.45
2009-03-27,102533,UTI Conservative Hybrd Fund - Regular Plan - Monthly Payment Option,15.6063
2009-03-27,102534,UTI Conservative Hybrid Fund - Regular Plan - Flexi IDCW,15.6031
2009-03-27,102535,UTI Conservative Hybrid Fund - Regular Plan - Growth Option,15.6043
2009-03-27,102536,UTI Conservative Hybrid Fund - Regular Plan - Monthly IDCW,11.5305
2009-03-27,102573,Kotak Multi Asset Omni FOF - Payout of Income Distribution cum capital withdrawal option,18.976
2009-03-27,102574,Kotak Multi Asset Omni FOF - Growth- Regular,18.976
2009-03-27,102577,DBS Chola Mid Cap Fund-Dividend,8.91
2009-03-27,102578,DBS Chola Mid Cap Fund-Cumulative,15.45
2009-03-27,102594,ICICI Prudential Value Fund (erstwhile Value Discovery Fund) - Growth,16.63
2009-03-27,102595,ICICI Prudential Value Fund (erstwhile Value Discovery Fund) - IDCW,8.98
2009-03-27,102596,ICICI Prudential Value Discovery Fund - Institutional Option - I - Growth,7.26
2009-03-27,102672,Tata Liquid Fund -Regular Plan - Growth Option,13.8671
2009-03-27,102701,Sundaram Money Fund Institutional Plan - Daily Reinvestment of Income Distribution cum Capital Withdrawal (IDCW),10.0953
2009-03-27,102703,Sundaram Money Fund Institutional Plan - Growth,18.4182
2009-03-27,102704,Sundaram Money Fund Institutional Plan - Monthly Income Distribution cum Capital Withdrawal (IDCW),10.3553
2009-03-27,102705,Sundaram Money Fund Institutional Plan - Quarterly Reinvestment of Income Distribution cum Capital Withdrawal (IDCW),10.9187
2009-03-27,102706,Sundaram Money Fund Institutional Plan - Weekly Reinvestment of Income Distribution cum Capital Withdrawal (IDCW),10.6351
2009-03-27,102716,ING Domestic Opportunities Fund-Growth Option,19.02
2009-03-27,102717,ING Domestic Opportunities Fund-Dividend Option,7.18
2009-03-27,102718,ING Domestic Opportunities Fund-Bonus Option,19.02
2009-03-27,102725,Principal Floating Rate Fund - SMP-Growth,13.7238
2009-03-27,102726,Principal Floating Rate Fund - SMP-Daily Dividend,10.0007
2009-03-27,102727,Principal Floating Rate Fund - SMP-Weekly Dividend,10.0024
2009-03-27,102728,Principal Floating Rate Fund - SMP-Monthly Dividend,10.7785
2009-03-27,102729,Principal Credit Risk Fund - Regular Plan - Growth Option,13.7881
2009-03-27,102730,Principal Floating Rate Fund - SMP-Insti. Daily Dividend,10.0007
2009-03-27,102731,Principal Floating Rate Fund - SMP-Insti. Weekly Dividend,10.0025
2009-03-27,102732,Principal Credit Risk Fund - Regular Plan - Monthly Dividend Option,11.5447
2009-03-27,102751,Nippon India Consumption Fund-Growth Plan-Growth Option,13.7353
2009-03-27,102752,Nippon India Consumption Fund-Growth Plan-Bonus Option,13.7353
2009-03-27,102753,NIPPON INDIA CONSUMPTION FUND - IDCW Option,10.7314
2009-03-27,102756,SBI FOCUSED FUND - REGULAR PLAN -GROWTH,13.94
2009-03-27,102760,HDFC Focused Fund - GROWTH PLAN,16.017
2009-03-27,102761,HDFC Focused Fund - IDCW PLAN,11.029
2009-03-27,102765,SBI Focused Fund - Regular Plan - Income Distribution cum Capital Withdrawal Option (IDCW),7.53
2009-03-27,102798,ING Treasury Management Fund-Growth Option,13.6364
2009-03-27,102799,ING Treasury Management Fund-Weekly Dividend Option,10.7831
2009-03-27,102800,ING Treasury Management Fund-Quarterly Dividend Option,10.3975
2009-03-27,102801,ING Treasury Management Fund-Half Yearly Dividend Option,10.3322
2009-03-27,102802,ING Treasury Management Fund-Annual Dividend Option,10.3287
2009-03-27,102804,ING Treasury Management Fund-Daily Dividend Option,10.3588
2009-03-27,102805,Canara Robeco Nifty Index - Regular Plan - Growth,16.57
2009-03-27,102806,Canara Robeco Nifty Index - Regular Plan - Dividend,11.03
2009-03-27,102807,Principal Dividend Yield Fund-Growth Plan,11.04
2009-03-27,102808,Principal Dividend Yield Fund- Half Yearly Income Distribution CUM Capital Withdrawal Plan,8.15
2009-03-27,102823,SBI HEALTHCARE OPPORTUNITIES FUND - REGULAR PLAN -GROWTH,16.92
2009-03-27,102846,Nippon India Balanced Advantage Fund-Growth Plan-Growth Option,18.0185
2009-03-27,102847,Nippon India Balanced Advantage Fund-Growth Plan-Bonus Option,18.0185
2009-03-27,102848,NIPPON INDIA BALANCED ADVANTAGE FUND - IDCW Option,12.8987
2009-03-27,102858,Tata Dividend Yield Fund  Regular Plan -( Div),10.9895
2009-03-27,102859,Tata Dividend Yield Fund Regular Plan,13.9516
2009-03-27,102860,SBI Savings Fund - Regular Plan Weekly Income Distribution cum Capital Withdrawal Option (IDCW),10.599
2009-03-27,102874,Kotak-Small Cap Fund - Payout of Income Distribution cum capital withdrawal option,8.176
2009-03-27,102875,Kotak-Small Cap Fund - Growth,10.657
2009-03-27,102883,Franklin India Large & Mid Cap Fund - Growth Plan,14.8205
2009-03-27,102884,Franklin India Large & Mid Cap Fund - IDCW,9.4291
2009-03-27,102885,SBI EQUITY HYBRID FUND - REGULAR PLAN -Growth,29.19
2009-03-27,102913,CANARA ROBECO SAVINGS FUND - REGULAR PLAN - GROWTH OPTION,13.5647
2009-03-27,102914,CANARA ROBECO SAVINGS FUND - REGULAR PLAN - IDCW (Payout/Reinvestment),13.0434
2009-03-27,102915,CANARA ROBECO SAVINGS FUND - REGULAR PLAN - WEEKLY IDCW (Payout/Reinvestment),10.264
2009-03-27,102920,CANARA ROBECO LARGE AND MID CAP FUND - REGULAR PLAN - GROWTH OPTION,7.64
2009-03-27,102921,CANARA ROBECO LARGE AND MID CAP FUND - REGULAR PLAN - IDCW (Payout/Reinvestment),5.27
2009-03-27,102922,Canara Robeco Large and Mid Cap Fund -BONUS OPTION,6.4
2009-03-27,102929,Tata Service Industries Fund - Dividend,9.5351
2009-03-27,102930,Tata Service Industries Fund - Appreciation,10.8174
2009-03-27,102931,ING Midcap Fund-Growth Option,9.38
2009-03-27,102932,ING Midcap Fund-Dividend Option,8.58
2009-03-27,102933,ING Midcap Fund-Bonus Option,9.38
2009-03-27,102941,SBI MIDCAP FUND - REGULAR PLAN - GROWTH,9.84
2009-03-27,102942,SBI Midcap Fund - Regular Plan - Income Distribution cum Capital Withdrawal Option (IDCW),7.55
2009-03-27,102947,HDFC Hybrid Equity Fund - IDCW Plan,8.336
2009-03-27,102948,HDFC Hybrid Equity Fund - Growth Plan,12.074
2009-03-27,102957,ICICI Prudential Multicap Fund - Institutional Option - I,15.36
2009-03-27,102961,Fidelity Equity Fund-Growth Option,16.498
2009-03-27,102962,Fidelity Equity Fund-Dividend Option,10.993
2009-03-27,103024,SBI LARGE & MIDCAP FUND- REGULAR PLAN -Growth,40.43
2009-03-27,103025,UTI Dividend Yield Fund - Regular Plan - IDCW,8.83
2009-03-27,103026,UTI-Dividend Yield Fund.-Growth,15.39
2009-03-27,103027,ICICI Prudential Blended Plan A - Growth,13.5016
2009-03-27,103028,ICICI Prudential Blended Plan A -  Dividend,10.6671
2009-03-27,103034,SBI MNC FUND - REGULAR PLAN -GROWTH,21.11
2009-03-27,103039,Kotak Contra Fund - Regular Plan - IDCW - Payout & Re-investment of Income Distribution cum capital withdrawal option,9.616
2009-03-27,103040,Kotak Contra Fund - Regular Plan - Growth,10.984
2009-03-27,103055,Franklin Templeton Fixed Tenure Fund-Series I(60 Month Plan)-Growth,14.4447
2009-03-27,103056,Franklin Templeton Fixed Tenure Fund-Series I(60 Month Plan)-Dividend,11.2346
2009-03-27,103058,Principal Junior Cap Fnd -Dividend Option,8.22
2009-03-27,103059,Principal Junior Cap Fnd-Growth Option,8.22
2009-03-27,103071,Tata Mid Cap Fund Plan A- Growth,7.8047
2009-03-27,103072,Tata Mid Cap Fund Plan A- Dividend,7.3288
2009-03-27,103079,DBS Chola Global Advantage Fund.-Dividend Option,4.38
2009-03-27,103080,DBS Chola Global Advantage Fund.-Cumulative Option,6.31
2009-03-27,103085,Nippon India Value Fund- Growth Plan,13.6307
2009-03-27,103087,Reliance Regular Savings Fund-BALANCED OPTION-Growth Option,10.8976
2009-03-27,103097,UTI Value Fund - Regular Plan - IDCW,8.56
2009-03-27,103098,UTI Value Fund - Regular Plan - Growth Option,13.11
2009-03-27,103108,JM Emerging Leaders Fund-Growth,3.3539
2009-03-27,103109,JM Emerging Leaders Fund-Dividend,3.3617
2009-03-27,103110,Aditya Birla Sun Life Consumption Fund -Regular - IDCW,9.88
2009-03-27,103111,Aditya Birla Sun Life Consumption Fund-Growth Option,11.93
2009-03-27,103114,SBI MNC Fund - Regular Plan - Income Distribution cum Capital Withdrawal Option (IDCW),13.95
2009-03-27,103119,Sahara Wealth Plus Fund-Fixed Pricing Option-Dividend Option,10.6171
2009-03-27,103120,Sahara Wealth Plus Fund-Fixed Pricing Option-Growth Option,10.6171
2009-03-27,103121,Sahara Wealth Plus Fund-Variable Pricing Option-Dividend Option,10.8732
2009-03-27,103122,Sahara Wealth Plus Fund-Variable Pricing Option-Growth Option,10.8732
2009-03-27,103130,HDFC Multi-Asset Fund - IDCW Option,10.0973
2009-03-27,103131,HDFC Multi-Asset Fund - Growth Option,12.1969
2009-03-27,103134,DBS Chola Short Term Floating Rate Fund-Dividend-Daily,10.2939
2009-03-27,103135,DBS Chola Short Term Floating Rate Fund-Dividend-Weekly,10.5184
2009-03-27,103136,DBS Chola Short Term Floating Rate Fund-Dividend-Monthly,10.4488
2009-03-27,103137,DBS Chola Short Term Floating Rate Fund-Cumulative,12.8966
2009-03-27,103140,SBI Overnight Fund - Regular Plan - Weekly Income Distribution cum Capital Withdrawal Option (IDCW),10.3195
2009-03-27,103145,SBI COMMA Fund - REGULAR PLAN - Growth,12.98
2009-03-27,103146,SBI Comma Fund - Regular Plan - Income Distribution cum Capital Withdrawal Option (IDCW),10.41
2009-03-27,103149,ICICI Prudential Infrastructure Fund - Growth,17.74
2009-03-27,103150,ICICI Prudential Infrastructure Fund - IDCW,8.12
2009-03-27,103151,Franklin India Opportunities Fund - Growth,17.0697
2009-03-27,103154,Aditya Birla Sun Life Equity Hybrid'95 Fund -Regular - IDCW,68.53
2009-03-27,103155,Aditya Birla Sun Life Equity Hybrid'95 Fund - Regular Plan-Growth,156.43
2009-03-27,103161,ING Dividend Yield Fund-Growth Option,9.18
2009-03-27,103162,ING Dividend Yield Fund-Dividend Option,8.34
2009-03-27,103163,ING Dividend Yield Fund-Bonus Option,9.18
2009-03-27,103164,Aditya Birla Sun Life ELSS Tax Saver Fund-Regular - IDCW,45.06
2009-03-27,103165,Aditya Birla Sun Life Flexi Cap Fund -Regular - IDCW,41.24
2009-03-27,103166,Aditya Birla Sun Life Flexi Cap Fund - Growth - Regular Plan,127.97
2009-03-27,103167,Aditya Birla Sun Life Digital India Fund -Regular - IDCW,7.38
2009-03-27,103168,Aditya Birla Sun Life Digital India Fund - Growth - Regular Plan,9.31
2009-03-27,103169,Aditya Birla Sun Life Buy India Fund - Dividend - Regular Plan,13.07
2009-03-27,103170,Aditya Birla Sun Life Buy India Fund - Growth - Regular Plan,18.61
2009-03-27,103171,Birla Sun Life Basic Industries Fund-Plan A(Dividend),18.61
2009-03-27,103172,Birla Sun Life Basic Industries Fund-Plan B(Growth),48.01
2009-03-27,103173,Aditya Birla Sun Life Large Cap Fund-Regular - IDCW,13.46
2009-03-27,103174,Aditya Birla Sun Life Large Cap Fund-Growth,42.38
2009-03-27,103196,Nippon India ELSS Tax Saver Fund-Growth Plan-Growth Option,9.7578
2009-03-27,103197,NIPPON INDIA ELSS TAX SAVER FUND - IDCW Option,8.554
2009-03-27,103202,Franklin Templeton Fixed Tenure Fund-SeriesII (60MonthsPlan)- Growth Plan,12.9479
2009-03-27,103203,Franklin Templeton Fixed Tenure Fund-SeriesII (60MonthsPlan)- Annual Dividend Plan,11.212
2009-03-27,103210,Sundaram CAPEX Opportunities Fund-Dividend,8.4418
2009-03-27,103211,Sundaram CAPEX Opportunities Fund-Growth,11.0298
2009-03-27,103215,SBI Flexicap Fund - REGULAR PLAN -Growth Option,9.86
2009-03-27,103216,SBI Flexicap Fund - Regular Plan - Income Distribution cum Capital Withdrawal Option (IDCW),7.49
