date,scheme_code,scheme_name,nav
2009-03-27,103225,quant Liquid Fund - Growth Option - Regular Plan,13.0295
2009-03-27,103226,quant Liquid Fund-Daily IDCW Option - Regular Plan,12.6745
2009-03-27,103227,quant Liquid Fund - Weekly IDCW Option - Regular Plan,12.6954
2009-03-27,103228,quant Liquid Fund - Monthly IDCW Option - Regular Plan,12.7363
2009-03-27,103233,Kotak Large & Midcap Fund - IDCW-Regular,8.777
2009-03-27,103234,Kotak Large & Midcap Fund - Growth-Regular,22.684
2009-03-27,103237,Benchmark Derivative Fund - Dividend Plan,1053.697
2009-03-27,103308,Aditya Birla Sun Life Focused Fund -Regular - IDCW,9.6495
2009-03-27,103309,Aditya Birla Sun Life Focused Fund -Growth Option,11.7714
2009-03-27,103312,ICICI Prudential Exports & Services Fund - Growth,8.41
2009-03-27,103313,ICICI Prudential Exports & Services Fund - IDCW,6.32
2009-03-27,103334,Principal Focused Multicap Fund-Half Yearly Income Distribution CUM Capital Withdrawal Option,10.96
2009-03-27,103335,Principal Focused Multicap Fund-Growth Option,13.13
2009-03-27,103336,Tata Contra Fund Plan A -  Growth,7.8469
2009-03-27,103337,Tata Contra Fund Plan A -  Dividend,7.3883
2009-03-27,103338,Kotak ELSS Tax Saver Fund-Payout of Income Distribution cum capital withdrawal option,5.633
2009-03-27,103339,Kotak ELSS Tax Saver Fund-Growth,9.2
2009-03-27,103340,ICICI Prudential Liquid Fund - Growth,12.9792
2009-03-27,103342,ICICI Prudential Liquid Fund - Weekly IDCW,10.0115
2009-03-27,103343,ICICI Prudential Liquid Fund - Daily IDCW,10.0005
2009-03-27,103344,ICICI Prudential Liquid Fund - Institutional Option - I,12.6987
2009-03-27,103356,DBS Chola Tax Saver Fund-Dividend Option,6.97
2009-03-27,103357,DBS Chola Tax Saver Fund-Cumulative Option,7.5
2009-03-27,103360,Franklin India Small Cap Fund-Growth,5.7407
2009-03-27,103361,Franklin India Small Cap Fund - IDCW,5.3154
2009-03-27,103389,CANARA ROBECO INFRASTRUCTURE FUND - REGULAR PLAN - IDCW (Payout/Reinvestment),9.56
2009-03-27,103390,CANARA ROBECO INFRASTRUCTURE FUND - REGULAR PLAN - GROWTH OPTION,11.21
2009-03-27,103392,Sundaram Money Fund Regular Plan - Daily Reinvestment of Income Distribution cum Capital Withdrawal (IDCW),10.0953
2009-03-27,103397,Sundaram Money Fund Regular Plan - Growth,18.5863
2009-03-27,103400,SBI Multi Asset Allocation Fund - Regular Plan - Monthly Income Distribution cum Capital Withdrawal Option (IDCW),9.9589
2009-03-27,103401,SBI Multi Asset Allocation Fund - Regular Plan - Quarterly Income Distribution cum Capital Withdrawal Option (IDCW),9.9013
2009-03-27,103408,SBI MULTI ASSET ALLOCATION FUND - REGULAR PLAN - GROWTH,11.2811
2009-03-27,103409,SBI Multi Asset Allocation Fund - Regular Plan - Annual Income Distribution cum Capital Withdrawal Option (IDCW),10.4739
2009-03-27,103420,Fidelity Tax Advantage Fund-Growth Option,10.018
2009-03-27,103421,Fidelity Tax Advantage Fund-Dividend Option,8.994
2009-03-27,103453,Principal Services Industries Fund-DIVIDEND,7.82
2009-03-27,103454,Principal Services Industries Fund-GROWTH,7.82
2009-03-27,103455,UTI Bluechip Flexicap Fund - Regular Plan - Dividend Option,8.71
2009-03-27,103457,UTI Bluechip Flexicap Fund - Regular Plan - Growth option,8.71
2009-03-27,103464,Quant Money Market Fund-Growth Option,12.6223
2009-03-27,103465,Quant Money Market Fund-Dividend Option,12.6223
2009-03-27,103468,HDFC Focused Large-Cap Fund-Dividend,6.847
2009-03-27,103469,HDFC Focused Large-Cap Fund-Growth,7.481
2009-03-27,103470,Tata Tax Advantage Fund -1,8.0024
2009-03-27,103473,KOTAK LIFESTYLE FUND---Dividend,5.881
2009-03-27,103474,KOTAK LIFESTYLE FUND---Growth,6.79
2009-03-27,103475,Aditya Birla Sun Life Infrastructure Fund -  Regular - IDCW,7.62
2009-03-27,103476,Aditya Birla Sun Life Infrastructure Fund-Growth,8.21
2009-03-27,103490,Quantum Value Fund - Direct Plan Growth Option,9.35
2009-03-27,103491,Quantum Value Fund - Direct Plan IDCW,9.42
2009-03-27,103504,SBI Large Cap FUND-REGULAR PLAN GROWTH,7.82
2009-03-27,103519,Tata Liquidity Management Fund - Regular Plan  -Weekly Dividend,1005.7835
2009-03-27,103532,UTI Contra Fund-Income-Dividend Option,7.86
2009-03-27,103534,UTI Contra Fund-Growth-Growth Option,7.86
2009-03-27,103539,DBS Chola Contra Fund-Dividend Option,5.42
2009-03-27,103540,DBS Chola Contra Fund-Cumulative Option,5.42
2009-03-27,103548,Franklin Templeton Fixed Tenure Fund-SeriesIV(60MonthsPlan)-Growth Plan,11.6764
2009-03-27,103549,Franklin Templeton Fixed Tenure Fund-SeriesIV(60MonthsPlan)-Annual Dividend Plan,10.2547
2009-03-27,103558,DWS TAX SAVING FUND-GROWTH,7.6936
2009-03-27,103559,DWS TAX SAVING FUND-DIVIDEND,7.1924
2009-03-27,103602,BARODA PIONEER GLOBAL FUND-Dividend,8.26
2009-03-27,103616,SBI Large Cap Fund - Regular Plan - Income Distribution cum Capital Withdrawal Option (IDCW),6.82
2009-03-27,103631,Tata Liquidity Management Fund - Regular Plan - Daily Dividend,1002.6089
2009-03-27,103632,Tata Liquidity Management Fund - Regular Plan - Growth,1226.0178
2009-03-27,103633,ICICI Prudential Money Market Fund Option - Growth,12.4973
2009-03-27,103634,ICICI Prudential Money Market Fund Option - Daily IDCW,10.001
2009-03-27,103635,ICICI Prudential Money Market Fund Option - Weekly IDCW,10.011
2009-03-27,103636,ICICI Prudential Money Market Fund Option -Fortnightly IDCW,10.0325
2009-03-27,103637,ICICI Prudential Money Market Fund Option - Monthly IDCW,10.0537
2009-03-27,103649,ING Contra Fund -Growth Option,7.87
2009-03-27,103650,ING Contra Fund-Dividend Option,7.87
2009-03-27,103651,ING Contra Fund-Bonus Option,7.87
2009-03-27,103659,ICICI Prudential Fusion Fund - Institutional Option - I - Growth,6.88
2009-03-27,103660,ICICI Prudential Fusion Fund-Growth Plan,6.65
2009-03-27,103661,ICICI Prudential Fusion Fund-Dividend Plan,6.26
2009-03-27,103678,Franklin India Dividend Yield Fund-Growth Plan,9.425
2009-03-27,103679,Franklin India Dividend Yield Fund - IDCW,8.1187
2009-03-27,103730,Sahara Infrastructure Fund ---FIXED PRICING OPTION-Dividend Option,6.5215
2009-03-27,103731,Sahara Infrastructure Fund ---FIXED PRICING OPTION-Growth Option,8.9165
2009-03-27,103732,Sahara Infrastructure Fund ---VARIABLE PRICING OPTION-Dividend Option,6.6876
2009-03-27,103733,Sahara Infrastructure Fund ---VARIABLE PRICING OPTION-Growth Option,9.1033
2009-03-27,103743,Sundaram Consumption Fund (Formerly Known as Sundaram Rural and Consumption Fund Regular Plan - Income Distribution cum Capital Withdrawal (IDCW),6.4089
2009-03-27,103747,Reliance Focused Large Cap Fund-Growth Plan-Growth Option,9.4865
2009-03-27,103748,Reliance Focused Large Cap Fund-Growth Plan-Bonus Option,9.4865
2009-03-27,103749,Reliance Focused Large Cap Fund-Dividend Plan,9.4865
2009-03-27,103751,JM HIFI Fund-Growth,3.926
2009-03-27,103752,JM HIFI Fund-Dividend,3.9265
2009-03-27,103760,Tata Equity Management Fund Plan A- Div,7.1422
2009-03-27,103761,Tata Equity Management Fund Plan A - Growth,7.6992
2009-03-27,103767,Fidelity India Special Situations Fund-Growth Option,8.012
2009-03-27,103768,Fidelity India Special Situations Fund-Dividend Option,8.012
2009-03-27,103780,JM Arbitrage Fund (Regular) - Growth Option,12.3969
2009-03-27,103781,JM Arbitrage Fund (Regular) - IDCW,10.0578
2009-03-27,103791,Kotak Flexi Fund of Fund-Series I-Dividend,10.983
2009-03-27,103792,Kotak Flexi Fund of Fund-Series I-Growth,10.981
2009-03-27,103819,DSP Large & Mid Cap Fund - Regular Plan - Growth,41.059
2009-03-27,103820,DSP Large & Mid Cap Fund - Regular Plan - IDCW,16.006
2009-03-27,103883,SBI ELSS Tax Saver Fund - Regular Plan - Income Distribution cum Capital Withdrawal Option (IDCW),25.64
2009-03-27,103884,SBI Ultra Short Duration Fund - Regular Plan - Weekly Income Distribution cum Capital Withdrawal Option (IDCW),10.7775
2009-03-27,104074,UTI Arbitrage Fund - Regular Plan - IDCW,11.0211
2009-03-27,104075,UTI Arbitrage Fund - Regular Plan - Growth Option,12.7076
2009-03-27,104078,Franklin Templeton Fixed Tenure Fund - Series VI (60 Months Plan) - Growth Plan,11.245
2009-03-27,104079,Franklin Templeton Fixed Tenure Fund - Series VI (60 Months Plan) - Annual Dividend Plan,10.0835
2009-03-27,104129,Kotak Flexi Fund of Funds Series II - Dividend,11.237
2009-03-27,104273,ING C.U.B (Competitive Upcoming Businesses) Fund-Bonus Option,6.71
2009-03-27,104274,ING C.U.B (Competitive Upcoming Businesses) Fund-Dividend Option,6.71
2009-03-27,104275,ING C.U.B (Competitive Upcoming Businesses) Fund-Growth Option,6.71
2009-03-27,104308,ICICI Prudential Liquid Fund - Half Yearly IDCW,10.3833
2009-03-27,104329,DBS Chola Liquid Fund-Cum -Super Institutional,12.105
2009-03-27,104331,Aditya Birla Sun Life Tax Plan - Regular Plan - Growth Option,7.29
2009-03-27,104338,Aditya Birla Sun Life Long Term Fund-Dividend Option,6.78
2009-03-27,104339,Aditya Birla Sun Life Long Term Fund- Growth Option,6.78
2009-03-27,104389,Franklin Templeton Capital Safety Fund - 5 Years Plan - Growth,10.9769
2009-03-27,104390,Franklin Templeton Capital Safety Fund - 5 Years Plan - Annual Dividend,10.6256
2009-03-27,104391,Franklin Templeton Capital Safety Fund - 3 Years Plan - Growth,11.1595
2009-03-27,104392,Franklin Templeton Capital Safety Fund - 3 Years Plan - Annual Dividend,10.905
2009-03-27,104406,ING Dynamic Asset Allocation Fund- Growth Option,10.1118
2009-03-27,104407,ING Dynamic Asset Allocation Fund- Dividend Option,10.1118
2009-03-27,104408,ING Dynamic Asset Allocation Fund - Bonus Option,10.1118
2009-03-27,104411,JM Financial Services Sector Fund - Growth Plan,5.9595
2009-03-27,104412,JM Financial Services Sector Fund - Dividend Plan,5.959
2009-03-27,104413,JM Telecom Sector Fund - Growth Plan,5.4575
2009-03-27,104414,JM Telecom Sector Fund - Dividend Plan,5.4567
2009-03-27,104457,SBI Arbitrage Opportunities Fund - Regular Plan - Gr,12.1376
2009-03-27,104458,SBI Arbitrage Opportunities Fund - Regular Plan - Income Distribution cum Capital Withdrawal Option (IDCW),11.4934
2009-03-27,104459,UTI Wealth Builder Fund - Dividend Option,8.5
2009-03-27,104460,UTI Wealth Builder Fund - Growth Option,8.5
2009-03-27,104481,DSP Midcap Fund - Regular Plan - Growth,6.3
2009-03-27,104482,DSP Midcap Fund - Regular Plan - IDCW,6.3
2009-03-27,104513,quant Large & Mid Cap Fund - Growth Option,7.3045
2009-03-27,104514,quant Large & Mid Cap Fund - IDCW Option - Regular Plan,6.4323
2009-03-27,104515,quant Large & Mid Cap Fund - Bonus Option - Regular Plan,7.3171
2009-03-27,104523,SBI ESG Exclusionary Strategy Fund - Regular Plan - Growth,20.78
2009-03-27,104554,Templeton India Money Market Account - Dividend Plan,1.0
2009-03-27,104559,CANARA ROBECO SAVINGS FUND - REGULAR PLAN - DAILY IDCW (Reinvestment),10.26
2009-03-27,104588,UTI - CRTS 81 - Growth Option,122.4778
2009-03-27,104635,Invesco India ELSS Tax Saver Fund - Regular Plan - IDCW Payout,7.17
2009-03-27,104636,Invesco India ELSS Tax Saver Fund - Regular Plan - Growth,8.0
2009-03-27,104637,Nippon India Focused Fund -Growth Plan -Growth Option,7.0693
2009-03-27,104638,NIPPON INDIA FOCUSED  FUND - IDCW OPTION,7.0693
2009-03-27,104639,JM Equity Tax Saver Fund - Series I - Dividend Plan,4.1108
2009-03-27,104640,JM Equity Tax Saver Fund - Series I - Growth Plan,4.1108
2009-03-27,104681,ICICI Prudential Arbitrage Fund - IDCW,10.54
2009-03-27,104682,ICICI Prudential Equity - Arbitrage Fund-Institutional Dividend Option,10.61
2009-03-27,104683,ICICI Prudential Arbitrage Fund - Growth,12.08
2009-03-27,104684,ICICI Prudential Equity - Arbitrage Fund-Institutional Growth Option,12.15
2009-03-27,104685,ICICI Prudential Balanced Advantage Fund - Growth,8.48
2009-03-27,104686,ICICI Prudential Balanced Advantage Fund - IDCW,8.04
2009-03-27,104706,HSBC Tax Saver Equity Fund - IDCW,7.4418
2009-03-27,104707,HSBC Tax Saver Equity Fund - Growth,7.4418
2009-03-27,104762,SBI ONE INDIA FUND - GROWTH (PREVIOUSLY CLOSE ENDED UPTO 14/01/2010),5.54
2009-03-27,104763,SBI ONE INDIA FUND - DIVIDEND (PREVIOUSLY CLOSE ENDED UPTO 14/01/2010),5.54
2009-03-27,104772,DSP ELSS Tax Saver Fund - Regular Plan - Growth,7.929
2009-03-27,104773,DSP ELSS Tax Saver Fund - Regular Plan - IDCW,5.904
2009-03-27,104860,Canara Robeco Multicap-GROWTH OPTION,6.85
2009-03-27,104861,Canara Robeco Multicap-DIVIDEND OPTION,6.85
2009-03-27,104898,ICICI Prudential Multi-Asset Fund-Institutional Option - I,7.7196
2009-03-27,104907,Kotak Midcap Fund - Regular Plan - IDCW -Payout & Re-investment of Income Distribution cum capital withdrawal option,5.466
2009-03-27,104908,Kotak Midcap Fund - Regular Plan - Growth,5.466
2009-03-27,104951,UTI Capital Protection Oriented Scheme 3 years - Income Option,11.0026
2009-03-27,104952,UTI Capital Protection Oriented Scheme - 3 years - Growth Option,11.0026
2009-03-27,104953,UTI Capital Protection Orinted Scheme - Plan 5 years- Income Option,10.707
2009-03-27,104954,UTI Capital Protection Oriented Scheme - 5 Years -Growth Option,10.7071
2009-03-27,104998,Sundaram Select Small Cap Dividend,4.8002
2009-03-27,104999,Sundaram Select Small Cap- Growth,4.8
2009-03-27,105000,Sundaram Large and Midcap Regular Plan - Income Distribution cum Capital Withdrawal (IDCW),6.0682
2009-03-27,105001,Sundaram Large and Midcap Fund Regular Plan - Growth,7.4234
2009-03-27,105038,JM Small & Mid-cap Fund - Regular Plan - Growth option,2.6713
2009-03-27,105039,JM Small & Mid-cap Fund - Regular Plan - Dividend option,2.6713
2009-03-27,105066,Franklin India Index Fund - BSE Plan - Dividend Plan,28.3569
2009-03-27,105067,Franklin India INDEX FUND- NSE NIFTY 50 INDEX FUND - IDCW,24.4699
2009-03-27,105080,SBI Ultra Short Duration Fund - Regular Plan - Daily Income Distribution cum Capital Withdrawal Option (IDCW),16.7503
2009-03-27,105085,Gold Benchmark Exchange Traded Scheme (Gold BeES),1501.3983
2009-03-27,105096,ICICI Prudential Equity Opportunities Fund - Retail Growth Plan,5.96
2009-03-27,105098,ICICI Prudential Equity Opportunities Fund - Retail Dividend Plan,5.56
2009-03-27,105099,ICICI Prudential Equity Opportunities Fund - Institutional Growth Plan,6.06
2009-03-27,105227,HSBC Dividend Yield Equity Fund - Dividend,5.7231
2009-03-27,105228,HSBC Dividend Yield Equity Fund - Growth,5.7231
2009-03-27,105274,SBI Liquid Fund - Institutional - Growth,14.0397
2009-03-27,105275,SBI Liquid Fund - Institutional Daily Income Distribution cum Capital Withdrawal Option (IDCW),10.0325
2009-03-27,105278,SBI Liquid Fund - Institutional Weekly Income Distribution cum Capital Withdrawal Option (IDCW),10.6088
2009-03-27,105279,SBI Liquid Fund - Institutional Fortnightly Income Distribution cum Capital Withdrawal Option (IDCW),10.1456
2009-03-27,105280,SBI Liquid Fund - REGULAR PLAN -Growth,13.8826
2009-03-27,105281,SBI Liquid Fund - Regular Plan - Daily Income Distribution cum Capital Withdrawal Option (IDCW),10.0325
2009-03-27,105316,Principal Pnb Long Term Equity Fund - Dividend Option,4.7
2009-03-27,105317,Principal Pnb Long Term Equity Fund - Growth Option,4.7
2009-03-27,105322,Franklin Templeton Fixed Tenure Fund - Series VIII - 60 Months Plan (Plan A) - Growth Plan,10.4667
2009-03-27,105323,Franklin Templeton Fixed Tenure Fund - Series VIII - 60 Months Plan (Plan A) - Dividend Plan,10.0909
2009-03-27,105417,Taurus Infrastructure Fund - Regular Plan - Growth,5.71
2009-03-27,105418,Taurus Infrastructure Fund - Regular Plan - Payout of Income Distribution cum Capital Withdrawal option,5.72
2009-03-27,105419,HDFC QUARTERLY INTERVAL FUND - PLAN B - WHOLESALE PLAN - Dividend Option,10.2498
2009-03-27,105420,HDFC QUARTERLY INTERVAL FUND - PLAN B - RETAIL PLAN - Growth Option,12.0
2009-03-27,105421,HDFC QUARTERLY INTERVAL FUND - PLAN B - RETAIL PLAN -Dividend Option,10.2498
2009-03-27,105427,HDFC QUARTERLY INTERVAL FUND - PLAN A - WHOLESALE PLAN - Dividend Option,10.0063
2009-03-27,105428,HDFC QUARTERLY INTERVAL FUND - PLAN A - RETAIL PLAN - Growth Option,12.0715
2009-03-27,105429,HDFC QUARTERLY INTERVAL FUND - PLAN A - RETAIL PLAN -Dividend Option,10.0063
2009-03-27,105459,Invesco India Contra Fund - Regular Plan - IDCW (Payout / Reinvestment),7.28
2009-03-27,105460,Invesco India Contra Fund - Regular Plan - Growth,7.28
2009-03-27,105463,UTI GOLD Exchange Traded Fund,1502.5295
2009-03-27,105497,UTI Long Term Advantage Fund  - Dividend Option,6.57
2009-03-27,105498,UTI Long Term Advantage Fund  - Growth Option,6.57
2009-03-27,105503,Invesco India Midcap Fund - Regular Plan - Growth Option,5.37
2009-03-27,105504,Invesco India Midcap Fund - Regular Plan - IDCW (Payout / Reinvestment),5.37
2009-03-27,105523,Franklin Templeton Capital Protection Oriented Fund - 3 Years Plan - Growth,11.0188
2009-03-27,105524,Franklin Templeton Capital Protection Oriented Fund - 3 Years Plan - Dividend,10.8179
2009-03-27,105525,Franklin Templeton Capital Protection Oriented Fund - 5 Years Plan - Growth,10.8562
2009-03-27,105526,Franklin Templeton Capital Protection Oriented Fund - 5 Years Plan - Dividend,10.5607
2009-03-27,105543,HDFC Low Duration  Fund - Monthly IDCW,10.0855
2009-03-27,105544,HDFC Low Duration Fund- Wholesale- Growth,19.1979
2009-03-27,105545,HDFC Low Duration Fund- Wholesale Weekly Dividend,10.0239
2009-03-27,105546,HDFC Low Duration Fund- Wholesale Monthly Dividend,10.099
2009-03-27,105547,HDFC Low Duration Fund- Wholesale Daily Dividend,10.0315
2009-03-27,105548,HDFC Low Duration  Fund - Daily IDCW,10.0315
2009-03-27,105576,DBS Chola Hedged Equity Fund - Dividend,5.35
2009-03-27,105577,DBS Chola Hedged Equity Fund - Cumulative,7.54
2009-03-27,105582,JPMorgan India Equity Fund - Regular Plan - Growth Option,6.597
2009-03-27,105583,JPMorgan India Equity Fund - Regular Plan - Dividend Option,6.126
2009-03-27,105598,PineBridge India Equity Fund- Standard Plan- Growth Option,6.069
2009-03-27,105600,PineBridge India Equity Fund- Standard Plan- Dividend Option,6.069
2009-03-27,105601,PineBridge India Equity Fund- Institutional Plan- Dividend Option,6.134
2009-03-27,105602,ICICI Prudential Infrastructure Fund - Institutional Option - I - Growth,9.48
2009-03-27,105603,Invesco India Arbitrage Fund - Regular Plan - Growth Option,11.6295
2009-03-27,105604,Invesco India Arbitrage Fund - Regular Plan - IDCW (Payout / Reinvestment),10.1935
2009-03-27,105628,SBI ELSS Tax Saver FUND - REGULAR PLAN- GROWTH,31.55
2009-03-27,105679,HDFC FMP 24M May 2007 - Wholesale Plan Growth Option,12.002
2009-03-27,105680,HDFC FMP 24M May 2007 - Retail Plan Quaterly Dividend Option,10.1612
2009-03-27,105681,HDFC FMP 24M May 2007 - Retail Plan Dividend Option,11.9409
2009-03-27,105682,HDFC FMP 24M May 2007 - Retail Plan Growth Option,11.9373
2009-03-27,105693,DBS Chola Freedom Income -Short Term Fund-Weekly Dividend- Institutional Plan,10.466
2009-03-27,105738,DBS Chola Freedom Income -Short Term Fund-Daily Dividend Re-investment Plan,10.1552
2009-03-27,105757,HDFC Mid Cap Fund - IDCW Plan,5.797
2009-03-27,105758,HDFC Mid Cap Fund - Growth Plan,5.797
2009-03-27,105760,HDFC QUARTERLY INTERVAL FUND - PLAN C -WHOLESALE PLAN - Dividend Option,10.1122
2009-03-27,105761,HDFC QUARTERLY INTERVAL FUND - PLAN C - RETAIL PLAN -Growth Option,11.8484
2009-03-27,105762,HDFC QUARTERLY INTERVAL FUND - PLAN C - RETAIL PLAN - Dividend Option,10.1122
2009-03-27,105802,Fidelity International Opportunities Fund - Growth Option,6.401
2009-03-27,105803,Fidelity International Opportunities Fund - Dividend Option,6.401
2009-03-27,105804,Aditya Birla Sun Life Small Cap Fund - GROWTH,4.749
2009-03-27,105805,Aditya Birla Sun Life Small Cap Fund -Regular - IDCW,4.749
2009-03-27,105816,Franklin India Focused Equity Fund - IDCW,5.631
2009-03-27,105817,Franklin India Focused Equity Fund - Growth Plan,5.631
2009-03-27,105868,DSP BlackRock Equity Fund - Institutional Plan - Dividend,7.686
2009-03-27,105869,DSP Equity Opportunities Fund - Institutional Plan - Growth,4.969
2009-03-27,105870,DSP Equity Opportunities Fund - Institutional Plan - IDCW,4.969
2009-03-27,105871,DSP Top 100 Equity Fund - Institutional  Plan - Dividend,7.209
2009-03-27,105872,DSP Top 100 Equity Fund - Institutional  Plan - Growth,7.209
2009-03-27,105873,DSP India T.I.G.E.R. Fund - Institutional Plan - IDCW,5.189
2009-03-27,105874,DSP India T.I.G.E.R. Fund - Institutional Plan - Growth,7.265
2009-03-27,105875,DSP Flexi Cap Fund - Regular Plan - Growth,7.662
2009-03-27,105967,Kotak Arbitrage Fund - Regular Plan - IDCW - Payout & Re-investment of Income Distribution cum capital withdrawal option,10.6835
2009-03-27,105968,Kotak Arbitrage Fund - Regular Plan - Growth,13.0531
2009-03-27,106029,HDFC FMP 36M JUNE 2007 - RETAIL PLAN GROWTH OPTION,11.5264
2009-03-27,106030,HDFC FMP 36M JUNE 2007 - RETAIL PLAN QUATERLY DIVIDEND OPTION,10.1371
2009-03-27,106032,HDFC FMP 36M JUNE 2007 - WHOLESALE PLAN QUATERLY DIVIDEND OPTION,10.2499
2009-03-27,106033,HDFC FMP 36M JUNE 2007 - RETAIL PLAN NORMAL DIVIDEND OPTION,11.5264
2009-03-27,106034,HDFC FMP 36M JUNE 2007 - WHOLESALE PLAN GROWTH OPTION,11.606
2009-03-27,106095,SBI Infrastructure Fund - Regular Plan - Income Distribution cum Capital Withdrawal Option (IDCW),5.79
2009-03-27,106096,SBI INFRASTRUCTURE FUND -  REGULAR PLAN - GROWTH,5.79
2009-03-27,106143,Invesco India Large & Mid Cap Fund - Regular Plan - IDCW (Payout / Reinvestment),6.72
2009-03-27,106144,Invesco India Large & Mid Cap Fund - Regular Plan - Growth,6.72
2009-03-27,106147,JM Contra Fund - Growth option,3.2629
2009-03-27,106148,JM Contra Fund - Dividend option,3.2629
2009-03-27,106166,CANARA ROBECO EQUITY HYBRID FUND - REGULAR PLAN - GROWTH OPTION,32.02
2009-03-27,106167,CANARA ROBECO EQUITY HYBRID FUND - REGULAR PLAN - MONTHLY IDCW (Payout/Reinvestment),32.02
2009-03-27,106168,JM Value Fund (Regular) - IDCW,6.3303
2009-03-27,106169,quant Infrastructure Fund - IDCW Option - Regular Plan,4.9858
2009-03-27,106170,quant Infrastructure Fund - Growth Option,4.983
2009-03-27,106193,KOTAK GOLD ETF,1504.717
2009-03-27,106212,SBI LOW DURATION FUND - REGULAR PLAN - GROWTH,11.3546
2009-03-27,106213,SBI Low Duration Fund - Regular Plan - Daily Income Distribution cum Capital Withdrawal Option (IDCW),10.0064
2009-03-27,106214,SBI Low Duration Fund - Regular Plan - Weekly Income Distribution cum Capital Withdrawal Option (IDCW),10.08
2009-03-27,106215,SBI Low Duration Fund - Regular Plan - Fornightly Income Distribution cum Capital Withdrawal Option (IDCW),10.0177
2009-03-27,106216,SBI Low Duration Fund - Regular Plan - Monthly Income Distribution cum Capital Withdrawal Option (IDCW),10.2711
2009-03-27,106217,SBI Short Horizon Debt Fund - Ultra Short Term Fund - Institutional Plan - Growth,11.4456
2009-03-27,106221,SBI Short Horizon Debt Fund - Ultra Short Term Fund - Institutional Plan - Daily Income Distribution cum Capital Withdrawal Option (IDCW),10.0069
2009-03-27,106222,SBI Short Horizon Debt Fund - Ultra Short Term Fund- Institutional Plan - Weekly Income Distribution cum Capital Withdrawal Option (IDCW),10.0763
2009-03-27,106224,SBI Short Horizon Debt Fund - Ultra Short Term Fund - Institutional Plan - Monthly Income Distribution cum Capital Withdrawal Option (IDCW),10.313
2009-03-27,106227,SBI SHORT HORIZON DEBT FUND-SHORT TERM FUND - RETAIL - GROWTH,11.501
2009-03-27,106228,SBI Short Horizon Debt Fund - Short Term Fund - Retail Dividend - Weekly Income Distribution cum Capital Withdrawal Option (IDCW),10.4023
2009-03-27,106229,SBI Short Horizon Debt Fund - Short Term Fund - Retail Dividend - Monthly Income Distribution cum Capital Withdrawal Option (IDCW),10.4657
2009-03-27,106230,SBI Short Horizon Debt Fund - Short Term Fund - Retail Dividend - Fortnightly Income Distribution cum Capital Withdrawal Option (IDCW),10.457
2009-03-27,106231,SBI SHORT TERM DEBT FUND - REGULAR PLAN -GROWTH,10.0537
2009-03-27,106232,SBI Short Term Debt Fund - Regular Plan Weekly Income Distribution cum Capital Withdrawal Option (IDCW),10.0344
2009-03-27,106233,SBI Short Term Debt Fund - Regular Plan - Monthly Income Distribution cum Capital Withdrawal Option (IDCW),10.7902
2009-03-27,106235,Nippon India Large Cap  Fund- Growth Plan -Growth Option,7.0368
2009-03-27,106236,NIPPON INDIA LARGE CAP FUND - IDCW Option,7.0368
2009-03-27,106237,Reliance Top 200  Fund-Institutional Plan Growth Plan Growth Option,7.1335
2009-03-27,106238,Nippon India Large Cap Fund-Institutional Plan Growth Plan Bonus Option,7.1335
2009-03-27,106239,Reliance Top 200 Fund-Institutional Plan Dividend Option,7.1335
2009-03-27,106240,Nippon India Large Cap Fund- Growth Plan Bonus Option,7.0368
2009-03-27,106249,Reliance Focused Large Cap  Fund Institutional Plan Growth Plan Growth Option,9.4865
2009-03-27,106250,Reliance Focused Large Cap Fund Institutional Plan Growth Plan Bonus Option,9.4865
2009-03-27,106251,Reliance Focused Large Cap  Fund Institutional Plan Dividend Option,9.4865
2009-03-27,106252,Nippon India Multi Cap Fund Institutional Dividend Plan,13.6103
2009-03-27,106253,Nippon India Multi Cap Fund Institutional Plan Growth Plan Growth Option,13.6103
2009-03-27,106254,Reliance Equity Opportunities  Fund Institutional Plan Growth Plan Bonus Option,13.6103
2009-03-27,106255,Nippon India Vision Large & Mid Cap Fund Institutional Dividend Plan,129.5794
2009-03-27,106256,Reliance Vision Fund Institutional Plan Growth Plan Growth Option,136.5125
2009-03-27,106257,Reliance Vision Fund Institutional Plan Growth Plan Bonus Option,136.5125
2009-03-27,106258,Reliance Growth Fund Institutional Plan Growth Plan Growth Option,209.7471
2009-03-27,106259,Reliance Growth Fund Institutional Plan Growth Plan Bonus Option,209.7471
2009-03-27,106260,NIPPON INDIA GROWTH MID CAP FUND - INSTITUTIONAL Plan - IDCW Option,207.0273
2009-03-27,106316,Invesco India Balanced Advantage Fund - Regular Plan - IDCW (Payout / Reinvestment),6.71
2009-03-27,106317,Invesco India Balanced Advantage Fund - Regular Plan - Growth,6.72
2009-03-27,106324,Canara Robeco Ultra Short Term Fund - Retail Plan- Income option,14.2229
2009-03-27,106325,Canara Robeco Ultra Short Term Fund - Retail Plan- Daily Dividend Reinvestment Option,12.4071
2009-03-27,106326,Canara Robeco Ultra Short Term Fund - Institutional Plan- Daily Dividend Reinvestment Option,12.4071
