date,scheme_code,scheme_name,nav
2006-08-21,100027,Grindlays Super Saver Income Fund-GSSIF-Half Yearly Dividend,10.2806
2006-08-21,100028,Grindlays Super Saver Income Fund-GSSIF-Quaterly Dividend,10.1849
2006-08-21,100029,Grindlays Super Saver Income Fund-GSSIF-Growth,16.3789
2006-08-21,100030,Grindlays Super Saver Income Fund-GSSIF-Annual Dividend,10.2936
2006-08-21,100031,Grindlays Super Saver Income Fund-GSSIF - ST-Dividend,10.0549
2006-08-21,100032,Grindlays Super Saver Income Fund-GSSIF - ST-Growth,14.288
2006-08-21,100033,Aditya Birla Sun Life Large & Mid Cap Fund - Regular Growth,104.73
2006-08-21,100034,Aditya Birla Sun Life Large & Mid Cap Fund -Regular - IDCW,75.13
2006-08-21,100035,Birla Sun Life Freedom Fund-Plan A (Dividend),16.22
2006-08-21,100036,Birla Sun Life Freedom Fund-Plan B (Growth),24.4
2006-08-21,100037,Aditya Birla Sun Life Income Fund - Regular - Quarterly IDCW,10.2121
2006-08-21,100038,Aditya Birla Sun Life Income Fund - Growth - Regular Plan,29.5921
2006-08-21,100041,Aditya Birla Sun Life Liquid Fund -Institutional - IDCW,10.8023
2006-08-21,100042,Aditya Birla Sun Life Liquid Fund-Retail (Growth),19.2988
2006-08-21,100043,Aditya Birla Sun Life Liquid Fund-Institutional (Growth),19.4228
2006-08-21,100044,Aditya Birla Sun Life Liquid Fund -Retail - IDCW,16.3694
2006-08-21,100046,Aditya Birla Sun Life Liquid Fund -Daily IDCW,10.0195
2006-08-21,100047,Aditya Birla Sun Life Liquid Fund - Growth,11.3931
2006-08-21,100048,Aditya Birla Sun Life Liquid Fund -Institutional - weekly  IDCW,10.8126
2006-08-21,100049,Aditya Birla Sun Life Cash Plus-Institutional - Fortnightly Dividend,10.84
2006-08-21,100051,Aditya Birla Sun Life Liquid Fund -weekly IDCW,10.028
2006-08-21,100052,Aditya Birla Sun Life Cash Plus-Institutional Premium - Fortnightly Dividend,10.0768
2006-08-21,100053,Aditya Birla Sun Life Cash Plus-Institutional Premium Plan-Monthly Dividend,10.0385
2006-08-21,100054,Aditya Birla Sun Life Gilt Plus - Liquid Plan - Quarterly Dividend - Regular Plan,10.6787
2006-08-21,100055,Aditya Birla Sun Life Gilt Plus - Liquid Plan - Growth - Regular Plan,17.4324
2006-08-21,100056,Aditya Birla Sun Life Gilt Plus - Liquid Plan - Annual Dividend - Regular Plan,11.6081
2006-08-21,100057,Aditya Birla Sun Life Govenment Securities Fund -Regular - Quarterly IDCW,10.5516
2006-08-21,100058,Aditya Birla Sun Life Government Securities Fund  - Growth - Regular Plan,19.9362
2006-08-21,100059,Aditya Birla Sun Life Gilt Plus-PF Plan (Annual Dividend),19.937
2006-08-21,100060,Aditya Birla Sun Life Constant Maturity 10 Year Gilt Fund - Quarterly Dividend - Regular Plan,10.9892
2006-08-21,100061,Aditya Birla Sun Life Constant Maturity 10 Year Gilt Fund - Growth - Regular Plan,22.1522
2006-08-21,100062,Aditya Birla Sun Life Gilt Plus-Regular Plan (Annual Dividend),22.1975
2006-08-21,100063,Aditya Birla Sun Life MNC Fund - Regular - IDCW,53.15
2006-08-21,100064,Aditya Birla Sun Life MNC Fund - Growth - Regular Plan,106.02
2006-08-21,100065,Aditya Birla Sun Life India Opportunities Fund - Dividend - Regular Plan,18.72
2006-08-21,100066,Aditya Birla Sun Life India Opportunities Fund - Growth - Regular Plan,43.58
2006-08-21,100067,Aditya Birla Sun Life Tax Plan -Regular - IDCW,48.02
2006-08-21,100068,BARODA ELSS 96 - Plan A - IDCW,22.29
2006-08-21,100069,BARODA PIONEER DIVERSIFIED FUND,27.9
2006-08-21,100077,DSP Bond Fund - IDCW,11.1245
2006-08-21,100078,DSP Bond Fund - Growth,24.2091
2006-08-21,100079,DSP Bond Fund - IDCW - Monthly,10.4014
2006-08-21,100080,DSP Flexi Cap Fund - Regular Plan - IDCW,37.3
2006-08-21,100081,DSP Aggressive Hybrid Fund- Regular Plan - Growth,33.48
2006-08-21,100082,DSP Aggressive Hybrid Fund- Regular Plan - IDCW,23.45
2006-08-21,100084,DSP Gilt Fund - Regular Plan - Growth,22.3826
2006-08-21,100085,DSP Gilt Fund - Regular Plan - IDCW,11.4498
2006-08-21,100086,DSP Gilt Fund - Regular Plan - IDCW - Monthly,10.1062
2006-08-21,100087,DSP Savings Fund - Regular Plan - Growth,16.3751
2006-08-21,100088,DSP Savings Fund - Regular Plan - IDCW,11.149
2006-08-21,100089,DSP Savings Fund - Regular Plan - IDCW - Monthly,10.1491
2006-08-21,100090,DSP BlackRock Technology.com   Fund - Regular Plan - Growth,17.09
2006-08-21,100119,HDFC Balanced Advantage Fund - Growth Plan,40.161
2006-08-21,100120,HDFC Balanced Advantage Fund - IDCW Plan,24.698
2006-08-21,100121,HDFC Balanced Fund - Dividend Option,18.344
2006-08-21,100122,HDFC Balanced Fund - Growth Option,28.525
2006-08-21,100123,HDFC Income Fund - Quarterly IDCW Option,10.2229
2006-08-21,100124,HDFC Income Fund - Growth Option,16.3557
2006-08-21,100136,Principal Deposit Fund-Plan 54EA/EB-Plan 54EA /EB,17.3714
2006-08-21,100150,Principal Child Benefit Fund-Super Saver-Future Guard Plan,44.22
2006-08-21,100151,Principal Retail Equity Savings Fund - Growth Option,44.8
2006-08-21,100152,Principal Nifty 100 Equal Weight Fund-Income Distribution CUM Capital Withdrawal,18.908
2006-08-21,100153,Principal Nifty 100 Equal Weight Fund-Growth,24.4497
2006-08-21,100156,Principal Tax Savings Fund,65.25
2006-08-21,100171,Quant Dynamic Bond-Dividend,10.0911
2006-08-21,100172,Quant Dynamic Bond-Growth,22.0826
2006-08-21,100173,Quant Dynamic Bond-Bonus,11.6304
2006-08-21,100174,quant ELSS Tax Saver Fund - IDCW Option - Regular Plan,12.9513
2006-08-21,100175,quant ELSS Tax Saver Fund - Growth Option - Regular Plan,36.7896
2006-08-21,100176,quant Small Cap Fund - IDCW Option - Regular Plan,15.5305
2006-08-21,100177,quant Small Cap Fund - Growth - Regular Plan,18.3973
2006-08-21,100178,ING Income Fund-Regular Plan -Dividend Option (Quarterly),10.1789
2006-08-21,100179,ING Income Fund-Regular Plan -Dividend Option (Half Yearly),10.2982
2006-08-21,100180,ING Income Fund- Regular Plan - Dividend Option (Annual),10.4332
2006-08-21,100181,ING Income Fund-Regular Plan -Growth Option,17.7354
2006-08-21,100182,ING Income Fund-Institutional Plan - Dividend Option (Half Yearly),10.0
2006-08-21,100183,ING Income Fund-Institutional Plan - Dividend Option (Quarterly),10.0
2006-08-21,100184,ING Income Fund-Institutional Plan -Dividend Option (Annual),10.4103
2006-08-21,100185,ING Income Fund-Bonus Option,10.8137
2006-08-21,100186,ING Income Fund-Institutional Bonus Option,10.9949
2006-08-21,100187,ING Income Fund-Institutional Plan - Growth Option,18.3668
2006-08-21,100188,ING Core Equity Fund-Dividend Option,12.47
2006-08-21,100189,ING Core Equity Fund-Growth Option,23.56
2006-08-21,100190,ING Liquid Fund-Regular Growth Option,15.2071
2006-08-21,100191,ING Liquid Fund-Regular Weekly Dividend Option,10.8373
2006-08-21,100192,ING Liquid Fund-Regular Daily Dividend Option,10.7849
2006-08-21,100194,ING Liquid Fund-Auto Sweep Growth Option,10.0
2006-08-21,100195,ING Liquid Fund-Auto Sweep Weekly Dividend Option,10.0
2006-08-21,100196,ING Liquid Fund-Institutional Growth Option,11.2608
2006-08-21,100197,ING Liquid Fund-Institutional Weekly Dividend Option,10.0665
2006-08-21,100198,ING Liquid Fund-Institutional Daily Dividend Option,10.0103
2006-08-21,100199,ING Liquid Fund-Super Institutional Growth Option,10.6527
2006-08-21,100200,ING Liquid Fund-Super Institutional Daily Dividend Option,10.0024
2006-08-21,100201,ING Liquid Fund-Super Institutional Weekly Dividend Option,10.0971
2006-08-21,100202,ING Balanced Fund-Dividend Option,11.32
2006-08-21,100203,ING Balanced Fund-Growth Option,16.18
2006-08-21,100218,JM Large Cap Fund (Regular) - IDCW,16.62
2006-08-21,100219,JM Large Cap Fund (Regular) - Growth Option,32.62
2006-08-21,100220,JM Aggressive Hybrid Fund (Regular) - IDCW,15.14
2006-08-21,100221,JM Aggressive Hybrid Fund (Regular) -Growth Option,19.92
2006-08-21,100222,JM Medium to Long Duration Fund (Regular) - Quarterly IDCW,10.1208
2006-08-21,100223,JM Medium to Long Duration Fund (Regular) - Growth Option,28.0541
2006-08-21,100233,JM Liquid Fund (Regular) - Weekly IDCW,10.3478
2006-08-21,100234,JM Liquid Fund - Growth Option,19.6898
2006-08-21,100237,JM High Liquidity Fund-- Institutional Plan - Growth,11.8786
2006-08-21,100238,JM High Liquidity Fund-Institutional Plan - Daily Dividend,10.0159
2006-08-21,100241,JM High Liquidity Fund-- Institutional Plan - Dividend,10.1137
2006-08-21,100243,JM High Liquidity Fund-- Premium Plan - Daily Dividend Option,10.0
2006-08-21,100244,JM Liquid Fund (Regular) - Quarterly IDCW,11.3362
2006-08-21,100245,JM High Liquidity Fund-Super Institutional Plan- Daily Dividend,10.0165
2006-08-21,100246,JM High Liquidity Fund-Super Institutional Plan- Weekly  Dividend,10.1011
2006-08-21,100247,JM Liquid Fund (Regular) - Super Institutional Plan - Growth Option,11.2951
2006-08-21,100249,JM G-Sec Fund - Quarterly Dividend Option,10.1387
2006-08-21,100250,JM G-Sec Fund - Growth Option,20.7382
2006-08-21,100251,JM G-Sec Fund-PF Plan - Growth Plan,21.5857
2006-08-21,100252,JM G-Sec Fund-PF Plan -Dividend Plan,19.7789
2006-08-21,100253,JM G-Sec Fund - Bonus Option - Principal Units,10.0879
2006-08-21,100254,JM Value Fund (Regular) - Growth Option,15.69
2006-08-21,100261,Kotak Gilt-Savings-Monthly Dividend,10.4451
2006-08-21,100262,Kotak Gilt-Savings-Growth,17.5919
2006-08-21,100263,Kotak Gilt-Savings-Annual Dividend,11.7642
2006-08-21,100264,Kotak Gilt-Investment Regular-Payout of Income Distribution cum capital withdrawal option,11.0728
2006-08-21,100265,Kotak Gilt-Investment Regular-Growth,23.021
2006-08-21,100280,Kotak Gilt-Investment  Provident Fund and Trust-Payout of Income Distribution cum capital withdrawal option,10.9551
2006-08-21,100281,Kotak Gilt-Investment  Provident Fund and Trust-Growth,23.2668
2006-08-21,100286,Kotak Aggressive Hybrid Fund - Regular Plan - IDCW - Payout & Reinvestment of Income Distribution cum capital withdrawal option,22.286
2006-08-21,100289,Kotak Tech,8.513
2006-08-21,100290,Kotak MNC,24.55
2006-08-21,100291,Kotak Bond-Deposit-Dividend,11.4357
2006-08-21,100292,Kotak Bond-Deposit-Growth,18.0942
2006-08-21,100298,Kotak Bond Regular Plan Quaterly Payout of Income Distribution cum capital withdrawal option,10.4829
2006-08-21,100299,Kotak Bond Fund - Regular Plan Growth,18.8358
2006-08-21,100300,Kotak Bond Fund - Regular Plan - Standard IDCW Option,12.5882
2006-08-21,100301,Kotak Bond Regular Plan Bonus Plan,12.555
2006-08-21,100312,LIC MF Flexi Cap Fund-Regular Plan-IDCW,12.1099
2006-08-21,100313,LIC MF Flexi Cap Fund-Regular Plan-Growth,17.7414
2006-08-21,100314,LIC MF Medium to Long Duration Fund-Regular Plan-IDCW,10.5402
2006-08-21,100315,LIC MF Medium to Long Duration Fund-Regular Plan-Growth,19.6576
2006-08-21,100316,LIC MF Gilt Fund-Regular Plan-IDCW,10.697
2006-08-21,100317,LIC MF Gilt Fund-Regular Plan-Growth,18.4055
2006-08-21,100318,LIC MF Gilt Fund-PF Plan-IDCW,10.6133
2006-08-21,100319,LIC MF Gilt Fund-PF Plan-Growth,10.6133
2006-08-21,100321,LIC MF Aggressive Hybrid Fund-Regular Plan-IDCW,11.7822
2006-08-21,100323,LIC MF Aggressive Hybrid Fund-Regular Plan-Growth,40.1511
2006-08-21,100325,LIC MF ULIS (5 Yrs. Single Premium)-Regular Plan-IDCW Reinvestment,12.2377
2006-08-21,100332,LIC MF Large Cap Fund-Regular Plan-IDCW,9.449
2006-08-21,100337,SaharaTax Gain-Dividend,15.7113
2006-08-21,100338,SaharaTax Gain-Growth,17.9824
2006-08-21,100347,Morgan Stanley Growth Fund- Regular Growth Plan,44.65
2006-08-21,100348,ICICI Prudential Large & Mid Cap Fund - IDCW,21.62
2006-08-21,100349,ICICI Prudential Large & Mid Cap Fund - Growth,79.47
2006-08-21,100350,ICICI Prudential Large & Mid Cap Fund - Institutional Option - I - Growth,10.48
2006-08-21,100351,ICICI Prudential FMCG Fund - IDCW,30.67
2006-08-21,100352,ICICI Prudential FMCG Fund - Growth,36.57
2006-08-21,100353,ICICI Prudential ELSS Tax Saver Fund - IDCW,27.35
2006-08-21,100354,ICICI Prudential ELSS Tax Saver Fund - Growth,85.19
2006-08-21,100355,ICICI Prudential Equity & Debt Fund - Monthly IDCW,16.95
2006-08-21,100356,ICICI Prudential Equity & Debt Fund - Growth,30.29
2006-08-21,100357,ICICI Prudential Liquid Fund -Quarterly IDCW,10.8183
2006-08-21,100359,ICICI Prudential Liquid Institutional Plus Fund - Div - Daily,11.8515
2006-08-21,100360,ICICI Prudential Liquid Institutional Plus Fund - Div - Weekly,11.8684
2006-08-21,100361,ICICI Prudential Liquid Fund-Dividend-Institutional Plus - Monthly,11.9626
2006-08-21,100362,ICICI Prudential Liquid Institutional Plus Fund - Growth,17.7985
2006-08-21,100363,ICICI Prudential Technology Fund - Growth,10.96
2006-08-21,100364,ICICI Prudential Long Term Bond Fund - Half Yearly IDCW,10.4592
2006-08-21,100365,ICICI Prudential Long Term Bond Fund - Growth,20.7794
2006-08-21,100366,ICICI Prudential Long Term Bond Fund-Institutional Quarterly Dividend,10.0325
2006-08-21,100367,ICICI Prudential Long Term Bond Fund - Quarterly IDCW,10.9168
2006-08-21,100368,ICICI Prudential Gilt Fund - IDCW,10.4017
2006-08-21,100369,ICICI Prudential Gilt Fund - Growth,21.1941
2006-08-21,100370,ICICI Prudential Short Term Gilt Fund - Dividend,10.5708
2006-08-21,100371,ICICI Prudential Short Term Gilt Fund - Growth,17.495
2006-08-21,100372,ICICI Prudential Short Term Gilt Fund - Half Yearly Dividend,10.1884
2006-08-21,100375,NIPPON INDIA GROWTH MID CAP FUND - IDCW Option,48.66
2006-08-21,100376,Nippon India Growth Mid Cap Fund-Growth Plan-Bonus Option,36.05
2006-08-21,100377,Nippon India Growth Mid Cap Fund-Growth Plan-Growth Option,217.42
2006-08-21,100378,Nippon India Vision Large & Midcap Fund - IDCW Option,46.77
2006-08-21,100379,Nippon India Vision Large & Midcap Fund-GROWTH PLAN-Bonus Option,25.26
2006-08-21,100380,Nippon India Vision Large & Midcap Fund-GROWTH PLAN-Growth Option,150.77
2006-08-21,100381,UTI Large Cap Fund-Income Option,15.4
2006-08-21,100382,UTI Large Cap Fund-Growth Option,17.66
2006-08-21,100383,NIPPON INDIA MEDIUM TO LONG DURATION FUND - MONTHLY IDCW Option,10.9478
2006-08-21,100384,NIPPON INDIA MEDIUM TO LONG DURATION  FUND - QUARTERLY IDCW Option,11.5166
2006-08-21,100385,NIPPON INDIA MEDIUM TO LONG DURATION  FUND - HALF YEARLY IDCW Option,11.1878
2006-08-21,100386,NIPPON INDIA MEDIUM TO LONG DURATION  FUND - ANNUAL IDCW Option,11.6658
2006-08-21,100387,Nippon India Medium to Long Duration  Fund - Growth Plan Growth Option,22.4599
2006-08-21,100388,Nippon India Medium to Long Duration  Fund - Growth Plan Bonus Option,10.5827
2006-08-21,100414,Tata Aggressive Hybrid Fund- Regular Plan - Growth Option,42.3993
2006-08-21,100415,Tata Ethical Fund-Regular Plan - Growth Option,39.9388
2006-08-21,100416,Tata Long Term Debt Fund - Regular Plan - Quarterly Dividend,10.5221
2006-08-21,100417,Tata Income Fund-Regular Plan - Half Yearly Payout of IDCW Option,10.8179
2006-08-21,100418,Tata Income Fund -Regular Plan - Growth Option,24.2621
2006-08-21,100470,Franklin India Large Cap Fund - IDCW,36.44
2006-08-21,100471,Franklin India Large Cap Fund-Growth,109.87
2006-08-21,100472,Franklin India Mid Cap Fund - IDCW,48.84
2006-08-21,100473,Franklin India Mid Cap Fund-Growth,175.39
2006-08-21,100474,Tata ELSS Fund- Regular Plan - Payout of IDCW Option,37.2693
2006-08-21,100475,Tata Large Cap Fund -Regular Plan - Growth Option,52.192
2006-08-21,100476,Taurus Flexi Cap Fund - Regular Plan - Growth,32.01
2006-08-21,100477,Taurus Mid Cap Fund - Regular Plan - Growth,13.06
2006-08-21,100480,Taurus ELSS Tax Saver Fund - Regular Plan - Growth,15.76
2006-08-21,100481,Franklin India Balanced Fund-Growth,30.49
2006-08-21,100482,Franklin India Balanced Fund-Div,26.36
2006-08-21,100483,Franklin India Growth Fund,24.21
2006-08-21,100484,Franklin India Index Fund- NSE Nifty 50 Index Fund - Growth,26.7465
2006-08-21,100485,Franklin India Govt.Sec. Fund-Composite Plan - Growth,23.4665
2006-08-21,100486,Franklin India Govt.Sec. Fund-Composite Plan - Dividend,10.7808
2006-08-21,100487,Franklin India Govt.Sec. Fund-Treasury Plan(Dividend Option),10.7113
2006-08-21,100489,Franklin India Govt.Sec. Fund-Treasury Plan(Growth Option),13.4906
2006-08-21,100490,Franklin India Govt.Sec. Fund-PF Plan - Growth,10.3059
2006-08-21,100491,Franklin India Govt.Sec. Fund-PF Plan - Dividend,10.3059
2006-08-21,100493,Franklin India Government Securities Fund - Growth,15.8366
2006-08-21,100494,Franklin India Government Securities Fund - IDCW,10.9329
2006-08-21,100495,Franklin India Govt.Sec. Fund-Long Term Plan - Bonus,12.3237
2006-08-21,100496,Templeton India Value Fund - Growth Plan,56.71
2006-08-21,100497,Templeton India Value Fund - IDCW,37.08
2006-08-21,100498,Franklin India Dynamic Accrual Fund - IDCW,10.5366
2006-08-21,100499,Franklin India Dynamic Accrual Fund-Growth,25.0466
2006-08-21,100503,Franklin India Low Duration Fund - Monthly - IDCW,10.2696
2006-08-21,100504,Franklin India Low Duration Fund - Quarterly - IDCW,10.2784
2006-08-21,100505,Templeton Monthly Income Plan-Half Yearly Dividend,12.16
2006-08-21,100506,Templeton Monthly Income Plan-Growth,18.9723
2006-08-21,100519,Franklin India Flexi Cap Fund - IDCW,32.88
2006-08-21,100520,Franklin India Flexi Cap Fund - Growth,112.14
2006-08-21,100521,Franklin India Technology Fund - IDCW,22.03
2006-08-21,100522,Franklin India Technology Fund-Growth,44.63
2006-08-21,100523,Franklin FMCG Fund - Growth,34.58
2006-08-21,100524,Franklin INDIA OPPORTUNITIES FUND - IDCW,17.99
2006-08-21,100525,Franklin India ELSS Tax Saver Fund - IDCW,34.81
2006-08-21,100526,Franklin India ELSS Tax Saver Fund-Growth,110.38
2006-08-21,100527,Franklin India Corporate Debt Fund - Plan A - Annual - IDCW,10.3188
2006-08-21,100528,Franklin India Corporate Debt Fund - Growth,24.2069
2006-08-21,100529,Franklin India Corporate Debt Fund - Plan B - Monthly - IDCW,13.9934
2006-08-21,100530,Franklin India Corporate Debt Fund - Plan B - Quarterly - IDCW,13.9954
2006-08-21,100531,Franklin India Corporate Debt Fund - Plan B - Half yearly - IDCW,14.1834
2006-08-21,100532,Franklin India Corporate Debt Fund - Monthly Bonus,19.4012
2006-08-21,100535,Franklin India Retirement Fund - IDCW,17.2772
2006-08-21,100536,Franklin India Retirement Fund - Growth,39.5108
2006-08-21,100537,Franklin India Liquid Fund - Regular Plan - Weekly - IDCW,1244.5338
2006-08-21,100538,Franklin India Liquid Fund - Regular Plan - Growth,1785.1499
2006-08-21,100541,Franklin India Liquid Fund - Regular Plan - Daily - IDCW,1512.34
2006-08-21,100542,Franklin India Liquid Fund - Liquid Plan - Weekly Dividend,1000.7368
2006-08-21,100543,Franklin India Liquid Fund - Liquid Plan - Daily IDCW,1000.25
2006-08-21,100544,Franklin India Liquid Fund - Liquid Plan - Growth,1099.6055
2006-08-21,100546,Franklin India Liquid Fund - Super Institutional Plan - Growth,1059.007
2006-08-21,100547,Franklin India Liquid Fund - Super Institutional Plan - Daily - IDCW,1000.25
2006-08-21,100548,Franklin India Liquid Fund - Super Institutional Plan - Weekly - IDCW,1016.3248
2006-08-21,100549,Franklin India Aggressive Hybrid Fund - IDCW,20.1102
2006-08-21,100550,Franklin India Aggressive Hybrid Fund - Growth Plan,28.2364
2006-08-21,100551,Templeton India Children’s Asset Plan-Education Plan,23.7551
2006-08-21,100552,Templeton India Children’s Asset Plan-Gift Plan - Growth,26.6414
2006-08-21,100553,Templeton India Children’s Asset Plan-Gift Plan - Dividend,26.6414
2006-08-21,100556,Franklin India Taxshield 97,105.57
2006-08-21,100557,Franklin India Taxshield 98,103.74
2006-08-21,100558,Franklin India Taxshield 99,61.26
2006-08-21,100561,Templeton India Money Market Account - Bonus Plan,1.0
2006-08-21,100563,DBS Chola Triple Ace-Regular -Cumulative,23.7079
2006-08-21,100567,DBS Chola Triple Ace-Regular - Quarterly Dividend,11.1627
2006-08-21,100569,DBS Chola Triple Ace-Semi Annual Dividend,11.4723
2006-08-21,100573,DBS Chola Triple Ace-Regular Bonus,13.1731
2006-08-21,100574,DBS Chola Freedom Income -Short Term Fund-Regular-Monthly Dividend,10.9101
2006-08-21,100575,DBS Chola Freedom Income -Short Term Fund-Regular - Cumulative,11.341
2006-08-21,100576,DBS Chola Freedom Income -Short Term Fund-Cum- Institutional Plan,11.476
2006-08-21,100579,DBS Chola Gilt-Investment-Quarterly Dividend,9.8705
2006-08-21,100580,DBS Chola Gilt-Investment-Cumulative,17.9459
2006-08-21,100589,Canara Robeco Expo-Income Plan,20.06
2006-08-21,100590,Canara Robeco Expo-Growth Plan,46.09
2006-08-21,100593,CANARA ROBECO ELSS TAX SAVER - REGULAR PLAN -IDCW (Payout),17.6
2006-08-21,100596,CANARA ROBECO GILT FUND - REGULAR PLAN - IDCW (Payout/Reinvestment),10.2735
2006-08-21,100597,CANARA ROBECO GILT FUND - REGULAR PLAN - GROWTH OPTION,18.0009
2006-08-21,100600,CANARA ROBECO CONSERVATIVE HYBRID FUND - REGULAR PLAN - MONTHLY IDCW (Payout/Reinvestment),11.37
2006-08-21,100601,CANARA ROBECO CONSERVATIVE HYBRID FUND - REGULAR PLAN - GROWTH OPTION,17.67
2006-08-21,100602,Sundaram Medium Duration Fund (Formerly Known as Sundaram Medium Term Bond Fund) Regular Plan-Income Distribution cum Capital Withdrawal(IDCW),10.1943
2006-08-21,100603,Sundaram Medium Duration Fund (Formerly Known as Sundaram Medium Term Bond Fund) Regular Plan - Growth,22.1739
2006-08-21,100604,Sundaram Medium Duration Fund (Formerly Known as Sundaram Medium Term Bond Fund) Regular Plan -Growth,11.676
2006-08-21,100609,Sundaram Medium Duration Fund (Formerly Known as Sundaram Medium Term Bond Fund) Regular Plan- Income Distribution cum Capital Withdrawal(IDCW),10.188
2006-08-21,100610,Sundaram Medium Duration Fund (Formerly Known as Sundaram Medium Term Bond Fund) Regular Plan -Income Distribution cum Capital Withdrawal (IDCW),10.1932
2006-08-21,100611,Sundaram Medium Duration Fund (Formerly Known as Sundaram Medium Term Bond Fund) Institutional Plan -Growth,11.3108
2006-08-21,100612,Sundaram Growth Fund-Dividend,12.4947
2006-08-21,100613,Sundaram Growth Fund-Growth,57.1338
2006-08-21,100614,Sundaram Value Fund Regular Plan - Income Distribution cum Capital Withdrawal (IDCW),15.9801
2006-08-21,100617,Sundaram Equity Hybrid Fund Regular Plan - Growth,28.6521
2006-08-21,100618,Sundaram Money Fund Retail Plan - Growth,15.0599
2006-08-21,100619,Sundaram Money Fund Retail Plan - Quarterly Reinvestment of Income Distribution cum Capital Withdrawal (IDCW),10.0934
2006-08-21,100620,Sundaram Money Fund Retail Plan - Daily Reinvestment of Income Distribution cum Capital Withdrawal (IDCW),10.0953
2006-08-21,100621,Sundaram Money Fund Retail Plan - Weekly Reinvestment of Income Distribution cum Capital Withdrawal (IDCW),10.2619
2006-08-21,100622,Sundaram Money Fund Retail Plan - Fortnightly Reinvestment of Income Distribution cum Capital Withdrawal (IDCW),10.1882
2006-08-21,100623,Sundaram Money Fund Retail Plan - Monthly Income Distribution cum Capital Withdrawal (IDCW),10.1389
2006-08-21,100630,quant Multi Cap Fund-IDCW Option - Regular Plan,14.1062
2006-08-21,100631,quant Multi Cap Fund-GROWTH OPTION - Regular Plan,47.8982
2006-08-21,100638,SBI Medium to Long Duration Fund - Regular Plan - Half Yearly - Income Distribution cum Capital Withdrawal Option (IDCW),10.2939
2006-08-21,100639,SBI Medium to Long Duration Fund-REGULAR PLAN-Growth,19.2731
2006-08-21,100640,SBI Medium to Long Duration Fund-REGULAR PLAN-Bonus,11.6745
2006-08-21,100641,SBI ULTRA SHORT DURATION FUND - REGULAR PLAN - GROWTH,16.0931
2006-08-21,100643,SBI Technology Opportunities Fund - Regular Plan - Income Distribution cum Capital Withdrawal Option (IDCW),19.84
2006-08-21,100644,SBI Healthcare Opportunities Fund - Regular Plan - Income Distribution cum Capital Withdrawal Option (IDCW),27.66
2006-08-21,100645,SBI Consumption Opportunities Fund - Regular Plan - Income Distribution cum Capital Withdrawal Option (IDCW),14.25
2006-08-21,100646,UTI - Unit Linked Insurance Plan,14.709
2006-08-21,100648,UTI - CRTS 81 - Dividend Option,111.3993
2006-08-21,100650,UTI Large Cap Fund - Regular Plan - IDCW,26.33
2006-08-21,100651,UTI Large Cap Fund - Regular Plan - Growth Option,29.45
2006-08-21,100656,UTI - Master Plus Unit Scheme-Growth Option,53.79
2006-08-21,100657,UTI - Master Plus Unit Scheme-Income Option,47.77
2006-08-21,100663,UTI Large & Mid Cap Fund - Regular Plan - IDCW,35.13
2006-08-21,100664,UTI Large & Mid Cap Fund - Regular Plan - Growth Option,38.11
2006-08-21,100668,UTI Flexi Cap Fund - Regular Plan - IDCW,26.27
2006-08-21,100669,UTI - Flexi Cap Fund-Growth Option,28.45
2006-08-21,100678,UTI Children's Hybrid Fund - Regular Plan,14.0083
2006-08-21,100682,UTI Retirement Fund - Regular Plan,19.1204
2006-08-21,100684,UTI Aggressive Hybrid Fund - Regular Plan - Growth,49.91
2006-08-21,100685,UTI Aggressive Hybrid Fund - Regular Plan - IDCW,19.73
2006-08-21,100711,UTI - INDEX SELECT FUND-Income Option,30.1
2006-08-21,100712,UTI - INDEX SELECT FUND-Growth Option,30.1
2006-08-21,100715,DBS Chola Multi-Cap Fund-Dividend Option,12.67
2006-08-21,100716,DBS Chola Multi-Cap Fund-Cumulative Option,15.89
2006-08-21,100723,UTI MMF-Discontinued - Regular Plan -Growth,20.1155
2006-08-21,100724,UTI MMF- Discontinued - Regular Plan - Flexi Dividend Option,17.5554
2006-08-21,100725,UTI MMF- Discontinued - Regular Plan - Periodic Dividend Option,17.4379
2006-08-21,100739,UTI MNC Fund - Regular Plan - IDCW,26.1
2006-08-21,100740,UTI - MNC Fund - Regular Plan - Growth Option,31.43
2006-08-21,100741,UTI Medium to Long Duration Fund- Regular Plan - Growth,21.0686
2006-08-21,100742,UTI Medium to Long Duration Fund - Regular Plan - Quarterly IDCW,10.8994
2006-08-21,100748,UTI - Master Index Fund-Income Option,36.2199
2006-08-21,100749,UTI - Master Index Fund-Growth Option,36.2199
2006-08-21,100750,UTI - Master Value Fund-Income Option,17.39
2006-08-21,100751,UTI - Master Value Fund-Growth Option,26.64
2006-08-21,100780,Sundaram Banking & PSU Fund (Formerly Known as Sundaram Banking and PSU Debt Fund) Retail Plan - Monthly Income Distribution cum Capital Withdrawal (IDCW),10.1861
2006-08-21,100781,Sundaram Banking & PSU Fund (Formerly Known as Sundaram Banking and PSU Debt Fund) Retail Plan - Growth,10.8979
2006-08-21,100782,Sundaram Banking & PSU Fund (Formerly Known as Sundaram Banking and PSU Debt Fund) Regular Plan - Daily Reinvestment of Income Distribution cum Capital Withdrawal (IDCW),10.0519
2006-08-21,100784,Sundaram Banking & PSU Fund (Formerly Known as Sundaram Banking and PSU Debt Fund) Regular Plan - Growth,10.9891
