date,scheme_code,scheme_name,nav
2006-08-21,100785,Sundaram Corporate Bond Fund Regular Plan -Income Distribution cum Capital Withdrawal(IDCW),10.2436
2006-08-21,100786,Sundaram Corporate Bond Fund Regular Plan - Income Distribution cum Capital Withdrawal (IDCW ),10.0859
2006-08-21,100787,Sundaram Corporate Bond Fund Regular Plan-Income Distribution cum Capital Withdrawal (IDCW),10.0865
2006-08-21,100788,Sundaram Corporate Bond Fund Regular Plan- Income Distribution cum Capital Withdrawal (IDCW),10.0829
2006-08-21,100789,Sundaram Corporate Bond Fund Regular Plan- Growth,10.8715
2006-08-21,100790,Sundaram Corporate Bond Fund Institutional Plan - Income Distribution cum Capital Withdrawal (IDCW),10.2437
2006-08-21,100792,Sundaram Corporate Bond Fund Institutional Plan - Growth,10.8703
2006-08-21,100793,Sundaram Banking & PSU Fund (Formerly Known as Sundaram Banking and PSU Debt Fund) Regular Plan - Income Distribution cum Capital Withdrawal (IDCW),10.2109
2006-08-21,100794,Sundaram Small Cap Fund Regular Plan - Income Distribution cum Capital Withdrawal (IDCW),13.9102
2006-08-21,100795,Sundaram Small Cap Fund Regular Plan - Growth,16.1088
2006-08-21,100796,Sahara Midcap Fund-Growth Plan,15.6226
2006-08-21,100797,Sahara Midcap Fund-Dividend Plan,13.946
2006-08-21,100798,Sahara Midcap Fund-Auto Payout,15.6226
2006-08-21,100799,Sahara Midcap Fund-Bonus,15.6226
2006-08-21,100800,UTI Growth Sector Funds-UTI - GSF - Brand Value-Income Option,18.0
2006-08-21,100801,UTI Growth Sector Funds-UTI - GSF - Brand Value-Growth Option,23.52
2006-08-21,100802,UTI Software Fund-Growth Option,21.17
2006-08-21,100803,UTI Software Fund-Income Option,19.41
2006-08-21,100804,UTI Energy Fund-Income Option,18.83
2006-08-21,100805,UTI Energy Fund-Growth Option,24.17
2006-08-21,100806,UTI Healthcare Fund - Regular Plan - IDCW,18.88
2006-08-21,100807,UTI Healthcare Fund - Regular Plan - Growth Option,21.41
2006-08-21,100808,UTI Services Industries Fund-Income Option,28.55
2006-08-21,100809,UTI Services Industries Fund-Growth Option,38.58
2006-08-21,100811,UTI - G-Sec Fund-Income,10.4239
2006-08-21,100812,UTI - G-Sec Fund-GrowthN,18.5409
2006-08-21,100813,UTI Overnight Fund - Regular Plan - Periodic IDCW,10.5929
2006-08-21,100814,UTI - Overnight  Fund - Regular Plan - Growth Option,11.3236
2006-08-21,100820,UTI ELSS Tax Saver Fund - Regular Plan - IDCW,16.45
2006-08-21,100821,UTI ELSS Tax Saver Fund - Regular Plan - Growth Option,26.77
2006-08-21,100822,UTI Nifty 50 Index Fund - Regular Plan - Growth Option,21.4607
2006-08-21,100823,UTI Nifty 50 Index Fund - Regular Plan - IDCW,21.4607
2006-08-21,100828,Kotak Liquid-Regular (Dividend),10.0304
2006-08-21,100829,Kotak Liquid-Regular (Growth),14.2145
2006-08-21,100830,Kotak Liquid-Institutional Plan  (Growth),14.4028
2006-08-21,100831,Kotak Liquid Fund -Institutional Plan - (Daily Dividend),12.2281
2006-08-21,100832,Kotak Liquid-Institutional Plan (Weekly Dividend),10.0339
2006-08-21,100833,Kotak Liquid Fund - Regular  - Daily Reinvestment of Income Distribution cum capital withdrawal option,12.2281
2006-08-21,100834,Kotak Liquid Fund Regular Plan Weekly Reinvestment of Income Distribution cum capital withdrawal option Dividend,10.0471
2006-08-21,100835,Kotak Liquid Fund - Regular Plan - Growth,14.4779
2006-08-21,100836,Kotak Liquid Fund -Sweep Daily Dividend,10.0071
2006-08-21,100837,Nippon India Liquid Fund - Retail Option - Growth Plan,17.316
2006-08-21,100838,NIPPON INDIA LIQUID FUND - RETAIL Plan - WEEKLY IDCW OPTION,10.3456
2006-08-21,100842,NIPPON INDIA LIQUID FUND - RETAIL Plan - DAILY IDCW OPTION,15.2396
2006-08-21,100843,NIPPON INDIA LIQUID FUND - RETAIL plan - MONTHLY IDCW OPTION,10.9288
2006-08-21,100844,NIPPON INDIA LIQUID FUND - RETAIL Plan - QUARTERLY IDCW OPTION,17.194
2006-08-21,100845,Reliance Liquid Fund-Cash Plan-Growth Plan,12.5566
2006-08-21,100848,Reliance Liquid Fund-Cash Plan-Weekly Dividend Reinvestment Option,10.9213
2006-08-21,100849,Reliance Liquid Fund-Cash Plan-Daily Dividend Reinvestment Option,11.1411
2006-08-21,100851,Nippon India Liquid Fund -Growth Plan,17.4501
2006-08-21,100852,NIPPON INDIA LIQUID FUND - DAILY IDCW OPTION,15.284
2006-08-21,100853,NIPPON INDIA LIQUID FUND - WEEKLY IDCW OPTION,15.3089
2006-08-21,100855,NIPPON INDIA LIQUID FUND - MONTHLY IDCW OPTION,15.1981
2006-08-21,100856,Nippon India Corporate Bond Fund - Growth Plan - Growth Option,15.1261
2006-08-21,100857,NIPPON INDIA CORPORATE BOND FUND - MONTHLY IDCW Option,10.2436
2006-08-21,100858,NIPPON INDIA CORPORATE BOND FUND - QUARTERLY IDCW Option,10.4514
2006-08-21,100859,Nippon India Corporate Bond Fund - Growth Plan - Bonus Option,10.8049
2006-08-21,100864,LIC MF ELSS Tax Saver-Regular Plan-IDCW,12.2773
2006-08-21,100865,LIC MF ELSS Tax Saver-Regular Plan-Growth,22.6801
2006-08-21,100868,HDFC Liquid Fund - Growth Plan,14.2254
2006-08-21,100872,HDFC Liquid Fund-PREMIUM PLUS- Growth,14.3411
2006-08-21,100873,HDFC Liquid Fund-PREMIUM- Growth,14.3103
2006-08-21,100874,HDFC Liquid Fund - IDCW Plan Weekly,10.3226
2006-08-21,100875,HDFC Liquid Fund - IDCW Daily,10.1982
2006-08-21,100876,HDFC Liquid Fund - IDCW Monthly,10.3013
2006-08-21,100877,HDFC Liquid Fund-Premium Plan - Dividend-Daily,12.2598
2006-08-21,100878,HDFC Liquid Fund-Premium Plan - Dividend-Weekly,12.4884
2006-08-21,100881,HDFC Liquid Fund-Premium Plus Plan - Dividend-Weekly,12.4301
2006-08-21,100887,Principal Cash Management-Liquid Option-Dividend Plan,10.127
2006-08-21,100888,Principal Cash Management-Liquid Option-Growth Plan,14.1111
2006-08-21,100889,Principal Cash Management-Liquid Option-Monthly Dividend,10.0404
2006-08-21,100890,Principal Cash Management-Liquid Option-Institutional - Weekly Dividend Plan,10.0088
2006-08-21,100891,Principal Cash Management-Liquid Option-Institutional - Monthly Dividend Plan,10.0417
2006-08-21,100892,Principal Cash Management-Liquid Option-Daily Dividend,10.0022
2006-08-21,100893,Principal Cash Management-Liquid Option-Institutional - Growth Plan,11.846
2006-08-21,100894,Principal Cash Management-Liquid Option-Institutional - Daily Dividend Plan,10.0022
2006-08-21,100895,Principal Cash Management Fund - Daily Income Distribution CUM Capital Withdrawal,10.0007
2006-08-21,100896,Principal Cash Management Fund - Weekly Income Distribution CUM Capital Withdrawal Option,10.0081
2006-08-21,100897,Principal Cash Management Fund - Monthly Income Distribution CUM Capital Withdrawal Option,10.0425
2006-08-21,100898,Principal Cash Management Fund -Growth Option,11.1725
2006-08-21,100899,HDFC Childrens Fund-Savings,14.543
2006-08-21,100900,HDFC Childrens Fund - Growth Plan,22.764
2006-08-21,100902,Franklin Pharma Fund - Growth,27.37
2006-08-21,100906,DBS Chola Opportunities Fund-Regular Quarterly Dividend,13.57
2006-08-21,100907,DBS Chola Opportunities Fund-Cumulative,20.86
2006-08-21,100915,SBI Contra Fund - Regular Plan - Income Distribution cum Capital Withdrawal Option (IDCW),23.52
2006-08-21,100927,SBI Conservative Hybrid Fund - Regular Plan - Monthly Income Distribution cum Capital Withdrawal Option (IDCW),10.6903
2006-08-21,100928,SBI Conservative Hybrid Fund - Regular Plan - Quarterly Income Distribution cum Capital Withdrawal Option (IDCW),10.667
2006-08-21,100929,SBI Conservative Hybrid Fund - Regular Plan - Annual Income Distribution cum Capital Withdrawal Option (IDCW),10.7287
2006-08-21,100940,DSP BlackRock Liquidity Fund - Regular Plan - Growth,17.566
2006-08-21,100941,DSP BlackRock Liquidity Fund - Regular Plan Weekly Dividend,12.4064
2006-08-21,100943,DSP BlackRock Liquidity Fund - Regular Plan - Daily Dividend,10.01
2006-08-21,100948,Franklin India Conservative Hybrid Fund - Growth,19.5709
2006-08-21,100949,Franklin India Conservative Hybrid Fund - Plan A - Monthly - IDCW,11.9873
2006-08-21,100950,Franklin India Conservative Hybrid Fund - Plan A - Quarterly - IDCW,11.8841
2006-08-21,100951,Franklin India Conservative Hybrid Fund - Monthly Bonus,14.6118
2006-08-21,100952,ICICI Prudential MIP - Growth,17.9797
2006-08-21,100953,ICICI Prudential MIP - Dividend Monthly,11.3986
2006-08-21,100954,ICICI Prudential MIP - Dividend Quarterly,11.721
2006-08-21,100955,ICICI Prudential MIP - Dividend Half Yearly,11.8099
2006-08-21,100956,Aditya Birla Tax Plan 98,173.11
2006-08-21,100957,Principal Income Fund-Dividend Plan-Half Yearly,10.6063
2006-08-21,100958,Principal Income Fund-Dividend Plan-Quaterly,10.456
2006-08-21,100960,Principal Dynamic Bond Fund - Dividend Option -Annual,10.7927
2006-08-21,100961,Principal Dynamic Bond Fund -Dividend Option - Quarterly,10.7275
2006-08-21,100962,Principal Income Fund-Growth Plan-growth,16.8567
2006-08-21,100963,Principal Dynamic Bond Fund - Growth Option,11.8779
2006-08-21,100966,Principal Multi Cap Growth Fund- Half Yearly Income Distribution CUM Capital Withdrawal Option,20.61
2006-08-21,100967,Principal Multi Cap Growth Fund-Growth Option,42.61
2006-08-21,100968,SBI Conservative Hybrid Fund - Regular Plan - Growth,16.1777
2006-08-21,100970,Aditya Birla Sun Life MIP - Regular Plan - Growth,18.1813
2006-08-21,100971,Aditya Birla Sun Life MIP - Regular Plan - Monthly Dividend,10.9104
2006-08-21,100972,Aditya Birla Sun Life MIP - Regular Plan - Monthly Payment,18.1813
2006-08-21,100975,DBS Chola Liquid Fund-Regular Cumulative,14.5124
2006-08-21,100978,DBS Chola Liquid Fund-Daily Dividend Reinvestment Plan,10.0315
2006-08-21,100989,DBS Chola Liquid Fund-Cum -Institutional Plus,14.5932
2006-08-21,100997,HDFC Long Term Advantage Plan - IDCW Plan,39.739
2006-08-21,100998,HDFC Long Term Advantage Plan - Growth Plan,79.602
2006-08-21,100999,SBI Gilt Fund - Regular Plan - Income Distribution cum Capital Withdrawal Option (IDCW),10.1543
2006-08-21,101000,Tata Life Sciences & Technology Fund - Growth,40.5713
2006-08-21,101001,SBI GILT FUND - REGULAR PLAN - GROWTH,16.5845
2006-08-21,101002,SBI CONSTANT MATURITY 10 Year GILT FUND - REGULAR PLAN - GROWTH,14.3116
2006-08-21,101003,SBI Constant Maturity 10 Year Gilt Fund - Regular Plan - Income Distribution cum Capital Withdrawal Option (IDCW),10.002
2006-08-21,101037,Franklin India Index Tax Fund,26.2877
2006-08-21,101042,Tata Gilt Securities Fund -Regular Plan- Growth Option,22.3651
2006-08-21,101044,Franklin India Floating Rate Fund - IDCW,10.0
2006-08-21,101048,Franklin India Floating Rate Fund - Growth Plan,13.1112
2006-08-21,101049,Tata Gilt Securities Fund - Regular Plan - Payout of IDCW Option,11.6016
2006-08-21,101059,SUNDARAM GILT FUND (DIV. OPTION),10.4403
2006-08-21,101065,quant Mid Cap Fund - Growth Option - Regular Plan,23.1178
2006-08-21,101066,quant Mid Cap Fund - IDCW Option - Regular Plan,13.582
2006-08-21,101069,quant Aggressive Hybrid Fund-IDCW Option - Regular Plan,13.3633
2006-08-21,101070,quant Aggressive Hybrid Fund - Growth Option - Regular Plan,41.2776
2006-08-21,101071,quant Multi Asset Allocation Fund - IDCW Option - Regular Plan,13.1933
2006-08-21,101072,quant Multi Asset Allocation Fund-GROWTH OPTION - Regular Plan,14.419
2006-08-21,101078,JM Liquid Fund (Regular) - Daily IDCW,10.4302
2006-08-21,101081,HDFC Gilt Fund-Short Term-Dividend,10.5164
2006-08-21,101082,HDFC Gilt Fund-Short Term-Growth,13.2918
2006-08-21,101083,HDFC Gilt Fund - Growth Plan,15.2504
2006-08-21,101084,HDFC Gilt Fund - IDCW Plan,10.1039
2006-08-21,101092,SUNDARAM GILT FUND (Growth. OPTION),13.0544
2006-08-21,101094,Taurus Gilt Fund-Dividend,12.3112
2006-08-21,101095,Taurus Gilt Fund-Growth,12.6311
2006-08-21,101098,ICICI Prudential Child Care Plan Study - Cumulative,18.2392
2006-08-21,101099,Grindlays Cash Fund-Growth,13.2488
2006-08-21,101100,Grindlays Cash Fund-Dividend (Daily),10.5819
2006-08-21,101113,Taurus Short Term Income Fund- Regular Plan - Dividend Option,13.0803
2006-08-21,101114,Taurus Short Term Income Fund- Regular Plan - Growth Option,13.4514
2006-08-21,101116,Principal Government Securities Fund-Investment-Dividend - Half Yearly,11.2224
2006-08-21,101117,Principal Government Securities Fund-Dividend Option - Quarterly,11.1341
2006-08-21,101118,Principal Government Securities Fund-Growth,15.6667
2006-08-21,101119,Principal Government Securities Fund-Dividend Option- Annually,13.5593
2006-08-21,101120,Principal Gilt Fund-Savings-Growth,13.7155
2006-08-21,101121,Principal Gilt Fund-Savings-Dividend,10.2935
2006-08-21,101122,Principal Gilt Fund-Provident-Growth,10.6132
2006-08-21,101123,Principal Gilt Fund-Provident-Haly Yearly,10.2573
2006-08-21,101124,Principal Gilt Fund-Provident-Annual,10.6328
2006-08-21,101126,Principal Gilt Fund-Provident-Annual Rebalancing 2005,10.5677
2006-08-21,101127,ICICI Prudential Children's Fund - Regular Plan,34.01
2006-08-21,101131,DBS Chola Growth Fund-Quarterly Dividend,14.17
2006-08-21,101132,DBS Chola Growth Fund-Cumulative,26.34
2006-08-21,101143,ICICI Prudential Multi-Asset Fund - IDCW,17.8788
2006-08-21,101144,ICICI Prudential Multi-Asset Fund - Growth,52.2628
2006-08-21,101154,BARODA INCOME FUND - Plan A - Growth Option,12.3435
2006-08-21,101155,BARODA INCOME FUND - Plan A - Dividend Option,12.3436
2006-08-21,101161,Nippon India Multi Cap Fund-Growth Plan-Growth Option,17.6854
2006-08-21,101162,Nippon India Multi Cap Fund-Growth Plan-Bonus Option,17.6854
2006-08-21,101163,NIPPON INDIA MULTI CAP FUND - IDCW Option,16.6008
2006-08-21,101165,ICICI Prudential Short Term Fund - Monthly IDCW,10.7996
2006-08-21,101169,SBI Children's Fund - Savings Plan - REGULAR PLAN - GROWTH,16.3262
2006-08-21,101170,Sahara Gilt Fund-Growth,12.0259
2006-08-21,101171,Sahara Gilt Fund-Dividend,10.9976
2006-08-21,101172,ING Vysya Equity Fund-Dividend Option,13.15
2006-08-21,101173,ING Vysya Equity Fund-Growth Option,27.59
2006-08-21,101177,Grindlays Government Securities Fund - IP (Qtr.Dividend),10.1985
2006-08-21,101178,Grindlays Government Securities Fund - ST (Monthly Dividend),10.0256
2006-08-21,101179,Grindlays Government Securities Fund-IP(Annual Dividend),10.3343
2006-08-21,101180,Grindlays Government Securities Fund-ST (Quarterly Dividend),10.1998
2006-08-21,101181,JM Medium to Long Duration Fund (Regular) - Bonus Option- Principal Units,11.4771
2006-08-21,101184,LIC MF Liquid Fund-Regular Plan-Daily IDCW,10.9801
2006-08-21,101185,LIC MF Liquid Fund-Regular Plan-Growth,12.9915
2006-08-21,101186,Tata Income Fund- Regular Plan - Periodic Payout of IDCW Option,14.0501
2006-08-21,101187,Baroda BNP Paribas GILT FUND - Regular Plan - Growth Option,10.9669
2006-08-21,101188,Baroda BNP Paribas GILT FUND - Regular Plan - IDCW Option,10.968
2006-08-21,101190,BOB GILT FUND-PF Plan (Growth),10.3255
2006-08-21,101192,DBS Chola Freedom Income-STF Regular-Semi Annual Dividend,11.2511
2006-08-21,101198,LIC MF BSE Sensex Index Fund-Regular Plan-IDCW,15.7806
2006-08-21,101199,LIC MF BSE Sensex Index Fund-Regular Plan-Growth,24.8352
2006-08-21,101200,LIC MF Nifty 50 Index Fund-Regular Plan-IDCW,13.7215
2006-08-21,101201,LIC MF Nifty 50 Index Fund-Regular Plan-Growth,21.5366
2006-08-21,101202,LIC MF Index Fund-Sensex Advantage-Dividend,12.3482
2006-08-21,101203,LIC MF Index Fund-Sensex Advantage-Growth,24.2721
2006-08-21,101206,SBI OVERNIGHT FUND - REGULAR PLAN - GROWTH,12.3974
2006-08-21,101207,UTI-Fixed Maturity Plan Yearly Series - July 2005-Dividend Option,10.0257
2006-08-21,101208,UTI-Fixed Maturity Plan Yearly Series - July 2005-Growth Option,10.6184
2006-08-21,101209,Taurus Large Cap Fund - Regular Plan - Growth,30.15
2006-08-21,101221,ICICI Prudential Money Market Fund Retail Growth (erstwhile Cash Option),12.1735
2006-08-21,101222,Tata Aggressive Hybrid Fund- Regular Plan - Periodic Payout of IDCW Option,34.7943
2006-08-21,101224,Tata Dynamic Bond Fund- Regular Plan - Payout of IDCW Option,10.2818
2006-08-21,101228,ICICI Prudential Multicap Fund - Growth,68.01
2006-08-21,101229,ICICI Prudential Short Term Fund - Institutional Plan - Dividend Monthly,11.061
2006-08-21,101230,ICICI Prudential Short Term Fund-Institutional Plan-Dividend Fortnightly,11.0243
2006-08-21,101231,ICICI Prudential Short Term Fund-Institutional Growth,13.7603
2006-08-21,101232,Franklin India Short-Term Income Plan-Growth,1317.2267
2006-08-21,101236,Franklin India Short Term Income Plan -  Retail Plan - Monthly - IDCW,1015.6453
2006-08-21,101237,Franklin India Short-Term Income Plan-Weekly Bonus,1049.4861
2006-08-21,101238,Franklin India Short Term Income Plan -  Retail Plan - Quarterly - IDCW,1024.5064
2006-08-21,101242,Franklin India Short Term Income Plan -  Retail Plan - Weekly - IDCW,1094.9084
2006-08-21,101244,Franklin India Short-Term Income Plan-Institutional Plan - Growth,1052.3212
2006-08-21,101245,Templeton India Short-Term Income Plan-Institutional Plan - Weekly Dividend,1005.4942
2006-08-21,101246,Franklin India Short-Term Income Plan-Institutional Plan - Monthly Dividend,1048.0989
2006-08-21,101248,Grindlays Cash Fund - Plan B (G) (Institutional Plan),13.3167
2006-08-21,101258,Grindlays Dynamic Bond Fund - GDBF (Annual Dividend),10.3693
2006-08-21,101262,Nippon India Power & Infra Fund-Growth Plan -Growth Option,27.2426
2006-08-21,101263,Nippon India Power & Infra Fund-Growth Plan-Bonus Option,27.2426
2006-08-21,101264,NIPPON INDIA POWER & INFRA FUND - IDCW Option,22.5419
2006-08-21,101265,Principal Hybrid Equity Fund-Growth,19.88
2006-08-21,101266,Principal Hybrid Equity Fund- Monthly Income Distribution CUM Capital Withdrawal,16.0
2006-08-21,101271,LIC MF Children's Fund-Regular Plan-Growth,13.9447
2006-08-21,101279,Grindlays Dynamic Bond Fund - GDBF (Growth),13.0193
2006-08-21,101281,HDFC BSE Sensex Index Fund - Growth Plan,109.3957
2006-08-21,101282,HDFC Index Fund-Sensex Plus( FV-Rs32.161),123.0273
2006-08-21,101288,ING Short Term Income Fund-Growth Option,12.7034
2006-08-21,101294,Birla Sun Life Cash Plus Sweep Plan-Dividend Option,10.049
2006-08-21,101295,SBI ESG Exclusionary Strategy Fund - Regular Plan - Income Distribution cum Capital Withdrawal Option (IDCW),27.7
2006-08-21,101296,Banking Index Benchmark Exchange Traded Scheme (Bank BeES),452.4357
2006-08-21,101303,DSP Short Term Fund - Regular Plan - Regular Plan - IDCW - Weekly,10.1858
2006-08-21,101304,DSP Short Term Fund - Regular Plan - Growth,12.5377
2006-08-21,101305,DSP Short Term Fund - Regular Plan - IDCW,10.5812
2006-08-21,101306,DSP Short Term Fund - IDCW - Monthly,10.4028
2006-08-21,101307,DBS Chola Liquid Fund - Regular Weekly Dividend,11.907
2006-08-21,101313,Aditya Birla Sun Life Nifty 50 Index Fund -REGULAR - IDCW,19.2639
2006-08-21,101314,Aditya Birla Sun Life Nifty 50 Index Fund - Growth - Regular Plan,34.8292
2006-08-21,101315,Aditya Birla Sun Life Savings Fund-Insititutional Fortnightly Dividend,10.5174
2006-08-21,101316,Aditya Birla Sun Life Savings Fund-Retail Growth,13.36
2006-08-21,101317,Aditya Birla Sun Life Savings Fund - Growth - Regular Plan,13.4727
2006-08-21,101318,Aditya Birla Sun Life Savings Fund-Retail Fortnightly Dividend,11.2804
2006-08-21,101319,Grindlays Cash Fund - Dividend (Weekly),10.1967
2006-08-21,101325,Nifty Benchmark Exchange Traded Scheme- Nifty BeES,342.9886
2006-08-21,101349,ICICI Prudential Nifty 50 Index Fund - Cumulative Option,30.0274
2006-08-21,101350,ICICI Prudential All Seasons Bond Fund Retail - Cumulative,14.9955
2006-08-21,101351,ICICI Prudential All Seasons Bond Fund - Weekly IDCW,10.4855
2006-08-21,101352,Templeton Floating Rate Income Fund-Short Term Plan-Dividend Option,10.0102
2006-08-21,101353,Templeton Floating Rate Income Fund-Short Term Plan-Growth Option,12.8962
2006-08-21,101354,Templeton Floating Rate Income Fund-Short Term Plan-Institutional Option - Growth,10.5604
2006-08-21,101355,Templeton Floating Rate Income Fund-Short Term Plan-Institutional Option - Dividend,10.0102
2006-08-21,101356,Franklin India Money Market Fund Retail Option - Quarterly - IDCW,10.4269
2006-08-21,101357,Franklin India Money Market Fund - Growth Option,12.897
2006-08-21,101358,Franklin India Money Market Fund - Institutional Option - Growth,10.5329
2006-08-21,101359,Franklin India Money Market Fund - Institutional Option - Dividend,10.3038
2006-08-21,101361,Canara Robeco Liquid Fund- INSTITUTIONAL-Weekly dividend,10.048
2006-08-21,101362,Canara Robeco Liquid Fund- INSTITUTIONAL-Growth,13.084
2006-08-21,101363,Canara Robeco Liquid Fund- INSTITUTIONAL-Daily Dividend Reinvestment,10.041
2006-08-21,101364,Canara Robeco Liquid Fund-Retail-DRI,10.041
2006-08-21,101365,Canara Robeco Liquid Fund-Retail-Growth,13.0717
2006-08-21,101372,Kotak Bond Short Term Plan-(Payout of Income Distribution cum capital withdrawal option),10.0668
2006-08-21,101373,Kotak Bond Short Term Plan-(Growth),12.936
2006-08-21,101393,Sahara Liquid Fund-Fixed Pricing - Daily Dividend Option,1024.4534
2006-08-21,101394,Sahara Liquid Fund-Fixed Pricing - Growth option,1285.135
2006-08-21,101397,Sahara Liquid Fund-Fixed Pricing -  Weekly Dividend Option,1024.6207
2006-08-21,101398,Sahara Liquid Fund-Fixed Pricing - Monthly Dividend Option,1026.6776
2006-08-21,101399,Sahara Liquid Fund-Variable Pricing - Daily Dividend option,1024.4658
2006-08-21,101400,Sahara Liquid Fund-Variable Pricing - Weekly Dividend Option,1025.1109
2006-08-21,101401,Sahara Liquid Fund-Variable Pricing- Monthly Dividend Option,1028.7049
2006-08-21,101402,Sahara Liquid Fund-Variable Pricing - Growth option,1287.6718
2006-08-21,101403,Sahara Income Fund-Dividend,11.1875
2006-08-21,101404,Sahara Income Fund-Growth,12.4296
2006-08-21,101405,ING Gilt Fund-Growth Option,11.9008
2006-08-21,101406,ING Gilt Fund-Dividend Option,11.9008
2006-08-21,101407,Baroda BNP Paribas LIQUID FUND-Defunct Plan- IDCW Option,11.0253
2006-08-21,101408,Baroda BNP Paribas LIQUID FUND- Defunct Plan -Growth Option,12.8558
2006-08-21,101409,Baroda BNP Paribas LIQUID FUND-Defunct Plan-Daily IDCW Option,10.0333
2006-08-21,101419,Tata Long Term Debt Fund - Regular Plan  -Bonus,12.1418
2006-08-21,101420,JM Floater Short Term Fund - Daily Dividend Option,10.0883
2006-08-21,101421,JM Floater Short Term Fund - Growth Option,11.8251
2006-08-21,101430,HDFC Regular Savings Fund-GROWTH,12.9021
2006-08-21,101431,HDFC Regular Savings Fund-Monthly Dividend Option,10.3365
2006-08-21,101455,Grindlays Government Securities Fund - IP (Growth),13.2242
2006-08-21,101456,Grindlays Government Securities Fund - ST (Growth),12.2353
2006-08-21,101458,Grindlays Government Securities Fund-IP(H.Yrly Dividend),10.2953
2006-08-21,101462,Principal Short Term Plan-Dividend,10.1556
2006-08-21,101463,Principal Short Term Plan-Growth,12.9649
2006-08-21,101465,Principal Short Term Debt Fund- Growth Plan,12.0317
2006-08-21,101466,Principal Short Term Debt Fund - Income Distribution CUM Capital Withdrawal Option - Monthly,10.1924
2006-08-21,101467,Principal Income Fund - Short Term Plan-Institutional - Weekly Dividend Plan,10.937
2006-08-21,101471,Tata Gilt Retirement Plan (28/2/2008) Growth,10.1025
2006-08-21,101472,Sundaram Equity Hybrid Fund Regular Plan - Income Distribution cum Capital Withdrawal (IDCW),14.0278
2006-08-21,101481,HDFC Floating Rate Debt Fund - Retail Growth Option,12.0528
2006-08-21,101482,HDFC Floating Rate Debt Fund - Retail Weekly Div Option,10.1482
2006-08-21,101483,HDFC Floating Rate Debt Fund - Retail Daily Div Option,10.0809
2006-08-21,101484,HDFC Floating Rate Debt Fund - Retail Monthly Div option,10.1829
2006-08-21,101489,Tata Young Citizen Fund [Upto 3 years] Regular Plan,19.9012
2006-08-21,101490,Tata Young Citizen Fund [>3 years upto 7 years] Regular Plan,19.9012
2006-08-21,101491,Tata Childrens Fund -Regular Plan-Growth Option,19.9012
2006-08-21,101498,Principal Equity Savings Fund - Growth Option,14.533
2006-08-21,101499,Principal Equity Savings Fund - Half Yearly Income Distribution CUM Capital Withdrawal,10.5153
2006-08-21,101500,Principal Equity Savings Fund -Quaterly Income Distribution CUM Capital Withdrawal,10.5937
2006-08-21,101516,Grindlays Dynamic Bond Fund - GDBF (Quarterly Dividend),10.2336
2006-08-21,101519,JM Short Term Fund - Regular Plan - Dividend Option,10.9242
2006-08-21,101520,JM Short Term Fund - Regular Plan - Growth Option,12.8152
2006-08-21,101521,JM Short Term Fund - Growth Option,12.0908
2006-08-21,101524,JM Short Term Fund - Dividend Option,10.3001
2006-08-21,101525,HDFC Nifty 50 Index Fund - Growth Plan,33.0939
2006-08-21,101528,Sahara Growth Fund-Growth,41.8387
2006-08-21,101529,Sahara Growth Fund-Dividend,21.1673
2006-08-21,101530,SBI Large & Midcap Fund - Regular Plan - Income Distribution cum Capital Withdrawal Option (IDCW),40.73
2006-08-21,101536,Sundaram Select Focus Regular Plan - Income Distribution cum Capital Withdrawal (IDCW),13.8511
2006-08-21,101537,Sundaram Select Focus Regular Plan - Growth,50.0297
2006-08-21,101538,Sundaram Mid Cap Fund Regular Plan - Income Distribution cum Capital Withdrawal (IDCW),19.0966
2006-08-21,101539,Sundaram Mid Cap Fund Regular Plan - Growth,78.0794
2006-08-21,101544,Sundaram Short Term Credit Risk Fund -Dividend,10.2592
2006-08-21,101545,Sundaram Short Term Credit Risk Fund-Appreciation,12.4567
2006-08-21,101547,Tata Short Term Bond Fund- Regular Plan - Monthly Payout of IDCW Option,10.9614
2006-08-21,101548,Tata Short Term Bond Fund -Regular Plan- Growth Option,12.7264
2006-08-21,101549,JM Liquid Fund (Regular) - Bonus Option - Principal Units,12.3048
2006-08-21,101550,ING Short Term Income Fund -Dividend Option,11.1732
2006-08-21,101551,SBI Equity Hybrid Fund - Regular Plan - Income Distribution cum Capital Withdrawal Option (IDCW),22.28
2006-08-21,101560,Sundaram Short Term Debt Fund Regular Plan -Income Distribution cum Capital Withdrawal ( IDCW ),10.1623
2006-08-21,101561,Sundaram Short Term Debt Fund Regular Plan- Income Distribution cum Capital Withdrawal (IDCW ),10.1619
2006-08-21,101562,Sundaram Short Term Debt Fund Regular Plan- Income Distribution cum Capital Withdrawal (IDCW),10.166
2006-08-21,101563,Sundaram Short Term Debt Fund Regular Plan - Growth,12.5133
2006-08-21,101564,Sundaram Short Term Debt Fund Regular Plan - Weekly Income Distribution cum Capital Withdrawal (IDCW),10.9732
