date,scheme_code,scheme_name,nav
2007-08-01,100027,Grindlays Super Saver Income Fund-GSSIF-Half Yearly Dividend,10.6593
2007-08-01,100028,Grindlays Super Saver Income Fund-GSSIF-Quaterly Dividend,10.5701
2007-08-01,100029,Grindlays Super Saver Income Fund-GSSIF-Growth,17.6749
2007-08-01,100030,Grindlays Super Saver Income Fund-GSSIF-Annual Dividend,10.6879
2007-08-01,100031,Grindlays Super Saver Income Fund-GSSIF - ST-Dividend,10.0465
2007-08-01,100032,Grindlays Super Saver Income Fund-GSSIF - ST-Growth,15.5133
2007-08-01,100033,Aditya Birla Sun Life Large & Mid Cap Fund - Regular Growth,135.23
2007-08-01,100034,Aditya Birla Sun Life Large & Mid Cap Fund -Regular - IDCW,97.01
2007-08-01,100035,Birla Sun Life Freedom Fund-Plan A (Dividend),20.41
2007-08-01,100036,Birla Sun Life Freedom Fund-Plan B (Growth),30.7
2007-08-01,100037,Aditya Birla Sun Life Income Fund - Regular - Quarterly IDCW,10.5211
2007-08-01,100038,Aditya Birla Sun Life Income Fund - Growth - Regular Plan,32.2734
2007-08-01,100041,Aditya Birla Sun Life Liquid Fund -Institutional - IDCW,10.8023
2007-08-01,100042,Aditya Birla Sun Life Liquid Fund-Retail (Growth),20.6625
2007-08-01,100043,Aditya Birla Sun Life Liquid Fund-Institutional (Growth),20.8159
2007-08-01,100044,Aditya Birla Sun Life Liquid Fund -Retail - IDCW,16.3694
2007-08-01,100046,Aditya Birla Sun Life Liquid Fund -Daily IDCW,10.0195
2007-08-01,100047,Aditya Birla Sun Life Liquid Fund - Growth,12.2367
2007-08-01,100048,Aditya Birla Sun Life Liquid Fund -Institutional - weekly  IDCW,10.8152
2007-08-01,100049,Aditya Birla Sun Life Cash Plus-Institutional - Fortnightly Dividend,10.8295
2007-08-01,100051,Aditya Birla Sun Life Liquid Fund -weekly IDCW,10.0303
2007-08-01,100052,Aditya Birla Sun Life Cash Plus-Institutional Premium - Fortnightly Dividend,10.0664
2007-08-01,100053,Aditya Birla Sun Life Cash Plus-Institutional Premium Plan-Monthly Dividend,10.0015
2007-08-01,100054,Aditya Birla Sun Life Gilt Plus - Liquid Plan - Quarterly Dividend - Regular Plan,10.6551
2007-08-01,100055,Aditya Birla Sun Life Gilt Plus - Liquid Plan - Growth - Regular Plan,18.5998
2007-08-01,100056,Aditya Birla Sun Life Gilt Plus - Liquid Plan - Annual Dividend - Regular Plan,11.5172
2007-08-01,100057,Aditya Birla Sun Life Govenment Securities Fund -Regular - Quarterly IDCW,10.5114
2007-08-01,100058,Aditya Birla Sun Life Government Securities Fund  - Growth - Regular Plan,21.2157
2007-08-01,100059,Aditya Birla Sun Life Gilt Plus-PF Plan (Annual Dividend),19.703
2007-08-01,100060,Aditya Birla Sun Life Constant Maturity 10 Year Gilt Fund - Quarterly Dividend - Regular Plan,11.2389
2007-08-01,100061,Aditya Birla Sun Life Constant Maturity 10 Year Gilt Fund - Growth - Regular Plan,24.3287
2007-08-01,100062,Aditya Birla Sun Life Gilt Plus-Regular Plan (Annual Dividend),22.6747
2007-08-01,100063,Aditya Birla Sun Life MNC Fund - Regular - IDCW,63.12
2007-08-01,100064,Aditya Birla Sun Life MNC Fund - Growth - Regular Plan,125.93
2007-08-01,100065,Aditya Birla Sun Life India Opportunities Fund - Dividend - Regular Plan,22.44
2007-08-01,100066,Aditya Birla Sun Life India Opportunities Fund - Growth - Regular Plan,52.26
2007-08-01,100067,Aditya Birla Sun Life Tax Plan -Regular - IDCW,66.47
2007-08-01,100068,BARODA ELSS 96 - Plan A - IDCW,21.7
2007-08-01,100069,BARODA PIONEER DIVERSIFIED FUND,35.33
2007-08-01,100077,DSP Bond Fund - IDCW,10.8236
2007-08-01,100078,DSP Bond Fund - Growth,25.471
2007-08-01,100079,DSP Bond Fund - IDCW - Monthly,10.4222
2007-08-01,100080,DSP Flexi Cap Fund - Regular Plan - IDCW,44.744
2007-08-01,100081,DSP Aggressive Hybrid Fund- Regular Plan - Growth,42.65
2007-08-01,100082,DSP Aggressive Hybrid Fund- Regular Plan - IDCW,24.744
2007-08-01,100084,DSP Gilt Fund - Regular Plan - Growth,23.7466
2007-08-01,100085,DSP Gilt Fund - Regular Plan - IDCW,11.7838
2007-08-01,100086,DSP Gilt Fund - Regular Plan - IDCW - Monthly,10.0602
2007-08-01,100087,DSP Savings Fund - Regular Plan - Growth,17.2739
2007-08-01,100088,DSP Savings Fund - Regular Plan - IDCW,11.1915
2007-08-01,100089,DSP Savings Fund - Regular Plan - IDCW - Monthly,10.0649
2007-08-01,100090,DSP BlackRock Technology.com   Fund - Regular Plan - Growth,27.998
2007-08-01,100119,HDFC Balanced Advantage Fund - Growth Plan,56.699
2007-08-01,100120,HDFC Balanced Advantage Fund - IDCW Plan,30.781
2007-08-01,100121,HDFC Balanced Fund - Dividend Option,18.6
2007-08-01,100122,HDFC Balanced Fund - Growth Option,32.919
2007-08-01,100123,HDFC Income Fund - Quarterly IDCW Option,10.4078
2007-08-01,100124,HDFC Income Fund - Growth Option,17.217
2007-08-01,100150,Principal Child Benefit Fund-Super Saver-Future Guard Plan,64.75
2007-08-01,100151,Principal Retail Equity Savings Fund - Growth Option,65.61
2007-08-01,100152,Principal Nifty 100 Equal Weight Fund-Income Distribution CUM Capital Withdrawal,24.0179
2007-08-01,100153,Principal Nifty 100 Equal Weight Fund-Growth,30.9277
2007-08-01,100156,Principal Tax Savings Fund,91.1
2007-08-01,100171,Quant Dynamic Bond-Dividend,10.3168
2007-08-01,100172,Quant Dynamic Bond-Growth,23.5505
2007-08-01,100173,Quant Dynamic Bond-Bonus,12.4039
2007-08-01,100174,quant ELSS Tax Saver Fund - IDCW Option - Regular Plan,14.3771
2007-08-01,100175,quant ELSS Tax Saver Fund - Growth Option - Regular Plan,49.4554
2007-08-01,100176,quant Small Cap Fund - IDCW Option - Regular Plan,18.0262
2007-08-01,100177,quant Small Cap Fund - Growth - Regular Plan,21.355
2007-08-01,100178,ING Income Fund-Regular Plan -Dividend Option (Quarterly),10.351
2007-08-01,100179,ING Income Fund-Regular Plan -Dividend Option (Half Yearly),10.5602
2007-08-01,100180,ING Income Fund- Regular Plan - Dividend Option (Annual),10.7071
2007-08-01,100181,ING Income Fund-Regular Plan -Growth Option,18.8175
2007-08-01,100182,ING Income Fund-Institutional Plan - Dividend Option (Half Yearly),10.0
2007-08-01,100183,ING Income Fund-Institutional Plan - Dividend Option (Quarterly),10.0
2007-08-01,100184,ING Income Fund-Institutional Plan -Dividend Option (Annual),10.6875
2007-08-01,100185,ING Income Fund-Bonus Option,11.4735
2007-08-01,100186,ING Income Fund-Institutional Bonus Option,11.782
2007-08-01,100187,ING Income Fund-Institutional Plan - Growth Option,19.6817
2007-08-01,100188,ING Core Equity Fund-Dividend Option,15.88
2007-08-01,100189,ING Core Equity Fund-Growth Option,30.07
2007-08-01,100190,ING Liquid Fund-Regular Growth Option,16.2525
2007-08-01,100191,ING Liquid Fund-Regular Weekly Dividend Option,10.8279
2007-08-01,100192,ING Liquid Fund-Regular Daily Dividend Option,10.7873
2007-08-01,100194,ING Liquid Fund-Auto Sweep Growth Option,10.0
2007-08-01,100195,ING Liquid Fund-Auto Sweep Weekly Dividend Option,10.0
2007-08-01,100196,ING Liquid Fund-Institutional Growth Option,12.0735
2007-08-01,100197,ING Liquid Fund-Institutional Weekly Dividend Option,10.0574
2007-08-01,100198,ING Liquid Fund-Institutional Daily Dividend Option,10.0121
2007-08-01,100199,ING Liquid Fund-Super Institutional Growth Option,11.4353
2007-08-01,100200,ING Liquid Fund-Super Institutional Daily Dividend Option,10.0048
2007-08-01,100201,ING Liquid Fund-Super Institutional Weekly Dividend Option,10.0082
2007-08-01,100202,ING Balanced Fund-Dividend Option,13.83
2007-08-01,100203,ING Balanced Fund-Growth Option,19.77
2007-08-01,100218,JM Large Cap Fund (Regular) - IDCW,18.6258
2007-08-01,100219,JM Large Cap Fund (Regular) - Growth Option,41.4502
2007-08-01,100220,JM Aggressive Hybrid Fund (Regular) - IDCW,20.0368
2007-08-01,100221,JM Aggressive Hybrid Fund (Regular) -Growth Option,26.3687
2007-08-01,100222,JM Medium to Long Duration Fund (Regular) - Quarterly IDCW,10.2973
2007-08-01,100223,JM Medium to Long Duration Fund (Regular) - Growth Option,29.1055
2007-08-01,100233,JM Liquid Fund (Regular) - Weekly IDCW,10.4372
2007-08-01,100234,JM Liquid Fund - Growth Option,21.048
2007-08-01,100237,JM High Liquidity Fund-- Institutional Plan - Growth,12.6983
2007-08-01,100238,JM High Liquidity Fund-Institutional Plan - Daily Dividend,10.0159
2007-08-01,100241,JM High Liquidity Fund-- Institutional Plan - Dividend,10.2011
2007-08-01,100243,JM High Liquidity Fund-- Premium Plan - Daily Dividend Option,10.0
2007-08-01,100244,JM Liquid Fund (Regular) - Quarterly IDCW,12.1178
2007-08-01,100245,JM High Liquidity Fund-Super Institutional Plan- Daily Dividend,10.0165
2007-08-01,100246,JM High Liquidity Fund-Super Institutional Plan- Weekly  Dividend,10.008
2007-08-01,100247,JM Liquid Fund (Regular) - Super Institutional Plan - Growth Option,12.0748
2007-08-01,100249,JM G-Sec Fund - Quarterly Dividend Option,10.269
2007-08-01,100250,JM G-Sec Fund - Growth Option,21.4819
2007-08-01,100251,JM G-Sec Fund-PF Plan - Growth Plan,22.2823
2007-08-01,100252,JM G-Sec Fund-PF Plan -Dividend Plan,20.4173
2007-08-01,100253,JM G-Sec Fund - Bonus Option - Principal Units,10.4497
2007-08-01,100254,JM Value Fund (Regular) - Growth Option,25.9083
2007-08-01,100261,Kotak Gilt-Savings-Monthly Dividend,10.4715
2007-08-01,100262,Kotak Gilt-Savings-Growth,18.5862
2007-08-01,100263,Kotak Gilt-Savings-Annual Dividend,12.429
2007-08-01,100264,Kotak Gilt-Investment Regular-Payout of Income Distribution cum capital withdrawal option,11.576
2007-08-01,100265,Kotak Gilt-Investment Regular-Growth,24.0658
2007-08-01,100280,Kotak Gilt-Investment  Provident Fund and Trust-Payout of Income Distribution cum capital withdrawal option,11.0221
2007-08-01,100281,Kotak Gilt-Investment  Provident Fund and Trust-Growth,24.4163
2007-08-01,100286,Kotak Aggressive Hybrid Fund - Regular Plan - IDCW - Payout & Reinvestment of Income Distribution cum capital withdrawal option,25.743
2007-08-01,100289,Kotak Tech,9.875
2007-08-01,100290,Kotak MNC,29.552
2007-08-01,100291,Kotak Bond-Deposit-Dividend,12.1069
2007-08-01,100292,Kotak Bond-Deposit-Growth,19.1562
2007-08-01,100298,Kotak Bond Regular Plan Quaterly Payout of Income Distribution cum capital withdrawal option,10.5474
2007-08-01,100299,Kotak Bond Fund - Regular Plan Growth,20.274
2007-08-01,100300,Kotak Bond Fund - Regular Plan - Standard IDCW Option,13.5494
2007-08-01,100301,Kotak Bond Regular Plan Bonus Plan,13.5136
2007-08-01,100312,LIC MF Flexi Cap Fund-Regular Plan-IDCW,12.1335
2007-08-01,100313,LIC MF Flexi Cap Fund-Regular Plan-Growth,21.9315
2007-08-01,100314,LIC MF Medium to Long Duration Fund-Regular Plan-IDCW,10.3523
2007-08-01,100315,LIC MF Medium to Long Duration Fund-Regular Plan-Growth,20.9606
2007-08-01,100316,LIC MF Gilt Fund-Regular Plan-IDCW,11.3005
2007-08-01,100317,LIC MF Gilt Fund-Regular Plan-Growth,19.4438
2007-08-01,100318,LIC MF Gilt Fund-PF Plan-IDCW,11.2121
2007-08-01,100319,LIC MF Gilt Fund-PF Plan-Growth,11.2121
2007-08-01,100321,LIC MF Aggressive Hybrid Fund-Regular Plan-IDCW,10.9752
2007-08-01,100323,LIC MF Aggressive Hybrid Fund-Regular Plan-Growth,46.3665
2007-08-01,100325,LIC MF ULIS (5 Yrs. Single Premium)-Regular Plan-IDCW Reinvestment,11.8921
2007-08-01,100332,LIC MF Large Cap Fund-Regular Plan-IDCW,11.0099
2007-08-01,100337,SaharaTax Gain-Dividend,20.0425
2007-08-01,100338,SaharaTax Gain-Growth,22.9725
2007-08-01,100347,Morgan Stanley Growth Fund- Regular Growth Plan,54.73
2007-08-01,100348,ICICI Prudential Large & Mid Cap Fund - IDCW,22.66
2007-08-01,100349,ICICI Prudential Large & Mid Cap Fund - Growth,101.07
2007-08-01,100350,ICICI Prudential Large & Mid Cap Fund - Institutional Option - I - Growth,13.49
2007-08-01,100351,ICICI Prudential FMCG Fund - IDCW,32.29
2007-08-01,100352,ICICI Prudential FMCG Fund - Growth,43.04
2007-08-01,100353,ICICI Prudential ELSS Tax Saver Fund - IDCW,22.11
2007-08-01,100354,ICICI Prudential ELSS Tax Saver Fund - Growth,92.1
2007-08-01,100355,ICICI Prudential Equity & Debt Fund - Monthly IDCW,17.66
2007-08-01,100356,ICICI Prudential Equity & Debt Fund - Growth,36.0
2007-08-01,100357,ICICI Prudential Liquid Fund -Quarterly IDCW,10.8182
2007-08-01,100359,ICICI Prudential Liquid Institutional Plus Fund - Div - Daily,11.8515
2007-08-01,100360,ICICI Prudential Liquid Institutional Plus Fund - Div - Weekly,11.8573
2007-08-01,100361,ICICI Prudential Liquid Fund-Dividend-Institutional Plus - Monthly,11.9257
2007-08-01,100362,ICICI Prudential Liquid Institutional Plus Fund - Growth,19.1289
2007-08-01,100363,ICICI Prudential Technology Fund - Growth,15.61
2007-08-01,100364,ICICI Prudential Long Term Bond Fund - Half Yearly IDCW,10.7775
2007-08-01,100365,ICICI Prudential Long Term Bond Fund - Growth,22.4602
2007-08-01,100366,ICICI Prudential Long Term Bond Fund-Institutional Quarterly Dividend,10.4539
2007-08-01,100367,ICICI Prudential Long Term Bond Fund - Quarterly IDCW,11.2767
2007-08-01,100368,ICICI Prudential Gilt Fund - IDCW,10.8896
2007-08-01,100369,ICICI Prudential Gilt Fund - Growth,23.2369
2007-08-01,100370,ICICI Prudential Short Term Gilt Fund - Dividend,10.6378
2007-08-01,100371,ICICI Prudential Short Term Gilt Fund - Growth,18.5154
2007-08-01,100372,ICICI Prudential Short Term Gilt Fund - Half Yearly Dividend,10.2683
2007-08-01,100375,NIPPON INDIA GROWTH MID CAP FUND - IDCW Option,57.46
2007-08-01,100376,Nippon India Growth Mid Cap Fund-Growth Plan-Bonus Option,51.66
2007-08-01,100377,Nippon India Growth Mid Cap Fund-Growth Plan-Growth Option,311.59
2007-08-01,100378,Nippon India Vision Large & Midcap Fund - IDCW Option,53.88
2007-08-01,100379,Nippon India Vision Large & Midcap Fund-GROWTH PLAN-Bonus Option,35.38
2007-08-01,100380,Nippon India Vision Large & Midcap Fund-GROWTH PLAN-Growth Option,211.09
2007-08-01,100383,NIPPON INDIA MEDIUM TO LONG DURATION FUND - MONTHLY IDCW Option,10.976
2007-08-01,100384,NIPPON INDIA MEDIUM TO LONG DURATION  FUND - QUARTERLY IDCW Option,12.3354
2007-08-01,100385,NIPPON INDIA MEDIUM TO LONG DURATION  FUND - HALF YEARLY IDCW Option,11.5686
2007-08-01,100386,NIPPON INDIA MEDIUM TO LONG DURATION  FUND - ANNUAL IDCW Option,12.5415
2007-08-01,100387,Nippon India Medium to Long Duration  Fund - Growth Plan Growth Option,24.0528
2007-08-01,100388,Nippon India Medium to Long Duration  Fund - Growth Plan Bonus Option,11.3368
2007-08-01,100414,Tata Aggressive Hybrid Fund- Regular Plan - Growth Option,55.9541
2007-08-01,100415,Tata Ethical Fund-Regular Plan - Growth Option,54.9605
2007-08-01,100416,Tata Long Term Debt Fund - Regular Plan - Quarterly Dividend,10.5416
2007-08-01,100417,Tata Income Fund-Regular Plan - Half Yearly Payout of IDCW Option,11.1791
2007-08-01,100418,Tata Income Fund -Regular Plan - Growth Option,25.9837
2007-08-01,100470,Franklin India Large Cap Fund - IDCW,41.9189
2007-08-01,100471,Franklin India Large Cap Fund-Growth,145.4364
2007-08-01,100472,Franklin India Mid Cap Fund - IDCW,56.7564
2007-08-01,100473,Franklin India Mid Cap Fund-Growth,224.461
2007-08-01,100474,Tata ELSS Fund- Regular Plan - Payout of IDCW Option,47.2536
2007-08-01,100475,Tata Large Cap Fund -Regular Plan - Growth Option,69.3184
2007-08-01,100476,Taurus Flexi Cap Fund - Regular Plan - Growth,47.41
2007-08-01,100477,Taurus Mid Cap Fund - Regular Plan - Growth,17.58
2007-08-01,100480,Taurus ELSS Tax Saver Fund - Regular Plan - Growth,19.82
2007-08-01,100481,Franklin India Balanced Fund-Growth,39.6119
2007-08-01,100482,Franklin India Balanced Fund-Div,34.2368
2007-08-01,100483,Franklin India Growth Fund,33.7421
2007-08-01,100484,Franklin India Index Fund- NSE Nifty 50 Index Fund - Growth,34.6482
2007-08-01,100485,Franklin India Govt.Sec. Fund-Composite Plan - Growth,24.6877
2007-08-01,100486,Franklin India Govt.Sec. Fund-Composite Plan - Dividend,10.6881
2007-08-01,100487,Franklin India Govt.Sec. Fund-Treasury Plan(Dividend Option),10.6609
2007-08-01,100489,Franklin India Govt.Sec. Fund-Treasury Plan(Growth Option),14.2818
2007-08-01,100490,Franklin India Govt.Sec. Fund-PF Plan - Growth,10.8437
2007-08-01,100491,Franklin India Govt.Sec. Fund-PF Plan - Dividend,10.8437
2007-08-01,100493,Franklin India Government Securities Fund - Growth,16.8311
2007-08-01,100494,Franklin India Government Securities Fund - IDCW,10.5855
2007-08-01,100495,Franklin India Govt.Sec. Fund-Long Term Plan - Bonus,11.67
2007-08-01,100496,Templeton India Value Fund - Growth Plan,74.1796
2007-08-01,100497,Templeton India Value Fund - IDCW,43.8586
2007-08-01,100498,Franklin India Dynamic Accrual Fund - IDCW,10.7197
2007-08-01,100499,Franklin India Dynamic Accrual Fund-Growth,26.9833
2007-08-01,100503,Franklin India Low Duration Fund - Monthly - IDCW,10.4123
2007-08-01,100504,Franklin India Low Duration Fund - Quarterly - IDCW,10.4208
2007-08-01,100505,Templeton Monthly Income Plan-Half Yearly Dividend,12.7417
2007-08-01,100506,Templeton Monthly Income Plan-Growth,20.9716
2007-08-01,100519,Franklin India Flexi Cap Fund - IDCW,35.1735
2007-08-01,100520,Franklin India Flexi Cap Fund - Growth,156.8951
2007-08-01,100521,Franklin India Technology Fund - IDCW,22.4071
2007-08-01,100522,Franklin India Technology Fund-Growth,48.1583
2007-08-01,100523,Franklin FMCG Fund - Growth,35.7054
2007-08-01,100524,Franklin INDIA OPPORTUNITIES FUND - IDCW,16.7939
2007-08-01,100525,Franklin India ELSS Tax Saver Fund - IDCW,35.8036
2007-08-01,100526,Franklin India ELSS Tax Saver Fund-Growth,141.3828
2007-08-01,100527,Franklin India Corporate Debt Fund - Plan A - Annual - IDCW,10.6578
2007-08-01,100528,Franklin India Corporate Debt Fund - Growth,25.73
2007-08-01,100529,Franklin India Corporate Debt Fund - Plan B - Monthly - IDCW,13.1841
2007-08-01,100530,Franklin India Corporate Debt Fund - Plan B - Quarterly - IDCW,13.5104
2007-08-01,100531,Franklin India Corporate Debt Fund - Plan B - Half yearly - IDCW,13.7218
2007-08-01,100532,Franklin India Corporate Debt Fund - Monthly Bonus,18.6686
2007-08-01,100535,Franklin India Retirement Fund - IDCW,18.1018
2007-08-01,100536,Franklin India Retirement Fund - Growth,47.0967
2007-08-01,100537,Franklin India Liquid Fund - Regular Plan - Weekly - IDCW,1245.0267
2007-08-01,100538,Franklin India Liquid Fund - Regular Plan - Growth,1909.8419
2007-08-01,100541,Franklin India Liquid Fund - Regular Plan - Daily - IDCW,1512.34
2007-08-01,100542,Franklin India Liquid Fund - Liquid Plan - Weekly Dividend,1001.119
2007-08-01,100543,Franklin India Liquid Fund - Liquid Plan - Daily IDCW,1000.25
2007-08-01,100544,Franklin India Liquid Fund - Liquid Plan - Growth,1173.647
2007-08-01,100546,Franklin India Liquid Fund - Super Institutional Plan - Growth,1137.8613
2007-08-01,100547,Franklin India Liquid Fund - Super Institutional Plan - Daily - IDCW,1000.25
2007-08-01,100548,Franklin India Liquid Fund - Super Institutional Plan - Weekly - IDCW,1016.7525
2007-08-01,100549,Franklin India Aggressive Hybrid Fund - IDCW,22.9446
2007-08-01,100550,Franklin India Aggressive Hybrid Fund - Growth Plan,36.6789
2007-08-01,100551,Templeton India Children’s Asset Plan-Education Plan,26.4879
2007-08-01,100552,Templeton India Children’s Asset Plan-Gift Plan - Growth,33.7259
2007-08-01,100553,Templeton India Children’s Asset Plan-Gift Plan - Dividend,33.7259
2007-08-01,100557,Franklin India Taxshield 98,135.2958
2007-08-01,100558,Franklin India Taxshield 99,74.4681
2007-08-01,100561,Templeton India Money Market Account - Bonus Plan,1.0
2007-08-01,100563,DBS Chola Triple Ace-Regular -Cumulative,24.0389
2007-08-01,100567,DBS Chola Triple Ace-Regular - Quarterly Dividend,11.3185
2007-08-01,100569,DBS Chola Triple Ace-Semi Annual Dividend,11.6327
2007-08-01,100573,DBS Chola Triple Ace-Regular Bonus,13.357
2007-08-01,100574,DBS Chola Freedom Income -Short Term Fund-Regular-Monthly Dividend,11.0578
2007-08-01,100575,DBS Chola Freedom Income -Short Term Fund-Regular - Cumulative,12.1719
2007-08-01,100576,DBS Chola Freedom Income -Short Term Fund-Cum- Institutional Plan,12.316
2007-08-01,100579,DBS Chola Gilt-Investment-Quarterly Dividend,10.4858
2007-08-01,100580,DBS Chola Gilt-Investment-Cumulative,19.0645
2007-08-01,100589,Canara Robeco Expo-Income Plan,15.7
2007-08-01,100590,Canara Robeco Expo-Growth Plan,54.34
2007-08-01,100593,CANARA ROBECO ELSS TAX SAVER - REGULAR PLAN -IDCW (Payout),18.08
2007-08-01,100596,CANARA ROBECO GILT FUND - REGULAR PLAN - IDCW (Payout/Reinvestment),10.9021
2007-08-01,100597,CANARA ROBECO GILT FUND - REGULAR PLAN - GROWTH OPTION,19.1021
2007-08-01,100600,CANARA ROBECO CONSERVATIVE HYBRID FUND - REGULAR PLAN - MONTHLY IDCW (Payout/Reinvestment),12.09
2007-08-01,100601,CANARA ROBECO CONSERVATIVE HYBRID FUND - REGULAR PLAN - GROWTH OPTION,21.21
2007-08-01,100602,Sundaram Medium Duration Fund (Formerly Known as Sundaram Medium Term Bond Fund) Regular Plan-Income Distribution cum Capital Withdrawal(IDCW),10.266
2007-08-01,100603,Sundaram Medium Duration Fund (Formerly Known as Sundaram Medium Term Bond Fund) Regular Plan - Growth,23.3292
2007-08-01,100604,Sundaram Medium Duration Fund (Formerly Known as Sundaram Medium Term Bond Fund) Regular Plan -Growth,12.2809
2007-08-01,100609,Sundaram Medium Duration Fund (Formerly Known as Sundaram Medium Term Bond Fund) Regular Plan- Income Distribution cum Capital Withdrawal(IDCW),10.3688
2007-08-01,100610,Sundaram Medium Duration Fund (Formerly Known as Sundaram Medium Term Bond Fund) Regular Plan -Income Distribution cum Capital Withdrawal (IDCW),10.2208
2007-08-01,100611,Sundaram Medium Duration Fund (Formerly Known as Sundaram Medium Term Bond Fund) Institutional Plan -Growth,11.9777
2007-08-01,100612,Sundaram Growth Fund-Dividend,15.9488
2007-08-01,100613,Sundaram Growth Fund-Growth,72.9062
2007-08-01,100614,Sundaram Value Fund Regular Plan - Income Distribution cum Capital Withdrawal (IDCW),13.9753
2007-08-01,100617,Sundaram Equity Hybrid Fund Regular Plan - Growth,35.3521
2007-08-01,100618,Sundaram Money Fund Retail Plan - Growth,16.0692
2007-08-01,100619,Sundaram Money Fund Retail Plan - Quarterly Reinvestment of Income Distribution cum Capital Withdrawal (IDCW),10.2996
2007-08-01,100620,Sundaram Money Fund Retail Plan - Daily Reinvestment of Income Distribution cum Capital Withdrawal (IDCW),10.0953
2007-08-01,100621,Sundaram Money Fund Retail Plan - Weekly Reinvestment of Income Distribution cum Capital Withdrawal (IDCW),10.4148
2007-08-01,100622,Sundaram Money Fund Retail Plan - Fortnightly Reinvestment of Income Distribution cum Capital Withdrawal (IDCW),10.2559
2007-08-01,100623,Sundaram Money Fund Retail Plan - Monthly Income Distribution cum Capital Withdrawal (IDCW),10.147
2007-08-01,100630,quant Multi Cap Fund-IDCW Option - Regular Plan,14.6515
2007-08-01,100631,quant Multi Cap Fund-GROWTH OPTION - Regular Plan,62.4722
2007-08-01,100638,SBI Medium to Long Duration Fund - Regular Plan - Half Yearly - Income Distribution cum Capital Withdrawal Option (IDCW),10.3224
2007-08-01,100639,SBI Medium to Long Duration Fund-REGULAR PLAN-Growth,20.28
2007-08-01,100640,SBI Medium to Long Duration Fund-REGULAR PLAN-Bonus,12.2842
2007-08-01,100641,SBI ULTRA SHORT DURATION FUND - REGULAR PLAN - GROWTH,17.2255
2007-08-01,100643,SBI Technology Opportunities Fund - Regular Plan - Income Distribution cum Capital Withdrawal Option (IDCW),23.28
2007-08-01,100644,SBI Healthcare Opportunities Fund - Regular Plan - Income Distribution cum Capital Withdrawal Option (IDCW),28.87
2007-08-01,100645,SBI Consumption Opportunities Fund - Regular Plan - Income Distribution cum Capital Withdrawal Option (IDCW),14.02
2007-08-01,100646,UTI - Unit Linked Insurance Plan,15.2074
2007-08-01,100648,UTI - CRTS 81 - Dividend Option,111.7697
2007-08-01,100650,UTI Large Cap Fund - Regular Plan - IDCW,31.28
2007-08-01,100651,UTI Large Cap Fund - Regular Plan - Growth Option,38.83
2007-08-01,100656,UTI - Master Plus Unit Scheme-Growth Option,71.56
2007-08-01,100657,UTI - Master Plus Unit Scheme-Income Option,54.91
2007-08-01,100663,UTI Large & Mid Cap Fund - Regular Plan - IDCW,41.36
2007-08-01,100664,UTI Large & Mid Cap Fund - Regular Plan - Growth Option,47.87
2007-08-01,100668,UTI Flexi Cap Fund - Regular Plan - IDCW,32.48
2007-08-01,100669,UTI - Flexi Cap Fund-Growth Option,35.06
2007-08-01,100676,Benchmark Derivative Fund - Growth Plan,1203.2876
2007-08-01,100678,UTI Children's Hybrid Fund - Regular Plan,14.1438
2007-08-01,100682,UTI Retirement Fund - Regular Plan,19.0273
2007-08-01,100684,UTI Aggressive Hybrid Fund - Regular Plan - Growth,59.39
2007-08-01,100685,UTI Aggressive Hybrid Fund - Regular Plan - IDCW,21.12
2007-08-01,100711,UTI - INDEX SELECT FUND-Income Option,24.93
2007-08-01,100712,UTI - INDEX SELECT FUND-Growth Option,36.93
2007-08-01,100715,DBS Chola Multi-Cap Fund-Dividend Option,15.1
2007-08-01,100716,DBS Chola Multi-Cap Fund-Cumulative Option,18.95
2007-08-01,100723,UTI MMF-Discontinued - Regular Plan -Growth,21.5511
2007-08-01,100724,UTI MMF- Discontinued - Regular Plan - Flexi Dividend Option,17.818
2007-08-01,100725,UTI MMF- Discontinued - Regular Plan - Periodic Dividend Option,17.7068
2007-08-01,100739,UTI MNC Fund - Regular Plan - IDCW,27.98
2007-08-01,100740,UTI - MNC Fund - Regular Plan - Growth Option,37.29
2007-08-01,100741,UTI Medium to Long Duration Fund- Regular Plan - Growth,22.3311
2007-08-01,100742,UTI Medium to Long Duration Fund - Regular Plan - Quarterly IDCW,11.0611
2007-08-01,100748,UTI - Master Index Fund-Income Option,46.9528
2007-08-01,100749,UTI - Master Index Fund-Growth Option,46.9528
2007-08-01,100750,UTI - Master Value Fund-Income Option,20.32
2007-08-01,100751,UTI - Master Value Fund-Growth Option,31.2
2007-08-01,100780,Sundaram Banking & PSU Fund (Formerly Known as Sundaram Banking and PSU Debt Fund) Retail Plan - Monthly Income Distribution cum Capital Withdrawal (IDCW),10.1918
2007-08-01,100781,Sundaram Banking & PSU Fund (Formerly Known as Sundaram Banking and PSU Debt Fund) Retail Plan - Growth,11.6323
2007-08-01,100782,Sundaram Banking & PSU Fund (Formerly Known as Sundaram Banking and PSU Debt Fund) Regular Plan - Daily Reinvestment of Income Distribution cum Capital Withdrawal (IDCW),10.0519
2007-08-01,100784,Sundaram Banking & PSU Fund (Formerly Known as Sundaram Banking and PSU Debt Fund) Regular Plan - Growth,11.7913
2007-08-01,100785,Sundaram Corporate Bond Fund Regular Plan -Income Distribution cum Capital Withdrawal(IDCW),10.2428
