date,scheme_code,scheme_name,nav
2006-12-06,100027,Grindlays Super Saver Income Fund-GSSIF-Half Yearly Dividend,10.3436
2006-12-06,100028,Grindlays Super Saver Income Fund-GSSIF-Quaterly Dividend,10.3571
2006-12-06,100029,Grindlays Super Saver Income Fund-GSSIF-Growth,16.8199
2006-12-06,100030,Grindlays Super Saver Income Fund-GSSIF-Annual Dividend,10.5707
2006-12-06,100031,Grindlays Super Saver Income Fund-GSSIF - ST-Dividend,10.0274
2006-12-06,100032,Grindlays Super Saver Income Fund-GSSIF - ST-Growth,14.5661
2006-12-06,100033,Aditya Birla Sun Life Large & Mid Cap Fund - Regular Growth,126.73
2006-12-06,100034,Aditya Birla Sun Life Large & Mid Cap Fund -Regular - IDCW,90.92
2006-12-06,100035,Birla Sun Life Freedom Fund-Plan A (Dividend),18.91
2006-12-06,100036,Birla Sun Life Freedom Fund-Plan B (Growth),28.44
2006-12-06,100037,Aditya Birla Sun Life Income Fund - Regular - Quarterly IDCW,10.3735
2006-12-06,100038,Aditya Birla Sun Life Income Fund - Growth - Regular Plan,30.4248
2006-12-06,100041,Aditya Birla Sun Life Liquid Fund -Institutional - IDCW,10.8023
2006-12-06,100042,Aditya Birla Sun Life Liquid Fund-Retail (Growth),19.6804
2006-12-06,100043,Aditya Birla Sun Life Liquid Fund-Institutional (Growth),19.8133
2006-12-06,100044,Aditya Birla Sun Life Liquid Fund -Retail - IDCW,16.3694
2006-12-06,100046,Aditya Birla Sun Life Liquid Fund -Daily IDCW,10.0195
2006-12-06,100047,Aditya Birla Sun Life Liquid Fund - Growth,11.6306
2006-12-06,100048,Aditya Birla Sun Life Liquid Fund -Institutional - weekly  IDCW,10.8169
2006-12-06,100049,Aditya Birla Sun Life Cash Plus-Institutional - Fortnightly Dividend,10.8457
2006-12-06,100051,Aditya Birla Sun Life Liquid Fund -weekly IDCW,10.0322
2006-12-06,100052,Aditya Birla Sun Life Cash Plus-Institutional Premium - Fortnightly Dividend,10.0823
2006-12-06,100053,Aditya Birla Sun Life Cash Plus-Institutional Premium Plan-Monthly Dividend,10.0117
2006-12-06,100054,Aditya Birla Sun Life Gilt Plus - Liquid Plan - Quarterly Dividend - Regular Plan,10.8554
2006-12-06,100055,Aditya Birla Sun Life Gilt Plus - Liquid Plan - Growth - Regular Plan,17.9271
2006-12-06,100056,Aditya Birla Sun Life Gilt Plus - Liquid Plan - Annual Dividend - Regular Plan,11.9376
2006-12-06,100057,Aditya Birla Sun Life Govenment Securities Fund -Regular - Quarterly IDCW,10.936
2006-12-06,100058,Aditya Birla Sun Life Government Securities Fund  - Growth - Regular Plan,20.9378
2006-12-06,100059,Aditya Birla Sun Life Gilt Plus-PF Plan (Annual Dividend),20.9387
2006-12-06,100060,Aditya Birla Sun Life Constant Maturity 10 Year Gilt Fund - Quarterly Dividend - Regular Plan,11.5371
2006-12-06,100061,Aditya Birla Sun Life Constant Maturity 10 Year Gilt Fund - Growth - Regular Plan,23.5907
2006-12-06,100062,Aditya Birla Sun Life Gilt Plus-Regular Plan (Annual Dividend),23.639
2006-12-06,100063,Aditya Birla Sun Life MNC Fund - Regular - IDCW,61.17
2006-12-06,100064,Aditya Birla Sun Life MNC Fund - Growth - Regular Plan,122.03
2006-12-06,100065,Aditya Birla Sun Life India Opportunities Fund - Dividend - Regular Plan,21.95
2006-12-06,100066,Aditya Birla Sun Life India Opportunities Fund - Growth - Regular Plan,51.12
2006-12-06,100067,Aditya Birla Sun Life Tax Plan -Regular - IDCW,57.33
2006-12-06,100068,BARODA ELSS 96 - Plan A - IDCW,25.88
2006-12-06,100069,BARODA PIONEER DIVERSIFIED FUND,31.13
2006-12-06,100077,DSP Bond Fund - IDCW,10.6978
2006-12-06,100078,DSP Bond Fund - Growth,24.7088
2006-12-06,100079,DSP Bond Fund - IDCW - Monthly,10.3742
2006-12-06,100080,DSP Flexi Cap Fund - Regular Plan - IDCW,45.501
2006-12-06,100081,DSP Aggressive Hybrid Fund- Regular Plan - Growth,38.383
2006-12-06,100082,DSP Aggressive Hybrid Fund- Regular Plan - IDCW,22.267
2006-12-06,100084,DSP Gilt Fund - Regular Plan - Growth,23.3163
2006-12-06,100085,DSP Gilt Fund - Regular Plan - IDCW,11.6209
2006-12-06,100086,DSP Gilt Fund - Regular Plan - IDCW - Monthly,10.2308
2006-12-06,100087,DSP Savings Fund - Regular Plan - Growth,16.7748
2006-12-06,100088,DSP Savings Fund - Regular Plan - IDCW,11.0662
2006-12-06,100089,DSP Savings Fund - Regular Plan - IDCW - Monthly,10.0732
2006-12-06,100090,DSP BlackRock Technology.com   Fund - Regular Plan - Growth,22.218
2006-12-06,100119,HDFC Balanced Advantage Fund - Growth Plan,48.137
2006-12-06,100120,HDFC Balanced Advantage Fund - IDCW Plan,29.612
2006-12-06,100121,HDFC Balanced Fund - Dividend Option,20.951
2006-12-06,100122,HDFC Balanced Fund - Growth Option,32.58
2006-12-06,100123,HDFC Income Fund - Quarterly IDCW Option,10.3515
2006-12-06,100124,HDFC Income Fund - Growth Option,16.7461
2006-12-06,100136,Principal Deposit Fund-Plan 54EA/EB-Plan 54EA /EB,17.7547
2006-12-06,100150,Principal Child Benefit Fund-Super Saver-Future Guard Plan,53.38
2006-12-06,100151,Principal Retail Equity Savings Fund - Growth Option,54.09
2006-12-06,100152,Principal Nifty 100 Equal Weight Fund-Income Distribution CUM Capital Withdrawal,22.3915
2006-12-06,100153,Principal Nifty 100 Equal Weight Fund-Growth,28.9485
2006-12-06,100156,Principal Tax Savings Fund,80.63
2006-12-06,100171,Quant Dynamic Bond-Dividend,10.1874
2006-12-06,100172,Quant Dynamic Bond-Growth,22.6042
2006-12-06,100173,Quant Dynamic Bond-Bonus,11.9058
2006-12-06,100174,quant ELSS Tax Saver Fund - IDCW Option - Regular Plan,15.4214
2006-12-06,100175,quant ELSS Tax Saver Fund - Growth Option - Regular Plan,43.8106
2006-12-06,100176,quant Small Cap Fund - IDCW Option - Regular Plan,17.0415
2006-12-06,100177,quant Small Cap Fund - Growth - Regular Plan,20.1871
2006-12-06,100178,ING Income Fund-Regular Plan -Dividend Option (Quarterly),10.2621
2006-12-06,100179,ING Income Fund-Regular Plan -Dividend Option (Half Yearly),10.2823
2006-12-06,100180,ING Income Fund- Regular Plan - Dividend Option (Annual),10.6221
2006-12-06,100181,ING Income Fund-Regular Plan -Growth Option,18.0567
2006-12-06,100182,ING Income Fund-Institutional Plan - Dividend Option (Half Yearly),10.0
2006-12-06,100183,ING Income Fund-Institutional Plan - Dividend Option (Quarterly),10.0
2006-12-06,100184,ING Income Fund-Institutional Plan -Dividend Option (Annual),10.6314
2006-12-06,100185,ING Income Fund-Bonus Option,11.0096
2006-12-06,100186,ING Income Fund-Institutional Bonus Option,11.2286
2006-12-06,100187,ING Income Fund-Institutional Plan - Growth Option,18.7571
2006-12-06,100188,ING Core Equity Fund-Dividend Option,14.36
2006-12-06,100189,ING Core Equity Fund-Growth Option,27.16
2006-12-06,100190,ING Liquid Fund-Regular Growth Option,15.5044
2006-12-06,100191,ING Liquid Fund-Regular Weekly Dividend Option,10.8282
2006-12-06,100192,ING Liquid Fund-Regular Daily Dividend Option,10.7849
2006-12-06,100194,ING Liquid Fund-Auto Sweep Growth Option,10.0
2006-12-06,100195,ING Liquid Fund-Auto Sweep Weekly Dividend Option,10.0
2006-12-06,100196,ING Liquid Fund-Institutional Growth Option,11.4899
2006-12-06,100197,ING Liquid Fund-Institutional Weekly Dividend Option,10.0577
2006-12-06,100198,ING Liquid Fund-Institutional Daily Dividend Option,10.0103
2006-12-06,100199,ING Liquid Fund-Super Institutional Growth Option,10.874
2006-12-06,100200,ING Liquid Fund-Super Institutional Daily Dividend Option,10.0024
2006-12-06,100201,ING Liquid Fund-Super Institutional Weekly Dividend Option,10.0882
2006-12-06,100202,ING Balanced Fund-Dividend Option,12.77
2006-12-06,100203,ING Balanced Fund-Growth Option,18.25
2006-12-06,100218,JM Large Cap Fund (Regular) - IDCW,17.48
2006-12-06,100219,JM Large Cap Fund (Regular) - Growth Option,38.89
2006-12-06,100220,JM Aggressive Hybrid Fund (Regular) - IDCW,17.65
2006-12-06,100221,JM Aggressive Hybrid Fund (Regular) -Growth Option,23.23
2006-12-06,100222,JM Medium to Long Duration Fund (Regular) - Quarterly IDCW,10.2652
2006-12-06,100223,JM Medium to Long Duration Fund (Regular) - Growth Option,28.4544
2006-12-06,100233,JM Liquid Fund (Regular) - Weekly IDCW,10.3694
2006-12-06,100234,JM Liquid Fund - Growth Option,20.0883
2006-12-06,100237,JM High Liquidity Fund-- Institutional Plan - Growth,12.1192
2006-12-06,100238,JM High Liquidity Fund-Institutional Plan - Daily Dividend,10.0159
2006-12-06,100241,JM High Liquidity Fund-- Institutional Plan - Dividend,10.1348
2006-12-06,100243,JM High Liquidity Fund-- Premium Plan - Daily Dividend Option,10.0
2006-12-06,100244,JM Liquid Fund (Regular) - Quarterly IDCW,11.5662
2006-12-06,100245,JM High Liquidity Fund-Super Institutional Plan- Daily Dividend,10.0165
2006-12-06,100246,JM High Liquidity Fund-Super Institutional Plan- Weekly  Dividend,10.1226
2006-12-06,100247,JM Liquid Fund (Regular) - Super Institutional Plan - Growth Option,11.5241
2006-12-06,100249,JM G-Sec Fund - Quarterly Dividend Option,10.2686
2006-12-06,100250,JM G-Sec Fund - Growth Option,21.004
2006-12-06,100251,JM G-Sec Fund-PF Plan - Growth Plan,21.8726
2006-12-06,100252,JM G-Sec Fund-PF Plan -Dividend Plan,20.0419
2006-12-06,100253,JM G-Sec Fund - Bonus Option - Principal Units,10.2172
2006-12-06,100254,JM Value Fund (Regular) - Growth Option,18.46
2006-12-06,100261,Kotak Gilt-Savings-Monthly Dividend,10.4687
2006-12-06,100262,Kotak Gilt-Savings-Growth,17.9554
2006-12-06,100263,Kotak Gilt-Savings-Annual Dividend,12.0073
2006-12-06,100264,Kotak Gilt-Investment Regular-Payout of Income Distribution cum capital withdrawal option,11.5536
2006-12-06,100265,Kotak Gilt-Investment Regular-Growth,24.019
2006-12-06,100280,Kotak Gilt-Investment  Provident Fund and Trust-Payout of Income Distribution cum capital withdrawal option,11.1399
2006-12-06,100281,Kotak Gilt-Investment  Provident Fund and Trust-Growth,24.3056
2006-12-06,100286,Kotak Aggressive Hybrid Fund - Regular Plan - IDCW - Payout & Reinvestment of Income Distribution cum capital withdrawal option,23.472
2006-12-06,100289,Kotak Tech,10.27
2006-12-06,100290,Kotak MNC,26.206
2006-12-06,100291,Kotak Bond-Deposit-Dividend,11.7306
2006-12-06,100292,Kotak Bond-Deposit-Growth,18.5608
2006-12-06,100298,Kotak Bond Regular Plan Quaterly Payout of Income Distribution cum capital withdrawal option,10.5888
2006-12-06,100299,Kotak Bond Fund - Regular Plan Growth,19.4209
2006-12-06,100300,Kotak Bond Fund - Regular Plan - Standard IDCW Option,12.9792
2006-12-06,100301,Kotak Bond Regular Plan Bonus Plan,12.945
2006-12-06,100312,LIC MF Flexi Cap Fund-Regular Plan-IDCW,11.8291
2006-12-06,100313,LIC MF Flexi Cap Fund-Regular Plan-Growth,21.3813
2006-12-06,100314,LIC MF Medium to Long Duration Fund-Regular Plan-IDCW,10.3257
2006-12-06,100315,LIC MF Medium to Long Duration Fund-Regular Plan-Growth,20.0109
2006-12-06,100316,LIC MF Gilt Fund-Regular Plan-IDCW,10.9608
2006-12-06,100317,LIC MF Gilt Fund-Regular Plan-Growth,18.8593
2006-12-06,100318,LIC MF Gilt Fund-PF Plan-IDCW,10.8751
2006-12-06,100319,LIC MF Gilt Fund-PF Plan-Growth,10.8751
2006-12-06,100321,LIC MF Aggressive Hybrid Fund-Regular Plan-IDCW,12.2495
2006-12-06,100323,LIC MF Aggressive Hybrid Fund-Regular Plan-Growth,45.5145
2006-12-06,100325,LIC MF ULIS (5 Yrs. Single Premium)-Regular Plan-IDCW Reinvestment,12.8202
2006-12-06,100332,LIC MF Large Cap Fund-Regular Plan-IDCW,11.028
2006-12-06,100337,SaharaTax Gain-Dividend,18.2049
2006-12-06,100338,SaharaTax Gain-Growth,20.8411
2006-12-06,100347,Morgan Stanley Growth Fund- Regular Growth Plan,51.22
2006-12-06,100348,ICICI Prudential Large & Mid Cap Fund - IDCW,25.66
2006-12-06,100349,ICICI Prudential Large & Mid Cap Fund - Growth,94.33
2006-12-06,100350,ICICI Prudential Large & Mid Cap Fund - Institutional Option - I - Growth,12.49
2006-12-06,100351,ICICI Prudential FMCG Fund - IDCW,34.5
2006-12-06,100352,ICICI Prudential FMCG Fund - Growth,41.14
2006-12-06,100353,ICICI Prudential ELSS Tax Saver Fund - IDCW,27.26
2006-12-06,100354,ICICI Prudential ELSS Tax Saver Fund - Growth,92.62
2006-12-06,100355,ICICI Prudential Equity & Debt Fund - Monthly IDCW,18.02
2006-12-06,100356,ICICI Prudential Equity & Debt Fund - Growth,34.57
2006-12-06,100357,ICICI Prudential Liquid Fund -Quarterly IDCW,10.856
2006-12-06,100359,ICICI Prudential Liquid Institutional Plus Fund - Div - Daily,11.8515
2006-12-06,100360,ICICI Prudential Liquid Institutional Plus Fund - Div - Weekly,11.858
2006-12-06,100361,ICICI Prudential Liquid Fund-Dividend-Institutional Plus - Monthly,11.9306
2006-12-06,100362,ICICI Prudential Liquid Institutional Plus Fund - Growth,18.1584
2006-12-06,100363,ICICI Prudential Technology Fund - Growth,13.87
2006-12-06,100364,ICICI Prudential Long Term Bond Fund - Half Yearly IDCW,10.6698
2006-12-06,100365,ICICI Prudential Long Term Bond Fund - Growth,21.7071
2006-12-06,100366,ICICI Prudential Long Term Bond Fund-Institutional Quarterly Dividend,10.415
2006-12-06,100367,ICICI Prudential Long Term Bond Fund - Quarterly IDCW,11.2505
2006-12-06,100368,ICICI Prudential Gilt Fund - IDCW,10.6949
2006-12-06,100369,ICICI Prudential Gilt Fund - Growth,22.6084
2006-12-06,100370,ICICI Prudential Short Term Gilt Fund - Dividend,10.5222
2006-12-06,100371,ICICI Prudential Short Term Gilt Fund - Growth,17.8826
2006-12-06,100372,ICICI Prudential Short Term Gilt Fund - Half Yearly Dividend,10.114
2006-12-06,100375,NIPPON INDIA GROWTH MID CAP FUND - IDCW Option,55.94
2006-12-06,100376,Nippon India Growth Mid Cap Fund-Growth Plan-Bonus Option,43.4
2006-12-06,100377,Nippon India Growth Mid Cap Fund-Growth Plan-Growth Option,261.75
2006-12-06,100378,Nippon India Vision Large & Midcap Fund - IDCW Option,53.56
2006-12-06,100379,Nippon India Vision Large & Midcap Fund-GROWTH PLAN-Bonus Option,30.12
2006-12-06,100380,Nippon India Vision Large & Midcap Fund-GROWTH PLAN-Growth Option,179.71
2006-12-06,100381,UTI Large Cap Fund-Income Option,17.75
2006-12-06,100382,UTI Large Cap Fund-Growth Option,20.36
2006-12-06,100383,NIPPON INDIA MEDIUM TO LONG DURATION FUND - MONTHLY IDCW Option,11.1148
2006-12-06,100384,NIPPON INDIA MEDIUM TO LONG DURATION  FUND - QUARTERLY IDCW Option,11.8821
2006-12-06,100385,NIPPON INDIA MEDIUM TO LONG DURATION  FUND - HALF YEARLY IDCW Option,11.3139
2006-12-06,100386,NIPPON INDIA MEDIUM TO LONG DURATION  FUND - ANNUAL IDCW Option,12.0366
2006-12-06,100387,Nippon India Medium to Long Duration  Fund - Growth Plan Growth Option,23.1728
2006-12-06,100388,Nippon India Medium to Long Duration  Fund - Growth Plan Bonus Option,10.9185
2006-12-06,100414,Tata Aggressive Hybrid Fund- Regular Plan - Growth Option,49.3909
2006-12-06,100415,Tata Ethical Fund-Regular Plan - Growth Option,48.3962
2006-12-06,100416,Tata Long Term Debt Fund - Regular Plan - Quarterly Dividend,10.5132
2006-12-06,100417,Tata Income Fund-Regular Plan - Half Yearly Payout of IDCW Option,10.9257
2006-12-06,100418,Tata Income Fund -Regular Plan - Growth Option,24.8479
2006-12-06,100470,Franklin India Large Cap Fund - IDCW,43.57
2006-12-06,100471,Franklin India Large Cap Fund-Growth,131.35
2006-12-06,100472,Franklin India Mid Cap Fund - IDCW,58.31
2006-12-06,100473,Franklin India Mid Cap Fund-Growth,209.42
2006-12-06,100474,Tata ELSS Fund- Regular Plan - Payout of IDCW Option,42.2198
2006-12-06,100475,Tata Large Cap Fund -Regular Plan - Growth Option,61.9941
2006-12-06,100476,Taurus Flexi Cap Fund - Regular Plan - Growth,40.68
2006-12-06,100477,Taurus Mid Cap Fund - Regular Plan - Growth,15.25
2006-12-06,100480,Taurus ELSS Tax Saver Fund - Regular Plan - Growth,17.35
2006-12-06,100481,Franklin India Balanced Fund-Growth,35.06
2006-12-06,100482,Franklin India Balanced Fund-Div,30.3
2006-12-06,100483,Franklin India Growth Fund,29.16
2006-12-06,100484,Franklin India Index Fund- NSE Nifty 50 Index Fund - Growth,31.856
2006-12-06,100485,Franklin India Govt.Sec. Fund-Composite Plan - Growth,24.2541
2006-12-06,100486,Franklin India Govt.Sec. Fund-Composite Plan - Dividend,10.9894
2006-12-06,100487,Franklin India Govt.Sec. Fund-Treasury Plan(Dividend Option),10.7883
2006-12-06,100489,Franklin India Govt.Sec. Fund-Treasury Plan(Growth Option),13.766
2006-12-06,100490,Franklin India Govt.Sec. Fund-PF Plan - Growth,10.6532
2006-12-06,100491,Franklin India Govt.Sec. Fund-PF Plan - Dividend,10.6532
2006-12-06,100493,Franklin India Government Securities Fund - Growth,16.6163
2006-12-06,100494,Franklin India Government Securities Fund - IDCW,11.1012
2006-12-06,100495,Franklin India Govt.Sec. Fund-Long Term Plan - Bonus,12.3771
2006-12-06,100496,Templeton India Value Fund - Growth Plan,65.37
2006-12-06,100497,Templeton India Value Fund - IDCW,42.74
2006-12-06,100498,Franklin India Dynamic Accrual Fund - IDCW,10.649
2006-12-06,100499,Franklin India Dynamic Accrual Fund-Growth,25.6783
2006-12-06,100503,Franklin India Low Duration Fund - Monthly - IDCW,10.2648
2006-12-06,100504,Franklin India Low Duration Fund - Quarterly - IDCW,10.3345
2006-12-06,100505,Templeton Monthly Income Plan-Half Yearly Dividend,12.2953
2006-12-06,100506,Templeton Monthly Income Plan-Growth,19.8239
2006-12-06,100519,Franklin India Flexi Cap Fund - IDCW,33.42
2006-12-06,100520,Franklin India Flexi Cap Fund - Growth,135.09
2006-12-06,100521,Franklin India Technology Fund - IDCW,24.97
2006-12-06,100522,Franklin India Technology Fund-Growth,53.67
2006-12-06,100523,Franklin FMCG Fund - Growth,35.96
2006-12-06,100524,Franklin INDIA OPPORTUNITIES FUND - IDCW,15.76
2006-12-06,100525,Franklin India ELSS Tax Saver Fund - IDCW,40.27
2006-12-06,100526,Franklin India ELSS Tax Saver Fund-Growth,127.7
2006-12-06,100527,Franklin India Corporate Debt Fund - Plan A - Annual - IDCW,10.7125
2006-12-06,100528,Franklin India Corporate Debt Fund - Growth,25.1295
2006-12-06,100529,Franklin India Corporate Debt Fund - Plan B - Monthly - IDCW,13.9173
2006-12-06,100530,Franklin India Corporate Debt Fund - Plan B - Quarterly - IDCW,14.2215
2006-12-06,100531,Franklin India Corporate Debt Fund - Plan B - Half yearly - IDCW,14.1093
2006-12-06,100532,Franklin India Corporate Debt Fund - Monthly Bonus,19.5675
2006-12-06,100535,Franklin India Retirement Fund - IDCW,19.0343
2006-12-06,100536,Franklin India Retirement Fund - Growth,43.5291
2006-12-06,100537,Franklin India Liquid Fund - Regular Plan - Weekly - IDCW,1245.0248
2006-12-06,100538,Franklin India Liquid Fund - Regular Plan - Growth,1819.7492
2006-12-06,100541,Franklin India Liquid Fund - Regular Plan - Daily - IDCW,1512.34
2006-12-06,100542,Franklin India Liquid Fund - Liquid Plan - Weekly Dividend,1001.1186
2006-12-06,100543,Franklin India Liquid Fund - Liquid Plan - Daily IDCW,1000.25
2006-12-06,100544,Franklin India Liquid Fund - Liquid Plan - Growth,1120.0978
2006-12-06,100546,Franklin India Liquid Fund - Super Institutional Plan - Growth,1080.9567
2006-12-06,100547,Franklin India Liquid Fund - Super Institutional Plan - Daily - IDCW,1000.25
2006-12-06,100548,Franklin India Liquid Fund - Super Institutional Plan - Weekly - IDCW,1016.7509
2006-12-06,100549,Franklin India Aggressive Hybrid Fund - IDCW,23.119
2006-12-06,100550,Franklin India Aggressive Hybrid Fund - Growth Plan,32.461
2006-12-06,100551,Templeton India Children’s Asset Plan-Education Plan,25.1654
2006-12-06,100552,Templeton India Children’s Asset Plan-Gift Plan - Growth,30.3066
2006-12-06,100553,Templeton India Children’s Asset Plan-Gift Plan - Dividend,30.3066
2006-12-06,100556,Franklin India Taxshield 97,120.84
2006-12-06,100557,Franklin India Taxshield 98,122.22
2006-12-06,100558,Franklin India Taxshield 99,73.2
2006-12-06,100561,Templeton India Money Market Account - Bonus Plan,1.0
2006-12-06,100563,DBS Chola Triple Ace-Regular -Cumulative,23.9093
2006-12-06,100567,DBS Chola Triple Ace-Regular - Quarterly Dividend,11.2575
2006-12-06,100569,DBS Chola Triple Ace-Semi Annual Dividend,11.5697
2006-12-06,100573,DBS Chola Triple Ace-Regular Bonus,13.285
2006-12-06,100574,DBS Chola Freedom Income -Short Term Fund-Regular-Monthly Dividend,10.9401
2006-12-06,100575,DBS Chola Freedom Income -Short Term Fund-Regular - Cumulative,11.6081
2006-12-06,100576,DBS Chola Freedom Income -Short Term Fund-Cum- Institutional Plan,11.7464
2006-12-06,100579,DBS Chola Gilt-Investment-Quarterly Dividend,10.2048
2006-12-06,100580,DBS Chola Gilt-Investment-Cumulative,18.5537
2006-12-06,100589,Canara Robeco Expo-Income Plan,20.25
2006-12-06,100590,Canara Robeco Expo-Growth Plan,53.21
2006-12-06,100593,CANARA ROBECO ELSS TAX SAVER - REGULAR PLAN -IDCW (Payout),22.09
2006-12-06,100596,CANARA ROBECO GILT FUND - REGULAR PLAN - IDCW (Payout/Reinvestment),10.4626
2006-12-06,100597,CANARA ROBECO GILT FUND - REGULAR PLAN - GROWTH OPTION,18.3321
2006-12-06,100600,CANARA ROBECO CONSERVATIVE HYBRID FUND - REGULAR PLAN - MONTHLY IDCW (Payout/Reinvestment),11.73
2006-12-06,100601,CANARA ROBECO CONSERVATIVE HYBRID FUND - REGULAR PLAN - GROWTH OPTION,19.36
2006-12-06,100602,Sundaram Medium Duration Fund (Formerly Known as Sundaram Medium Term Bond Fund) Regular Plan-Income Distribution cum Capital Withdrawal(IDCW),10.422
2006-12-06,100603,Sundaram Medium Duration Fund (Formerly Known as Sundaram Medium Term Bond Fund) Regular Plan - Growth,22.6744
2006-12-06,100604,Sundaram Medium Duration Fund (Formerly Known as Sundaram Medium Term Bond Fund) Regular Plan -Growth,11.9352
2006-12-06,100609,Sundaram Medium Duration Fund (Formerly Known as Sundaram Medium Term Bond Fund) Regular Plan- Income Distribution cum Capital Withdrawal(IDCW),10.4177
2006-12-06,100610,Sundaram Medium Duration Fund (Formerly Known as Sundaram Medium Term Bond Fund) Regular Plan -Income Distribution cum Capital Withdrawal (IDCW),10.4195
2006-12-06,100611,Sundaram Medium Duration Fund (Formerly Known as Sundaram Medium Term Bond Fund) Institutional Plan -Growth,11.5864
2006-12-06,100612,Sundaram Growth Fund-Dividend,14.8707
2006-12-06,100613,Sundaram Growth Fund-Growth,68.0103
2006-12-06,100614,Sundaram Value Fund Regular Plan - Income Distribution cum Capital Withdrawal (IDCW),17.5633
2006-12-06,100617,Sundaram Equity Hybrid Fund Regular Plan - Growth,32.2652
2006-12-06,100618,Sundaram Money Fund Retail Plan - Growth,15.3542
2006-12-06,100619,Sundaram Money Fund Retail Plan - Quarterly Reinvestment of Income Distribution cum Capital Withdrawal (IDCW),10.2907
2006-12-06,100620,Sundaram Money Fund Retail Plan - Daily Reinvestment of Income Distribution cum Capital Withdrawal (IDCW),10.0953
2006-12-06,100621,Sundaram Money Fund Retail Plan - Weekly Reinvestment of Income Distribution cum Capital Withdrawal (IDCW),10.3055
2006-12-06,100622,Sundaram Money Fund Retail Plan - Fortnightly Reinvestment of Income Distribution cum Capital Withdrawal (IDCW),10.2042
2006-12-06,100623,Sundaram Money Fund Retail Plan - Monthly Income Distribution cum Capital Withdrawal (IDCW),10.1233
2006-12-06,100630,quant Multi Cap Fund-IDCW Option - Regular Plan,16.3333
2006-12-06,100631,quant Multi Cap Fund-GROWTH OPTION - Regular Plan,55.4666
2006-12-06,100638,SBI Medium to Long Duration Fund - Regular Plan - Half Yearly - Income Distribution cum Capital Withdrawal Option (IDCW),10.2205
2006-12-06,100639,SBI Medium to Long Duration Fund-REGULAR PLAN-Growth,19.7852
2006-12-06,100640,SBI Medium to Long Duration Fund-REGULAR PLAN-Bonus,11.9847
2006-12-06,100641,SBI ULTRA SHORT DURATION FUND - REGULAR PLAN - GROWTH,16.406
2006-12-06,100643,SBI Technology Opportunities Fund - Regular Plan - Income Distribution cum Capital Withdrawal Option (IDCW),25.84
2006-12-06,100644,SBI Healthcare Opportunities Fund - Regular Plan - Income Distribution cum Capital Withdrawal Option (IDCW),29.58
2006-12-06,100645,SBI Consumption Opportunities Fund - Regular Plan - Income Distribution cum Capital Withdrawal Option (IDCW),14.88
2006-12-06,100646,UTI - Unit Linked Insurance Plan,15.7203
2006-12-06,100648,UTI - CRTS 81 - Dividend Option,108.542
2006-12-06,100650,UTI Large Cap Fund - Regular Plan - IDCW,28.08
2006-12-06,100651,UTI Large Cap Fund - Regular Plan - Growth Option,34.87
2006-12-06,100656,UTI - Master Plus Unit Scheme-Growth Option,67.48
2006-12-06,100657,UTI - Master Plus Unit Scheme-Income Option,60.17
2006-12-06,100663,UTI Large & Mid Cap Fund - Regular Plan - IDCW,41.72
2006-12-06,100664,UTI Large & Mid Cap Fund - Regular Plan - Growth Option,45.25
2006-12-06,100668,UTI Flexi Cap Fund - Regular Plan - IDCW,30.86
2006-12-06,100669,UTI - Flexi Cap Fund-Growth Option,33.34
2006-12-06,100676,Benchmark Derivative Fund - Growth Plan,1130.3811
2006-12-06,100678,UTI Children's Hybrid Fund - Regular Plan,15.0047
2006-12-06,100682,UTI Retirement Fund - Regular Plan,19.6101
2006-12-06,100684,UTI Aggressive Hybrid Fund - Regular Plan - Growth,56.2
2006-12-06,100685,UTI Aggressive Hybrid Fund - Regular Plan - IDCW,22.22
2006-12-06,100711,UTI - INDEX SELECT FUND-Income Option,23.63
2006-12-06,100712,UTI - INDEX SELECT FUND-Growth Option,35.03
2006-12-06,100715,DBS Chola Multi-Cap Fund-Dividend Option,15.21
2006-12-06,100716,DBS Chola Multi-Cap Fund-Cumulative Option,19.08
2006-12-06,100723,UTI MMF-Discontinued - Regular Plan -Growth,20.5207
2006-12-06,100724,UTI MMF- Discontinued - Regular Plan - Flexi Dividend Option,17.6041
2006-12-06,100725,UTI MMF- Discontinued - Regular Plan - Periodic Dividend Option,17.4828
2006-12-06,100739,UTI MNC Fund - Regular Plan - IDCW,28.8
2006-12-06,100740,UTI - MNC Fund - Regular Plan - Growth Option,34.67
2006-12-06,100741,UTI Medium to Long Duration Fund- Regular Plan - Growth,21.5585
2006-12-06,100742,UTI Medium to Long Duration Fund - Regular Plan - Quarterly IDCW,11.0009
2006-12-06,100748,UTI - Master Index Fund-Income Option,43.7679
2006-12-06,100749,UTI - Master Index Fund-Growth Option,43.7678
2006-12-06,100750,UTI - Master Value Fund-Income Option,19.8
2006-12-06,100751,UTI - Master Value Fund-Growth Option,30.36
2006-12-06,100780,Sundaram Banking & PSU Fund (Formerly Known as Sundaram Banking and PSU Debt Fund) Retail Plan - Monthly Income Distribution cum Capital Withdrawal (IDCW),10.1715
2006-12-06,100781,Sundaram Banking & PSU Fund (Formerly Known as Sundaram Banking and PSU Debt Fund) Retail Plan - Growth,11.1016
2006-12-06,100782,Sundaram Banking & PSU Fund (Formerly Known as Sundaram Banking and PSU Debt Fund) Regular Plan - Daily Reinvestment of Income Distribution cum Capital Withdrawal (IDCW),10.0519
