date,scheme_code,scheme_name,nav
2006-11-23,102205,SBI Dynamic Bond Fund - REGULAR PLAN - Growth,10.6031
2006-11-23,102206,SBI Dynamic Bond Fund - Regular Plan - Income Distribution cum Capital Withdrawal Option (IDCW),10.1829
2006-11-23,102207,SBI MAGNUM NRI FLEXIASSET PLAN-GROWTH,23.2263
2006-11-23,102208,SBI MAGNUM NRI FLEXIASSET PLAN-DIVIDEND,23.2231
2006-11-23,102222,ING Dynamic Duration Fund-Growth Option,11.4331
2006-11-23,102223,ING Dynamic Duration Fund-Annual Dividend Option,10.5537
2006-11-23,102224,ING Dynamic Duration Fund-Monthly Dividend Option,10.148
2006-11-23,102225,ING Dynamic Duration Fund-Quarterly Dividend Option,10.2379
2006-11-23,102226,ING Dynamic Duration Fund-Half Yearly Dividend Option,10.2141
2006-11-23,102231,ING Dynamic Duration Fund-Bonus Option,11.4331
2006-11-23,102232,ING MIP Fund-Growth Option,12.0718
2006-11-23,102233,ING MIP Fund-Monthly Dividend Option,10.6987
2006-11-23,102234,ING MIP Fund-Quarterly Dividend Option,10.7634
2006-11-23,102235,ING MIP Fund-Half Yearly Dividend Option,10.6211
2006-11-23,102236,ING MIP Fund-Annual Dividend Option,10.8772
2006-11-23,102240,ING MIP Fund-Bonus Option,12.0718
2006-11-23,102242,ING Large Cap Equity Fund-Growth Option,20.25
2006-11-23,102243,ING Large Cap Equity Fund-Dividend Option,13.48
2006-11-23,102245,ING Large Cap Equity Fund-Bonus Option,20.25
2006-11-23,102248,ICICI Prudential Gilt Fund Treasury Plan PF Option - Growth,11.3269
2006-11-23,102251,HSBC Flexi Cap Fund - Regular IDCW,18.6609
2006-11-23,102252,HSBC Flexi Cap Fund - Regular Growth,28.0212
2006-11-23,102257,HSBC MIP - Regular -  Dividend - Monthly,10.6726
2006-11-23,102258,HSBC MIP - Regular - Dividend - Quarterly,10.8543
2006-11-23,102259,HSBC MIP - Regular - Growth,12.2372
2006-11-23,102260,HSBC Conservative Hybrid Fund - Regular Monthly IDCW,11.0082
2006-11-23,102261,HSBC Conservative Hybrid Fund - Regular Quarterly IDCW,11.2767
2006-11-23,102262,HSBC Conservative Hybrid Fund - Regular Growth,13.1247
2006-11-23,102263,Tata Gilt Securities Fund RIP ( Bonus),11.5544
2006-11-23,102266,UTI Children's Equity Fund - Regular Plan - IDCW,11.0037
2006-11-23,102267,UTI Children's Equity Fund - Regular Plan - Growth Option,11.0036
2006-11-23,102268,LIC NOMURA MF Floating Rate Fund - Short Term Plan-Growth,11.6286
2006-11-23,102269,LIC NOMURA MF Floating Rate Fund - Short Term Plan-Weekly Dividend,10.1528
2006-11-23,102270,Franklin FMCG Fund - Dividend,25.06
2006-11-23,102271,Franklin Pharma Fund - Dividend,20.15
2006-11-23,102272,SBI NIFTY INDEX FUND - REGULAR PLAN - GROWTH,36.2723
2006-11-23,102273,SBI Nifty Index Fund - Regular Plan - Income Distribution cum Capital Withdrawal Option (IDCW),17.9391
2006-11-23,102280,Tata M I P Plus Fund - Regular Plan-Monthly Dividend,10.476
2006-11-23,102281,Tata M I P Plus Fund -Regular Plan- Quarterly Dividend,10.6553
2006-11-23,102282,Tata M I P Plus Fund -Regular Plan- Half Yearly Dividend,10.6634
2006-11-23,102283,Tata MIP Plus Fund -Regular Plan - Growth,11.861
2006-11-23,102300,Grindlays Government Securities Fund-Provident fund Plan-Regular- Plan A-Growth/Appreciation,11.1238
2006-11-23,102304,Grindlays Government Securities Fund-Provident fund Plan-Regular- Plan A-Annual Dividend,10.7596
2006-11-23,102305,Grindlays Government Securities Fund-Provident fund Plan-Regular- Plan A-Quarterly Dividend,10.5094
2006-11-23,102306,Grindlays Government Securities Fund-Provident fund Plan-Institutional Plan-Plan B-Growth/Appreciation,11.1565
2006-11-23,102311,Grindlays Government Securities Fund-Provident fund Plan-Institutional Plan-Plan B-Quarterly Dividend,10.5032
2006-11-23,102315,ING Tax Savings Fund-Growth Option,25.59
2006-11-23,102316,ING Tax Savings Fund-Dividend Option,16.68
2006-11-23,102317,ING Tax Savings Fund-Bonus Option,25.63
2006-11-23,102320,Franklin India Index Fund - BSE Plan - Growth Plan,38.0784
2006-11-23,102326,Tata Mid Cap Fund-Regular Plan - IDCW Option,26.1844
2006-11-23,102328,Tata Mid Cap Fund Regular Plan- Growth Option,30.2643
2006-11-23,102329,Tata Mid Cap Growth Fund Regular Plan  - Bonus (Growth),26.3365
2006-11-23,102330,ICICI Prudential Regular Savings Fund - Plan - Growth,14.1589
2006-11-23,102331,ICICI Prudential Regular Savings Fund - Plan - Monthly IDCW,12.4483
2006-11-23,102336,Principal Global Opportunities Fund- Income Distribution CUM Capital Withdrawal Option,13.9683
2006-11-23,102337,Principal Global Opportunities Fund-Growth Option,13.9683
2006-11-23,102340,GCF-Plan C-Growth,11.5276
2006-11-23,102341,GCF-Plan C-weekly Dividend,10.0106
2006-11-23,102342,GCF-Plan C-Daily Dividend,10.0
2006-11-23,102343,GCF-Plan C-Monthly Dividend,10.0
2006-11-23,102347,GFRF-Plan C-Growth,11.5386
2006-11-23,102348,GFRF-Plan C-Daily Dividend,10.0
2006-11-23,102349,GFRF-Plan C-Weekly Dividend,10.0
2006-11-23,102350,GFRF-Plan C-Monthly Divdend,10.0
2006-11-23,102363,GSSIF-ST-Plan C-Growth,10.7512
2006-11-23,102364,GSSIF-ST-Plan C-Dividend,10.0565
2006-11-23,102365,GSSIF-ST-Plan D-Growth,10.182
2006-11-23,102366,GSSIF-ST-Plan D-Dividend,10.0509
2006-11-23,102381,ING Gilt Fund Provident Fund - Dynamic Plan-Growth Option,11.4881
2006-11-23,102382,ING Gilt Fund Provident Fund - Dynamic Plan-Growth Auto Income Payout Option,11.4881
2006-11-23,102383,ING Gilt Fund Provident Fund - Dynamic Plan-Half Yearly Dividend Option,10.3476
2006-11-23,102384,ING Gilt Fund Provident Fund - Dynamic Plan-Annual Dividend Option,10.5746
2006-11-23,102387,ING Gilt Fund Provident Fund - Dynamic Plan-Cyclical Series Option 2006,10.449
2006-11-23,102393,UTI Mid Cap Fund - Regular Plan - IDCW,19.07
2006-11-23,102394,UTI Mid Cap Fund-Growth Option,22.51
2006-11-23,102395,UTI Infrastructure Fund-Growth Option,27.49
2006-11-23,102396,UTI Infrastructure Fund - Regular Plan - IDCW,20.1
2006-11-23,102397,UTI Transportation and Logistics Fund - Regular Plan - IDCW,15.12
2006-11-23,102398,UTI-Transportation and Logistics  Fund-Growth Option,18.89
2006-11-23,102401,UTI Banking and Financial Services Fund - Regular Plan - Growth Option,20.78
2006-11-23,102402,UTI Banking and Financial Services Fund - Regular Plan - IDCW,17.47
2006-11-23,102403,UTI PSU Fund-Income Option,14.95
2006-11-23,102404,UTI PSU Fund-Growth Option,16.47
2006-11-23,102409,Reliance Gilt Securities Fund-Long Term-P F -Plan-Automatic Capital Appreciation Payout,12.7268
2006-11-23,102410,Reliance Gilt Securities Fund-Long Term-P F -Plan-Defined Maturity Debt,12.7268
2006-11-23,102414,SBI CONTRA FUND - REGULAR PLAN -GROWTH,36.94
2006-11-23,102416,ICICI Prudential Fixed Maturity Plan - 1 Year-Series 12-Retail,11.2281
2006-11-23,102421,ICICI Prudential Fixed Maturity Plan - 1 Year-Series 12-Institutional,11.295
2006-11-23,102422,ICICI Prudential Fixed Maturity Plan - 1 Year-Series 12-Retail Dividend - 1,10.411
2006-11-23,102423,ICICI Prudential Fixed Maturity Plan - 1 Year-Series 12-Institutional Dividend - 1,10.4122
2006-11-23,102424,ICICI Prudential Fixed Maturity Plan - 1 Year-Series 12-Retail Growth - 1,10.411
2006-11-23,102425,ICICI Prudential Fixed Maturity Plan - 1 Year-Series 12-Institutional Growth - 1,10.4226
2006-11-23,102426,Principal Resurgent India Equity Fund-Growth,71.61
2006-11-23,102427,Principal Resurgent India Equity Fund-Dividend,18.67
2006-11-23,102428,Tata Value Fund Regular Plan - Payout of IDCW-Option B(10%),23.5743
2006-11-23,102431,Nippon India Pharma Fund-Growth Plan-Growth Option,19.9495
2006-11-23,102432,Nippon India Pharma Fund-Growth Plan-Bonus Option,19.9495
2006-11-23,102433,NIPPON INDIA PHARMA FUND - IDCW Option,18.7718
2006-11-23,102434,DSP India T.I.G.E.R. Fund - Regular Plan - Growth,32.093
2006-11-23,102435,DSP India T.I.G.E.R. Fund - Regular Plan - IDCW,22.736
2006-11-23,102441,Franklin India Liquid Fund - Institution-Growth,1141.2405
2006-11-23,102442,Franklin India Liquid Fund - Institutional Plan - Weekly - IDCW,1001.3869
2006-11-23,102443,Franklin India Liquid Fund - Institutional Plan - Daily - IDCW,1000.25
2006-11-23,102445,DSP BlackRock Savings Manager Fund - Conservative - Growth,11.8961
2006-11-23,102446,DSP BlackRock Savings Manager Fund - Conservative - Monthly Dividend,10.334
2006-11-23,102447,DSP BlackRock Savings Manager Fund - Conservative - Quarterly Dividend,10.4969
2006-11-23,102448,DSP Regular Savings Fund- Regular Plan - Growth,13.5707
2006-11-23,102450,DSP Regular Savings Fund - Regular Plan - IDCW - Monthly,10.6397
2006-11-23,102451,DSP Regular Savings Fund - Regular Plan - IDCW - Quarterly,11.001
2006-11-23,102452,HDFC Low Duration  Fund - Growth,15.8125
2006-11-23,102453,HDFC Low Duration  Fund - Weekly IDCW,10.0201
2006-11-23,102478,JM Mid Cap Fund-Dividend,16.61
2006-11-23,102479,JM Mid Cap Fund-Growth,21.68
2006-11-23,102480,JM Large Cap Fund-Dividend,13.05
2006-11-23,102481,JM Large Cap Fund-Growth,16.44
2006-11-23,102482,Sundaram India Leadership Fund-Growth,29.1513
2006-11-23,102483,Sundaram India Leadership Fund-Dividend,14.2212
2006-11-23,102491,UTI - GROWTH & VALUE FUND-ANNUAL DIVIDEND,22.92
2006-11-23,102494,UTI - GROWTH & VALUE FUND-GROWTH,56.73
2006-11-23,102495,UTI - GROWTH & VALUE FUND-SEMI ANNUAL DIVIDEND,16.0
2006-11-23,102496,UTI - INDIA ADVANTAGE EQUITY FUND-DIVIDEND,7.88
2006-11-23,102497,UTI - INDIA ADVANTAGE EQUITY FUND-GROWTH,7.88
2006-11-23,102503,SBI  SAVINGS FUND - REGULAR PLAN - GROWTH,11.3423
2006-11-23,102504,SBI Savings Fund - Regular Plan - Income Distribution cum Capital Withdrawal Option (IDCW),10.1109
2006-11-23,102505,SBI CREDIT RISK FUND - REGULAR PLAN - GROWTH,11.2607
2006-11-23,102506,SBI Credit Risk Fund - Regular Plan - Income Distribution cum Capital Withdrawal Option (IDCW),10.327
2006-11-23,102507,OLD-SBI Magnum Income Fund - F R P - Long Term - Inst. (G),11.3633
2006-11-23,102508,SBI Magnum Income Fund - F R P - Long Term - Inst. (D),10.4891
2006-11-23,102509,UTI Gilt Fund - Regular Plan - IDCW,10.6954
2006-11-23,102510,UTI - GILT FUND - Regular Plan - Growth Option,15.229
2006-11-23,102511,UTI - GILT FUND -Discontinued PF Plan -Dividend Option,10.6483
2006-11-23,102512,UTI - GILT FUND - Discontinued PF Plan - Growth Option,11.3258
2006-11-23,102513,UTI - GILT ADVANTAGE-LONG TERM PF-( PRESCRIBED APPRECIATION AUTO REDEMPTION,11.3426
2006-11-23,102514,UTI - GILT FUND - Discontinued PF Plan Prescribed Date Auto Redemption Option,11.3286
2006-11-23,102517,UTI - DYNAMIC EQUITY FUND-GROWTH,34.42
2006-11-23,102518,UTI - DYNAMIC EQUITY FUND-DIVIDEND,18.8
2006-11-23,102528,ICICI Prudential MidCap Fund - Growth,26.79
2006-11-23,102529,ICICI Prudential MidCap Fund - IDCW,21.76
2006-11-23,102530,ICICI Prudential MidCap Fund - Institutional Option - I,10.47
2006-11-23,102531,UTI Ultra Short Duration Fund - Regular Plan - Weekly IDCW (Reinvestment),1014.9533
2006-11-23,102532,UTI Ultra Short Duration Fund - Regular Plan - Growth Option,1192.371
2006-11-23,102533,UTI Conservative Hybrd Fund - Regular Plan - Monthly Payment Option,13.9159
2006-11-23,102534,UTI Conservative Hybrid Fund - Regular Plan - Flexi IDCW,13.9345
2006-11-23,102535,UTI Conservative Hybrid Fund - Regular Plan - Growth Option,13.9349
2006-11-23,102536,UTI Conservative Hybrid Fund - Regular Plan - Monthly IDCW,12.0914
2006-11-23,102538,UTI Low Duration Fund - Discontinued - Annaul Dividend Option,11.3561
2006-11-23,102539,UTI Low Duration Fund - Discontinued Bonus Option,12.4336
2006-11-23,102540,UTI Low Duration Fund - Discontinued Growth Option,18.6523
2006-11-23,102541,UTI Low Duration Fund - Discontinued - Quarterly Dividend Option,11.0135
2006-11-23,102545,UTI Low Duration Fund - Regular Plan - Bonus Option,11.4121
2006-11-23,102546,Franklin India Life Stage Fund Of Funds - 50's Plus Floating Rate Plan - IDCW,12.1909
2006-11-23,102547,Franklin India Life Stage Fund of Funds - The 50s Plus Flo (Gro),13.403
2006-11-23,102556,GFRF Long Term-Plan A-Growth,11.2428
2006-11-23,102557,GFRF Long Term-Plan A-Dividend Quarterly,10.2617
2006-11-23,102558,GFRF Long Term-Plan A-Dividend Annual,10.5213
2006-11-23,102559,GFRF Long Term-Plan A-Dividend Monthly,10.0485
2006-11-23,102560,GFRF Long Term-Plan B-Growth,11.2897
2006-11-23,102561,GFRF Long Term-Plan B-Dividend Quarterly,10.298
2006-11-23,102563,GFRF Long Term-Plan B-Dividend Monthly,10.0
2006-11-23,102564,GFRF Long Term-Plan B-Dividend Weekly,10.0
2006-11-23,102573,Kotak Multi Asset Omni FOF - Payout of Income Distribution cum capital withdrawal option,24.944
2006-11-23,102574,Kotak Multi Asset Omni FOF - Growth- Regular,24.944
2006-11-23,102577,DBS Chola Mid Cap Fund-Dividend,14.9
2006-11-23,102578,DBS Chola Mid Cap Fund-Cumulative,25.83
2006-11-23,102585,ICICI Prudential FMP-15 Month - Series 25-Retail Plan-Cumulative Option,11.2324
2006-11-23,102587,ICICI Prudential FMP-15 Month - Series 25-Institutional Plan-Cumulative Option,11.321
2006-11-23,102590,Kotak Savings Fund -Weekly Weekly Reinvestment of Income Distribution cum capital withdrawal option,10.0387
2006-11-23,102591,Kotak Savings Fund -Growth,11.3859
2006-11-23,102592,Kotak Savings Fund -Monthly Payout of Income Distribution cum capital withdrawal option,10.0199
2006-11-23,102594,ICICI Prudential Value Fund (erstwhile Value Discovery Fund) - Growth,26.93
2006-11-23,102595,ICICI Prudential Value Fund (erstwhile Value Discovery Fund) - IDCW,20.6
2006-11-23,102596,ICICI Prudential Value Discovery Fund - Institutional Option - I - Growth,11.4
2006-11-23,102619,ABN AMRO Flexi Debt Fund-Regular Plan-Growth Option,11.2478
2006-11-23,102620,ABN AMRO Flexi Debt Fund-Regular Plan-Quarterly Dividend Option,10.2154
2006-11-23,102621,ABN AMRO Flexi Debt Fund-Regular Plan-Half-Yearly Dividend Option,10.2095
2006-11-23,102622,ABN AMRO Flexi Debt Fund-Regular Plan-Daily Dividend Option,10.0007
2006-11-23,102623,ABN AMRO Flexi Debt Fund-Regular Plan-Weekly Dividend Option,10.0007
2006-11-23,102639,ABN AMRO  Equity Fund-Growth Plan,26.84
2006-11-23,102640,ABN AMRO  Equity Fund-Dividend Plan,20.39
2006-11-23,102641,ABN AMRO  Short Term Income Fund-Regular Plan-Growth Option,11.1997
2006-11-23,102642,ABN AMRO  Short Term Income Fund-Regular Plan-Monthly Dividend Option,10.0433
2006-11-23,102643,ABN AMRO  Short Term Income Fund-Regular Plan-Weekly Dividend Option,10.0
2006-11-23,102644,ABN AMRO  Short Term Income Fund-Institutional Plan-Growth Option,11.3109
2006-11-23,102645,ABN AMRO  Short Term Income Fund-Institutional Plan-Daily Dividend Option,10.0
2006-11-23,102646,ABN AMRO  Short Term Income Fund-Institutional Plan-Monthly Dividend Option,10.0452
2006-11-23,102647,ABN AMRO  Short Term Income Fund-Institutional Plan-Weekly Dividend Option,10.0
2006-11-23,102648,ABN AMRO  Short Term Income Fund-Institutional Plus Plan-Growth Option,10.7276
2006-11-23,102652,ABN AMRO  Monthly Income Plan-Regular Plan-Growth Option,12.5759
2006-11-23,102653,ABN AMRO  Monthly Income Plan-Regular Plan-Monthly Dividend Option,10.7638
2006-11-23,102654,ABN AMRO  Monthly Income Plan-Regular Plan-Quarterly Dividend Option,10.7668
2006-11-23,102659,DBS Chola Floating Rate Fund-Dividend,10.365
2006-11-23,102660,DBS Chola Floating Rate Fund-Cumulative,11.2601
2006-11-23,102661,BARODA CONSERVATIVE HYBRID FUND - Plan A - Growth Option,11.5767
2006-11-23,102662,BARODA CONSERVATIVE HYBRID FUND - Plan A - Monthly IDCW Option,11.5778
2006-11-23,102663,BARODA CONSERVATIVE HYBRID FUND - Plan A - Quarterly IDCW Option,11.5773
2006-11-23,102670,BARODA PIONEER CHILDREN FUND-GIFT PLAN,10.5022
2006-11-23,102672,Tata Liquid Fund -Regular Plan - Growth Option,11.3865
2006-11-23,102673,Nippon India Floater Fund - Growth Plan-Growth Option,11.353
2006-11-23,102675,NIPPON INDIA FLOATER FUND - MONTHLY IDCW Option,10.1207
2006-11-23,102676,NIPPON INDIA FLOATER FUND - DAILY IDCW REINVESTMENT Option,10.0618
2006-11-23,102677,NIPPON INDIA FLOATER FUND - WEEKLY IDCW Option,10.0884
2006-11-23,102682,Birla Sun Life Fixed Maturity Plan - Quarterly Series II-Dividend,10.1424
2006-11-23,102683,Birla Sun Life Fixed Maturity Plan - Quarterly Series II-Growth,11.4228
2006-11-23,102701,Sundaram Money Fund Institutional Plan - Daily Reinvestment of Income Distribution cum Capital Withdrawal (IDCW),10.0953
2006-11-23,102703,Sundaram Money Fund Institutional Plan - Growth,15.3649
2006-11-23,102704,Sundaram Money Fund Institutional Plan - Monthly Income Distribution cum Capital Withdrawal (IDCW),10.195
2006-11-23,102706,Sundaram Money Fund Institutional Plan - Weekly Reinvestment of Income Distribution cum Capital Withdrawal (IDCW),10.3365
2006-11-23,102711,ING Select Debt Fund-Growth Option,11.0574
2006-11-23,102712,ING Select Debt Fund-Quarterly Dividend Option,10.2011
2006-11-23,102713,ING Select Debt Fund-Half Yearly Dividend Option,10.2309
2006-11-23,102714,ING Select Debt Fund-Annual Dividend Option,10.3745
2006-11-23,102715,ING Select Debt Fund-Bonus Option,11.0574
2006-11-23,102716,ING Domestic Opportunities Fund-Growth Option,26.2
2006-11-23,102717,ING Domestic Opportunities Fund-Dividend Option,14.37
2006-11-23,102718,ING Domestic Opportunities Fund-Bonus Option,26.2
2006-11-23,102719,Principal Low Duration Fund - Growth,11.3604
2006-11-23,102720,Principal Floating Rate Fund - FMP-Weekly Dividend,10.0008
2006-11-23,102721,Principal Floating Rate Fund - FMP-Monthly Dividend,10.2495
2006-11-23,102722,Principal Low Duration Fund- Growth Option,11.3966
2006-11-23,102723,Principal Low Duration Fund - Weekly Income Distribution CUM Capital Withdrawal Option,10.0007
2006-11-23,102724,Principal Low Duration Fund- Monthly Income Distribution CUM Capital Withdrawal Option,10.1106
2006-11-23,102725,Principal Floating Rate Fund - SMP-Growth,11.3201
2006-11-23,102726,Principal Floating Rate Fund - SMP-Daily Dividend,10.0007
2006-11-23,102727,Principal Floating Rate Fund - SMP-Weekly Dividend,10.0007
2006-11-23,102728,Principal Floating Rate Fund - SMP-Monthly Dividend,10.169
2006-11-23,102729,Principal Credit Risk Fund - Regular Plan - Growth Option,11.3594
2006-11-23,102730,Principal Floating Rate Fund - SMP-Insti. Daily Dividend,10.0007
2006-11-23,102731,Principal Floating Rate Fund - SMP-Insti. Weekly Dividend,10.0007
2006-11-23,102732,Principal Credit Risk Fund - Regular Plan - Monthly Dividend Option,10.3007
2006-11-23,102733,Standard Chartered All Seasons Bond Fund-Plan A-Dividend - Quarterly,10.2801
2006-11-23,102734,Standard Chartered All Seasons Bond Fund-Plan A-Growth,11.1859
2006-11-23,102735,Standard Chartered All Seasons Bond Fund-Plan A-Dividend - Half Yearly,10.3145
2006-11-23,102736,Standard Chartered All Seasons Bond Fund-Plan A-Dividend - Annual,10.5929
2006-11-23,102741,ICICI Prudential Medium Term Bond Fund - Growth,11.2468
2006-11-23,102742,ICICI Prudential Medium Term Bond Fund - Dividend,10.1335
2006-11-23,102743,ICICI Prudential Medium Term Bond Fund-Plan B-Growth,11.3514
2006-11-23,102744,ICICI Prudential Medium Term Bond Fund-Plan B-Dividend,10.1522
2006-11-23,102751,Nippon India Consumption Fund-Growth Plan-Growth Option,21.6519
2006-11-23,102752,Nippon India Consumption Fund-Growth Plan-Bonus Option,21.6519
2006-11-23,102753,NIPPON INDIA CONSUMPTION FUND - IDCW Option,20.2679
2006-11-23,102754,Birla Sun Life Fixed Maturity Plan - Annual Series 1-Dividend,10.0899
2006-11-23,102755,Birla Sun Life Fixed Maturity Plan - Annual Series 1-Growth,11.3172
2006-11-23,102756,SBI FOCUSED FUND - REGULAR PLAN -GROWTH,29.02
2006-11-23,102760,HDFC Focused Fund - GROWTH PLAN,25.755
2006-11-23,102761,HDFC Focused Fund - IDCW PLAN,22.801
2006-11-23,102765,SBI Focused Fund - Regular Plan - Income Distribution cum Capital Withdrawal Option (IDCW),17.83
2006-11-23,102766,Aditya Birla Sun Life Dynamic Bond Fund -Regular - Quarterly IDCW,10.2018
2006-11-23,102767,Aditya Birla Sun Life Dynamic Bond Fund - Growth - Regular Plan,11.2517
2006-11-23,102798,ING Treasury Management Fund-Growth Option,11.2522
2006-11-23,102799,ING Treasury Management Fund-Weekly Dividend Option,10.2342
2006-11-23,102800,ING Treasury Management Fund-Quarterly Dividend Option,10.3018
2006-11-23,102801,ING Treasury Management Fund-Half Yearly Dividend Option,10.2648
2006-11-23,102802,ING Treasury Management Fund-Annual Dividend Option,10.5474
2006-11-23,102803,ING Treasury Management Fund-Bonus Option,11.2522
2006-11-23,102804,ING Treasury Management Fund-Daily Dividend Option,10.0138
2006-11-23,102805,Canara Robeco Nifty Index - Regular Plan - Growth,21.56
2006-11-23,102806,Canara Robeco Nifty Index - Regular Plan - Dividend,21.56
2006-11-23,102807,Principal Dividend Yield Fund-Growth Plan,15.81
2006-11-23,102808,Principal Dividend Yield Fund- Half Yearly Income Distribution CUM Capital Withdrawal Plan,12.88
2006-11-23,102813,LIC NOMURA MF Floater MIP - Monthly Dividend,10.2895
2006-11-23,102814,LIC NOMURA MF Floater MIP - Quarterly Dividend,10.3988
2006-11-23,102815,LIC NOMURA MF Floater MIP - Yearly Dividend,10.9219
2006-11-23,102816,LIC NOMURA MF Floater MIP - Growth,12.4739
2006-11-23,102823,SBI HEALTHCARE OPPORTUNITIES FUND - REGULAR PLAN -GROWTH,35.1
2006-11-23,102827,HSBC Floating Rate Fund - Long Term - Regular - Growth,11.1679
2006-11-23,102828,HSBC Floating Rate Fund - Long Term - Regular - Dividend - Monthly,10.0444
2006-11-23,102829,HSBC Floating Rate Fund - Long Term - Growth,11.2132
2006-11-23,102830,HSBC Floating Rate Fund - Long Term - Dividend - Weekly,10.292
2006-11-23,102831,HSBC Floating Rate Fund - Long Term - Dividend - Monthly,10.0881
2006-11-23,102832,HSBC Floating Rate Fund - Short Term - Regular - Growth,11.1855
2006-11-23,102833,HSBC Floating Rate Fund - Short Term - Regular - Dividend - Daily,10.0
2006-11-23,102834,HSBC Floating Rate Fund - Short Term - Regular - Dividend - Weekly,10.0126
2006-11-23,102835,HSBC Floating Rate Fund - Short Term - Inst. - Growth,11.2306
2006-11-23,102836,HSBC Floating Rate Fund - Short Term - Inst. - Dividend - Daily,10.0132
2006-11-23,102837,HSBC Floating Rate Fund - Short Term - Inst. - Dividend - Weekly,10.0313
2006-11-23,102838,HSBC Floating Rate Fund - Short Term - Inst. - Dividend - Monthly,10.0671
2006-11-23,102839,HSBC Floating Rate Fund - Short Term - Inst. Plus - Growth,10.6416
2006-11-23,102840,HSBC Floating Rate Fund - Short Term - Inst. Plus - Dividend - Daily,10.0262
2006-11-23,102846,Nippon India Balanced Advantage Fund-Growth Plan-Growth Option,24.1554
2006-11-23,102847,Nippon India Balanced Advantage Fund-Growth Plan-Bonus Option,24.1554
2006-11-23,102848,NIPPON INDIA BALANCED ADVANTAGE FUND - IDCW Option,22.8952
2006-11-23,102849,Nippon India Dynamic Bond Fund-Growth Plan-Growth Option,11.0753
2006-11-23,102851,NIPPON INDIA DYNAMIC BOND FUND - IDCW Option,11.0753
2006-11-23,102855,Birla Sun Life Fixed Maturity Plan - Annual  Series 3-Dividend,10.0
2006-11-23,102856,Birla Sun Life Fixed Maturity Plan - Annual  Series 3-Growth,11.36
2006-11-23,102858,Tata Dividend Yield Fund  Regular Plan -( Div),14.2479
2006-11-23,102859,Tata Dividend Yield Fund Regular Plan,17.344
2006-11-23,102860,SBI Savings Fund - Regular Plan Weekly Income Distribution cum Capital Withdrawal Option (IDCW),10.1975
2006-11-23,102867,Kotak Flexi-Debt - Regular Plan - Dividend,10.1911
2006-11-23,102868,Kotak Flexi-Debt - Regular Plan - Growth,11.3248
2006-11-23,102869,Kotak Flexi-Debt- Regular Plan - Daily Dividend,10.0311
2006-11-23,102870,Z-OLD-SBI Magnum Inst. Income Fund -  Savings - Wkly(D)(Upto 22/03/07) Renamed as SBI Premier Liquid Fund,10.5716
2006-11-23,102874,Kotak-Small Cap Fund - Payout of Income Distribution cum capital withdrawal option,14.247
2006-11-23,102875,Kotak-Small Cap Fund - Growth,18.569
2006-11-23,102883,Franklin India Large & Mid Cap Fund - Growth Plan,20.69
2006-11-23,102884,Franklin India Large & Mid Cap Fund - IDCW,18.35
2006-11-23,102885,SBI EQUITY HYBRID FUND - REGULAR PLAN -Growth,35.11
2006-11-23,102896,Principal Focussed Advantage Fund-Dividend,16.24
2006-11-23,102897,Principal Focussed Advantage Fund-Growth,16.25
2006-11-23,102900,LIC NOMURA MF Opportunities Fund-Dividend,11.5349
2006-11-23,102901,LIC NOMURA MF Opportunities Fund-Growth,16.6242
2006-11-23,102902,JM Equity & Derivative Fund-Growth-growth option,11.2172
2006-11-23,102903,JM Equity & Derivative Fund-Dividend-dividend option,10.3856
2006-11-23,102904,JM Equity & Derivative Fund-Bonus-Bonus option,10.3868
2006-11-23,102905,Reliance Index Fund-Sensex Plan-Growth Option,20.1426
2006-11-23,102906,Reliance Index Fund-Sensex Plan-Bonus Option,20.1426
2006-11-23,102907,Reliance Index Fund-Sensex Plan-Dividend Option,20.1426
2006-11-23,102908,Reliance Index Fund-Nifty Plan-Growth Option,15.9042
2006-11-23,102909,Reliance Index Fund-Nifty Plan-Bonus Option,15.9042
2006-11-23,102910,Reliance Index Fund-Nifty Plan-Dividend Option,15.9042
2006-11-23,102913,CANARA ROBECO SAVINGS FUND - REGULAR PLAN - GROWTH OPTION,11.1449
2006-11-23,102914,CANARA ROBECO SAVINGS FUND - REGULAR PLAN - IDCW (Payout/Reinvestment),10.7187
2006-11-23,102915,CANARA ROBECO SAVINGS FUND - REGULAR PLAN - WEEKLY IDCW (Payout/Reinvestment),10.26
2006-11-23,102920,CANARA ROBECO LARGE AND MID CAP FUND - REGULAR PLAN - GROWTH OPTION,15.6
2006-11-23,102921,CANARA ROBECO LARGE AND MID CAP FUND - REGULAR PLAN - IDCW (Payout/Reinvestment),13.3
2006-11-23,102922,Canara Robeco Large and Mid Cap Fund -BONUS OPTION,15.6
2006-11-23,102929,Tata Service Industries Fund - Dividend,18.7111
2006-11-23,102930,Tata Service Industries Fund - Appreciation,18.6467
2006-11-23,102931,ING Midcap Fund-Growth Option,16.77
2006-11-23,102932,ING Midcap Fund-Dividend Option,15.34
2006-11-23,102933,ING Midcap Fund-Bonus Option,16.77
2006-11-23,102941,SBI MIDCAP FUND - REGULAR PLAN - GROWTH,21.28
2006-11-23,102942,SBI Midcap Fund - Regular Plan - Income Distribution cum Capital Withdrawal Option (IDCW),18.29
2006-11-23,102947,HDFC Hybrid Equity Fund - IDCW Plan,16.157
2006-11-23,102948,HDFC Hybrid Equity Fund - Growth Plan,18.178
2006-11-23,102951,ABN  AMRO Opportunities Fund-Growth,20.271
2006-11-23,102952,ABN  AMRO Opportunities Fund-Dividend,17.447
2006-11-23,102957,ICICI Prudential Multicap Fund - Institutional Option - I,20.91
