date,scheme_code,scheme_name,nav
2007-02-02,100027,Grindlays Super Saver Income Fund-GSSIF-Half Yearly Dividend,10.3525
2007-02-02,100028,Grindlays Super Saver Income Fund-GSSIF-Quaterly Dividend,10.2654
2007-02-02,100029,Grindlays Super Saver Income Fund-GSSIF-Growth,16.8343
2007-02-02,100030,Grindlays Super Saver Income Fund-GSSIF-Annual Dividend,10.5798
2007-02-02,100031,Grindlays Super Saver Income Fund-GSSIF - ST-Dividend,10.019
2007-02-02,100032,Grindlays Super Saver Income Fund-GSSIF - ST-Growth,14.6758
2007-02-02,100033,Aditya Birla Sun Life Large & Mid Cap Fund - Regular Growth,130.66
2007-02-02,100034,Aditya Birla Sun Life Large & Mid Cap Fund -Regular - IDCW,93.73
2007-02-02,100035,Birla Sun Life Freedom Fund-Plan A (Dividend),19.03
2007-02-02,100036,Birla Sun Life Freedom Fund-Plan B (Growth),28.62
2007-02-02,100037,Aditya Birla Sun Life Income Fund - Regular - Quarterly IDCW,10.2145
2007-02-02,100038,Aditya Birla Sun Life Income Fund - Growth - Regular Plan,30.475
2007-02-02,100041,Aditya Birla Sun Life Liquid Fund -Institutional - IDCW,10.8023
2007-02-02,100042,Aditya Birla Sun Life Liquid Fund-Retail (Growth),19.9104
2007-02-02,100043,Aditya Birla Sun Life Liquid Fund-Institutional (Growth),20.0481
2007-02-02,100044,Aditya Birla Sun Life Liquid Fund -Retail - IDCW,16.3694
2007-02-02,100046,Aditya Birla Sun Life Liquid Fund -Daily IDCW,10.0195
2007-02-02,100047,Aditya Birla Sun Life Liquid Fund - Growth,11.7736
2007-02-02,100048,Aditya Birla Sun Life Liquid Fund -Institutional - weekly  IDCW,10.8068
2007-02-02,100049,Aditya Birla Sun Life Cash Plus-Institutional - Fortnightly Dividend,10.837
2007-02-02,100051,Aditya Birla Sun Life Liquid Fund -weekly IDCW,10.0225
2007-02-02,100052,Aditya Birla Sun Life Cash Plus-Institutional Premium - Fortnightly Dividend,10.0736
2007-02-02,100053,Aditya Birla Sun Life Cash Plus-Institutional Premium Plan-Monthly Dividend,10.0042
2007-02-02,100054,Aditya Birla Sun Life Gilt Plus - Liquid Plan - Quarterly Dividend - Regular Plan,10.7319
2007-02-02,100055,Aditya Birla Sun Life Gilt Plus - Liquid Plan - Growth - Regular Plan,18.0525
2007-02-02,100056,Aditya Birla Sun Life Gilt Plus - Liquid Plan - Annual Dividend - Regular Plan,12.0211
2007-02-02,100057,Aditya Birla Sun Life Govenment Securities Fund -Regular - Quarterly IDCW,10.6954
2007-02-02,100058,Aditya Birla Sun Life Government Securities Fund  - Growth - Regular Plan,20.825
2007-02-02,100059,Aditya Birla Sun Life Gilt Plus-PF Plan (Annual Dividend),20.8257
2007-02-02,100060,Aditya Birla Sun Life Constant Maturity 10 Year Gilt Fund - Quarterly Dividend - Regular Plan,11.2707
2007-02-02,100061,Aditya Birla Sun Life Constant Maturity 10 Year Gilt Fund - Growth - Regular Plan,23.4874
2007-02-02,100062,Aditya Birla Sun Life Gilt Plus-Regular Plan (Annual Dividend),23.5354
2007-02-02,100063,Aditya Birla Sun Life MNC Fund - Regular - IDCW,64.28
2007-02-02,100064,Aditya Birla Sun Life MNC Fund - Growth - Regular Plan,128.24
2007-02-02,100065,Aditya Birla Sun Life India Opportunities Fund - Dividend - Regular Plan,23.59
2007-02-02,100066,Aditya Birla Sun Life India Opportunities Fund - Growth - Regular Plan,54.91
2007-02-02,100067,Aditya Birla Sun Life Tax Plan -Regular - IDCW,60.4
2007-02-02,100068,BARODA ELSS 96 - Plan A - IDCW,27.09
2007-02-02,100069,BARODA PIONEER DIVERSIFIED FUND,31.97
2007-02-02,100077,DSP Bond Fund - IDCW,10.6723
2007-02-02,100078,DSP Bond Fund - Growth,24.8824
2007-02-02,100079,DSP Bond Fund - IDCW - Monthly,10.3869
2007-02-02,100080,DSP Flexi Cap Fund - Regular Plan - IDCW,41.045
2007-02-02,100081,DSP Aggressive Hybrid Fund- Regular Plan - Growth,39.84
2007-02-02,100082,DSP Aggressive Hybrid Fund- Regular Plan - IDCW,23.112
2007-02-02,100084,DSP Gilt Fund - Regular Plan - Growth,23.177
2007-02-02,100085,DSP Gilt Fund - Regular Plan - IDCW,11.5514
2007-02-02,100086,DSP Gilt Fund - Regular Plan - IDCW - Monthly,10.1696
2007-02-02,100087,DSP Savings Fund - Regular Plan - Growth,16.8272
2007-02-02,100088,DSP Savings Fund - Regular Plan - IDCW,11.1011
2007-02-02,100089,DSP Savings Fund - Regular Plan - IDCW - Monthly,10.1047
2007-02-02,100090,DSP BlackRock Technology.com   Fund - Regular Plan - Growth,25.923
2007-02-02,100119,HDFC Balanced Advantage Fund - Growth Plan,49.733
2007-02-02,100120,HDFC Balanced Advantage Fund - IDCW Plan,26.997
2007-02-02,100121,HDFC Balanced Fund - Dividend Option,18.154
2007-02-02,100122,HDFC Balanced Fund - Growth Option,32.135
2007-02-02,100123,HDFC Income Fund - Quarterly IDCW Option,10.2091
2007-02-02,100124,HDFC Income Fund - Growth Option,16.6999
2007-02-02,100150,Principal Child Benefit Fund-Super Saver-Future Guard Plan,58.02
2007-02-02,100151,Principal Retail Equity Savings Fund - Growth Option,58.79
2007-02-02,100152,Principal Nifty 100 Equal Weight Fund-Income Distribution CUM Capital Withdrawal,23.0586
2007-02-02,100153,Principal Nifty 100 Equal Weight Fund-Growth,29.8222
2007-02-02,100156,Principal Tax Savings Fund,80.63
2007-02-02,100171,Quant Dynamic Bond-Dividend,10.1245
2007-02-02,100172,Quant Dynamic Bond-Growth,22.6211
2007-02-02,100173,Quant Dynamic Bond-Bonus,11.9149
2007-02-02,100174,quant ELSS Tax Saver Fund - IDCW Option - Regular Plan,16.1103
2007-02-02,100175,quant ELSS Tax Saver Fund - Growth Option - Regular Plan,45.7506
2007-02-02,100176,quant Small Cap Fund - IDCW Option - Regular Plan,17.1649
2007-02-02,100177,quant Small Cap Fund - Growth - Regular Plan,20.3345
2007-02-02,100178,ING Income Fund-Regular Plan -Dividend Option (Quarterly),10.1918
2007-02-02,100179,ING Income Fund-Regular Plan -Dividend Option (Half Yearly),10.3396
2007-02-02,100180,ING Income Fund- Regular Plan - Dividend Option (Annual),10.6813
2007-02-02,100181,ING Income Fund-Regular Plan -Growth Option,18.1572
2007-02-02,100182,ING Income Fund-Institutional Plan - Dividend Option (Half Yearly),10.0
2007-02-02,100183,ING Income Fund-Institutional Plan - Dividend Option (Quarterly),10.0
2007-02-02,100184,ING Income Fund-Institutional Plan -Dividend Option (Annual),10.7084
2007-02-02,100185,ING Income Fund-Bonus Option,11.0709
2007-02-02,100186,ING Income Fund-Institutional Bonus Option,11.3099
2007-02-02,100187,ING Income Fund-Institutional Plan - Growth Option,18.893
2007-02-02,100188,ING Core Equity Fund-Dividend Option,15.02
2007-02-02,100189,ING Core Equity Fund-Growth Option,28.42
2007-02-02,100190,ING Liquid Fund-Regular Growth Option,15.6821
2007-02-02,100191,ING Liquid Fund-Regular Weekly Dividend Option,10.8328
2007-02-02,100192,ING Liquid Fund-Regular Daily Dividend Option,10.7854
2007-02-02,100194,ING Liquid Fund-Auto Sweep Growth Option,10.0
2007-02-02,100195,ING Liquid Fund-Auto Sweep Weekly Dividend Option,10.0
2007-02-02,100196,ING Liquid Fund-Institutional Growth Option,11.6294
2007-02-02,100197,ING Liquid Fund-Institutional Weekly Dividend Option,10.0622
2007-02-02,100198,ING Liquid Fund-Institutional Daily Dividend Option,10.0107
2007-02-02,100199,ING Liquid Fund-Super Institutional Growth Option,11.0068
2007-02-02,100200,ING Liquid Fund-Super Institutional Daily Dividend Option,10.0032
2007-02-02,100201,ING Liquid Fund-Super Institutional Weekly Dividend Option,10.0928
2007-02-02,100202,ING Balanced Fund-Dividend Option,13.18
2007-02-02,100203,ING Balanced Fund-Growth Option,18.83
2007-02-02,100218,JM Large Cap Fund (Regular) - IDCW,17.96
2007-02-02,100219,JM Large Cap Fund (Regular) - Growth Option,39.96
2007-02-02,100220,JM Aggressive Hybrid Fund (Regular) - IDCW,18.35
2007-02-02,100221,JM Aggressive Hybrid Fund (Regular) -Growth Option,24.14
2007-02-02,100222,JM Medium to Long Duration Fund (Regular) - Quarterly IDCW,10.3177
2007-02-02,100223,JM Medium to Long Duration Fund (Regular) - Growth Option,28.5999
2007-02-02,100233,JM Liquid Fund (Regular) - Weekly IDCW,10.391
2007-02-02,100234,JM Liquid Fund - Growth Option,20.3299
2007-02-02,100237,JM High Liquidity Fund-- Institutional Plan - Growth,12.2653
2007-02-02,100238,JM High Liquidity Fund-Institutional Plan - Daily Dividend,10.0159
2007-02-02,100241,JM High Liquidity Fund-- Institutional Plan - Dividend,10.1558
2007-02-02,100243,JM High Liquidity Fund-- Premium Plan - Daily Dividend Option,10.0
2007-02-02,100244,JM Liquid Fund (Regular) - Quarterly IDCW,11.7054
2007-02-02,100245,JM High Liquidity Fund-Super Institutional Plan- Daily Dividend,10.0165
2007-02-02,100246,JM High Liquidity Fund-Super Institutional Plan- Weekly  Dividend,10.1436
2007-02-02,100247,JM Liquid Fund (Regular) - Super Institutional Plan - Growth Option,11.6629
2007-02-02,100249,JM G-Sec Fund - Quarterly Dividend Option,10.3129
2007-02-02,100250,JM G-Sec Fund - Growth Option,21.0945
2007-02-02,100251,JM G-Sec Fund-PF Plan - Growth Plan,22.0706
2007-02-02,100252,JM G-Sec Fund-PF Plan -Dividend Plan,20.2233
2007-02-02,100253,JM G-Sec Fund - Bonus Option - Principal Units,10.2612
2007-02-02,100254,JM Value Fund (Regular) - Growth Option,20.6
2007-02-02,100261,Kotak Gilt-Savings-Monthly Dividend,10.4541
2007-02-02,100262,Kotak Gilt-Savings-Growth,18.0287
2007-02-02,100263,Kotak Gilt-Savings-Annual Dividend,12.0563
2007-02-02,100264,Kotak Gilt-Investment Regular-Payout of Income Distribution cum capital withdrawal option,11.3842
2007-02-02,100265,Kotak Gilt-Investment Regular-Growth,23.6669
2007-02-02,100280,Kotak Gilt-Investment  Provident Fund and Trust-Payout of Income Distribution cum capital withdrawal option,10.8181
2007-02-02,100281,Kotak Gilt-Investment  Provident Fund and Trust-Growth,23.9645
2007-02-02,100286,Kotak Aggressive Hybrid Fund - Regular Plan - IDCW - Payout & Reinvestment of Income Distribution cum capital withdrawal option,24.439
2007-02-02,100289,Kotak Tech,11.149
2007-02-02,100290,Kotak MNC,27.798
2007-02-02,100291,Kotak Bond-Deposit-Dividend,11.7494
2007-02-02,100292,Kotak Bond-Deposit-Growth,18.5905
2007-02-02,100298,Kotak Bond Regular Plan Quaterly Payout of Income Distribution cum capital withdrawal option,10.4249
2007-02-02,100299,Kotak Bond Fund - Regular Plan Growth,19.5062
2007-02-02,100300,Kotak Bond Fund - Regular Plan - Standard IDCW Option,13.0362
2007-02-02,100301,Kotak Bond Regular Plan Bonus Plan,13.0019
2007-02-02,100312,LIC MF Flexi Cap Fund-Regular Plan-IDCW,12.4651
2007-02-02,100313,LIC MF Flexi Cap Fund-Regular Plan-Growth,22.5309
2007-02-02,100314,LIC MF Medium to Long Duration Fund-Regular Plan-IDCW,10.1795
2007-02-02,100315,LIC MF Medium to Long Duration Fund-Regular Plan-Growth,19.9219
2007-02-02,100316,LIC MF Gilt Fund-Regular Plan-IDCW,10.9679
2007-02-02,100317,LIC MF Gilt Fund-Regular Plan-Growth,18.8714
2007-02-02,100318,LIC MF Gilt Fund-PF Plan-IDCW,10.882
2007-02-02,100319,LIC MF Gilt Fund-PF Plan-Growth,10.882
2007-02-02,100321,LIC MF Aggressive Hybrid Fund-Regular Plan-IDCW,11.0824
2007-02-02,100323,LIC MF Aggressive Hybrid Fund-Regular Plan-Growth,46.8194
2007-02-02,100325,LIC MF ULIS (5 Yrs. Single Premium)-Regular Plan-IDCW Reinvestment,11.1522
2007-02-02,100332,LIC MF Large Cap Fund-Regular Plan-IDCW,11.2678
2007-02-02,100337,SaharaTax Gain-Dividend,18.9649
2007-02-02,100338,SaharaTax Gain-Growth,21.711
2007-02-02,100347,Morgan Stanley Growth Fund- Regular Growth Plan,53.0
2007-02-02,100348,ICICI Prudential Large & Mid Cap Fund - IDCW,23.73
2007-02-02,100349,ICICI Prudential Large & Mid Cap Fund - Growth,96.9
2007-02-02,100350,ICICI Prudential Large & Mid Cap Fund - Institutional Option - I - Growth,12.86
2007-02-02,100351,ICICI Prudential FMCG Fund - IDCW,33.2
2007-02-02,100352,ICICI Prudential FMCG Fund - Growth,41.73
2007-02-02,100353,ICICI Prudential ELSS Tax Saver Fund - IDCW,27.79
2007-02-02,100354,ICICI Prudential ELSS Tax Saver Fund - Growth,94.41
2007-02-02,100355,ICICI Prudential Equity & Debt Fund - Monthly IDCW,18.73
2007-02-02,100356,ICICI Prudential Equity & Debt Fund - Growth,35.92
2007-02-02,100357,ICICI Prudential Liquid Fund -Quarterly IDCW,10.7988
2007-02-02,100359,ICICI Prudential Liquid Institutional Plus Fund - Div - Daily,11.8515
2007-02-02,100360,ICICI Prudential Liquid Institutional Plus Fund - Div - Weekly,11.8637
2007-02-02,100361,ICICI Prudential Liquid Fund-Dividend-Institutional Plus - Monthly,11.9248
2007-02-02,100362,ICICI Prudential Liquid Institutional Plus Fund - Growth,18.3757
2007-02-02,100363,ICICI Prudential Technology Fund - Growth,16.62
2007-02-02,100364,ICICI Prudential Long Term Bond Fund - Half Yearly IDCW,10.6102
2007-02-02,100365,ICICI Prudential Long Term Bond Fund - Growth,21.5862
2007-02-02,100366,ICICI Prudential Long Term Bond Fund-Institutional Quarterly Dividend,10.216
2007-02-02,100367,ICICI Prudential Long Term Bond Fund - Quarterly IDCW,11.0379
2007-02-02,100368,ICICI Prudential Gilt Fund - IDCW,10.5952
2007-02-02,100369,ICICI Prudential Gilt Fund - Growth,22.398
2007-02-02,100370,ICICI Prudential Short Term Gilt Fund - Dividend,10.5342
2007-02-02,100371,ICICI Prudential Short Term Gilt Fund - Growth,17.9038
2007-02-02,100372,ICICI Prudential Short Term Gilt Fund - Half Yearly Dividend,10.1256
2007-02-02,100375,NIPPON INDIA GROWTH MID CAP FUND - IDCW Option,60.08
2007-02-02,100376,Nippon India Growth Mid Cap Fund-Growth Plan-Bonus Option,46.6
2007-02-02,100377,Nippon India Growth Mid Cap Fund-Growth Plan-Growth Option,281.08
2007-02-02,100378,Nippon India Vision Large & Midcap Fund - IDCW Option,48.0
2007-02-02,100379,Nippon India Vision Large & Midcap Fund-GROWTH PLAN-Bonus Option,31.51
2007-02-02,100380,Nippon India Vision Large & Midcap Fund-GROWTH PLAN-Growth Option,188.01
2007-02-02,100381,UTI Large Cap Fund-Income Option,18.02
2007-02-02,100382,UTI Large Cap Fund-Growth Option,20.67
2007-02-02,100383,NIPPON INDIA MEDIUM TO LONG DURATION FUND - MONTHLY IDCW Option,11.0119
2007-02-02,100384,NIPPON INDIA MEDIUM TO LONG DURATION  FUND - QUARTERLY IDCW Option,11.9164
2007-02-02,100385,NIPPON INDIA MEDIUM TO LONG DURATION  FUND - HALF YEARLY IDCW Option,11.3469
2007-02-02,100386,NIPPON INDIA MEDIUM TO LONG DURATION  FUND - ANNUAL IDCW Option,12.0716
2007-02-02,100387,Nippon India Medium to Long Duration  Fund - Growth Plan Growth Option,23.2406
2007-02-02,100388,Nippon India Medium to Long Duration  Fund - Growth Plan Bonus Option,10.9503
2007-02-02,100414,Tata Aggressive Hybrid Fund- Regular Plan - Growth Option,51.6897
2007-02-02,100415,Tata Ethical Fund-Regular Plan - Growth Option,51.2255
2007-02-02,100416,Tata Long Term Debt Fund - Regular Plan - Quarterly Dividend,10.3865
2007-02-02,100417,Tata Income Fund-Regular Plan - Half Yearly Payout of IDCW Option,10.9431
2007-02-02,100418,Tata Income Fund -Regular Plan - Growth Option,24.8876
2007-02-02,100470,Franklin India Large Cap Fund - IDCW,45.5
2007-02-02,100471,Franklin India Large Cap Fund-Growth,137.18
2007-02-02,100472,Franklin India Mid Cap Fund - IDCW,60.56
2007-02-02,100473,Franklin India Mid Cap Fund-Growth,217.5
2007-02-02,100474,Tata ELSS Fund- Regular Plan - Payout of IDCW Option,44.9071
2007-02-02,100475,Tata Large Cap Fund -Regular Plan - Growth Option,64.0125
2007-02-02,100476,Taurus Flexi Cap Fund - Regular Plan - Growth,43.06
2007-02-02,100477,Taurus Mid Cap Fund - Regular Plan - Growth,17.11
2007-02-02,100480,Taurus ELSS Tax Saver Fund - Regular Plan - Growth,18.52
2007-02-02,100481,Franklin India Balanced Fund-Growth,36.8
2007-02-02,100482,Franklin India Balanced Fund-Div,31.81
2007-02-02,100483,Franklin India Growth Fund,31.55
2007-02-02,100484,Franklin India Index Fund- NSE Nifty 50 Index Fund - Growth,33.2832
2007-02-02,100485,Franklin India Govt.Sec. Fund-Composite Plan - Growth,24.328
2007-02-02,100486,Franklin India Govt.Sec. Fund-Composite Plan - Dividend,10.8323
2007-02-02,100487,Franklin India Govt.Sec. Fund-Treasury Plan(Dividend Option),10.7235
2007-02-02,100489,Franklin India Govt.Sec. Fund-Treasury Plan(Growth Option),13.8758
2007-02-02,100490,Franklin India Govt.Sec. Fund-PF Plan - Growth,10.6857
2007-02-02,100491,Franklin India Govt.Sec. Fund-PF Plan - Dividend,10.6857
2007-02-02,100493,Franklin India Government Securities Fund - Growth,16.6299
2007-02-02,100494,Franklin India Government Securities Fund - IDCW,10.8595
2007-02-02,100495,Franklin India Govt.Sec. Fund-Long Term Plan - Bonus,12.1671
2007-02-02,100496,Templeton India Value Fund - Growth Plan,69.89
2007-02-02,100497,Templeton India Value Fund - IDCW,41.33
2007-02-02,100498,Franklin India Dynamic Accrual Fund - IDCW,10.5046
2007-02-02,100499,Franklin India Dynamic Accrual Fund-Growth,25.6935
2007-02-02,100503,Franklin India Low Duration Fund - Monthly - IDCW,10.2575
2007-02-02,100504,Franklin India Low Duration Fund - Quarterly - IDCW,10.2372
2007-02-02,100505,Templeton Monthly Income Plan-Half Yearly Dividend,12.4105
2007-02-02,100506,Templeton Monthly Income Plan-Growth,20.0096
2007-02-02,100519,Franklin India Flexi Cap Fund - IDCW,36.16
2007-02-02,100520,Franklin India Flexi Cap Fund - Growth,146.15
2007-02-02,100521,Franklin India Technology Fund - IDCW,26.91
2007-02-02,100522,Franklin India Technology Fund-Growth,57.84
2007-02-02,100523,Franklin FMCG Fund - Growth,35.61
2007-02-02,100524,Franklin INDIA OPPORTUNITIES FUND - IDCW,16.26
2007-02-02,100525,Franklin India ELSS Tax Saver Fund - IDCW,33.57
2007-02-02,100526,Franklin India ELSS Tax Saver Fund-Growth,132.58
2007-02-02,100527,Franklin India Corporate Debt Fund - Plan A - Annual - IDCW,10.6724
2007-02-02,100528,Franklin India Corporate Debt Fund - Growth,25.0353
2007-02-02,100529,Franklin India Corporate Debt Fund - Plan B - Monthly - IDCW,13.6242
2007-02-02,100530,Franklin India Corporate Debt Fund - Plan B - Quarterly - IDCW,13.8673
2007-02-02,100531,Franklin India Corporate Debt Fund - Plan B - Half yearly - IDCW,14.0564
2007-02-02,100532,Franklin India Corporate Debt Fund - Monthly Bonus,19.2624
2007-02-02,100535,Franklin India Retirement Fund - IDCW,17.2038
2007-02-02,100536,Franklin India Retirement Fund - Growth,44.7603
2007-02-02,100537,Franklin India Liquid Fund - Regular Plan - Weekly - IDCW,1245.5561
2007-02-02,100538,Franklin India Liquid Fund - Regular Plan - Growth,1840.2737
2007-02-02,100541,Franklin India Liquid Fund - Regular Plan - Daily - IDCW,1512.34
2007-02-02,100542,Franklin India Liquid Fund - Liquid Plan - Weekly Dividend,1001.5338
2007-02-02,100543,Franklin India Liquid Fund - Liquid Plan - Daily IDCW,1000.25
2007-02-02,100544,Franklin India Liquid Fund - Liquid Plan - Growth,1132.2787
2007-02-02,100546,Franklin India Liquid Fund - Super Institutional Plan - Growth,1093.9277
2007-02-02,100547,Franklin India Liquid Fund - Super Institutional Plan - Daily - IDCW,1000.25
2007-02-02,100548,Franklin India Liquid Fund - Super Institutional Plan - Weekly - IDCW,1017.2094
2007-02-02,100549,Franklin India Aggressive Hybrid Fund - IDCW,24.2686
2007-02-02,100550,Franklin India Aggressive Hybrid Fund - Growth Plan,34.0752
2007-02-02,100551,Templeton India Children’s Asset Plan-Education Plan,25.6627
2007-02-02,100552,Templeton India Children’s Asset Plan-Gift Plan - Growth,31.6733
2007-02-02,100553,Templeton India Children’s Asset Plan-Gift Plan - Dividend,31.6733
2007-02-02,100556,Franklin India Taxshield 97,125.12
2007-02-02,100557,Franklin India Taxshield 98,126.46
2007-02-02,100558,Franklin India Taxshield 99,75.88
2007-02-02,100561,Templeton India Money Market Account - Bonus Plan,1.0
2007-02-02,100563,DBS Chola Triple Ace-Regular -Cumulative,23.9469
2007-02-02,100567,DBS Chola Triple Ace-Regular - Quarterly Dividend,11.2752
2007-02-02,100569,DBS Chola Triple Ace-Semi Annual Dividend,11.5879
2007-02-02,100573,DBS Chola Triple Ace-Regular Bonus,13.3058
2007-02-02,100574,DBS Chola Freedom Income -Short Term Fund-Regular-Monthly Dividend,10.9425
2007-02-02,100575,DBS Chola Freedom Income -Short Term Fund-Regular - Cumulative,11.7467
2007-02-02,100576,DBS Chola Freedom Income -Short Term Fund-Cum- Institutional Plan,11.8879
2007-02-02,100579,DBS Chola Gilt-Investment-Quarterly Dividend,10.2965
2007-02-02,100580,DBS Chola Gilt-Investment-Cumulative,18.7204
2007-02-02,100589,Canara Robeco Expo-Income Plan,21.16
2007-02-02,100590,Canara Robeco Expo-Growth Plan,55.6
2007-02-02,100593,CANARA ROBECO ELSS TAX SAVER - REGULAR PLAN -IDCW (Payout),23.31
2007-02-02,100596,CANARA ROBECO GILT FUND - REGULAR PLAN - IDCW (Payout/Reinvestment),10.4571
2007-02-02,100597,CANARA ROBECO GILT FUND - REGULAR PLAN - GROWTH OPTION,18.3225
2007-02-02,100600,CANARA ROBECO CONSERVATIVE HYBRID FUND - REGULAR PLAN - MONTHLY IDCW (Payout/Reinvestment),11.88
2007-02-02,100601,CANARA ROBECO CONSERVATIVE HYBRID FUND - REGULAR PLAN - GROWTH OPTION,19.61
2007-02-02,100602,Sundaram Medium Duration Fund (Formerly Known as Sundaram Medium Term Bond Fund) Regular Plan-Income Distribution cum Capital Withdrawal(IDCW),10.1818
2007-02-02,100603,Sundaram Medium Duration Fund (Formerly Known as Sundaram Medium Term Bond Fund) Regular Plan - Growth,22.696
2007-02-02,100604,Sundaram Medium Duration Fund (Formerly Known as Sundaram Medium Term Bond Fund) Regular Plan -Growth,11.9466
2007-02-02,100609,Sundaram Medium Duration Fund (Formerly Known as Sundaram Medium Term Bond Fund) Regular Plan- Income Distribution cum Capital Withdrawal(IDCW),10.4276
2007-02-02,100610,Sundaram Medium Duration Fund (Formerly Known as Sundaram Medium Term Bond Fund) Regular Plan -Income Distribution cum Capital Withdrawal (IDCW),10.4294
2007-02-02,100611,Sundaram Medium Duration Fund (Formerly Known as Sundaram Medium Term Bond Fund) Institutional Plan -Growth,11.6108
2007-02-02,100612,Sundaram Growth Fund-Dividend,15.6319
2007-02-02,100613,Sundaram Growth Fund-Growth,71.4934
2007-02-02,100614,Sundaram Value Fund Regular Plan - Income Distribution cum Capital Withdrawal (IDCW),15.969
2007-02-02,100617,Sundaram Equity Hybrid Fund Regular Plan - Growth,33.1492
2007-02-02,100618,Sundaram Money Fund Retail Plan - Growth,15.5243
2007-02-02,100619,Sundaram Money Fund Retail Plan - Quarterly Reinvestment of Income Distribution cum Capital Withdrawal (IDCW),10.13
2007-02-02,100620,Sundaram Money Fund Retail Plan - Daily Reinvestment of Income Distribution cum Capital Withdrawal (IDCW),10.0953
2007-02-02,100621,Sundaram Money Fund Retail Plan - Weekly Reinvestment of Income Distribution cum Capital Withdrawal (IDCW),10.3277
2007-02-02,100622,Sundaram Money Fund Retail Plan - Fortnightly Reinvestment of Income Distribution cum Capital Withdrawal (IDCW),10.236
2007-02-02,100623,Sundaram Money Fund Retail Plan - Monthly Income Distribution cum Capital Withdrawal (IDCW),10.1216
2007-02-02,100630,quant Multi Cap Fund-IDCW Option - Regular Plan,17.0107
2007-02-02,100631,quant Multi Cap Fund-GROWTH OPTION - Regular Plan,57.7558
2007-02-02,100638,SBI Medium to Long Duration Fund - Regular Plan - Half Yearly - Income Distribution cum Capital Withdrawal Option (IDCW),10.2242
2007-02-02,100639,SBI Medium to Long Duration Fund-REGULAR PLAN-Growth,19.7924
2007-02-02,100640,SBI Medium to Long Duration Fund-REGULAR PLAN-Bonus,11.989
2007-02-02,100641,SBI ULTRA SHORT DURATION FUND - REGULAR PLAN - GROWTH,16.6012
2007-02-02,100643,SBI Technology Opportunities Fund - Regular Plan - Income Distribution cum Capital Withdrawal Option (IDCW),30.22
2007-02-02,100644,SBI Healthcare Opportunities Fund - Regular Plan - Income Distribution cum Capital Withdrawal Option (IDCW),29.88
2007-02-02,100645,SBI Consumption Opportunities Fund - Regular Plan - Income Distribution cum Capital Withdrawal Option (IDCW),14.41
2007-02-02,100646,UTI - Unit Linked Insurance Plan,15.8964
2007-02-02,100648,UTI - CRTS 81 - Dividend Option,110.1705
2007-02-02,100650,UTI Large Cap Fund - Regular Plan - IDCW,29.13
2007-02-02,100651,UTI Large Cap Fund - Regular Plan - Growth Option,36.16
2007-02-02,100656,UTI - Master Plus Unit Scheme-Growth Option,69.37
2007-02-02,100657,UTI - Master Plus Unit Scheme-Income Option,53.28
2007-02-02,100663,UTI Large & Mid Cap Fund - Regular Plan - IDCW,42.72
2007-02-02,100664,UTI Large & Mid Cap Fund - Regular Plan - Growth Option,46.34
2007-02-02,100668,UTI Flexi Cap Fund - Regular Plan - IDCW,31.57
2007-02-02,100669,UTI - Flexi Cap Fund-Growth Option,34.1
2007-02-02,100678,UTI Children's Hybrid Fund - Regular Plan,15.2046
2007-02-02,100682,UTI Retirement Fund - Regular Plan,19.902
2007-02-02,100684,UTI Aggressive Hybrid Fund - Regular Plan - Growth,56.97
2007-02-02,100685,UTI Aggressive Hybrid Fund - Regular Plan - IDCW,22.52
2007-02-02,100711,UTI - INDEX SELECT FUND-Income Option,24.25
2007-02-02,100712,UTI - INDEX SELECT FUND-Growth Option,35.93
2007-02-02,100715,DBS Chola Multi-Cap Fund-Dividend Option,15.53
2007-02-02,100716,DBS Chola Multi-Cap Fund-Cumulative Option,19.47
2007-02-02,100723,UTI MMF-Discontinued - Regular Plan -Growth,20.7848
2007-02-02,100724,UTI MMF- Discontinued - Regular Plan - Flexi Dividend Option,17.6656
2007-02-02,100725,UTI MMF- Discontinued - Regular Plan - Periodic Dividend Option,17.538
2007-02-02,100739,UTI MNC Fund - Regular Plan - IDCW,29.37
2007-02-02,100740,UTI - MNC Fund - Regular Plan - Growth Option,35.36
2007-02-02,100741,UTI Medium to Long Duration Fund- Regular Plan - Growth,21.6222
2007-02-02,100742,UTI Medium to Long Duration Fund - Regular Plan - Quarterly IDCW,10.8823
2007-02-02,100748,UTI - Master Index Fund-Income Option,45.1827
2007-02-02,100749,UTI - Master Index Fund-Growth Option,45.1826
2007-02-02,100750,UTI - Master Value Fund-Income Option,20.12
2007-02-02,100751,UTI - Master Value Fund-Growth Option,30.85
2007-02-02,100780,Sundaram Banking & PSU Fund (Formerly Known as Sundaram Banking and PSU Debt Fund) Retail Plan - Monthly Income Distribution cum Capital Withdrawal (IDCW),10.1699
2007-02-02,100781,Sundaram Banking & PSU Fund (Formerly Known as Sundaram Banking and PSU Debt Fund) Retail Plan - Growth,11.2179
2007-02-02,100782,Sundaram Banking & PSU Fund (Formerly Known as Sundaram Banking and PSU Debt Fund) Regular Plan - Daily Reinvestment of Income Distribution cum Capital Withdrawal (IDCW),10.0519
2007-02-02,100784,Sundaram Banking & PSU Fund (Formerly Known as Sundaram Banking and PSU Debt Fund) Regular Plan - Growth,11.3401
