date,scheme_code,scheme_name,nav
2007-02-02,102205,SBI Dynamic Bond Fund - REGULAR PLAN - Growth,10.6775
2007-02-02,102206,SBI Dynamic Bond Fund - Regular Plan - Income Distribution cum Capital Withdrawal Option (IDCW),10.2543
2007-02-02,102207,SBI MAGNUM NRI FLEXIASSET PLAN-GROWTH,23.7663
2007-02-02,102208,SBI MAGNUM NRI FLEXIASSET PLAN-DIVIDEND,23.7629
2007-02-02,102222,ING Dynamic Duration Fund-Growth Option,11.5786
2007-02-02,102223,ING Dynamic Duration Fund-Annual Dividend Option,10.6881
2007-02-02,102224,ING Dynamic Duration Fund-Monthly Dividend Option,10.1188
2007-02-02,102225,ING Dynamic Duration Fund-Quarterly Dividend Option,10.2106
2007-02-02,102226,ING Dynamic Duration Fund-Half Yearly Dividend Option,10.3441
2007-02-02,102231,ING Dynamic Duration Fund-Bonus Option,11.5786
2007-02-02,102232,ING MIP Fund-Growth Option,12.241
2007-02-02,102233,ING MIP Fund-Monthly Dividend Option,10.5981
2007-02-02,102234,ING MIP Fund-Quarterly Dividend Option,10.7125
2007-02-02,102235,ING MIP Fund-Half Yearly Dividend Option,10.77
2007-02-02,102236,ING MIP Fund-Annual Dividend Option,11.0297
2007-02-02,102240,ING MIP Fund-Bonus Option,12.241
2007-02-02,102242,ING Large Cap Equity Fund-Growth Option,21.53
2007-02-02,102243,ING Large Cap Equity Fund-Dividend Option,14.32
2007-02-02,102245,ING Large Cap Equity Fund-Bonus Option,21.53
2007-02-02,102248,ICICI Prudential Gilt Fund Treasury Plan PF Option - Growth,11.3957
2007-02-02,102251,HSBC Flexi Cap Fund - Regular IDCW,19.8963
2007-02-02,102252,HSBC Flexi Cap Fund - Regular Growth,29.8795
2007-02-02,102257,HSBC MIP - Regular -  Dividend - Monthly,10.5819
2007-02-02,102258,HSBC MIP - Regular - Dividend - Quarterly,10.7249
2007-02-02,102259,HSBC MIP - Regular - Growth,12.3754
2007-02-02,102260,HSBC Conservative Hybrid Fund - Regular Monthly IDCW,10.9395
2007-02-02,102261,HSBC Conservative Hybrid Fund - Regular Quarterly IDCW,11.1506
2007-02-02,102262,HSBC Conservative Hybrid Fund - Regular Growth,13.3317
2007-02-02,102263,Tata Gilt Securities Fund RIP ( Bonus),11.5691
2007-02-02,102266,UTI Children's Equity Fund - Regular Plan - IDCW,11.0763
2007-02-02,102267,UTI Children's Equity Fund - Regular Plan - Growth Option,11.0763
2007-02-02,102268,LIC NOMURA MF Floating Rate Fund - Short Term Plan-Growth,11.8178
2007-02-02,102269,LIC NOMURA MF Floating Rate Fund - Short Term Plan-Weekly Dividend,10.1574
2007-02-02,102270,Franklin FMCG Fund - Dividend,22.89
2007-02-02,102271,Franklin Pharma Fund - Dividend,18.34
2007-02-02,102272,SBI NIFTY INDEX FUND - REGULAR PLAN - GROWTH,38.0794
2007-02-02,102273,SBI Nifty Index Fund - Regular Plan - Income Distribution cum Capital Withdrawal Option (IDCW),18.8364
2007-02-02,102280,Tata M I P Plus Fund - Regular Plan-Monthly Dividend,10.5261
2007-02-02,102281,Tata M I P Plus Fund -Regular Plan- Quarterly Dividend,10.6442
2007-02-02,102282,Tata M I P Plus Fund -Regular Plan- Half Yearly Dividend,10.8451
2007-02-02,102283,Tata MIP Plus Fund -Regular Plan - Growth,12.0633
2007-02-02,102300,Grindlays Government Securities Fund-Provident fund Plan-Regular- Plan A-Growth/Appreciation,11.1823
2007-02-02,102304,Grindlays Government Securities Fund-Provident fund Plan-Regular- Plan A-Annual Dividend,10.8162
2007-02-02,102305,Grindlays Government Securities Fund-Provident fund Plan-Regular- Plan A-Quarterly Dividend,10.4635
2007-02-02,102306,Grindlays Government Securities Fund-Provident fund Plan-Institutional Plan-Plan B-Growth/Appreciation,11.213
2007-02-02,102311,Grindlays Government Securities Fund-Provident fund Plan-Institutional Plan-Plan B-Quarterly Dividend,10.4553
2007-02-02,102315,ING Tax Savings Fund-Growth Option,28.19
2007-02-02,102316,ING Tax Savings Fund-Dividend Option,18.38
2007-02-02,102317,ING Tax Savings Fund-Bonus Option,28.24
2007-02-02,102320,Franklin India Index Fund - BSE Plan - Growth Plan,39.9915
2007-02-02,102326,Tata Mid Cap Fund-Regular Plan - IDCW Option,29.2856
2007-02-02,102328,Tata Mid Cap Fund Regular Plan- Growth Option,33.8503
2007-02-02,102329,Tata Mid Cap Growth Fund Regular Plan  - Bonus (Growth),29.4735
2007-02-02,102330,ICICI Prudential Regular Savings Fund - Plan - Growth,14.6125
2007-02-02,102331,ICICI Prudential Regular Savings Fund - Plan - Monthly IDCW,12.3356
2007-02-02,102336,Principal Global Opportunities Fund- Income Distribution CUM Capital Withdrawal Option,14.8566
2007-02-02,102337,Principal Global Opportunities Fund-Growth Option,14.8566
2007-02-02,102340,GCF-Plan C-Growth,11.6853
2007-02-02,102341,GCF-Plan C-weekly Dividend,10.0
2007-02-02,102342,GCF-Plan C-Daily Dividend,10.0005
2007-02-02,102347,GFRF-Plan C-Growth,11.6939
2007-02-02,102348,GFRF-Plan C-Daily Dividend,10.0005
2007-02-02,102363,GSSIF-ST-Plan C-Growth,10.8714
2007-02-02,102364,GSSIF-ST-Plan C-Dividend,10.0143
2007-02-02,102365,GSSIF-ST-Plan D-Growth,10.2886
2007-02-02,102366,GSSIF-ST-Plan D-Dividend,10.0009
2007-02-02,102381,ING Gilt Fund Provident Fund - Dynamic Plan-Growth Option,11.5442
2007-02-02,102382,ING Gilt Fund Provident Fund - Dynamic Plan-Growth Auto Income Payout Option,11.5442
2007-02-02,102383,ING Gilt Fund Provident Fund - Dynamic Plan-Half Yearly Dividend Option,10.3981
2007-02-02,102384,ING Gilt Fund Provident Fund - Dynamic Plan-Annual Dividend Option,10.6262
2007-02-02,102387,ING Gilt Fund Provident Fund - Dynamic Plan-Cyclical Series Option 2006,10.5
2007-02-02,102393,UTI Mid Cap Fund - Regular Plan - IDCW,20.46
2007-02-02,102394,UTI Mid Cap Fund-Growth Option,24.17
2007-02-02,102395,UTI Infrastructure Fund-Growth Option,29.95
2007-02-02,102396,UTI Infrastructure Fund - Regular Plan - IDCW,21.9
2007-02-02,102397,UTI Transportation and Logistics Fund - Regular Plan - IDCW,15.89
2007-02-02,102398,UTI-Transportation and Logistics  Fund-Growth Option,19.87
2007-02-02,102401,UTI Banking and Financial Services Fund - Regular Plan - Growth Option,22.14
2007-02-02,102402,UTI Banking and Financial Services Fund - Regular Plan - IDCW,18.62
2007-02-02,102403,UTI PSU Fund-Income Option,15.45
2007-02-02,102404,UTI PSU Fund-Growth Option,17.03
2007-02-02,102409,Reliance Gilt Securities Fund-Long Term-P F -Plan-Automatic Capital Appreciation Payout,12.7379
2007-02-02,102410,Reliance Gilt Securities Fund-Long Term-P F -Plan-Defined Maturity Debt,12.7379
2007-02-02,102414,SBI CONTRA FUND - REGULAR PLAN -GROWTH,39.55
2007-02-02,102416,ICICI Prudential Fixed Maturity Plan - 1 Year-Series 12-Retail,11.3795
2007-02-02,102421,ICICI Prudential Fixed Maturity Plan - 1 Year-Series 12-Institutional,11.4518
2007-02-02,102422,ICICI Prudential Fixed Maturity Plan - 1 Year-Series 12-Retail Dividend - 1,10.5514
2007-02-02,102423,ICICI Prudential Fixed Maturity Plan - 1 Year-Series 12-Institutional Dividend - 1,10.5567
2007-02-02,102424,ICICI Prudential Fixed Maturity Plan - 1 Year-Series 12-Retail Growth - 1,10.5514
2007-02-02,102425,ICICI Prudential Fixed Maturity Plan - 1 Year-Series 12-Institutional Growth - 1,10.5673
2007-02-02,102426,Principal Resurgent India Equity Fund-Growth,76.64
2007-02-02,102427,Principal Resurgent India Equity Fund-Dividend,19.98
2007-02-02,102428,Tata Value Fund Regular Plan - Payout of IDCW-Option B(10%),25.3892
2007-02-02,102431,Nippon India Pharma Fund-Growth Plan-Growth Option,20.6589
2007-02-02,102432,Nippon India Pharma Fund-Growth Plan-Bonus Option,20.6589
2007-02-02,102433,NIPPON INDIA PHARMA FUND - IDCW Option,19.4443
2007-02-02,102434,DSP India T.I.G.E.R. Fund - Regular Plan - Growth,35.006
2007-02-02,102435,DSP India T.I.G.E.R. Fund - Regular Plan - IDCW,24.8
2007-02-02,102441,Franklin India Liquid Fund - Institution-Growth,1157.4521
2007-02-02,102442,Franklin India Liquid Fund - Institutional Plan - Weekly - IDCW,1001.6273
2007-02-02,102443,Franklin India Liquid Fund - Institutional Plan - Daily - IDCW,1000.25
2007-02-02,102445,DSP BlackRock Savings Manager Fund - Conservative - Growth,12.1147
2007-02-02,102446,DSP BlackRock Savings Manager Fund - Conservative - Monthly Dividend,10.3014
2007-02-02,102447,DSP BlackRock Savings Manager Fund - Conservative - Quarterly Dividend,10.5079
2007-02-02,102448,DSP Regular Savings Fund- Regular Plan - Growth,13.9394
2007-02-02,102450,DSP Regular Savings Fund - Regular Plan - IDCW - Monthly,10.552
2007-02-02,102451,DSP Regular Savings Fund - Regular Plan - IDCW - Quarterly,11.0961
2007-02-02,102452,HDFC Low Duration  Fund - Growth,16.0449
2007-02-02,102453,HDFC Low Duration  Fund - Weekly IDCW,10.0225
2007-02-02,102478,JM Mid Cap Fund-Dividend,17.74
2007-02-02,102479,JM Mid Cap Fund-Growth,23.16
2007-02-02,102480,JM Large Cap Fund-Dividend,14.49
2007-02-02,102481,JM Large Cap Fund-Growth,18.26
2007-02-02,102482,Sundaram India Leadership Fund-Growth,31.1425
2007-02-02,102483,Sundaram India Leadership Fund-Dividend,15.1918
2007-02-02,102491,UTI - GROWTH & VALUE FUND-ANNUAL DIVIDEND,24.43
2007-02-02,102494,UTI - GROWTH & VALUE FUND-GROWTH,60.43
2007-02-02,102495,UTI - GROWTH & VALUE FUND-SEMI ANNUAL DIVIDEND,17.06
2007-02-02,102496,UTI - INDIA ADVANTAGE EQUITY FUND-DIVIDEND,8.92
2007-02-02,102497,UTI - INDIA ADVANTAGE EQUITY FUND-GROWTH,8.92
2007-02-02,102503,SBI  SAVINGS FUND - REGULAR PLAN - GROWTH,11.4886
2007-02-02,102504,SBI Savings Fund - Regular Plan - Income Distribution cum Capital Withdrawal Option (IDCW),10.0761
2007-02-02,102505,SBI CREDIT RISK FUND - REGULAR PLAN - GROWTH,11.4009
2007-02-02,102506,SBI Credit Risk Fund - Regular Plan - Income Distribution cum Capital Withdrawal Option (IDCW),10.3193
2007-02-02,102507,OLD-SBI Magnum Income Fund - F R P - Long Term - Inst. (G),11.5124
2007-02-02,102508,SBI Magnum Income Fund - F R P - Long Term - Inst. (D),10.6369
2007-02-02,102509,UTI Gilt Fund - Regular Plan - IDCW,10.7358
2007-02-02,102510,UTI - GILT FUND - Regular Plan - Growth Option,15.2865
2007-02-02,102511,UTI - GILT FUND -Discontinued PF Plan -Dividend Option,10.6885
2007-02-02,102512,UTI - GILT FUND - Discontinued PF Plan - Growth Option,11.3675
2007-02-02,102513,UTI - GILT ADVANTAGE-LONG TERM PF-( PRESCRIBED APPRECIATION AUTO REDEMPTION,11.3855
2007-02-02,102514,UTI - GILT FUND - Discontinued PF Plan Prescribed Date Auto Redemption Option,11.3713
2007-02-02,102517,UTI - DYNAMIC EQUITY FUND-GROWTH,38.78
2007-02-02,102518,UTI - DYNAMIC EQUITY FUND-DIVIDEND,21.18
2007-02-02,102528,ICICI Prudential MidCap Fund - Growth,30.1
2007-02-02,102529,ICICI Prudential MidCap Fund - IDCW,21.94
2007-02-02,102530,ICICI Prudential MidCap Fund - Institutional Option - I,11.79
2007-02-02,102531,UTI Ultra Short Duration Fund - Regular Plan - Weekly IDCW (Reinvestment),1016.6782
2007-02-02,102532,UTI Ultra Short Duration Fund - Regular Plan - Growth Option,1208.8368
2007-02-02,102533,UTI Conservative Hybrd Fund - Regular Plan - Monthly Payment Option,14.3249
2007-02-02,102534,UTI Conservative Hybrid Fund - Regular Plan - Flexi IDCW,14.3371
2007-02-02,102535,UTI Conservative Hybrid Fund - Regular Plan - Growth Option,14.3367
2007-02-02,102536,UTI Conservative Hybrid Fund - Regular Plan - Monthly IDCW,12.2272
2007-02-02,102538,UTI Low Duration Fund - Discontinued - Annaul Dividend Option,11.4363
2007-02-02,102539,UTI Low Duration Fund - Discontinued Bonus Option,12.5214
2007-02-02,102540,UTI Low Duration Fund - Discontinued Growth Option,18.7841
2007-02-02,102541,UTI Low Duration Fund - Discontinued - Quarterly Dividend Option,11.0911
2007-02-02,102545,UTI Low Duration Fund - Regular Plan - Bonus Option,11.5017
2007-02-02,102546,Franklin India Life Stage Fund Of Funds - 50's Plus Floating Rate Plan - IDCW,12.1931
2007-02-02,102547,Franklin India Life Stage Fund of Funds - The 50s Plus Flo (Gro),13.7396
2007-02-02,102556,GFRF Long Term-Plan A-Growth,11.3815
2007-02-02,102557,GFRF Long Term-Plan A-Dividend Quarterly,10.2877
2007-02-02,102558,GFRF Long Term-Plan A-Dividend Annual,10.3767
2007-02-02,102559,GFRF Long Term-Plan A-Dividend Monthly,10.0135
2007-02-02,102560,GFRF Long Term-Plan B-Growth,11.4356
2007-02-02,102561,GFRF Long Term-Plan B-Dividend Quarterly,10.3304
2007-02-02,102573,Kotak Multi Asset Omni FOF - Payout of Income Distribution cum capital withdrawal option,26.513
2007-02-02,102574,Kotak Multi Asset Omni FOF - Growth- Regular,26.513
2007-02-02,102577,DBS Chola Mid Cap Fund-Dividend,16.07
2007-02-02,102578,DBS Chola Mid Cap Fund-Cumulative,27.86
2007-02-02,102585,ICICI Prudential FMP-15 Month - Series 25-Retail Plan-Cumulative Option,11.3605
2007-02-02,102587,ICICI Prudential FMP-15 Month - Series 25-Institutional Plan-Cumulative Option,11.458
2007-02-02,102590,Kotak Savings Fund -Weekly Weekly Reinvestment of Income Distribution cum capital withdrawal option,10.0412
2007-02-02,102591,Kotak Savings Fund -Growth,11.5435
2007-02-02,102592,Kotak Savings Fund -Monthly Payout of Income Distribution cum capital withdrawal option,10.0412
2007-02-02,102594,ICICI Prudential Value Fund (erstwhile Value Discovery Fund) - Growth,27.64
2007-02-02,102595,ICICI Prudential Value Fund (erstwhile Value Discovery Fund) - IDCW,19.1
2007-02-02,102596,ICICI Prudential Value Discovery Fund - Institutional Option - I - Growth,11.73
2007-02-02,102619,ABN AMRO Flexi Debt Fund-Regular Plan-Growth Option,11.4392
2007-02-02,102620,ABN AMRO Flexi Debt Fund-Regular Plan-Quarterly Dividend Option,10.1673
2007-02-02,102621,ABN AMRO Flexi Debt Fund-Regular Plan-Half-Yearly Dividend Option,10.3831
2007-02-02,102622,ABN AMRO Flexi Debt Fund-Regular Plan-Daily Dividend Option,10.0001
2007-02-02,102623,ABN AMRO Flexi Debt Fund-Regular Plan-Weekly Dividend Option,10.0
2007-02-02,102639,ABN AMRO  Equity Fund-Growth Plan,27.7
2007-02-02,102640,ABN AMRO  Equity Fund-Dividend Plan,15.16
2007-02-02,102641,ABN AMRO  Short Term Income Fund-Regular Plan-Growth Option,11.3355
2007-02-02,102642,ABN AMRO  Short Term Income Fund-Regular Plan-Monthly Dividend Option,10.0068
2007-02-02,102643,ABN AMRO  Short Term Income Fund-Regular Plan-Weekly Dividend Option,10.0017
2007-02-02,102644,ABN AMRO  Short Term Income Fund-Institutional Plan-Growth Option,11.4556
2007-02-02,102645,ABN AMRO  Short Term Income Fund-Institutional Plan-Daily Dividend Option,10.0
2007-02-02,102646,ABN AMRO  Short Term Income Fund-Institutional Plan-Monthly Dividend Option,10.0068
2007-02-02,102647,ABN AMRO  Short Term Income Fund-Institutional Plan-Weekly Dividend Option,10.0017
2007-02-02,102652,ABN AMRO  Monthly Income Plan-Regular Plan-Growth Option,13.1789
2007-02-02,102653,ABN AMRO  Monthly Income Plan-Regular Plan-Monthly Dividend Option,11.0356
2007-02-02,102654,ABN AMRO  Monthly Income Plan-Regular Plan-Quarterly Dividend Option,11.028
2007-02-02,102659,DBS Chola Floating Rate Fund-Dividend,10.3526
2007-02-02,102660,DBS Chola Floating Rate Fund-Cumulative,11.3886
2007-02-02,102661,BARODA CONSERVATIVE HYBRID FUND - Plan A - Growth Option,11.7363
2007-02-02,102662,BARODA CONSERVATIVE HYBRID FUND - Plan A - Monthly IDCW Option,11.7412
2007-02-02,102663,BARODA CONSERVATIVE HYBRID FUND - Plan A - Quarterly IDCW Option,11.7368
2007-02-02,102670,BARODA PIONEER CHILDREN FUND-GIFT PLAN,10.5854
2007-02-02,102672,Tata Liquid Fund -Regular Plan - Growth Option,11.5544
2007-02-02,102673,Nippon India Floater Fund - Growth Plan-Growth Option,11.5264
2007-02-02,102675,NIPPON INDIA FLOATER FUND - MONTHLY IDCW Option,10.1437
2007-02-02,102676,NIPPON INDIA FLOATER FUND - DAILY IDCW REINVESTMENT Option,10.0622
2007-02-02,102677,NIPPON INDIA FLOATER FUND - WEEKLY IDCW Option,10.077
2007-02-02,102682,Birla Sun Life Fixed Maturity Plan - Quarterly Series II-Dividend,10.115
2007-02-02,102683,Birla Sun Life Fixed Maturity Plan - Quarterly Series II-Growth,11.6036
2007-02-02,102701,Sundaram Money Fund Institutional Plan - Daily Reinvestment of Income Distribution cum Capital Withdrawal (IDCW),10.0953
2007-02-02,102703,Sundaram Money Fund Institutional Plan - Growth,15.577
2007-02-02,102704,Sundaram Money Fund Institutional Plan - Monthly Income Distribution cum Capital Withdrawal (IDCW),10.1642
2007-02-02,102705,Sundaram Money Fund Institutional Plan - Quarterly Reinvestment of Income Distribution cum Capital Withdrawal (IDCW),10.4063
2007-02-02,102706,Sundaram Money Fund Institutional Plan - Weekly Reinvestment of Income Distribution cum Capital Withdrawal (IDCW),10.3618
2007-02-02,102711,ING Select Debt Fund-Growth Option,11.1269
2007-02-02,102712,ING Select Debt Fund-Quarterly Dividend Option,10.1674
2007-02-02,102713,ING Select Debt Fund-Half Yearly Dividend Option,10.2952
2007-02-02,102714,ING Select Debt Fund-Annual Dividend Option,10.4397
2007-02-02,102715,ING Select Debt Fund-Bonus Option,11.1269
2007-02-02,102716,ING Domestic Opportunities Fund-Growth Option,28.18
2007-02-02,102717,ING Domestic Opportunities Fund-Dividend Option,15.46
2007-02-02,102718,ING Domestic Opportunities Fund-Bonus Option,28.18
2007-02-02,102719,Principal Low Duration Fund - Growth,11.529
2007-02-02,102720,Principal Floating Rate Fund - FMP-Weekly Dividend,10.0008
2007-02-02,102721,Principal Floating Rate Fund - FMP-Monthly Dividend,10.2512
2007-02-02,102722,Principal Low Duration Fund- Growth Option,11.5675
2007-02-02,102723,Principal Low Duration Fund - Weekly Income Distribution CUM Capital Withdrawal Option,10.0007
2007-02-02,102724,Principal Low Duration Fund- Monthly Income Distribution CUM Capital Withdrawal Option,10.1106
2007-02-02,102725,Principal Floating Rate Fund - SMP-Growth,11.487
2007-02-02,102726,Principal Floating Rate Fund - SMP-Daily Dividend,10.0007
2007-02-02,102727,Principal Floating Rate Fund - SMP-Weekly Dividend,10.0028
2007-02-02,102728,Principal Floating Rate Fund - SMP-Monthly Dividend,10.1677
2007-02-02,102729,Principal Credit Risk Fund - Regular Plan - Growth Option,11.528
2007-02-02,102730,Principal Floating Rate Fund - SMP-Insti. Daily Dividend,10.0007
2007-02-02,102731,Principal Floating Rate Fund - SMP-Insti. Weekly Dividend,10.0028
2007-02-02,102732,Principal Credit Risk Fund - Regular Plan - Monthly Dividend Option,10.3532
2007-02-02,102733,Standard Chartered All Seasons Bond Fund-Plan A-Dividend - Quarterly,10.3196
2007-02-02,102734,Standard Chartered All Seasons Bond Fund-Plan A-Growth,11.3375
2007-02-02,102735,Standard Chartered All Seasons Bond Fund-Plan A-Dividend - Half Yearly,10.4544
2007-02-02,102736,Standard Chartered All Seasons Bond Fund-Plan A-Dividend - Annual,10.7365
2007-02-02,102741,ICICI Prudential Medium Term Bond Fund - Growth,11.3937
2007-02-02,102742,ICICI Prudential Medium Term Bond Fund - Dividend,10.1128
2007-02-02,102743,ICICI Prudential Medium Term Bond Fund-Plan B-Growth,11.5086
2007-02-02,102744,ICICI Prudential Medium Term Bond Fund-Plan B-Dividend,10.1337
2007-02-02,102751,Nippon India Consumption Fund-Growth Plan-Growth Option,24.9293
2007-02-02,102752,Nippon India Consumption Fund-Growth Plan-Bonus Option,24.9293
2007-02-02,102753,NIPPON INDIA CONSUMPTION FUND - IDCW Option,20.8086
2007-02-02,102754,Birla Sun Life Fixed Maturity Plan - Annual Series 1-Dividend,10.2459
2007-02-02,102755,Birla Sun Life Fixed Maturity Plan - Annual Series 1-Growth,11.4922
2007-02-02,102756,SBI FOCUSED FUND - REGULAR PLAN -GROWTH,31.6
2007-02-02,102760,HDFC Focused Fund - GROWTH PLAN,26.348
2007-02-02,102761,HDFC Focused Fund - IDCW PLAN,20.298
2007-02-02,102765,SBI Focused Fund - Regular Plan - Income Distribution cum Capital Withdrawal Option (IDCW),19.42
2007-02-02,102766,Aditya Birla Sun Life Dynamic Bond Fund -Regular - Quarterly IDCW,10.1601
2007-02-02,102767,Aditya Birla Sun Life Dynamic Bond Fund - Growth - Regular Plan,11.3572
2007-02-02,102798,ING Treasury Management Fund-Growth Option,11.4258
2007-02-02,102799,ING Treasury Management Fund-Weekly Dividend Option,10.3084
2007-02-02,102800,ING Treasury Management Fund-Quarterly Dividend Option,10.2851
2007-02-02,102801,ING Treasury Management Fund-Half Yearly Dividend Option,10.4232
2007-02-02,102802,ING Treasury Management Fund-Annual Dividend Option,10.7101
2007-02-02,102803,ING Treasury Management Fund-Bonus Option,11.4258
2007-02-02,102804,ING Treasury Management Fund-Daily Dividend Option,10.04
2007-02-02,102805,Canara Robeco Nifty Index - Regular Plan - Growth,22.41
2007-02-02,102806,Canara Robeco Nifty Index - Regular Plan - Dividend,14.45
2007-02-02,102807,Principal Dividend Yield Fund-Growth Plan,16.02
2007-02-02,102808,Principal Dividend Yield Fund- Half Yearly Income Distribution CUM Capital Withdrawal Plan,13.06
2007-02-02,102813,LIC NOMURA MF Floater MIP - Monthly Dividend,10.2793
2007-02-02,102814,LIC NOMURA MF Floater MIP - Quarterly Dividend,10.2923
2007-02-02,102815,LIC NOMURA MF Floater MIP - Yearly Dividend,11.2136
2007-02-02,102816,LIC NOMURA MF Floater MIP - Growth,12.8069
2007-02-02,102823,SBI HEALTHCARE OPPORTUNITIES FUND - REGULAR PLAN -GROWTH,36.31
2007-02-02,102827,HSBC Floating Rate Fund - Long Term - Regular - Growth,11.3131
2007-02-02,102828,HSBC Floating Rate Fund - Long Term - Regular - Dividend - Monthly,10.0151
2007-02-02,102829,HSBC Floating Rate Fund - Long Term - Growth,11.3643
2007-02-02,102830,HSBC Floating Rate Fund - Long Term - Dividend - Weekly,10.4309
2007-02-02,102831,HSBC Floating Rate Fund - Long Term - Dividend - Monthly,10.0461
2007-02-02,102832,HSBC Floating Rate Fund - Short Term - Regular - Growth,11.337
2007-02-02,102833,HSBC Floating Rate Fund - Short Term - Regular - Dividend - Daily,10.0
2007-02-02,102834,HSBC Floating Rate Fund - Short Term - Regular - Dividend - Weekly,10.0176
2007-02-02,102835,HSBC Floating Rate Fund - Short Term - Inst. - Growth,11.3883
2007-02-02,102836,HSBC Floating Rate Fund - Short Term - Inst. - Dividend - Daily,10.015
2007-02-02,102837,HSBC Floating Rate Fund - Short Term - Inst. - Dividend - Weekly,10.0473
2007-02-02,102838,HSBC Floating Rate Fund - Short Term - Inst. - Dividend - Monthly,10.0358
2007-02-02,102840,HSBC Floating Rate Fund - Short Term - Inst. Plus - Dividend - Daily,10.0262
2007-02-02,102846,Nippon India Balanced Advantage Fund-Growth Plan-Growth Option,25.7065
2007-02-02,102847,Nippon India Balanced Advantage Fund-Growth Plan-Bonus Option,25.7065
2007-02-02,102848,NIPPON INDIA BALANCED ADVANTAGE FUND - IDCW Option,21.8269
2007-02-02,102849,Nippon India Dynamic Bond Fund-Growth Plan-Growth Option,11.2457
2007-02-02,102851,NIPPON INDIA DYNAMIC BOND FUND - IDCW Option,11.2457
2007-02-02,102855,Birla Sun Life Fixed Maturity Plan - Annual  Series 3-Dividend,10.1582
2007-02-02,102856,Birla Sun Life Fixed Maturity Plan - Annual  Series 3-Growth,11.5397
2007-02-02,102858,Tata Dividend Yield Fund  Regular Plan -( Div),14.8172
2007-02-02,102859,Tata Dividend Yield Fund Regular Plan,18.037
2007-02-02,102860,SBI Savings Fund - Regular Plan Weekly Income Distribution cum Capital Withdrawal Option (IDCW),10.2013
2007-02-02,102867,Kotak Flexi-Debt - Regular Plan - Dividend,10.1679
2007-02-02,102868,Kotak Flexi-Debt - Regular Plan - Growth,11.4896
2007-02-02,102869,Kotak Flexi-Debt- Regular Plan - Daily Dividend,10.0311
2007-02-02,102870,Z-OLD-SBI Magnum Inst. Income Fund -  Savings - Wkly(D)(Upto 22/03/07) Renamed as SBI Premier Liquid Fund,10.5768
2007-02-02,102874,Kotak-Small Cap Fund - Payout of Income Distribution cum capital withdrawal option,16.292
2007-02-02,102875,Kotak-Small Cap Fund - Growth,21.235
2007-02-02,102883,Franklin India Large & Mid Cap Fund - Growth Plan,21.67
2007-02-02,102884,Franklin India Large & Mid Cap Fund - IDCW,19.22
2007-02-02,102885,SBI EQUITY HYBRID FUND - REGULAR PLAN -Growth,36.59
2007-02-02,102896,Principal Focussed Advantage Fund-Dividend,17.02
2007-02-02,102897,Principal Focussed Advantage Fund-Growth,17.03
2007-02-02,102900,LIC NOMURA MF Opportunities Fund-Dividend,12.4996
2007-02-02,102901,LIC NOMURA MF Opportunities Fund-Growth,18.0147
2007-02-02,102902,JM Equity & Derivative Fund-Growth-growth option,11.375
2007-02-02,102903,JM Equity & Derivative Fund-Dividend-dividend option,10.3503
2007-02-02,102904,JM Equity & Derivative Fund-Bonus-Bonus option,10.5328
2007-02-02,102905,Reliance Index Fund-Sensex Plan-Growth Option,21.006
2007-02-02,102906,Reliance Index Fund-Sensex Plan-Bonus Option,21.006
2007-02-02,102907,Reliance Index Fund-Sensex Plan-Dividend Option,21.006
2007-02-02,102908,Reliance Index Fund-Nifty Plan-Growth Option,16.8576
2007-02-02,102909,Reliance Index Fund-Nifty Plan-Bonus Option,16.8576
2007-02-02,102910,Reliance Index Fund-Nifty Plan-Dividend Option,16.8576
2007-02-02,102913,CANARA ROBECO SAVINGS FUND - REGULAR PLAN - GROWTH OPTION,11.3093
2007-02-02,102914,CANARA ROBECO SAVINGS FUND - REGULAR PLAN - IDCW (Payout/Reinvestment),10.8768
2007-02-02,102915,CANARA ROBECO SAVINGS FUND - REGULAR PLAN - WEEKLY IDCW (Payout/Reinvestment),10.2622
2007-02-02,102920,CANARA ROBECO LARGE AND MID CAP FUND - REGULAR PLAN - GROWTH OPTION,16.47
2007-02-02,102921,CANARA ROBECO LARGE AND MID CAP FUND - REGULAR PLAN - IDCW (Payout/Reinvestment),14.04
2007-02-02,102922,Canara Robeco Large and Mid Cap Fund -BONUS OPTION,16.47
2007-02-02,102929,Tata Service Industries Fund - Dividend,21.0745
2007-02-02,102930,Tata Service Industries Fund - Appreciation,21.002
2007-02-02,102931,ING Midcap Fund-Growth Option,17.78
2007-02-02,102932,ING Midcap Fund-Dividend Option,16.26
2007-02-02,102933,ING Midcap Fund-Bonus Option,17.78
2007-02-02,102941,SBI MIDCAP FUND - REGULAR PLAN - GROWTH,23.92
2007-02-02,102942,SBI Midcap Fund - Regular Plan - Income Distribution cum Capital Withdrawal Option (IDCW),20.55
2007-02-02,102947,HDFC Hybrid Equity Fund - IDCW Plan,17.064
2007-02-02,102948,HDFC Hybrid Equity Fund - Growth Plan,19.199
2007-02-02,102951,ABN  AMRO Opportunities Fund-Growth,21.903
2007-02-02,102952,ABN  AMRO Opportunities Fund-Dividend,18.85
2007-02-02,102957,ICICI Prudential Multicap Fund - Institutional Option - I,22.61
2007-02-02,102960,Z-OLD-SBI Magnum Inst. Income Fund -  Savings - Fortnightly(D)(Upto 22/03/07) Renamed as SBI Premier Liquid Fund,10.1026
2007-02-02,102961,Fidelity Equity Fund-Growth Option,22.041
2007-02-02,102962,Fidelity Equity Fund-Dividend Option,19.45
2007-02-02,103001,Kotak Dynamic FOF---Growth,17.622
2007-02-02,103024,SBI LARGE & MIDCAP FUND- REGULAR PLAN -Growth,56.07
