date,scheme_code,scheme_name,nav
2007-02-26,102206,SBI Dynamic Bond Fund - Regular Plan - Income Distribution cum Capital Withdrawal Option (IDCW),10.2746
2007-02-26,102207,SBI MAGNUM NRI FLEXIASSET PLAN-GROWTH,22.864
2007-02-26,102208,SBI MAGNUM NRI FLEXIASSET PLAN-DIVIDEND,22.8605
2007-02-26,102222,ING Dynamic Duration Fund-Growth Option,11.6405
2007-02-26,102223,ING Dynamic Duration Fund-Annual Dividend Option,10.7453
2007-02-26,102224,ING Dynamic Duration Fund-Monthly Dividend Option,10.1729
2007-02-26,102225,ING Dynamic Duration Fund-Quarterly Dividend Option,10.2652
2007-02-26,102226,ING Dynamic Duration Fund-Half Yearly Dividend Option,10.3995
2007-02-26,102231,ING Dynamic Duration Fund-Bonus Option,11.6405
2007-02-26,102232,ING MIP Fund-Growth Option,12.1596
2007-02-26,102233,ING MIP Fund-Monthly Dividend Option,10.5276
2007-02-26,102234,ING MIP Fund-Quarterly Dividend Option,10.6414
2007-02-26,102235,ING MIP Fund-Half Yearly Dividend Option,10.6984
2007-02-26,102236,ING MIP Fund-Annual Dividend Option,10.9564
2007-02-26,102240,ING MIP Fund-Bonus Option,12.1596
2007-02-26,102242,ING Large Cap Equity Fund-Growth Option,20.37
2007-02-26,102243,ING Large Cap Equity Fund-Dividend Option,13.56
2007-02-26,102245,ING Large Cap Equity Fund-Bonus Option,20.37
2007-02-26,102248,ICICI Prudential Gilt Fund Treasury Plan PF Option - Growth,11.3734
2007-02-26,102251,HSBC Flexi Cap Fund - Regular IDCW,18.359
2007-02-26,102252,HSBC Flexi Cap Fund - Regular Growth,27.5706
2007-02-26,102257,HSBC MIP - Regular -  Dividend - Monthly,10.4334
2007-02-26,102258,HSBC MIP - Regular - Dividend - Quarterly,10.6252
2007-02-26,102259,HSBC MIP - Regular - Growth,12.2603
2007-02-26,102260,HSBC Conservative Hybrid Fund - Regular Monthly IDCW,10.7121
2007-02-26,102261,HSBC Conservative Hybrid Fund - Regular Quarterly IDCW,10.98
2007-02-26,102262,HSBC Conservative Hybrid Fund - Regular Growth,13.1277
2007-02-26,102263,Tata Gilt Securities Fund RIP ( Bonus),11.573
2007-02-26,102266,UTI Children's Equity Fund - Regular Plan - IDCW,11.0698
2007-02-26,102267,UTI Children's Equity Fund - Regular Plan - Growth Option,11.0698
2007-02-26,102268,LIC NOMURA MF Floating Rate Fund - Short Term Plan-Growth,11.8819
2007-02-26,102269,LIC NOMURA MF Floating Rate Fund - Short Term Plan-Weekly Dividend,10.1623
2007-02-26,102270,Franklin FMCG Fund - Dividend,21.51
2007-02-26,102271,Franklin Pharma Fund - Dividend,17.6
2007-02-26,102272,SBI NIFTY INDEX FUND - REGULAR PLAN - GROWTH,35.9771
2007-02-26,102273,SBI Nifty Index Fund - Regular Plan - Income Distribution cum Capital Withdrawal Option (IDCW),17.8009
2007-02-26,102280,Tata M I P Plus Fund - Regular Plan-Monthly Dividend,10.3332
2007-02-26,102281,Tata M I P Plus Fund -Regular Plan- Quarterly Dividend,10.5111
2007-02-26,102282,Tata M I P Plus Fund -Regular Plan- Half Yearly Dividend,10.7094
2007-02-26,102283,Tata MIP Plus Fund -Regular Plan - Growth,11.9123
2007-02-26,102300,Grindlays Government Securities Fund-Provident fund Plan-Regular- Plan A-Growth/Appreciation,11.0804
2007-02-26,102304,Grindlays Government Securities Fund-Provident fund Plan-Regular- Plan A-Annual Dividend,10.7177
2007-02-26,102305,Grindlays Government Securities Fund-Provident fund Plan-Regular- Plan A-Quarterly Dividend,10.3682
2007-02-26,102306,Grindlays Government Securities Fund-Provident fund Plan-Institutional Plan-Plan B-Growth/Appreciation,11.1102
2007-02-26,102311,Grindlays Government Securities Fund-Provident fund Plan-Institutional Plan-Plan B-Quarterly Dividend,10.3594
2007-02-26,102315,ING Tax Savings Fund-Growth Option,26.46
2007-02-26,102316,ING Tax Savings Fund-Dividend Option,17.25
2007-02-26,102317,ING Tax Savings Fund-Bonus Option,26.5
2007-02-26,102320,Franklin India Index Fund - BSE Plan - Growth Plan,37.8875
2007-02-26,102326,Tata Mid Cap Fund-Regular Plan - IDCW Option,27.6591
2007-02-26,102328,Tata Mid Cap Fund Regular Plan- Growth Option,31.97
2007-02-26,102329,Tata Mid Cap Growth Fund Regular Plan  - Bonus (Growth),27.7409
2007-02-26,102330,ICICI Prudential Regular Savings Fund - Plan - Growth,14.4415
2007-02-26,102331,ICICI Prudential Regular Savings Fund - Plan - Monthly IDCW,12.1912
2007-02-26,102336,Principal Global Opportunities Fund- Income Distribution CUM Capital Withdrawal Option,15.1495
2007-02-26,102337,Principal Global Opportunities Fund-Growth Option,15.1495
2007-02-26,102340,GCF-Plan C-Growth,11.742
2007-02-26,102341,GCF-Plan C-weekly Dividend,10.0059
2007-02-26,102342,GCF-Plan C-Daily Dividend,10.0005
2007-02-26,102347,GFRF-Plan C-Growth,11.7459
2007-02-26,102348,GFRF-Plan C-Daily Dividend,10.0005
2007-02-26,102363,GSSIF-ST-Plan C-Growth,10.8608
2007-02-26,102364,GSSIF-ST-Plan C-Dividend,10.0047
2007-02-26,102365,GSSIF-ST-Plan D-Growth,10.2758
2007-02-26,102366,GSSIF-ST-Plan D-Dividend,9.9859
2007-02-26,102381,ING Gilt Fund Provident Fund - Dynamic Plan-Growth Option,11.5364
2007-02-26,102382,ING Gilt Fund Provident Fund - Dynamic Plan-Growth Auto Income Payout Option,11.5364
2007-02-26,102383,ING Gilt Fund Provident Fund - Dynamic Plan-Half Yearly Dividend Option,10.3911
2007-02-26,102384,ING Gilt Fund Provident Fund - Dynamic Plan-Annual Dividend Option,10.619
2007-02-26,102387,ING Gilt Fund Provident Fund - Dynamic Plan-Cyclical Series Option 2006,10.4929
2007-02-26,102393,UTI Mid Cap Fund - Regular Plan - IDCW,18.36
2007-02-26,102394,UTI Mid Cap Fund-Growth Option,21.69
2007-02-26,102395,UTI Infrastructure Fund-Growth Option,27.2
2007-02-26,102396,UTI Infrastructure Fund - Regular Plan - IDCW,19.88
2007-02-26,102397,UTI Transportation and Logistics Fund - Regular Plan - IDCW,15.13
2007-02-26,102398,UTI-Transportation and Logistics  Fund-Growth Option,18.92
2007-02-26,102401,UTI Banking and Financial Services Fund - Regular Plan - Growth Option,20.41
2007-02-26,102402,UTI Banking and Financial Services Fund - Regular Plan - IDCW,17.17
2007-02-26,102403,UTI PSU Fund-Income Option,14.49
2007-02-26,102404,UTI PSU Fund-Growth Option,15.97
2007-02-26,102409,Reliance Gilt Securities Fund-Long Term-P F -Plan-Automatic Capital Appreciation Payout,12.7508
2007-02-26,102410,Reliance Gilt Securities Fund-Long Term-P F -Plan-Defined Maturity Debt,12.7508
2007-02-26,102414,SBI CONTRA FUND - REGULAR PLAN -GROWTH,37.27
2007-02-26,102416,ICICI Prudential Fixed Maturity Plan - 1 Year-Series 12-Retail,11.431
2007-02-26,102421,ICICI Prudential Fixed Maturity Plan - 1 Year-Series 12-Institutional,11.5048
2007-02-26,102422,ICICI Prudential Fixed Maturity Plan - 1 Year-Series 12-Retail Dividend - 1,10.5989
2007-02-26,102423,ICICI Prudential Fixed Maturity Plan - 1 Year-Series 12-Institutional Dividend - 1,10.6056
2007-02-26,102424,ICICI Prudential Fixed Maturity Plan - 1 Year-Series 12-Retail Growth - 1,10.5989
2007-02-26,102425,ICICI Prudential Fixed Maturity Plan - 1 Year-Series 12-Institutional Growth - 1,10.6162
2007-02-26,102426,Principal Resurgent India Equity Fund-Growth,71.7
2007-02-26,102427,Principal Resurgent India Equity Fund-Dividend,18.7
2007-02-26,102428,Tata Value Fund Regular Plan - Payout of IDCW-Option B(10%),24.1769
2007-02-26,102431,Nippon India Pharma Fund-Growth Plan-Growth Option,20.1186
2007-02-26,102432,Nippon India Pharma Fund-Growth Plan-Bonus Option,20.1186
2007-02-26,102433,NIPPON INDIA PHARMA FUND - IDCW Option,17.4456
2007-02-26,102434,DSP India T.I.G.E.R. Fund - Regular Plan - Growth,32.83
2007-02-26,102435,DSP India T.I.G.E.R. Fund - Regular Plan - IDCW,23.258
2007-02-26,102441,Franklin India Liquid Fund - Institution-Growth,1162.9907
2007-02-26,102442,Franklin India Liquid Fund - Institutional Plan - Weekly - IDCW,1000.811
2007-02-26,102443,Franklin India Liquid Fund - Institutional Plan - Daily - IDCW,1000.25
2007-02-26,102445,DSP BlackRock Savings Manager Fund - Conservative - Growth,12.0745
2007-02-26,102446,DSP BlackRock Savings Manager Fund - Conservative - Monthly Dividend,10.2667
2007-02-26,102447,DSP BlackRock Savings Manager Fund - Conservative - Quarterly Dividend,10.4725
2007-02-26,102448,DSP Regular Savings Fund- Regular Plan - Growth,13.8848
2007-02-26,102450,DSP Regular Savings Fund - Regular Plan - IDCW - Monthly,10.5107
2007-02-26,102451,DSP Regular Savings Fund - Regular Plan - IDCW - Quarterly,11.0526
2007-02-26,102452,HDFC Low Duration  Fund - Growth,16.1262
2007-02-26,102453,HDFC Low Duration  Fund - Weekly IDCW,10.0293
2007-02-26,102478,JM Mid Cap Fund-Dividend,16.7
2007-02-26,102479,JM Mid Cap Fund-Growth,21.8
2007-02-26,102480,JM Large Cap Fund-Dividend,13.68
2007-02-26,102481,JM Large Cap Fund-Growth,17.25
2007-02-26,102482,Sundaram India Leadership Fund-Growth,28.8461
2007-02-26,102483,Sundaram India Leadership Fund-Dividend,14.0708
2007-02-26,102491,UTI - GROWTH & VALUE FUND-ANNUAL DIVIDEND,23.13
2007-02-26,102494,UTI - GROWTH & VALUE FUND-GROWTH,57.2
2007-02-26,102495,UTI - GROWTH & VALUE FUND-SEMI ANNUAL DIVIDEND,16.14
2007-02-26,102496,UTI - INDIA ADVANTAGE EQUITY FUND-DIVIDEND,8.43
2007-02-26,102497,UTI - INDIA ADVANTAGE EQUITY FUND-GROWTH,8.43
2007-02-26,102503,SBI  SAVINGS FUND - REGULAR PLAN - GROWTH,11.5213
2007-02-26,102504,SBI Savings Fund - Regular Plan - Income Distribution cum Capital Withdrawal Option (IDCW),10.1047
2007-02-26,102505,SBI CREDIT RISK FUND - REGULAR PLAN - GROWTH,11.4556
2007-02-26,102506,SBI Credit Risk Fund - Regular Plan - Income Distribution cum Capital Withdrawal Option (IDCW),10.3687
2007-02-26,102507,OLD-SBI Magnum Income Fund - F R P - Long Term - Inst. (G),11.57
2007-02-26,102508,SBI Magnum Income Fund - F R P - Long Term - Inst. (D),10.6873
2007-02-26,102509,UTI Gilt Fund - Regular Plan - IDCW,10.6737
2007-02-26,102510,UTI - GILT FUND - Regular Plan - Growth Option,15.1981
2007-02-26,102511,UTI - GILT FUND -Discontinued PF Plan -Dividend Option,10.6267
2007-02-26,102512,UTI - GILT FUND - Discontinued PF Plan - Growth Option,11.3017
2007-02-26,102513,UTI - GILT ADVANTAGE-LONG TERM PF-( PRESCRIBED APPRECIATION AUTO REDEMPTION,11.3196
2007-02-26,102514,UTI - GILT FUND - Discontinued PF Plan Prescribed Date Auto Redemption Option,11.3056
2007-02-26,102517,UTI - DYNAMIC EQUITY FUND-GROWTH,34.81
2007-02-26,102518,UTI - DYNAMIC EQUITY FUND-DIVIDEND,19.01
2007-02-26,102528,ICICI Prudential MidCap Fund - Growth,28.25
2007-02-26,102529,ICICI Prudential MidCap Fund - IDCW,20.58
2007-02-26,102530,ICICI Prudential MidCap Fund - Institutional Option - I,11.07
2007-02-26,102531,UTI Ultra Short Duration Fund - Regular Plan - Weekly IDCW (Reinvestment),1016.5313
2007-02-26,102532,UTI Ultra Short Duration Fund - Regular Plan - Growth Option,1214.6228
2007-02-26,102533,UTI Conservative Hybrd Fund - Regular Plan - Monthly Payment Option,14.0018
2007-02-26,102534,UTI Conservative Hybrid Fund - Regular Plan - Flexi IDCW,14.0143
2007-02-26,102535,UTI Conservative Hybrid Fund - Regular Plan - Growth Option,14.0126
2007-02-26,102536,UTI Conservative Hybrid Fund - Regular Plan - Monthly IDCW,11.9511
2007-02-26,102538,UTI Low Duration Fund - Discontinued - Annaul Dividend Option,11.4467
2007-02-26,102539,UTI Low Duration Fund - Discontinued Bonus Option,12.5328
2007-02-26,102540,UTI Low Duration Fund - Discontinued Growth Option,18.8013
2007-02-26,102541,UTI Low Duration Fund - Discontinued - Quarterly Dividend Option,11.1012
2007-02-26,102545,UTI Low Duration Fund - Regular Plan - Bonus Option,11.5152
2007-02-26,102546,Franklin India Life Stage Fund Of Funds - 50's Plus Floating Rate Plan - IDCW,12.0594
2007-02-26,102547,Franklin India Life Stage Fund of Funds - The 50s Plus Flo (Gro),13.5888
2007-02-26,102556,GFRF Long Term-Plan A-Growth,11.4341
2007-02-26,102557,GFRF Long Term-Plan A-Dividend Quarterly,10.3353
2007-02-26,102558,GFRF Long Term-Plan A-Dividend Annual,10.4247
2007-02-26,102559,GFRF Long Term-Plan A-Dividend Monthly,10.0599
2007-02-26,102560,GFRF Long Term-Plan B-Growth,11.4908
2007-02-26,102561,GFRF Long Term-Plan B-Dividend Quarterly,10.3802
2007-02-26,102573,Kotak Multi Asset Omni FOF - Payout of Income Distribution cum capital withdrawal option,24.974
2007-02-26,102574,Kotak Multi Asset Omni FOF - Growth- Regular,24.974
2007-02-26,102577,DBS Chola Mid Cap Fund-Dividend,14.85
2007-02-26,102578,DBS Chola Mid Cap Fund-Cumulative,25.73
2007-02-26,102585,ICICI Prudential FMP-15 Month - Series 25-Retail Plan-Cumulative Option,11.4069
2007-02-26,102587,ICICI Prudential FMP-15 Month - Series 25-Institutional Plan-Cumulative Option,11.5074
2007-02-26,102590,Kotak Savings Fund -Weekly Weekly Reinvestment of Income Distribution cum capital withdrawal option,10.0452
2007-02-26,102591,Kotak Savings Fund -Growth,11.5889
2007-02-26,102592,Kotak Savings Fund -Monthly Payout of Income Distribution cum capital withdrawal option,10.0222
2007-02-26,102594,ICICI Prudential Value Fund (erstwhile Value Discovery Fund) - Growth,25.64
2007-02-26,102595,ICICI Prudential Value Fund (erstwhile Value Discovery Fund) - IDCW,17.73
2007-02-26,102596,ICICI Prudential Value Discovery Fund - Institutional Option - I - Growth,10.9
2007-02-26,102619,ABN AMRO Flexi Debt Fund-Regular Plan-Growth Option,11.5033
2007-02-26,102620,ABN AMRO Flexi Debt Fund-Regular Plan-Quarterly Dividend Option,10.2242
2007-02-26,102621,ABN AMRO Flexi Debt Fund-Regular Plan-Half-Yearly Dividend Option,10.4408
2007-02-26,102622,ABN AMRO Flexi Debt Fund-Regular Plan-Daily Dividend Option,10.0
2007-02-26,102623,ABN AMRO Flexi Debt Fund-Regular Plan-Weekly Dividend Option,10.0072
2007-02-26,102639,ABN AMRO  Equity Fund-Growth Plan,25.79
2007-02-26,102640,ABN AMRO  Equity Fund-Dividend Plan,14.11
2007-02-26,102641,ABN AMRO  Short Term Income Fund-Regular Plan-Growth Option,11.3812
2007-02-26,102642,ABN AMRO  Short Term Income Fund-Regular Plan-Monthly Dividend Option,10.0472
2007-02-26,102643,ABN AMRO  Short Term Income Fund-Regular Plan-Weekly Dividend Option,10.0067
2007-02-26,102644,ABN AMRO  Short Term Income Fund-Institutional Plan-Growth Option,11.5037
2007-02-26,102645,ABN AMRO  Short Term Income Fund-Institutional Plan-Daily Dividend Option,10.0
2007-02-26,102646,ABN AMRO  Short Term Income Fund-Institutional Plan-Monthly Dividend Option,10.0488
2007-02-26,102647,ABN AMRO  Short Term Income Fund-Institutional Plan-Weekly Dividend Option,10.0069
2007-02-26,102652,ABN AMRO  Monthly Income Plan-Regular Plan-Growth Option,13.1454
2007-02-26,102653,ABN AMRO  Monthly Income Plan-Regular Plan-Monthly Dividend Option,11.0077
2007-02-26,102654,ABN AMRO  Monthly Income Plan-Regular Plan-Quarterly Dividend Option,11.0
2007-02-26,102659,DBS Chola Floating Rate Fund-Dividend,10.3779
2007-02-26,102660,DBS Chola Floating Rate Fund-Cumulative,11.4165
2007-02-26,102661,BARODA CONSERVATIVE HYBRID FUND - Plan A - Growth Option,11.7672
2007-02-26,102662,BARODA CONSERVATIVE HYBRID FUND - Plan A - Monthly IDCW Option,11.7721
2007-02-26,102663,BARODA CONSERVATIVE HYBRID FUND - Plan A - Quarterly IDCW Option,11.7677
2007-02-26,102670,BARODA PIONEER CHILDREN FUND-GIFT PLAN,10.61
2007-02-26,102672,Tata Liquid Fund -Regular Plan - Growth Option,11.6139
2007-02-26,102673,Nippon India Floater Fund - Growth Plan-Growth Option,11.5855
2007-02-26,102675,NIPPON INDIA FLOATER FUND - MONTHLY IDCW Option,10.128
2007-02-26,102676,NIPPON INDIA FLOATER FUND - DAILY IDCW REINVESTMENT Option,10.0622
2007-02-26,102677,NIPPON INDIA FLOATER FUND - WEEKLY IDCW Option,10.0831
2007-02-26,102682,Birla Sun Life Fixed Maturity Plan - Quarterly Series II-Dividend,10.1728
2007-02-26,102683,Birla Sun Life Fixed Maturity Plan - Quarterly Series II-Growth,11.6699
2007-02-26,102701,Sundaram Money Fund Institutional Plan - Daily Reinvestment of Income Distribution cum Capital Withdrawal (IDCW),10.0953
2007-02-26,102703,Sundaram Money Fund Institutional Plan - Growth,15.6529
2007-02-26,102704,Sundaram Money Fund Institutional Plan - Monthly Income Distribution cum Capital Withdrawal (IDCW),10.2138
2007-02-26,102705,Sundaram Money Fund Institutional Plan - Quarterly Reinvestment of Income Distribution cum Capital Withdrawal (IDCW),10.457
2007-02-26,102706,Sundaram Money Fund Institutional Plan - Weekly Reinvestment of Income Distribution cum Capital Withdrawal (IDCW),10.363
2007-02-26,102711,ING Select Debt Fund-Growth Option,11.1454
2007-02-26,102712,ING Select Debt Fund-Quarterly Dividend Option,10.1843
2007-02-26,102713,ING Select Debt Fund-Half Yearly Dividend Option,10.3124
2007-02-26,102714,ING Select Debt Fund-Annual Dividend Option,10.4572
2007-02-26,102715,ING Select Debt Fund-Bonus Option,11.1454
2007-02-26,102716,ING Domestic Opportunities Fund-Growth Option,26.66
2007-02-26,102717,ING Domestic Opportunities Fund-Dividend Option,12.26
2007-02-26,102718,ING Domestic Opportunities Fund-Bonus Option,26.66
2007-02-26,102719,Principal Low Duration Fund - Growth,11.5877
2007-02-26,102720,Principal Floating Rate Fund - FMP-Weekly Dividend,10.0093
2007-02-26,102721,Principal Floating Rate Fund - FMP-Monthly Dividend,10.3033
2007-02-26,102722,Principal Low Duration Fund- Growth Option,11.6268
2007-02-26,102723,Principal Low Duration Fund - Weekly Income Distribution CUM Capital Withdrawal Option,10.0093
2007-02-26,102724,Principal Low Duration Fund- Monthly Income Distribution CUM Capital Withdrawal Option,10.1106
2007-02-26,102725,Principal Floating Rate Fund - SMP-Growth,11.5452
2007-02-26,102726,Principal Floating Rate Fund - SMP-Daily Dividend,10.0007
2007-02-26,102727,Principal Floating Rate Fund - SMP-Weekly Dividend,10.0092
2007-02-26,102728,Principal Floating Rate Fund - SMP-Monthly Dividend,10.2192
2007-02-26,102729,Principal Credit Risk Fund - Regular Plan - Growth Option,11.5868
2007-02-26,102730,Principal Floating Rate Fund - SMP-Insti. Daily Dividend,10.0007
2007-02-26,102731,Principal Floating Rate Fund - SMP-Insti. Weekly Dividend,10.0093
2007-02-26,102732,Principal Credit Risk Fund - Regular Plan - Monthly Dividend Option,10.406
2007-02-26,102733,Standard Chartered All Seasons Bond Fund-Plan A-Dividend - Quarterly,10.358
2007-02-26,102734,Standard Chartered All Seasons Bond Fund-Plan A-Growth,11.3797
2007-02-26,102735,Standard Chartered All Seasons Bond Fund-Plan A-Dividend - Half Yearly,10.4933
2007-02-26,102736,Standard Chartered All Seasons Bond Fund-Plan A-Dividend - Annual,10.7765
2007-02-26,102741,ICICI Prudential Medium Term Bond Fund - Growth,11.4408
2007-02-26,102742,ICICI Prudential Medium Term Bond Fund - Dividend,10.1546
2007-02-26,102743,ICICI Prudential Medium Term Bond Fund-Plan B-Growth,11.5591
2007-02-26,102744,ICICI Prudential Medium Term Bond Fund-Plan B-Dividend,10.1782
2007-02-26,102751,Nippon India Consumption Fund-Growth Plan-Growth Option,24.9915
2007-02-26,102752,Nippon India Consumption Fund-Growth Plan-Bonus Option,24.9915
2007-02-26,102753,NIPPON INDIA CONSUMPTION FUND - IDCW Option,20.861
2007-02-26,102754,Birla Sun Life Fixed Maturity Plan - Annual Series 1-Dividend,10.2987
2007-02-26,102755,Birla Sun Life Fixed Maturity Plan - Annual Series 1-Growth,11.5514
2007-02-26,102756,SBI FOCUSED FUND - REGULAR PLAN -GROWTH,29.31
2007-02-26,102760,HDFC Focused Fund - GROWTH PLAN,24.811
2007-02-26,102761,HDFC Focused Fund - IDCW PLAN,19.113
2007-02-26,102765,SBI Focused Fund - Regular Plan - Income Distribution cum Capital Withdrawal Option (IDCW),18.01
2007-02-26,102766,Aditya Birla Sun Life Dynamic Bond Fund -Regular - Quarterly IDCW,10.1611
2007-02-26,102767,Aditya Birla Sun Life Dynamic Bond Fund - Growth - Regular Plan,11.3584
2007-02-26,102798,ING Treasury Management Fund-Growth Option,11.4829
2007-02-26,102799,ING Treasury Management Fund-Weekly Dividend Option,10.3349
2007-02-26,102800,ING Treasury Management Fund-Quarterly Dividend Option,10.3365
2007-02-26,102801,ING Treasury Management Fund-Half Yearly Dividend Option,10.4752
2007-02-26,102802,ING Treasury Management Fund-Annual Dividend Option,10.7636
2007-02-26,102803,ING Treasury Management Fund-Bonus Option,11.4829
2007-02-26,102804,ING Treasury Management Fund-Daily Dividend Option,10.0483
2007-02-26,102805,Canara Robeco Nifty Index - Regular Plan - Growth,21.18
2007-02-26,102806,Canara Robeco Nifty Index - Regular Plan - Dividend,13.66
2007-02-26,102807,Principal Dividend Yield Fund-Growth Plan,15.06
2007-02-26,102808,Principal Dividend Yield Fund- Half Yearly Income Distribution CUM Capital Withdrawal Plan,12.27
2007-02-26,102813,LIC NOMURA MF Floater MIP - Monthly Dividend,10.0251
2007-02-26,102814,LIC NOMURA MF Floater MIP - Quarterly Dividend,10.1763
2007-02-26,102815,LIC NOMURA MF Floater MIP - Yearly Dividend,11.0872
2007-02-26,102816,LIC NOMURA MF Floater MIP - Growth,12.6626
2007-02-26,102823,SBI HEALTHCARE OPPORTUNITIES FUND - REGULAR PLAN -GROWTH,33.96
2007-02-26,102827,HSBC Floating Rate Fund - Long Term - Regular - Growth,11.3611
2007-02-26,102828,HSBC Floating Rate Fund - Long Term - Regular - Dividend - Monthly,10.0049
2007-02-26,102829,HSBC Floating Rate Fund - Long Term - Growth,11.4145
2007-02-26,102830,HSBC Floating Rate Fund - Long Term - Dividend - Weekly,10.477
2007-02-26,102831,HSBC Floating Rate Fund - Long Term - Dividend - Monthly,10.0331
2007-02-26,102832,HSBC Floating Rate Fund - Short Term - Regular - Growth,11.3903
2007-02-26,102833,HSBC Floating Rate Fund - Short Term - Regular - Dividend - Daily,10.0
2007-02-26,102834,HSBC Floating Rate Fund - Short Term - Regular - Dividend - Weekly,10.0076
2007-02-26,102835,HSBC Floating Rate Fund - Short Term - Inst. - Growth,11.4437
2007-02-26,102836,HSBC Floating Rate Fund - Short Term - Inst. - Dividend - Daily,10.0157
2007-02-26,102837,HSBC Floating Rate Fund - Short Term - Inst. - Dividend - Weekly,10.035
2007-02-26,102838,HSBC Floating Rate Fund - Short Term - Inst. - Dividend - Monthly,10.0262
2007-02-26,102840,HSBC Floating Rate Fund - Short Term - Inst. Plus - Dividend - Daily,10.0262
2007-02-26,102846,Nippon India Balanced Advantage Fund-Growth Plan-Growth Option,24.3641
2007-02-26,102847,Nippon India Balanced Advantage Fund-Growth Plan-Bonus Option,24.3641
2007-02-26,102848,NIPPON INDIA BALANCED ADVANTAGE FUND - IDCW Option,20.6866
2007-02-26,102849,Nippon India Dynamic Bond Fund-Growth Plan-Growth Option,11.3088
2007-02-26,102851,NIPPON INDIA DYNAMIC BOND FUND - IDCW Option,11.3088
2007-02-26,102855,Birla Sun Life Fixed Maturity Plan - Annual  Series 3-Dividend,10.2158
2007-02-26,102856,Birla Sun Life Fixed Maturity Plan - Annual  Series 3-Growth,11.6052
2007-02-26,102858,Tata Dividend Yield Fund  Regular Plan -( Div),13.9588
2007-02-26,102859,Tata Dividend Yield Fund Regular Plan,16.9922
2007-02-26,102860,SBI Savings Fund - Regular Plan Weekly Income Distribution cum Capital Withdrawal Option (IDCW),10.188
2007-02-26,102867,Kotak Flexi-Debt - Regular Plan - Dividend,10.219
2007-02-26,102868,Kotak Flexi-Debt - Regular Plan - Growth,11.5474
2007-02-26,102869,Kotak Flexi-Debt- Regular Plan - Daily Dividend,10.0311
2007-02-26,102870,Z-OLD-SBI Magnum Inst. Income Fund -  Savings - Wkly(D)(Upto 22/03/07) Renamed as SBI Premier Liquid Fund,10.5694
2007-02-26,102874,Kotak-Small Cap Fund - Payout of Income Distribution cum capital withdrawal option,15.31
2007-02-26,102875,Kotak-Small Cap Fund - Growth,19.955
2007-02-26,102883,Franklin India Large & Mid Cap Fund - Growth Plan,20.43
2007-02-26,102884,Franklin India Large & Mid Cap Fund - IDCW,18.12
2007-02-26,102885,SBI EQUITY HYBRID FUND - REGULAR PLAN -Growth,34.94
2007-02-26,102896,Principal Focussed Advantage Fund-Dividend,16.11
2007-02-26,102897,Principal Focussed Advantage Fund-Growth,16.11
2007-02-26,102900,LIC NOMURA MF Opportunities Fund-Dividend,11.6079
2007-02-26,102901,LIC NOMURA MF Opportunities Fund-Growth,16.7294
2007-02-26,102902,JM Equity & Derivative Fund-Growth-growth option,11.4317
2007-02-26,102903,JM Equity & Derivative Fund-Dividend-dividend option,10.4019
2007-02-26,102904,JM Equity & Derivative Fund-Bonus-Bonus option,10.5854
2007-02-26,102905,Reliance Index Fund-Sensex Plan-Growth Option,20.0239
2007-02-26,102906,Reliance Index Fund-Sensex Plan-Bonus Option,20.0239
2007-02-26,102907,Reliance Index Fund-Sensex Plan-Dividend Option,20.0239
2007-02-26,102908,Reliance Index Fund-Nifty Plan-Growth Option,15.9276
2007-02-26,102909,Reliance Index Fund-Nifty Plan-Bonus Option,15.9276
2007-02-26,102910,Reliance Index Fund-Nifty Plan-Dividend Option,15.9276
2007-02-26,102913,CANARA ROBECO SAVINGS FUND - REGULAR PLAN - GROWTH OPTION,11.3661
2007-02-26,102914,CANARA ROBECO SAVINGS FUND - REGULAR PLAN - IDCW (Payout/Reinvestment),10.9314
2007-02-26,102915,CANARA ROBECO SAVINGS FUND - REGULAR PLAN - WEEKLY IDCW (Payout/Reinvestment),10.2682
2007-02-26,102920,CANARA ROBECO LARGE AND MID CAP FUND - REGULAR PLAN - GROWTH OPTION,15.4
2007-02-26,102921,CANARA ROBECO LARGE AND MID CAP FUND - REGULAR PLAN - IDCW (Payout/Reinvestment),13.13
2007-02-26,102922,Canara Robeco Large and Mid Cap Fund -BONUS OPTION,15.4
2007-02-26,102929,Tata Service Industries Fund - Dividend,19.906
2007-02-26,102930,Tata Service Industries Fund - Appreciation,19.8365
2007-02-26,102931,ING Midcap Fund-Growth Option,16.76
2007-02-26,102932,ING Midcap Fund-Dividend Option,15.33
2007-02-26,102933,ING Midcap Fund-Bonus Option,16.76
2007-02-26,102941,SBI MIDCAP FUND - REGULAR PLAN - GROWTH,22.05
2007-02-26,102942,SBI Midcap Fund - Regular Plan - Income Distribution cum Capital Withdrawal Option (IDCW),18.94
2007-02-26,102947,HDFC Hybrid Equity Fund - IDCW Plan,14.198
2007-02-26,102948,HDFC Hybrid Equity Fund - Growth Plan,18.183
2007-02-26,102951,ABN  AMRO Opportunities Fund-Growth,20.499
2007-02-26,102952,ABN  AMRO Opportunities Fund-Dividend,17.642
2007-02-26,102957,ICICI Prudential Multicap Fund - Institutional Option - I,21.44
2007-02-26,102960,Z-OLD-SBI Magnum Inst. Income Fund -  Savings - Fortnightly(D)(Upto 22/03/07) Renamed as SBI Premier Liquid Fund,10.0958
2007-02-26,102961,Fidelity Equity Fund-Growth Option,21.079
2007-02-26,102962,Fidelity Equity Fund-Dividend Option,18.601
2007-02-26,103001,Kotak Dynamic FOF---Growth,16.805
2007-02-26,103024,SBI LARGE & MIDCAP FUND- REGULAR PLAN -Growth,52.75
2007-02-26,103025,UTI Dividend Yield Fund - Regular Plan - IDCW,12.43
