date,scheme_code,scheme_name,nav
2007-02-26,100027,Grindlays Super Saver Income Fund-GSSIF-Half Yearly Dividend,10.3083
2007-02-26,100028,Grindlays Super Saver Income Fund-GSSIF-Quaterly Dividend,10.2216
2007-02-26,100029,Grindlays Super Saver Income Fund-GSSIF-Growth,16.7625
2007-02-26,100030,Grindlays Super Saver Income Fund-GSSIF-Annual Dividend,10.5346
2007-02-26,100031,Grindlays Super Saver Income Fund-GSSIF - ST-Dividend,10.0061
2007-02-26,100032,Grindlays Super Saver Income Fund-GSSIF - ST-Growth,14.6568
2007-02-26,100033,Aditya Birla Sun Life Large & Mid Cap Fund - Regular Growth,122.91
2007-02-26,100034,Aditya Birla Sun Life Large & Mid Cap Fund -Regular - IDCW,88.17
2007-02-26,100035,Birla Sun Life Freedom Fund-Plan A (Dividend),18.46
2007-02-26,100036,Birla Sun Life Freedom Fund-Plan B (Growth),27.76
2007-02-26,100037,Aditya Birla Sun Life Income Fund - Regular - Quarterly IDCW,10.15
2007-02-26,100038,Aditya Birla Sun Life Income Fund - Growth - Regular Plan,30.2828
2007-02-26,100041,Aditya Birla Sun Life Liquid Fund -Institutional - IDCW,10.8023
2007-02-26,100042,Aditya Birla Sun Life Liquid Fund-Retail (Growth),20.0074
2007-02-26,100043,Aditya Birla Sun Life Liquid Fund-Institutional (Growth),20.1472
2007-02-26,100044,Aditya Birla Sun Life Liquid Fund -Retail - IDCW,16.3694
2007-02-26,100046,Aditya Birla Sun Life Liquid Fund -Daily IDCW,10.0195
2007-02-26,100047,Aditya Birla Sun Life Liquid Fund - Growth,11.8333
2007-02-26,100048,Aditya Birla Sun Life Liquid Fund -Institutional - weekly  IDCW,10.8136
2007-02-26,100049,Aditya Birla Sun Life Cash Plus-Institutional - Fortnightly Dividend,10.8278
2007-02-26,100051,Aditya Birla Sun Life Liquid Fund -weekly IDCW,10.029
2007-02-26,100052,Aditya Birla Sun Life Cash Plus-Institutional Premium - Fortnightly Dividend,10.065
2007-02-26,100053,Aditya Birla Sun Life Cash Plus-Institutional Premium Plan-Monthly Dividend,10.0549
2007-02-26,100054,Aditya Birla Sun Life Gilt Plus - Liquid Plan - Quarterly Dividend - Regular Plan,10.7632
2007-02-26,100055,Aditya Birla Sun Life Gilt Plus - Liquid Plan - Growth - Regular Plan,18.1051
2007-02-26,100056,Aditya Birla Sun Life Gilt Plus - Liquid Plan - Annual Dividend - Regular Plan,12.0561
2007-02-26,100057,Aditya Birla Sun Life Govenment Securities Fund -Regular - Quarterly IDCW,10.5914
2007-02-26,100058,Aditya Birla Sun Life Government Securities Fund  - Growth - Regular Plan,20.6226
2007-02-26,100059,Aditya Birla Sun Life Gilt Plus-PF Plan (Annual Dividend),20.6233
2007-02-26,100060,Aditya Birla Sun Life Constant Maturity 10 Year Gilt Fund - Quarterly Dividend - Regular Plan,11.1835
2007-02-26,100061,Aditya Birla Sun Life Constant Maturity 10 Year Gilt Fund - Growth - Regular Plan,23.3056
2007-02-26,100062,Aditya Birla Sun Life Gilt Plus-Regular Plan (Annual Dividend),23.3532
2007-02-26,100063,Aditya Birla Sun Life MNC Fund - Regular - IDCW,60.51
2007-02-26,100064,Aditya Birla Sun Life MNC Fund - Growth - Regular Plan,120.71
2007-02-26,100065,Aditya Birla Sun Life India Opportunities Fund - Dividend - Regular Plan,22.41
2007-02-26,100066,Aditya Birla Sun Life India Opportunities Fund - Growth - Regular Plan,52.19
2007-02-26,100067,Aditya Birla Sun Life Tax Plan -Regular - IDCW,56.73
2007-02-26,100068,BARODA ELSS 96 - Plan A - IDCW,19.64
2007-02-26,100069,BARODA PIONEER DIVERSIFIED FUND,30.06
2007-02-26,100077,DSP Bond Fund - IDCW,10.7125
2007-02-26,100078,DSP Bond Fund - Growth,24.9762
2007-02-26,100079,DSP Bond Fund - IDCW - Monthly,10.4261
2007-02-26,100080,DSP Flexi Cap Fund - Regular Plan - IDCW,38.814
2007-02-26,100081,DSP Aggressive Hybrid Fund- Regular Plan - Growth,37.958
2007-02-26,100082,DSP Aggressive Hybrid Fund- Regular Plan - IDCW,22.02
2007-02-26,100084,DSP Gilt Fund - Regular Plan - Growth,23.0372
2007-02-26,100085,DSP Gilt Fund - Regular Plan - IDCW,11.4817
2007-02-26,100086,DSP Gilt Fund - Regular Plan - IDCW - Monthly,10.1082
2007-02-26,100087,DSP Savings Fund - Regular Plan - Growth,16.8321
2007-02-26,100088,DSP Savings Fund - Regular Plan - IDCW,11.1043
2007-02-26,100089,DSP Savings Fund - Regular Plan - IDCW - Monthly,10.1076
2007-02-26,100090,DSP BlackRock Technology.com   Fund - Regular Plan - Growth,25.876
2007-02-26,100119,HDFC Balanced Advantage Fund - Growth Plan,46.765
2007-02-26,100120,HDFC Balanced Advantage Fund - IDCW Plan,25.386
2007-02-26,100121,HDFC Balanced Fund - Dividend Option,17.071
2007-02-26,100122,HDFC Balanced Fund - Growth Option,30.219
2007-02-26,100123,HDFC Income Fund - Quarterly IDCW Option,10.1342
2007-02-26,100124,HDFC Income Fund - Growth Option,16.5775
2007-02-26,100150,Principal Child Benefit Fund-Super Saver-Future Guard Plan,56.1
2007-02-26,100151,Principal Retail Equity Savings Fund - Growth Option,56.85
2007-02-26,100152,Principal Nifty 100 Equal Weight Fund-Income Distribution CUM Capital Withdrawal,21.7785
2007-02-26,100153,Principal Nifty 100 Equal Weight Fund-Growth,28.1707
2007-02-26,100156,Principal Tax Savings Fund,75.69
2007-02-26,100171,Quant Dynamic Bond-Dividend,10.0778
2007-02-26,100172,Quant Dynamic Bond-Growth,22.5961
2007-02-26,100173,Quant Dynamic Bond-Bonus,11.9018
2007-02-26,100174,quant ELSS Tax Saver Fund - IDCW Option - Regular Plan,14.8926
2007-02-26,100175,quant ELSS Tax Saver Fund - Growth Option - Regular Plan,42.2922
2007-02-26,100176,quant Small Cap Fund - IDCW Option - Regular Plan,16.6144
2007-02-26,100177,quant Small Cap Fund - Growth - Regular Plan,19.6823
2007-02-26,100178,ING Income Fund-Regular Plan -Dividend Option (Quarterly),10.1935
2007-02-26,100179,ING Income Fund-Regular Plan -Dividend Option (Half Yearly),10.3413
2007-02-26,100180,ING Income Fund- Regular Plan - Dividend Option (Annual),10.683
2007-02-26,100181,ING Income Fund-Regular Plan -Growth Option,18.1601
2007-02-26,100182,ING Income Fund-Institutional Plan - Dividend Option (Half Yearly),10.0
2007-02-26,100183,ING Income Fund-Institutional Plan - Dividend Option (Quarterly),10.0
2007-02-26,100184,ING Income Fund-Institutional Plan -Dividend Option (Annual),10.7175
2007-02-26,100185,ING Income Fund-Bonus Option,11.0727
2007-02-26,100186,ING Income Fund-Institutional Bonus Option,11.3196
2007-02-26,100187,ING Income Fund-Institutional Plan - Growth Option,18.9092
2007-02-26,100188,ING Core Equity Fund-Dividend Option,14.24
2007-02-26,100189,ING Core Equity Fund-Growth Option,26.95
2007-02-26,100190,ING Liquid Fund-Regular Growth Option,15.7578
2007-02-26,100191,ING Liquid Fund-Regular Weekly Dividend Option,10.8394
2007-02-26,100192,ING Liquid Fund-Regular Daily Dividend Option,10.7873
2007-02-26,100194,ING Liquid Fund-Auto Sweep Growth Option,10.0
2007-02-26,100195,ING Liquid Fund-Auto Sweep Weekly Dividend Option,10.0
2007-02-26,100196,ING Liquid Fund-Institutional Growth Option,11.6883
2007-02-26,100197,ING Liquid Fund-Institutional Weekly Dividend Option,10.0686
2007-02-26,100198,ING Liquid Fund-Institutional Daily Dividend Option,10.0121
2007-02-26,100199,ING Liquid Fund-Super Institutional Growth Option,11.0634
2007-02-26,100200,ING Liquid Fund-Super Institutional Daily Dividend Option,10.0048
2007-02-26,100201,ING Liquid Fund-Super Institutional Weekly Dividend Option,10.0992
2007-02-26,100202,ING Balanced Fund-Dividend Option,12.86
2007-02-26,100203,ING Balanced Fund-Growth Option,18.39
2007-02-26,100218,JM Large Cap Fund (Regular) - IDCW,16.1
2007-02-26,100219,JM Large Cap Fund (Regular) - Growth Option,35.82
2007-02-26,100220,JM Aggressive Hybrid Fund (Regular) - IDCW,17.3
2007-02-26,100221,JM Aggressive Hybrid Fund (Regular) -Growth Option,22.76
2007-02-26,100222,JM Medium to Long Duration Fund (Regular) - Quarterly IDCW,10.3312
2007-02-26,100223,JM Medium to Long Duration Fund (Regular) - Growth Option,28.6373
2007-02-26,100233,JM Liquid Fund (Regular) - Weekly IDCW,10.4039
2007-02-26,100234,JM Liquid Fund - Growth Option,20.433
2007-02-26,100237,JM High Liquidity Fund-- Institutional Plan - Growth,12.3272
2007-02-26,100238,JM High Liquidity Fund-Institutional Plan - Daily Dividend,10.0159
2007-02-26,100241,JM High Liquidity Fund-- Institutional Plan - Dividend,10.1684
2007-02-26,100243,JM High Liquidity Fund-- Premium Plan - Daily Dividend Option,10.0
2007-02-26,100244,JM Liquid Fund (Regular) - Quarterly IDCW,11.7645
2007-02-26,100245,JM High Liquidity Fund-Super Institutional Plan- Daily Dividend,10.0165
2007-02-26,100246,JM High Liquidity Fund-Super Institutional Plan- Weekly  Dividend,10.1561
2007-02-26,100247,JM Liquid Fund (Regular) - Super Institutional Plan - Growth Option,11.7217
2007-02-26,100249,JM G-Sec Fund - Quarterly Dividend Option,10.3642
2007-02-26,100250,JM G-Sec Fund - Growth Option,21.1996
2007-02-26,100251,JM G-Sec Fund-PF Plan - Growth Plan,22.165
2007-02-26,100252,JM G-Sec Fund-PF Plan -Dividend Plan,20.3098
2007-02-26,100253,JM G-Sec Fund - Bonus Option - Principal Units,10.3123
2007-02-26,100254,JM Value Fund (Regular) - Growth Option,19.12
2007-02-26,100261,Kotak Gilt-Savings-Monthly Dividend,10.4463
2007-02-26,100262,Kotak Gilt-Savings-Growth,18.0774
2007-02-26,100263,Kotak Gilt-Savings-Annual Dividend,12.0889
2007-02-26,100264,Kotak Gilt-Investment Regular-Payout of Income Distribution cum capital withdrawal option,11.3089
2007-02-26,100265,Kotak Gilt-Investment Regular-Growth,23.5104
2007-02-26,100280,Kotak Gilt-Investment  Provident Fund and Trust-Payout of Income Distribution cum capital withdrawal option,10.7494
2007-02-26,100281,Kotak Gilt-Investment  Provident Fund and Trust-Growth,23.8122
2007-02-26,100286,Kotak Aggressive Hybrid Fund - Regular Plan - IDCW - Payout & Reinvestment of Income Distribution cum capital withdrawal option,23.402
2007-02-26,100289,Kotak Tech,10.728
2007-02-26,100290,Kotak MNC,26.328
2007-02-26,100291,Kotak Bond-Deposit-Dividend,11.7407
2007-02-26,100292,Kotak Bond-Deposit-Growth,18.5768
2007-02-26,100298,Kotak Bond Regular Plan Quaterly Payout of Income Distribution cum capital withdrawal option,10.4292
2007-02-26,100299,Kotak Bond Fund - Regular Plan Growth,19.5143
2007-02-26,100300,Kotak Bond Fund - Regular Plan - Standard IDCW Option,13.0416
2007-02-26,100301,Kotak Bond Regular Plan Bonus Plan,13.0073
2007-02-26,100312,LIC MF Flexi Cap Fund-Regular Plan-IDCW,11.3218
2007-02-26,100313,LIC MF Flexi Cap Fund-Regular Plan-Growth,20.4645
2007-02-26,100314,LIC MF Medium to Long Duration Fund-Regular Plan-IDCW,10.1632
2007-02-26,100315,LIC MF Medium to Long Duration Fund-Regular Plan-Growth,19.8898
2007-02-26,100316,LIC MF Gilt Fund-Regular Plan-IDCW,10.9518
2007-02-26,100317,LIC MF Gilt Fund-Regular Plan-Growth,18.8439
2007-02-26,100318,LIC MF Gilt Fund-PF Plan-IDCW,10.8661
2007-02-26,100319,LIC MF Gilt Fund-PF Plan-Growth,10.8661
2007-02-26,100321,LIC MF Aggressive Hybrid Fund-Regular Plan-IDCW,10.3618
2007-02-26,100323,LIC MF Aggressive Hybrid Fund-Regular Plan-Growth,43.7751
2007-02-26,100325,LIC MF ULIS (5 Yrs. Single Premium)-Regular Plan-IDCW Reinvestment,10.4754
2007-02-26,100332,LIC MF Large Cap Fund-Regular Plan-IDCW,10.4006
2007-02-26,100337,SaharaTax Gain-Dividend,17.6723
2007-02-26,100338,SaharaTax Gain-Growth,20.2554
2007-02-26,100347,Morgan Stanley Growth Fund- Regular Growth Plan,49.91
2007-02-26,100348,ICICI Prudential Large & Mid Cap Fund - IDCW,22.47
2007-02-26,100349,ICICI Prudential Large & Mid Cap Fund - Growth,91.78
2007-02-26,100350,ICICI Prudential Large & Mid Cap Fund - Institutional Option - I - Growth,12.19
2007-02-26,100351,ICICI Prudential FMCG Fund - IDCW,31.76
2007-02-26,100352,ICICI Prudential FMCG Fund - Growth,39.91
2007-02-26,100353,ICICI Prudential ELSS Tax Saver Fund - IDCW,21.03
2007-02-26,100354,ICICI Prudential ELSS Tax Saver Fund - Growth,87.58
2007-02-26,100355,ICICI Prudential Equity & Debt Fund - Monthly IDCW,17.94
2007-02-26,100356,ICICI Prudential Equity & Debt Fund - Growth,34.41
2007-02-26,100357,ICICI Prudential Liquid Fund -Quarterly IDCW,10.851
2007-02-26,100359,ICICI Prudential Liquid Institutional Plus Fund - Div - Daily,11.8515
2007-02-26,100360,ICICI Prudential Liquid Institutional Plus Fund - Div - Weekly,11.8714
2007-02-26,100361,ICICI Prudential Liquid Fund-Dividend-Institutional Plus - Monthly,11.9852
2007-02-26,100362,ICICI Prudential Liquid Institutional Plus Fund - Growth,18.4688
2007-02-26,100363,ICICI Prudential Technology Fund - Growth,16.04
2007-02-26,100364,ICICI Prudential Long Term Bond Fund - Half Yearly IDCW,10.5431
2007-02-26,100365,ICICI Prudential Long Term Bond Fund - Growth,21.4496
2007-02-26,100366,ICICI Prudential Long Term Bond Fund-Institutional Quarterly Dividend,10.1551
2007-02-26,100367,ICICI Prudential Long Term Bond Fund - Quarterly IDCW,10.968
2007-02-26,100368,ICICI Prudential Gilt Fund - IDCW,10.5587
2007-02-26,100369,ICICI Prudential Gilt Fund - Growth,22.3208
2007-02-26,100370,ICICI Prudential Short Term Gilt Fund - Dividend,10.4947
2007-02-26,100371,ICICI Prudential Short Term Gilt Fund - Growth,17.8365
2007-02-26,100372,ICICI Prudential Short Term Gilt Fund - Half Yearly Dividend,10.0876
2007-02-26,100375,NIPPON INDIA GROWTH MID CAP FUND - IDCW Option,57.79
2007-02-26,100376,Nippon India Growth Mid Cap Fund-Growth Plan-Bonus Option,44.83
2007-02-26,100377,Nippon India Growth Mid Cap Fund-Growth Plan-Growth Option,270.38
2007-02-26,100378,Nippon India Vision Large & Midcap Fund - IDCW Option,45.66
2007-02-26,100379,Nippon India Vision Large & Midcap Fund-GROWTH PLAN-Bonus Option,29.97
2007-02-26,100380,Nippon India Vision Large & Midcap Fund-GROWTH PLAN-Growth Option,178.84
2007-02-26,100381,UTI Large Cap Fund-Income Option,17.08
2007-02-26,100382,UTI Large Cap Fund-Growth Option,19.6
2007-02-26,100383,NIPPON INDIA MEDIUM TO LONG DURATION FUND - MONTHLY IDCW Option,10.9477
2007-02-26,100384,NIPPON INDIA MEDIUM TO LONG DURATION  FUND - QUARTERLY IDCW Option,11.8788
2007-02-26,100385,NIPPON INDIA MEDIUM TO LONG DURATION  FUND - HALF YEARLY IDCW Option,11.311
2007-02-26,100386,NIPPON INDIA MEDIUM TO LONG DURATION  FUND - ANNUAL IDCW Option,12.0784
2007-02-26,100387,Nippon India Medium to Long Duration  Fund - Growth Plan Growth Option,23.1624
2007-02-26,100388,Nippon India Medium to Long Duration  Fund - Growth Plan Bonus Option,10.9156
2007-02-26,100414,Tata Aggressive Hybrid Fund- Regular Plan - Growth Option,49.4707
2007-02-26,100415,Tata Ethical Fund-Regular Plan - Growth Option,47.1782
2007-02-26,100416,Tata Long Term Debt Fund - Regular Plan - Quarterly Dividend,10.3959
2007-02-26,100417,Tata Income Fund-Regular Plan - Half Yearly Payout of IDCW Option,10.953
2007-02-26,100418,Tata Income Fund -Regular Plan - Growth Option,24.9101
2007-02-26,100470,Franklin India Large Cap Fund - IDCW,36.85
2007-02-26,100471,Franklin India Large Cap Fund-Growth,127.84
2007-02-26,100472,Franklin India Mid Cap Fund - IDCW,56.23
2007-02-26,100473,Franklin India Mid Cap Fund-Growth,201.93
2007-02-26,100474,Tata ELSS Fund- Regular Plan - Payout of IDCW Option,42.2234
2007-02-26,100475,Tata Large Cap Fund -Regular Plan - Growth Option,61.2494
2007-02-26,100476,Taurus Flexi Cap Fund - Regular Plan - Growth,39.36
2007-02-26,100477,Taurus Mid Cap Fund - Regular Plan - Growth,15.52
2007-02-26,100480,Taurus ELSS Tax Saver Fund - Regular Plan - Growth,17.12
2007-02-26,100481,Franklin India Balanced Fund-Growth,35.41
2007-02-26,100482,Franklin India Balanced Fund-Div,30.61
2007-02-26,100483,Franklin India Growth Fund,29.73
2007-02-26,100484,Franklin India Index Fund- NSE Nifty 50 Index Fund - Growth,31.4167
2007-02-26,100485,Franklin India Govt.Sec. Fund-Composite Plan - Growth,24.246
2007-02-26,100486,Franklin India Govt.Sec. Fund-Composite Plan - Dividend,10.7958
2007-02-26,100487,Franklin India Govt.Sec. Fund-Treasury Plan(Dividend Option),10.7445
2007-02-26,100489,Franklin India Govt.Sec. Fund-Treasury Plan(Growth Option),13.9029
2007-02-26,100490,Franklin India Govt.Sec. Fund-PF Plan - Growth,10.6497
2007-02-26,100491,Franklin India Govt.Sec. Fund-PF Plan - Dividend,10.6497
2007-02-26,100493,Franklin India Government Securities Fund - Growth,16.629
2007-02-26,100494,Franklin India Government Securities Fund - IDCW,10.8589
2007-02-26,100495,Franklin India Govt.Sec. Fund-Long Term Plan - Bonus,12.046
2007-02-26,100496,Templeton India Value Fund - Growth Plan,64.78
2007-02-26,100497,Templeton India Value Fund - IDCW,38.3
2007-02-26,100498,Franklin India Dynamic Accrual Fund - IDCW,10.4976
2007-02-26,100499,Franklin India Dynamic Accrual Fund-Growth,25.6764
2007-02-26,100503,Franklin India Low Duration Fund - Monthly - IDCW,10.1886
2007-02-26,100504,Franklin India Low Duration Fund - Quarterly - IDCW,10.1784
2007-02-26,100505,Templeton Monthly Income Plan-Half Yearly Dividend,12.2986
2007-02-26,100506,Templeton Monthly Income Plan-Growth,19.8291
2007-02-26,100519,Franklin India Flexi Cap Fund - IDCW,34.07
2007-02-26,100520,Franklin India Flexi Cap Fund - Growth,137.74
2007-02-26,100521,Franklin India Technology Fund - IDCW,26.12
2007-02-26,100522,Franklin India Technology Fund-Growth,56.13
2007-02-26,100523,Franklin FMCG Fund - Growth,33.46
2007-02-26,100524,Franklin INDIA OPPORTUNITIES FUND - IDCW,15.01
2007-02-26,100525,Franklin India ELSS Tax Saver Fund - IDCW,31.82
2007-02-26,100526,Franklin India ELSS Tax Saver Fund-Growth,125.64
2007-02-26,100527,Franklin India Corporate Debt Fund - Plan A - Annual - IDCW,10.6519
2007-02-26,100528,Franklin India Corporate Debt Fund - Growth,24.9874
2007-02-26,100529,Franklin India Corporate Debt Fund - Plan B - Monthly - IDCW,13.4781
2007-02-26,100530,Franklin India Corporate Debt Fund - Plan B - Quarterly - IDCW,13.8407
2007-02-26,100531,Franklin India Corporate Debt Fund - Plan B - Half yearly - IDCW,14.0295
2007-02-26,100532,Franklin India Corporate Debt Fund - Monthly Bonus,19.054
2007-02-26,100535,Franklin India Retirement Fund - IDCW,16.7941
2007-02-26,100536,Franklin India Retirement Fund - Growth,43.6943
2007-02-26,100537,Franklin India Liquid Fund - Regular Plan - Weekly - IDCW,1244.573
2007-02-26,100538,Franklin India Liquid Fund - Regular Plan - Growth,1848.7451
2007-02-26,100541,Franklin India Liquid Fund - Regular Plan - Daily - IDCW,1512.34
2007-02-26,100542,Franklin India Liquid Fund - Liquid Plan - Weekly Dividend,1000.7684
2007-02-26,100543,Franklin India Liquid Fund - Liquid Plan - Daily IDCW,1000.25
2007-02-26,100544,Franklin India Liquid Fund - Liquid Plan - Growth,1137.3025
2007-02-26,100546,Franklin India Liquid Fund - Super Institutional Plan - Growth,1099.3074
2007-02-26,100547,Franklin India Liquid Fund - Super Institutional Plan - Daily - IDCW,1000.25
2007-02-26,100548,Franklin India Liquid Fund - Super Institutional Plan - Weekly - IDCW,1016.3584
2007-02-26,100549,Franklin India Aggressive Hybrid Fund - IDCW,23.3527
2007-02-26,100550,Franklin India Aggressive Hybrid Fund - Growth Plan,32.7892
2007-02-26,100551,Templeton India Children’s Asset Plan-Education Plan,25.4361
2007-02-26,100552,Templeton India Children’s Asset Plan-Gift Plan - Growth,30.7955
2007-02-26,100553,Templeton India Children’s Asset Plan-Gift Plan - Dividend,30.7955
2007-02-26,100556,Franklin India Taxshield 97,118.62
2007-02-26,100557,Franklin India Taxshield 98,121.18
2007-02-26,100558,Franklin India Taxshield 99,72.4
2007-02-26,100561,Templeton India Money Market Account - Bonus Plan,1.0
2007-02-26,100563,DBS Chola Triple Ace-Regular -Cumulative,23.913
2007-02-26,100567,DBS Chola Triple Ace-Regular - Quarterly Dividend,11.2592
2007-02-26,100569,DBS Chola Triple Ace-Semi Annual Dividend,11.5715
2007-02-26,100573,DBS Chola Triple Ace-Regular Bonus,13.287
2007-02-26,100574,DBS Chola Freedom Income -Short Term Fund-Regular-Monthly Dividend,10.9966
2007-02-26,100575,DBS Chola Freedom Income -Short Term Fund-Regular - Cumulative,11.8049
2007-02-26,100576,DBS Chola Freedom Income -Short Term Fund-Cum- Institutional Plan,11.9467
2007-02-26,100579,DBS Chola Gilt-Investment-Quarterly Dividend,10.1813
2007-02-26,100580,DBS Chola Gilt-Investment-Cumulative,18.5109
2007-02-26,100589,Canara Robeco Expo-Income Plan,19.99
2007-02-26,100590,Canara Robeco Expo-Growth Plan,52.52
2007-02-26,100593,CANARA ROBECO ELSS TAX SAVER - REGULAR PLAN -IDCW (Payout),22.06
2007-02-26,100596,CANARA ROBECO GILT FUND - REGULAR PLAN - IDCW (Payout/Reinvestment),10.4633
2007-02-26,100597,CANARA ROBECO GILT FUND - REGULAR PLAN - GROWTH OPTION,18.3333
2007-02-26,100600,CANARA ROBECO CONSERVATIVE HYBRID FUND - REGULAR PLAN - MONTHLY IDCW (Payout/Reinvestment),11.59
2007-02-26,100601,CANARA ROBECO CONSERVATIVE HYBRID FUND - REGULAR PLAN - GROWTH OPTION,19.13
2007-02-26,100602,Sundaram Medium Duration Fund (Formerly Known as Sundaram Medium Term Bond Fund) Regular Plan-Income Distribution cum Capital Withdrawal(IDCW),10.1819
2007-02-26,100603,Sundaram Medium Duration Fund (Formerly Known as Sundaram Medium Term Bond Fund) Regular Plan - Growth,22.6962
2007-02-26,100604,Sundaram Medium Duration Fund (Formerly Known as Sundaram Medium Term Bond Fund) Regular Plan -Growth,11.9466
2007-02-26,100609,Sundaram Medium Duration Fund (Formerly Known as Sundaram Medium Term Bond Fund) Regular Plan- Income Distribution cum Capital Withdrawal(IDCW),10.4277
2007-02-26,100610,Sundaram Medium Duration Fund (Formerly Known as Sundaram Medium Term Bond Fund) Regular Plan -Income Distribution cum Capital Withdrawal (IDCW),10.4295
2007-02-26,100611,Sundaram Medium Duration Fund (Formerly Known as Sundaram Medium Term Bond Fund) Institutional Plan -Growth,11.6165
2007-02-26,100612,Sundaram Growth Fund-Dividend,14.5148
2007-02-26,100613,Sundaram Growth Fund-Growth,66.3764
2007-02-26,100614,Sundaram Value Fund Regular Plan - Income Distribution cum Capital Withdrawal (IDCW),14.8244
2007-02-26,100617,Sundaram Equity Hybrid Fund Regular Plan - Growth,32.0106
2007-02-26,100618,Sundaram Money Fund Retail Plan - Growth,15.5987
2007-02-26,100619,Sundaram Money Fund Retail Plan - Quarterly Reinvestment of Income Distribution cum Capital Withdrawal (IDCW),10.1789
2007-02-26,100620,Sundaram Money Fund Retail Plan - Daily Reinvestment of Income Distribution cum Capital Withdrawal (IDCW),10.0953
2007-02-26,100621,Sundaram Money Fund Retail Plan - Weekly Reinvestment of Income Distribution cum Capital Withdrawal (IDCW),10.329
2007-02-26,100622,Sundaram Money Fund Retail Plan - Fortnightly Reinvestment of Income Distribution cum Capital Withdrawal (IDCW),10.2263
2007-02-26,100623,Sundaram Money Fund Retail Plan - Monthly Income Distribution cum Capital Withdrawal (IDCW),10.17
2007-02-26,100630,quant Multi Cap Fund-IDCW Option - Regular Plan,15.6963
2007-02-26,100631,quant Multi Cap Fund-GROWTH OPTION - Regular Plan,53.2926
2007-02-26,100638,SBI Medium to Long Duration Fund - Regular Plan - Half Yearly - Income Distribution cum Capital Withdrawal Option (IDCW),10.2335
2007-02-26,100639,SBI Medium to Long Duration Fund-REGULAR PLAN-Growth,19.8099
2007-02-26,100640,SBI Medium to Long Duration Fund-REGULAR PLAN-Bonus,11.9995
2007-02-26,100641,SBI ULTRA SHORT DURATION FUND - REGULAR PLAN - GROWTH,16.6875
2007-02-26,100643,SBI Technology Opportunities Fund - Regular Plan - Income Distribution cum Capital Withdrawal Option (IDCW),28.89
2007-02-26,100644,SBI Healthcare Opportunities Fund - Regular Plan - Income Distribution cum Capital Withdrawal Option (IDCW),27.96
2007-02-26,100645,SBI Consumption Opportunities Fund - Regular Plan - Income Distribution cum Capital Withdrawal Option (IDCW),13.23
2007-02-26,100646,UTI - Unit Linked Insurance Plan,15.4873
2007-02-26,100648,UTI - CRTS 81 - Dividend Option,108.6696
2007-02-26,100650,UTI Large Cap Fund - Regular Plan - IDCW,27.56
2007-02-26,100651,UTI Large Cap Fund - Regular Plan - Growth Option,34.22
2007-02-26,100656,UTI - Master Plus Unit Scheme-Growth Option,65.11
2007-02-26,100657,UTI - Master Plus Unit Scheme-Income Option,49.99
2007-02-26,100663,UTI Large & Mid Cap Fund - Regular Plan - IDCW,39.92
2007-02-26,100664,UTI Large & Mid Cap Fund - Regular Plan - Growth Option,43.3
2007-02-26,100668,UTI Flexi Cap Fund - Regular Plan - IDCW,29.42
2007-02-26,100669,UTI - Flexi Cap Fund-Growth Option,31.78
2007-02-26,100678,UTI Children's Hybrid Fund - Regular Plan,14.7482
2007-02-26,100682,UTI Retirement Fund - Regular Plan,19.4517
2007-02-26,100684,UTI Aggressive Hybrid Fund - Regular Plan - Growth,54.15
2007-02-26,100685,UTI Aggressive Hybrid Fund - Regular Plan - IDCW,21.41
2007-02-26,100711,UTI - INDEX SELECT FUND-Income Option,22.92
2007-02-26,100712,UTI - INDEX SELECT FUND-Growth Option,33.97
2007-02-26,100715,DBS Chola Multi-Cap Fund-Dividend Option,14.39
2007-02-26,100716,DBS Chola Multi-Cap Fund-Cumulative Option,18.05
2007-02-26,100723,UTI MMF-Discontinued - Regular Plan -Growth,20.8822
2007-02-26,100724,UTI MMF- Discontinued - Regular Plan - Flexi Dividend Option,17.6602
2007-02-26,100725,UTI MMF- Discontinued - Regular Plan - Periodic Dividend Option,17.5461
2007-02-26,100739,UTI MNC Fund - Regular Plan - IDCW,27.84
2007-02-26,100740,UTI - MNC Fund - Regular Plan - Growth Option,33.52
2007-02-26,100741,UTI Medium to Long Duration Fund- Regular Plan - Growth,21.5732
2007-02-26,100742,UTI Medium to Long Duration Fund - Regular Plan - Quarterly IDCW,10.8576
2007-02-26,100748,UTI - Master Index Fund-Income Option,42.8044
2007-02-26,100749,UTI - Master Index Fund-Growth Option,42.8044
2007-02-26,100750,UTI - Master Value Fund-Income Option,18.79
2007-02-26,100751,UTI - Master Value Fund-Growth Option,28.82
2007-02-26,100780,Sundaram Banking & PSU Fund (Formerly Known as Sundaram Banking and PSU Debt Fund) Retail Plan - Monthly Income Distribution cum Capital Withdrawal (IDCW),10.2165
2007-02-26,100781,Sundaram Banking & PSU Fund (Formerly Known as Sundaram Banking and PSU Debt Fund) Retail Plan - Growth,11.2693
2007-02-26,100782,Sundaram Banking & PSU Fund (Formerly Known as Sundaram Banking and PSU Debt Fund) Regular Plan - Daily Reinvestment of Income Distribution cum Capital Withdrawal (IDCW),10.0519
2007-02-26,100784,Sundaram Banking & PSU Fund (Formerly Known as Sundaram Banking and PSU Debt Fund) Regular Plan - Growth,11.3962
