date,scheme_code,scheme_name,nav
2010-09-30,100033,Aditya Birla Sun Life Large & Mid Cap Fund - Regular Growth,174.26
2010-09-30,100034,Aditya Birla Sun Life Large & Mid Cap Fund -Regular - IDCW,94.41
2010-09-30,100035,Birla Sun Life Freedom Fund-Plan A (Dividend),17.25
2010-09-30,100036,Birla Sun Life Freedom Fund-Plan B (Growth),33.96
2010-09-30,100041,Aditya Birla Sun Life Liquid Fund -Institutional - IDCW,10.8023
2010-09-30,100042,Aditya Birla Sun Life Liquid Fund-Retail (Growth),25.0152
2010-09-30,100043,Aditya Birla Sun Life Liquid Fund-Institutional (Growth),25.4442
2010-09-30,100044,Aditya Birla Sun Life Liquid Fund -Retail - IDCW,16.3694
2010-09-30,100046,Aditya Birla Sun Life Liquid Fund -Daily IDCW,10.0195
2010-09-30,100047,Aditya Birla Sun Life Liquid Fund - Growth,15.1164
2010-09-30,100048,Aditya Birla Sun Life Liquid Fund -Institutional - weekly  IDCW,10.8174
2010-09-30,100049,Aditya Birla Sun Life Cash Plus-Institutional - Fortnightly Dividend,10.8316
2010-09-30,100051,Aditya Birla Sun Life Liquid Fund -weekly IDCW,10.0328
2010-09-30,100052,Aditya Birla Sun Life Cash Plus-Institutional Premium - Fortnightly Dividend,10.0
2010-09-30,100053,Aditya Birla Sun Life Cash Plus-Institutional Premium Plan-Monthly Dividend,10.0
2010-09-30,100063,Aditya Birla Sun Life MNC Fund - Regular - IDCW,87.2
2010-09-30,100064,Aditya Birla Sun Life MNC Fund - Growth - Regular Plan,215.8
2010-09-30,100065,Aditya Birla Sun Life India Opportunities Fund - Dividend - Regular Plan,19.13
2010-09-30,100066,Aditya Birla Sun Life India Opportunities Fund - Growth - Regular Plan,56.17
2010-09-30,100067,Aditya Birla Sun Life Tax Plan -Regular - IDCW,48.82
2010-09-30,100068,BARODA ELSS 96 - Plan A - IDCW,28.37
2010-09-30,100080,DSP Flexi Cap Fund - Regular Plan - IDCW,56.282
2010-09-30,100081,DSP Aggressive Hybrid Fund- Regular Plan - Growth,69.359
2010-09-30,100082,DSP Aggressive Hybrid Fund- Regular Plan - IDCW,24.98
2010-09-30,100090,DSP BlackRock Technology.com   Fund - Regular Plan - Growth,34.926
2010-09-30,100119,HDFC Balanced Advantage Fund - Growth Plan,93.228
2010-09-30,100120,HDFC Balanced Advantage Fund - IDCW Plan,36.508
2010-09-30,100121,HDFC Balanced Fund - Dividend Option,21.865
2010-09-30,100122,HDFC Balanced Fund - Growth Option,55.564
2010-09-30,100151,Principal Retail Equity Savings Fund - Growth Option,93.47
2010-09-30,100152,Principal Nifty 100 Equal Weight Fund-Income Distribution CUM Capital Withdrawal,24.2271
2010-09-30,100153,Principal Nifty 100 Equal Weight Fund-Growth,41.2315
2010-09-30,100156,Principal Tax Savings Fund,82.59
2010-09-30,100171,Quant Dynamic Bond-Dividend,11.1669
2010-09-30,100172,Quant Dynamic Bond-Growth,30.188
2010-09-30,100173,Quant Dynamic Bond-Bonus,15.8954
2010-09-30,100174,quant ELSS Tax Saver Fund - IDCW Option - Regular Plan,11.6237
2010-09-30,100175,quant ELSS Tax Saver Fund - Growth Option - Regular Plan,54.0868
2010-09-30,100176,quant Small Cap Fund - IDCW Option - Regular Plan,23.98
2010-09-30,100177,quant Small Cap Fund - Growth - Regular Plan,25.2871
2010-09-30,100188,ING Core Equity Fund-Dividend Option,21.31
2010-09-30,100189,ING Core Equity Fund-Growth Option,40.27
2010-09-30,100190,ING Liquid Fund-Regular Growth Option,19.7476
2010-09-30,100191,ING Liquid Fund-Regular Weekly Dividend Option,10.8298
2010-09-30,100192,ING Liquid Fund-Regular Daily Dividend Option,10.7873
2010-09-30,100196,ING Liquid Fund-Institutional Growth Option,14.8095
2010-09-30,100197,ING Liquid Fund-Institutional Weekly Dividend Option,10.059
2010-09-30,100198,ING Liquid Fund-Institutional Daily Dividend Option,10.0121
2010-09-30,100199,ING Liquid Fund-Super Institutional Growth Option,14.0934
2010-09-30,100200,ING Liquid Fund-Super Institutional Daily Dividend Option,10.0048
2010-09-30,100201,ING Liquid Fund-Super Institutional Weekly Dividend Option,10.0
2010-09-30,100202,ING Balanced Fund-Dividend Option,18.55
2010-09-30,100203,ING Balanced Fund-Growth Option,26.52
2010-09-30,100218,JM Large Cap Fund (Regular) - IDCW,16.193
2010-09-30,100219,JM Large Cap Fund (Regular) - Growth Option,39.7761
2010-09-30,100220,JM Aggressive Hybrid Fund (Regular) - IDCW,17.5233
2010-09-30,100221,JM Aggressive Hybrid Fund (Regular) -Growth Option,24.5695
2010-09-30,100233,JM Liquid Fund (Regular) - Weekly IDCW,10.7468
2010-09-30,100234,JM Liquid Fund - Growth Option,25.7561
2010-09-30,100237,JM High Liquidity Fund-- Institutional Plan - Growth,15.5396
2010-09-30,100238,JM High Liquidity Fund-Institutional Plan - Daily Dividend,10.0159
2010-09-30,100241,JM High Liquidity Fund-- Institutional Plan - Dividend,10.5023
2010-09-30,100244,JM Liquid Fund (Regular) - Quarterly IDCW,14.5775
2010-09-30,100245,JM High Liquidity Fund-Super Institutional Plan- Daily Dividend,10.0165
2010-09-30,100246,JM High Liquidity Fund-Super Institutional Plan- Weekly  Dividend,10.0
2010-09-30,100247,JM Liquid Fund (Regular) - Super Institutional Plan - Growth Option,14.7759
2010-09-30,100254,JM Value Fund (Regular) - Growth Option,18.0514
2010-09-30,100286,Kotak Aggressive Hybrid Fund - Regular Plan - IDCW - Payout & Reinvestment of Income Distribution cum capital withdrawal option,23.894
2010-09-30,100312,LIC MF Flexi Cap Fund-Regular Plan-IDCW,11.3228
2010-09-30,100313,LIC MF Flexi Cap Fund-Regular Plan-Growth,28.7319
2010-09-30,100314,LIC MF Medium to Long Duration Fund-Regular Plan-IDCW,10.9104
2010-09-30,100315,LIC MF Medium to Long Duration Fund-Regular Plan-Growth,26.8401
2010-09-30,100316,LIC MF Gilt Fund-Regular Plan-IDCW,10.2392
2010-09-30,100317,LIC MF Gilt Fund-Regular Plan-Growth,22.0084
2010-09-30,100318,LIC MF Gilt Fund-PF Plan-IDCW,12.1358
2010-09-30,100319,LIC MF Gilt Fund-PF Plan-Growth,12.691
2010-09-30,100321,LIC MF Aggressive Hybrid Fund-Regular Plan-IDCW,12.4681
2010-09-30,100323,LIC MF Aggressive Hybrid Fund-Regular Plan-Growth,58.9887
2010-09-30,100325,LIC MF ULIS (5 Yrs. Single Premium)-Regular Plan-IDCW Reinvestment,10.3472
2010-09-30,100332,LIC MF Large Cap Fund-Regular Plan-IDCW,12.4019
2010-09-30,100337,SaharaTax Gain-Dividend,18.0161
2010-09-30,100338,SaharaTax Gain-Growth,40.4112
2010-09-30,100347,Morgan Stanley Growth Fund- Regular Growth Plan,68.779
2010-09-30,100348,ICICI Prudential Large & Mid Cap Fund - IDCW,19.04
2010-09-30,100349,ICICI Prudential Large & Mid Cap Fund - Growth,140.59
2010-09-30,100350,ICICI Prudential Large & Mid Cap Fund - Institutional Option - I - Growth,19.76
2010-09-30,100351,ICICI Prudential FMCG Fund - IDCW,39.08
2010-09-30,100352,ICICI Prudential FMCG Fund - Growth,68.34
2010-09-30,100353,ICICI Prudential ELSS Tax Saver Fund - IDCW,22.12
2010-09-30,100354,ICICI Prudential ELSS Tax Saver Fund - Growth,148.38
2010-09-30,100355,ICICI Prudential Equity & Debt Fund - Monthly IDCW,16.59
2010-09-30,100356,ICICI Prudential Equity & Debt Fund - Growth,46.33
2010-09-30,100357,ICICI Prudential Liquid Fund -Quarterly IDCW,100.2218
2010-09-30,100359,ICICI Prudential Liquid Institutional Plus Fund - Div - Daily,118.515
2010-09-30,100360,ICICI Prudential Liquid Institutional Plus Fund - Div - Weekly,118.6205
2010-09-30,100361,ICICI Prudential Liquid Fund-Dividend-Institutional Plus - Monthly,100.0879
2010-09-30,100362,ICICI Prudential Liquid Institutional Plus Fund - Growth,233.6409
2010-09-30,100363,ICICI Prudential Technology Fund - Growth,17.75
2010-09-30,100375,NIPPON INDIA GROWTH MID CAP FUND - IDCW Option,62.4591
2010-09-30,100376,Nippon India Growth Mid Cap Fund-Growth Plan-Bonus Option,84.5187
2010-09-30,100377,Nippon India Growth Mid Cap Fund-Growth Plan-Growth Option,509.5282
2010-09-30,100378,Nippon India Vision Large & Midcap Fund - IDCW Option,48.7266
2010-09-30,100379,Nippon India Vision Large & Midcap Fund-GROWTH PLAN-Bonus Option,50.1663
2010-09-30,100380,Nippon India Vision Large & Midcap Fund-GROWTH PLAN-Growth Option,298.7151
2010-09-30,100414,Tata Aggressive Hybrid Fund- Regular Plan - Growth Option,85.4961
2010-09-30,100415,Tata Ethical Fund-Regular Plan - Growth Option,69.8433
2010-09-30,100470,Franklin India Large Cap Fund - IDCW,44.9467
2010-09-30,100471,Franklin India Large Cap Fund-Growth,224.5342
2010-09-30,100472,Franklin India Mid Cap Fund - IDCW,46.9152
2010-09-30,100473,Franklin India Mid Cap Fund-Growth,301.0903
2010-09-30,100474,Tata ELSS Fund- Regular Plan - Payout of IDCW Option,48.8284
2010-09-30,100475,Tata Large Cap Fund -Regular Plan - Growth Option,108.2185
2010-09-30,100476,Taurus Flexi Cap Fund - Regular Plan - Growth,60.98
2010-09-30,100477,Taurus Mid Cap Fund - Regular Plan - Growth,17.67
2010-09-30,100480,Taurus ELSS Tax Saver Fund - Regular Plan - Growth,38.85
2010-09-30,100484,Franklin India Index Fund- NSE Nifty 50 Index Fund - Growth,47.489
2010-09-30,100496,Templeton India Value Fund - Growth Plan,129.8904
2010-09-30,100497,Templeton India Value Fund - IDCW,61.1037
2010-09-30,100519,Franklin India Flexi Cap Fund - IDCW,31.4156
2010-09-30,100520,Franklin India Flexi Cap Fund - Growth,233.9921
2010-09-30,100521,Franklin India Technology Fund - IDCW,21.3813
2010-09-30,100522,Franklin India Technology Fund-Growth,62.8277
2010-09-30,100523,Franklin FMCG Fund - Growth,69.0081
2010-09-30,100524,Franklin INDIA OPPORTUNITIES FUND - IDCW,16.2608
2010-09-30,100525,Franklin India ELSS Tax Saver Fund - IDCW,35.7126
2010-09-30,100526,Franklin India ELSS Tax Saver Fund-Growth,217.2435
2010-09-30,100535,Franklin India Retirement Fund - IDCW,15.9867
2010-09-30,100536,Franklin India Retirement Fund - Growth,58.683
2010-09-30,100537,Franklin India Liquid Fund - Regular Plan - Weekly - IDCW,1245.1389
2010-09-30,100538,Franklin India Liquid Fund - Regular Plan - Growth,2320.6428
2010-09-30,100541,Franklin India Liquid Fund - Regular Plan - Daily - IDCW,1512.34
2010-09-30,100542,Franklin India Liquid Fund - Liquid Plan - Weekly Dividend,1001.2029
2010-09-30,100543,Franklin India Liquid Fund - Liquid Plan - Daily IDCW,1000.673
2010-09-30,100544,Franklin India Liquid Fund - Liquid Plan - Growth,1414.8432
2010-09-30,100546,Franklin India Liquid Fund - Super Institutional Plan - Growth,1403.4087
2010-09-30,100547,Franklin India Liquid Fund - Super Institutional Plan - Daily - IDCW,1000.673
2010-09-30,100548,Franklin India Liquid Fund - Super Institutional Plan - Weekly - IDCW,1021.8548
2010-09-30,100549,Franklin India Aggressive Hybrid Fund - IDCW,21.7033
2010-09-30,100550,Franklin India Aggressive Hybrid Fund - Growth Plan,50.5764
2010-09-30,100551,Templeton India Children’s Asset Plan-Education Plan,32.0668
2010-09-30,100552,Templeton India Children’s Asset Plan-Gift Plan - Growth,45.682
2010-09-30,100553,Templeton India Children’s Asset Plan-Gift Plan - Dividend,45.682
2010-09-30,100561,Templeton India Money Market Account - Bonus Plan,1.0
2010-09-30,100593,CANARA ROBECO ELSS TAX SAVER - REGULAR PLAN -IDCW (Payout),22.91
2010-09-30,100596,CANARA ROBECO GILT FUND - REGULAR PLAN - IDCW (Payout/Reinvestment),10.8275
2010-09-30,100597,CANARA ROBECO GILT FUND - REGULAR PLAN - GROWTH OPTION,25.3888
2010-09-30,100600,CANARA ROBECO CONSERVATIVE HYBRID FUND - REGULAR PLAN - MONTHLY IDCW (Payout/Reinvestment),14.4777
2010-09-30,100601,CANARA ROBECO CONSERVATIVE HYBRID FUND - REGULAR PLAN - GROWTH OPTION,29.0609
2010-09-30,100612,Sundaram Growth Fund-Dividend,13.5064
2010-09-30,100613,Sundaram Growth Fund-Growth,101.135
2010-09-30,100614,Sundaram Value Fund Regular Plan - Income Distribution cum Capital Withdrawal (IDCW),12.9002
2010-09-30,100617,Sundaram Equity Hybrid Fund Regular Plan - Growth,50.786
2010-09-30,100618,Sundaram Money Fund Retail Plan - Growth,19.318
2010-09-30,100619,Sundaram Money Fund Retail Plan - Quarterly Reinvestment of Income Distribution cum Capital Withdrawal (IDCW),10.815
2010-09-30,100620,Sundaram Money Fund Retail Plan - Daily Reinvestment of Income Distribution cum Capital Withdrawal (IDCW),10.0953
2010-09-30,100621,Sundaram Money Fund Retail Plan - Weekly Reinvestment of Income Distribution cum Capital Withdrawal (IDCW),10.6918
2010-09-30,100622,Sundaram Money Fund Retail Plan - Fortnightly Reinvestment of Income Distribution cum Capital Withdrawal (IDCW),10.4525
2010-09-30,100623,Sundaram Money Fund Retail Plan - Monthly Income Distribution cum Capital Withdrawal (IDCW),10.3269
2010-09-30,100630,quant Multi Cap Fund-IDCW Option - Regular Plan,13.9196
2010-09-30,100631,quant Multi Cap Fund-GROWTH OPTION - Regular Plan,84.1234
2010-09-30,100638,SBI Medium to Long Duration Fund - Regular Plan - Half Yearly - Income Distribution cum Capital Withdrawal Option (IDCW),10.5452
2010-09-30,100639,SBI Medium to Long Duration Fund-REGULAR PLAN-Growth,22.9043
2010-09-30,100640,SBI Medium to Long Duration Fund-REGULAR PLAN-Bonus,13.8759
2010-09-30,100641,SBI ULTRA SHORT DURATION FUND - REGULAR PLAN - GROWTH,20.9847
2010-09-30,100643,SBI Technology Opportunities Fund - Regular Plan - Income Distribution cum Capital Withdrawal Option (IDCW),22.47
2010-09-30,100644,SBI Healthcare Opportunities Fund - Regular Plan - Income Distribution cum Capital Withdrawal Option (IDCW),34.49
2010-09-30,100645,SBI Consumption Opportunities Fund - Regular Plan - Income Distribution cum Capital Withdrawal Option (IDCW),30.84
2010-09-30,100646,UTI - Unit Linked Insurance Plan,18.8397
2010-09-30,100650,UTI Large Cap Fund - Regular Plan - IDCW,33.72
2010-09-30,100651,UTI Large Cap Fund - Regular Plan - Growth Option,57.1
2010-09-30,100656,UTI - Master Plus Unit Scheme-Growth Option,88.66
2010-09-30,100657,UTI - Master Plus Unit Scheme-Income Option,63.92
2010-09-30,100663,UTI Large & Mid Cap Fund - Regular Plan - IDCW,23.47
2010-09-30,100664,UTI Large & Mid Cap Fund - Regular Plan - Growth Option,30.22
2010-09-30,100668,UTI Flexi Cap Fund - Regular Plan - IDCW,50.39
2010-09-30,100669,UTI - Flexi Cap Fund-Growth Option,57.02
2010-09-30,100676,Benchmark Derivative Fund - Growth Plan,1409.2404
2010-09-30,100678,UTI Children's Hybrid Fund - Regular Plan,15.5649
2010-09-30,100682,UTI Retirement Fund - Regular Plan,19.8567
2010-09-30,100684,UTI Aggressive Hybrid Fund - Regular Plan - Growth,84.14
2010-09-30,100685,UTI Aggressive Hybrid Fund - Regular Plan - IDCW,23.84
2010-09-30,100723,UTI MMF-Discontinued - Regular Plan -Growth,2631.5438
2010-09-30,100724,UTI MMF- Discontinued - Regular Plan - Flexi Dividend Option,1864.7226
2010-09-30,100725,UTI MMF- Discontinued - Regular Plan - Periodic Dividend Option,1854.3942
2010-09-30,100739,UTI MNC Fund - Regular Plan - IDCW,39.04
2010-09-30,100740,UTI - MNC Fund - Regular Plan - Growth Option,60.47
2010-09-30,100748,UTI - Master Index Fund-Income Option,62.1713
2010-09-30,100749,UTI - Master Index Fund-Growth Option,62.1713
2010-09-30,100750,UTI - Master Value Fund-Income Option,25.5
2010-09-30,100751,UTI - Master Value Fund-Growth Option,55.58
2010-09-30,100794,Sundaram Small Cap Fund Regular Plan - Income Distribution cum Capital Withdrawal (IDCW),14.3318
2010-09-30,100795,Sundaram Small Cap Fund Regular Plan - Growth,36.8699
2010-09-30,100796,Sahara Midcap Fund-Growth Plan,33.8288
2010-09-30,100797,Sahara Midcap Fund-Dividend Plan,18.1145
2010-09-30,100798,Sahara Midcap Fund-Auto Payout,33.8288
2010-09-30,100799,Sahara Midcap Fund-Bonus,33.8288
2010-09-30,100804,UTI Energy Fund-Income Option,13.71
2010-09-30,100805,UTI Energy Fund-Growth Option,12.1
2010-09-30,100806,UTI Healthcare Fund - Regular Plan - IDCW,30.8
2010-09-30,100807,UTI Healthcare Fund - Regular Plan - Growth Option,37.74
2010-09-30,100808,UTI Services Industries Fund-Income Option,27.45
2010-09-30,100809,UTI Services Industries Fund-Growth Option,63.84
2010-09-30,100820,UTI ELSS Tax Saver Fund - Regular Plan - IDCW,18.32
2010-09-30,100821,UTI ELSS Tax Saver Fund - Regular Plan - Growth Option,43.08
2010-09-30,100822,UTI Nifty 50 Index Fund - Regular Plan - Growth Option,37.6564
2010-09-30,100823,UTI Nifty 50 Index Fund - Regular Plan - IDCW,19.1676
2010-09-30,100828,Kotak Liquid-Regular (Dividend),10.0269
2010-09-30,100829,Kotak Liquid-Regular (Growth),18.2354
2010-09-30,100830,Kotak Liquid-Institutional Plan  (Growth),18.6257
2010-09-30,100831,Kotak Liquid Fund -Institutional Plan - (Daily Dividend),12.2281
2010-09-30,100832,Kotak Liquid-Institutional Plan (Weekly Dividend),10.0275
2010-09-30,100833,Kotak Liquid Fund - Regular  - Daily Reinvestment of Income Distribution cum capital withdrawal option,12.2281
2010-09-30,100834,Kotak Liquid Fund Regular Plan Weekly Reinvestment of Income Distribution cum capital withdrawal option Dividend,10.0676
2010-09-30,100835,Kotak Liquid Fund - Regular Plan - Growth,19.1608
2010-09-30,100837,Nippon India Liquid Fund - Retail Option - Growth Plan,22.6091
2010-09-30,100838,NIPPON INDIA LIQUID FUND - RETAIL Plan - WEEKLY IDCW OPTION,10.3519
2010-09-30,100842,NIPPON INDIA LIQUID FUND - RETAIL Plan - DAILY IDCW OPTION,15.2428
2010-09-30,100843,NIPPON INDIA LIQUID FUND - RETAIL plan - MONTHLY IDCW OPTION,13.3149
2010-09-30,100844,NIPPON INDIA LIQUID FUND - RETAIL Plan - QUARTERLY IDCW OPTION,12.1685
2010-09-30,100845,Reliance Liquid Fund-Cash Plan-Growth Plan,15.3268
2010-09-30,100848,Reliance Liquid Fund-Cash Plan-Weekly Dividend Reinvestment Option,10.9264
2010-09-30,100849,Reliance Liquid Fund-Cash Plan-Daily Dividend Reinvestment Option,11.1415
2010-09-30,100851,Nippon India Liquid Fund -Growth Plan,23.0232
2010-09-30,100852,NIPPON INDIA LIQUID FUND - DAILY IDCW OPTION,15.2874
2010-09-30,100853,NIPPON INDIA LIQUID FUND - WEEKLY IDCW OPTION,15.3187
2010-09-30,100855,NIPPON INDIA LIQUID FUND - MONTHLY IDCW OPTION,21.7538
2010-09-30,100864,LIC MF ELSS Tax Saver-Regular Plan-IDCW,11.3359
2010-09-30,100865,LIC MF ELSS Tax Saver-Regular Plan-Growth,31.6616
2010-09-30,100868,HDFC Liquid Fund - Growth Plan,18.6925
2010-09-30,100872,HDFC Liquid Fund-PREMIUM PLUS- Growth,18.9768
2010-09-30,100873,HDFC Liquid Fund-PREMIUM- Growth,18.9383
2010-09-30,100874,HDFC Liquid Fund - IDCW Plan Weekly,10.3155
2010-09-30,100875,HDFC Liquid Fund - IDCW Daily,10.1982
2010-09-30,100876,HDFC Liquid Fund - IDCW Monthly,10.2683
2010-09-30,100877,HDFC Liquid Fund-Premium Plan - Dividend-Daily,12.2598
2010-09-30,100878,HDFC Liquid Fund-Premium Plan - Dividend-Weekly,10.0
2010-09-30,100881,HDFC Liquid Fund-Premium Plus Plan - Dividend-Weekly,10.0
2010-09-30,100895,Principal Cash Management Fund - Daily Income Distribution CUM Capital Withdrawal,10.0007
2010-09-30,100896,Principal Cash Management Fund - Weekly Income Distribution CUM Capital Withdrawal Option,10.0618
2010-09-30,100897,Principal Cash Management Fund - Monthly Income Distribution CUM Capital Withdrawal Option,10.0673
2010-09-30,100898,Principal Cash Management Fund -Growth Option,14.6949
2010-09-30,100899,HDFC Childrens Fund-Savings,22.032
2010-09-30,100900,HDFC Childrens Fund - Growth Plan,41.623
2010-09-30,100902,Franklin Pharma Fund - Growth,60.6844
2010-09-30,100915,SBI Contra Fund - Regular Plan - Income Distribution cum Capital Withdrawal Option (IDCW),24.97
2010-09-30,100927,SBI Conservative Hybrid Fund - Regular Plan - Monthly Income Distribution cum Capital Withdrawal Option (IDCW),10.7531
2010-09-30,100928,SBI Conservative Hybrid Fund - Regular Plan - Quarterly Income Distribution cum Capital Withdrawal Option (IDCW),10.4928
2010-09-30,100929,SBI Conservative Hybrid Fund - Regular Plan - Annual Income Distribution cum Capital Withdrawal Option (IDCW),11.5146
2010-09-30,100940,DSP BlackRock Liquidity Fund - Regular Plan - Growth,22.4338
2010-09-30,100941,DSP BlackRock Liquidity Fund - Regular Plan Weekly Dividend,12.4104
2010-09-30,100943,DSP BlackRock Liquidity Fund - Regular Plan - Daily Dividend,10.01
2010-09-30,100948,Franklin India Conservative Hybrid Fund - Growth,27.5988
2010-09-30,100949,Franklin India Conservative Hybrid Fund - Plan A - Monthly - IDCW,11.6492
2010-09-30,100950,Franklin India Conservative Hybrid Fund - Plan A - Quarterly - IDCW,11.724
2010-09-30,100951,Franklin India Conservative Hybrid Fund - Monthly Bonus,12.0031
2010-09-30,100966,Principal Multi Cap Growth Fund- Half Yearly Income Distribution CUM Capital Withdrawal Option,25.72
2010-09-30,100967,Principal Multi Cap Growth Fund-Growth Option,56.77
2010-09-30,100968,SBI Conservative Hybrid Fund - Regular Plan - Growth,20.0771
2010-09-30,100997,HDFC Long Term Advantage Plan - IDCW Plan,42.768
2010-09-30,100998,HDFC Long Term Advantage Plan - Growth Plan,146.103
2010-09-30,100999,SBI Gilt Fund - Regular Plan - Income Distribution cum Capital Withdrawal Option (IDCW),10.2125
2010-09-30,101000,Tata Life Sciences & Technology Fund - Growth,69.5544
2010-09-30,101001,SBI GILT FUND - REGULAR PLAN - GROWTH,19.2765
2010-09-30,101002,SBI CONSTANT MATURITY 10 Year GILT FUND - REGULAR PLAN - GROWTH,18.9516
2010-09-30,101003,SBI Constant Maturity 10 Year Gilt Fund - Regular Plan - Income Distribution cum Capital Withdrawal Option (IDCW),10.8997
2010-09-30,101037,Franklin India Index Tax Fund,46.1464
2010-09-30,101044,Franklin India Floating Rate Fund - IDCW,10.0
2010-09-30,101048,Franklin India Floating Rate Fund - Growth Plan,16.1805
2010-09-30,101065,quant Mid Cap Fund - Growth Option - Regular Plan,28.4088
2010-09-30,101066,quant Mid Cap Fund - IDCW Option - Regular Plan,10.2827
2010-09-30,101069,quant Aggressive Hybrid Fund-IDCW Option - Regular Plan,12.6476
2010-09-30,101070,quant Aggressive Hybrid Fund - Growth Option - Regular Plan,66.175
2010-09-30,101071,quant Multi Asset Allocation Fund - IDCW Option - Regular Plan,19.24
2010-09-30,101072,quant Multi Asset Allocation Fund-GROWTH OPTION - Regular Plan,21.0785
2010-09-30,101078,JM Liquid Fund (Regular) - Daily IDCW,10.4302
2010-09-30,101127,ICICI Prudential Children's Fund - Regular Plan,63.33
2010-09-30,101143,ICICI Prudential Multi-Asset Fund - IDCW,19.394
2010-09-30,101144,ICICI Prudential Multi-Asset Fund - Growth,108.5082
2010-09-30,101161,Nippon India Multi Cap Fund-Growth Plan-Growth Option,38.7718
2010-09-30,101162,Nippon India Multi Cap Fund-Growth Plan-Bonus Option,38.7718
2010-09-30,101163,NIPPON INDIA MULTI CAP FUND - IDCW Option,27.3873
2010-09-30,101169,SBI Children's Fund - Savings Plan - REGULAR PLAN - GROWTH,22.3766
2010-09-30,101184,LIC MF Liquid Fund-Regular Plan-Daily IDCW,10.9801
2010-09-30,101185,LIC MF Liquid Fund-Regular Plan-Growth,17.2974
2010-09-30,101198,LIC MF BSE Sensex Index Fund-Regular Plan-IDCW,12.8624
2010-09-30,101199,LIC MF BSE Sensex Index Fund-Regular Plan-Growth,37.5371
2010-09-30,101200,LIC MF Nifty 50 Index Fund-Regular Plan-IDCW,12.2898
2010-09-30,101201,LIC MF Nifty 50 Index Fund-Regular Plan-Growth,33.3156
2010-09-30,101202,LIC MF Index Fund-Sensex Advantage-Dividend,12.5211
2010-09-30,101203,LIC MF Index Fund-Sensex Advantage-Growth,35.3901
2010-09-30,101206,SBI OVERNIGHT FUND - REGULAR PLAN - GROWTH,16.2884
2010-09-30,101209,Taurus Large Cap Fund - Regular Plan - Growth,45.75
2010-09-30,101221,ICICI Prudential Money Market Fund Retail Growth (erstwhile Cash Option),153.1193
2010-09-30,101222,Tata Aggressive Hybrid Fund- Regular Plan - Periodic Payout of IDCW Option,53.9264
2010-09-30,101228,ICICI Prudential Multicap Fund - Growth,121.69
2010-09-30,101262,Nippon India Power & Infra Fund-Growth Plan -Growth Option,87.4492
2010-09-30,101263,Nippon India Power & Infra Fund-Growth Plan-Bonus Option,87.4492
2010-09-30,101264,NIPPON INDIA POWER & INFRA FUND - IDCW Option,51.6173
2010-09-30,101265,Principal Hybrid Equity Fund-Growth,33.22
2010-09-30,101266,Principal Hybrid Equity Fund- Monthly Income Distribution CUM Capital Withdrawal,16.78
2010-09-30,101271,LIC MF Children's Fund-Regular Plan-Growth,10.733
2010-09-30,101281,HDFC BSE Sensex Index Fund - Growth Plan,167.7773
2010-09-30,101282,HDFC Index Fund-Sensex Plus( FV-Rs32.161),242.7425
2010-09-30,101295,SBI ESG Exclusionary Strategy Fund - Regular Plan - Income Distribution cum Capital Withdrawal Option (IDCW),35.04
2010-09-30,101296,Banking Index Benchmark Exchange Traded Scheme (Bank BeES),1244.0957
2010-09-30,101313,Aditya Birla Sun Life Nifty 50 Index Fund -REGULAR - IDCW,23.255
2010-09-30,101314,Aditya Birla Sun Life Nifty 50 Index Fund - Growth - Regular Plan,60.1595
2010-09-30,101325,Nifty Benchmark Exchange Traded Scheme- Nifty BeES,608.5645
2010-09-30,101349,ICICI Prudential Nifty 50 Index Fund - Cumulative Option,55.9963
2010-09-30,101352,Templeton Floating Rate Income Fund-Short Term Plan-Dividend Option,10.0598
2010-09-30,101353,Templeton Floating Rate Income Fund-Short Term Plan-Growth Option,17.0368
2010-09-30,101354,Templeton Floating Rate Income Fund-Short Term Plan-Institutional Option - Growth,14.0988
2010-09-30,101355,Templeton Floating Rate Income Fund-Short Term Plan-Institutional Option - Dividend,10.1574
2010-09-30,101361,Canara Robeco Liquid Fund- INSTITUTIONAL-Weekly dividend,10.055
2010-09-30,101362,Canara Robeco Liquid Fund- INSTITUTIONAL-Growth,17.1603
2010-09-30,101363,Canara Robeco Liquid Fund- INSTITUTIONAL-Daily Dividend Reinvestment,10.055
2010-09-30,101364,Canara Robeco Liquid Fund-Retail-DRI,10.07
2010-09-30,101365,Canara Robeco Liquid Fund-Retail-Growth,17.1171
2010-09-30,101393,Sahara Liquid Fund-Fixed Pricing - Daily Dividend Option,1024.9045
2010-09-30,101394,Sahara Liquid Fund-Fixed Pricing - Growth option,1711.3704
2010-09-30,101397,Sahara Liquid Fund-Fixed Pricing -  Weekly Dividend Option,1027.376
2010-09-30,101398,Sahara Liquid Fund-Fixed Pricing - Monthly Dividend Option,1025.6443
2010-09-30,101399,Sahara Liquid Fund-Variable Pricing - Daily Dividend option,1024.9262
2010-09-30,101400,Sahara Liquid Fund-Variable Pricing - Weekly Dividend Option,1025.8839
2010-09-30,101401,Sahara Liquid Fund-Variable Pricing- Monthly Dividend Option,1025.9587
2010-09-30,101402,Sahara Liquid Fund-Variable Pricing - Growth option,1724.8146
2010-09-30,101407,Baroda BNP Paribas LIQUID FUND-Defunct Plan- IDCW Option,14.052
2010-09-30,101408,Baroda BNP Paribas LIQUID FUND- Defunct Plan -Growth Option,16.4004
2010-09-30,101409,Baroda BNP Paribas LIQUID FUND-Defunct Plan-Daily IDCW Option,10.0606
2010-09-30,101420,JM Floater Short Term Fund - Daily Dividend Option,10.0883
2010-09-30,101421,JM Floater Short Term Fund - Growth Option,15.184
