date,scheme_code,scheme_name,nav
2010-09-30,103170,Aditya Birla Sun Life Buy India Fund - Growth - Regular Plan,46.67
2010-09-30,103171,Birla Sun Life Basic Industries Fund-Plan A(Dividend),30.75
2010-09-30,103172,Birla Sun Life Basic Industries Fund-Plan B(Growth),111.48
2010-09-30,103173,Aditya Birla Sun Life Large Cap Fund-Regular - IDCW,23.86
2010-09-30,103174,Aditya Birla Sun Life Large Cap Fund-Growth,93.51
2010-09-30,103196,Nippon India ELSS Tax Saver Fund-Growth Plan-Growth Option,23.25
2010-09-30,103197,NIPPON INDIA ELSS TAX SAVER FUND - IDCW Option,18.1253
2010-09-30,103210,Sundaram CAPEX Opportunities Fund-Dividend,14.1768
2010-09-30,103211,Sundaram CAPEX Opportunities Fund-Growth,26.9114
2010-09-30,103215,SBI Flexicap Fund - REGULAR PLAN -Growth Option,19.59
2010-09-30,103216,SBI Flexicap Fund - Regular Plan - Income Distribution cum Capital Withdrawal Option (IDCW),14.88
2010-09-30,103225,quant Liquid Fund - Growth Option - Regular Plan,14.2121
2010-09-30,103226,quant Liquid Fund-Daily IDCW Option - Regular Plan,12.8962
2010-09-30,103227,quant Liquid Fund - Weekly IDCW Option - Regular Plan,12.7685
2010-09-30,103228,quant Liquid Fund - Monthly IDCW Option - Regular Plan,13.7928
2010-09-30,103233,Kotak Large & Midcap Fund - IDCW-Regular,16.417
2010-09-30,103234,Kotak Large & Midcap Fund - Growth-Regular,50.747
2010-09-30,103237,Benchmark Derivative Fund - Dividend Plan,1067.5372
2010-09-30,103308,Aditya Birla Sun Life Focused Fund -Regular - IDCW,16.4033
2010-09-30,103309,Aditya Birla Sun Life Focused Fund -Growth Option,23.6263
2010-09-30,103312,ICICI Prudential Exports & Services Fund - Growth,18.75
2010-09-30,103313,ICICI Prudential Exports & Services Fund - IDCW,14.1
2010-09-30,103334,Principal Focused Multicap Fund-Half Yearly Income Distribution CUM Capital Withdrawal Option,21.0
2010-09-30,103335,Principal Focused Multicap Fund-Growth Option,30.65
2010-09-30,103336,Tata Contra Fund Plan A -  Growth,18.7322
2010-09-30,103337,Tata Contra Fund Plan A -  Dividend,16.4797
2010-09-30,103338,Kotak ELSS Tax Saver Fund-Payout of Income Distribution cum capital withdrawal option,12.397
2010-09-30,103339,Kotak ELSS Tax Saver Fund-Growth,20.244
2010-09-30,103340,ICICI Prudential Liquid Fund - Growth,139.6762
2010-09-30,103341,ICICI Prudential Liquid Fund -Monthly IDCW,100.0909
2010-09-30,103342,ICICI Prudential Liquid Fund - Weekly IDCW,100.1911
2010-09-30,103343,ICICI Prudential Liquid Fund - Daily IDCW,100.0226
2010-09-30,103344,ICICI Prudential Liquid Fund - Institutional Option - I,136.4212
2010-09-30,103347,DSP Liquidity Fund - Regular Plan - Growth,1351.9393
2010-09-30,103348,DSP Liquidity Fund - Regular Plan - IDCW - Weekly,1000.2
2010-09-30,103349,DSP Liquidity Fund- Regular Plan - IDCW - Daily,1000.3161
2010-09-30,103360,Franklin India Small Cap Fund-Growth,15.8108
2010-09-30,103361,Franklin India Small Cap Fund - IDCW,14.6394
2010-09-30,103389,CANARA ROBECO INFRASTRUCTURE FUND - REGULAR PLAN - IDCW (Payout/Reinvestment),19.45
2010-09-30,103390,CANARA ROBECO INFRASTRUCTURE FUND - REGULAR PLAN - GROWTH OPTION,24.42
2010-09-30,103392,Sundaram Money Fund Regular Plan - Daily Reinvestment of Income Distribution cum Capital Withdrawal (IDCW),10.0953
2010-09-30,103397,Sundaram Money Fund Regular Plan - Growth,19.893
2010-09-30,103400,SBI Multi Asset Allocation Fund - Regular Plan - Monthly Income Distribution cum Capital Withdrawal Option (IDCW),10.6561
2010-09-30,103401,SBI Multi Asset Allocation Fund - Regular Plan - Quarterly Income Distribution cum Capital Withdrawal Option (IDCW),10.6279
2010-09-30,103408,SBI MULTI ASSET ALLOCATION FUND - REGULAR PLAN - GROWTH,13.0175
2010-09-30,103409,SBI Multi Asset Allocation Fund - Regular Plan - Annual Income Distribution cum Capital Withdrawal Option (IDCW),11.6078
2010-09-30,103420,Fidelity Tax Advantage Fund-Growth Option,23.438
2010-09-30,103421,Fidelity Tax Advantage Fund-Dividend Option,21.042
2010-09-30,103453,Principal Services Industries Fund-DIVIDEND,13.94
2010-09-30,103454,Principal Services Industries Fund-GROWTH,15.72
2010-09-30,103455,UTI Bluechip Flexicap Fund - Regular Plan - Dividend Option,15.56
2010-09-30,103457,UTI Bluechip Flexicap Fund - Regular Plan - Growth option,16.78
2010-09-30,103464,Quant Money Market Fund-Growth Option,13.8136
2010-09-30,103465,Quant Money Market Fund-Dividend Option,13.8123
2010-09-30,103468,HDFC Focused Large-Cap Fund-Dividend,14.329
2010-09-30,103469,HDFC Focused Large-Cap Fund-Growth,17.321
2010-09-30,103470,Tata Tax Advantage Fund -1,17.1181
2010-09-30,103473,KOTAK LIFESTYLE FUND---Dividend,13.064
2010-09-30,103474,KOTAK LIFESTYLE FUND---Growth,15.084
2010-09-30,103475,Aditya Birla Sun Life Infrastructure Fund -  Regular - IDCW,13.97
2010-09-30,103476,Aditya Birla Sun Life Infrastructure Fund-Growth,19.02
2010-09-30,103490,Quantum Value Fund - Direct Plan Growth Option,23.46
2010-09-30,103491,Quantum Value Fund - Direct Plan IDCW,23.66
2010-09-30,103504,SBI Large Cap FUND-REGULAR PLAN GROWTH,15.84
2010-09-30,103519,Tata Liquidity Management Fund - Regular Plan  -Weekly Dividend,1005.8432
2010-09-30,103532,UTI Contra Fund-Income-Dividend Option,14.19
2010-09-30,103534,UTI Contra Fund-Growth-Growth Option,15.38
2010-09-30,103548,Franklin Templeton Fixed Tenure Fund-SeriesIV(60MonthsPlan)-Growth Plan,15.199
2010-09-30,103549,Franklin Templeton Fixed Tenure Fund-SeriesIV(60MonthsPlan)-Annual Dividend Plan,12.0386
2010-09-30,103558,DWS TAX SAVING FUND-GROWTH,15.4573
2010-09-30,103559,DWS TAX SAVING FUND-DIVIDEND,14.4503
2010-09-30,103616,SBI Large Cap Fund - Regular Plan - Income Distribution cum Capital Withdrawal Option (IDCW),13.81
2010-09-30,103631,Tata Liquidity Management Fund - Regular Plan - Daily Dividend,1002.6089
2010-09-30,103632,Tata Liquidity Management Fund - Regular Plan - Growth,1285.9554
2010-09-30,103633,ICICI Prudential Money Market Fund Option - Growth,131.9127
2010-09-30,103634,ICICI Prudential Money Market Fund Option - Daily IDCW,100.0111
2010-09-30,103635,ICICI Prudential Money Market Fund Option - Weekly IDCW,100.0913
2010-09-30,103636,ICICI Prudential Money Market Fund Option -Fortnightly IDCW,100.2535
2010-09-30,103637,ICICI Prudential Money Market Fund Option - Monthly IDCW,100.2747
2010-09-30,103649,ING Contra Fund -Growth Option,17.4
2010-09-30,103650,ING Contra Fund-Dividend Option,14.85
2010-09-30,103651,ING Contra Fund-Bonus Option,17.4
2010-09-30,103659,ICICI Prudential Fusion Fund - Institutional Option - I - Growth,16.77
2010-09-30,103660,ICICI Prudential Fusion Fund-Growth Plan,15.87
2010-09-30,103661,ICICI Prudential Fusion Fund-Dividend Plan,14.96
2010-09-30,103678,Franklin India Dividend Yield Fund-Growth Plan,21.3921
2010-09-30,103679,Franklin India Dividend Yield Fund - IDCW,15.9128
2010-09-30,103730,Sahara Infrastructure Fund ---FIXED PRICING OPTION-Dividend Option,13.0189
2010-09-30,103731,Sahara Infrastructure Fund ---FIXED PRICING OPTION-Growth Option,17.8056
2010-09-30,103732,Sahara Infrastructure Fund ---VARIABLE PRICING OPTION-Dividend Option,13.5137
2010-09-30,103733,Sahara Infrastructure Fund ---VARIABLE PRICING OPTION-Growth Option,18.3917
2010-09-30,103734,Quantum Liquid Fund - Direct Plan Growth Option,13.4572
2010-09-30,103735,Quantum Liquid Fund - Direct Plan Monthly IDCW,10.0054
2010-09-30,103736,Quantum Liquid Fund - Direct Plan Daily IDCW,10.0
2010-09-30,103739,ING Income Growth Multi-Manager FoF Scheme-15% Equity Plan Option A-Dividend,11.3302
2010-09-30,103740,ING Income Growth Multi-Manager FoF Scheme Option A -15% Equity Plan-Growth,11.7161
2010-09-30,103741,ING Income Growth Multi-Manager FoF Scheme-30% Equity Plan Option A -Dividend,12.4697
2010-09-30,103742,ING Income Growth Multi-Manager FoF Scheme-30% Equity Plan Option A -Growth,12.8986
2010-09-30,103743,Sundaram Consumption Fund (Formerly Known as Sundaram Rural and Consumption Fund Regular Plan - Income Distribution cum Capital Withdrawal (IDCW),14.9948
2010-09-30,103747,Reliance Focused Large Cap Fund-Growth Plan-Growth Option,15.6341
2010-09-30,103748,Reliance Focused Large Cap Fund-Growth Plan-Bonus Option,15.6341
2010-09-30,103749,Reliance Focused Large Cap Fund-Dividend Plan,15.6341
2010-09-30,103751,JM HIFI Fund-Growth,6.0789
2010-09-30,103752,JM HIFI Fund-Dividend,6.0789
2010-09-30,103760,Tata Equity Management Fund Plan A- Div,13.4474
2010-09-30,103761,Tata Equity Management Fund Plan A - Growth,15.5593
2010-09-30,103767,Fidelity India Special Situations Fund-Growth Option,19.779
2010-09-30,103768,Fidelity India Special Situations Fund-Dividend Option,17.935
2010-09-30,103780,JM Arbitrage Fund (Regular) - Growth Option,13.261
2010-09-30,103781,JM Arbitrage Fund (Regular) - IDCW,10.1504
2010-09-30,103819,DSP Large & Mid Cap Fund - Regular Plan - Growth,94.078
2010-09-30,103820,DSP Large & Mid Cap Fund - Regular Plan - IDCW,32.798
2010-09-30,103883,SBI ELSS Tax Saver Fund - Regular Plan - Income Distribution cum Capital Withdrawal Option (IDCW),44.41
2010-09-30,103884,SBI Ultra Short Duration Fund - Regular Plan - Weekly Income Distribution cum Capital Withdrawal Option (IDCW),10.7856
2010-09-30,104074,UTI Arbitrage Fund - Regular Plan - IDCW,11.2333
2010-09-30,104075,UTI Arbitrage Fund - Regular Plan - Growth Option,13.6558
2010-09-30,104078,Franklin Templeton Fixed Tenure Fund - Series VI (60 Months Plan) - Growth Plan,14.8435
2010-09-30,104079,Franklin Templeton Fixed Tenure Fund - Series VI (60 Months Plan) - Annual Dividend Plan,12.7507
2010-09-30,104123,Tata Capital Builder Fund - Div,15.2481
2010-09-30,104124,Tata Capital Builder Fund - Growth,16.3316
2010-09-30,104174,ING Asset Allocator Multi-Manager FoF Scheme - Dividend,15.4815
2010-09-30,104175,ING Asset Allocator Multi-Manager FoF Scheme - Growth,16.8058
2010-09-30,104240,Taurus Liquid Fund-Dividend,1001.2
2010-09-30,104241,Taurus Liquid Fund-Growth,1240.8534
2010-09-30,104273,ING C.U.B (Competitive Upcoming Businesses) Fund-Bonus Option,18.86
2010-09-30,104274,ING C.U.B (Competitive Upcoming Businesses) Fund-Dividend Option,13.77
2010-09-30,104275,ING C.U.B (Competitive Upcoming Businesses) Fund-Growth Option,18.86
2010-09-30,104308,ICICI Prudential Liquid Fund - Half Yearly IDCW,100.1155
2010-09-30,104331,Aditya Birla Sun Life Tax Plan - Regular Plan - Growth Option,14.48
2010-09-30,104338,Aditya Birla Sun Life Long Term Fund-Dividend Option,14.2
2010-09-30,104339,Aditya Birla Sun Life Long Term Fund- Growth Option,15.37
2010-09-30,104389,Franklin Templeton Capital Safety Fund - 5 Years Plan - Growth,13.4478
2010-09-30,104390,Franklin Templeton Capital Safety Fund - 5 Years Plan - Annual Dividend,12.1333
2010-09-30,104411,JM Financial Services Sector Fund - Growth Plan,11.48
2010-09-30,104412,JM Financial Services Sector Fund - Dividend Plan,11.4797
2010-09-30,104413,JM Telecom Sector Fund - Growth Plan,8.933
2010-09-30,104414,JM Telecom Sector Fund - Dividend Plan,8.933
2010-09-30,104457,SBI Arbitrage Opportunities Fund - Regular Plan - Gr,12.984
2010-09-30,104458,SBI Arbitrage Opportunities Fund - Regular Plan - Income Distribution cum Capital Withdrawal Option (IDCW),11.1845
2010-09-30,104459,UTI Wealth Builder Fund - Dividend Option,15.2
2010-09-30,104460,UTI Wealth Builder Fund - Growth Option,17.44
2010-09-30,104481,DSP Midcap Fund - Regular Plan - Growth,19.2
2010-09-30,104482,DSP Midcap Fund - Regular Plan - IDCW,17.605
2010-09-30,104483,Religare Invesco Liquid Fund - Institutional - Daily Dividend,10.0022
2010-09-30,104484,Invesco India Liquid Fund - Daily IDCW (Reinvestment),10.0078
2010-09-30,104485,Invesco India Liquid Fund - Weekly IDCW (Reinvestment),10.0084
2010-09-30,104486,Invesco India Liquid Fund - Growth,12.9698
2010-09-30,104488,Invesco India Liquid Fund - Regular - Growth,12.7843
2010-09-30,104489,Invesco India Liquid Fund - Regular - Weekly IDCW (Reinvestment),10.0104
2010-09-30,104490,Religare Invesco Liquid Fund - Institutional - Weekly Dividend,10.0104
2010-09-30,104491,Religare Invesco Liquid Fund - Institutional - Growth,12.9091
2010-09-30,104493,Fidelity Cash Fund - Retail Plan - Growth option,12.6107
2010-09-30,104494,Fidelity Cash Fund - Super Institutional Plan - Daily Dividend Option,10.233
2010-09-30,104495,Fidelity Cash Fund - Retail Plan - Daily Dividend option,10.0025
2010-09-30,104496,Fidelity Cash Fund - Super Institutional Plan - Growth Option,12.8669
2010-09-30,104497,Fidelity Cash Fund - Institutional Plan - Growth Option,12.8043
2010-09-30,104498,Fidelity Cash Fund - Institutional Plan - Daily Dividend Option,10.0025
2010-09-30,104513,quant Large & Mid Cap Fund - Growth Option,14.981
2010-09-30,104514,quant Large & Mid Cap Fund - IDCW Option - Regular Plan,12.7594
2010-09-30,104515,quant Large & Mid Cap Fund - Bonus Option - Regular Plan,15.0153
2010-09-30,104523,SBI ESG Exclusionary Strategy Fund - Regular Plan - Growth,46.44
2010-09-30,104546,Fidelity Cash Fund - Institutional Plan - Weekly Dividend Option,10.1796
2010-09-30,104547,Fidelity Cash Fund - Retail Plan - Monthly Dividend Option,10.0084
2010-09-30,104548,Fidelity Cash Fund - Institutional Plan - Monthly Dividend Option,10.0
2010-09-30,104549,Fidelity Cash Fund - Retail Plan - Weekly Dividend Option,10.0061
2010-09-30,104550,Fidelity Cash Fund - Super Institutional Plan - Weekly Dividend Option,10.0
2010-09-30,104551,Fidelity Cash Fund - Super Institutional Plan - Monthly Dividend Option,10.0
2010-09-30,104554,Templeton India Money Market Account - Dividend Plan,1.0
2010-09-30,104559,CANARA ROBECO SAVINGS FUND - REGULAR PLAN - DAILY IDCW (Reinvestment),10.26
2010-09-30,104635,Invesco India ELSS Tax Saver Fund - Regular Plan - IDCW Payout,15.61
2010-09-30,104636,Invesco India ELSS Tax Saver Fund - Regular Plan - Growth,18.84
2010-09-30,104637,Nippon India Focused Fund -Growth Plan -Growth Option,17.2804
2010-09-30,104638,NIPPON INDIA FOCUSED  FUND - IDCW OPTION,17.2804
2010-09-30,104671,LIC NOMURA MF INDIA VISION FUND - GROWTH OPTION,9.8481
2010-09-30,104672,LIC NOMURA MF INDIA VISION FUND - DIVIDEND OPTION,9.8482
2010-09-30,104681,ICICI Prudential Arbitrage Fund - IDCW,10.72
2010-09-30,104682,ICICI Prudential Equity - Arbitrage Fund-Institutional Dividend Option,10.84
2010-09-30,104683,ICICI Prudential Arbitrage Fund - Growth,12.89
2010-09-30,104684,ICICI Prudential Equity - Arbitrage Fund-Institutional Growth Option,13.0
2010-09-30,104685,ICICI Prudential Balanced Advantage Fund - Growth,13.89
2010-09-30,104686,ICICI Prudential Balanced Advantage Fund - IDCW,13.16
2010-09-30,104706,HSBC Tax Saver Equity Fund - IDCW,14.6462
2010-09-30,104707,HSBC Tax Saver Equity Fund - Growth,15.8801
2010-09-30,104756,ING 5 Star Multi-Manager FoF Scheme - Growth,16.3759
2010-09-30,104757,ING 5 Star Multi-Manager FoF Scheme - Dividend,14.1637
2010-09-30,104762,SBI ONE INDIA FUND - GROWTH (PREVIOUSLY CLOSE ENDED UPTO 14/01/2010),12.03
2010-09-30,104763,SBI ONE INDIA FUND - DIVIDEND (PREVIOUSLY CLOSE ENDED UPTO 14/01/2010),12.04
2010-09-30,104772,DSP ELSS Tax Saver Fund - Regular Plan - Growth,18.649
2010-09-30,104773,DSP ELSS Tax Saver Fund - Regular Plan - IDCW,13.887
2010-09-30,104860,Canara Robeco Multicap-GROWTH OPTION,16.92
2010-09-30,104861,Canara Robeco Multicap-DIVIDEND OPTION,15.69
2010-09-30,104898,ICICI Prudential Multi-Asset Fund-Institutional Option - I,16.9619
2010-09-30,104907,Kotak Midcap Fund - Regular Plan - IDCW -Payout & Re-investment of Income Distribution cum capital withdrawal option,13.339
2010-09-30,104908,Kotak Midcap Fund - Regular Plan - Growth,13.339
2010-09-30,104953,UTI Capital Protection Orinted Scheme - Plan 5 years- Income Option,13.6777
2010-09-30,104954,UTI Capital Protection Oriented Scheme - 5 Years -Growth Option,13.6777
2010-09-30,104998,Sundaram Select Small Cap Dividend,14.5555
2010-09-30,104999,Sundaram Select Small Cap- Growth,14.5546
2010-09-30,105000,Sundaram Large and Midcap Regular Plan - Income Distribution cum Capital Withdrawal (IDCW),12.1992
2010-09-30,105001,Sundaram Large and Midcap Fund Regular Plan - Growth,14.9547
2010-09-30,105038,JM Small & Mid-cap Fund - Regular Plan - Growth option,6.4277
2010-09-30,105039,JM Small & Mid-cap Fund - Regular Plan - Dividend option,6.4277
2010-09-30,105066,Franklin India Index Fund - BSE Plan - Dividend Plan,56.5278
2010-09-30,105067,Franklin India INDEX FUND- NSE NIFTY 50 INDEX FUND - IDCW,47.489
2010-09-30,105080,SBI Ultra Short Duration Fund - Regular Plan - Daily Income Distribution cum Capital Withdrawal Option (IDCW),16.7503
2010-09-30,105085,Gold Benchmark Exchange Traded Scheme (Gold BeES),1879.3351
2010-09-30,105096,ICICI Prudential Equity Opportunities Fund - Retail Growth Plan,14.07
2010-09-30,105098,ICICI Prudential Equity Opportunities Fund - Retail Dividend Plan,13.12
2010-09-30,105099,ICICI Prudential Equity Opportunities Fund - Institutional Growth Plan,14.53
2010-09-30,105227,HSBC Dividend Yield Equity Fund - Dividend,12.0298
2010-09-30,105228,HSBC Dividend Yield Equity Fund - Growth,12.0298
2010-09-30,105274,SBI Liquid Fund - Institutional - Growth,15.014
2010-09-30,105275,SBI Liquid Fund - Institutional Daily Income Distribution cum Capital Withdrawal Option (IDCW),10.0325
2010-09-30,105278,SBI Liquid Fund - Institutional Weekly Income Distribution cum Capital Withdrawal Option (IDCW),10.6134
2010-09-30,105279,SBI Liquid Fund - Institutional Fortnightly Income Distribution cum Capital Withdrawal Option (IDCW),10.1891
2010-09-30,105280,SBI Liquid Fund - REGULAR PLAN -Growth,14.8529
2010-09-30,105281,SBI Liquid Fund - Regular Plan - Daily Income Distribution cum Capital Withdrawal Option (IDCW),10.0325
2010-09-30,105316,Principal Pnb Long Term Equity Fund - Dividend Option,12.31
2010-09-30,105317,Principal Pnb Long Term Equity Fund - Growth Option,12.31
2010-09-30,105322,Franklin Templeton Fixed Tenure Fund - Series VIII - 60 Months Plan (Plan A) - Growth Plan,13.7954
2010-09-30,105323,Franklin Templeton Fixed Tenure Fund - Series VIII - 60 Months Plan (Plan A) - Dividend Plan,11.7647
2010-09-30,105324,ING RetireInvest Fund Series I - Dividend,13.41
2010-09-30,105325,ING RetireInvest Fund Series I - Growth,13.41
2010-09-30,105417,Taurus Infrastructure Fund - Regular Plan - Growth,15.63
2010-09-30,105418,Taurus Infrastructure Fund - Regular Plan - Payout of Income Distribution cum Capital Withdrawal option,14.65
2010-09-30,105459,Invesco India Contra Fund - Regular Plan - IDCW (Payout / Reinvestment),13.32
2010-09-30,105460,Invesco India Contra Fund - Regular Plan - Growth,17.22
2010-09-30,105497,UTI Long Term Advantage Fund  - Dividend Option,13.85
2010-09-30,105498,UTI Long Term Advantage Fund  - Growth Option,13.85
2010-09-30,105503,Invesco India Midcap Fund - Regular Plan - Growth Option,15.69
2010-09-30,105504,Invesco India Midcap Fund - Regular Plan - IDCW (Payout / Reinvestment),12.99
2010-09-30,105525,Franklin Templeton Capital Protection Oriented Fund - 5 Years Plan - Growth,13.5057
2010-09-30,105526,Franklin Templeton Capital Protection Oriented Fund - 5 Years Plan - Dividend,12.3049
2010-09-30,105582,JPMorgan India Equity Fund - Regular Plan - Growth Option,14.259
2010-09-30,105583,JPMorgan India Equity Fund - Regular Plan - Dividend Option,13.24
2010-09-30,105598,PineBridge India Equity Fund- Standard Plan- Growth Option,12.821
2010-09-30,105600,PineBridge India Equity Fund- Standard Plan- Dividend Option,12.821
2010-09-30,105601,PineBridge India Equity Fund- Institutional Plan- Dividend Option,13.109
2010-09-30,105602,ICICI Prudential Infrastructure Fund - Institutional Option - I - Growth,17.46
2010-09-30,105603,Invesco India Arbitrage Fund - Regular Plan - Growth Option,12.3697
2010-09-30,105604,Invesco India Arbitrage Fund - Regular Plan - IDCW (Payout / Reinvestment),10.1228
2010-09-30,105619,ING Multi Manager Equity Fund - Option A- Dividend(Payout and Reinvestment),11.78
2010-09-30,105620,ING Multi Manager Equity Fund - Option A- Growth,11.78
2010-09-30,105628,SBI ELSS Tax Saver FUND - REGULAR PLAN- GROWTH,65.15
2010-09-30,105672,DWS INSTA CASH PLUS FUND - Regular Plan BONUS OPTION,11.7345
2010-09-30,105757,HDFC Mid Cap Fund - IDCW Plan,16.245
2010-09-30,105758,HDFC Mid Cap Fund - Growth Plan,16.244
2010-09-30,105802,Fidelity International Opportunities Fund - Growth Option,13.93
2010-09-30,105803,Fidelity International Opportunities Fund - Dividend Option,13.93
2010-09-30,105804,Aditya Birla Sun Life Small Cap Fund - GROWTH,13.4205
2010-09-30,105805,Aditya Birla Sun Life Small Cap Fund -Regular - IDCW,13.4205
2010-09-30,105816,Franklin India Focused Equity Fund - IDCW,13.4514
2010-09-30,105817,Franklin India Focused Equity Fund - Growth Plan,14.047
2010-09-30,105822,LIC MF Banking & PSU Fund-Regular Plan-Daily IDCW,10.0
2010-09-30,105823,LIC MF Banking & PSU Fund-Regular Plan-Growth,12.6949
2010-09-30,105856,LIC MF Banking & PSU Fund-Regular Plan-Monthly IDCW,10.046
2010-09-30,105857,LIC MF Banking & PSU Fund-Regular Plan-Weekly IDCW,10.0048
2010-09-30,105870,DSP Equity Opportunities Fund - Institutional Plan - IDCW,11.508
2010-09-30,105871,DSP Top 100 Equity Fund - Institutional  Plan - Dividend,14.506
2010-09-30,105872,DSP Top 100 Equity Fund - Institutional  Plan - Growth,14.506
2010-09-30,105873,DSP India T.I.G.E.R. Fund - Institutional Plan - IDCW,10.713
2010-09-30,105874,DSP India T.I.G.E.R. Fund - Institutional Plan - Growth,15.039
2010-09-30,105875,DSP Flexi Cap Fund - Regular Plan - Growth,17.804
2010-09-30,105876,DSP BlackRock Equity Fund - Institutional Plan - Growth,14.07
2010-09-30,105967,Kotak Arbitrage Fund - Regular Plan - IDCW - Payout & Re-investment of Income Distribution cum capital withdrawal option,10.5774
2010-09-30,105968,Kotak Arbitrage Fund - Regular Plan - Growth,14.0515
2010-09-30,105989,DSP Small Cap Fund - Regular - Growth,17.735
2010-09-30,106095,SBI Infrastructure Fund - Regular Plan - Income Distribution cum Capital Withdrawal Option (IDCW),11.33
2010-09-30,106096,SBI INFRASTRUCTURE FUND -  REGULAR PLAN - GROWTH,11.33
2010-09-30,106130,Tata Corporate Bond Fund -Regular Plan  -  Daily Dividend,1009.4394
2010-09-30,106133,Tata Corporate Bond Fund Super High Investment Plan Daily Dividend,1010.3171
2010-09-30,106143,Invesco India Large & Mid Cap Fund - Regular Plan - IDCW (Payout / Reinvestment),13.54
2010-09-30,106144,Invesco India Large & Mid Cap Fund - Regular Plan - Growth,13.55
2010-09-30,106147,JM Contra Fund - Growth option,6.2024
2010-09-30,106148,JM Contra Fund - Dividend option,6.2024
2010-09-30,106166,CANARA ROBECO EQUITY HYBRID FUND - REGULAR PLAN - GROWTH OPTION,63.72
2010-09-30,106167,CANARA ROBECO EQUITY HYBRID FUND - REGULAR PLAN - MONTHLY IDCW (Payout/Reinvestment),55.3
2010-09-30,106168,JM Value Fund (Regular) - IDCW,12.6037
2010-09-30,106169,quant Infrastructure Fund - IDCW Option - Regular Plan,9.3193
2010-09-30,106170,quant Infrastructure Fund - Growth Option,9.3143
2010-09-30,106212,SBI LOW DURATION FUND - REGULAR PLAN - GROWTH,12.1462
2010-09-30,106213,SBI Low Duration Fund - Regular Plan - Daily Income Distribution cum Capital Withdrawal Option (IDCW),10.0079
2010-09-30,106214,SBI Low Duration Fund - Regular Plan - Weekly Income Distribution cum Capital Withdrawal Option (IDCW),10.0799
2010-09-30,106215,SBI Low Duration Fund - Regular Plan - Fornightly Income Distribution cum Capital Withdrawal Option (IDCW),10.0567
2010-09-30,106216,SBI Low Duration Fund - Regular Plan - Monthly Income Distribution cum Capital Withdrawal Option (IDCW),10.2834
2010-09-30,106217,SBI Short Horizon Debt Fund - Ultra Short Term Fund - Institutional Plan - Growth,12.321
2010-09-30,106221,SBI Short Horizon Debt Fund - Ultra Short Term Fund - Institutional Plan - Daily Income Distribution cum Capital Withdrawal Option (IDCW),10.0079
2010-09-30,106222,SBI Short Horizon Debt Fund - Ultra Short Term Fund- Institutional Plan - Weekly Income Distribution cum Capital Withdrawal Option (IDCW),10.0967
2010-09-30,106224,SBI Short Horizon Debt Fund - Ultra Short Term Fund - Institutional Plan - Monthly Income Distribution cum Capital Withdrawal Option (IDCW),10.3864
2010-09-30,106227,SBI SHORT HORIZON DEBT FUND-SHORT TERM FUND - RETAIL - GROWTH,12.376
2010-09-30,106228,SBI Short Horizon Debt Fund - Short Term Fund - Retail Dividend - Weekly Income Distribution cum Capital Withdrawal Option (IDCW),10.499
2010-09-30,106229,SBI Short Horizon Debt Fund - Short Term Fund - Retail Dividend - Monthly Income Distribution cum Capital Withdrawal Option (IDCW),10.4635
2010-09-30,106230,SBI Short Horizon Debt Fund - Short Term Fund - Retail Dividend - Fortnightly Income Distribution cum Capital Withdrawal Option (IDCW),10.5402
2010-09-30,106231,SBI SHORT TERM DEBT FUND - REGULAR PLAN -GROWTH,10.8912
2010-09-30,106232,SBI Short Term Debt Fund - Regular Plan Weekly Income Distribution cum Capital Withdrawal Option (IDCW),10.1141
2010-09-30,106233,SBI Short Term Debt Fund - Regular Plan - Monthly Income Distribution cum Capital Withdrawal Option (IDCW),10.8355
2010-09-30,106235,Nippon India Large Cap  Fund- Growth Plan -Growth Option,13.9345
2010-09-30,106236,NIPPON INDIA LARGE CAP FUND - IDCW Option,13.9345
2010-09-30,106238,Nippon India Large Cap Fund-Institutional Plan Growth Plan Bonus Option,14.1716
2010-09-30,106239,Reliance Top 200 Fund-Institutional Plan Dividend Option,14.1716
2010-09-30,106240,Nippon India Large Cap Fund- Growth Plan Bonus Option,13.9345
2010-09-30,106252,Nippon India Multi Cap Fund Institutional Dividend Plan,38.8299
2010-09-30,106255,Nippon India Vision Large & Mid Cap Fund Institutional Dividend Plan,273.9135
2010-09-30,106256,Reliance Vision Fund Institutional Plan Growth Plan Growth Option,298.6885
2010-09-30,106258,Reliance Growth Fund Institutional Plan Growth Plan Growth Option,513.2638
2010-09-30,106260,NIPPON INDIA GROWTH MID CAP FUND - INSTITUTIONAL Plan - IDCW Option,496.589
2010-09-30,106316,Invesco India Balanced Advantage Fund - Regular Plan - IDCW (Payout / Reinvestment),13.52
2010-09-30,106317,Invesco India Balanced Advantage Fund - Regular Plan - Growth,13.52
