date,scheme_code,scheme_name,nav
2010-09-30,101472,Sundaram Equity Hybrid Fund Regular Plan - Income Distribution cum Capital Withdrawal (IDCW),17.6898
2010-09-30,101489,Tata Young Citizen Fund [Upto 3 years] Regular Plan,20.5924
2010-09-30,101490,Tata Young Citizen Fund [>3 years upto 7 years] Regular Plan,20.5924
2010-09-30,101491,Tata Childrens Fund -Regular Plan-Growth Option,20.5924
2010-09-30,101525,HDFC Nifty 50 Index Fund - Growth Plan,52.5324
2010-09-30,101528,Sahara Growth Fund-Growth,87.8864
2010-09-30,101529,Sahara Growth Fund-Dividend,32.9499
2010-09-30,101530,SBI Large & Midcap Fund - Regular Plan - Income Distribution cum Capital Withdrawal Option (IDCW),63.26
2010-09-30,101536,Sundaram Select Focus Regular Plan - Income Distribution cum Capital Withdrawal (IDCW),12.6422
2010-09-30,101537,Sundaram Select Focus Regular Plan - Growth,97.5944
2010-09-30,101538,Sundaram Mid Cap Fund Regular Plan - Income Distribution cum Capital Withdrawal (IDCW),20.4997
2010-09-30,101539,Sundaram Mid Cap Fund Regular Plan - Growth,164.0462
2010-09-30,101549,JM Liquid Fund (Regular) - Bonus Option - Principal Units,13.5255
2010-09-30,101551,SBI Equity Hybrid Fund - Regular Plan - Income Distribution cum Capital Withdrawal Option (IDCW),28.84
2010-09-30,101587,CANARA ROBECO INCOME FUND - REGULAR PLAN - QUARTERLY IDCW (Payout/Reinvestment),13.2572
2010-09-30,101588,CANARA ROBECO INCOME FUND - REGULAR PLAN - GROWTH OPTION,20.0836
2010-09-30,101589,Canara Robeco Income Fund-Bonus option,13.5103
2010-09-30,101591,Aditya Birla Sun Life Midcap Fund -REGULAR - IDCW,26.47
2010-09-30,101592,Aditya Birla Sun Life MIDCAP Fund-Growth,119.72
2010-09-30,101593,HSBC Large Cap Fund - Regular IDCW,29.8458
2010-09-30,101594,HSBC Large Cap Fund - Regular Growth,110.5633
2010-09-30,101621,Nifty Junior Benchmark Exchange Traded Scheme (Junior BeES),126.0699
2010-09-30,101628,DWS Alpha Equity Fund - Dividend,18.69
2010-09-30,101629,DWS Alpha Equity Fund - Growth,85.88
2010-09-30,101635,DSP Large Cap Fund - Regular Plan - Growth,105.903
2010-09-30,101636,DSP Large Cap Fund - Regular Plan - IDCW,22.468
2010-09-30,101659,Tata Nifty 50 Index Fund -Regular Plan,36.0169
2010-09-30,101661,UTI - Variable Investment Scheme-Income Option,13.1619
2010-09-30,101662,UTI - Variable Investment Scheme-Growth Option,17.5082
2010-09-30,101672,Tata Value Fund - Regular Plan -Growth Option,50.6258
2010-09-30,101691,HSBC Cash Fund - Inst. - Growth,15.3643
2010-09-30,101692,HSBC Cash Fund - Inst. - Dividend - Daily,10.4401
2010-09-30,101693,HSBC Cash Fund - Inst. - Dividend - Weekly,10.4733
2010-09-30,101694,HSBC Cash Fund - Inst. - Dividend - Monthly,10.5311
2010-09-30,101696,HSBC Liquid Fund - Growth closed plan,15.2052
2010-09-30,101697,HSBC Cash Fund - Regular - Dividend - Daily,10.193
2010-09-30,101698,HSBC Cash Fund - Regular - Dividend - Weekly,10.0258
2010-09-30,101699,HSBC Liquid Fund Closed,14.5022
2010-09-30,101700,HSBC Cash Fund - Dividend - Daily,10.0056
2010-09-30,101701,HSBC Cash Fund - Dividend - Weekly,10.2445
2010-09-30,101702,HSBC Cash Fund - Dividend - Monthly,10.0863
2010-09-30,101705,ICICI Prudential BSE Sensex ETF,208.7626
2010-09-30,101706,ICICI Prudential Multicap Fund - IDCW,19.06
2010-09-30,101714,Tata Liquid Fund- Regular Plan - Daily Reinvestment of IDCW Option,10.0152
2010-09-30,101716,DWS Insta Cash Plus Fund-DIVIDEND-WEEKLY DIVIDEND,10.3618
2010-09-30,101717,DWS Insta Cash Plus Fund-DIVIDEND-MONTHLY DIVIDEND,11.0797
2010-09-30,101718,DWS Insta Cash Plus Fund-DIVIDEND-Daily Dividend,10.301
2010-09-30,101719,DWS Insta Cash Plus Fund-Growth-GROWTH,15.8093
2010-09-30,101720,DWS Insta Cash Plus Fund-Institutional Plan-Dividend,10.0893
2010-09-30,101721,DWS Insta Cash Plus Fund-Institutional Plan-Growth,14.8686
2010-09-30,101722,DWS Insta Cash Plus Fund-Institutional Plan-Daily Dividend,10.0516
2010-09-30,101723,DWS Insta Cash Plus Fund-Institutional Plan-Weekly Dividend,10.0877
2010-09-30,101733,Kotak 30-(Dividend),34.68
2010-09-30,101734,Kotak 30-(Growth),109.956
2010-09-30,101737,Aditya Birla Sun Life Dividend Yield Fund -REGULAR - IDCW,16.25
2010-09-30,101738,Aditya Birla Sun Life Dividend Yield Fund - Growth - Regular Plan,90.92
2010-09-30,101746,Tata S&P BSE Sensex Index Fund -Regular Plan,48.8462
2010-09-30,101747,Tata Index Fund - Sensex B,15.8589
2010-09-30,101748,ICICI Prudential Liquid Fund - Institutional - Daily - Div,118.502
2010-09-30,101749,ICICI Prudential Liquid Fund - Institutional - Monthly - Div,100.064
2010-09-30,101750,ICICI Prudential Liquid Fund Retail Growth,227.6839
2010-09-30,101751,ICICI Prudential Liquid Institutional Fund - Growth,232.1643
2010-09-30,101752,ICICI Prudential Liquid Fund Retail Weekly Dividend,118.8594
2010-09-30,101753,ICICI Prudential Liquid Fund - Institutional - Weekly - Div,118.49
2010-09-30,101754,ICICI Prudential Liquid Fund Retail Daily Dividend,118.514
2010-09-30,101755,ICICI Prudential Liquid Fund Retail Monthly Dividend,100.1023
2010-09-30,101762,HDFC Flexi Cap Fund - Growth Plan,296.647
2010-09-30,101763,HDFC Flexi Cap Fund - IDCW Plan,54.518
2010-09-30,101764,HDFC Value Fund - Growth Plan,117.837
2010-09-30,101765,HDFC Value Fund - IDCW Plan,28.544
2010-09-30,101766,Tata Infrastructure Fund-Regular Plan- Growth Option,38.0374
2010-09-30,101815,Principal Personal Tax Saver Fund,106.19
2010-09-30,101823,Tata Large & Mid Cap Fund Regular Plan - Payout of IDCW Option,23.9899
2010-09-30,101824,Tata Large & Mid Cap Fund- Regular Plan - Growth Option,87.7602
2010-09-30,101829,LIC MF Low Duration Fund-Regular Plan-Monthly IDCW,10.0457
2010-09-30,101830,LIC MF Low Duration Fund-Regular Plan-Growth,15.0292
2010-09-30,101833,Tata Ethical Fund- Regular Plan - Payout of IDCW Option,50.1021
2010-09-30,101834,UTI - Master Equity Plan Unit Scheme,52.38
2010-09-30,101847,Tata Money Market Fund-Regular Plan - Growth Option,1743.9029
2010-09-30,101852,TATA Infrastructure Fund Regular Plan - Payout of IDCW Option,25.0466
2010-09-30,101853,Sundaram Value Fund Regular Plan - Growth,48.1228
2010-09-30,101858,Tata Liquid Retail Investment Plan - Growth,2164.2056
2010-09-30,101859,Tata Liquid High Investment Plan - Weekly,1146.9028
2010-09-30,101860,Tata Liquid High Investment Plan - Growth,1565.5043
2010-09-30,101861,Tata Liquid Fund-Regular Plan  - Weekly Dividend,1150.9138
2010-09-30,101862,Nippon India Banking & Financial Services Fund-Growth Plan-Growth Option,112.478
2010-09-30,101863,Nippon India Banking & Financial Services Fund-Growth Plan-Bonus Option,112.478
2010-09-30,101864,Nippon India Banking & Financial Services Fund - IDCW Option,44.8818
2010-09-30,101866,LIC MF Conservative Hybrid Fund-Regular Plan-Monthly IDCW,10.1193
2010-09-30,101867,LIC MF Conservative Hybrid Fund-Regular Plan-Quarterly IDCW,10.152
2010-09-30,101868,LIC MF Conservative Hybrid Fund-Regular Plan-Yearly IDCW,10.5827
2010-09-30,101869,LIC MF Conservative Hybrid Fund-Regular Plan-Growth,32.8137
2010-09-30,101871,Tata Life Science & Technology Fund - Dividend Option,34.9594
2010-09-30,101884,Liquid Benchmark Exchange Traded Scheme (Liquid BeES),1000.0
2010-09-30,101892,Kotak Money market Fund - (Monthly Payout of Income Distribution cum capital withdrawal option),10.0321
2010-09-30,101893,Kotak Money Market Fund - (Growth),15.4353
2010-09-30,101894,Kotak Money Market Fund - (Weekly Reinvestment of Income Distribution cum capital withdrawal option),10.0641
2010-09-30,101898,UTI Sunder,636.9489
2010-09-30,101912,BARODA  HYBRID EQUITY FUND - Plan A - Growth Option,29.42
2010-09-30,101913,BARODA HYBRID EQUITY FUND - Plan A - IDCW Option,29.41
2010-09-30,101922,CANARA ROBECO FLEXICAP FUND - REGULAR PLAN - GROWTH OPTION,58.53
2010-09-30,101923,CANARA ROBECO FLEXICAP FUND - REGULAR PLAN - IDCW (Payout/Reinvestment),26.62
2010-09-30,101924,Canara Robeco Equity Diversified-Bonus Option,26.66
2010-09-30,101932,SBI GILT FUND -  GROWTH - PF (Regular) Option,12.3548
2010-09-30,101933,SBI GILT FUND -  GROWTH - PF (Fixed Period - 2 Yrs) Option,11.95
2010-09-30,101934,SBI GILT FUND -  GROWTH - PF (Fixed Period - 3 Yrs) Option,11.7594
2010-09-30,101935,SBI Gilt Fund - Income Distribution cum Capital Withdrawal Option (IDCW) - PF (Regular),10.2821
2010-09-30,101950,SBI Gilt Fund - Income Distribution cum Capital Withdrawal Option (IDCW) - PF (Fixed Period - 1 Yr),10.1131
2010-09-30,101951,SBI Gilt Fund - Income Distribution cum Capital Withdrawal Option (IDCW) - PF (Fixed Period - 2 Yrs),10.2063
2010-09-30,101952,SBI Gilt Fund - Income Distribution cum Capital Withdrawal Option (IDCW) - PF (Fixed Period - 3 Yrs),10.0586
2010-09-30,101970,Aditya Birla Sun Life Money Manager Fund - RETAIL - WEEKLY IDCW,10.3864
2010-09-30,101971,Aditya Birla Sun Life Money Manager Fund - Retail Growth,15.5518
2010-09-30,101972,Aditya Birla Sun Life Money Manager Fund - Retail - Daily IDCW,10.0015
2010-09-30,101973,Aditya Birla Sun Life Money Manager Fund - Daily IDCW,10.0
2010-09-30,101974,Aditya Birla Sun Life Money Manager Fund - WEEKLY IDCW,10.0191
2010-09-30,101975,Aditya Birla Sun Life Floating Rate Fund-Short Term Plan-Institutional Fortnightly Dividend,10.0
2010-09-30,101976,Aditya Birla Sun Life Money Manager Fund - Growth,12.5323
2010-09-30,101977,HDFC Prudence Fund - Growth Option,219.644
2010-09-30,101978,HDFC Prudence Fund - Dividend Option,33.738
2010-09-30,101979,HDFC ELSS Tax saver - Growth Plan,250.622
2010-09-30,101980,HDFC ELSS Tax saver - IDCW Plan,70.408
2010-09-30,101982,Tata Liquid Retail Investment PLan - Daily,1116.8143
2010-09-30,101983,Tata Liquid Retail Investment Plan - Fortnightly,1144.9739
2010-09-30,101984,Tata Liquid High Investment Plan - Daily,1114.3379
2010-09-30,101985,Tata Liquid High Investment Plan - Monthly,1019.5681
2010-09-30,101986,Tata Money Market Fund- Regular Plan - Daily Reinvestment of IDCW Option,1114.52
2010-09-30,101987,Tata Liquid Fund Reglar Plan - Monthly Dividend,1003.5212
2010-09-30,101993,HDFC Money Market Fund - Growth Option,19.7493
2010-09-30,101994,HDFC Money Market Fund - Daily IDCW Option,10.6364
2010-09-30,101995,HDFC Money Market Fund - Weekly IDCW Option,10.6355
2010-09-30,101996,HDFC Overnight Fund - Growth Option,15.6205
2010-09-30,101997,HDFC Overnight Fund - IDCW Option (Daily),10.4266
2010-09-30,102000,HDFC Large Cap Fund - Growth Option - Regular Plan,224.764
2010-09-30,102001,HDFC Large Cap Fund - IDCW Option - Regular Plan,53.127
2010-09-30,102007,UTI-  Liquid Cash Plan- Discontinued -Regular Plan Periodic Dividend Option,1059.7297
2010-09-30,102008,UTI-  Liquid Cash Plan- Discontinued - Regular Plan - Monthly Dividend Option,1074.7207
2010-09-30,102009,UTI-  Liquid Cash Plan- Discontinued - Regular Plan -Growth,1524.9424
2010-09-30,102010,UTI Liquid Fund - Regular Plan - Daily IDCW (Reinvestment),1019.4457
2010-09-30,102011,UTI Liquid Fund - Regular Plan - Monthly IDCW,1029.8335
2010-09-30,102012,UTI-  Liquid Cash Plan - Regular Plan - Growth Option,1551.2421
2010-09-30,102013,UTI Liquid Fund - Regular Plan - Weekly IDCW,1028.3527
2010-09-30,102020,Baroda BNP Paribas MULTI CAP FUND - Regular Plan - Growth Option,56.81
2010-09-30,102021,Baroda BNP Paribas MULTI CAP FUND - Regular Plan - IDCW Option,32.0
2010-09-30,102036,Tata Large Cap Fund- Regular Plan - Payout of IDCW Option,40.7098
2010-09-30,102053,SBI MEDIUM DURATION FUND - REGULAR PLAN - GROWTH,16.1903
2010-09-30,102054,SBI Medium Duration Fund - Regular Plan - Income Distribution cum Capital Withdrawal Option (IDCW),10.9824
2010-09-30,102055,SBI Magnum Income Plus Fund - Savings Plan (G),11.0152
2010-09-30,102056,SBI Magnum Income Plus Fund - Savings Plan (D),10.4579
2010-09-30,102061,SBI GILT FUND -  GROWTH - PF (Fixed Period - 1 Yr) Option,12.0873
2010-09-30,102133,ICICI Prudential Multi Sector Passive FOF - Growth,30.2707
2010-09-30,102134,ICICI Prudential Multi Sector Passive FOF - IDCW,30.2707
2010-09-30,102135,ICICI Prudential Aggressive Hybrid Active FOF - Growth,35.5019
2010-09-30,102136,ICICI Prudential Aggressive Hybrid Active FOF - IDCW,35.5019
2010-09-30,102137,ICICI Prudential Dynamic Asset Allocation Active FOF - Growth,24.6182
2010-09-30,102138,ICICI Prudential Dynamic Asset Allocation Active FOF - IDCW,24.6182
2010-09-30,102142,Sundaram Consumption Fund(Formerly Known as Sundaram Rural and Consumption Fund Regular Plan - Growth),16.4655
2010-09-30,102152,Tata Money Market Fund Regular (Bonus / Dividend),10.1521
2010-09-30,102153,Tata Money Market Fund Regular (Growth),15.1036
2010-09-30,102201,SBI MAGNUM NRI - SHORT TERM BOND PLAN-GROWTH,11.1742
2010-09-30,102202,SBI MAGNUM NRI - SHORT TERM BOND PLAN-DIVIDEND,10.8699
2010-09-30,102203,DWS Investment Opportunity Fund - Dividend Option,29.36
2010-09-30,102204,DWS Investment Opportunity Fund - Growth Option,42.38
2010-09-30,102205,SBI Dynamic Bond Fund - REGULAR PLAN - Growth,11.3402
2010-09-30,102206,SBI Dynamic Bond Fund - Regular Plan - Income Distribution cum Capital Withdrawal Option (IDCW),10.4333
2010-09-30,102207,SBI MAGNUM NRI FLEXIASSET PLAN-GROWTH,30.8575
2010-09-30,102208,SBI MAGNUM NRI FLEXIASSET PLAN-DIVIDEND,30.9729
2010-09-30,102242,ING Large Cap Equity Fund-Growth Option,30.31
2010-09-30,102243,ING Large Cap Equity Fund-Dividend Option,20.2
2010-09-30,102251,HSBC Flexi Cap Fund - Regular IDCW,18.5365
2010-09-30,102252,HSBC Flexi Cap Fund - Regular Growth,37.1897
2010-09-30,102266,UTI Children's Equity Fund - Regular Plan - IDCW,17.4137
2010-09-30,102267,UTI Children's Equity Fund - Regular Plan - Growth Option,17.4137
2010-09-30,102268,LIC NOMURA MF Floating Rate Fund - Short Term Plan-Growth,15.5382
2010-09-30,102269,LIC NOMURA MF Floating Rate Fund - Short Term Plan-Weekly Dividend,10.1532
2010-09-30,102270,Franklin FMCG Fund - Dividend,43.3123
2010-09-30,102271,Franklin Pharma Fund - Dividend,32.114
2010-09-30,102272,SBI NIFTY INDEX FUND - REGULAR PLAN - GROWTH,51.463
2010-09-30,102273,SBI Nifty Index Fund - Regular Plan - Income Distribution cum Capital Withdrawal Option (IDCW),26.3588
2010-09-30,102315,ING Tax Savings Fund-Growth Option,31.61
2010-09-30,102316,ING Tax Savings Fund-Dividend Option,15.59
2010-09-30,102317,ING Tax Savings Fund-Bonus Option,31.66
2010-09-30,102320,Franklin India Index Fund - BSE Plan - Growth Plan,56.5278
2010-09-30,102326,Tata Mid Cap Fund-Regular Plan - IDCW Option,18.8352
2010-09-30,102328,Tata Mid Cap Fund Regular Plan- Growth Option,47.089
2010-09-30,102329,Tata Mid Cap Growth Fund Regular Plan  - Bonus (Growth),42.7911
2010-09-30,102336,Principal Global Opportunities Fund- Income Distribution CUM Capital Withdrawal Option,16.9881
2010-09-30,102337,Principal Global Opportunities Fund-Growth Option,16.9881
2010-09-30,102393,UTI Mid Cap Fund - Regular Plan - IDCW,23.63
2010-09-30,102394,UTI Mid Cap Fund-Growth Option,34.67
2010-09-30,102395,UTI Infrastructure Fund-Growth Option,37.65
2010-09-30,102396,UTI Infrastructure Fund - Regular Plan - IDCW,21.44
2010-09-30,102397,UTI Transportation and Logistics Fund - Regular Plan - IDCW,18.3
2010-09-30,102398,UTI-Transportation and Logistics  Fund-Growth Option,29.97
2010-09-30,102401,UTI Banking and Financial Services Fund - Regular Plan - Growth Option,47.82
2010-09-30,102402,UTI Banking and Financial Services Fund - Regular Plan - IDCW,27.76
2010-09-30,102414,SBI CONTRA FUND - REGULAR PLAN -GROWTH,62.63
2010-09-30,102426,Principal Resurgent India Equity Fund-Growth,97.0
2010-09-30,102427,Principal Resurgent India Equity Fund-Dividend,13.78
2010-09-30,102428,Tata Value Fund Regular Plan - Payout of IDCW-Option B(10%),43.2443
2010-09-30,102431,Nippon India Pharma Fund-Growth Plan-Growth Option,53.9167
2010-09-30,102432,Nippon India Pharma Fund-Growth Plan-Bonus Option,53.9167
2010-09-30,102433,NIPPON INDIA PHARMA FUND - IDCW Option,40.2146
2010-09-30,102434,DSP India T.I.G.E.R. Fund - Regular Plan - Growth,52.551
2010-09-30,102435,DSP India T.I.G.E.R. Fund - Regular Plan - IDCW,20.172
2010-09-30,102441,Franklin India Liquid Fund - Institution-Growth,1473.0366
2010-09-30,102442,Franklin India Liquid Fund - Institutional Plan - Weekly - IDCW,1055.4384
2010-09-30,102443,Franklin India Liquid Fund - Institutional Plan - Daily - IDCW,1000.673
2010-09-30,102478,JM Mid Cap Fund-Dividend,19.3612
2010-09-30,102479,JM Mid Cap Fund-Growth,28.26
2010-09-30,102480,JM Large Cap Fund-Dividend,14.9212
2010-09-30,102481,JM Large Cap Fund-Growth,20.291
2010-09-30,102482,Sundaram India Leadership Fund-Growth,45.3468
2010-09-30,102483,Sundaram India Leadership Fund-Dividend,13.9068
2010-09-30,102503,SBI  SAVINGS FUND - REGULAR PLAN - GROWTH,14.5894
2010-09-30,102504,SBI Savings Fund - Regular Plan - Income Distribution cum Capital Withdrawal Option (IDCW),10.6015
2010-09-30,102505,SBI CREDIT RISK FUND - REGULAR PLAN - GROWTH,14.247
2010-09-30,102506,SBI Credit Risk Fund - Regular Plan - Income Distribution cum Capital Withdrawal Option (IDCW),10.8818
2010-09-30,102528,ICICI Prudential MidCap Fund - Growth,37.37
2010-09-30,102529,ICICI Prudential MidCap Fund - IDCW,18.61
2010-09-30,102530,ICICI Prudential MidCap Fund - Institutional Option - I,15.24
2010-09-30,102573,Kotak Multi Asset Omni FOF - Payout of Income Distribution cum capital withdrawal option,39.4
2010-09-30,102574,Kotak Multi Asset Omni FOF - Growth- Regular,40.477
2010-09-30,102594,ICICI Prudential Value Fund (erstwhile Value Discovery Fund) - Growth,51.07
2010-09-30,102595,ICICI Prudential Value Fund (erstwhile Value Discovery Fund) - IDCW,22.13
2010-09-30,102596,ICICI Prudential Value Discovery Fund - Institutional Option - I - Growth,22.69
2010-09-30,102672,Tata Liquid Fund -Regular Plan - Growth Option,14.8217
2010-09-30,102701,Sundaram Money Fund Institutional Plan - Daily Reinvestment of Income Distribution cum Capital Withdrawal (IDCW),10.0953
2010-09-30,102703,Sundaram Money Fund Institutional Plan - Growth,19.613
2010-09-30,102704,Sundaram Money Fund Institutional Plan - Monthly Income Distribution cum Capital Withdrawal (IDCW),10.3793
2010-09-30,102705,Sundaram Money Fund Institutional Plan - Quarterly Reinvestment of Income Distribution cum Capital Withdrawal (IDCW),10.8227
2010-09-30,102706,Sundaram Money Fund Institutional Plan - Weekly Reinvestment of Income Distribution cum Capital Withdrawal (IDCW),10.8285
2010-09-30,102716,ING Domestic Opportunities Fund-Growth Option,39.87
2010-09-30,102717,ING Domestic Opportunities Fund-Dividend Option,15.05
2010-09-30,102729,Principal Credit Risk Fund - Regular Plan - Growth Option,14.7758
2010-09-30,102732,Principal Credit Risk Fund - Regular Plan - Monthly Dividend Option,11.5585
2010-09-30,102751,Nippon India Consumption Fund-Growth Plan-Growth Option,31.7408
2010-09-30,102752,Nippon India Consumption Fund-Growth Plan-Bonus Option,31.7408
2010-09-30,102753,NIPPON INDIA CONSUMPTION FUND - IDCW Option,22.8229
2010-09-30,102756,SBI FOCUSED FUND - REGULAR PLAN -GROWTH,43.37
2010-09-30,102760,HDFC Focused Fund - GROWTH PLAN,43.33
2010-09-30,102761,HDFC Focused Fund - IDCW PLAN,24.634
2010-09-30,102765,SBI Focused Fund - Regular Plan - Income Distribution cum Capital Withdrawal Option (IDCW),19.24
2010-09-30,102805,Canara Robeco Nifty Index - Regular Plan - Growth,31.81
2010-09-30,102806,Canara Robeco Nifty Index - Regular Plan - Dividend,21.1
2010-09-30,102807,Principal Dividend Yield Fund-Growth Plan,25.27
2010-09-30,102808,Principal Dividend Yield Fund- Half Yearly Income Distribution CUM Capital Withdrawal Plan,18.65
2010-09-30,102813,LIC NOMURA MF Floater MIP - Monthly Dividend,10.0833
2010-09-30,102814,LIC NOMURA MF Floater MIP - Quarterly Dividend,10.215
2010-09-30,102815,LIC NOMURA MF Floater MIP - Yearly Dividend,10.7421
2010-09-30,102816,LIC NOMURA MF Floater MIP - Growth,18.0297
2010-09-30,102823,SBI HEALTHCARE OPPORTUNITIES FUND - REGULAR PLAN -GROWTH,41.73
2010-09-30,102832,HSBC Floating Rate Fund - Short Term - Regular - Growth,13.9486
2010-09-30,102833,HSBC Floating Rate Fund - Short Term - Regular - Dividend - Daily,10.0
2010-09-30,102834,HSBC Floating Rate Fund - Short Term - Regular - Dividend - Weekly,10.0242
2010-09-30,102835,HSBC Floating Rate Fund - Short Term - Inst. - Growth,14.1033
2010-09-30,102836,HSBC Floating Rate Fund - Short Term - Inst. - Dividend - Daily,10.3483
2010-09-30,102838,HSBC Floating Rate Fund - Short Term - Inst. - Dividend - Monthly,10.2935
2010-09-30,102839,HSBC Floating Rate Fund - Short Term - Inst. Plus - Growth,11.9851
2010-09-30,102846,Nippon India Balanced Advantage Fund-Growth Plan-Growth Option,42.5986
2010-09-30,102847,Nippon India Balanced Advantage Fund-Growth Plan-Bonus Option,42.5986
2010-09-30,102848,NIPPON INDIA BALANCED ADVANTAGE FUND - IDCW Option,25.344
2010-09-30,102858,Tata Dividend Yield Fund  Regular Plan -( Div),22.6146
2010-09-30,102859,Tata Dividend Yield Fund Regular Plan,34.9086
2010-09-30,102860,SBI Savings Fund - Regular Plan Weekly Income Distribution cum Capital Withdrawal Option (IDCW),10.7681
2010-09-30,102874,Kotak-Small Cap Fund - Payout of Income Distribution cum capital withdrawal option,19.771
2010-09-30,102875,Kotak-Small Cap Fund - Growth,28.423
2010-09-30,102883,Franklin India Large & Mid Cap Fund - Growth Plan,34.8384
2010-09-30,102884,Franklin India Large & Mid Cap Fund - IDCW,17.6433
2010-09-30,102885,SBI EQUITY HYBRID FUND - REGULAR PLAN -Growth,53.75
2010-09-30,102900,LIC NOMURA MF Opportunities Fund-Dividend,11.4522
2010-09-30,102901,LIC NOMURA MF Opportunities Fund-Growth,20.1202
2010-09-30,102913,CANARA ROBECO SAVINGS FUND - REGULAR PLAN - GROWTH OPTION,14.6073
2010-09-30,102914,CANARA ROBECO SAVINGS FUND - REGULAR PLAN - IDCW (Payout/Reinvestment),14.045
2010-09-30,102915,CANARA ROBECO SAVINGS FUND - REGULAR PLAN - WEEKLY IDCW (Payout/Reinvestment),10.2618
2010-09-30,102920,CANARA ROBECO LARGE AND MID CAP FUND - REGULAR PLAN - GROWTH OPTION,24.02
2010-09-30,102921,CANARA ROBECO LARGE AND MID CAP FUND - REGULAR PLAN - IDCW (Payout/Reinvestment),16.58
2010-09-30,102922,Canara Robeco Large and Mid Cap Fund -BONUS OPTION,20.11
2010-09-30,102929,Tata Service Industries Fund - Dividend,20.0361
2010-09-30,102930,Tata Service Industries Fund - Appreciation,26.8623
2010-09-30,102931,ING Midcap Fund-Growth Option,22.83
2010-09-30,102932,ING Midcap Fund-Dividend Option,18.14
2010-09-30,102941,SBI MIDCAP FUND - REGULAR PLAN - GROWTH,25.42
2010-09-30,102942,SBI Midcap Fund - Regular Plan - Income Distribution cum Capital Withdrawal Option (IDCW),19.49
2010-09-30,102947,HDFC Hybrid Equity Fund - IDCW Plan,17.765
2010-09-30,102948,HDFC Hybrid Equity Fund - Growth Plan,31.329
2010-09-30,102957,ICICI Prudential Multicap Fund - Institutional Option - I,33.82
2010-09-30,102961,Fidelity Equity Fund-Growth Option,37.639
2010-09-30,102962,Fidelity Equity Fund-Dividend Option,23.818
2010-09-30,103024,SBI LARGE & MIDCAP FUND- REGULAR PLAN -Growth,89.1
2010-09-30,103025,UTI Dividend Yield Fund - Regular Plan - IDCW,16.27
2010-09-30,103026,UTI-Dividend Yield Fund.-Growth,33.94
2010-09-30,103027,ICICI Prudential Blended Plan A - Growth,14.3003
2010-09-30,103028,ICICI Prudential Blended Plan A -  Dividend,10.7701
2010-09-30,103034,SBI MNC FUND - REGULAR PLAN -GROWTH,60.63
2010-09-30,103039,Kotak Contra Fund - Regular Plan - IDCW - Payout & Re-investment of Income Distribution cum capital withdrawal option,19.097
2010-09-30,103040,Kotak Contra Fund - Regular Plan - Growth,23.695
2010-09-30,103048,Nippon India Money Market Fund-Growth Plan-Growth Option,14.2264
2010-09-30,103050,NIPPON INDIA MONEY MARKET FUND - DAILY IDCW Option,10.0051
2010-09-30,103051,NIPPON INDIA MONEY MARKET FUND - WEEKLY IDCW Option,10.0136
2010-09-30,103071,Tata Mid Cap Fund Plan A- Growth,19.0021
2010-09-30,103072,Tata Mid Cap Fund Plan A- Dividend,16.3127
2010-09-30,103085,Nippon India Value Fund- Growth Plan,33.3263
2010-09-30,103086,NIPPON INDIA VALUE FUND - IDCW Option,25.9776
2010-09-30,103097,UTI Value Fund - Regular Plan - IDCW,15.07
2010-09-30,103098,UTI Value Fund - Regular Plan - Growth Option,28.22
2010-09-30,103108,JM Emerging Leaders Fund-Growth,9.5708
2010-09-30,103109,JM Emerging Leaders Fund-Dividend,9.5915
2010-09-30,103110,Aditya Birla Sun Life Consumption Fund -Regular - IDCW,15.81
2010-09-30,103111,Aditya Birla Sun Life Consumption Fund-Growth Option,26.06
2010-09-30,103114,SBI MNC Fund - Regular Plan - Income Distribution cum Capital Withdrawal Option (IDCW),33.89
2010-09-30,103119,Sahara Wealth Plus Fund-Fixed Pricing Option-Dividend Option,22.7321
2010-09-30,103120,Sahara Wealth Plus Fund-Fixed Pricing Option-Growth Option,22.7324
2010-09-30,103121,Sahara Wealth Plus Fund-Variable Pricing Option-Dividend Option,23.5625
2010-09-30,103122,Sahara Wealth Plus Fund-Variable Pricing Option-Growth Option,23.5626
2010-09-30,103140,SBI Overnight Fund - Regular Plan - Weekly Income Distribution cum Capital Withdrawal Option (IDCW),10.3212
2010-09-30,103145,SBI COMMA Fund - REGULAR PLAN - Growth,26.32
2010-09-30,103146,SBI Comma Fund - Regular Plan - Income Distribution cum Capital Withdrawal Option (IDCW),17.78
2010-09-30,103149,ICICI Prudential Infrastructure Fund - Growth,32.29
2010-09-30,103150,ICICI Prudential Infrastructure Fund - IDCW,13.0
2010-09-30,103151,Franklin India Opportunities Fund - Growth,33.8416
2010-09-30,103154,Aditya Birla Sun Life Equity Hybrid'95 Fund -Regular - IDCW,123.72
2010-09-30,103155,Aditya Birla Sun Life Equity Hybrid'95 Fund - Regular Plan-Growth,320.71
2010-09-30,103160,Tata Treasury Advantage Fund Regular Plan - Daily Reinvestment of IDCW Option,10.0356
2010-09-30,103161,ING Dividend Yield Fund-Growth Option,24.86
2010-09-30,103162,ING Dividend Yield Fund-Dividend Option,22.59
2010-09-30,103164,Aditya Birla Sun Life ELSS Tax Saver Fund-Regular - IDCW,93.83
2010-09-30,103165,Aditya Birla Sun Life Flexi Cap Fund -Regular - IDCW,82.05
2010-09-30,103166,Aditya Birla Sun Life Flexi Cap Fund - Growth - Regular Plan,291.8
2010-09-30,103167,Aditya Birla Sun Life Digital India Fund -Regular - IDCW,13.62
2010-09-30,103168,Aditya Birla Sun Life Digital India Fund - Growth - Regular Plan,20.86
2010-09-30,103169,Aditya Birla Sun Life Buy India Fund - Dividend - Regular Plan,26.59
