date,scheme_code,scheme_name,nav
2007-06-04,100027,Grindlays Super Saver Income Fund-GSSIF-Half Yearly Dividend,10.3175
2007-06-04,100028,Grindlays Super Saver Income Fund-GSSIF-Quaterly Dividend,10.3307
2007-06-04,100029,Grindlays Super Saver Income Fund-GSSIF-Growth,17.1081
2007-06-04,100030,Grindlays Super Saver Income Fund-GSSIF-Annual Dividend,10.3453
2007-06-04,100031,Grindlays Super Saver Income Fund-GSSIF - ST-Dividend,10.0772
2007-06-04,100032,Grindlays Super Saver Income Fund-GSSIF - ST-Growth,15.1247
2007-06-04,100033,Aditya Birla Sun Life Large & Mid Cap Fund - Regular Growth,131.45
2007-06-04,100034,Aditya Birla Sun Life Large & Mid Cap Fund -Regular - IDCW,94.3
2007-06-04,100035,Birla Sun Life Freedom Fund-Plan A (Dividend),19.65
2007-06-04,100036,Birla Sun Life Freedom Fund-Plan B (Growth),29.55
2007-06-04,100037,Aditya Birla Sun Life Income Fund - Regular - Quarterly IDCW,10.2065
2007-06-04,100038,Aditya Birla Sun Life Income Fund - Growth - Regular Plan,30.7739
2007-06-04,100041,Aditya Birla Sun Life Liquid Fund -Institutional - IDCW,10.8023
2007-06-04,100042,Aditya Birla Sun Life Liquid Fund-Retail (Growth),20.4559
2007-06-04,100043,Aditya Birla Sun Life Liquid Fund-Institutional (Growth),20.6044
2007-06-04,100044,Aditya Birla Sun Life Liquid Fund -Retail - IDCW,16.3694
2007-06-04,100046,Aditya Birla Sun Life Liquid Fund -Daily IDCW,10.0195
2007-06-04,100047,Aditya Birla Sun Life Liquid Fund - Growth,12.1103
2007-06-04,100048,Aditya Birla Sun Life Liquid Fund -Institutional - weekly  IDCW,10.8121
2007-06-04,100049,Aditya Birla Sun Life Cash Plus-Institutional - Fortnightly Dividend,10.842
2007-06-04,100051,Aditya Birla Sun Life Liquid Fund -weekly IDCW,10.0276
2007-06-04,100052,Aditya Birla Sun Life Cash Plus-Institutional Premium - Fortnightly Dividend,10.0787
2007-06-04,100053,Aditya Birla Sun Life Cash Plus-Institutional Premium Plan-Monthly Dividend,10.0068
2007-06-04,100054,Aditya Birla Sun Life Gilt Plus - Liquid Plan - Quarterly Dividend - Regular Plan,10.7401
2007-06-04,100055,Aditya Birla Sun Life Gilt Plus - Liquid Plan - Growth - Regular Plan,18.4026
2007-06-04,100056,Aditya Birla Sun Life Gilt Plus - Liquid Plan - Annual Dividend - Regular Plan,11.3951
2007-06-04,100057,Aditya Birla Sun Life Govenment Securities Fund -Regular - Quarterly IDCW,10.5304
2007-06-04,100058,Aditya Birla Sun Life Government Securities Fund  - Growth - Regular Plan,20.8667
2007-06-04,100059,Aditya Birla Sun Life Gilt Plus-PF Plan (Annual Dividend),19.3789
2007-06-04,100060,Aditya Birla Sun Life Constant Maturity 10 Year Gilt Fund - Quarterly Dividend - Regular Plan,11.164
2007-06-04,100061,Aditya Birla Sun Life Constant Maturity 10 Year Gilt Fund - Growth - Regular Plan,23.6742
2007-06-04,100062,Aditya Birla Sun Life Gilt Plus-Regular Plan (Annual Dividend),22.0646
2007-06-04,100063,Aditya Birla Sun Life MNC Fund - Regular - IDCW,63.89
2007-06-04,100064,Aditya Birla Sun Life MNC Fund - Growth - Regular Plan,127.47
2007-06-04,100065,Aditya Birla Sun Life India Opportunities Fund - Dividend - Regular Plan,22.74
2007-06-04,100066,Aditya Birla Sun Life India Opportunities Fund - Growth - Regular Plan,52.95
2007-06-04,100067,Aditya Birla Sun Life Tax Plan -Regular - IDCW,63.58
2007-06-04,100068,BARODA ELSS 96 - Plan A - IDCW,21.49
2007-06-04,100069,BARODA PIONEER DIVERSIFIED FUND,34.66
2007-06-04,100077,DSP Bond Fund - IDCW,10.7129
2007-06-04,100078,DSP Bond Fund - Growth,25.2121
2007-06-04,100079,DSP Bond Fund - IDCW - Monthly,10.4542
2007-06-04,100080,DSP Flexi Cap Fund - Regular Plan - IDCW,44.388
2007-06-04,100081,DSP Aggressive Hybrid Fund- Regular Plan - Growth,42.657
2007-06-04,100082,DSP Aggressive Hybrid Fund- Regular Plan - IDCW,24.748
2007-06-04,100084,DSP Gilt Fund - Regular Plan - Growth,23.2613
2007-06-04,100085,DSP Gilt Fund - Regular Plan - IDCW,11.5429
2007-06-04,100086,DSP Gilt Fund - Regular Plan - IDCW - Monthly,10.1664
2007-06-04,100087,DSP Savings Fund - Regular Plan - Growth,17.1349
2007-06-04,100088,DSP Savings Fund - Regular Plan - IDCW,11.1014
2007-06-04,100089,DSP Savings Fund - Regular Plan - IDCW - Monthly,10.1128
2007-06-04,100090,DSP BlackRock Technology.com   Fund - Regular Plan - Growth,29.083
2007-06-04,100119,HDFC Balanced Advantage Fund - Growth Plan,53.054
2007-06-04,100120,HDFC Balanced Advantage Fund - IDCW Plan,28.802
2007-06-04,100121,HDFC Balanced Fund - Dividend Option,18.053
2007-06-04,100122,HDFC Balanced Fund - Growth Option,31.951
2007-06-04,100123,HDFC Income Fund - Quarterly IDCW Option,10.2164
2007-06-04,100124,HDFC Income Fund - Growth Option,16.7119
2007-06-04,100150,Principal Child Benefit Fund-Super Saver-Future Guard Plan,61.08
2007-06-04,100151,Principal Retail Equity Savings Fund - Growth Option,61.9
2007-06-04,100152,Principal Nifty 100 Equal Weight Fund-Income Distribution CUM Capital Withdrawal,23.6055
2007-06-04,100153,Principal Nifty 100 Equal Weight Fund-Growth,30.3986
2007-06-04,100156,Principal Tax Savings Fund,86.15
2007-06-04,100171,Quant Dynamic Bond-Dividend,10.1139
2007-06-04,100172,Quant Dynamic Bond-Growth,22.9177
2007-06-04,100173,Quant Dynamic Bond-Bonus,12.0707
2007-06-04,100174,quant ELSS Tax Saver Fund - IDCW Option - Regular Plan,13.9597
2007-06-04,100175,quant ELSS Tax Saver Fund - Growth Option - Regular Plan,48.0153
2007-06-04,100176,quant Small Cap Fund - IDCW Option - Regular Plan,17.2454
2007-06-04,100177,quant Small Cap Fund - Growth - Regular Plan,20.4298
2007-06-04,100178,ING Income Fund-Regular Plan -Dividend Option (Quarterly),10.2312
2007-06-04,100179,ING Income Fund-Regular Plan -Dividend Option (Half Yearly),10.2997
2007-06-04,100180,ING Income Fund- Regular Plan - Dividend Option (Annual),10.443
2007-06-04,100181,ING Income Fund-Regular Plan -Growth Option,18.3533
2007-06-04,100182,ING Income Fund-Institutional Plan - Dividend Option (Half Yearly),10.0
2007-06-04,100183,ING Income Fund-Institutional Plan - Dividend Option (Quarterly),10.0
2007-06-04,100184,ING Income Fund-Institutional Plan -Dividend Option (Annual),10.4065
2007-06-04,100185,ING Income Fund-Bonus Option,11.1905
2007-06-04,100186,ING Income Fund-Institutional Bonus Option,11.4722
2007-06-04,100187,ING Income Fund-Institutional Plan - Growth Option,19.1642
2007-06-04,100188,ING Core Equity Fund-Dividend Option,15.26
2007-06-04,100189,ING Core Equity Fund-Growth Option,28.87
2007-06-04,100190,ING Liquid Fund-Regular Growth Option,16.0985
2007-06-04,100191,ING Liquid Fund-Regular Weekly Dividend Option,10.8367
2007-06-04,100192,ING Liquid Fund-Regular Daily Dividend Option,10.7873
2007-06-04,100194,ING Liquid Fund-Auto Sweep Growth Option,10.0
2007-06-04,100195,ING Liquid Fund-Auto Sweep Weekly Dividend Option,10.0
2007-06-04,100196,ING Liquid Fund-Institutional Growth Option,11.9525
2007-06-04,100197,ING Liquid Fund-Institutional Weekly Dividend Option,10.066
2007-06-04,100198,ING Liquid Fund-Institutional Daily Dividend Option,10.0121
2007-06-04,100199,ING Liquid Fund-Super Institutional Growth Option,11.3179
2007-06-04,100200,ING Liquid Fund-Super Institutional Daily Dividend Option,10.0048
2007-06-04,100201,ING Liquid Fund-Super Institutional Weekly Dividend Option,10.0081
2007-06-04,100202,ING Balanced Fund-Dividend Option,13.47
2007-06-04,100203,ING Balanced Fund-Growth Option,19.25
2007-06-04,100218,JM Large Cap Fund (Regular) - IDCW,17.4874
2007-06-04,100219,JM Large Cap Fund (Regular) - Growth Option,38.9166
2007-06-04,100220,JM Aggressive Hybrid Fund (Regular) - IDCW,18.7697
2007-06-04,100221,JM Aggressive Hybrid Fund (Regular) -Growth Option,24.7012
2007-06-04,100222,JM Medium to Long Duration Fund (Regular) - Quarterly IDCW,10.2636
2007-06-04,100223,JM Medium to Long Duration Fund (Regular) - Growth Option,29.0104
2007-06-04,100233,JM Liquid Fund (Regular) - Weekly IDCW,10.4325
2007-06-04,100234,JM Liquid Fund - Growth Option,20.8889
2007-06-04,100237,JM High Liquidity Fund-- Institutional Plan - Growth,12.6024
2007-06-04,100238,JM High Liquidity Fund-Institutional Plan - Daily Dividend,10.0159
2007-06-04,100241,JM High Liquidity Fund-- Institutional Plan - Dividend,10.1963
2007-06-04,100243,JM High Liquidity Fund-- Premium Plan - Daily Dividend Option,10.0
2007-06-04,100244,JM Liquid Fund (Regular) - Quarterly IDCW,12.0262
2007-06-04,100245,JM High Liquidity Fund-Super Institutional Plan- Daily Dividend,10.0165
2007-06-04,100246,JM High Liquidity Fund-Super Institutional Plan- Weekly  Dividend,10.0
2007-06-04,100247,JM Liquid Fund (Regular) - Super Institutional Plan - Growth Option,11.9835
2007-06-04,100249,JM G-Sec Fund - Quarterly Dividend Option,10.2104
2007-06-04,100250,JM G-Sec Fund - Growth Option,21.3594
2007-06-04,100251,JM G-Sec Fund-PF Plan - Growth Plan,22.0888
2007-06-04,100252,JM G-Sec Fund-PF Plan -Dividend Plan,20.24
2007-06-04,100253,JM G-Sec Fund - Bonus Option - Principal Units,10.3901
2007-06-04,100254,JM Value Fund (Regular) - Growth Option,22.8366
2007-06-04,100261,Kotak Gilt-Savings-Monthly Dividend,10.4624
2007-06-04,100262,Kotak Gilt-Savings-Growth,18.3617
2007-06-04,100263,Kotak Gilt-Savings-Annual Dividend,12.279
2007-06-04,100264,Kotak Gilt-Investment Regular-Payout of Income Distribution cum capital withdrawal option,11.416
2007-06-04,100265,Kotak Gilt-Investment Regular-Growth,23.733
2007-06-04,100280,Kotak Gilt-Investment  Provident Fund and Trust-Payout of Income Distribution cum capital withdrawal option,10.8628
2007-06-04,100281,Kotak Gilt-Investment  Provident Fund and Trust-Growth,24.0635
2007-06-04,100286,Kotak Aggressive Hybrid Fund - Regular Plan - IDCW - Payout & Reinvestment of Income Distribution cum capital withdrawal option,24.864
2007-06-04,100289,Kotak Tech,10.428
2007-06-04,100290,Kotak MNC,29.819
2007-06-04,100291,Kotak Bond-Deposit-Dividend,11.8507
2007-06-04,100292,Kotak Bond-Deposit-Growth,18.7508
2007-06-04,100298,Kotak Bond Regular Plan Quaterly Payout of Income Distribution cum capital withdrawal option,10.4466
2007-06-04,100299,Kotak Bond Fund - Regular Plan Growth,19.7898
2007-06-04,100300,Kotak Bond Fund - Regular Plan - Standard IDCW Option,13.2258
2007-06-04,100301,Kotak Bond Regular Plan Bonus Plan,13.1909
2007-06-04,100312,LIC MF Flexi Cap Fund-Regular Plan-IDCW,11.6429
2007-06-04,100313,LIC MF Flexi Cap Fund-Regular Plan-Growth,21.0448
2007-06-04,100314,LIC MF Medium to Long Duration Fund-Regular Plan-IDCW,10.2985
2007-06-04,100315,LIC MF Medium to Long Duration Fund-Regular Plan-Growth,20.3545
2007-06-04,100316,LIC MF Gilt Fund-Regular Plan-IDCW,11.1592
2007-06-04,100317,LIC MF Gilt Fund-Regular Plan-Growth,19.2006
2007-06-04,100318,LIC MF Gilt Fund-PF Plan-IDCW,11.0718
2007-06-04,100319,LIC MF Gilt Fund-PF Plan-Growth,11.0718
2007-06-04,100321,LIC MF Aggressive Hybrid Fund-Regular Plan-IDCW,10.4442
2007-06-04,100323,LIC MF Aggressive Hybrid Fund-Regular Plan-Growth,44.1233
2007-06-04,100325,LIC MF ULIS (5 Yrs. Single Premium)-Regular Plan-IDCW Reinvestment,11.2576
2007-06-04,100332,LIC MF Large Cap Fund-Regular Plan-IDCW,10.8092
2007-06-04,100337,SaharaTax Gain-Dividend,19.221
2007-06-04,100338,SaharaTax Gain-Growth,22.0308
2007-06-04,100347,Morgan Stanley Growth Fund- Regular Growth Plan,53.0
2007-06-04,100348,ICICI Prudential Large & Mid Cap Fund - IDCW,24.24
2007-06-04,100349,ICICI Prudential Large & Mid Cap Fund - Growth,98.99
2007-06-04,100350,ICICI Prudential Large & Mid Cap Fund - Institutional Option - I - Growth,13.19
2007-06-04,100351,ICICI Prudential FMCG Fund - IDCW,33.47
2007-06-04,100352,ICICI Prudential FMCG Fund - Growth,42.06
2007-06-04,100353,ICICI Prudential ELSS Tax Saver Fund - IDCW,22.16
2007-06-04,100354,ICICI Prudential ELSS Tax Saver Fund - Growth,92.28
2007-06-04,100355,ICICI Prudential Equity & Debt Fund - Monthly IDCW,17.77
2007-06-04,100356,ICICI Prudential Equity & Debt Fund - Growth,36.23
2007-06-04,100357,ICICI Prudential Liquid Fund -Quarterly IDCW,10.8533
2007-06-04,100359,ICICI Prudential Liquid Institutional Plus Fund - Div - Daily,11.8515
2007-06-04,100360,ICICI Prudential Liquid Institutional Plus Fund - Div - Weekly,11.8685
2007-06-04,100361,ICICI Prudential Liquid Fund-Dividend-Institutional Plus - Monthly,11.9243
2007-06-04,100362,ICICI Prudential Liquid Institutional Plus Fund - Growth,18.9227
2007-06-04,100363,ICICI Prudential Technology Fund - Growth,16.55
2007-06-04,100364,ICICI Prudential Long Term Bond Fund - Half Yearly IDCW,10.3451
2007-06-04,100365,ICICI Prudential Long Term Bond Fund - Growth,21.559
2007-06-04,100366,ICICI Prudential Long Term Bond Fund-Institutional Quarterly Dividend,10.1735
2007-06-04,100367,ICICI Prudential Long Term Bond Fund - Quarterly IDCW,10.9737
2007-06-04,100368,ICICI Prudential Gilt Fund - IDCW,10.6254
2007-06-04,100369,ICICI Prudential Gilt Fund - Growth,22.673
2007-06-04,100370,ICICI Prudential Short Term Gilt Fund - Dividend,10.4791
2007-06-04,100371,ICICI Prudential Short Term Gilt Fund - Growth,18.2392
2007-06-04,100372,ICICI Prudential Short Term Gilt Fund - Half Yearly Dividend,10.1151
2007-06-04,100375,NIPPON INDIA GROWTH MID CAP FUND - IDCW Option,54.78
2007-06-04,100376,Nippon India Growth Mid Cap Fund-Growth Plan-Bonus Option,49.25
2007-06-04,100377,Nippon India Growth Mid Cap Fund-Growth Plan-Growth Option,297.06
2007-06-04,100378,Nippon India Vision Large & Midcap Fund - IDCW Option,50.85
2007-06-04,100379,Nippon India Vision Large & Midcap Fund-GROWTH PLAN-Bonus Option,33.38
2007-06-04,100380,Nippon India Vision Large & Midcap Fund-GROWTH PLAN-Growth Option,199.2
2007-06-04,100383,NIPPON INDIA MEDIUM TO LONG DURATION FUND - MONTHLY IDCW Option,10.9254
2007-06-04,100384,NIPPON INDIA MEDIUM TO LONG DURATION  FUND - QUARTERLY IDCW Option,12.0136
2007-06-04,100385,NIPPON INDIA MEDIUM TO LONG DURATION  FUND - HALF YEARLY IDCW Option,11.2669
2007-06-04,100386,NIPPON INDIA MEDIUM TO LONG DURATION  FUND - ANNUAL IDCW Option,12.2156
2007-06-04,100387,Nippon India Medium to Long Duration  Fund - Growth Plan Growth Option,23.4252
2007-06-04,100388,Nippon India Medium to Long Duration  Fund - Growth Plan Bonus Option,11.0413
2007-06-04,100414,Tata Aggressive Hybrid Fund- Regular Plan - Growth Option,54.2031
2007-06-04,100415,Tata Ethical Fund-Regular Plan - Growth Option,50.0609
2007-06-04,100416,Tata Long Term Debt Fund - Regular Plan - Quarterly Dividend,10.4307
2007-06-04,100417,Tata Income Fund-Regular Plan - Half Yearly Payout of IDCW Option,10.9049
2007-06-04,100418,Tata Income Fund -Regular Plan - Growth Option,25.3467
2007-06-04,100470,Franklin India Large Cap Fund - IDCW,39.9916
2007-06-04,100471,Franklin India Large Cap Fund-Growth,138.7499
2007-06-04,100472,Franklin India Mid Cap Fund - IDCW,60.2612
2007-06-04,100473,Franklin India Mid Cap Fund-Growth,216.419
2007-06-04,100474,Tata ELSS Fund- Regular Plan - Payout of IDCW Option,45.2471
2007-06-04,100475,Tata Large Cap Fund -Regular Plan - Growth Option,66.2706
2007-06-04,100476,Taurus Flexi Cap Fund - Regular Plan - Growth,44.74
2007-06-04,100477,Taurus Mid Cap Fund - Regular Plan - Growth,17.01
2007-06-04,100480,Taurus ELSS Tax Saver Fund - Regular Plan - Growth,19.0
2007-06-04,100481,Franklin India Balanced Fund-Growth,37.9966
2007-06-04,100482,Franklin India Balanced Fund-Div,32.8407
2007-06-04,100483,Franklin India Growth Fund,32.5029
2007-06-04,100484,Franklin India Index Fund- NSE Nifty 50 Index Fund - Growth,33.9662
2007-06-04,100485,Franklin India Govt.Sec. Fund-Composite Plan - Growth,24.4341
2007-06-04,100486,Franklin India Govt.Sec. Fund-Composite Plan - Dividend,10.7283
2007-06-04,100487,Franklin India Govt.Sec. Fund-Treasury Plan(Dividend Option),10.6533
2007-06-04,100489,Franklin India Govt.Sec. Fund-Treasury Plan(Growth Option),14.1117
2007-06-04,100490,Franklin India Govt.Sec. Fund-PF Plan - Growth,10.7323
2007-06-04,100491,Franklin India Govt.Sec. Fund-PF Plan - Dividend,10.7323
2007-06-04,100493,Franklin India Government Securities Fund - Growth,16.6796
2007-06-04,100494,Franklin India Government Securities Fund - IDCW,10.6404
2007-06-04,100495,Franklin India Govt.Sec. Fund-Long Term Plan - Bonus,11.7273
2007-06-04,100496,Templeton India Value Fund - Growth Plan,72.694
2007-06-04,100497,Templeton India Value Fund - IDCW,42.9803
2007-06-04,100498,Franklin India Dynamic Accrual Fund - IDCW,10.475
2007-06-04,100499,Franklin India Dynamic Accrual Fund-Growth,25.9926
2007-06-04,100503,Franklin India Low Duration Fund - Monthly - IDCW,10.3004
2007-06-04,100504,Franklin India Low Duration Fund - Quarterly - IDCW,10.3206
2007-06-04,100505,Templeton Monthly Income Plan-Half Yearly Dividend,12.3736
2007-06-04,100506,Templeton Monthly Income Plan-Growth,20.3658
2007-06-04,100519,Franklin India Flexi Cap Fund - IDCW,33.9056
2007-06-04,100520,Franklin India Flexi Cap Fund - Growth,151.2393
2007-06-04,100521,Franklin India Technology Fund - IDCW,23.7345
2007-06-04,100522,Franklin India Technology Fund-Growth,51.0109
2007-06-04,100523,Franklin FMCG Fund - Growth,35.5273
2007-06-04,100524,Franklin INDIA OPPORTUNITIES FUND - IDCW,16.5338
2007-06-04,100525,Franklin India ELSS Tax Saver Fund - IDCW,34.2166
2007-06-04,100526,Franklin India ELSS Tax Saver Fund-Growth,135.1163
2007-06-04,100527,Franklin India Corporate Debt Fund - Plan A - Annual - IDCW,10.3494
2007-06-04,100528,Franklin India Corporate Debt Fund - Growth,24.9854
2007-06-04,100529,Franklin India Corporate Debt Fund - Plan B - Monthly - IDCW,13.1154
2007-06-04,100530,Franklin India Corporate Debt Fund - Plan B - Quarterly - IDCW,13.4778
2007-06-04,100531,Franklin India Corporate Debt Fund - Plan B - Half yearly - IDCW,13.3247
2007-06-04,100532,Franklin India Corporate Debt Fund - Monthly Bonus,18.5473
2007-06-04,100535,Franklin India Retirement Fund - IDCW,17.2871
2007-06-04,100536,Franklin India Retirement Fund - Growth,44.9771
2007-06-04,100537,Franklin India Liquid Fund - Regular Plan - Weekly - IDCW,1244.4965
2007-06-04,100538,Franklin India Liquid Fund - Regular Plan - Growth,1890.6387
2007-06-04,100541,Franklin India Liquid Fund - Regular Plan - Daily - IDCW,1512.34
2007-06-04,100542,Franklin India Liquid Fund - Liquid Plan - Weekly Dividend,1000.7067
2007-06-04,100543,Franklin India Liquid Fund - Liquid Plan - Daily IDCW,1000.25
2007-06-04,100544,Franklin India Liquid Fund - Liquid Plan - Growth,1162.3022
2007-06-04,100546,Franklin India Liquid Fund - Super Institutional Plan - Growth,1125.6153
2007-06-04,100547,Franklin India Liquid Fund - Super Institutional Plan - Daily - IDCW,1000.25
2007-06-04,100548,Franklin India Liquid Fund - Super Institutional Plan - Weekly - IDCW,1016.2944
2007-06-04,100549,Franklin India Aggressive Hybrid Fund - IDCW,22.0089
2007-06-04,100550,Franklin India Aggressive Hybrid Fund - Growth Plan,35.1832
2007-06-04,100551,Templeton India Children’s Asset Plan-Education Plan,26.2092
2007-06-04,100552,Templeton India Children’s Asset Plan-Gift Plan - Growth,32.7053
2007-06-04,100553,Templeton India Children’s Asset Plan-Gift Plan - Dividend,32.7053
2007-06-04,100557,Franklin India Taxshield 98,130.7096
2007-06-04,100558,Franklin India Taxshield 99,73.0711
2007-06-04,100561,Templeton India Money Market Account - Bonus Plan,1.0
2007-06-04,100563,DBS Chola Triple Ace-Regular -Cumulative,23.9331
2007-06-04,100567,DBS Chola Triple Ace-Regular - Quarterly Dividend,11.2687
2007-06-04,100569,DBS Chola Triple Ace-Semi Annual Dividend,11.5812
2007-06-04,100573,DBS Chola Triple Ace-Regular Bonus,13.2981
2007-06-04,100574,DBS Chola Freedom Income -Short Term Fund-Regular-Monthly Dividend,11.066
2007-06-04,100575,DBS Chola Freedom Income -Short Term Fund-Regular - Cumulative,12.0119
2007-06-04,100576,DBS Chola Freedom Income -Short Term Fund-Cum- Institutional Plan,12.1489
2007-06-04,100579,DBS Chola Gilt-Investment-Quarterly Dividend,10.3391
2007-06-04,100580,DBS Chola Gilt-Investment-Cumulative,18.7978
2007-06-04,100589,Canara Robeco Expo-Income Plan,15.66
2007-06-04,100590,Canara Robeco Expo-Growth Plan,54.22
2007-06-04,100593,CANARA ROBECO ELSS TAX SAVER - REGULAR PLAN -IDCW (Payout),16.96
2007-06-04,100596,CANARA ROBECO GILT FUND - REGULAR PLAN - IDCW (Payout/Reinvestment),10.675
2007-06-04,100597,CANARA ROBECO GILT FUND - REGULAR PLAN - GROWTH OPTION,18.7042
2007-06-04,100600,CANARA ROBECO CONSERVATIVE HYBRID FUND - REGULAR PLAN - MONTHLY IDCW (Payout/Reinvestment),11.36
2007-06-04,100601,CANARA ROBECO CONSERVATIVE HYBRID FUND - REGULAR PLAN - GROWTH OPTION,19.93
2007-06-04,100602,Sundaram Medium Duration Fund (Formerly Known as Sundaram Medium Term Bond Fund) Regular Plan-Income Distribution cum Capital Withdrawal(IDCW),10.3386
2007-06-04,100603,Sundaram Medium Duration Fund (Formerly Known as Sundaram Medium Term Bond Fund) Regular Plan - Growth,23.0455
2007-06-04,100604,Sundaram Medium Duration Fund (Formerly Known as Sundaram Medium Term Bond Fund) Regular Plan -Growth,12.1317
2007-06-04,100609,Sundaram Medium Duration Fund (Formerly Known as Sundaram Medium Term Bond Fund) Regular Plan- Income Distribution cum Capital Withdrawal(IDCW),10.5882
2007-06-04,100610,Sundaram Medium Duration Fund (Formerly Known as Sundaram Medium Term Bond Fund) Regular Plan -Income Distribution cum Capital Withdrawal (IDCW),10.5899
2007-06-04,100611,Sundaram Medium Duration Fund (Formerly Known as Sundaram Medium Term Bond Fund) Institutional Plan -Growth,11.8184
2007-06-04,100612,Sundaram Growth Fund-Dividend,15.4623
2007-06-04,100613,Sundaram Growth Fund-Growth,70.681
2007-06-04,100614,Sundaram Value Fund Regular Plan - Income Distribution cum Capital Withdrawal (IDCW),13.5894
2007-06-04,100617,Sundaram Equity Hybrid Fund Regular Plan - Growth,34.5614
2007-06-04,100618,Sundaram Money Fund Retail Plan - Growth,15.9477
2007-06-04,100619,Sundaram Money Fund Retail Plan - Quarterly Reinvestment of Income Distribution cum Capital Withdrawal (IDCW),10.4005
2007-06-04,100620,Sundaram Money Fund Retail Plan - Daily Reinvestment of Income Distribution cum Capital Withdrawal (IDCW),10.0953
2007-06-04,100621,Sundaram Money Fund Retail Plan - Weekly Reinvestment of Income Distribution cum Capital Withdrawal (IDCW),10.3886
2007-06-04,100622,Sundaram Money Fund Retail Plan - Fortnightly Reinvestment of Income Distribution cum Capital Withdrawal (IDCW),10.2485
2007-06-04,100623,Sundaram Money Fund Retail Plan - Monthly Income Distribution cum Capital Withdrawal (IDCW),10.1467
2007-06-04,100630,quant Multi Cap Fund-IDCW Option - Regular Plan,13.8857
2007-06-04,100631,quant Multi Cap Fund-GROWTH OPTION - Regular Plan,59.1233
2007-06-04,100638,SBI Medium to Long Duration Fund - Regular Plan - Half Yearly - Income Distribution cum Capital Withdrawal Option (IDCW),10.135
2007-06-04,100639,SBI Medium to Long Duration Fund-REGULAR PLAN-Growth,19.9119
2007-06-04,100640,SBI Medium to Long Duration Fund-REGULAR PLAN-Bonus,12.0613
2007-06-04,100641,SBI ULTRA SHORT DURATION FUND - REGULAR PLAN - GROWTH,17.0725
2007-06-04,100643,SBI Technology Opportunities Fund - Regular Plan - Income Distribution cum Capital Withdrawal Option (IDCW),29.2
2007-06-04,100644,SBI Healthcare Opportunities Fund - Regular Plan - Income Distribution cum Capital Withdrawal Option (IDCW),29.77
2007-06-04,100645,SBI Consumption Opportunities Fund - Regular Plan - Income Distribution cum Capital Withdrawal Option (IDCW),14.12
2007-06-04,100646,UTI - Unit Linked Insurance Plan,14.7913
2007-06-04,100648,UTI - CRTS 81 - Dividend Option,107.3896
2007-06-04,100650,UTI Large Cap Fund - Regular Plan - IDCW,30.09
2007-06-04,100651,UTI Large Cap Fund - Regular Plan - Growth Option,37.36
2007-06-04,100656,UTI - Master Plus Unit Scheme-Growth Option,69.3
2007-06-04,100657,UTI - Master Plus Unit Scheme-Income Option,53.18
2007-06-04,100663,UTI Large & Mid Cap Fund - Regular Plan - IDCW,40.35
2007-06-04,100664,UTI Large & Mid Cap Fund - Regular Plan - Growth Option,46.7
2007-06-04,100668,UTI Flexi Cap Fund - Regular Plan - IDCW,32.2
2007-06-04,100669,UTI - Flexi Cap Fund-Growth Option,34.8
2007-06-04,100678,UTI Children's Hybrid Fund - Regular Plan,13.8926
2007-06-04,100682,UTI Retirement Fund - Regular Plan,18.5066
2007-06-04,100684,UTI Aggressive Hybrid Fund - Regular Plan - Growth,57.39
2007-06-04,100685,UTI Aggressive Hybrid Fund - Regular Plan - IDCW,20.41
2007-06-04,100711,UTI - INDEX SELECT FUND-Income Option,24.34
2007-06-04,100712,UTI - INDEX SELECT FUND-Growth Option,36.07
2007-06-04,100715,DBS Chola Multi-Cap Fund-Dividend Option,14.89
2007-06-04,100716,DBS Chola Multi-Cap Fund-Cumulative Option,18.68
2007-06-04,100723,UTI MMF-Discontinued - Regular Plan -Growth,21.38
2007-06-04,100724,UTI MMF- Discontinued - Regular Plan - Flexi Dividend Option,17.7694
2007-06-04,100725,UTI MMF- Discontinued - Regular Plan - Periodic Dividend Option,17.6598
2007-06-04,100739,UTI MNC Fund - Regular Plan - IDCW,28.01
2007-06-04,100740,UTI - MNC Fund - Regular Plan - Growth Option,37.38
2007-06-04,100741,UTI Medium to Long Duration Fund- Regular Plan - Growth,21.8677
2007-06-04,100742,UTI Medium to Long Duration Fund - Regular Plan - Quarterly IDCW,10.9558
2007-06-04,100748,UTI - Master Index Fund-Income Option,45.4613
2007-06-04,100749,UTI - Master Index Fund-Growth Option,45.4613
2007-06-04,100750,UTI - Master Value Fund-Income Option,20.32
2007-06-04,100751,UTI - Master Value Fund-Growth Option,31.19
2007-06-04,100780,Sundaram Banking & PSU Fund (Formerly Known as Sundaram Banking and PSU Debt Fund) Retail Plan - Monthly Income Distribution cum Capital Withdrawal (IDCW),10.1944
2007-06-04,100781,Sundaram Banking & PSU Fund (Formerly Known as Sundaram Banking and PSU Debt Fund) Retail Plan - Growth,11.5115
2007-06-04,100782,Sundaram Banking & PSU Fund (Formerly Known as Sundaram Banking and PSU Debt Fund) Regular Plan - Daily Reinvestment of Income Distribution cum Capital Withdrawal (IDCW),10.0519
2007-06-04,100784,Sundaram Banking & PSU Fund (Formerly Known as Sundaram Banking and PSU Debt Fund) Regular Plan - Growth,11.6587
2007-06-04,100785,Sundaram Corporate Bond Fund Regular Plan -Income Distribution cum Capital Withdrawal(IDCW),10.245
