date,scheme_code,scheme_name,nav
2007-06-15,100027,Grindlays Super Saver Income Fund-GSSIF-Half Yearly Dividend,10.3376
2007-06-15,100028,Grindlays Super Saver Income Fund-GSSIF-Quaterly Dividend,10.3508
2007-06-15,100029,Grindlays Super Saver Income Fund-GSSIF-Growth,17.1413
2007-06-15,100030,Grindlays Super Saver Income Fund-GSSIF-Annual Dividend,10.3653
2007-06-15,100031,Grindlays Super Saver Income Fund-GSSIF - ST-Dividend,10.0951
2007-06-15,100032,Grindlays Super Saver Income Fund-GSSIF - ST-Growth,15.1514
2007-06-15,100033,Aditya Birla Sun Life Large & Mid Cap Fund - Regular Growth,130.89
2007-06-15,100034,Aditya Birla Sun Life Large & Mid Cap Fund -Regular - IDCW,93.91
2007-06-15,100035,Birla Sun Life Freedom Fund-Plan A (Dividend),19.23
2007-06-15,100036,Birla Sun Life Freedom Fund-Plan B (Growth),28.93
2007-06-15,100037,Aditya Birla Sun Life Income Fund - Regular - Quarterly IDCW,10.2218
2007-06-15,100038,Aditya Birla Sun Life Income Fund - Growth - Regular Plan,30.8202
2007-06-15,100041,Aditya Birla Sun Life Liquid Fund -Institutional - IDCW,10.8023
2007-06-15,100042,Aditya Birla Sun Life Liquid Fund-Retail (Growth),20.4912
2007-06-15,100043,Aditya Birla Sun Life Liquid Fund-Institutional (Growth),20.6406
2007-06-15,100044,Aditya Birla Sun Life Liquid Fund -Retail - IDCW,16.3694
2007-06-15,100046,Aditya Birla Sun Life Liquid Fund -Daily IDCW,10.0195
2007-06-15,100047,Aditya Birla Sun Life Liquid Fund - Growth,12.1325
2007-06-15,100048,Aditya Birla Sun Life Liquid Fund -Institutional - weekly  IDCW,10.8068
2007-06-15,100049,Aditya Birla Sun Life Cash Plus-Institutional - Fortnightly Dividend,10.8334
2007-06-15,100051,Aditya Birla Sun Life Liquid Fund -weekly IDCW,10.0225
2007-06-15,100052,Aditya Birla Sun Life Cash Plus-Institutional Premium - Fortnightly Dividend,10.0705
2007-06-15,100053,Aditya Birla Sun Life Cash Plus-Institutional Premium Plan-Monthly Dividend,10.0252
2007-06-15,100054,Aditya Birla Sun Life Gilt Plus - Liquid Plan - Quarterly Dividend - Regular Plan,10.7493
2007-06-15,100055,Aditya Birla Sun Life Gilt Plus - Liquid Plan - Growth - Regular Plan,18.4183
2007-06-15,100056,Aditya Birla Sun Life Gilt Plus - Liquid Plan - Annual Dividend - Regular Plan,11.4048
2007-06-15,100057,Aditya Birla Sun Life Govenment Securities Fund -Regular - Quarterly IDCW,10.4974
2007-06-15,100058,Aditya Birla Sun Life Government Securities Fund  - Growth - Regular Plan,20.8012
2007-06-15,100059,Aditya Birla Sun Life Gilt Plus-PF Plan (Annual Dividend),19.3181
2007-06-15,100060,Aditya Birla Sun Life Constant Maturity 10 Year Gilt Fund - Quarterly Dividend - Regular Plan,11.1349
2007-06-15,100061,Aditya Birla Sun Life Constant Maturity 10 Year Gilt Fund - Growth - Regular Plan,23.6125
2007-06-15,100062,Aditya Birla Sun Life Gilt Plus-Regular Plan (Annual Dividend),22.0072
2007-06-15,100063,Aditya Birla Sun Life MNC Fund - Regular - IDCW,63.01
2007-06-15,100064,Aditya Birla Sun Life MNC Fund - Growth - Regular Plan,125.7
2007-06-15,100065,Aditya Birla Sun Life India Opportunities Fund - Dividend - Regular Plan,22.77
2007-06-15,100066,Aditya Birla Sun Life India Opportunities Fund - Growth - Regular Plan,53.03
2007-06-15,100067,Aditya Birla Sun Life Tax Plan -Regular - IDCW,62.64
2007-06-15,100068,BARODA ELSS 96 - Plan A - IDCW,20.84
2007-06-15,100069,BARODA PIONEER DIVERSIFIED FUND,33.97
2007-06-15,100077,DSP Bond Fund - IDCW,10.6967
2007-06-15,100078,DSP Bond Fund - Growth,25.1739
2007-06-15,100079,DSP Bond Fund - IDCW - Monthly,10.4383
2007-06-15,100080,DSP Flexi Cap Fund - Regular Plan - IDCW,43.648
2007-06-15,100081,DSP Aggressive Hybrid Fund- Regular Plan - Growth,42.135
2007-06-15,100082,DSP Aggressive Hybrid Fund- Regular Plan - IDCW,24.445
2007-06-15,100084,DSP Gilt Fund - Regular Plan - Growth,23.1937
2007-06-15,100085,DSP Gilt Fund - Regular Plan - IDCW,11.5094
2007-06-15,100086,DSP Gilt Fund - Regular Plan - IDCW - Monthly,10.1369
2007-06-15,100087,DSP Savings Fund - Regular Plan - Growth,17.1126
2007-06-15,100088,DSP Savings Fund - Regular Plan - IDCW,11.0869
2007-06-15,100089,DSP Savings Fund - Regular Plan - IDCW - Monthly,10.0996
2007-06-15,100090,DSP BlackRock Technology.com   Fund - Regular Plan - Growth,28.836
2007-06-15,100119,HDFC Balanced Advantage Fund - Growth Plan,52.527
2007-06-15,100120,HDFC Balanced Advantage Fund - IDCW Plan,28.516
2007-06-15,100121,HDFC Balanced Fund - Dividend Option,17.898
2007-06-15,100122,HDFC Balanced Fund - Growth Option,31.678
2007-06-15,100123,HDFC Income Fund - Quarterly IDCW Option,10.2221
2007-06-15,100124,HDFC Income Fund - Growth Option,16.7212
2007-06-15,100150,Principal Child Benefit Fund-Super Saver-Future Guard Plan,60.09
2007-06-15,100151,Principal Retail Equity Savings Fund - Growth Option,60.9
2007-06-15,100152,Principal Nifty 100 Equal Weight Fund-Income Distribution CUM Capital Withdrawal,23.1179
2007-06-15,100153,Principal Nifty 100 Equal Weight Fund-Growth,29.7712
2007-06-15,100156,Principal Tax Savings Fund,83.96
2007-06-15,100171,Quant Dynamic Bond-Dividend,10.1351
2007-06-15,100172,Quant Dynamic Bond-Growth,22.9657
2007-06-15,100173,Quant Dynamic Bond-Bonus,12.0959
2007-06-15,100174,quant ELSS Tax Saver Fund - IDCW Option - Regular Plan,13.6629
2007-06-15,100175,quant ELSS Tax Saver Fund - Growth Option - Regular Plan,46.9945
2007-06-15,100176,quant Small Cap Fund - IDCW Option - Regular Plan,17.2749
2007-06-15,100177,quant Small Cap Fund - Growth - Regular Plan,20.4648
2007-06-15,100178,ING Income Fund-Regular Plan -Dividend Option (Quarterly),10.2459
2007-06-15,100179,ING Income Fund-Regular Plan -Dividend Option (Half Yearly),10.3145
2007-06-15,100180,ING Income Fund- Regular Plan - Dividend Option (Annual),10.4581
2007-06-15,100181,ING Income Fund-Regular Plan -Growth Option,18.3797
2007-06-15,100182,ING Income Fund-Institutional Plan - Dividend Option (Half Yearly),10.0
2007-06-15,100183,ING Income Fund-Institutional Plan - Dividend Option (Quarterly),10.0
2007-06-15,100184,ING Income Fund-Institutional Plan -Dividend Option (Annual),10.4248
2007-06-15,100185,ING Income Fund-Bonus Option,11.2066
2007-06-15,100186,ING Income Fund-Institutional Bonus Option,11.4924
2007-06-15,100187,ING Income Fund-Institutional Plan - Growth Option,19.1979
2007-06-15,100188,ING Core Equity Fund-Dividend Option,15.02
2007-06-15,100189,ING Core Equity Fund-Growth Option,28.42
2007-06-15,100190,ING Liquid Fund-Regular Growth Option,16.1244
2007-06-15,100191,ING Liquid Fund-Regular Weekly Dividend Option,10.8306
2007-06-15,100192,ING Liquid Fund-Regular Daily Dividend Option,10.7873
2007-06-15,100194,ING Liquid Fund-Auto Sweep Growth Option,10.0
2007-06-15,100195,ING Liquid Fund-Auto Sweep Weekly Dividend Option,10.0
2007-06-15,100196,ING Liquid Fund-Institutional Growth Option,11.9725
2007-06-15,100197,ING Liquid Fund-Institutional Weekly Dividend Option,10.0601
2007-06-15,100198,ING Liquid Fund-Institutional Daily Dividend Option,10.0121
2007-06-15,100199,ING Liquid Fund-Super Institutional Growth Option,11.3374
2007-06-15,100200,ING Liquid Fund-Super Institutional Daily Dividend Option,10.0048
2007-06-15,100201,ING Liquid Fund-Super Institutional Weekly Dividend Option,10.0088
2007-06-15,100202,ING Balanced Fund-Dividend Option,13.32
2007-06-15,100203,ING Balanced Fund-Growth Option,19.04
2007-06-15,100218,JM Large Cap Fund (Regular) - IDCW,17.1165
2007-06-15,100219,JM Large Cap Fund (Regular) - Growth Option,38.0911
2007-06-15,100220,JM Aggressive Hybrid Fund (Regular) - IDCW,18.3658
2007-06-15,100221,JM Aggressive Hybrid Fund (Regular) -Growth Option,24.1696
2007-06-15,100222,JM Medium to Long Duration Fund (Regular) - Quarterly IDCW,10.2788
2007-06-15,100223,JM Medium to Long Duration Fund (Regular) - Growth Option,29.0533
2007-06-15,100233,JM Liquid Fund (Regular) - Weekly IDCW,10.4316
2007-06-15,100234,JM Liquid Fund - Growth Option,20.9148
2007-06-15,100237,JM High Liquidity Fund-- Institutional Plan - Growth,12.6179
2007-06-15,100238,JM High Liquidity Fund-Institutional Plan - Daily Dividend,10.0159
2007-06-15,100241,JM High Liquidity Fund-- Institutional Plan - Dividend,10.1952
2007-06-15,100243,JM High Liquidity Fund-- Premium Plan - Daily Dividend Option,10.0
2007-06-15,100244,JM Liquid Fund (Regular) - Quarterly IDCW,12.0412
2007-06-15,100245,JM High Liquidity Fund-Super Institutional Plan- Daily Dividend,10.0165
2007-06-15,100246,JM High Liquidity Fund-Super Institutional Plan- Weekly  Dividend,10.0
2007-06-15,100247,JM Liquid Fund (Regular) - Super Institutional Plan - Growth Option,11.9984
2007-06-15,100249,JM G-Sec Fund - Quarterly Dividend Option,10.2507
2007-06-15,100250,JM G-Sec Fund - Growth Option,21.4437
2007-06-15,100251,JM G-Sec Fund-PF Plan - Growth Plan,22.2094
2007-06-15,100252,JM G-Sec Fund-PF Plan -Dividend Plan,20.3505
2007-06-15,100253,JM G-Sec Fund - Bonus Option - Principal Units,10.4311
2007-06-15,100254,JM Value Fund (Regular) - Growth Option,22.788
2007-06-15,100261,Kotak Gilt-Savings-Monthly Dividend,10.4278
2007-06-15,100262,Kotak Gilt-Savings-Growth,18.3756
2007-06-15,100263,Kotak Gilt-Savings-Annual Dividend,12.2882
2007-06-15,100264,Kotak Gilt-Investment Regular-Payout of Income Distribution cum capital withdrawal option,11.3793
2007-06-15,100265,Kotak Gilt-Investment Regular-Growth,23.6567
2007-06-15,100280,Kotak Gilt-Investment  Provident Fund and Trust-Payout of Income Distribution cum capital withdrawal option,10.8292
2007-06-15,100281,Kotak Gilt-Investment  Provident Fund and Trust-Growth,23.989
2007-06-15,100286,Kotak Aggressive Hybrid Fund - Regular Plan - IDCW - Payout & Reinvestment of Income Distribution cum capital withdrawal option,24.64
2007-06-15,100289,Kotak Tech,10.667
2007-06-15,100290,Kotak MNC,30.16
2007-06-15,100291,Kotak Bond-Deposit-Dividend,11.8616
2007-06-15,100292,Kotak Bond-Deposit-Growth,18.768
2007-06-15,100298,Kotak Bond Regular Plan Quaterly Payout of Income Distribution cum capital withdrawal option,10.4618
2007-06-15,100299,Kotak Bond Fund - Regular Plan Growth,19.8184
2007-06-15,100300,Kotak Bond Fund - Regular Plan - Standard IDCW Option,13.2449
2007-06-15,100301,Kotak Bond Regular Plan Bonus Plan,13.21
2007-06-15,100312,LIC MF Flexi Cap Fund-Regular Plan-IDCW,11.5151
2007-06-15,100313,LIC MF Flexi Cap Fund-Regular Plan-Growth,20.8137
2007-06-15,100314,LIC MF Medium to Long Duration Fund-Regular Plan-IDCW,10.3727
2007-06-15,100315,LIC MF Medium to Long Duration Fund-Regular Plan-Growth,20.501
2007-06-15,100316,LIC MF Gilt Fund-Regular Plan-IDCW,11.144
2007-06-15,100317,LIC MF Gilt Fund-Regular Plan-Growth,19.1745
2007-06-15,100318,LIC MF Gilt Fund-PF Plan-IDCW,11.0568
2007-06-15,100319,LIC MF Gilt Fund-PF Plan-Growth,11.0568
2007-06-15,100321,LIC MF Aggressive Hybrid Fund-Regular Plan-IDCW,10.2739
2007-06-15,100323,LIC MF Aggressive Hybrid Fund-Regular Plan-Growth,43.4036
2007-06-15,100325,LIC MF ULIS (5 Yrs. Single Premium)-Regular Plan-IDCW Reinvestment,11.1889
2007-06-15,100332,LIC MF Large Cap Fund-Regular Plan-IDCW,10.5807
2007-06-15,100337,SaharaTax Gain-Dividend,18.8875
2007-06-15,100338,SaharaTax Gain-Growth,21.6487
2007-06-15,100347,Morgan Stanley Growth Fund- Regular Growth Plan,52.64
2007-06-15,100348,ICICI Prudential Large & Mid Cap Fund - IDCW,23.7
2007-06-15,100349,ICICI Prudential Large & Mid Cap Fund - Growth,96.8
2007-06-15,100350,ICICI Prudential Large & Mid Cap Fund - Institutional Option - I - Growth,12.9
2007-06-15,100351,ICICI Prudential FMCG Fund - IDCW,33.09
2007-06-15,100352,ICICI Prudential FMCG Fund - Growth,41.58
2007-06-15,100353,ICICI Prudential ELSS Tax Saver Fund - IDCW,21.77
2007-06-15,100354,ICICI Prudential ELSS Tax Saver Fund - Growth,90.68
2007-06-15,100355,ICICI Prudential Equity & Debt Fund - Monthly IDCW,17.57
2007-06-15,100356,ICICI Prudential Equity & Debt Fund - Growth,35.81
2007-06-15,100357,ICICI Prudential Liquid Fund -Quarterly IDCW,10.8707
2007-06-15,100359,ICICI Prudential Liquid Institutional Plus Fund - Div - Daily,11.8515
2007-06-15,100360,ICICI Prudential Liquid Institutional Plus Fund - Div - Weekly,11.8608
2007-06-15,100361,ICICI Prudential Liquid Fund-Dividend-Institutional Plus - Monthly,11.944
2007-06-15,100362,ICICI Prudential Liquid Institutional Plus Fund - Growth,18.954
2007-06-15,100363,ICICI Prudential Technology Fund - Growth,16.51
2007-06-15,100364,ICICI Prudential Long Term Bond Fund - Half Yearly IDCW,10.3618
2007-06-15,100365,ICICI Prudential Long Term Bond Fund - Growth,21.5937
2007-06-15,100366,ICICI Prudential Long Term Bond Fund-Institutional Quarterly Dividend,10.1919
2007-06-15,100367,ICICI Prudential Long Term Bond Fund - Quarterly IDCW,10.9914
2007-06-15,100368,ICICI Prudential Gilt Fund - IDCW,10.6393
2007-06-15,100369,ICICI Prudential Gilt Fund - Growth,22.7027
2007-06-15,100370,ICICI Prudential Short Term Gilt Fund - Dividend,10.4958
2007-06-15,100371,ICICI Prudential Short Term Gilt Fund - Growth,18.2682
2007-06-15,100372,ICICI Prudential Short Term Gilt Fund - Half Yearly Dividend,10.1312
2007-06-15,100375,NIPPON INDIA GROWTH MID CAP FUND - IDCW Option,54.07
2007-06-15,100376,Nippon India Growth Mid Cap Fund-Growth Plan-Bonus Option,48.61
2007-06-15,100377,Nippon India Growth Mid Cap Fund-Growth Plan-Growth Option,293.18
2007-06-15,100378,Nippon India Vision Large & Midcap Fund - IDCW Option,50.14
2007-06-15,100379,Nippon India Vision Large & Midcap Fund-GROWTH PLAN-Bonus Option,32.92
2007-06-15,100380,Nippon India Vision Large & Midcap Fund-GROWTH PLAN-Growth Option,196.44
2007-06-15,100383,NIPPON INDIA MEDIUM TO LONG DURATION FUND - MONTHLY IDCW Option,10.9154
2007-06-15,100384,NIPPON INDIA MEDIUM TO LONG DURATION  FUND - QUARTERLY IDCW Option,12.0026
2007-06-15,100385,NIPPON INDIA MEDIUM TO LONG DURATION  FUND - HALF YEARLY IDCW Option,11.2565
2007-06-15,100386,NIPPON INDIA MEDIUM TO LONG DURATION  FUND - ANNUAL IDCW Option,12.2044
2007-06-15,100387,Nippon India Medium to Long Duration  Fund - Growth Plan Growth Option,23.4038
2007-06-15,100388,Nippon India Medium to Long Duration  Fund - Growth Plan Bonus Option,11.031
2007-06-15,100414,Tata Aggressive Hybrid Fund- Regular Plan - Growth Option,53.8084
2007-06-15,100415,Tata Ethical Fund-Regular Plan - Growth Option,49.8686
2007-06-15,100416,Tata Long Term Debt Fund - Regular Plan - Quarterly Dividend,10.4417
2007-06-15,100417,Tata Income Fund-Regular Plan - Half Yearly Payout of IDCW Option,10.9164
2007-06-15,100418,Tata Income Fund -Regular Plan - Growth Option,25.3734
2007-06-15,100470,Franklin India Large Cap Fund - IDCW,39.0309
2007-06-15,100471,Franklin India Large Cap Fund-Growth,135.4166
2007-06-15,100472,Franklin India Mid Cap Fund - IDCW,59.8835
2007-06-15,100473,Franklin India Mid Cap Fund-Growth,215.0627
2007-06-15,100474,Tata ELSS Fund- Regular Plan - Payout of IDCW Option,45.6244
2007-06-15,100475,Tata Large Cap Fund -Regular Plan - Growth Option,65.3069
2007-06-15,100476,Taurus Flexi Cap Fund - Regular Plan - Growth,43.63
2007-06-15,100477,Taurus Mid Cap Fund - Regular Plan - Growth,17.01
2007-06-15,100480,Taurus ELSS Tax Saver Fund - Regular Plan - Growth,18.93
2007-06-15,100481,Franklin India Balanced Fund-Growth,37.4939
2007-06-15,100482,Franklin India Balanced Fund-Div,32.4062
2007-06-15,100483,Franklin India Growth Fund,31.913
2007-06-15,100484,Franklin India Index Fund- NSE Nifty 50 Index Fund - Growth,33.255
2007-06-15,100485,Franklin India Govt.Sec. Fund-Composite Plan - Growth,24.2777
2007-06-15,100486,Franklin India Govt.Sec. Fund-Composite Plan - Dividend,10.6596
2007-06-15,100487,Franklin India Govt.Sec. Fund-Treasury Plan(Dividend Option),10.6652
2007-06-15,100489,Franklin India Govt.Sec. Fund-Treasury Plan(Growth Option),14.1275
2007-06-15,100490,Franklin India Govt.Sec. Fund-PF Plan - Growth,10.6636
2007-06-15,100491,Franklin India Govt.Sec. Fund-PF Plan - Dividend,10.6636
2007-06-15,100493,Franklin India Government Securities Fund - Growth,16.527
2007-06-15,100494,Franklin India Government Securities Fund - IDCW,10.543
2007-06-15,100495,Franklin India Govt.Sec. Fund-Long Term Plan - Bonus,11.6201
2007-06-15,100496,Templeton India Value Fund - Growth Plan,72.6817
2007-06-15,100497,Templeton India Value Fund - IDCW,42.973
2007-06-15,100498,Franklin India Dynamic Accrual Fund - IDCW,10.4618
2007-06-15,100499,Franklin India Dynamic Accrual Fund-Growth,25.9598
2007-06-15,100503,Franklin India Low Duration Fund - Monthly - IDCW,10.3203
2007-06-15,100504,Franklin India Low Duration Fund - Quarterly - IDCW,10.3405
2007-06-15,100505,Templeton Monthly Income Plan-Half Yearly Dividend,12.3419
2007-06-15,100506,Templeton Monthly Income Plan-Growth,20.3136
2007-06-15,100519,Franklin India Flexi Cap Fund - IDCW,33.2966
2007-06-15,100520,Franklin India Flexi Cap Fund - Growth,148.5228
2007-06-15,100521,Franklin India Technology Fund - IDCW,24.1247
2007-06-15,100522,Franklin India Technology Fund-Growth,51.8496
2007-06-15,100523,Franklin FMCG Fund - Growth,34.5066
2007-06-15,100524,Franklin INDIA OPPORTUNITIES FUND - IDCW,16.2857
2007-06-15,100525,Franklin India ELSS Tax Saver Fund - IDCW,33.8459
2007-06-15,100526,Franklin India ELSS Tax Saver Fund-Growth,133.6524
2007-06-15,100527,Franklin India Corporate Debt Fund - Plan A - Annual - IDCW,10.3351
2007-06-15,100528,Franklin India Corporate Debt Fund - Growth,24.9508
2007-06-15,100529,Franklin India Corporate Debt Fund - Plan B - Monthly - IDCW,13.0972
2007-06-15,100530,Franklin India Corporate Debt Fund - Plan B - Quarterly - IDCW,13.4591
2007-06-15,100531,Franklin India Corporate Debt Fund - Plan B - Half yearly - IDCW,13.3062
2007-06-15,100532,Franklin India Corporate Debt Fund - Monthly Bonus,18.5217
2007-06-15,100535,Franklin India Retirement Fund - IDCW,17.1565
2007-06-15,100536,Franklin India Retirement Fund - Growth,44.6371
2007-06-15,100537,Franklin India Liquid Fund - Regular Plan - Weekly - IDCW,1245.1898
2007-06-15,100538,Franklin India Liquid Fund - Regular Plan - Growth,1893.5356
2007-06-15,100541,Franklin India Liquid Fund - Regular Plan - Daily - IDCW,1512.34
2007-06-15,100542,Franklin India Liquid Fund - Liquid Plan - Weekly Dividend,1001.2359
2007-06-15,100543,Franklin India Liquid Fund - Liquid Plan - Daily IDCW,1000.25
2007-06-15,100544,Franklin India Liquid Fund - Liquid Plan - Growth,1163.9967
2007-06-15,100546,Franklin India Liquid Fund - Super Institutional Plan - Growth,1127.4928
2007-06-15,100547,Franklin India Liquid Fund - Super Institutional Plan - Daily - IDCW,1000.25
2007-06-15,100548,Franklin India Liquid Fund - Super Institutional Plan - Weekly - IDCW,1016.9106
2007-06-15,100549,Franklin India Aggressive Hybrid Fund - IDCW,21.7177
2007-06-15,100550,Franklin India Aggressive Hybrid Fund - Growth Plan,34.7177
2007-06-15,100551,Templeton India Children’s Asset Plan-Education Plan,26.1047
2007-06-15,100552,Templeton India Children’s Asset Plan-Gift Plan - Growth,32.3447
2007-06-15,100553,Templeton India Children’s Asset Plan-Gift Plan - Dividend,32.3447
2007-06-15,100557,Franklin India Taxshield 98,129.7406
2007-06-15,100558,Franklin India Taxshield 99,73.1091
2007-06-15,100561,Templeton India Money Market Account - Bonus Plan,1.0
2007-06-15,100563,DBS Chola Triple Ace-Regular -Cumulative,23.9444
2007-06-15,100567,DBS Chola Triple Ace-Regular - Quarterly Dividend,11.274
2007-06-15,100569,DBS Chola Triple Ace-Semi Annual Dividend,11.5867
2007-06-15,100573,DBS Chola Triple Ace-Regular Bonus,13.3044
2007-06-15,100574,DBS Chola Freedom Income -Short Term Fund-Regular-Monthly Dividend,11.0936
2007-06-15,100575,DBS Chola Freedom Income -Short Term Fund-Regular - Cumulative,12.0419
2007-06-15,100576,DBS Chola Freedom Income -Short Term Fund-Cum- Institutional Plan,12.1798
2007-06-15,100579,DBS Chola Gilt-Investment-Quarterly Dividend,10.4601
2007-06-15,100580,DBS Chola Gilt-Investment-Cumulative,19.0177
2007-06-15,100589,Canara Robeco Expo-Income Plan,15.6
2007-06-15,100590,Canara Robeco Expo-Growth Plan,54.02
2007-06-15,100593,CANARA ROBECO ELSS TAX SAVER - REGULAR PLAN -IDCW (Payout),17.01
2007-06-15,100596,CANARA ROBECO GILT FUND - REGULAR PLAN - IDCW (Payout/Reinvestment),10.6916
2007-06-15,100597,CANARA ROBECO GILT FUND - REGULAR PLAN - GROWTH OPTION,18.7333
2007-06-15,100600,CANARA ROBECO CONSERVATIVE HYBRID FUND - REGULAR PLAN - MONTHLY IDCW (Payout/Reinvestment),11.42
2007-06-15,100601,CANARA ROBECO CONSERVATIVE HYBRID FUND - REGULAR PLAN - GROWTH OPTION,20.02
2007-06-15,100602,Sundaram Medium Duration Fund (Formerly Known as Sundaram Medium Term Bond Fund) Regular Plan-Income Distribution cum Capital Withdrawal(IDCW),10.3433
2007-06-15,100603,Sundaram Medium Duration Fund (Formerly Known as Sundaram Medium Term Bond Fund) Regular Plan - Growth,23.0561
2007-06-15,100604,Sundaram Medium Duration Fund (Formerly Known as Sundaram Medium Term Bond Fund) Regular Plan -Growth,12.1372
2007-06-15,100609,Sundaram Medium Duration Fund (Formerly Known as Sundaram Medium Term Bond Fund) Regular Plan- Income Distribution cum Capital Withdrawal(IDCW),10.593
2007-06-15,100610,Sundaram Medium Duration Fund (Formerly Known as Sundaram Medium Term Bond Fund) Regular Plan -Income Distribution cum Capital Withdrawal (IDCW),10.5948
2007-06-15,100611,Sundaram Medium Duration Fund (Formerly Known as Sundaram Medium Term Bond Fund) Institutional Plan -Growth,11.8264
2007-06-15,100612,Sundaram Growth Fund-Dividend,15.0658
2007-06-15,100613,Sundaram Growth Fund-Growth,68.8693
2007-06-15,100614,Sundaram Value Fund Regular Plan - Income Distribution cum Capital Withdrawal (IDCW),13.344
2007-06-15,100617,Sundaram Equity Hybrid Fund Regular Plan - Growth,34.22
2007-06-15,100618,Sundaram Money Fund Retail Plan - Growth,15.9664
2007-06-15,100619,Sundaram Money Fund Retail Plan - Quarterly Reinvestment of Income Distribution cum Capital Withdrawal (IDCW),10.4128
2007-06-15,100620,Sundaram Money Fund Retail Plan - Daily Reinvestment of Income Distribution cum Capital Withdrawal (IDCW),10.0953
2007-06-15,100621,Sundaram Money Fund Retail Plan - Weekly Reinvestment of Income Distribution cum Capital Withdrawal (IDCW),10.3936
2007-06-15,100622,Sundaram Money Fund Retail Plan - Fortnightly Reinvestment of Income Distribution cum Capital Withdrawal (IDCW),10.2602
2007-06-15,100623,Sundaram Money Fund Retail Plan - Monthly Income Distribution cum Capital Withdrawal (IDCW),10.1586
2007-06-15,100630,quant Multi Cap Fund-IDCW Option - Regular Plan,13.6506
2007-06-15,100631,quant Multi Cap Fund-GROWTH OPTION - Regular Plan,58.1223
2007-06-15,100638,SBI Medium to Long Duration Fund - Regular Plan - Half Yearly - Income Distribution cum Capital Withdrawal Option (IDCW),10.1048
2007-06-15,100639,SBI Medium to Long Duration Fund-REGULAR PLAN-Growth,19.8525
2007-06-15,100640,SBI Medium to Long Duration Fund-REGULAR PLAN-Bonus,12.0253
2007-06-15,100641,SBI ULTRA SHORT DURATION FUND - REGULAR PLAN - GROWTH,17.1027
2007-06-15,100643,SBI Technology Opportunities Fund - Regular Plan - Income Distribution cum Capital Withdrawal Option (IDCW),29.13
2007-06-15,100644,SBI Healthcare Opportunities Fund - Regular Plan - Income Distribution cum Capital Withdrawal Option (IDCW),29.36
2007-06-15,100645,SBI Consumption Opportunities Fund - Regular Plan - Income Distribution cum Capital Withdrawal Option (IDCW),13.72
2007-06-15,100646,UTI - Unit Linked Insurance Plan,14.6922
2007-06-15,100648,UTI - CRTS 81 - Dividend Option,107.5267
2007-06-15,100650,UTI Large Cap Fund - Regular Plan - IDCW,29.38
2007-06-15,100651,UTI Large Cap Fund - Regular Plan - Growth Option,36.48
2007-06-15,100656,UTI - Master Plus Unit Scheme-Growth Option,67.95
2007-06-15,100657,UTI - Master Plus Unit Scheme-Income Option,52.14
2007-06-15,100663,UTI Large & Mid Cap Fund - Regular Plan - IDCW,39.3
2007-06-15,100664,UTI Large & Mid Cap Fund - Regular Plan - Growth Option,45.48
2007-06-15,100668,UTI Flexi Cap Fund - Regular Plan - IDCW,31.5
2007-06-15,100669,UTI - Flexi Cap Fund-Growth Option,34.01
2007-06-15,100678,UTI Children's Hybrid Fund - Regular Plan,13.8141
2007-06-15,100682,UTI Retirement Fund - Regular Plan,18.4801
2007-06-15,100684,UTI Aggressive Hybrid Fund - Regular Plan - Growth,56.59
2007-06-15,100685,UTI Aggressive Hybrid Fund - Regular Plan - IDCW,20.13
2007-06-15,100711,UTI - INDEX SELECT FUND-Income Option,23.82
2007-06-15,100712,UTI - INDEX SELECT FUND-Growth Option,35.29
2007-06-15,100715,DBS Chola Multi-Cap Fund-Dividend Option,14.69
2007-06-15,100716,DBS Chola Multi-Cap Fund-Cumulative Option,18.42
2007-06-15,100723,UTI MMF-Discontinued - Regular Plan -Growth,21.4162
2007-06-15,100724,UTI MMF- Discontinued - Regular Plan - Flexi Dividend Option,17.7879
2007-06-15,100725,UTI MMF- Discontinued - Regular Plan - Periodic Dividend Option,17.663
2007-06-15,100739,UTI MNC Fund - Regular Plan - IDCW,27.55
2007-06-15,100740,UTI - MNC Fund - Regular Plan - Growth Option,36.76
2007-06-15,100741,UTI Medium to Long Duration Fund- Regular Plan - Growth,21.8998
2007-06-15,100742,UTI Medium to Long Duration Fund - Regular Plan - Quarterly IDCW,10.9719
2007-06-15,100748,UTI - Master Index Fund-Income Option,44.5406
2007-06-15,100749,UTI - Master Index Fund-Growth Option,44.5407
2007-06-15,100750,UTI - Master Value Fund-Income Option,19.73
2007-06-15,100751,UTI - Master Value Fund-Growth Option,30.28
2007-06-15,100780,Sundaram Banking & PSU Fund (Formerly Known as Sundaram Banking and PSU Debt Fund) Retail Plan - Monthly Income Distribution cum Capital Withdrawal (IDCW),10.216
2007-06-15,100781,Sundaram Banking & PSU Fund (Formerly Known as Sundaram Banking and PSU Debt Fund) Retail Plan - Growth,11.5359
2007-06-15,100782,Sundaram Banking & PSU Fund (Formerly Known as Sundaram Banking and PSU Debt Fund) Regular Plan - Daily Reinvestment of Income Distribution cum Capital Withdrawal (IDCW),10.0519
2007-06-15,100784,Sundaram Banking & PSU Fund (Formerly Known as Sundaram Banking and PSU Debt Fund) Regular Plan - Growth,11.6854
2007-06-15,100785,Sundaram Corporate Bond Fund Regular Plan -Income Distribution cum Capital Withdrawal(IDCW),10.2615
