date,scheme_code,scheme_name,nav
2007-06-27,100027,Grindlays Super Saver Income Fund-GSSIF-Half Yearly Dividend,10.3486
2007-06-27,100028,Grindlays Super Saver Income Fund-GSSIF-Quaterly Dividend,10.3618
2007-06-27,100029,Grindlays Super Saver Income Fund-GSSIF-Growth,17.1595
2007-06-27,100030,Grindlays Super Saver Income Fund-GSSIF-Annual Dividend,10.3764
2007-06-27,100031,Grindlays Super Saver Income Fund-GSSIF - ST-Dividend,10.1214
2007-06-27,100032,Grindlays Super Saver Income Fund-GSSIF - ST-Growth,15.1909
2007-06-27,100033,Aditya Birla Sun Life Large & Mid Cap Fund - Regular Growth,133.11
2007-06-27,100034,Aditya Birla Sun Life Large & Mid Cap Fund -Regular - IDCW,95.5
2007-06-27,100035,Birla Sun Life Freedom Fund-Plan A (Dividend),19.66
2007-06-27,100036,Birla Sun Life Freedom Fund-Plan B (Growth),29.57
2007-06-27,100037,Aditya Birla Sun Life Income Fund - Regular - Quarterly IDCW,10.077
2007-06-27,100038,Aditya Birla Sun Life Income Fund - Growth - Regular Plan,30.9109
2007-06-27,100041,Aditya Birla Sun Life Liquid Fund -Institutional - IDCW,10.8023
2007-06-27,100042,Aditya Birla Sun Life Liquid Fund-Retail (Growth),20.5354
2007-06-27,100043,Aditya Birla Sun Life Liquid Fund-Institutional (Growth),20.6858
2007-06-27,100044,Aditya Birla Sun Life Liquid Fund -Retail - IDCW,16.3694
2007-06-27,100046,Aditya Birla Sun Life Liquid Fund -Daily IDCW,10.0195
2007-06-27,100047,Aditya Birla Sun Life Liquid Fund - Growth,12.1599
2007-06-27,100048,Aditya Birla Sun Life Liquid Fund -Institutional - weekly  IDCW,10.8172
2007-06-27,100049,Aditya Birla Sun Life Cash Plus-Institutional - Fortnightly Dividend,10.8314
2007-06-27,100051,Aditya Birla Sun Life Liquid Fund -weekly IDCW,10.0324
2007-06-27,100052,Aditya Birla Sun Life Cash Plus-Institutional Premium - Fortnightly Dividend,10.0684
2007-06-27,100053,Aditya Birla Sun Life Cash Plus-Institutional Premium Plan-Monthly Dividend,10.0478
2007-06-27,100054,Aditya Birla Sun Life Gilt Plus - Liquid Plan - Quarterly Dividend - Regular Plan,10.5859
2007-06-27,100055,Aditya Birla Sun Life Gilt Plus - Liquid Plan - Growth - Regular Plan,18.4788
2007-06-27,100056,Aditya Birla Sun Life Gilt Plus - Liquid Plan - Annual Dividend - Regular Plan,11.4423
2007-06-27,100057,Aditya Birla Sun Life Govenment Securities Fund -Regular - Quarterly IDCW,10.3368
2007-06-27,100058,Aditya Birla Sun Life Government Securities Fund  - Growth - Regular Plan,20.8633
2007-06-27,100059,Aditya Birla Sun Life Gilt Plus-PF Plan (Annual Dividend),19.3757
2007-06-27,100060,Aditya Birla Sun Life Constant Maturity 10 Year Gilt Fund - Quarterly Dividend - Regular Plan,10.9063
2007-06-27,100061,Aditya Birla Sun Life Constant Maturity 10 Year Gilt Fund - Growth - Regular Plan,23.6088
2007-06-27,100062,Aditya Birla Sun Life Gilt Plus-Regular Plan (Annual Dividend),22.0038
2007-06-27,100063,Aditya Birla Sun Life MNC Fund - Regular - IDCW,64.22
2007-06-27,100064,Aditya Birla Sun Life MNC Fund - Growth - Regular Plan,128.12
2007-06-27,100065,Aditya Birla Sun Life India Opportunities Fund - Dividend - Regular Plan,22.87
2007-06-27,100066,Aditya Birla Sun Life India Opportunities Fund - Growth - Regular Plan,53.26
2007-06-27,100067,Aditya Birla Sun Life Tax Plan -Regular - IDCW,64.49
2007-06-27,100068,BARODA ELSS 96 - Plan A - IDCW,21.44
2007-06-27,100069,BARODA PIONEER DIVERSIFIED FUND,35.04
2007-06-27,100077,DSP Bond Fund - IDCW,10.6867
2007-06-27,100078,DSP Bond Fund - Growth,25.1504
2007-06-27,100079,DSP Bond Fund - IDCW - Monthly,10.4286
2007-06-27,100080,DSP Flexi Cap Fund - Regular Plan - IDCW,44.835
2007-06-27,100081,DSP Aggressive Hybrid Fund- Regular Plan - Growth,43.127
2007-06-27,100082,DSP Aggressive Hybrid Fund- Regular Plan - IDCW,25.021
2007-06-27,100084,DSP Gilt Fund - Regular Plan - Growth,23.2115
2007-06-27,100085,DSP Gilt Fund - Regular Plan - IDCW,11.5182
2007-06-27,100086,DSP Gilt Fund - Regular Plan - IDCW - Monthly,10.1446
2007-06-27,100087,DSP Savings Fund - Regular Plan - Growth,17.1484
2007-06-27,100088,DSP Savings Fund - Regular Plan - IDCW,11.1101
2007-06-27,100089,DSP Savings Fund - Regular Plan - IDCW - Monthly,10.1208
2007-06-27,100090,DSP BlackRock Technology.com   Fund - Regular Plan - Growth,29.079
2007-06-27,100119,HDFC Balanced Advantage Fund - Growth Plan,54.23
2007-06-27,100120,HDFC Balanced Advantage Fund - IDCW Plan,29.44
2007-06-27,100121,HDFC Balanced Fund - Dividend Option,18.113
2007-06-27,100122,HDFC Balanced Fund - Growth Option,32.058
2007-06-27,100123,HDFC Income Fund - Quarterly IDCW Option,10.1242
2007-06-27,100124,HDFC Income Fund - Growth Option,16.7477
2007-06-27,100150,Principal Child Benefit Fund-Super Saver-Future Guard Plan,62.19
2007-06-27,100151,Principal Retail Equity Savings Fund - Growth Option,63.03
2007-06-27,100152,Principal Nifty 100 Equal Weight Fund-Income Distribution CUM Capital Withdrawal,23.5912
2007-06-27,100153,Principal Nifty 100 Equal Weight Fund-Growth,30.3798
2007-06-27,100156,Principal Tax Savings Fund,88.64
2007-06-27,100171,Quant Dynamic Bond-Dividend,10.1303
2007-06-27,100172,Quant Dynamic Bond-Growth,23.0339
2007-06-27,100173,Quant Dynamic Bond-Bonus,12.1319
2007-06-27,100174,quant ELSS Tax Saver Fund - IDCW Option - Regular Plan,14.0199
2007-06-27,100175,quant ELSS Tax Saver Fund - Growth Option - Regular Plan,48.2222
2007-06-27,100176,quant Small Cap Fund - IDCW Option - Regular Plan,17.4845
2007-06-27,100177,quant Small Cap Fund - Growth - Regular Plan,20.7134
2007-06-27,100178,ING Income Fund-Regular Plan -Dividend Option (Quarterly),10.2662
2007-06-27,100179,ING Income Fund-Regular Plan -Dividend Option (Half Yearly),10.335
2007-06-27,100180,ING Income Fund- Regular Plan - Dividend Option (Annual),10.4788
2007-06-27,100181,ING Income Fund-Regular Plan -Growth Option,18.4161
2007-06-27,100182,ING Income Fund-Institutional Plan - Dividend Option (Half Yearly),10.0
2007-06-27,100183,ING Income Fund-Institutional Plan - Dividend Option (Quarterly),10.0
2007-06-27,100184,ING Income Fund-Institutional Plan -Dividend Option (Annual),10.449
2007-06-27,100185,ING Income Fund-Bonus Option,11.2288
2007-06-27,100186,ING Income Fund-Institutional Bonus Option,11.5191
2007-06-27,100187,ING Income Fund-Institutional Plan - Growth Option,19.2425
2007-06-27,100188,ING Core Equity Fund-Dividend Option,15.47
2007-06-27,100189,ING Core Equity Fund-Growth Option,29.27
2007-06-27,100190,ING Liquid Fund-Regular Growth Option,16.1569
2007-06-27,100191,ING Liquid Fund-Regular Weekly Dividend Option,10.8287
2007-06-27,100192,ING Liquid Fund-Regular Daily Dividend Option,10.7873
2007-06-27,100194,ING Liquid Fund-Auto Sweep Growth Option,10.0
2007-06-27,100195,ING Liquid Fund-Auto Sweep Weekly Dividend Option,10.0
2007-06-27,100196,ING Liquid Fund-Institutional Growth Option,11.998
2007-06-27,100197,ING Liquid Fund-Institutional Weekly Dividend Option,10.0582
2007-06-27,100198,ING Liquid Fund-Institutional Daily Dividend Option,10.0121
2007-06-27,100199,ING Liquid Fund-Super Institutional Growth Option,11.3621
2007-06-27,100200,ING Liquid Fund-Super Institutional Daily Dividend Option,10.0048
2007-06-27,100201,ING Liquid Fund-Super Institutional Weekly Dividend Option,10.0073
2007-06-27,100202,ING Balanced Fund-Dividend Option,13.53
2007-06-27,100203,ING Balanced Fund-Growth Option,19.33
2007-06-27,100218,JM Large Cap Fund (Regular) - IDCW,17.6712
2007-06-27,100219,JM Large Cap Fund (Regular) - Growth Option,39.3258
2007-06-27,100220,JM Aggressive Hybrid Fund (Regular) - IDCW,18.822
2007-06-27,100221,JM Aggressive Hybrid Fund (Regular) -Growth Option,24.77
2007-06-27,100222,JM Medium to Long Duration Fund (Regular) - Quarterly IDCW,10.2998
2007-06-27,100223,JM Medium to Long Duration Fund (Regular) - Growth Option,29.1126
2007-06-27,100233,JM Liquid Fund (Regular) - Weekly IDCW,10.4324
2007-06-27,100234,JM Liquid Fund - Growth Option,20.9515
2007-06-27,100237,JM High Liquidity Fund-- Institutional Plan - Growth,12.64
2007-06-27,100238,JM High Liquidity Fund-Institutional Plan - Daily Dividend,10.0159
2007-06-27,100241,JM High Liquidity Fund-- Institutional Plan - Dividend,10.1961
2007-06-27,100243,JM High Liquidity Fund-- Premium Plan - Daily Dividend Option,10.0
2007-06-27,100244,JM Liquid Fund (Regular) - Quarterly IDCW,12.0622
2007-06-27,100245,JM High Liquidity Fund-Super Institutional Plan- Daily Dividend,10.0165
2007-06-27,100246,JM High Liquidity Fund-Super Institutional Plan- Weekly  Dividend,10.0
2007-06-27,100247,JM Liquid Fund (Regular) - Super Institutional Plan - Growth Option,12.0194
2007-06-27,100249,JM G-Sec Fund - Quarterly Dividend Option,10.2628
2007-06-27,100250,JM G-Sec Fund - Growth Option,21.469
2007-06-27,100251,JM G-Sec Fund-PF Plan - Growth Plan,22.2514
2007-06-27,100252,JM G-Sec Fund-PF Plan -Dividend Plan,20.389
2007-06-27,100253,JM G-Sec Fund - Bonus Option - Principal Units,10.4434
2007-06-27,100254,JM Value Fund (Regular) - Growth Option,23.7527
2007-06-27,100261,Kotak Gilt-Savings-Monthly Dividend,10.4533
2007-06-27,100262,Kotak Gilt-Savings-Growth,18.4204
2007-06-27,100263,Kotak Gilt-Savings-Annual Dividend,12.3182
2007-06-27,100264,Kotak Gilt-Investment Regular-Payout of Income Distribution cum capital withdrawal option,11.4045
2007-06-27,100265,Kotak Gilt-Investment Regular-Growth,23.709
2007-06-27,100280,Kotak Gilt-Investment  Provident Fund and Trust-Payout of Income Distribution cum capital withdrawal option,10.8545
2007-06-27,100281,Kotak Gilt-Investment  Provident Fund and Trust-Growth,24.0452
2007-06-27,100286,Kotak Aggressive Hybrid Fund - Regular Plan - IDCW - Payout & Reinvestment of Income Distribution cum capital withdrawal option,25.163
2007-06-27,100289,Kotak Tech,10.483
2007-06-27,100290,Kotak MNC,31.011
2007-06-27,100291,Kotak Bond-Deposit-Dividend,11.8906
2007-06-27,100292,Kotak Bond-Deposit-Growth,18.814
2007-06-27,100298,Kotak Bond Regular Plan Quaterly Payout of Income Distribution cum capital withdrawal option,10.3417
2007-06-27,100299,Kotak Bond Fund - Regular Plan Growth,19.8785
2007-06-27,100300,Kotak Bond Fund - Regular Plan - Standard IDCW Option,13.285
2007-06-27,100301,Kotak Bond Regular Plan Bonus Plan,13.25
2007-06-27,100312,LIC MF Flexi Cap Fund-Regular Plan-IDCW,11.7541
2007-06-27,100313,LIC MF Flexi Cap Fund-Regular Plan-Growth,21.2458
2007-06-27,100314,LIC MF Medium to Long Duration Fund-Regular Plan-IDCW,10.4035
2007-06-27,100315,LIC MF Medium to Long Duration Fund-Regular Plan-Growth,20.5619
2007-06-27,100316,LIC MF Gilt Fund-Regular Plan-IDCW,11.1819
2007-06-27,100317,LIC MF Gilt Fund-Regular Plan-Growth,19.2398
2007-06-27,100318,LIC MF Gilt Fund-PF Plan-IDCW,11.0944
2007-06-27,100319,LIC MF Gilt Fund-PF Plan-Growth,11.0944
2007-06-27,100321,LIC MF Aggressive Hybrid Fund-Regular Plan-IDCW,10.5818
2007-06-27,100323,LIC MF Aggressive Hybrid Fund-Regular Plan-Growth,44.7047
2007-06-27,100325,LIC MF ULIS (5 Yrs. Single Premium)-Regular Plan-IDCW Reinvestment,11.4995
2007-06-27,100332,LIC MF Large Cap Fund-Regular Plan-IDCW,10.872
2007-06-27,100337,SaharaTax Gain-Dividend,19.5493
2007-06-27,100338,SaharaTax Gain-Growth,22.4073
2007-06-27,100347,Morgan Stanley Growth Fund- Regular Growth Plan,53.6
2007-06-27,100348,ICICI Prudential Large & Mid Cap Fund - IDCW,22.08
2007-06-27,100349,ICICI Prudential Large & Mid Cap Fund - Growth,98.5
2007-06-27,100350,ICICI Prudential Large & Mid Cap Fund - Institutional Option - I - Growth,13.13
2007-06-27,100351,ICICI Prudential FMCG Fund - IDCW,33.4
2007-06-27,100352,ICICI Prudential FMCG Fund - Growth,41.98
2007-06-27,100353,ICICI Prudential ELSS Tax Saver Fund - IDCW,22.18
2007-06-27,100354,ICICI Prudential ELSS Tax Saver Fund - Growth,92.37
2007-06-27,100355,ICICI Prudential Equity & Debt Fund - Monthly IDCW,17.79
2007-06-27,100356,ICICI Prudential Equity & Debt Fund - Growth,36.26
2007-06-27,100357,ICICI Prudential Liquid Fund -Quarterly IDCW,10.8975
2007-06-27,100359,ICICI Prudential Liquid Institutional Plus Fund - Div - Daily,11.8515
2007-06-27,100360,ICICI Prudential Liquid Institutional Plus Fund - Div - Weekly,11.8594
2007-06-27,100361,ICICI Prudential Liquid Fund-Dividend-Institutional Plus - Monthly,11.9746
2007-06-27,100362,ICICI Prudential Liquid Institutional Plus Fund - Growth,19.0025
2007-06-27,100363,ICICI Prudential Technology Fund - Growth,16.7
2007-06-27,100364,ICICI Prudential Long Term Bond Fund - Half Yearly IDCW,10.3827
2007-06-27,100365,ICICI Prudential Long Term Bond Fund - Growth,21.6373
2007-06-27,100366,ICICI Prudential Long Term Bond Fund-Institutional Quarterly Dividend,10.2146
2007-06-27,100367,ICICI Prudential Long Term Bond Fund - Quarterly IDCW,11.0136
2007-06-27,100368,ICICI Prudential Gilt Fund - IDCW,10.6521
2007-06-27,100369,ICICI Prudential Gilt Fund - Growth,22.73
2007-06-27,100370,ICICI Prudential Short Term Gilt Fund - Dividend,10.5313
2007-06-27,100371,ICICI Prudential Short Term Gilt Fund - Growth,18.33
2007-06-27,100372,ICICI Prudential Short Term Gilt Fund - Half Yearly Dividend,10.1655
2007-06-27,100375,NIPPON INDIA GROWTH MID CAP FUND - IDCW Option,56.0
2007-06-27,100376,Nippon India Growth Mid Cap Fund-Growth Plan-Bonus Option,50.35
2007-06-27,100377,Nippon India Growth Mid Cap Fund-Growth Plan-Growth Option,303.66
2007-06-27,100378,Nippon India Vision Large & Midcap Fund - IDCW Option,52.18
2007-06-27,100379,Nippon India Vision Large & Midcap Fund-GROWTH PLAN-Bonus Option,34.26
2007-06-27,100380,Nippon India Vision Large & Midcap Fund-GROWTH PLAN-Growth Option,204.42
2007-06-27,100383,NIPPON INDIA MEDIUM TO LONG DURATION FUND - MONTHLY IDCW Option,10.89
2007-06-27,100384,NIPPON INDIA MEDIUM TO LONG DURATION  FUND - QUARTERLY IDCW Option,12.0407
2007-06-27,100385,NIPPON INDIA MEDIUM TO LONG DURATION  FUND - HALF YEARLY IDCW Option,11.2923
2007-06-27,100386,NIPPON INDIA MEDIUM TO LONG DURATION  FUND - ANNUAL IDCW Option,12.2431
2007-06-27,100387,Nippon India Medium to Long Duration  Fund - Growth Plan Growth Option,23.4782
2007-06-27,100388,Nippon India Medium to Long Duration  Fund - Growth Plan Bonus Option,11.066
2007-06-27,100414,Tata Aggressive Hybrid Fund- Regular Plan - Growth Option,55.1957
2007-06-27,100415,Tata Ethical Fund-Regular Plan - Growth Option,52.2035
2007-06-27,100416,Tata Long Term Debt Fund - Regular Plan - Quarterly Dividend,10.3238
2007-06-27,100417,Tata Income Fund-Regular Plan - Half Yearly Payout of IDCW Option,10.9481
2007-06-27,100418,Tata Income Fund -Regular Plan - Growth Option,25.4471
2007-06-27,100470,Franklin India Large Cap Fund - IDCW,40.2784
2007-06-27,100471,Franklin India Large Cap Fund-Growth,139.7449
2007-06-27,100472,Franklin India Mid Cap Fund - IDCW,61.9395
2007-06-27,100473,Franklin India Mid Cap Fund-Growth,222.4465
2007-06-27,100474,Tata ELSS Fund- Regular Plan - Payout of IDCW Option,47.0709
2007-06-27,100475,Tata Large Cap Fund -Regular Plan - Growth Option,67.1849
2007-06-27,100476,Taurus Flexi Cap Fund - Regular Plan - Growth,44.47
2007-06-27,100477,Taurus Mid Cap Fund - Regular Plan - Growth,17.6
2007-06-27,100480,Taurus ELSS Tax Saver Fund - Regular Plan - Growth,19.78
2007-06-27,100481,Franklin India Balanced Fund-Growth,38.3371
2007-06-27,100482,Franklin India Balanced Fund-Div,33.1349
2007-06-27,100483,Franklin India Growth Fund,32.8905
2007-06-27,100484,Franklin India Index Fund- NSE Nifty 50 Index Fund - Growth,33.9787
2007-06-27,100485,Franklin India Govt.Sec. Fund-Composite Plan - Growth,24.3146
2007-06-27,100486,Franklin India Govt.Sec. Fund-Composite Plan - Dividend,10.6758
2007-06-27,100487,Franklin India Govt.Sec. Fund-Treasury Plan(Dividend Option),10.6932
2007-06-27,100489,Franklin India Govt.Sec. Fund-Treasury Plan(Growth Option),14.1646
2007-06-27,100490,Franklin India Govt.Sec. Fund-PF Plan - Growth,10.6798
2007-06-27,100491,Franklin India Govt.Sec. Fund-PF Plan - Dividend,10.6798
2007-06-27,100493,Franklin India Government Securities Fund - Growth,16.5646
2007-06-27,100494,Franklin India Government Securities Fund - IDCW,10.567
2007-06-27,100495,Franklin India Govt.Sec. Fund-Long Term Plan - Bonus,11.6465
2007-06-27,100496,Templeton India Value Fund - Growth Plan,74.0586
2007-06-27,100497,Templeton India Value Fund - IDCW,43.7871
2007-06-27,100498,Franklin India Dynamic Accrual Fund - IDCW,10.5023
2007-06-27,100499,Franklin India Dynamic Accrual Fund-Growth,26.0604
2007-06-27,100503,Franklin India Low Duration Fund - Monthly - IDCW,10.345
2007-06-27,100504,Franklin India Low Duration Fund - Quarterly - IDCW,10.3653
2007-06-27,100505,Templeton Monthly Income Plan-Half Yearly Dividend,12.436
2007-06-27,100506,Templeton Monthly Income Plan-Growth,20.4685
2007-06-27,100519,Franklin India Flexi Cap Fund - IDCW,34.2878
2007-06-27,100520,Franklin India Flexi Cap Fund - Growth,152.9441
2007-06-27,100521,Franklin India Technology Fund - IDCW,23.3535
2007-06-27,100522,Franklin India Technology Fund-Growth,50.1921
2007-06-27,100523,Franklin FMCG Fund - Growth,34.7317
2007-06-27,100524,Franklin INDIA OPPORTUNITIES FUND - IDCW,16.954
2007-06-27,100525,Franklin India ELSS Tax Saver Fund - IDCW,34.7858
2007-06-27,100526,Franklin India ELSS Tax Saver Fund-Growth,137.3635
2007-06-27,100527,Franklin India Corporate Debt Fund - Plan A - Annual - IDCW,10.3542
2007-06-27,100528,Franklin India Corporate Debt Fund - Growth,24.997
2007-06-27,100529,Franklin India Corporate Debt Fund - Plan B - Monthly - IDCW,13.1215
2007-06-27,100530,Franklin India Corporate Debt Fund - Plan B - Quarterly - IDCW,13.484
2007-06-27,100531,Franklin India Corporate Debt Fund - Plan B - Half yearly - IDCW,13.3309
2007-06-27,100532,Franklin India Corporate Debt Fund - Monthly Bonus,18.5559
2007-06-27,100535,Franklin India Retirement Fund - IDCW,17.4002
2007-06-27,100536,Franklin India Retirement Fund - Growth,45.2713
2007-06-27,100537,Franklin India Liquid Fund - Regular Plan - Weekly - IDCW,1245.1923
2007-06-27,100538,Franklin India Liquid Fund - Regular Plan - Growth,1897.2472
2007-06-27,100541,Franklin India Liquid Fund - Regular Plan - Daily - IDCW,1512.34
2007-06-27,100542,Franklin India Liquid Fund - Liquid Plan - Weekly Dividend,1001.2522
2007-06-27,100543,Franklin India Liquid Fund - Liquid Plan - Daily IDCW,1000.25
2007-06-27,100544,Franklin India Liquid Fund - Liquid Plan - Growth,1166.1835
2007-06-27,100546,Franklin India Liquid Fund - Super Institutional Plan - Growth,1129.87
2007-06-27,100547,Franklin India Liquid Fund - Super Institutional Plan - Daily - IDCW,1000.25
2007-06-27,100548,Franklin India Liquid Fund - Super Institutional Plan - Weekly - IDCW,1016.8877
2007-06-27,100549,Franklin India Aggressive Hybrid Fund - IDCW,22.2062
2007-06-27,100550,Franklin India Aggressive Hybrid Fund - Growth Plan,35.4984
2007-06-27,100551,Templeton India Children’s Asset Plan-Education Plan,26.2603
2007-06-27,100552,Templeton India Children’s Asset Plan-Gift Plan - Growth,32.9031
2007-06-27,100553,Templeton India Children’s Asset Plan-Gift Plan - Dividend,32.9031
2007-06-27,100557,Franklin India Taxshield 98,131.2638
2007-06-27,100558,Franklin India Taxshield 99,72.6632
2007-06-27,100561,Templeton India Money Market Account - Bonus Plan,1.0
2007-06-27,100563,DBS Chola Triple Ace-Regular -Cumulative,23.9751
2007-06-27,100567,DBS Chola Triple Ace-Regular - Quarterly Dividend,11.2885
2007-06-27,100569,DBS Chola Triple Ace-Semi Annual Dividend,11.6015
2007-06-27,100573,DBS Chola Triple Ace-Regular Bonus,13.3215
2007-06-27,100574,DBS Chola Freedom Income -Short Term Fund-Regular-Monthly Dividend,11.1243
2007-06-27,100575,DBS Chola Freedom Income -Short Term Fund-Regular - Cumulative,12.0753
2007-06-27,100576,DBS Chola Freedom Income -Short Term Fund-Cum- Institutional Plan,12.2142
2007-06-27,100579,DBS Chola Gilt-Investment-Quarterly Dividend,10.47
2007-06-27,100580,DBS Chola Gilt-Investment-Cumulative,19.0357
2007-06-27,100589,Canara Robeco Expo-Income Plan,15.74
2007-06-27,100590,Canara Robeco Expo-Growth Plan,54.48
2007-06-27,100593,CANARA ROBECO ELSS TAX SAVER - REGULAR PLAN -IDCW (Payout),17.74
2007-06-27,100596,CANARA ROBECO GILT FUND - REGULAR PLAN - IDCW (Payout/Reinvestment),10.7173
2007-06-27,100597,CANARA ROBECO GILT FUND - REGULAR PLAN - GROWTH OPTION,18.7783
2007-06-27,100600,CANARA ROBECO CONSERVATIVE HYBRID FUND - REGULAR PLAN - MONTHLY IDCW (Payout/Reinvestment),11.74
2007-06-27,100601,CANARA ROBECO CONSERVATIVE HYBRID FUND - REGULAR PLAN - GROWTH OPTION,20.59
2007-06-27,100602,Sundaram Medium Duration Fund (Formerly Known as Sundaram Medium Term Bond Fund) Regular Plan-Income Distribution cum Capital Withdrawal(IDCW),10.3602
2007-06-27,100603,Sundaram Medium Duration Fund (Formerly Known as Sundaram Medium Term Bond Fund) Regular Plan - Growth,23.0936
2007-06-27,100604,Sundaram Medium Duration Fund (Formerly Known as Sundaram Medium Term Bond Fund) Regular Plan -Growth,12.1569
2007-06-27,100609,Sundaram Medium Duration Fund (Formerly Known as Sundaram Medium Term Bond Fund) Regular Plan- Income Distribution cum Capital Withdrawal(IDCW),10.6103
2007-06-27,100610,Sundaram Medium Duration Fund (Formerly Known as Sundaram Medium Term Bond Fund) Regular Plan -Income Distribution cum Capital Withdrawal (IDCW),10.6121
2007-06-27,100611,Sundaram Medium Duration Fund (Formerly Known as Sundaram Medium Term Bond Fund) Institutional Plan -Growth,11.8485
2007-06-27,100612,Sundaram Growth Fund-Dividend,15.518
2007-06-27,100613,Sundaram Growth Fund-Growth,70.9366
2007-06-27,100614,Sundaram Value Fund Regular Plan - Income Distribution cum Capital Withdrawal (IDCW),13.7622
2007-06-27,100617,Sundaram Equity Hybrid Fund Regular Plan - Growth,34.8443
2007-06-27,100618,Sundaram Money Fund Retail Plan - Growth,15.9914
2007-06-27,100619,Sundaram Money Fund Retail Plan - Quarterly Reinvestment of Income Distribution cum Capital Withdrawal (IDCW),10.429
2007-06-27,100620,Sundaram Money Fund Retail Plan - Daily Reinvestment of Income Distribution cum Capital Withdrawal (IDCW),10.0953
2007-06-27,100621,Sundaram Money Fund Retail Plan - Weekly Reinvestment of Income Distribution cum Capital Withdrawal (IDCW),10.4056
2007-06-27,100622,Sundaram Money Fund Retail Plan - Fortnightly Reinvestment of Income Distribution cum Capital Withdrawal (IDCW),10.2621
2007-06-27,100623,Sundaram Money Fund Retail Plan - Monthly Income Distribution cum Capital Withdrawal (IDCW),10.1746
2007-06-27,100630,quant Multi Cap Fund-IDCW Option - Regular Plan,14.1486
2007-06-27,100631,quant Multi Cap Fund-GROWTH OPTION - Regular Plan,60.2427
2007-06-27,100638,SBI Medium to Long Duration Fund - Regular Plan - Half Yearly - Income Distribution cum Capital Withdrawal Option (IDCW),10.109
2007-06-27,100639,SBI Medium to Long Duration Fund-REGULAR PLAN-Growth,19.8608
2007-06-27,100640,SBI Medium to Long Duration Fund-REGULAR PLAN-Bonus,12.0302
2007-06-27,100641,SBI ULTRA SHORT DURATION FUND - REGULAR PLAN - GROWTH,17.1368
2007-06-27,100643,SBI Technology Opportunities Fund - Regular Plan - Income Distribution cum Capital Withdrawal Option (IDCW),29.06
2007-06-27,100644,SBI Healthcare Opportunities Fund - Regular Plan - Income Distribution cum Capital Withdrawal Option (IDCW),30.21
2007-06-27,100645,SBI Consumption Opportunities Fund - Regular Plan - Income Distribution cum Capital Withdrawal Option (IDCW),13.82
2007-06-27,100646,UTI - Unit Linked Insurance Plan,14.8685
2007-06-27,100648,UTI - CRTS 81 - Dividend Option,108.7785
2007-06-27,100650,UTI Large Cap Fund - Regular Plan - IDCW,30.25
2007-06-27,100651,UTI Large Cap Fund - Regular Plan - Growth Option,37.55
2007-06-27,100656,UTI - Master Plus Unit Scheme-Growth Option,69.69
2007-06-27,100657,UTI - Master Plus Unit Scheme-Income Option,53.47
2007-06-27,100663,UTI Large & Mid Cap Fund - Regular Plan - IDCW,40.56
2007-06-27,100664,UTI Large & Mid Cap Fund - Regular Plan - Growth Option,46.94
2007-06-27,100668,UTI Flexi Cap Fund - Regular Plan - IDCW,31.92
2007-06-27,100669,UTI - Flexi Cap Fund-Growth Option,34.45
2007-06-27,100676,Benchmark Derivative Fund - Growth Plan,1188.7597
2007-06-27,100678,UTI Children's Hybrid Fund - Regular Plan,13.9263
2007-06-27,100682,UTI Retirement Fund - Regular Plan,18.6903
2007-06-27,100684,UTI Aggressive Hybrid Fund - Regular Plan - Growth,57.77
2007-06-27,100685,UTI Aggressive Hybrid Fund - Regular Plan - IDCW,20.55
2007-06-27,100711,UTI - INDEX SELECT FUND-Income Option,24.38
2007-06-27,100712,UTI - INDEX SELECT FUND-Growth Option,36.11
2007-06-27,100715,DBS Chola Multi-Cap Fund-Dividend Option,14.99
2007-06-27,100716,DBS Chola Multi-Cap Fund-Cumulative Option,18.8
2007-06-27,100723,UTI MMF-Discontinued - Regular Plan -Growth,21.4621
2007-06-27,100724,UTI MMF- Discontinued - Regular Plan - Flexi Dividend Option,17.8031
2007-06-27,100725,UTI MMF- Discontinued - Regular Plan - Periodic Dividend Option,17.6818
2007-06-27,100739,UTI MNC Fund - Regular Plan - IDCW,28.59
2007-06-27,100740,UTI - MNC Fund - Regular Plan - Growth Option,38.14
2007-06-27,100741,UTI Medium to Long Duration Fund- Regular Plan - Growth,21.9586
2007-06-27,100742,UTI Medium to Long Duration Fund - Regular Plan - Quarterly IDCW,11.0014
2007-06-27,100748,UTI - Master Index Fund-Income Option,45.3656
2007-06-27,100749,UTI - Master Index Fund-Growth Option,45.3657
2007-06-27,100750,UTI - Master Value Fund-Income Option,20.52
2007-06-27,100751,UTI - Master Value Fund-Growth Option,31.5
2007-06-27,100780,Sundaram Banking & PSU Fund (Formerly Known as Sundaram Banking and PSU Debt Fund) Retail Plan - Monthly Income Distribution cum Capital Withdrawal (IDCW),10.2384
2007-06-27,100781,Sundaram Banking & PSU Fund (Formerly Known as Sundaram Banking and PSU Debt Fund) Retail Plan - Growth,11.5612
2007-06-27,100782,Sundaram Banking & PSU Fund (Formerly Known as Sundaram Banking and PSU Debt Fund) Regular Plan - Daily Reinvestment of Income Distribution cum Capital Withdrawal (IDCW),10.0519
2007-06-27,100784,Sundaram Banking & PSU Fund (Formerly Known as Sundaram Banking and PSU Debt Fund) Regular Plan - Growth,11.7131
2007-06-27,100785,Sundaram Corporate Bond Fund Regular Plan -Income Distribution cum Capital Withdrawal(IDCW),10.2801
