date,scheme_code,scheme_name,nav
2007-12-27,100027,Grindlays Super Saver Income Fund-GSSIF-Half Yearly Dividend,10.77
2007-12-27,100028,Grindlays Super Saver Income Fund-GSSIF-Quaterly Dividend,10.6781
2007-12-27,100029,Grindlays Super Saver Income Fund-GSSIF-Growth,18.199
2007-12-27,100030,Grindlays Super Saver Income Fund-GSSIF-Annual Dividend,11.0049
2007-12-27,100031,Grindlays Super Saver Income Fund-GSSIF - ST-Dividend,10.1128
2007-12-27,100032,Grindlays Super Saver Income Fund-GSSIF - ST-Growth,15.8928
2007-12-27,100033,Aditya Birla Sun Life Large & Mid Cap Fund - Regular Growth,189.19
2007-12-27,100034,Aditya Birla Sun Life Large & Mid Cap Fund -Regular - IDCW,135.77
2007-12-27,100035,Birla Sun Life Freedom Fund-Plan A (Dividend),24.19
2007-12-27,100036,Birla Sun Life Freedom Fund-Plan B (Growth),36.38
2007-12-27,100037,Aditya Birla Sun Life Income Fund - Regular - Quarterly IDCW,10.613
2007-12-27,100038,Aditya Birla Sun Life Income Fund - Growth - Regular Plan,33.9341
2007-12-27,100041,Aditya Birla Sun Life Liquid Fund -Institutional - IDCW,10.8023
2007-12-27,100042,Aditya Birla Sun Life Liquid Fund-Retail (Growth),21.3079
2007-12-27,100043,Aditya Birla Sun Life Liquid Fund-Institutional (Growth),21.4749
2007-12-27,100044,Aditya Birla Sun Life Liquid Fund -Retail - IDCW,16.3694
2007-12-27,100046,Aditya Birla Sun Life Liquid Fund -Daily IDCW,10.0195
2007-12-27,100047,Aditya Birla Sun Life Liquid Fund - Growth,12.6332
2007-12-27,100048,Aditya Birla Sun Life Liquid Fund -Institutional - weekly  IDCW,10.8242
2007-12-27,100049,Aditya Birla Sun Life Cash Plus-Institutional - Fortnightly Dividend,10.8531
2007-12-27,100051,Aditya Birla Sun Life Liquid Fund -weekly IDCW,10.039
2007-12-27,100052,Aditya Birla Sun Life Cash Plus-Institutional Premium - Fortnightly Dividend,10.0
2007-12-27,100053,Aditya Birla Sun Life Cash Plus-Institutional Premium Plan-Monthly Dividend,10.0613
2007-12-27,100054,Aditya Birla Sun Life Gilt Plus - Liquid Plan - Quarterly Dividend - Regular Plan,10.5079
2007-12-27,100055,Aditya Birla Sun Life Gilt Plus - Liquid Plan - Growth - Regular Plan,19.0288
2007-12-27,100056,Aditya Birla Sun Life Gilt Plus - Liquid Plan - Annual Dividend - Regular Plan,11.7828
2007-12-27,100057,Aditya Birla Sun Life Govenment Securities Fund -Regular - Quarterly IDCW,10.4858
2007-12-27,100058,Aditya Birla Sun Life Government Securities Fund  - Growth - Regular Plan,22.0249
2007-12-27,100059,Aditya Birla Sun Life Gilt Plus-PF Plan (Annual Dividend),20.4546
2007-12-27,100060,Aditya Birla Sun Life Constant Maturity 10 Year Gilt Fund - Quarterly Dividend - Regular Plan,11.2176
2007-12-27,100061,Aditya Birla Sun Life Constant Maturity 10 Year Gilt Fund - Growth - Regular Plan,25.4198
2007-12-27,100062,Aditya Birla Sun Life Gilt Plus-Regular Plan (Annual Dividend),23.6916
2007-12-27,100063,Aditya Birla Sun Life MNC Fund - Regular - IDCW,74.21
2007-12-27,100064,Aditya Birla Sun Life MNC Fund - Growth - Regular Plan,148.04
2007-12-27,100065,Aditya Birla Sun Life India Opportunities Fund - Dividend - Regular Plan,26.46
2007-12-27,100066,Aditya Birla Sun Life India Opportunities Fund - Growth - Regular Plan,61.61
2007-12-27,100067,Aditya Birla Sun Life Tax Plan -Regular - IDCW,86.79
2007-12-27,100068,BARODA ELSS 96 - Plan A - IDCW,30.15
2007-12-27,100069,BARODA PIONEER DIVERSIFIED FUND,49.37
2007-12-27,100077,DSP Bond Fund - IDCW,10.8067
2007-12-27,100078,DSP Bond Fund - Growth,26.0286
2007-12-27,100079,DSP Bond Fund - IDCW - Monthly,10.5696
2007-12-27,100080,DSP Flexi Cap Fund - Regular Plan - IDCW,65.308
2007-12-27,100081,DSP Aggressive Hybrid Fund- Regular Plan - Growth,57.139
2007-12-27,100082,DSP Aggressive Hybrid Fund- Regular Plan - IDCW,25.908
2007-12-27,100084,DSP Gilt Fund - Regular Plan - Growth,24.4041
2007-12-27,100085,DSP Gilt Fund - Regular Plan - IDCW,11.6526
2007-12-27,100086,DSP Gilt Fund - Regular Plan - IDCW - Monthly,10.2681
2007-12-27,100087,DSP Savings Fund - Regular Plan - Growth,17.635
2007-12-27,100088,DSP Savings Fund - Regular Plan - IDCW,11.1211
2007-12-27,100089,DSP Savings Fund - Regular Plan - IDCW - Monthly,10.1943
2007-12-27,100090,DSP BlackRock Technology.com   Fund - Regular Plan - Growth,36.057
2007-12-27,100119,HDFC Balanced Advantage Fund - Growth Plan,79.078
2007-12-27,100120,HDFC Balanced Advantage Fund - IDCW Plan,42.928
2007-12-27,100121,HDFC Balanced Fund - Dividend Option,22.744
2007-12-27,100122,HDFC Balanced Fund - Growth Option,40.256
2007-12-27,100123,HDFC Income Fund - Quarterly IDCW Option,10.416
2007-12-27,100124,HDFC Income Fund - Growth Option,17.9013
2007-12-27,100150,Principal Child Benefit Fund-Super Saver-Future Guard Plan,86.92
2007-12-27,100151,Principal Retail Equity Savings Fund - Growth Option,88.08
2007-12-27,100152,Principal Nifty 100 Equal Weight Fund-Income Distribution CUM Capital Withdrawal,33.3078
2007-12-27,100153,Principal Nifty 100 Equal Weight Fund-Growth,42.9621
2007-12-27,100156,Principal Tax Savings Fund,132.62
2007-12-27,100171,Quant Dynamic Bond-Dividend,10.4256
2007-12-27,100172,Quant Dynamic Bond-Growth,24.2113
2007-12-27,100173,Quant Dynamic Bond-Bonus,12.7505
2007-12-27,100174,quant ELSS Tax Saver Fund - IDCW Option - Regular Plan,20.8681
2007-12-27,100175,quant ELSS Tax Saver Fund - Growth Option - Regular Plan,71.7668
2007-12-27,100176,quant Small Cap Fund - IDCW Option - Regular Plan,20.778
2007-12-27,100177,quant Small Cap Fund - Growth - Regular Plan,24.6149
2007-12-27,100178,ING Income Fund-Regular Plan -Dividend Option (Quarterly),10.3133
2007-12-27,100179,ING Income Fund-Regular Plan -Dividend Option (Half Yearly),10.5503
2007-12-27,100180,ING Income Fund- Regular Plan - Dividend Option (Annual),11.0471
2007-12-27,100181,ING Income Fund-Regular Plan -Growth Option,19.4149
2007-12-27,100182,ING Income Fund-Institutional Plan - Dividend Option (Half Yearly),10.0
2007-12-27,100183,ING Income Fund-Institutional Plan - Dividend Option (Quarterly),10.0291
2007-12-27,100184,ING Income Fund-Institutional Plan -Dividend Option (Annual),11.0739
2007-12-27,100185,ING Income Fund-Bonus Option,11.8378
2007-12-27,100186,ING Income Fund-Institutional Bonus Option,12.208
2007-12-27,100187,ING Income Fund-Institutional Plan - Growth Option,20.3931
2007-12-27,100188,ING Core Equity Fund-Dividend Option,22.79
2007-12-27,100189,ING Core Equity Fund-Growth Option,43.13
2007-12-27,100190,ING Liquid Fund-Regular Growth Option,16.7419
2007-12-27,100191,ING Liquid Fund-Regular Weekly Dividend Option,10.831
2007-12-27,100192,ING Liquid Fund-Regular Daily Dividend Option,10.7873
2007-12-27,100194,ING Liquid Fund-Auto Sweep Growth Option,10.0
2007-12-27,100195,ING Liquid Fund-Auto Sweep Weekly Dividend Option,10.0
2007-12-27,100196,ING Liquid Fund-Institutional Growth Option,12.455
2007-12-27,100197,ING Liquid Fund-Institutional Weekly Dividend Option,10.0605
2007-12-27,100198,ING Liquid Fund-Institutional Daily Dividend Option,10.0121
2007-12-27,100199,ING Liquid Fund-Super Institutional Growth Option,11.8043
2007-12-27,100200,ING Liquid Fund-Super Institutional Daily Dividend Option,10.0048
2007-12-27,100201,ING Liquid Fund-Super Institutional Weekly Dividend Option,10.0098
2007-12-27,100202,ING Balanced Fund-Dividend Option,18.4
2007-12-27,100203,ING Balanced Fund-Growth Option,26.3
2007-12-27,100218,JM Large Cap Fund (Regular) - IDCW,25.0905
2007-12-27,100219,JM Large Cap Fund (Regular) - Growth Option,55.8452
2007-12-27,100220,JM Aggressive Hybrid Fund (Regular) - IDCW,25.1439
2007-12-27,100221,JM Aggressive Hybrid Fund (Regular) -Growth Option,33.0818
2007-12-27,100222,JM Medium to Long Duration Fund (Regular) - Quarterly IDCW,10.6797
2007-12-27,100223,JM Medium to Long Duration Fund (Regular) - Growth Option,30.1863
2007-12-27,100233,JM Liquid Fund (Regular) - Weekly IDCW,10.4848
2007-12-27,100234,JM Liquid Fund - Growth Option,21.6659
2007-12-27,100237,JM High Liquidity Fund-- Institutional Plan - Growth,13.0708
2007-12-27,100238,JM High Liquidity Fund-Institutional Plan - Daily Dividend,10.0159
2007-12-27,100241,JM High Liquidity Fund-- Institutional Plan - Dividend,10.2473
2007-12-27,100243,JM High Liquidity Fund-- Premium Plan - Daily Dividend Option,10.0
2007-12-27,100244,JM Liquid Fund (Regular) - Quarterly IDCW,12.4734
2007-12-27,100245,JM High Liquidity Fund-Super Institutional Plan- Daily Dividend,10.0165
2007-12-27,100246,JM High Liquidity Fund-Super Institutional Plan- Weekly  Dividend,10.02
2007-12-27,100247,JM Liquid Fund (Regular) - Super Institutional Plan - Growth Option,12.4291
2007-12-27,100249,JM G-Sec Fund - Quarterly Dividend Option,10.4447
2007-12-27,100250,JM G-Sec Fund - Growth Option,21.8468
2007-12-27,100251,JM G-Sec Fund-PF Plan - Growth Plan,22.7505
2007-12-27,100252,JM G-Sec Fund-PF Plan -Dividend Plan,20.8462
2007-12-27,100253,JM G-Sec Fund - Bonus Option - Principal Units,10.6285
2007-12-27,100254,JM Value Fund (Regular) - Growth Option,38.3613
2007-12-27,100261,Kotak Gilt-Savings-Monthly Dividend,10.4684
2007-12-27,100262,Kotak Gilt-Savings-Growth,19.0027
2007-12-27,100263,Kotak Gilt-Savings-Annual Dividend,12.7076
2007-12-27,100264,Kotak Gilt-Investment Regular-Payout of Income Distribution cum capital withdrawal option,11.9864
2007-12-27,100265,Kotak Gilt-Investment Regular-Growth,24.9193
2007-12-27,100280,Kotak Gilt-Investment  Provident Fund and Trust-Payout of Income Distribution cum capital withdrawal option,11.0022
2007-12-27,100281,Kotak Gilt-Investment  Provident Fund and Trust-Growth,25.3228
2007-12-27,100286,Kotak Aggressive Hybrid Fund - Regular Plan - IDCW - Payout & Reinvestment of Income Distribution cum capital withdrawal option,32.611
2007-12-27,100289,Kotak Tech,10.61
2007-12-27,100290,Kotak MNC,34.775
2007-12-27,100291,Kotak Bond-Deposit-Dividend,12.6039
2007-12-27,100292,Kotak Bond-Deposit-Growth,19.943
2007-12-27,100298,Kotak Bond Regular Plan Quaterly Payout of Income Distribution cum capital withdrawal option,10.6335
2007-12-27,100299,Kotak Bond Fund - Regular Plan Growth,21.2556
2007-12-27,100300,Kotak Bond Fund - Regular Plan - Standard IDCW Option,14.2054
2007-12-27,100301,Kotak Bond Regular Plan Bonus Plan,14.1679
2007-12-27,100312,LIC MF Flexi Cap Fund-Regular Plan-IDCW,13.432
2007-12-27,100313,LIC MF Flexi Cap Fund-Regular Plan-Growth,34.0885
2007-12-27,100314,LIC MF Medium to Long Duration Fund-Regular Plan-IDCW,10.3301
2007-12-27,100315,LIC MF Medium to Long Duration Fund-Regular Plan-Growth,21.4279
2007-12-27,100316,LIC MF Gilt Fund-Regular Plan-IDCW,11.5704
2007-12-27,100317,LIC MF Gilt Fund-Regular Plan-Growth,19.9082
2007-12-27,100318,LIC MF Gilt Fund-PF Plan-IDCW,11.4799
2007-12-27,100319,LIC MF Gilt Fund-PF Plan-Growth,11.4799
2007-12-27,100321,LIC MF Aggressive Hybrid Fund-Regular Plan-IDCW,15.3725
2007-12-27,100323,LIC MF Aggressive Hybrid Fund-Regular Plan-Growth,72.7304
2007-12-27,100325,LIC MF ULIS (5 Yrs. Single Premium)-Regular Plan-IDCW Reinvestment,12.3559
2007-12-27,100332,LIC MF Large Cap Fund-Regular Plan-IDCW,13.4368
2007-12-27,100337,SaharaTax Gain-Dividend,29.3529
2007-12-27,100338,SaharaTax Gain-Growth,33.6615
2007-12-27,100347,Morgan Stanley Growth Fund- Regular Growth Plan,71.18
2007-12-27,100348,ICICI Prudential Large & Mid Cap Fund - IDCW,27.75
2007-12-27,100349,ICICI Prudential Large & Mid Cap Fund - Growth,133.48
2007-12-27,100350,ICICI Prudential Large & Mid Cap Fund - Institutional Option - I - Growth,17.92
2007-12-27,100351,ICICI Prudential FMCG Fund - IDCW,42.16
2007-12-27,100352,ICICI Prudential FMCG Fund - Growth,56.22
2007-12-27,100353,ICICI Prudential ELSS Tax Saver Fund - IDCW,27.62
2007-12-27,100354,ICICI Prudential ELSS Tax Saver Fund - Growth,126.82
2007-12-27,100355,ICICI Prudential Equity & Debt Fund - Monthly IDCW,21.58
2007-12-27,100356,ICICI Prudential Equity & Debt Fund - Growth,46.51
2007-12-27,100357,ICICI Prudential Liquid Fund -Quarterly IDCW,10.951
2007-12-27,100359,ICICI Prudential Liquid Institutional Plus Fund - Div - Daily,11.8515
2007-12-27,100360,ICICI Prudential Liquid Institutional Plus Fund - Div - Weekly,11.8618
2007-12-27,100361,ICICI Prudential Liquid Fund-Dividend-Institutional Plus - Monthly,11.9882
2007-12-27,100362,ICICI Prudential Liquid Institutional Plus Fund - Growth,19.7393
2007-12-27,100363,ICICI Prudential Technology Fund - Growth,16.2
2007-12-27,100364,ICICI Prudential Long Term Bond Fund - Half Yearly IDCW,10.8098
2007-12-27,100365,ICICI Prudential Long Term Bond Fund - Growth,23.3916
2007-12-27,100366,ICICI Prudential Long Term Bond Fund-Institutional Quarterly Dividend,10.7083
2007-12-27,100367,ICICI Prudential Long Term Bond Fund - Quarterly IDCW,11.5372
2007-12-27,100368,ICICI Prudential Gilt Fund - IDCW,11.1781
2007-12-27,100369,ICICI Prudential Gilt Fund - Growth,24.2863
2007-12-27,100370,ICICI Prudential Short Term Gilt Fund - Dividend,10.7053
2007-12-27,100371,ICICI Prudential Short Term Gilt Fund - Growth,19.1642
2007-12-27,100372,ICICI Prudential Short Term Gilt Fund - Half Yearly Dividend,10.4266
2007-12-27,100375,NIPPON INDIA GROWTH MID CAP FUND - IDCW Option,78.91
2007-12-27,100376,Nippon India Growth Mid Cap Fund-Growth Plan-Bonus Option,75.82
2007-12-27,100377,Nippon India Growth Mid Cap Fund-Growth Plan-Growth Option,457.13
2007-12-27,100378,Nippon India Vision Large & Midcap Fund - IDCW Option,69.33
2007-12-27,100379,Nippon India Vision Large & Midcap Fund-GROWTH PLAN-Bonus Option,47.59
2007-12-27,100380,Nippon India Vision Large & Midcap Fund-GROWTH PLAN-Growth Option,284.03
2007-12-27,100383,NIPPON INDIA MEDIUM TO LONG DURATION FUND - MONTHLY IDCW Option,10.9111
2007-12-27,100384,NIPPON INDIA MEDIUM TO LONG DURATION  FUND - QUARTERLY IDCW Option,12.8333
2007-12-27,100385,NIPPON INDIA MEDIUM TO LONG DURATION  FUND - HALF YEARLY IDCW Option,11.863
2007-12-27,100386,NIPPON INDIA MEDIUM TO LONG DURATION  FUND - ANNUAL IDCW Option,13.3963
2007-12-27,100387,Nippon India Medium to Long Duration  Fund - Growth Plan Growth Option,25.1744
2007-12-27,100388,Nippon India Medium to Long Duration  Fund - Growth Plan Bonus Option,11.8658
2007-12-27,100414,Tata Aggressive Hybrid Fund- Regular Plan - Growth Option,75.0803
2007-12-27,100415,Tata Ethical Fund-Regular Plan - Growth Option,77.9252
2007-12-27,100416,Tata Long Term Debt Fund - Regular Plan - Quarterly Dividend,10.5161
2007-12-27,100417,Tata Income Fund-Regular Plan - Half Yearly Payout of IDCW Option,11.2242
2007-12-27,100418,Tata Income Fund -Regular Plan - Growth Option,26.6836
2007-12-27,100470,Franklin India Large Cap Fund - IDCW,55.0783
2007-12-27,100471,Franklin India Large Cap Fund-Growth,191.0861
2007-12-27,100472,Franklin India Mid Cap Fund - IDCW,76.373
2007-12-27,100473,Franklin India Mid Cap Fund-Growth,302.0412
2007-12-27,100474,Tata ELSS Fund- Regular Plan - Payout of IDCW Option,61.0024
2007-12-27,100475,Tata Large Cap Fund -Regular Plan - Growth Option,97.2717
2007-12-27,100476,Taurus Flexi Cap Fund - Regular Plan - Growth,77.51
2007-12-27,100477,Taurus Mid Cap Fund - Regular Plan - Growth,30.6
2007-12-27,100480,Taurus ELSS Tax Saver Fund - Regular Plan - Growth,34.9
2007-12-27,100484,Franklin India Index Fund- NSE Nifty 50 Index Fund - Growth,48.1511
2007-12-27,100485,Franklin India Govt.Sec. Fund-Composite Plan - Growth,25.4925
2007-12-27,100486,Franklin India Govt.Sec. Fund-Composite Plan - Dividend,10.8314
2007-12-27,100487,Franklin India Govt.Sec. Fund-Treasury Plan(Dividend Option),10.6422
2007-12-27,100489,Franklin India Govt.Sec. Fund-Treasury Plan(Growth Option),14.5968
2007-12-27,100490,Franklin India Govt.Sec. Fund-PF Plan - Growth,11.1971
2007-12-27,100491,Franklin India Govt.Sec. Fund-PF Plan - Dividend,11.1971
2007-12-27,100493,Franklin India Government Securities Fund - Growth,17.4656
2007-12-27,100494,Franklin India Government Securities Fund - IDCW,10.7269
2007-12-27,100495,Franklin India Govt.Sec. Fund-Long Term Plan - Bonus,11.6374
2007-12-27,100498,Franklin India Dynamic Accrual Fund - IDCW,10.8027
2007-12-27,100499,Franklin India Dynamic Accrual Fund-Growth,27.9193
2007-12-27,100503,Franklin India Low Duration Fund - Monthly - IDCW,10.5233
2007-12-27,100504,Franklin India Low Duration Fund - Quarterly - IDCW,10.5617
2007-12-27,100505,Templeton Monthly Income Plan-Half Yearly Dividend,12.8744
2007-12-27,100506,Templeton Monthly Income Plan-Growth,22.6936
2007-12-27,100519,Franklin India Flexi Cap Fund - IDCW,46.6387
2007-12-27,100520,Franklin India Flexi Cap Fund - Growth,208.0367
2007-12-27,100521,Franklin India Technology Fund - IDCW,19.2524
2007-12-27,100522,Franklin India Technology Fund-Growth,46.7526
2007-12-27,100523,Franklin FMCG Fund - Growth,41.5226
2007-12-27,100524,Franklin INDIA OPPORTUNITIES FUND - IDCW,19.595
2007-12-27,100525,Franklin India ELSS Tax Saver Fund - IDCW,40.5279
2007-12-27,100526,Franklin India ELSS Tax Saver Fund-Growth,192.8646
2007-12-27,100527,Franklin India Corporate Debt Fund - Plan A - Annual - IDCW,11.0159
2007-12-27,100528,Franklin India Corporate Debt Fund - Growth,26.5951
2007-12-27,100529,Franklin India Corporate Debt Fund - Plan B - Monthly - IDCW,12.8084
2007-12-27,100530,Franklin India Corporate Debt Fund - Plan B - Quarterly - IDCW,13.5929
2007-12-27,100531,Franklin India Corporate Debt Fund - Plan B - Half yearly - IDCW,13.4605
2007-12-27,100532,Franklin India Corporate Debt Fund - Monthly Bonus,18.1805
2007-12-27,100535,Franklin India Retirement Fund - IDCW,18.022
2007-12-27,100536,Franklin India Retirement Fund - Growth,54.4756
2007-12-27,100537,Franklin India Liquid Fund - Regular Plan - Weekly - IDCW,1245.4605
2007-12-27,100538,Franklin India Liquid Fund - Regular Plan - Growth,1967.2279
2007-12-27,100541,Franklin India Liquid Fund - Regular Plan - Daily - IDCW,1512.34
2007-12-27,100542,Franklin India Liquid Fund - Liquid Plan - Weekly Dividend,1001.461
2007-12-27,100543,Franklin India Liquid Fund - Liquid Plan - Daily IDCW,1000.25
2007-12-27,100544,Franklin India Liquid Fund - Liquid Plan - Growth,1207.6867
2007-12-27,100546,Franklin India Liquid Fund - Super Institutional Plan - Growth,1174.1917
2007-12-27,100547,Franklin India Liquid Fund - Super Institutional Plan - Daily - IDCW,1000.25
2007-12-27,100548,Franklin India Liquid Fund - Super Institutional Plan - Weekly - IDCW,1017.1193
2007-12-27,100549,Franklin India Aggressive Hybrid Fund - IDCW,28.8188
2007-12-27,100550,Franklin India Aggressive Hybrid Fund - Growth Plan,46.0694
2007-12-27,100551,Templeton India Children’s Asset Plan-Education Plan,28.5796
2007-12-27,100552,Templeton India Children’s Asset Plan-Gift Plan - Growth,40.6806
2007-12-27,100553,Templeton India Children’s Asset Plan-Gift Plan - Dividend,40.6806
2007-12-27,100557,Franklin India Taxshield 98,181.6166
2007-12-27,100558,Franklin India Taxshield 99,91.4435
2007-12-27,100561,Templeton India Money Market Account - Bonus Plan,1.0
2007-12-27,100563,DBS Chola Triple Ace-Regular -Cumulative,24.5754
2007-12-27,100567,DBS Chola Triple Ace-Regular - Quarterly Dividend,11.5712
2007-12-27,100569,DBS Chola Triple Ace-Semi Annual Dividend,10.4226
2007-12-27,100573,DBS Chola Triple Ace-Regular Bonus,13.6551
2007-12-27,100574,DBS Chola Freedom Income -Short Term Fund-Regular-Monthly Dividend,10.9884
2007-12-27,100575,DBS Chola Freedom Income -Short Term Fund-Regular - Cumulative,12.5709
2007-12-27,100576,DBS Chola Freedom Income -Short Term Fund-Cum- Institutional Plan,12.7206
2007-12-27,100579,DBS Chola Gilt-Investment-Quarterly Dividend,10.7918
2007-12-27,100580,DBS Chola Gilt-Investment-Cumulative,19.6209
2007-12-27,100589,Canara Robeco Expo-Income Plan,19.56
2007-12-27,100590,Canara Robeco Expo-Growth Plan,67.72
2007-12-27,100593,CANARA ROBECO ELSS TAX SAVER - REGULAR PLAN -IDCW (Payout),25.33
2007-12-27,100596,CANARA ROBECO GILT FUND - REGULAR PLAN - IDCW (Payout/Reinvestment),10.511
2007-12-27,100597,CANARA ROBECO GILT FUND - REGULAR PLAN - GROWTH OPTION,19.6735
2007-12-27,100600,CANARA ROBECO CONSERVATIVE HYBRID FUND - REGULAR PLAN - MONTHLY IDCW (Payout/Reinvestment),12.73
2007-12-27,100601,CANARA ROBECO CONSERVATIVE HYBRID FUND - REGULAR PLAN - GROWTH OPTION,23.56
2007-12-27,100602,Sundaram Medium Duration Fund (Formerly Known as Sundaram Medium Term Bond Fund) Regular Plan-Income Distribution cum Capital Withdrawal(IDCW),10.3982
2007-12-27,100603,Sundaram Medium Duration Fund (Formerly Known as Sundaram Medium Term Bond Fund) Regular Plan - Growth,24.0917
2007-12-27,100604,Sundaram Medium Duration Fund (Formerly Known as Sundaram Medium Term Bond Fund) Regular Plan -Growth,12.6822
2007-12-27,100605,Sundaram Medium Duration Fund (Formerly Known as Sundaram Medium Term Bond Fund) Institutional Plan- Income Distribution cum Capital Withdrawal(IDCW ),10.4164
2007-12-27,100609,Sundaram Medium Duration Fund (Formerly Known as Sundaram Medium Term Bond Fund) Regular Plan- Income Distribution cum Capital Withdrawal(IDCW),10.3074
2007-12-27,100610,Sundaram Medium Duration Fund (Formerly Known as Sundaram Medium Term Bond Fund) Regular Plan -Income Distribution cum Capital Withdrawal (IDCW),10.5549
2007-12-27,100611,Sundaram Medium Duration Fund (Formerly Known as Sundaram Medium Term Bond Fund) Institutional Plan -Growth,12.4057
2007-12-27,100612,Sundaram Growth Fund-Dividend,18.0908
2007-12-27,100613,Sundaram Growth Fund-Growth,114.0943
2007-12-27,100614,Sundaram Value Fund Regular Plan - Income Distribution cum Capital Withdrawal (IDCW),21.7769
2007-12-27,100617,Sundaram Equity Hybrid Fund Regular Plan - Growth,45.772
2007-12-27,100618,Sundaram Money Fund Retail Plan - Growth,16.5499
2007-12-27,100619,Sundaram Money Fund Retail Plan - Quarterly Reinvestment of Income Distribution cum Capital Withdrawal (IDCW),10.4279
2007-12-27,100620,Sundaram Money Fund Retail Plan - Daily Reinvestment of Income Distribution cum Capital Withdrawal (IDCW),10.0953
2007-12-27,100621,Sundaram Money Fund Retail Plan - Weekly Reinvestment of Income Distribution cum Capital Withdrawal (IDCW),10.4841
2007-12-27,100622,Sundaram Money Fund Retail Plan - Fortnightly Reinvestment of Income Distribution cum Capital Withdrawal (IDCW),10.3417
2007-12-27,100623,Sundaram Money Fund Retail Plan - Monthly Income Distribution cum Capital Withdrawal (IDCW),10.2183
2007-12-27,100630,quant Multi Cap Fund-IDCW Option - Regular Plan,22.0442
2007-12-27,100631,quant Multi Cap Fund-GROWTH OPTION - Regular Plan,93.9924
2007-12-27,100638,SBI Medium to Long Duration Fund - Regular Plan - Half Yearly - Income Distribution cum Capital Withdrawal Option (IDCW),10.2733
2007-12-27,100639,SBI Medium to Long Duration Fund-REGULAR PLAN-Growth,20.8723
2007-12-27,100640,SBI Medium to Long Duration Fund-REGULAR PLAN-Bonus,12.6425
2007-12-27,100641,SBI ULTRA SHORT DURATION FUND - REGULAR PLAN - GROWTH,17.7319
2007-12-27,100643,SBI Technology Opportunities Fund - Regular Plan - Income Distribution cum Capital Withdrawal Option (IDCW),24.23
2007-12-27,100644,SBI Healthcare Opportunities Fund - Regular Plan - Income Distribution cum Capital Withdrawal Option (IDCW),29.43
2007-12-27,100645,SBI Consumption Opportunities Fund - Regular Plan - Income Distribution cum Capital Withdrawal Option (IDCW),17.39
2007-12-27,100646,UTI - Unit Linked Insurance Plan,17.7513
2007-12-27,100648,UTI - CRTS 81 - Dividend Option,121.6534
2007-12-27,100650,UTI Large Cap Fund - Regular Plan - IDCW,40.52
2007-12-27,100651,UTI Large Cap Fund - Regular Plan - Growth Option,54.9
2007-12-27,100656,UTI - Master Plus Unit Scheme-Growth Option,96.66
2007-12-27,100657,UTI - Master Plus Unit Scheme-Income Option,74.08
2007-12-27,100663,UTI Large & Mid Cap Fund - Regular Plan - IDCW,58.6
2007-12-27,100664,UTI Large & Mid Cap Fund - Regular Plan - Growth Option,67.83
2007-12-27,100668,UTI Flexi Cap Fund - Regular Plan - IDCW,43.41
2007-12-27,100669,UTI - Flexi Cap Fund-Growth Option,47.05
2007-12-27,100678,UTI Children's Hybrid Fund - Regular Plan,16.0659
2007-12-27,100682,UTI Retirement Fund - Regular Plan,21.6955
2007-12-27,100684,UTI Aggressive Hybrid Fund - Regular Plan - Growth,74.61
2007-12-27,100685,UTI Aggressive Hybrid Fund - Regular Plan - IDCW,26.53
2007-12-27,100711,UTI - INDEX SELECT FUND-Income Option,34.21
2007-12-27,100712,UTI - INDEX SELECT FUND-Growth Option,50.74
2007-12-27,100715,DBS Chola Multi-Cap Fund-Dividend Option,19.51
2007-12-27,100716,DBS Chola Multi-Cap Fund-Cumulative Option,24.48
2007-12-27,100723,UTI MMF-Discontinued - Regular Plan -Growth,22.214
2007-12-27,100724,UTI MMF- Discontinued - Regular Plan - Flexi Dividend Option,17.9607
2007-12-27,100725,UTI MMF- Discontinued - Regular Plan - Periodic Dividend Option,17.8521
2007-12-27,100739,UTI MNC Fund - Regular Plan - IDCW,33.57
2007-12-27,100740,UTI - MNC Fund - Regular Plan - Growth Option,44.8
2007-12-27,100741,UTI Medium to Long Duration Fund- Regular Plan - Growth,23.2505
2007-12-27,100742,UTI Medium to Long Duration Fund - Regular Plan - Quarterly IDCW,11.3118
2007-12-27,100748,UTI - Master Index Fund-Income Option,63.256
2007-12-27,100749,UTI - Master Index Fund-Growth Option,63.256
2007-12-27,100750,UTI - Master Value Fund-Income Option,30.6
2007-12-27,100751,UTI - Master Value Fund-Growth Option,47.02
2007-12-27,100780,Sundaram Banking & PSU Fund (Formerly Known as Sundaram Banking and PSU Debt Fund) Retail Plan - Monthly Income Distribution cum Capital Withdrawal (IDCW),10.2518
2007-12-27,100781,Sundaram Banking & PSU Fund (Formerly Known as Sundaram Banking and PSU Debt Fund) Retail Plan - Growth,11.9851
2007-12-27,100782,Sundaram Banking & PSU Fund (Formerly Known as Sundaram Banking and PSU Debt Fund) Regular Plan - Daily Reinvestment of Income Distribution cum Capital Withdrawal (IDCW),10.0519
2007-12-27,100784,Sundaram Banking & PSU Fund (Formerly Known as Sundaram Banking and PSU Debt Fund) Regular Plan - Growth,12.1765
2007-12-27,100785,Sundaram Corporate Bond Fund Regular Plan -Income Distribution cum Capital Withdrawal(IDCW),10.3056
2007-12-27,100786,Sundaram Corporate Bond Fund Regular Plan - Income Distribution cum Capital Withdrawal (IDCW ),10.4284
