date,scheme_code,scheme_name,nav
2007-05-07,100027,Grindlays Super Saver Income Fund-GSSIF-Half Yearly Dividend,10.231
2007-05-07,100028,Grindlays Super Saver Income Fund-GSSIF-Quaterly Dividend,10.244
2007-05-07,100029,Grindlays Super Saver Income Fund-GSSIF-Growth,16.9645
2007-05-07,100030,Grindlays Super Saver Income Fund-GSSIF-Annual Dividend,10.2585
2007-05-07,100031,Grindlays Super Saver Income Fund-GSSIF - ST-Dividend,10.0635
2007-05-07,100032,Grindlays Super Saver Income Fund-GSSIF - ST-Growth,14.9373
2007-05-07,100033,Aditya Birla Sun Life Large & Mid Cap Fund - Regular Growth,125.06
2007-05-07,100034,Aditya Birla Sun Life Large & Mid Cap Fund -Regular - IDCW,89.72
2007-05-07,100035,Birla Sun Life Freedom Fund-Plan A (Dividend),18.82
2007-05-07,100036,Birla Sun Life Freedom Fund-Plan B (Growth),28.31
2007-05-07,100037,Aditya Birla Sun Life Income Fund - Regular - Quarterly IDCW,10.1125
2007-05-07,100038,Aditya Birla Sun Life Income Fund - Growth - Regular Plan,30.4907
2007-05-07,100041,Aditya Birla Sun Life Liquid Fund -Institutional - IDCW,10.8023
2007-05-07,100042,Aditya Birla Sun Life Liquid Fund-Retail (Growth),20.3334
2007-05-07,100043,Aditya Birla Sun Life Liquid Fund-Institutional (Growth),20.4794
2007-05-07,100044,Aditya Birla Sun Life Liquid Fund -Retail - IDCW,16.3694
2007-05-07,100046,Aditya Birla Sun Life Liquid Fund -Daily IDCW,10.0195
2007-05-07,100047,Aditya Birla Sun Life Liquid Fund - Growth,12.0343
2007-05-07,100048,Aditya Birla Sun Life Liquid Fund -Institutional - weekly  IDCW,10.8146
2007-05-07,100049,Aditya Birla Sun Life Cash Plus-Institutional - Fortnightly Dividend,10.8471
2007-05-07,100051,Aditya Birla Sun Life Liquid Fund -weekly IDCW,10.0301
2007-05-07,100052,Aditya Birla Sun Life Cash Plus-Institutional Premium - Fortnightly Dividend,10.0836
2007-05-07,100053,Aditya Birla Sun Life Cash Plus-Institutional Premium Plan-Monthly Dividend,10.0176
2007-05-07,100054,Aditya Birla Sun Life Gilt Plus - Liquid Plan - Quarterly Dividend - Regular Plan,10.7001
2007-05-07,100055,Aditya Birla Sun Life Gilt Plus - Liquid Plan - Growth - Regular Plan,18.3341
2007-05-07,100056,Aditya Birla Sun Life Gilt Plus - Liquid Plan - Annual Dividend - Regular Plan,11.3526
2007-05-07,100057,Aditya Birla Sun Life Govenment Securities Fund -Regular - Quarterly IDCW,10.4763
2007-05-07,100058,Aditya Birla Sun Life Government Securities Fund  - Growth - Regular Plan,20.7595
2007-05-07,100059,Aditya Birla Sun Life Gilt Plus-PF Plan (Annual Dividend),19.2793
2007-05-07,100060,Aditya Birla Sun Life Constant Maturity 10 Year Gilt Fund - Quarterly Dividend - Regular Plan,11.1103
2007-05-07,100061,Aditya Birla Sun Life Constant Maturity 10 Year Gilt Fund - Growth - Regular Plan,23.5604
2007-05-07,100062,Aditya Birla Sun Life Gilt Plus-Regular Plan (Annual Dividend),21.9586
2007-05-07,100063,Aditya Birla Sun Life MNC Fund - Regular - IDCW,62.98
2007-05-07,100064,Aditya Birla Sun Life MNC Fund - Growth - Regular Plan,125.64
2007-05-07,100065,Aditya Birla Sun Life India Opportunities Fund - Dividend - Regular Plan,22.51
2007-05-07,100066,Aditya Birla Sun Life India Opportunities Fund - Growth - Regular Plan,52.42
2007-05-07,100067,Aditya Birla Sun Life Tax Plan -Regular - IDCW,59.34
2007-05-07,100068,BARODA ELSS 96 - Plan A - IDCW,19.71
2007-05-07,100069,BARODA PIONEER DIVERSIFIED FUND,32.05
2007-05-07,100077,DSP Bond Fund - IDCW,10.6619
2007-05-07,100078,DSP Bond Fund - Growth,25.092
2007-05-07,100079,DSP Bond Fund - IDCW - Monthly,10.4343
2007-05-07,100080,DSP Flexi Cap Fund - Regular Plan - IDCW,40.442
2007-05-07,100081,DSP Aggressive Hybrid Fund- Regular Plan - Growth,39.546
2007-05-07,100082,DSP Aggressive Hybrid Fund- Regular Plan - IDCW,22.943
2007-05-07,100084,DSP Gilt Fund - Regular Plan - Growth,23.0255
2007-05-07,100085,DSP Gilt Fund - Regular Plan - IDCW,11.4259
2007-05-07,100086,DSP Gilt Fund - Regular Plan - IDCW - Monthly,10.103
2007-05-07,100087,DSP Savings Fund - Regular Plan - Growth,17.0044
2007-05-07,100088,DSP Savings Fund - Regular Plan - IDCW,11.0167
2007-05-07,100089,DSP Savings Fund - Regular Plan - IDCW - Monthly,10.0854
2007-05-07,100090,DSP BlackRock Technology.com   Fund - Regular Plan - Growth,27.077
2007-05-07,100119,HDFC Balanced Advantage Fund - Growth Plan,48.843
2007-05-07,100120,HDFC Balanced Advantage Fund - IDCW Plan,26.516
2007-05-07,100121,HDFC Balanced Fund - Dividend Option,17.455
2007-05-07,100122,HDFC Balanced Fund - Growth Option,30.893
2007-05-07,100123,HDFC Income Fund - Quarterly IDCW Option,10.1654
2007-05-07,100124,HDFC Income Fund - Growth Option,16.6286
2007-05-07,100150,Principal Child Benefit Fund-Super Saver-Future Guard Plan,58.33
2007-05-07,100151,Principal Retail Equity Savings Fund - Growth Option,59.12
2007-05-07,100152,Principal Nifty 100 Equal Weight Fund-Income Distribution CUM Capital Withdrawal,22.7047
2007-05-07,100153,Principal Nifty 100 Equal Weight Fund-Growth,29.3473
2007-05-07,100156,Principal Tax Savings Fund,79.0
2007-05-07,100171,Quant Dynamic Bond-Dividend,10.0834
2007-05-07,100172,Quant Dynamic Bond-Growth,22.7687
2007-05-07,100173,Quant Dynamic Bond-Bonus,11.9922
2007-05-07,100174,quant ELSS Tax Saver Fund - IDCW Option - Regular Plan,13.1245
2007-05-07,100175,quant ELSS Tax Saver Fund - Growth Option - Regular Plan,45.1433
2007-05-07,100176,quant Small Cap Fund - IDCW Option - Regular Plan,16.9549
2007-05-07,100177,quant Small Cap Fund - Growth - Regular Plan,20.0857
2007-05-07,100178,ING Income Fund-Regular Plan -Dividend Option (Quarterly),10.1867
2007-05-07,100179,ING Income Fund-Regular Plan -Dividend Option (Half Yearly),10.2549
2007-05-07,100180,ING Income Fund- Regular Plan - Dividend Option (Annual),10.3977
2007-05-07,100181,ING Income Fund-Regular Plan -Growth Option,18.2735
2007-05-07,100182,ING Income Fund-Institutional Plan - Dividend Option (Half Yearly),10.0
2007-05-07,100183,ING Income Fund-Institutional Plan - Dividend Option (Quarterly),10.0
2007-05-07,100184,ING Income Fund-Institutional Plan -Dividend Option (Annual),10.353
2007-05-07,100185,ING Income Fund-Bonus Option,11.1419
2007-05-07,100186,ING Income Fund-Institutional Bonus Option,11.4132
2007-05-07,100187,ING Income Fund-Institutional Plan - Growth Option,19.0656
2007-05-07,100188,ING Core Equity Fund-Dividend Option,14.46
2007-05-07,100189,ING Core Equity Fund-Growth Option,27.35
2007-05-07,100190,ING Liquid Fund-Regular Growth Option,16.0049
2007-05-07,100191,ING Liquid Fund-Regular Weekly Dividend Option,10.8412
2007-05-07,100192,ING Liquid Fund-Regular Daily Dividend Option,10.7873
2007-05-07,100194,ING Liquid Fund-Auto Sweep Growth Option,10.0
2007-05-07,100195,ING Liquid Fund-Auto Sweep Weekly Dividend Option,10.0
2007-05-07,100196,ING Liquid Fund-Institutional Growth Option,11.8794
2007-05-07,100197,ING Liquid Fund-Institutional Weekly Dividend Option,10.0702
2007-05-07,100198,ING Liquid Fund-Institutional Daily Dividend Option,10.0121
2007-05-07,100199,ING Liquid Fund-Super Institutional Growth Option,11.2475
2007-05-07,100200,ING Liquid Fund-Super Institutional Daily Dividend Option,10.0048
2007-05-07,100201,ING Liquid Fund-Super Institutional Weekly Dividend Option,10.0
2007-05-07,100202,ING Balanced Fund-Dividend Option,13.1
2007-05-07,100203,ING Balanced Fund-Growth Option,18.72
2007-05-07,100218,JM Large Cap Fund (Regular) - IDCW,16.15
2007-05-07,100219,JM Large Cap Fund (Regular) - Growth Option,35.93
2007-05-07,100220,JM Aggressive Hybrid Fund (Regular) - IDCW,17.89
2007-05-07,100221,JM Aggressive Hybrid Fund (Regular) -Growth Option,23.55
2007-05-07,100222,JM Medium to Long Duration Fund (Regular) - Quarterly IDCW,10.2249
2007-05-07,100223,JM Medium to Long Duration Fund (Regular) - Growth Option,28.9009
2007-05-07,100233,JM Liquid Fund (Regular) - Weekly IDCW,10.4294
2007-05-07,100234,JM Liquid Fund - Growth Option,20.7741
2007-05-07,100237,JM High Liquidity Fund-- Institutional Plan - Growth,12.5331
2007-05-07,100238,JM High Liquidity Fund-Institutional Plan - Daily Dividend,10.0159
2007-05-07,100241,JM High Liquidity Fund-- Institutional Plan - Dividend,10.1932
2007-05-07,100243,JM High Liquidity Fund-- Premium Plan - Daily Dividend Option,10.0
2007-05-07,100244,JM Liquid Fund (Regular) - Quarterly IDCW,11.9601
2007-05-07,100245,JM High Liquidity Fund-Super Institutional Plan- Daily Dividend,10.0165
2007-05-07,100246,JM High Liquidity Fund-Super Institutional Plan- Weekly  Dividend,10.0
2007-05-07,100247,JM Liquid Fund (Regular) - Super Institutional Plan - Growth Option,11.9174
2007-05-07,100249,JM G-Sec Fund - Quarterly Dividend Option,10.1691
2007-05-07,100250,JM G-Sec Fund - Growth Option,21.2731
2007-05-07,100251,JM G-Sec Fund-PF Plan - Growth Plan,22.0233
2007-05-07,100252,JM G-Sec Fund-PF Plan -Dividend Plan,20.18
2007-05-07,100253,JM G-Sec Fund - Bonus Option - Principal Units,10.3481
2007-05-07,100254,JM Value Fund (Regular) - Growth Option,20.84
2007-05-07,100261,Kotak Gilt-Savings-Monthly Dividend,10.4757
2007-05-07,100262,Kotak Gilt-Savings-Growth,18.2788
2007-05-07,100263,Kotak Gilt-Savings-Annual Dividend,12.2236
2007-05-07,100264,Kotak Gilt-Investment Regular-Payout of Income Distribution cum capital withdrawal option,11.355
2007-05-07,100265,Kotak Gilt-Investment Regular-Growth,23.6061
2007-05-07,100280,Kotak Gilt-Investment  Provident Fund and Trust-Payout of Income Distribution cum capital withdrawal option,10.8014
2007-05-07,100281,Kotak Gilt-Investment  Provident Fund and Trust-Growth,23.9275
2007-05-07,100286,Kotak Aggressive Hybrid Fund - Regular Plan - IDCW - Payout & Reinvestment of Income Distribution cum capital withdrawal option,23.816
2007-05-07,100289,Kotak Tech,10.653
2007-05-07,100290,Kotak MNC,28.171
2007-05-07,100291,Kotak Bond-Deposit-Dividend,11.7931
2007-05-07,100292,Kotak Bond-Deposit-Growth,18.6597
2007-05-07,100298,Kotak Bond Regular Plan Quaterly Payout of Income Distribution cum capital withdrawal option,10.3819
2007-05-07,100299,Kotak Bond Fund - Regular Plan Growth,19.6672
2007-05-07,100300,Kotak Bond Fund - Regular Plan - Standard IDCW Option,13.1438
2007-05-07,100301,Kotak Bond Regular Plan Bonus Plan,13.1092
2007-05-07,100312,LIC MF Flexi Cap Fund-Regular Plan-IDCW,11.4945
2007-05-07,100313,LIC MF Flexi Cap Fund-Regular Plan-Growth,20.7766
2007-05-07,100314,LIC MF Medium to Long Duration Fund-Regular Plan-IDCW,10.1867
2007-05-07,100315,LIC MF Medium to Long Duration Fund-Regular Plan-Growth,20.1335
2007-05-07,100316,LIC MF Gilt Fund-Regular Plan-IDCW,11.0734
2007-05-07,100317,LIC MF Gilt Fund-Regular Plan-Growth,19.053
2007-05-07,100318,LIC MF Gilt Fund-PF Plan-IDCW,10.9867
2007-05-07,100319,LIC MF Gilt Fund-PF Plan-Growth,10.9867
2007-05-07,100321,LIC MF Aggressive Hybrid Fund-Regular Plan-IDCW,10.3073
2007-05-07,100323,LIC MF Aggressive Hybrid Fund-Regular Plan-Growth,43.545
2007-05-07,100325,LIC MF ULIS (5 Yrs. Single Premium)-Regular Plan-IDCW Reinvestment,10.8314
2007-05-07,100332,LIC MF Large Cap Fund-Regular Plan-IDCW,10.5433
2007-05-07,100337,SaharaTax Gain-Dividend,18.1058
2007-05-07,100338,SaharaTax Gain-Growth,20.7526
2007-05-07,100347,Morgan Stanley Growth Fund- Regular Growth Plan,50.54
2007-05-07,100348,ICICI Prudential Large & Mid Cap Fund - IDCW,23.27
2007-05-07,100349,ICICI Prudential Large & Mid Cap Fund - Growth,95.04
2007-05-07,100350,ICICI Prudential Large & Mid Cap Fund - Institutional Option - I - Growth,12.65
2007-05-07,100351,ICICI Prudential FMCG Fund - IDCW,31.12
2007-05-07,100352,ICICI Prudential FMCG Fund - Growth,39.11
2007-05-07,100353,ICICI Prudential ELSS Tax Saver Fund - IDCW,21.21
2007-05-07,100354,ICICI Prudential ELSS Tax Saver Fund - Growth,88.35
2007-05-07,100355,ICICI Prudential Equity & Debt Fund - Monthly IDCW,17.07
2007-05-07,100356,ICICI Prudential Equity & Debt Fund - Growth,34.79
2007-05-07,100357,ICICI Prudential Liquid Fund -Quarterly IDCW,10.7888
2007-05-07,100359,ICICI Prudential Liquid Institutional Plus Fund - Div - Daily,11.8515
2007-05-07,100360,ICICI Prudential Liquid Institutional Plus Fund - Div - Weekly,11.872
2007-05-07,100361,ICICI Prudential Liquid Fund-Dividend-Institutional Plus - Monthly,11.949
2007-05-07,100362,ICICI Prudential Liquid Institutional Plus Fund - Growth,18.8054
2007-05-07,100363,ICICI Prudential Technology Fund - Growth,16.37
2007-05-07,100364,ICICI Prudential Long Term Bond Fund - Half Yearly IDCW,10.3376
2007-05-07,100365,ICICI Prudential Long Term Bond Fund - Growth,21.5433
2007-05-07,100366,ICICI Prudential Long Term Bond Fund-Institutional Quarterly Dividend,10.1611
2007-05-07,100367,ICICI Prudential Long Term Bond Fund - Quarterly IDCW,10.9657
2007-05-07,100368,ICICI Prudential Gilt Fund - IDCW,10.6676
2007-05-07,100369,ICICI Prudential Gilt Fund - Growth,22.551
2007-05-07,100370,ICICI Prudential Short Term Gilt Fund - Dividend,10.5552
2007-05-07,100371,ICICI Prudential Short Term Gilt Fund - Growth,18.1121
2007-05-07,100372,ICICI Prudential Short Term Gilt Fund - Half Yearly Dividend,10.2434
2007-05-07,100375,NIPPON INDIA GROWTH MID CAP FUND - IDCW Option,51.09
2007-05-07,100376,Nippon India Growth Mid Cap Fund-Growth Plan-Bonus Option,45.93
2007-05-07,100377,Nippon India Growth Mid Cap Fund-Growth Plan-Growth Option,277.03
2007-05-07,100378,Nippon India Vision Large & Midcap Fund - IDCW Option,47.56
2007-05-07,100379,Nippon India Vision Large & Midcap Fund-GROWTH PLAN-Bonus Option,31.23
2007-05-07,100380,Nippon India Vision Large & Midcap Fund-GROWTH PLAN-Growth Option,186.35
2007-05-07,100383,NIPPON INDIA MEDIUM TO LONG DURATION FUND - MONTHLY IDCW Option,10.9067
2007-05-07,100384,NIPPON INDIA MEDIUM TO LONG DURATION  FUND - QUARTERLY IDCW Option,11.9272
2007-05-07,100385,NIPPON INDIA MEDIUM TO LONG DURATION  FUND - HALF YEARLY IDCW Option,11.1859
2007-05-07,100386,NIPPON INDIA MEDIUM TO LONG DURATION  FUND - ANNUAL IDCW Option,12.1275
2007-05-07,100387,Nippon India Medium to Long Duration  Fund - Growth Plan Growth Option,23.2567
2007-05-07,100388,Nippon India Medium to Long Duration  Fund - Growth Plan Bonus Option,10.9606
2007-05-07,100414,Tata Aggressive Hybrid Fund- Regular Plan - Growth Option,51.959
2007-05-07,100415,Tata Ethical Fund-Regular Plan - Growth Option,48.5929
2007-05-07,100416,Tata Long Term Debt Fund - Regular Plan - Quarterly Dividend,10.3699
2007-05-07,100417,Tata Income Fund-Regular Plan - Half Yearly Payout of IDCW Option,10.8413
2007-05-07,100418,Tata Income Fund -Regular Plan - Growth Option,25.1988
2007-05-07,100470,Franklin India Large Cap Fund - IDCW,38.0037
2007-05-07,100471,Franklin India Large Cap Fund-Growth,131.8527
2007-05-07,100472,Franklin India Mid Cap Fund - IDCW,55.4863
2007-05-07,100473,Franklin India Mid Cap Fund-Growth,199.2706
2007-05-07,100474,Tata ELSS Fund- Regular Plan - Payout of IDCW Option,43.1238
2007-05-07,100475,Tata Large Cap Fund -Regular Plan - Growth Option,62.6989
2007-05-07,100476,Taurus Flexi Cap Fund - Regular Plan - Growth,41.12
2007-05-07,100477,Taurus Mid Cap Fund - Regular Plan - Growth,15.87
2007-05-07,100480,Taurus ELSS Tax Saver Fund - Regular Plan - Growth,17.7
2007-05-07,100481,Franklin India Balanced Fund-Growth,36.3586
2007-05-07,100482,Franklin India Balanced Fund-Div,31.425
2007-05-07,100483,Franklin India Growth Fund,30.7606
2007-05-07,100484,Franklin India Index Fund- NSE Nifty 50 Index Fund - Growth,32.7477
2007-05-07,100485,Franklin India Govt.Sec. Fund-Composite Plan - Growth,24.2733
2007-05-07,100486,Franklin India Govt.Sec. Fund-Composite Plan - Dividend,10.6577
2007-05-07,100487,Franklin India Govt.Sec. Fund-Treasury Plan(Dividend Option),10.59
2007-05-07,100489,Franklin India Govt.Sec. Fund-Treasury Plan(Growth Option),14.0279
2007-05-07,100490,Franklin India Govt.Sec. Fund-PF Plan - Growth,10.6617
2007-05-07,100491,Franklin India Govt.Sec. Fund-PF Plan - Dividend,10.6617
2007-05-07,100493,Franklin India Government Securities Fund - Growth,16.5712
2007-05-07,100494,Franklin India Government Securities Fund - IDCW,10.5712
2007-05-07,100495,Franklin India Govt.Sec. Fund-Long Term Plan - Bonus,11.7676
2007-05-07,100496,Templeton India Value Fund - Growth Plan,69.7083
2007-05-07,100497,Templeton India Value Fund - IDCW,41.215
2007-05-07,100498,Franklin India Dynamic Accrual Fund - IDCW,10.3828
2007-05-07,100499,Franklin India Dynamic Accrual Fund-Growth,25.7636
2007-05-07,100503,Franklin India Low Duration Fund - Monthly - IDCW,10.255
2007-05-07,100504,Franklin India Low Duration Fund - Quarterly - IDCW,10.2352
2007-05-07,100505,Templeton Monthly Income Plan-Half Yearly Dividend,12.1853
2007-05-07,100506,Templeton Monthly Income Plan-Growth,20.0558
2007-05-07,100519,Franklin India Flexi Cap Fund - IDCW,31.9588
2007-05-07,100520,Franklin India Flexi Cap Fund - Growth,142.5555
2007-05-07,100521,Franklin India Technology Fund - IDCW,24.6723
2007-05-07,100522,Franklin India Technology Fund-Growth,53.0266
2007-05-07,100523,Franklin FMCG Fund - Growth,33.764
2007-05-07,100524,Franklin INDIA OPPORTUNITIES FUND - IDCW,15.365
2007-05-07,100525,Franklin India ELSS Tax Saver Fund - IDCW,32.3077
2007-05-07,100526,Franklin India ELSS Tax Saver Fund-Growth,127.5784
2007-05-07,100527,Franklin India Corporate Debt Fund - Plan A - Annual - IDCW,10.2845
2007-05-07,100528,Franklin India Corporate Debt Fund - Growth,24.8286
2007-05-07,100529,Franklin India Corporate Debt Fund - Plan B - Monthly - IDCW,13.1526
2007-05-07,100530,Franklin India Corporate Debt Fund - Plan B - Quarterly - IDCW,13.3932
2007-05-07,100531,Franklin India Corporate Debt Fund - Plan B - Half yearly - IDCW,13.2411
2007-05-07,100532,Franklin India Corporate Debt Fund - Monthly Bonus,18.5969
2007-05-07,100535,Franklin India Retirement Fund - IDCW,16.8665
2007-05-07,100536,Franklin India Retirement Fund - Growth,43.8827
2007-05-07,100537,Franklin India Liquid Fund - Regular Plan - Weekly - IDCW,1244.5883
2007-05-07,100538,Franklin India Liquid Fund - Regular Plan - Growth,1879.7797
2007-05-07,100541,Franklin India Liquid Fund - Regular Plan - Daily - IDCW,1512.34
2007-05-07,100542,Franklin India Liquid Fund - Liquid Plan - Weekly Dividend,1000.7806
2007-05-07,100543,Franklin India Liquid Fund - Liquid Plan - Daily IDCW,1000.25
2007-05-07,100544,Franklin India Liquid Fund - Liquid Plan - Growth,1155.8447
2007-05-07,100546,Franklin India Liquid Fund - Super Institutional Plan - Growth,1118.7638
2007-05-07,100547,Franklin India Liquid Fund - Super Institutional Plan - Daily - IDCW,1000.25
2007-05-07,100548,Franklin India Liquid Fund - Super Institutional Plan - Weekly - IDCW,1016.3694
2007-05-07,100549,Franklin India Aggressive Hybrid Fund - IDCW,23.9775
2007-05-07,100550,Franklin India Aggressive Hybrid Fund - Growth Plan,33.6665
2007-05-07,100551,Templeton India Children’s Asset Plan-Education Plan,25.8776
2007-05-07,100552,Templeton India Children’s Asset Plan-Gift Plan - Growth,31.5802
2007-05-07,100553,Templeton India Children’s Asset Plan-Gift Plan - Dividend,31.5802
2007-05-07,100557,Franklin India Taxshield 98,126.0295
2007-05-07,100558,Franklin India Taxshield 99,71.8996
2007-05-07,100561,Templeton India Money Market Account - Bonus Plan,1.0
2007-05-07,100563,DBS Chola Triple Ace-Regular -Cumulative,24.2767
2007-05-07,100567,DBS Chola Triple Ace-Regular - Quarterly Dividend,11.4305
2007-05-07,100569,DBS Chola Triple Ace-Semi Annual Dividend,11.7475
2007-05-07,100573,DBS Chola Triple Ace-Regular Bonus,13.4891
2007-05-07,100574,DBS Chola Freedom Income -Short Term Fund-Regular-Monthly Dividend,10.9836
2007-05-07,100575,DBS Chola Freedom Income -Short Term Fund-Regular - Cumulative,11.9224
2007-05-07,100576,DBS Chola Freedom Income -Short Term Fund-Cum- Institutional Plan,12.0655
2007-05-07,100579,DBS Chola Gilt-Investment-Quarterly Dividend,10.2965
2007-05-07,100580,DBS Chola Gilt-Investment-Cumulative,18.7203
2007-05-07,100589,Canara Robeco Expo-Income Plan,20.49
2007-05-07,100590,Canara Robeco Expo-Growth Plan,53.84
2007-05-07,100593,CANARA ROBECO ELSS TAX SAVER - REGULAR PLAN -IDCW (Payout),16.24
2007-05-07,100596,CANARA ROBECO GILT FUND - REGULAR PLAN - IDCW (Payout/Reinvestment),10.6207
2007-05-07,100597,CANARA ROBECO GILT FUND - REGULAR PLAN - GROWTH OPTION,18.6091
2007-05-07,100600,CANARA ROBECO CONSERVATIVE HYBRID FUND - REGULAR PLAN - MONTHLY IDCW (Payout/Reinvestment),11.13
2007-05-07,100601,CANARA ROBECO CONSERVATIVE HYBRID FUND - REGULAR PLAN - GROWTH OPTION,19.52
2007-05-07,100602,Sundaram Medium Duration Fund (Formerly Known as Sundaram Medium Term Bond Fund) Regular Plan-Income Distribution cum Capital Withdrawal(IDCW),10.2929
2007-05-07,100603,Sundaram Medium Duration Fund (Formerly Known as Sundaram Medium Term Bond Fund) Regular Plan - Growth,22.9437
2007-05-07,100604,Sundaram Medium Duration Fund (Formerly Known as Sundaram Medium Term Bond Fund) Regular Plan -Growth,12.0768
2007-05-07,100609,Sundaram Medium Duration Fund (Formerly Known as Sundaram Medium Term Bond Fund) Regular Plan- Income Distribution cum Capital Withdrawal(IDCW),10.5414
2007-05-07,100610,Sundaram Medium Duration Fund (Formerly Known as Sundaram Medium Term Bond Fund) Regular Plan -Income Distribution cum Capital Withdrawal (IDCW),10.5432
2007-05-07,100611,Sundaram Medium Duration Fund (Formerly Known as Sundaram Medium Term Bond Fund) Institutional Plan -Growth,11.7596
2007-05-07,100612,Sundaram Growth Fund-Dividend,14.6165
2007-05-07,100613,Sundaram Growth Fund-Growth,66.824
2007-05-07,100614,Sundaram Value Fund Regular Plan - Income Distribution cum Capital Withdrawal (IDCW),13.1271
2007-05-07,100617,Sundaram Equity Hybrid Fund Regular Plan - Growth,33.3317
2007-05-07,100618,Sundaram Money Fund Retail Plan - Growth,15.8569
2007-05-07,100619,Sundaram Money Fund Retail Plan - Quarterly Reinvestment of Income Distribution cum Capital Withdrawal (IDCW),10.3413
2007-05-07,100620,Sundaram Money Fund Retail Plan - Daily Reinvestment of Income Distribution cum Capital Withdrawal (IDCW),10.0953
2007-05-07,100621,Sundaram Money Fund Retail Plan - Weekly Reinvestment of Income Distribution cum Capital Withdrawal (IDCW),10.3746
2007-05-07,100622,Sundaram Money Fund Retail Plan - Fortnightly Reinvestment of Income Distribution cum Capital Withdrawal (IDCW),10.2558
2007-05-07,100623,Sundaram Money Fund Retail Plan - Monthly Income Distribution cum Capital Withdrawal (IDCW),10.1511
2007-05-07,100630,quant Multi Cap Fund-IDCW Option - Regular Plan,13.0794
2007-05-07,100631,quant Multi Cap Fund-GROWTH OPTION - Regular Plan,55.6922
2007-05-07,100638,SBI Medium to Long Duration Fund - Regular Plan - Half Yearly - Income Distribution cum Capital Withdrawal Option (IDCW),10.0578
2007-05-07,100639,SBI Medium to Long Duration Fund-REGULAR PLAN-Growth,19.76
2007-05-07,100640,SBI Medium to Long Duration Fund-REGULAR PLAN-Bonus,11.9693
2007-05-07,100641,SBI ULTRA SHORT DURATION FUND - REGULAR PLAN - GROWTH,16.972
2007-05-07,100643,SBI Technology Opportunities Fund - Regular Plan - Income Distribution cum Capital Withdrawal Option (IDCW),28.75
2007-05-07,100644,SBI Healthcare Opportunities Fund - Regular Plan - Income Distribution cum Capital Withdrawal Option (IDCW),28.83
2007-05-07,100645,SBI Consumption Opportunities Fund - Regular Plan - Income Distribution cum Capital Withdrawal Option (IDCW),13.98
2007-05-07,100646,UTI - Unit Linked Insurance Plan,14.3561
2007-05-07,100648,UTI - CRTS 81 - Dividend Option,110.4452
2007-05-07,100650,UTI Large Cap Fund - Regular Plan - IDCW,28.6
2007-05-07,100651,UTI Large Cap Fund - Regular Plan - Growth Option,35.51
2007-05-07,100656,UTI - Master Plus Unit Scheme-Growth Option,65.72
2007-05-07,100657,UTI - Master Plus Unit Scheme-Income Option,50.45
2007-05-07,100663,UTI Large & Mid Cap Fund - Regular Plan - IDCW,37.98
2007-05-07,100664,UTI Large & Mid Cap Fund - Regular Plan - Growth Option,43.97
2007-05-07,100668,UTI Flexi Cap Fund - Regular Plan - IDCW,30.61
2007-05-07,100669,UTI - Flexi Cap Fund-Growth Option,33.08
2007-05-07,100678,UTI Children's Hybrid Fund - Regular Plan,13.5769
2007-05-07,100682,UTI Retirement Fund - Regular Plan,18.09
2007-05-07,100684,UTI Aggressive Hybrid Fund - Regular Plan - Growth,55.31
2007-05-07,100685,UTI Aggressive Hybrid Fund - Regular Plan - IDCW,19.67
2007-05-07,100711,UTI - INDEX SELECT FUND-Income Option,23.25
2007-05-07,100712,UTI - INDEX SELECT FUND-Growth Option,34.44
2007-05-07,100715,DBS Chola Multi-Cap Fund-Dividend Option,14.75
2007-05-07,100716,DBS Chola Multi-Cap Fund-Cumulative Option,18.5
2007-05-07,100723,UTI MMF-Discontinued - Regular Plan -Growth,21.2486
2007-05-07,100724,UTI MMF- Discontinued - Regular Plan - Flexi Dividend Option,17.7479
2007-05-07,100725,UTI MMF- Discontinued - Regular Plan - Periodic Dividend Option,17.6378
2007-05-07,100739,UTI MNC Fund - Regular Plan - IDCW,29.06
2007-05-07,100740,UTI - MNC Fund - Regular Plan - Growth Option,34.99
2007-05-07,100741,UTI Medium to Long Duration Fund- Regular Plan - Growth,21.7041
2007-05-07,100742,UTI Medium to Long Duration Fund - Regular Plan - Quarterly IDCW,10.8738
2007-05-07,100748,UTI - Master Index Fund-Income Option,43.5082
2007-05-07,100749,UTI - Master Index Fund-Growth Option,43.5083
2007-05-07,100750,UTI - Master Value Fund-Income Option,19.11
2007-05-07,100751,UTI - Master Value Fund-Growth Option,29.33
2007-05-07,100780,Sundaram Banking & PSU Fund (Formerly Known as Sundaram Banking and PSU Debt Fund) Retail Plan - Monthly Income Distribution cum Capital Withdrawal (IDCW),10.1943
2007-05-07,100781,Sundaram Banking & PSU Fund (Formerly Known as Sundaram Banking and PSU Debt Fund) Retail Plan - Growth,11.4427
2007-05-07,100782,Sundaram Banking & PSU Fund (Formerly Known as Sundaram Banking and PSU Debt Fund) Regular Plan - Daily Reinvestment of Income Distribution cum Capital Withdrawal (IDCW),10.0519
2007-05-07,100784,Sundaram Banking & PSU Fund (Formerly Known as Sundaram Banking and PSU Debt Fund) Regular Plan - Growth,11.5842
2007-05-07,100785,Sundaram Corporate Bond Fund Regular Plan -Income Distribution cum Capital Withdrawal(IDCW),10.2462
