date,scheme_code,scheme_name,nav
2006-10-23,100784,Sundaram Banking & PSU Fund (Formerly Known as Sundaram Banking and PSU Debt Fund) Regular Plan - Growth,11.1194
2006-10-23,100785,Sundaram Corporate Bond Fund Regular Plan -Income Distribution cum Capital Withdrawal(IDCW),10.2532
2006-10-23,100786,Sundaram Corporate Bond Fund Regular Plan - Income Distribution cum Capital Withdrawal (IDCW ),10.1977
2006-10-23,100787,Sundaram Corporate Bond Fund Regular Plan-Income Distribution cum Capital Withdrawal (IDCW),10.1985
2006-10-23,100788,Sundaram Corporate Bond Fund Regular Plan- Income Distribution cum Capital Withdrawal (IDCW),10.1948
2006-10-23,100789,Sundaram Corporate Bond Fund Regular Plan- Growth,10.9931
2006-10-23,100790,Sundaram Corporate Bond Fund Institutional Plan - Income Distribution cum Capital Withdrawal (IDCW),10.2544
2006-10-23,100792,Sundaram Corporate Bond Fund Institutional Plan - Growth,10.9909
2006-10-23,100793,Sundaram Banking & PSU Fund (Formerly Known as Sundaram Banking and PSU Debt Fund) Regular Plan - Income Distribution cum Capital Withdrawal (IDCW),10.2191
2006-10-23,100794,Sundaram Small Cap Fund Regular Plan - Income Distribution cum Capital Withdrawal (IDCW),15.1161
2006-10-23,100795,Sundaram Small Cap Fund Regular Plan - Growth,17.5055
2006-10-23,100796,Sahara Midcap Fund-Growth Plan,16.5913
2006-10-23,100797,Sahara Midcap Fund-Dividend Plan,14.8109
2006-10-23,100798,Sahara Midcap Fund-Auto Payout,16.5913
2006-10-23,100799,Sahara Midcap Fund-Bonus,16.5913
2006-10-23,100800,UTI Growth Sector Funds-UTI - GSF - Brand Value-Income Option,19.52
2006-10-23,100801,UTI Growth Sector Funds-UTI - GSF - Brand Value-Growth Option,25.51
2006-10-23,100802,UTI Software Fund-Growth Option,23.83
2006-10-23,100803,UTI Software Fund-Income Option,21.85
2006-10-23,100804,UTI Energy Fund-Income Option,20.02
2006-10-23,100805,UTI Energy Fund-Growth Option,25.68
2006-10-23,100806,UTI Healthcare Fund - Regular Plan - IDCW,18.59
2006-10-23,100807,UTI Healthcare Fund - Regular Plan - Growth Option,21.08
2006-10-23,100808,UTI Services Industries Fund-Income Option,31.89
2006-10-23,100809,UTI Services Industries Fund-Growth Option,43.14
2006-10-23,100811,UTI - G-Sec Fund-Income,10.3674
2006-10-23,100812,UTI - G-Sec Fund-GrowthN,18.8392
2006-10-23,100813,UTI Overnight Fund - Regular Plan - Periodic IDCW,10.4649
2006-10-23,100814,UTI - Overnight  Fund - Regular Plan - Growth Option,11.4275
2006-10-23,100820,UTI ELSS Tax Saver Fund - Regular Plan - IDCW,17.91
2006-10-23,100821,UTI ELSS Tax Saver Fund - Regular Plan - Growth Option,29.16
2006-10-23,100822,UTI Nifty 50 Index Fund - Regular Plan - Growth Option,23.3081
2006-10-23,100823,UTI Nifty 50 Index Fund - Regular Plan - IDCW,23.3081
2006-10-23,100828,Kotak Liquid-Regular (Dividend),10.0317
2006-10-23,100829,Kotak Liquid-Regular (Growth),14.3659
2006-10-23,100830,Kotak Liquid-Institutional Plan  (Growth),14.565
2006-10-23,100831,Kotak Liquid Fund -Institutional Plan - (Daily Dividend),12.2281
2006-10-23,100832,Kotak Liquid-Institutional Plan (Weekly Dividend),10.0349
2006-10-23,100833,Kotak Liquid Fund - Regular  - Daily Reinvestment of Income Distribution cum capital withdrawal option,12.2281
2006-10-23,100834,Kotak Liquid Fund Regular Plan Weekly Reinvestment of Income Distribution cum capital withdrawal option Dividend,10.0483
2006-10-23,100835,Kotak Liquid Fund - Regular Plan - Growth,14.651
2006-10-23,100836,Kotak Liquid Fund -Sweep Daily Dividend,10.0071
2006-10-23,100837,Nippon India Liquid Fund - Retail Option - Growth Plan,17.5081
2006-10-23,100838,NIPPON INDIA LIQUID FUND - RETAIL Plan - WEEKLY IDCW OPTION,10.3466
2006-10-23,100842,NIPPON INDIA LIQUID FUND - RETAIL Plan - DAILY IDCW OPTION,15.241
2006-10-23,100843,NIPPON INDIA LIQUID FUND - RETAIL plan - MONTHLY IDCW OPTION,11.05
2006-10-23,100844,NIPPON INDIA LIQUID FUND - RETAIL Plan - QUARTERLY IDCW OPTION,17.128
2006-10-23,100845,Reliance Liquid Fund-Cash Plan-Growth Plan,12.6872
2006-10-23,100848,Reliance Liquid Fund-Cash Plan-Weekly Dividend Reinvestment Option,10.9221
2006-10-23,100849,Reliance Liquid Fund-Cash Plan-Daily Dividend Reinvestment Option,11.1411
2006-10-23,100851,Nippon India Liquid Fund -Growth Plan,17.6528
2006-10-23,100852,NIPPON INDIA LIQUID FUND - DAILY IDCW OPTION,15.2857
2006-10-23,100853,NIPPON INDIA LIQUID FUND - WEEKLY IDCW OPTION,15.3106
2006-10-23,100855,NIPPON INDIA LIQUID FUND - MONTHLY IDCW OPTION,15.3747
2006-10-23,100856,Nippon India Corporate Bond Fund - Growth Plan - Growth Option,15.2821
2006-10-23,100857,NIPPON INDIA CORPORATE BOND FUND - MONTHLY IDCW Option,10.2699
2006-10-23,100858,NIPPON INDIA CORPORATE BOND FUND - QUARTERLY IDCW Option,10.0714
2006-10-23,100859,Nippon India Corporate Bond Fund - Growth Plan - Bonus Option,10.9163
2006-10-23,100864,LIC MF ELSS Tax Saver-Regular Plan-IDCW,13.1927
2006-10-23,100865,LIC MF ELSS Tax Saver-Regular Plan-Growth,24.3712
2006-10-23,100868,HDFC Liquid Fund - Growth Plan,14.391
2006-10-23,100872,HDFC Liquid Fund-PREMIUM PLUS- Growth,14.5113
2006-10-23,100873,HDFC Liquid Fund-PREMIUM- Growth,14.4802
2006-10-23,100874,HDFC Liquid Fund - IDCW Plan Weekly,10.3241
2006-10-23,100875,HDFC Liquid Fund - IDCW Daily,10.1982
2006-10-23,100876,HDFC Liquid Fund - IDCW Monthly,10.3175
2006-10-23,100877,HDFC Liquid Fund-Premium Plan - Dividend-Daily,12.2598
2006-10-23,100878,HDFC Liquid Fund-Premium Plan - Dividend-Weekly,12.493
2006-10-23,100881,HDFC Liquid Fund-Premium Plus Plan - Dividend-Weekly,12.4346
2006-10-23,100887,Principal Cash Management-Liquid Option-Dividend Plan,10.1274
2006-10-23,100888,Principal Cash Management-Liquid Option-Growth Plan,14.2685
2006-10-23,100889,Principal Cash Management-Liquid Option-Monthly Dividend,10.0443
2006-10-23,100890,Principal Cash Management-Liquid Option-Institutional - Weekly Dividend Plan,10.0092
2006-10-23,100891,Principal Cash Management-Liquid Option-Institutional - Monthly Dividend Plan,10.0456
2006-10-23,100892,Principal Cash Management-Liquid Option-Daily Dividend,10.0022
2006-10-23,100893,Principal Cash Management-Liquid Option-Institutional - Growth Plan,11.9818
2006-10-23,100894,Principal Cash Management-Liquid Option-Institutional - Daily Dividend Plan,10.0022
2006-10-23,100895,Principal Cash Management Fund - Daily Income Distribution CUM Capital Withdrawal,10.0007
2006-10-23,100896,Principal Cash Management Fund - Weekly Income Distribution CUM Capital Withdrawal Option,10.0086
2006-10-23,100897,Principal Cash Management Fund - Monthly Income Distribution CUM Capital Withdrawal Option,10.0468
2006-10-23,100898,Principal Cash Management Fund -Growth Option,11.3057
2006-10-23,100899,HDFC Childrens Fund-Savings,14.873
2006-10-23,100900,HDFC Childrens Fund - Growth Plan,24.133
2006-10-23,100902,Franklin Pharma Fund - Growth,28.14
2006-10-23,100906,DBS Chola Opportunities Fund-Regular Quarterly Dividend,16.26
2006-10-23,100907,DBS Chola Opportunities Fund-Cumulative,25.01
2006-10-23,100915,SBI Contra Fund - Regular Plan - Income Distribution cum Capital Withdrawal Option (IDCW),25.73
2006-10-23,100927,SBI Conservative Hybrid Fund - Regular Plan - Monthly Income Distribution cum Capital Withdrawal Option (IDCW),10.7331
2006-10-23,100928,SBI Conservative Hybrid Fund - Regular Plan - Quarterly Income Distribution cum Capital Withdrawal Option (IDCW),10.6292
2006-10-23,100929,SBI Conservative Hybrid Fund - Regular Plan - Annual Income Distribution cum Capital Withdrawal Option (IDCW),10.91
2006-10-23,100940,DSP BlackRock Liquidity Fund - Regular Plan - Growth,17.765
2006-10-23,100941,DSP BlackRock Liquidity Fund - Regular Plan Weekly Dividend,12.4069
2006-10-23,100943,DSP BlackRock Liquidity Fund - Regular Plan - Daily Dividend,10.01
2006-10-23,100948,Franklin India Conservative Hybrid Fund - Growth,20.2107
2006-10-23,100949,Franklin India Conservative Hybrid Fund - Plan A - Monthly - IDCW,12.0524
2006-10-23,100950,Franklin India Conservative Hybrid Fund - Plan A - Quarterly - IDCW,11.8181
2006-10-23,100951,Franklin India Conservative Hybrid Fund - Monthly Bonus,14.7629
2006-10-23,100952,ICICI Prudential MIP - Growth,18.467
2006-10-23,100953,ICICI Prudential MIP - Dividend Monthly,11.5655
2006-10-23,100954,ICICI Prudential MIP - Dividend Quarterly,11.8853
2006-10-23,100955,ICICI Prudential MIP - Dividend Half Yearly,11.6703
2006-10-23,100956,Aditya Birla Tax Plan 98,192.6
2006-10-23,100957,Principal Income Fund-Dividend Plan-Half Yearly,10.5016
2006-10-23,100958,Principal Income Fund-Dividend Plan-Quaterly,10.5118
2006-10-23,100960,Principal Dynamic Bond Fund - Dividend Option -Annual,10.3647
2006-10-23,100961,Principal Dynamic Bond Fund -Dividend Option - Quarterly,10.9935
2006-10-23,100962,Principal Income Fund-Growth Plan-growth,17.2107
2006-10-23,100963,Principal Dynamic Bond Fund - Growth Option,12.1356
2006-10-23,100966,Principal Multi Cap Growth Fund- Half Yearly Income Distribution CUM Capital Withdrawal Option,22.64
2006-10-23,100967,Principal Multi Cap Growth Fund-Growth Option,46.78
2006-10-23,100968,SBI Conservative Hybrid Fund - Regular Plan - Growth,16.4514
2006-10-23,100970,Aditya Birla Sun Life MIP - Regular Plan - Growth,18.729
2006-10-23,100971,Aditya Birla Sun Life MIP - Regular Plan - Monthly Dividend,11.1082
2006-10-23,100972,Aditya Birla Sun Life MIP - Regular Plan - Monthly Payment,18.729
2006-10-23,100975,DBS Chola Liquid Fund-Regular Cumulative,14.6833
2006-10-23,100978,DBS Chola Liquid Fund-Daily Dividend Reinvestment Plan,10.0315
2006-10-23,100989,DBS Chola Liquid Fund-Cum -Institutional Plus,14.7666
2006-10-23,100997,HDFC Long Term Advantage Plan - IDCW Plan,43.126
2006-10-23,100998,HDFC Long Term Advantage Plan - Growth Plan,86.388
2006-10-23,100999,SBI Gilt Fund - Regular Plan - Income Distribution cum Capital Withdrawal Option (IDCW),10.0989
2006-10-23,101000,Tata Life Sciences & Technology Fund - Growth,43.9851
2006-10-23,101001,SBI GILT FUND - REGULAR PLAN - GROWTH,16.8675
2006-10-23,101002,SBI CONSTANT MATURITY 10 Year GILT FUND - REGULAR PLAN - GROWTH,14.435
2006-10-23,101003,SBI Constant Maturity 10 Year Gilt Fund - Regular Plan - Income Distribution cum Capital Withdrawal Option (IDCW),10.0416
2006-10-23,101037,Franklin India Index Tax Fund,28.534
2006-10-23,101042,Tata Gilt Securities Fund -Regular Plan- Growth Option,22.8031
2006-10-23,101044,Franklin India Floating Rate Fund - IDCW,10.0
2006-10-23,101048,Franklin India Floating Rate Fund - Growth Plan,13.242
2006-10-23,101049,Tata Gilt Securities Fund - Regular Plan - Payout of IDCW Option,11.7024
2006-10-23,101059,SUNDARAM GILT FUND (DIV. OPTION),10.5259
2006-10-23,101065,quant Mid Cap Fund - Growth Option - Regular Plan,23.9906
2006-10-23,101066,quant Mid Cap Fund - IDCW Option - Regular Plan,13.7677
2006-10-23,101069,quant Aggressive Hybrid Fund-IDCW Option - Regular Plan,14.1769
2006-10-23,101070,quant Aggressive Hybrid Fund - Growth Option - Regular Plan,43.7833
2006-10-23,101071,quant Multi Asset Allocation Fund - IDCW Option - Regular Plan,13.3835
2006-10-23,101072,quant Multi Asset Allocation Fund-GROWTH OPTION - Regular Plan,14.6269
2006-10-23,101078,JM Liquid Fund (Regular) - Daily IDCW,10.4302
2006-10-23,101081,HDFC Gilt Fund-Short Term-Dividend,10.4939
2006-10-23,101082,HDFC Gilt Fund-Short Term-Growth,13.4079
2006-10-23,101083,HDFC Gilt Fund - Growth Plan,15.4925
2006-10-23,101084,HDFC Gilt Fund - IDCW Plan,10.2643
2006-10-23,101092,SUNDARAM GILT FUND (Growth. OPTION),13.1614
2006-10-23,101094,Taurus Gilt Fund-Dividend,12.3882
2006-10-23,101095,Taurus Gilt Fund-Growth,12.7096
2006-10-23,101098,ICICI Prudential Child Care Plan Study - Cumulative,18.7442
2006-10-23,101099,Grindlays Cash Fund-Growth,13.3957
2006-10-23,101100,Grindlays Cash Fund-Dividend (Daily),10.5819
2006-10-23,101113,Taurus Short Term Income Fund- Regular Plan - Dividend Option,13.4683
2006-10-23,101114,Taurus Short Term Income Fund- Regular Plan - Growth Option,13.8469
2006-10-23,101116,Principal Government Securities Fund-Investment-Dividend - Half Yearly,11.1237
2006-10-23,101117,Principal Government Securities Fund-Dividend Option - Quarterly,11.2094
2006-10-23,101118,Principal Government Securities Fund-Growth,16.0202
2006-10-23,101119,Principal Government Securities Fund-Dividend Option- Annually,13.1612
2006-10-23,101120,Principal Gilt Fund-Savings-Growth,13.822
2006-10-23,101121,Principal Gilt Fund-Savings-Dividend,10.2481
2006-10-23,101122,Principal Gilt Fund-Provident-Growth,10.8297
2006-10-23,101123,Principal Gilt Fund-Provident-Haly Yearly,10.1146
2006-10-23,101124,Principal Gilt Fund-Provident-Annual,10.4977
2006-10-23,101126,Principal Gilt Fund-Provident-Annual Rebalancing 2005,10.7833
2006-10-23,101127,ICICI Prudential Children's Fund - Regular Plan,37.19
2006-10-23,101131,DBS Chola Growth Fund-Quarterly Dividend,15.78
2006-10-23,101132,DBS Chola Growth Fund-Cumulative,29.33
2006-10-23,101143,ICICI Prudential Multi-Asset Fund - IDCW,19.7517
2006-10-23,101144,ICICI Prudential Multi-Asset Fund - Growth,57.7377
2006-10-23,101154,BARODA INCOME FUND - Plan A - Growth Option,12.4279
2006-10-23,101155,BARODA INCOME FUND - Plan A - Dividend Option,12.4279
2006-10-23,101161,Nippon India Multi Cap Fund-Growth Plan-Growth Option,19.2296
2006-10-23,101162,Nippon India Multi Cap Fund-Growth Plan-Bonus Option,19.2296
2006-10-23,101163,NIPPON INDIA MULTI CAP FUND - IDCW Option,18.0453
2006-10-23,101165,ICICI Prudential Short Term Fund - Monthly IDCW,10.8131
2006-10-23,101169,SBI Children's Fund - Savings Plan - REGULAR PLAN - GROWTH,16.6485
2006-10-23,101170,Sahara Gilt Fund-Growth,12.1219
2006-10-23,101171,Sahara Gilt Fund-Dividend,11.0853
2006-10-23,101172,ING Vysya Equity Fund-Dividend Option,14.54
2006-10-23,101173,ING Vysya Equity Fund-Growth Option,30.5
2006-10-23,101177,Grindlays Government Securities Fund - IP (Qtr.Dividend),10.2779
2006-10-23,101178,Grindlays Government Securities Fund - ST (Monthly Dividend),10.0345
2006-10-23,101179,Grindlays Government Securities Fund-IP(Annual Dividend),10.5167
2006-10-23,101180,Grindlays Government Securities Fund-ST (Quarterly Dividend),10.1735
2006-10-23,101181,JM Medium to Long Duration Fund (Regular) - Bonus Option- Principal Units,11.5882
2006-10-23,101184,LIC MF Liquid Fund-Regular Plan-Daily IDCW,10.9801
2006-10-23,101185,LIC MF Liquid Fund-Regular Plan-Growth,13.151
2006-10-23,101186,Tata Income Fund- Regular Plan - Periodic Payout of IDCW Option,14.2305
2006-10-23,101187,Baroda BNP Paribas GILT FUND - Regular Plan - Growth Option,11.0624
2006-10-23,101188,Baroda BNP Paribas GILT FUND - Regular Plan - IDCW Option,11.0636
2006-10-23,101190,BOB GILT FUND-PF Plan (Growth),10.4259
2006-10-23,101192,DBS Chola Freedom Income-STF Regular-Semi Annual Dividend,11.4099
2006-10-23,101198,LIC MF BSE Sensex Index Fund-Regular Plan-IDCW,17.2211
2006-10-23,101199,LIC MF BSE Sensex Index Fund-Regular Plan-Growth,27.1022
2006-10-23,101200,LIC MF Nifty 50 Index Fund-Regular Plan-IDCW,14.691
2006-10-23,101201,LIC MF Nifty 50 Index Fund-Regular Plan-Growth,23.0582
2006-10-23,101202,LIC MF Index Fund-Sensex Advantage-Dividend,13.426
2006-10-23,101203,LIC MF Index Fund-Sensex Advantage-Growth,26.3907
2006-10-23,101206,SBI OVERNIGHT FUND - REGULAR PLAN - GROWTH,12.5434
2006-10-23,101209,Taurus Large Cap Fund - Regular Plan - Growth,32.09
2006-10-23,101221,ICICI Prudential Money Market Fund Retail Growth (erstwhile Cash Option),12.32
2006-10-23,101222,Tata Aggressive Hybrid Fund- Regular Plan - Periodic Payout of IDCW Option,37.2542
2006-10-23,101224,Tata Dynamic Bond Fund- Regular Plan - Payout of IDCW Option,10.2554
2006-10-23,101228,ICICI Prudential Multicap Fund - Growth,74.42
2006-10-23,101229,ICICI Prudential Short Term Fund - Institutional Plan - Dividend Monthly,11.0786
2006-10-23,101230,ICICI Prudential Short Term Fund-Institutional Plan-Dividend Fortnightly,11.0386
2006-10-23,101231,ICICI Prudential Short Term Fund-Institutional Growth,13.939
2006-10-23,101232,Franklin India Short-Term Income Plan-Growth,1333.8972
2006-10-23,101236,Franklin India Short Term Income Plan -  Retail Plan - Monthly - IDCW,1017.6608
2006-10-23,101237,Franklin India Short-Term Income Plan-Weekly Bonus,1053.2525
2006-10-23,101238,Franklin India Short Term Income Plan -  Retail Plan - Quarterly - IDCW,1021.4061
2006-10-23,101242,Franklin India Short Term Income Plan -  Retail Plan - Weekly - IDCW,1095.0608
2006-10-23,101244,Franklin India Short-Term Income Plan-Institutional Plan - Growth,1065.8344
2006-10-23,101245,Templeton India Short-Term Income Plan-Institutional Plan - Weekly Dividend,1005.463
2006-10-23,101246,Franklin India Short-Term Income Plan-Institutional Plan - Monthly Dividend,1050.7191
2006-10-23,101248,Grindlays Cash Fund - Plan B (G) (Institutional Plan),13.4644
2006-10-23,101258,Grindlays Dynamic Bond Fund - GDBF (Annual Dividend),10.5249
2006-10-23,101262,Nippon India Power & Infra Fund-Growth Plan -Growth Option,30.4007
2006-10-23,101263,Nippon India Power & Infra Fund-Growth Plan-Bonus Option,30.4007
2006-10-23,101264,NIPPON INDIA POWER & INFRA FUND - IDCW Option,25.1577
2006-10-23,101265,Principal Hybrid Equity Fund-Growth,21.11
2006-10-23,101266,Principal Hybrid Equity Fund- Monthly Income Distribution CUM Capital Withdrawal,16.99
2006-10-23,101271,LIC MF Children's Fund-Regular Plan-Growth,14.6824
2006-10-23,101279,Grindlays Dynamic Bond Fund - GDBF (Growth),13.2147
2006-10-23,101281,HDFC BSE Sensex Index Fund - Growth Plan,117.9181
2006-10-23,101282,HDFC Index Fund-Sensex Plus( FV-Rs32.161),134.9456
2006-10-23,101288,ING Short Term Income Fund-Growth Option,12.8726
2006-10-23,101294,Birla Sun Life Cash Plus Sweep Plan-Dividend Option,10.0477
2006-10-23,101295,SBI ESG Exclusionary Strategy Fund - Regular Plan - Income Distribution cum Capital Withdrawal Option (IDCW),24.61
2006-10-23,101296,Banking Index Benchmark Exchange Traded Scheme (Bank BeES),532.4276
2006-10-23,101303,DSP Short Term Fund - Regular Plan - Regular Plan - IDCW - Weekly,10.1859
2006-10-23,101304,DSP Short Term Fund - Regular Plan - Growth,12.689
2006-10-23,101305,DSP Short Term Fund - Regular Plan - IDCW,10.5282
2006-10-23,101306,DSP Short Term Fund - IDCW - Monthly,10.4169
2006-10-23,101307,DBS Chola Liquid Fund - Regular Weekly Dividend,11.9563
2006-10-23,101313,Aditya Birla Sun Life Nifty 50 Index Fund -REGULAR - IDCW,20.9485
2006-10-23,101314,Aditya Birla Sun Life Nifty 50 Index Fund - Growth - Regular Plan,37.8827
2006-10-23,101315,Aditya Birla Sun Life Savings Fund-Insititutional Fortnightly Dividend,10.5202
2006-10-23,101316,Aditya Birla Sun Life Savings Fund-Retail Growth,13.5286
2006-10-23,101317,Aditya Birla Sun Life Savings Fund - Growth - Regular Plan,13.6474
2006-10-23,101318,Aditya Birla Sun Life Savings Fund-Retail Fortnightly Dividend,11.2908
2006-10-23,101319,Grindlays Cash Fund - Dividend (Weekly),10.1967
2006-10-23,101325,Nifty Benchmark Exchange Traded Scheme- Nifty BeES,373.1656
2006-10-23,101349,ICICI Prudential Nifty 50 Index Fund - Cumulative Option,32.5707
2006-10-23,101350,ICICI Prudential All Seasons Bond Fund Retail - Cumulative,15.1858
2006-10-23,101351,ICICI Prudential All Seasons Bond Fund - Weekly IDCW,10.5078
2006-10-23,101352,Templeton Floating Rate Income Fund-Short Term Plan-Dividend Option,10.0103
2006-10-23,101353,Templeton Floating Rate Income Fund-Short Term Plan-Growth Option,13.0473
2006-10-23,101354,Templeton Floating Rate Income Fund-Short Term Plan-Institutional Option - Growth,10.6879
2006-10-23,101355,Templeton Floating Rate Income Fund-Short Term Plan-Institutional Option - Dividend,10.0103
2006-10-23,101356,Franklin India Money Market Fund Retail Option - Quarterly - IDCW,10.4024
2006-10-23,101357,Franklin India Money Market Fund - Growth Option,13.053
2006-10-23,101358,Franklin India Money Market Fund - Institutional Option - Growth,10.6678
2006-10-23,101359,Franklin India Money Market Fund - Institutional Option - Dividend,10.3402
2006-10-23,101361,Canara Robeco Liquid Fund- INSTITUTIONAL-Weekly dividend,10.0489
2006-10-23,101362,Canara Robeco Liquid Fund- INSTITUTIONAL-Growth,13.2356
2006-10-23,101363,Canara Robeco Liquid Fund- INSTITUTIONAL-Daily Dividend Reinvestment,10.041
2006-10-23,101364,Canara Robeco Liquid Fund-Retail-DRI,10.041
2006-10-23,101365,Canara Robeco Liquid Fund-Retail-Growth,13.223
2006-10-23,101372,Kotak Bond Short Term Plan-(Payout of Income Distribution cum capital withdrawal option),10.0769
2006-10-23,101373,Kotak Bond Short Term Plan-(Growth),13.114
2006-10-23,101393,Sahara Liquid Fund-Fixed Pricing - Daily Dividend Option,1024.549
2006-10-23,101394,Sahara Liquid Fund-Fixed Pricing - Growth option,1299.0011
2006-10-23,101397,Sahara Liquid Fund-Fixed Pricing -  Weekly Dividend Option,1024.6207
2006-10-23,101398,Sahara Liquid Fund-Fixed Pricing - Monthly Dividend Option,1028.6889
2006-10-23,101399,Sahara Liquid Fund-Variable Pricing - Daily Dividend option,1024.5599
2006-10-23,101400,Sahara Liquid Fund-Variable Pricing - Weekly Dividend Option,1025.2876
2006-10-23,101401,Sahara Liquid Fund-Variable Pricing- Monthly Dividend Option,1029.4297
2006-10-23,101402,Sahara Liquid Fund-Variable Pricing - Growth option,1302.0617
2006-10-23,101403,Sahara Income Fund-Dividend,11.2781
2006-10-23,101404,Sahara Income Fund-Growth,12.5302
2006-10-23,101405,ING Gilt Fund-Growth Option,11.9848
2006-10-23,101406,ING Gilt Fund-Dividend Option,11.9848
2006-10-23,101407,Baroda BNP Paribas LIQUID FUND-Defunct Plan- IDCW Option,11.1498
2006-10-23,101408,Baroda BNP Paribas LIQUID FUND- Defunct Plan -Growth Option,13.001
2006-10-23,101409,Baroda BNP Paribas LIQUID FUND-Defunct Plan-Daily IDCW Option,10.0374
2006-10-23,101419,Tata Long Term Debt Fund - Regular Plan  -Bonus,12.2971
2006-10-23,101420,JM Floater Short Term Fund - Daily Dividend Option,10.0883
2006-10-23,101421,JM Floater Short Term Fund - Growth Option,11.9642
2006-10-23,101430,HDFC Regular Savings Fund-GROWTH,13.0594
2006-10-23,101431,HDFC Regular Savings Fund-Monthly Dividend Option,10.3399
2006-10-23,101455,Grindlays Government Securities Fund - IP (Growth),13.4575
2006-10-23,101456,Grindlays Government Securities Fund - ST (Growth),12.3238
2006-10-23,101458,Grindlays Government Securities Fund-IP(H.Yrly Dividend),10.2756
2006-10-23,101462,Principal Short Term Plan-Dividend,10.2025
2006-10-23,101463,Principal Short Term Plan-Growth,13.1405
2006-10-23,101465,Principal Short Term Debt Fund- Growth Plan,12.1989
2006-10-23,101466,Principal Short Term Debt Fund - Income Distribution CUM Capital Withdrawal Option - Monthly,10.2431
2006-10-23,101467,Principal Income Fund - Short Term Plan-Institutional - Weekly Dividend Plan,10.9371
2006-10-23,101471,Tata Gilt Retirement Plan (28/2/2008) Growth,10.3004
2006-10-23,101472,Sundaram Equity Hybrid Fund Regular Plan - Income Distribution cum Capital Withdrawal (IDCW),15.0907
2006-10-23,101481,HDFC Floating Rate Debt Fund - Retail Growth Option,12.1959
2006-10-23,101482,HDFC Floating Rate Debt Fund - Retail Weekly Div Option,10.1513
2006-10-23,101483,HDFC Floating Rate Debt Fund - Retail Daily Div Option,10.0809
2006-10-23,101484,HDFC Floating Rate Debt Fund - Retail Monthly Div option,10.1988
2006-10-23,101489,Tata Young Citizen Fund [Upto 3 years] Regular Plan,20.8441
2006-10-23,101490,Tata Young Citizen Fund [>3 years upto 7 years] Regular Plan,20.8441
2006-10-23,101491,Tata Childrens Fund -Regular Plan-Growth Option,20.8441
2006-10-23,101498,Principal Equity Savings Fund - Growth Option,14.8342
2006-10-23,101499,Principal Equity Savings Fund - Half Yearly Income Distribution CUM Capital Withdrawal,10.6367
2006-10-23,101500,Principal Equity Savings Fund -Quaterly Income Distribution CUM Capital Withdrawal,10.6615
2006-10-23,101516,Grindlays Dynamic Bond Fund - GDBF (Quarterly Dividend),10.2867
2006-10-23,101519,JM Short Term Fund - Regular Plan - Dividend Option,11.0115
2006-10-23,101520,JM Short Term Fund - Regular Plan - Growth Option,12.9828
2006-10-23,101521,JM Short Term Fund - Growth Option,12.2564
2006-10-23,101524,JM Short Term Fund - Dividend Option,10.2952
2006-10-23,101525,HDFC Nifty 50 Index Fund - Growth Plan,35.7713
2006-10-23,101528,Sahara Growth Fund-Growth,45.8926
2006-10-23,101529,Sahara Growth Fund-Dividend,23.2193
2006-10-23,101530,SBI Large & Midcap Fund - Regular Plan - Income Distribution cum Capital Withdrawal Option (IDCW),42.96
2006-10-23,101536,Sundaram Select Focus Regular Plan - Income Distribution cum Capital Withdrawal (IDCW),15.049
2006-10-23,101537,Sundaram Select Focus Regular Plan - Growth,54.3557
2006-10-23,101538,Sundaram Mid Cap Fund Regular Plan - Income Distribution cum Capital Withdrawal (IDCW),20.8389
2006-10-23,101539,Sundaram Mid Cap Fund Regular Plan - Growth,85.2101
2006-10-23,101544,Sundaram Short Term Credit Risk Fund -Dividend,10.3594
2006-10-23,101545,Sundaram Short Term Credit Risk Fund-Appreciation,12.5785
2006-10-23,101547,Tata Short Term Bond Fund- Regular Plan - Monthly Payout of IDCW Option,10.9806
2006-10-23,101548,Tata Short Term Bond Fund -Regular Plan- Growth Option,12.8901
2006-10-23,101549,JM Liquid Fund (Regular) - Bonus Option - Principal Units,10.4621
2006-10-23,101550,ING Short Term Income Fund -Dividend Option,11.2212
2006-10-23,101551,SBI Equity Hybrid Fund - Regular Plan - Income Distribution cum Capital Withdrawal Option (IDCW),23.97
2006-10-23,101560,Sundaram Short Term Debt Fund Regular Plan -Income Distribution cum Capital Withdrawal ( IDCW ),10.2864
2006-10-23,101561,Sundaram Short Term Debt Fund Regular Plan- Income Distribution cum Capital Withdrawal (IDCW ),10.2873
2006-10-23,101562,Sundaram Short Term Debt Fund Regular Plan- Income Distribution cum Capital Withdrawal (IDCW),10.2915
2006-10-23,101563,Sundaram Short Term Debt Fund Regular Plan - Growth,12.6667
2006-10-23,101564,Sundaram Short Term Debt Fund Regular Plan - Weekly Income Distribution cum Capital Withdrawal (IDCW),10.9901
2006-10-23,101565,Sundaram Short Term Debt Fund Regular Plan - Fortnightly Income Distribution cum Capital Withdrawal (IDCW),10.6327
