date,scheme_code,scheme_name,nav
2006-10-23,100027,Grindlays Super Saver Income Fund-GSSIF-Half Yearly Dividend,10.2051
2006-10-23,100028,Grindlays Super Saver Income Fund-GSSIF-Quaterly Dividend,10.2185
2006-10-23,100029,Grindlays Super Saver Income Fund-GSSIF-Growth,16.5946
2006-10-23,100030,Grindlays Super Saver Income Fund-GSSIF-Annual Dividend,10.4292
2006-10-23,100031,Grindlays Super Saver Income Fund-GSSIF - ST-Dividend,10.0557
2006-10-23,100032,Grindlays Super Saver Income Fund-GSSIF - ST-Growth,14.4424
2006-10-23,100033,Aditya Birla Sun Life Large & Mid Cap Fund - Regular Growth,115.1
2006-10-23,100034,Aditya Birla Sun Life Large & Mid Cap Fund -Regular - IDCW,82.58
2006-10-23,100035,Birla Sun Life Freedom Fund-Plan A (Dividend),17.44
2006-10-23,100036,Birla Sun Life Freedom Fund-Plan B (Growth),26.24
2006-10-23,100037,Aditya Birla Sun Life Income Fund - Regular - Quarterly IDCW,10.2381
2006-10-23,100038,Aditya Birla Sun Life Income Fund - Growth - Regular Plan,30.0277
2006-10-23,100041,Aditya Birla Sun Life Liquid Fund -Institutional - IDCW,10.8023
2006-10-23,100042,Aditya Birla Sun Life Liquid Fund-Retail (Growth),19.5193
2006-10-23,100043,Aditya Birla Sun Life Liquid Fund-Institutional (Growth),19.6488
2006-10-23,100044,Aditya Birla Sun Life Liquid Fund -Retail - IDCW,16.3694
2006-10-23,100046,Aditya Birla Sun Life Liquid Fund -Daily IDCW,10.0195
2006-10-23,100047,Aditya Birla Sun Life Liquid Fund - Growth,11.5305
2006-10-23,100048,Aditya Birla Sun Life Liquid Fund -Institutional - weekly  IDCW,10.8129
2006-10-23,100049,Aditya Birla Sun Life Cash Plus-Institutional - Fortnightly Dividend,10.8413
2006-10-23,100051,Aditya Birla Sun Life Liquid Fund -weekly IDCW,10.0284
2006-10-23,100052,Aditya Birla Sun Life Cash Plus-Institutional Premium - Fortnightly Dividend,10.0781
2006-10-23,100053,Aditya Birla Sun Life Cash Plus-Institutional Premium Plan-Monthly Dividend,10.0467
2006-10-23,100054,Aditya Birla Sun Life Gilt Plus - Liquid Plan - Quarterly Dividend - Regular Plan,10.6993
2006-10-23,100055,Aditya Birla Sun Life Gilt Plus - Liquid Plan - Growth - Regular Plan,17.6694
2006-10-23,100056,Aditya Birla Sun Life Gilt Plus - Liquid Plan - Annual Dividend - Regular Plan,11.7659
2006-10-23,100057,Aditya Birla Sun Life Govenment Securities Fund -Regular - Quarterly IDCW,10.6774
2006-10-23,100058,Aditya Birla Sun Life Government Securities Fund  - Growth - Regular Plan,20.4428
2006-10-23,100059,Aditya Birla Sun Life Gilt Plus-PF Plan (Annual Dividend),20.4437
2006-10-23,100060,Aditya Birla Sun Life Constant Maturity 10 Year Gilt Fund - Quarterly Dividend - Regular Plan,11.2239
2006-10-23,100061,Aditya Birla Sun Life Constant Maturity 10 Year Gilt Fund - Growth - Regular Plan,22.9504
2006-10-23,100062,Aditya Birla Sun Life Gilt Plus-Regular Plan (Annual Dividend),22.9973
2006-10-23,100063,Aditya Birla Sun Life MNC Fund - Regular - IDCW,58.19
2006-10-23,100064,Aditya Birla Sun Life MNC Fund - Growth - Regular Plan,116.09
2006-10-23,100065,Aditya Birla Sun Life India Opportunities Fund - Dividend - Regular Plan,20.41
2006-10-23,100066,Aditya Birla Sun Life India Opportunities Fund - Growth - Regular Plan,47.51
2006-10-23,100067,Aditya Birla Sun Life Tax Plan -Regular - IDCW,54.34
2006-10-23,100068,BARODA ELSS 96 - Plan A - IDCW,23.81
2006-10-23,100069,BARODA PIONEER DIVERSIFIED FUND,29.9
2006-10-23,100077,DSP Bond Fund - IDCW,10.6191
2006-10-23,100078,DSP Bond Fund - Growth,24.5272
2006-10-23,100079,DSP Bond Fund - IDCW - Monthly,10.3976
2006-10-23,100080,DSP Flexi Cap Fund - Regular Plan - IDCW,41.21
2006-10-23,100081,DSP Aggressive Hybrid Fund- Regular Plan - Growth,35.95
2006-10-23,100082,DSP Aggressive Hybrid Fund- Regular Plan - IDCW,20.86
2006-10-23,100084,DSP Gilt Fund - Regular Plan - Growth,22.8804
2006-10-23,100085,DSP Gilt Fund - Regular Plan - IDCW,11.4036
2006-10-23,100086,DSP Gilt Fund - Regular Plan - IDCW - Monthly,10.1286
2006-10-23,100087,DSP Savings Fund - Regular Plan - Growth,16.5986
2006-10-23,100088,DSP Savings Fund - Regular Plan - IDCW,10.9498
2006-10-23,100089,DSP Savings Fund - Regular Plan - IDCW - Monthly,10.0866
2006-10-23,100090,DSP BlackRock Technology.com   Fund - Regular Plan - Growth,19.49
2006-10-23,100119,HDFC Balanced Advantage Fund - Growth Plan,44.298
2006-10-23,100120,HDFC Balanced Advantage Fund - IDCW Plan,27.242
2006-10-23,100121,HDFC Balanced Fund - Dividend Option,19.817
2006-10-23,100122,HDFC Balanced Fund - Growth Option,30.817
2006-10-23,100123,HDFC Income Fund - Quarterly IDCW Option,10.243
2006-10-23,100124,HDFC Income Fund - Growth Option,16.5706
2006-10-23,100136,Principal Deposit Fund-Plan 54EA/EB-Plan 54EA /EB,17.5338
2006-10-23,100150,Principal Child Benefit Fund-Super Saver-Future Guard Plan,48.41
2006-10-23,100151,Principal Retail Equity Savings Fund - Growth Option,49.05
2006-10-23,100152,Principal Nifty 100 Equal Weight Fund-Income Distribution CUM Capital Withdrawal,20.5052
2006-10-23,100153,Principal Nifty 100 Equal Weight Fund-Growth,26.51
2006-10-23,100156,Principal Tax Savings Fund,71.55
2006-10-23,100171,Quant Dynamic Bond-Dividend,10.1296
2006-10-23,100172,Quant Dynamic Bond-Growth,22.3213
2006-10-23,100173,Quant Dynamic Bond-Bonus,11.7563
2006-10-23,100174,quant ELSS Tax Saver Fund - IDCW Option - Regular Plan,14.0956
2006-10-23,100175,quant ELSS Tax Saver Fund - Growth Option - Regular Plan,40.0441
2006-10-23,100176,quant Small Cap Fund - IDCW Option - Regular Plan,16.0408
2006-10-23,100177,quant Small Cap Fund - Growth - Regular Plan,19.0017
2006-10-23,100178,ING Income Fund-Regular Plan -Dividend Option (Quarterly),10.1618
2006-10-23,100179,ING Income Fund-Regular Plan -Dividend Option (Half Yearly),10.1819
2006-10-23,100180,ING Income Fund- Regular Plan - Dividend Option (Annual),10.5184
2006-10-23,100181,ING Income Fund-Regular Plan -Growth Option,17.8803
2006-10-23,100182,ING Income Fund-Institutional Plan - Dividend Option (Half Yearly),10.0
2006-10-23,100183,ING Income Fund-Institutional Plan - Dividend Option (Quarterly),10.0
2006-10-23,100184,ING Income Fund-Institutional Plan -Dividend Option (Annual),10.5143
2006-10-23,100185,ING Income Fund-Bonus Option,10.9021
2006-10-23,100186,ING Income Fund-Institutional Bonus Option,11.1048
2006-10-23,100187,ING Income Fund-Institutional Plan - Growth Option,18.5504
2006-10-23,100188,ING Core Equity Fund-Dividend Option,13.61
2006-10-23,100189,ING Core Equity Fund-Growth Option,25.73
2006-10-23,100190,ING Liquid Fund-Regular Growth Option,15.3787
2006-10-23,100191,ING Liquid Fund-Regular Weekly Dividend Option,10.838
2006-10-23,100192,ING Liquid Fund-Regular Daily Dividend Option,10.7849
2006-10-23,100194,ING Liquid Fund-Auto Sweep Growth Option,10.0
2006-10-23,100195,ING Liquid Fund-Auto Sweep Weekly Dividend Option,10.0
2006-10-23,100196,ING Liquid Fund-Institutional Growth Option,11.3928
2006-10-23,100197,ING Liquid Fund-Institutional Weekly Dividend Option,10.0672
2006-10-23,100198,ING Liquid Fund-Institutional Daily Dividend Option,10.0103
2006-10-23,100199,ING Liquid Fund-Super Institutional Growth Option,10.7802
2006-10-23,100200,ING Liquid Fund-Super Institutional Daily Dividend Option,10.0024
2006-10-23,100201,ING Liquid Fund-Super Institutional Weekly Dividend Option,10.0978
2006-10-23,100202,ING Balanced Fund-Dividend Option,12.09
2006-10-23,100203,ING Balanced Fund-Growth Option,17.28
2006-10-23,100218,JM Large Cap Fund (Regular) - IDCW,15.94
2006-10-23,100219,JM Large Cap Fund (Regular) - Growth Option,35.48
2006-10-23,100220,JM Aggressive Hybrid Fund (Regular) - IDCW,16.29
2006-10-23,100221,JM Aggressive Hybrid Fund (Regular) -Growth Option,21.44
2006-10-23,100222,JM Medium to Long Duration Fund (Regular) - Quarterly IDCW,10.2187
2006-10-23,100223,JM Medium to Long Duration Fund (Regular) - Growth Option,28.3255
2006-10-23,100233,JM Liquid Fund (Regular) - Weekly IDCW,10.3658
2006-10-23,100234,JM Liquid Fund - Growth Option,19.922
2006-10-23,100237,JM High Liquidity Fund-- Institutional Plan - Growth,12.0186
2006-10-23,100238,JM High Liquidity Fund-Institutional Plan - Daily Dividend,10.0159
2006-10-23,100241,JM High Liquidity Fund-- Institutional Plan - Dividend,10.1312
2006-10-23,100243,JM High Liquidity Fund-- Premium Plan - Daily Dividend Option,10.0
2006-10-23,100244,JM Liquid Fund (Regular) - Quarterly IDCW,11.4699
2006-10-23,100245,JM High Liquidity Fund-Super Institutional Plan- Daily Dividend,10.0165
2006-10-23,100246,JM High Liquidity Fund-Super Institutional Plan- Weekly  Dividend,10.1188
2006-10-23,100247,JM Liquid Fund (Regular) - Super Institutional Plan - Growth Option,11.4283
2006-10-23,100249,JM G-Sec Fund - Quarterly Dividend Option,10.2197
2006-10-23,100250,JM G-Sec Fund - Growth Option,20.9039
2006-10-23,100251,JM G-Sec Fund-PF Plan - Growth Plan,21.7638
2006-10-23,100252,JM G-Sec Fund-PF Plan -Dividend Plan,19.9421
2006-10-23,100253,JM G-Sec Fund - Bonus Option - Principal Units,10.1685
2006-10-23,100254,JM Value Fund (Regular) - Growth Option,17.22
2006-10-23,100261,Kotak Gilt-Savings-Monthly Dividend,10.4402
2006-10-23,100262,Kotak Gilt-Savings-Growth,17.8023
2006-10-23,100263,Kotak Gilt-Savings-Annual Dividend,11.9049
2006-10-23,100264,Kotak Gilt-Investment Regular-Payout of Income Distribution cum capital withdrawal option,11.3195
2006-10-23,100265,Kotak Gilt-Investment Regular-Growth,23.5324
2006-10-23,100280,Kotak Gilt-Investment  Provident Fund and Trust-Payout of Income Distribution cum capital withdrawal option,10.909
2006-10-23,100281,Kotak Gilt-Investment  Provident Fund and Trust-Growth,23.8016
2006-10-23,100286,Kotak Aggressive Hybrid Fund - Regular Plan - IDCW - Payout & Reinvestment of Income Distribution cum capital withdrawal option,22.489
2006-10-23,100289,Kotak Tech,9.393
2006-10-23,100290,Kotak MNC,25.57
2006-10-23,100291,Kotak Bond-Deposit-Dividend,11.5943
2006-10-23,100292,Kotak Bond-Deposit-Growth,18.3452
2006-10-23,100298,Kotak Bond Regular Plan Quaterly Payout of Income Distribution cum capital withdrawal option,10.4437
2006-10-23,100299,Kotak Bond Fund - Regular Plan Growth,19.1548
2006-10-23,100300,Kotak Bond Fund - Regular Plan - Standard IDCW Option,12.8014
2006-10-23,100301,Kotak Bond Regular Plan Bonus Plan,12.7677
2006-10-23,100312,LIC MF Flexi Cap Fund-Regular Plan-IDCW,13.195
2006-10-23,100313,LIC MF Flexi Cap Fund-Regular Plan-Growth,19.3311
2006-10-23,100314,LIC MF Medium to Long Duration Fund-Regular Plan-IDCW,10.2455
2006-10-23,100315,LIC MF Medium to Long Duration Fund-Regular Plan-Growth,19.8554
2006-10-23,100316,LIC MF Gilt Fund-Regular Plan-IDCW,10.8392
2006-10-23,100317,LIC MF Gilt Fund-Regular Plan-Growth,18.6501
2006-10-23,100318,LIC MF Gilt Fund-PF Plan-IDCW,10.7544
2006-10-23,100319,LIC MF Gilt Fund-PF Plan-Growth,10.7544
2006-10-23,100321,LIC MF Aggressive Hybrid Fund-Regular Plan-IDCW,11.4126
2006-10-23,100323,LIC MF Aggressive Hybrid Fund-Regular Plan-Growth,42.4052
2006-10-23,100325,LIC MF ULIS (5 Yrs. Single Premium)-Regular Plan-IDCW Reinvestment,11.9743
2006-10-23,100332,LIC MF Large Cap Fund-Regular Plan-IDCW,10.194
2006-10-23,100337,SaharaTax Gain-Dividend,17.0665
2006-10-23,100338,SaharaTax Gain-Growth,19.5377
2006-10-23,100347,Morgan Stanley Growth Fund- Regular Growth Plan,46.69
2006-10-23,100348,ICICI Prudential Large & Mid Cap Fund - IDCW,23.3
2006-10-23,100349,ICICI Prudential Large & Mid Cap Fund - Growth,85.66
2006-10-23,100350,ICICI Prudential Large & Mid Cap Fund - Institutional Option - I - Growth,11.33
2006-10-23,100351,ICICI Prudential FMCG Fund - IDCW,32.29
2006-10-23,100352,ICICI Prudential FMCG Fund - Growth,38.51
2006-10-23,100353,ICICI Prudential ELSS Tax Saver Fund - IDCW,29.25
2006-10-23,100354,ICICI Prudential ELSS Tax Saver Fund - Growth,91.11
2006-10-23,100355,ICICI Prudential Equity & Debt Fund - Monthly IDCW,16.8
2006-10-23,100356,ICICI Prudential Equity & Debt Fund - Growth,32.22
2006-10-23,100357,ICICI Prudential Liquid Fund -Quarterly IDCW,10.7697
2006-10-23,100359,ICICI Prudential Liquid Institutional Plus Fund - Div - Daily,11.8515
2006-10-23,100360,ICICI Prudential Liquid Institutional Plus Fund - Div - Weekly,11.8692
2006-10-23,100361,ICICI Prudential Liquid Fund-Dividend-Institutional Plus - Monthly,11.971
2006-10-23,100362,ICICI Prudential Liquid Institutional Plus Fund - Growth,18.0065
2006-10-23,100363,ICICI Prudential Technology Fund - Growth,12.52
2006-10-23,100364,ICICI Prudential Long Term Bond Fund - Half Yearly IDCW,10.465
2006-10-23,100365,ICICI Prudential Long Term Bond Fund - Growth,21.2905
2006-10-23,100366,ICICI Prudential Long Term Bond Fund-Institutional Quarterly Dividend,10.2084
2006-10-23,100367,ICICI Prudential Long Term Bond Fund - Quarterly IDCW,11.0345
2006-10-23,100368,ICICI Prudential Gilt Fund - IDCW,10.7237
2006-10-23,100369,ICICI Prudential Gilt Fund - Growth,21.8502
2006-10-23,100370,ICICI Prudential Short Term Gilt Fund - Dividend,10.552
2006-10-23,100371,ICICI Prudential Short Term Gilt Fund - Growth,17.6809
2006-10-23,100372,ICICI Prudential Short Term Gilt Fund - Half Yearly Dividend,10.2969
2006-10-23,100375,NIPPON INDIA GROWTH MID CAP FUND - IDCW Option,54.47
2006-10-23,100376,Nippon India Growth Mid Cap Fund-Growth Plan-Bonus Option,40.36
2006-10-23,100377,Nippon India Growth Mid Cap Fund-Growth Plan-Growth Option,243.41
2006-10-23,100378,Nippon India Vision Large & Midcap Fund - IDCW Option,49.22
2006-10-23,100379,Nippon India Vision Large & Midcap Fund-GROWTH PLAN-Bonus Option,27.68
2006-10-23,100380,Nippon India Vision Large & Midcap Fund-GROWTH PLAN-Growth Option,165.17
2006-10-23,100381,UTI Large Cap Fund-Income Option,16.49
2006-10-23,100382,UTI Large Cap Fund-Growth Option,18.91
2006-10-23,100383,NIPPON INDIA MEDIUM TO LONG DURATION FUND - MONTHLY IDCW Option,11.0341
2006-10-23,100384,NIPPON INDIA MEDIUM TO LONG DURATION  FUND - QUARTERLY IDCW Option,11.7321
2006-10-23,100385,NIPPON INDIA MEDIUM TO LONG DURATION  FUND - HALF YEARLY IDCW Option,11.1711
2006-10-23,100386,NIPPON INDIA MEDIUM TO LONG DURATION  FUND - ANNUAL IDCW Option,11.8846
2006-10-23,100387,Nippon India Medium to Long Duration  Fund - Growth Plan Growth Option,22.8802
2006-10-23,100388,Nippon India Medium to Long Duration  Fund - Growth Plan Bonus Option,10.7807
2006-10-23,100414,Tata Aggressive Hybrid Fund- Regular Plan - Growth Option,45.3982
2006-10-23,100415,Tata Ethical Fund-Regular Plan - Growth Option,43.5069
2006-10-23,100416,Tata Long Term Debt Fund - Regular Plan - Quarterly Dividend,10.3963
2006-10-23,100417,Tata Income Fund-Regular Plan - Half Yearly Payout of IDCW Option,10.8042
2006-10-23,100418,Tata Income Fund -Regular Plan - Growth Option,24.5717
2006-10-23,100470,Franklin India Large Cap Fund - IDCW,39.87
2006-10-23,100471,Franklin India Large Cap Fund-Growth,120.21
2006-10-23,100472,Franklin India Mid Cap Fund - IDCW,52.83
2006-10-23,100473,Franklin India Mid Cap Fund-Growth,189.74
2006-10-23,100474,Tata ELSS Fund- Regular Plan - Payout of IDCW Option,39.0479
2006-10-23,100475,Tata Large Cap Fund -Regular Plan - Growth Option,56.0115
2006-10-23,100476,Taurus Flexi Cap Fund - Regular Plan - Growth,34.53
2006-10-23,100477,Taurus Mid Cap Fund - Regular Plan - Growth,14.05
2006-10-23,100480,Taurus ELSS Tax Saver Fund - Regular Plan - Growth,16.83
2006-10-23,100481,Franklin India Balanced Fund-Growth,33.03
2006-10-23,100482,Franklin India Balanced Fund-Div,28.54
2006-10-23,100483,Franklin India Growth Fund,26.7
2006-10-23,100484,Franklin India Index Fund- NSE Nifty 50 Index Fund - Growth,29.0462
2006-10-23,100485,Franklin India Govt.Sec. Fund-Composite Plan - Growth,23.8012
2006-10-23,100486,Franklin India Govt.Sec. Fund-Composite Plan - Dividend,10.7842
2006-10-23,100487,Franklin India Govt.Sec. Fund-Treasury Plan(Dividend Option),10.6819
2006-10-23,100489,Franklin India Govt.Sec. Fund-Treasury Plan(Growth Option),13.6303
2006-10-23,100490,Franklin India Govt.Sec. Fund-PF Plan - Growth,10.4529
2006-10-23,100491,Franklin India Govt.Sec. Fund-PF Plan - Dividend,10.4529
2006-10-23,100493,Franklin India Government Securities Fund - Growth,16.2215
2006-10-23,100494,Franklin India Government Securities Fund - IDCW,10.8374
2006-10-23,100495,Franklin India Govt.Sec. Fund-Long Term Plan - Bonus,12.3989
2006-10-23,100496,Templeton India Value Fund - Growth Plan,62.7
2006-10-23,100497,Templeton India Value Fund - IDCW,40.99
2006-10-23,100498,Franklin India Dynamic Accrual Fund - IDCW,10.5056
2006-10-23,100499,Franklin India Dynamic Accrual Fund-Growth,25.3304
2006-10-23,100503,Franklin India Low Duration Fund - Monthly - IDCW,10.2656
2006-10-23,100504,Franklin India Low Duration Fund - Quarterly - IDCW,10.2449
2006-10-23,100505,Templeton Monthly Income Plan-Half Yearly Dividend,12.0928
2006-10-23,100506,Templeton Monthly Income Plan-Growth,19.4972
2006-10-23,100519,Franklin India Flexi Cap Fund - IDCW,36.27
2006-10-23,100520,Franklin India Flexi Cap Fund - Growth,123.68
2006-10-23,100521,Franklin India Technology Fund - IDCW,24.28
2006-10-23,100522,Franklin India Technology Fund-Growth,49.18
2006-10-23,100523,Franklin FMCG Fund - Growth,35.76
2006-10-23,100524,Franklin INDIA OPPORTUNITIES FUND - IDCW,16.8
2006-10-23,100525,Franklin India ELSS Tax Saver Fund - IDCW,37.9
2006-10-23,100526,Franklin India ELSS Tax Saver Fund-Growth,120.19
2006-10-23,100527,Franklin India Corporate Debt Fund - Plan A - Annual - IDCW,10.5004
2006-10-23,100528,Franklin India Corporate Debt Fund - Growth,24.6329
2006-10-23,100529,Franklin India Corporate Debt Fund - Plan B - Monthly - IDCW,14.0073
2006-10-23,100530,Franklin India Corporate Debt Fund - Plan B - Quarterly - IDCW,13.9403
2006-10-23,100531,Franklin India Corporate Debt Fund - Plan B - Half yearly - IDCW,13.8303
2006-10-23,100532,Franklin India Corporate Debt Fund - Monthly Bonus,19.5272
2006-10-23,100535,Franklin India Retirement Fund - IDCW,18.1492
2006-10-23,100536,Franklin India Retirement Fund - Growth,41.505
2006-10-23,100537,Franklin India Liquid Fund - Regular Plan - Weekly - IDCW,1244.5282
2006-10-23,100538,Franklin India Liquid Fund - Regular Plan - Growth,1805.1057
2006-10-23,100541,Franklin India Liquid Fund - Regular Plan - Daily - IDCW,1512.34
2006-10-23,100542,Franklin India Liquid Fund - Liquid Plan - Weekly Dividend,1000.7147
2006-10-23,100543,Franklin India Liquid Fund - Liquid Plan - Daily IDCW,1000.25
2006-10-23,100544,Franklin India Liquid Fund - Liquid Plan - Growth,1111.416
2006-10-23,100546,Franklin India Liquid Fund - Super Institutional Plan - Growth,1071.6771
2006-10-23,100547,Franklin India Liquid Fund - Super Institutional Plan - Daily - IDCW,1000.25
2006-10-23,100548,Franklin India Liquid Fund - Super Institutional Plan - Weekly - IDCW,1016.3203
2006-10-23,100549,Franklin India Aggressive Hybrid Fund - IDCW,21.7791
2006-10-23,100550,Franklin India Aggressive Hybrid Fund - Growth Plan,30.5797
2006-10-23,100551,Templeton India Children’s Asset Plan-Education Plan,24.3469
2006-10-23,100552,Templeton India Children’s Asset Plan-Gift Plan - Growth,28.5752
2006-10-23,100553,Templeton India Children’s Asset Plan-Gift Plan - Dividend,28.5752
2006-10-23,100556,Franklin India Taxshield 97,114.8
2006-10-23,100557,Franklin India Taxshield 98,112.83
2006-10-23,100558,Franklin India Taxshield 99,66.93
2006-10-23,100561,Templeton India Money Market Account - Bonus Plan,1.0
2006-10-23,100563,DBS Chola Triple Ace-Regular -Cumulative,23.8704
2006-10-23,100567,DBS Chola Triple Ace-Regular - Quarterly Dividend,11.2392
2006-10-23,100569,DBS Chola Triple Ace-Semi Annual Dividend,11.5509
2006-10-23,100573,DBS Chola Triple Ace-Regular Bonus,13.2634
2006-10-23,100574,DBS Chola Freedom Income -Short Term Fund-Regular-Monthly Dividend,10.9637
2006-10-23,100575,DBS Chola Freedom Income -Short Term Fund-Regular - Cumulative,11.5013
2006-10-23,100576,DBS Chola Freedom Income -Short Term Fund-Cum- Institutional Plan,11.6381
2006-10-23,100579,DBS Chola Gilt-Investment-Quarterly Dividend,10.1471
2006-10-23,100580,DBS Chola Gilt-Investment-Cumulative,18.4487
2006-10-23,100589,Canara Robeco Expo-Income Plan,18.85
2006-10-23,100590,Canara Robeco Expo-Growth Plan,49.53
2006-10-23,100593,CANARA ROBECO ELSS TAX SAVER - REGULAR PLAN -IDCW (Payout),19.86
2006-10-23,100596,CANARA ROBECO GILT FUND - REGULAR PLAN - IDCW (Payout/Reinvestment),10.3618
2006-10-23,100597,CANARA ROBECO GILT FUND - REGULAR PLAN - GROWTH OPTION,18.1554
2006-10-23,100600,CANARA ROBECO CONSERVATIVE HYBRID FUND - REGULAR PLAN - MONTHLY IDCW (Payout/Reinvestment),11.79
2006-10-23,100601,CANARA ROBECO CONSERVATIVE HYBRID FUND - REGULAR PLAN - GROWTH OPTION,18.32
2006-10-23,100602,Sundaram Medium Duration Fund (Formerly Known as Sundaram Medium Term Bond Fund) Regular Plan-Income Distribution cum Capital Withdrawal(IDCW),10.3249
2006-10-23,100603,Sundaram Medium Duration Fund (Formerly Known as Sundaram Medium Term Bond Fund) Regular Plan - Growth,22.4582
2006-10-23,100604,Sundaram Medium Duration Fund (Formerly Known as Sundaram Medium Term Bond Fund) Regular Plan -Growth,11.8256
2006-10-23,100609,Sundaram Medium Duration Fund (Formerly Known as Sundaram Medium Term Bond Fund) Regular Plan- Income Distribution cum Capital Withdrawal(IDCW),10.3185
2006-10-23,100610,Sundaram Medium Duration Fund (Formerly Known as Sundaram Medium Term Bond Fund) Regular Plan -Income Distribution cum Capital Withdrawal (IDCW),10.3238
2006-10-23,100611,Sundaram Medium Duration Fund (Formerly Known as Sundaram Medium Term Bond Fund) Institutional Plan -Growth,11.4702
2006-10-23,100612,Sundaram Growth Fund-Dividend,13.4972
2006-10-23,100613,Sundaram Growth Fund-Growth,61.7176
2006-10-23,100614,Sundaram Value Fund Regular Plan - Income Distribution cum Capital Withdrawal (IDCW),16.0084
2006-10-23,100617,Sundaram Equity Hybrid Fund Regular Plan - Growth,30.8043
2006-10-23,100618,Sundaram Money Fund Retail Plan - Growth,15.2301
2006-10-23,100619,Sundaram Money Fund Retail Plan - Quarterly Reinvestment of Income Distribution cum Capital Withdrawal (IDCW),10.2075
2006-10-23,100620,Sundaram Money Fund Retail Plan - Daily Reinvestment of Income Distribution cum Capital Withdrawal (IDCW),10.0953
2006-10-23,100621,Sundaram Money Fund Retail Plan - Weekly Reinvestment of Income Distribution cum Capital Withdrawal (IDCW),10.2886
2006-10-23,100622,Sundaram Money Fund Retail Plan - Fortnightly Reinvestment of Income Distribution cum Capital Withdrawal (IDCW),10.2008
2006-10-23,100623,Sundaram Money Fund Retail Plan - Monthly Income Distribution cum Capital Withdrawal (IDCW),10.1454
2006-10-23,100630,quant Multi Cap Fund-IDCW Option - Regular Plan,15.2253
2006-10-23,100631,quant Multi Cap Fund-GROWTH OPTION - Regular Plan,51.7038
2006-10-23,100638,SBI Medium to Long Duration Fund - Regular Plan - Half Yearly - Income Distribution cum Capital Withdrawal Option (IDCW),10.0916
2006-10-23,100639,SBI Medium to Long Duration Fund-REGULAR PLAN-Growth,19.5363
2006-10-23,100640,SBI Medium to Long Duration Fund-REGULAR PLAN-Bonus,11.834
2006-10-23,100641,SBI ULTRA SHORT DURATION FUND - REGULAR PLAN - GROWTH,16.2746
2006-10-23,100643,SBI Technology Opportunities Fund - Regular Plan - Income Distribution cum Capital Withdrawal Option (IDCW),23.06
2006-10-23,100644,SBI Healthcare Opportunities Fund - Regular Plan - Income Distribution cum Capital Withdrawal Option (IDCW),28.64
2006-10-23,100645,SBI Consumption Opportunities Fund - Regular Plan - Income Distribution cum Capital Withdrawal Option (IDCW),14.47
2006-10-23,100646,UTI - Unit Linked Insurance Plan,15.2788
2006-10-23,100648,UTI - CRTS 81 - Dividend Option,107.1831
2006-10-23,100650,UTI Large Cap Fund - Regular Plan - IDCW,28.43
2006-10-23,100651,UTI Large Cap Fund - Regular Plan - Growth Option,31.77
2006-10-23,100656,UTI - Master Plus Unit Scheme-Growth Option,59.56
2006-10-23,100657,UTI - Master Plus Unit Scheme-Income Option,53.01
2006-10-23,100663,UTI Large & Mid Cap Fund - Regular Plan - IDCW,37.93
2006-10-23,100664,UTI Large & Mid Cap Fund - Regular Plan - Growth Option,41.14
2006-10-23,100668,UTI Flexi Cap Fund - Regular Plan - IDCW,28.68
2006-10-23,100669,UTI - Flexi Cap Fund-Growth Option,31.02
2006-10-23,100676,Benchmark Derivative Fund - Growth Plan,1120.8435
2006-10-23,100678,UTI Children's Hybrid Fund - Regular Plan,14.7164
2006-10-23,100682,UTI Retirement Fund - Regular Plan,19.5643
2006-10-23,100684,UTI Aggressive Hybrid Fund - Regular Plan - Growth,53.87
2006-10-23,100685,UTI Aggressive Hybrid Fund - Regular Plan - IDCW,21.29
2006-10-23,100711,UTI - INDEX SELECT FUND-Income Option,21.78
2006-10-23,100712,UTI - INDEX SELECT FUND-Growth Option,32.29
2006-10-23,100715,DBS Chola Multi-Cap Fund-Dividend Option,13.97
2006-10-23,100716,DBS Chola Multi-Cap Fund-Cumulative Option,17.52
2006-10-23,100723,UTI MMF-Discontinued - Regular Plan -Growth,20.3498
2006-10-23,100724,UTI MMF- Discontinued - Regular Plan - Flexi Dividend Option,17.5803
2006-10-23,100725,UTI MMF- Discontinued - Regular Plan - Periodic Dividend Option,17.4646
2006-10-23,100739,UTI MNC Fund - Regular Plan - IDCW,28.0
2006-10-23,100740,UTI - MNC Fund - Regular Plan - Growth Option,33.71
2006-10-23,100741,UTI Medium to Long Duration Fund- Regular Plan - Growth,21.3582
2006-10-23,100742,UTI Medium to Long Duration Fund - Regular Plan - Quarterly IDCW,10.8995
2006-10-23,100748,UTI - Master Index Fund-Income Option,39.6596
2006-10-23,100749,UTI - Master Index Fund-Growth Option,39.6596
2006-10-23,100750,UTI - Master Value Fund-Income Option,18.71
2006-10-23,100751,UTI - Master Value Fund-Growth Option,28.7
2006-10-23,100780,Sundaram Banking & PSU Fund (Formerly Known as Sundaram Banking and PSU Debt Fund) Retail Plan - Monthly Income Distribution cum Capital Withdrawal (IDCW),10.1941
2006-10-23,100781,Sundaram Banking & PSU Fund (Formerly Known as Sundaram Banking and PSU Debt Fund) Retail Plan - Growth,11.0168
2006-10-23,100782,Sundaram Banking & PSU Fund (Formerly Known as Sundaram Banking and PSU Debt Fund) Regular Plan - Daily Reinvestment of Income Distribution cum Capital Withdrawal (IDCW),10.0519
