date,scheme_code,scheme_name,nav
2006-10-30,100027,Grindlays Super Saver Income Fund-GSSIF-Half Yearly Dividend,10.2174
2006-10-30,100028,Grindlays Super Saver Income Fund-GSSIF-Quaterly Dividend,10.2307
2006-10-30,100029,Grindlays Super Saver Income Fund-GSSIF-Growth,16.6146
2006-10-30,100030,Grindlays Super Saver Income Fund-GSSIF-Annual Dividend,10.4417
2006-10-30,100031,Grindlays Super Saver Income Fund-GSSIF - ST-Dividend,10.0685
2006-10-30,100032,Grindlays Super Saver Income Fund-GSSIF - ST-Growth,14.4607
2006-10-30,100033,Aditya Birla Sun Life Large & Mid Cap Fund - Regular Growth,117.85
2006-10-30,100034,Aditya Birla Sun Life Large & Mid Cap Fund -Regular - IDCW,84.54
2006-10-30,100035,Birla Sun Life Freedom Fund-Plan A (Dividend),18.09
2006-10-30,100036,Birla Sun Life Freedom Fund-Plan B (Growth),27.21
2006-10-30,100037,Aditya Birla Sun Life Income Fund - Regular - Quarterly IDCW,10.2513
2006-10-30,100038,Aditya Birla Sun Life Income Fund - Growth - Regular Plan,30.0665
2006-10-30,100041,Aditya Birla Sun Life Liquid Fund -Institutional - IDCW,10.8023
2006-10-30,100042,Aditya Birla Sun Life Liquid Fund-Retail (Growth),19.5446
2006-10-30,100043,Aditya Birla Sun Life Liquid Fund-Institutional (Growth),19.6746
2006-10-30,100044,Aditya Birla Sun Life Liquid Fund -Retail - IDCW,16.3694
2006-10-30,100046,Aditya Birla Sun Life Liquid Fund -Daily IDCW,10.0195
2006-10-30,100047,Aditya Birla Sun Life Liquid Fund - Growth,11.5462
2006-10-30,100048,Aditya Birla Sun Life Liquid Fund -Institutional - weekly  IDCW,10.8129
2006-10-30,100049,Aditya Birla Sun Life Cash Plus-Institutional - Fortnightly Dividend,10.8271
2006-10-30,100051,Aditya Birla Sun Life Liquid Fund -weekly IDCW,10.0284
2006-10-30,100052,Aditya Birla Sun Life Cash Plus-Institutional Premium - Fortnightly Dividend,10.0502
2006-10-30,100053,Aditya Birla Sun Life Cash Plus-Institutional Premium Plan-Monthly Dividend,10.0604
2006-10-30,100054,Aditya Birla Sun Life Gilt Plus - Liquid Plan - Quarterly Dividend - Regular Plan,10.7116
2006-10-30,100055,Aditya Birla Sun Life Gilt Plus - Liquid Plan - Growth - Regular Plan,17.6896
2006-10-30,100056,Aditya Birla Sun Life Gilt Plus - Liquid Plan - Annual Dividend - Regular Plan,11.7794
2006-10-30,100057,Aditya Birla Sun Life Govenment Securities Fund -Regular - Quarterly IDCW,10.6899
2006-10-30,100058,Aditya Birla Sun Life Government Securities Fund  - Growth - Regular Plan,20.4666
2006-10-30,100059,Aditya Birla Sun Life Gilt Plus-PF Plan (Annual Dividend),20.4675
2006-10-30,100060,Aditya Birla Sun Life Constant Maturity 10 Year Gilt Fund - Quarterly Dividend - Regular Plan,11.2387
2006-10-30,100061,Aditya Birla Sun Life Constant Maturity 10 Year Gilt Fund - Growth - Regular Plan,22.9805
2006-10-30,100062,Aditya Birla Sun Life Gilt Plus-Regular Plan (Annual Dividend),23.0275
2006-10-30,100063,Aditya Birla Sun Life MNC Fund - Regular - IDCW,59.52
2006-10-30,100064,Aditya Birla Sun Life MNC Fund - Growth - Regular Plan,118.74
2006-10-30,100065,Aditya Birla Sun Life India Opportunities Fund - Dividend - Regular Plan,20.94
2006-10-30,100066,Aditya Birla Sun Life India Opportunities Fund - Growth - Regular Plan,48.76
2006-10-30,100067,Aditya Birla Sun Life Tax Plan -Regular - IDCW,55.14
2006-10-30,100068,BARODA ELSS 96 - Plan A - IDCW,24.32
2006-10-30,100069,BARODA PIONEER DIVERSIFIED FUND,30.45
2006-10-30,100077,DSP Bond Fund - IDCW,10.6315
2006-10-30,100078,DSP Bond Fund - Growth,24.5559
2006-10-30,100079,DSP Bond Fund - IDCW - Monthly,10.3597
2006-10-30,100080,DSP Flexi Cap Fund - Regular Plan - IDCW,42.38
2006-10-30,100081,DSP Aggressive Hybrid Fund- Regular Plan - Growth,36.6
2006-10-30,100082,DSP Aggressive Hybrid Fund- Regular Plan - IDCW,21.23
2006-10-30,100084,DSP Gilt Fund - Regular Plan - Growth,22.9523
2006-10-30,100085,DSP Gilt Fund - Regular Plan - IDCW,11.4395
2006-10-30,100086,DSP Gilt Fund - Regular Plan - IDCW - Monthly,10.1204
2006-10-30,100087,DSP Savings Fund - Regular Plan - Growth,16.6255
2006-10-30,100088,DSP Savings Fund - Regular Plan - IDCW,10.9676
2006-10-30,100089,DSP Savings Fund - Regular Plan - IDCW - Monthly,10.053
2006-10-30,100090,DSP BlackRock Technology.com   Fund - Regular Plan - Growth,20.11
2006-10-30,100119,HDFC Balanced Advantage Fund - Growth Plan,45.185
2006-10-30,100120,HDFC Balanced Advantage Fund - IDCW Plan,27.796
2006-10-30,100121,HDFC Balanced Fund - Dividend Option,20.283
2006-10-30,100122,HDFC Balanced Fund - Growth Option,31.542
2006-10-30,100123,HDFC Income Fund - Quarterly IDCW Option,10.2559
2006-10-30,100124,HDFC Income Fund - Growth Option,16.5915
2006-10-30,100136,Principal Deposit Fund-Plan 54EA/EB-Plan 54EA /EB,17.5527
2006-10-30,100150,Principal Child Benefit Fund-Super Saver-Future Guard Plan,49.61
2006-10-30,100151,Principal Retail Equity Savings Fund - Growth Option,50.27
2006-10-30,100152,Principal Nifty 100 Equal Weight Fund-Income Distribution CUM Capital Withdrawal,21.1016
2006-10-30,100153,Principal Nifty 100 Equal Weight Fund-Growth,27.281
2006-10-30,100156,Principal Tax Savings Fund,73.9
2006-10-30,100171,Quant Dynamic Bond-Dividend,10.1033
2006-10-30,100172,Quant Dynamic Bond-Growth,22.3413
2006-10-30,100173,Quant Dynamic Bond-Bonus,11.7667
2006-10-30,100174,quant ELSS Tax Saver Fund - IDCW Option - Regular Plan,14.3925
2006-10-30,100175,quant ELSS Tax Saver Fund - Growth Option - Regular Plan,40.8875
2006-10-30,100176,quant Small Cap Fund - IDCW Option - Regular Plan,16.1849
2006-10-30,100177,quant Small Cap Fund - Growth - Regular Plan,19.1723
2006-10-30,100178,ING Income Fund-Regular Plan -Dividend Option (Quarterly),10.1794
2006-10-30,100179,ING Income Fund-Regular Plan -Dividend Option (Half Yearly),10.1995
2006-10-30,100180,ING Income Fund- Regular Plan - Dividend Option (Annual),10.5365
2006-10-30,100181,ING Income Fund-Regular Plan -Growth Option,17.9111
2006-10-30,100182,ING Income Fund-Institutional Plan - Dividend Option (Half Yearly),10.0
2006-10-30,100183,ING Income Fund-Institutional Plan - Dividend Option (Quarterly),10.0
2006-10-30,100184,ING Income Fund-Institutional Plan -Dividend Option (Annual),10.5346
2006-10-30,100185,ING Income Fund-Bonus Option,10.9209
2006-10-30,100186,ING Income Fund-Institutional Bonus Option,11.1262
2006-10-30,100187,ING Income Fund-Institutional Plan - Growth Option,18.5862
2006-10-30,100188,ING Core Equity Fund-Dividend Option,13.82
2006-10-30,100189,ING Core Equity Fund-Growth Option,26.13
2006-10-30,100190,ING Liquid Fund-Regular Growth Option,15.3987
2006-10-30,100191,ING Liquid Fund-Regular Weekly Dividend Option,10.8382
2006-10-30,100192,ING Liquid Fund-Regular Daily Dividend Option,10.7849
2006-10-30,100194,ING Liquid Fund-Auto Sweep Growth Option,10.0
2006-10-30,100195,ING Liquid Fund-Auto Sweep Weekly Dividend Option,10.0
2006-10-30,100196,ING Liquid Fund-Institutional Growth Option,11.4082
2006-10-30,100197,ING Liquid Fund-Institutional Weekly Dividend Option,10.0674
2006-10-30,100198,ING Liquid Fund-Institutional Daily Dividend Option,10.0103
2006-10-30,100199,ING Liquid Fund-Super Institutional Growth Option,10.7951
2006-10-30,100200,ING Liquid Fund-Super Institutional Daily Dividend Option,10.0024
2006-10-30,100201,ING Liquid Fund-Super Institutional Weekly Dividend Option,10.0982
2006-10-30,100202,ING Balanced Fund-Dividend Option,12.26
2006-10-30,100203,ING Balanced Fund-Growth Option,17.52
2006-10-30,100218,JM Large Cap Fund (Regular) - IDCW,16.39
2006-10-30,100219,JM Large Cap Fund (Regular) - Growth Option,36.48
2006-10-30,100220,JM Aggressive Hybrid Fund (Regular) - IDCW,16.62
2006-10-30,100221,JM Aggressive Hybrid Fund (Regular) -Growth Option,21.87
2006-10-30,100222,JM Medium to Long Duration Fund (Regular) - Quarterly IDCW,10.2275
2006-10-30,100223,JM Medium to Long Duration Fund (Regular) - Growth Option,28.3499
2006-10-30,100233,JM Liquid Fund (Regular) - Weekly IDCW,10.3677
2006-10-30,100234,JM Liquid Fund - Growth Option,19.9489
2006-10-30,100237,JM High Liquidity Fund-- Institutional Plan - Growth,12.0348
2006-10-30,100238,JM High Liquidity Fund-Institutional Plan - Daily Dividend,10.0159
2006-10-30,100241,JM High Liquidity Fund-- Institutional Plan - Dividend,10.1332
2006-10-30,100243,JM High Liquidity Fund-- Premium Plan - Daily Dividend Option,10.0
2006-10-30,100244,JM Liquid Fund (Regular) - Quarterly IDCW,11.4854
2006-10-30,100245,JM High Liquidity Fund-Super Institutional Plan- Daily Dividend,10.0165
2006-10-30,100246,JM High Liquidity Fund-Super Institutional Plan- Weekly  Dividend,10.1207
2006-10-30,100247,JM Liquid Fund (Regular) - Super Institutional Plan - Growth Option,11.4437
2006-10-30,100249,JM G-Sec Fund - Quarterly Dividend Option,10.233
2006-10-30,100250,JM G-Sec Fund - Growth Option,20.931
2006-10-30,100251,JM G-Sec Fund-PF Plan - Growth Plan,21.7861
2006-10-30,100252,JM G-Sec Fund-PF Plan -Dividend Plan,19.9626
2006-10-30,100253,JM G-Sec Fund - Bonus Option - Principal Units,10.1817
2006-10-30,100254,JM Value Fund (Regular) - Growth Option,17.47
2006-10-30,100261,Kotak Gilt-Savings-Monthly Dividend,10.4503
2006-10-30,100262,Kotak Gilt-Savings-Growth,17.8194
2006-10-30,100263,Kotak Gilt-Savings-Annual Dividend,11.9164
2006-10-30,100264,Kotak Gilt-Investment Regular-Payout of Income Distribution cum capital withdrawal option,11.3273
2006-10-30,100265,Kotak Gilt-Investment Regular-Growth,23.5485
2006-10-30,100280,Kotak Gilt-Investment  Provident Fund and Trust-Payout of Income Distribution cum capital withdrawal option,10.9173
2006-10-30,100281,Kotak Gilt-Investment  Provident Fund and Trust-Growth,23.8198
2006-10-30,100286,Kotak Aggressive Hybrid Fund - Regular Plan - IDCW - Payout & Reinvestment of Income Distribution cum capital withdrawal option,22.726
2006-10-30,100289,Kotak Tech,9.543
2006-10-30,100290,Kotak MNC,25.8
2006-10-30,100291,Kotak Bond-Deposit-Dividend,11.6055
2006-10-30,100292,Kotak Bond-Deposit-Growth,18.3629
2006-10-30,100298,Kotak Bond Regular Plan Quaterly Payout of Income Distribution cum capital withdrawal option,10.4573
2006-10-30,100299,Kotak Bond Fund - Regular Plan Growth,19.1797
2006-10-30,100300,Kotak Bond Fund - Regular Plan - Standard IDCW Option,12.818
2006-10-30,100301,Kotak Bond Regular Plan Bonus Plan,12.7843
2006-10-30,100312,LIC MF Flexi Cap Fund-Regular Plan-IDCW,10.9905
2006-10-30,100313,LIC MF Flexi Cap Fund-Regular Plan-Growth,19.8655
2006-10-30,100314,LIC MF Medium to Long Duration Fund-Regular Plan-IDCW,10.2568
2006-10-30,100315,LIC MF Medium to Long Duration Fund-Regular Plan-Growth,19.8773
2006-10-30,100316,LIC MF Gilt Fund-Regular Plan-IDCW,10.8537
2006-10-30,100317,LIC MF Gilt Fund-Regular Plan-Growth,18.675
2006-10-30,100318,LIC MF Gilt Fund-PF Plan-IDCW,10.7687
2006-10-30,100319,LIC MF Gilt Fund-PF Plan-Growth,10.7687
2006-10-30,100321,LIC MF Aggressive Hybrid Fund-Regular Plan-IDCW,11.673
2006-10-30,100323,LIC MF Aggressive Hybrid Fund-Regular Plan-Growth,43.3726
2006-10-30,100325,LIC MF ULIS (5 Yrs. Single Premium)-Regular Plan-IDCW Reinvestment,12.1398
2006-10-30,100332,LIC MF Large Cap Fund-Regular Plan-IDCW,10.3732
2006-10-30,100337,SaharaTax Gain-Dividend,17.3405
2006-10-30,100338,SaharaTax Gain-Growth,19.8514
2006-10-30,100347,Morgan Stanley Growth Fund- Regular Growth Plan,48.03
2006-10-30,100348,ICICI Prudential Large & Mid Cap Fund - IDCW,24.02
2006-10-30,100349,ICICI Prudential Large & Mid Cap Fund - Growth,88.32
2006-10-30,100350,ICICI Prudential Large & Mid Cap Fund - Institutional Option - I - Growth,11.68
2006-10-30,100351,ICICI Prudential FMCG Fund - IDCW,32.56
2006-10-30,100352,ICICI Prudential FMCG Fund - Growth,38.83
2006-10-30,100353,ICICI Prudential ELSS Tax Saver Fund - IDCW,29.3
2006-10-30,100354,ICICI Prudential ELSS Tax Saver Fund - Growth,91.27
2006-10-30,100355,ICICI Prudential Equity & Debt Fund - Monthly IDCW,17.18
2006-10-30,100356,ICICI Prudential Equity & Debt Fund - Growth,32.95
2006-10-30,100357,ICICI Prudential Liquid Fund -Quarterly IDCW,10.7832
2006-10-30,100359,ICICI Prudential Liquid Institutional Plus Fund - Div - Daily,11.8515
2006-10-30,100360,ICICI Prudential Liquid Institutional Plus Fund - Div - Weekly,11.8691
2006-10-30,100361,ICICI Prudential Liquid Fund-Dividend-Institutional Plus - Monthly,11.9868
2006-10-30,100362,ICICI Prudential Liquid Institutional Plus Fund - Growth,18.0303
2006-10-30,100363,ICICI Prudential Technology Fund - Growth,12.6
2006-10-30,100364,ICICI Prudential Long Term Bond Fund - Half Yearly IDCW,10.4797
2006-10-30,100365,ICICI Prudential Long Term Bond Fund - Growth,21.3205
2006-10-30,100366,ICICI Prudential Long Term Bond Fund-Institutional Quarterly Dividend,10.2238
2006-10-30,100367,ICICI Prudential Long Term Bond Fund - Quarterly IDCW,11.0501
2006-10-30,100368,ICICI Prudential Gilt Fund - IDCW,10.7476
2006-10-30,100369,ICICI Prudential Gilt Fund - Growth,21.899
2006-10-30,100370,ICICI Prudential Short Term Gilt Fund - Dividend,10.5622
2006-10-30,100371,ICICI Prudential Short Term Gilt Fund - Growth,17.698
2006-10-30,100372,ICICI Prudential Short Term Gilt Fund - Half Yearly Dividend,10.3068
2006-10-30,100375,NIPPON INDIA GROWTH MID CAP FUND - IDCW Option,55.91
2006-10-30,100376,Nippon India Growth Mid Cap Fund-Growth Plan-Bonus Option,41.42
2006-10-30,100377,Nippon India Growth Mid Cap Fund-Growth Plan-Growth Option,249.82
2006-10-30,100378,Nippon India Vision Large & Midcap Fund - IDCW Option,50.75
2006-10-30,100379,Nippon India Vision Large & Midcap Fund-GROWTH PLAN-Bonus Option,28.54
2006-10-30,100380,Nippon India Vision Large & Midcap Fund-GROWTH PLAN-Growth Option,170.29
2006-10-30,100381,UTI Large Cap Fund-Income Option,16.84
2006-10-30,100382,UTI Large Cap Fund-Growth Option,19.31
2006-10-30,100383,NIPPON INDIA MEDIUM TO LONG DURATION FUND - MONTHLY IDCW Option,11.0518
2006-10-30,100384,NIPPON INDIA MEDIUM TO LONG DURATION  FUND - QUARTERLY IDCW Option,11.7508
2006-10-30,100385,NIPPON INDIA MEDIUM TO LONG DURATION  FUND - HALF YEARLY IDCW Option,11.1889
2006-10-30,100386,NIPPON INDIA MEDIUM TO LONG DURATION  FUND - ANNUAL IDCW Option,11.9036
2006-10-30,100387,Nippon India Medium to Long Duration  Fund - Growth Plan Growth Option,22.9167
2006-10-30,100388,Nippon India Medium to Long Duration  Fund - Growth Plan Bonus Option,10.7979
2006-10-30,100414,Tata Aggressive Hybrid Fund- Regular Plan - Growth Option,46.3173
2006-10-30,100415,Tata Ethical Fund-Regular Plan - Growth Option,44.8179
2006-10-30,100416,Tata Long Term Debt Fund - Regular Plan - Quarterly Dividend,10.406
2006-10-30,100417,Tata Income Fund-Regular Plan - Half Yearly Payout of IDCW Option,10.8143
2006-10-30,100418,Tata Income Fund -Regular Plan - Growth Option,24.5947
2006-10-30,100470,Franklin India Large Cap Fund - IDCW,41.12
2006-10-30,100471,Franklin India Large Cap Fund-Growth,123.98
2006-10-30,100472,Franklin India Mid Cap Fund - IDCW,53.97
2006-10-30,100473,Franklin India Mid Cap Fund-Growth,193.84
2006-10-30,100474,Tata ELSS Fund- Regular Plan - Payout of IDCW Option,39.9899
2006-10-30,100475,Tata Large Cap Fund -Regular Plan - Growth Option,57.6941
2006-10-30,100476,Taurus Flexi Cap Fund - Regular Plan - Growth,36.69
2006-10-30,100477,Taurus Mid Cap Fund - Regular Plan - Growth,14.85
2006-10-30,100480,Taurus ELSS Tax Saver Fund - Regular Plan - Growth,17.09
2006-10-30,100481,Franklin India Balanced Fund-Growth,33.72
2006-10-30,100482,Franklin India Balanced Fund-Div,29.14
2006-10-30,100483,Franklin India Growth Fund,27.49
2006-10-30,100484,Franklin India Index Fund- NSE Nifty 50 Index Fund - Growth,29.9266
2006-10-30,100485,Franklin India Govt.Sec. Fund-Composite Plan - Growth,23.8524
2006-10-30,100486,Franklin India Govt.Sec. Fund-Composite Plan - Dividend,10.8075
2006-10-30,100487,Franklin India Govt.Sec. Fund-Treasury Plan(Dividend Option),10.6954
2006-10-30,100489,Franklin India Govt.Sec. Fund-Treasury Plan(Growth Option),13.6475
2006-10-30,100490,Franklin India Govt.Sec. Fund-PF Plan - Growth,10.4754
2006-10-30,100491,Franklin India Govt.Sec. Fund-PF Plan - Dividend,10.4754
2006-10-30,100493,Franklin India Government Securities Fund - Growth,16.2641
2006-10-30,100494,Franklin India Government Securities Fund - IDCW,10.8658
2006-10-30,100495,Franklin India Govt.Sec. Fund-Long Term Plan - Bonus,12.3206
2006-10-30,100496,Templeton India Value Fund - Growth Plan,64.04
2006-10-30,100497,Templeton India Value Fund - IDCW,41.87
2006-10-30,100498,Franklin India Dynamic Accrual Fund - IDCW,10.5194
2006-10-30,100499,Franklin India Dynamic Accrual Fund-Growth,25.3637
2006-10-30,100503,Franklin India Low Duration Fund - Monthly - IDCW,10.2315
2006-10-30,100504,Franklin India Low Duration Fund - Quarterly - IDCW,10.2608
2006-10-30,100505,Templeton Monthly Income Plan-Half Yearly Dividend,12.1529
2006-10-30,100506,Templeton Monthly Income Plan-Growth,19.5942
2006-10-30,100519,Franklin India Flexi Cap Fund - IDCW,37.34
2006-10-30,100520,Franklin India Flexi Cap Fund - Growth,127.35
2006-10-30,100521,Franklin India Technology Fund - IDCW,24.82
2006-10-30,100522,Franklin India Technology Fund-Growth,50.27
2006-10-30,100523,Franklin FMCG Fund - Growth,35.63
2006-10-30,100524,Franklin INDIA OPPORTUNITIES FUND - IDCW,17.29
2006-10-30,100525,Franklin India ELSS Tax Saver Fund - IDCW,38.61
2006-10-30,100526,Franklin India ELSS Tax Saver Fund-Growth,122.45
2006-10-30,100527,Franklin India Corporate Debt Fund - Plan A - Annual - IDCW,10.5182
2006-10-30,100528,Franklin India Corporate Debt Fund - Growth,24.6745
2006-10-30,100529,Franklin India Corporate Debt Fund - Plan B - Monthly - IDCW,13.911
2006-10-30,100530,Franklin India Corporate Debt Fund - Plan B - Quarterly - IDCW,13.9639
2006-10-30,100531,Franklin India Corporate Debt Fund - Plan B - Half yearly - IDCW,13.8537
2006-10-30,100532,Franklin India Corporate Debt Fund - Monthly Bonus,19.4436
2006-10-30,100535,Franklin India Retirement Fund - IDCW,18.3969
2006-10-30,100536,Franklin India Retirement Fund - Growth,42.0715
2006-10-30,100537,Franklin India Liquid Fund - Regular Plan - Weekly - IDCW,1244.5513
2006-10-30,100538,Franklin India Liquid Fund - Regular Plan - Growth,1807.4158
2006-10-30,100541,Franklin India Liquid Fund - Regular Plan - Daily - IDCW,1512.34
2006-10-30,100542,Franklin India Liquid Fund - Liquid Plan - Weekly Dividend,1000.7509
2006-10-30,100543,Franklin India Liquid Fund - Liquid Plan - Daily IDCW,1000.25
2006-10-30,100544,Franklin India Liquid Fund - Liquid Plan - Growth,1112.7853
2006-10-30,100546,Franklin India Liquid Fund - Super Institutional Plan - Growth,1073.1414
2006-10-30,100547,Franklin India Liquid Fund - Super Institutional Plan - Daily - IDCW,1000.25
2006-10-30,100548,Franklin India Liquid Fund - Super Institutional Plan - Weekly - IDCW,1016.3392
2006-10-30,100549,Franklin India Aggressive Hybrid Fund - IDCW,22.236
2006-10-30,100550,Franklin India Aggressive Hybrid Fund - Growth Plan,31.2212
2006-10-30,100551,Templeton India Children’s Asset Plan-Education Plan,24.5399
2006-10-30,100552,Templeton India Children’s Asset Plan-Gift Plan - Growth,29.2602
2006-10-30,100553,Templeton India Children’s Asset Plan-Gift Plan - Dividend,29.2602
2006-10-30,100556,Franklin India Taxshield 97,116.46
2006-10-30,100557,Franklin India Taxshield 98,114.83
2006-10-30,100558,Franklin India Taxshield 99,68.36
2006-10-30,100561,Templeton India Money Market Account - Bonus Plan,1.0
2006-10-30,100563,DBS Chola Triple Ace-Regular -Cumulative,23.8782
2006-10-30,100567,DBS Chola Triple Ace-Regular - Quarterly Dividend,11.2429
2006-10-30,100569,DBS Chola Triple Ace-Semi Annual Dividend,11.5547
2006-10-30,100573,DBS Chola Triple Ace-Regular Bonus,13.2677
2006-10-30,100574,DBS Chola Freedom Income -Short Term Fund-Regular-Monthly Dividend,10.9196
2006-10-30,100575,DBS Chola Freedom Income -Short Term Fund-Regular - Cumulative,11.518
2006-10-30,100576,DBS Chola Freedom Income -Short Term Fund-Cum- Institutional Plan,11.655
2006-10-30,100579,DBS Chola Gilt-Investment-Quarterly Dividend,10.1566
2006-10-30,100580,DBS Chola Gilt-Investment-Cumulative,18.4661
2006-10-30,100589,Canara Robeco Expo-Income Plan,19.18
2006-10-30,100590,Canara Robeco Expo-Growth Plan,50.4
2006-10-30,100593,CANARA ROBECO ELSS TAX SAVER - REGULAR PLAN -IDCW (Payout),20.52
2006-10-30,100596,CANARA ROBECO GILT FUND - REGULAR PLAN - IDCW (Payout/Reinvestment),10.3789
2006-10-30,100597,CANARA ROBECO GILT FUND - REGULAR PLAN - GROWTH OPTION,18.1856
2006-10-30,100600,CANARA ROBECO CONSERVATIVE HYBRID FUND - REGULAR PLAN - MONTHLY IDCW (Payout/Reinvestment),11.9
2006-10-30,100601,CANARA ROBECO CONSERVATIVE HYBRID FUND - REGULAR PLAN - GROWTH OPTION,18.5
2006-10-30,100602,Sundaram Medium Duration Fund (Formerly Known as Sundaram Medium Term Bond Fund) Regular Plan-Income Distribution cum Capital Withdrawal(IDCW),10.3411
2006-10-30,100603,Sundaram Medium Duration Fund (Formerly Known as Sundaram Medium Term Bond Fund) Regular Plan - Growth,22.4933
2006-10-30,100604,Sundaram Medium Duration Fund (Formerly Known as Sundaram Medium Term Bond Fund) Regular Plan -Growth,11.8441
2006-10-30,100609,Sundaram Medium Duration Fund (Formerly Known as Sundaram Medium Term Bond Fund) Regular Plan- Income Distribution cum Capital Withdrawal(IDCW),10.3346
2006-10-30,100610,Sundaram Medium Duration Fund (Formerly Known as Sundaram Medium Term Bond Fund) Regular Plan -Income Distribution cum Capital Withdrawal (IDCW),10.3399
2006-10-30,100611,Sundaram Medium Duration Fund (Formerly Known as Sundaram Medium Term Bond Fund) Institutional Plan -Growth,11.4897
2006-10-30,100612,Sundaram Growth Fund-Dividend,13.9558
2006-10-30,100613,Sundaram Growth Fund-Growth,63.8638
2006-10-30,100614,Sundaram Value Fund Regular Plan - Income Distribution cum Capital Withdrawal (IDCW),16.3671
2006-10-30,100617,Sundaram Equity Hybrid Fund Regular Plan - Growth,31.2301
2006-10-30,100618,Sundaram Money Fund Retail Plan - Growth,15.2498
2006-10-30,100619,Sundaram Money Fund Retail Plan - Quarterly Reinvestment of Income Distribution cum Capital Withdrawal (IDCW),10.2207
2006-10-30,100620,Sundaram Money Fund Retail Plan - Daily Reinvestment of Income Distribution cum Capital Withdrawal (IDCW),10.0953
2006-10-30,100621,Sundaram Money Fund Retail Plan - Weekly Reinvestment of Income Distribution cum Capital Withdrawal (IDCW),10.2905
2006-10-30,100622,Sundaram Money Fund Retail Plan - Fortnightly Reinvestment of Income Distribution cum Capital Withdrawal (IDCW),10.2141
2006-10-30,100623,Sundaram Money Fund Retail Plan - Monthly Income Distribution cum Capital Withdrawal (IDCW),10.1586
2006-10-30,100630,quant Multi Cap Fund-IDCW Option - Regular Plan,15.5332
2006-10-30,100631,quant Multi Cap Fund-GROWTH OPTION - Regular Plan,52.7495
2006-10-30,100638,SBI Medium to Long Duration Fund - Regular Plan - Half Yearly - Income Distribution cum Capital Withdrawal Option (IDCW),10.1057
2006-10-30,100639,SBI Medium to Long Duration Fund-REGULAR PLAN-Growth,19.5631
2006-10-30,100640,SBI Medium to Long Duration Fund-REGULAR PLAN-Bonus,11.8502
2006-10-30,100641,SBI ULTRA SHORT DURATION FUND - REGULAR PLAN - GROWTH,16.295
2006-10-30,100643,SBI Technology Opportunities Fund - Regular Plan - Income Distribution cum Capital Withdrawal Option (IDCW),23.48
2006-10-30,100644,SBI Healthcare Opportunities Fund - Regular Plan - Income Distribution cum Capital Withdrawal Option (IDCW),28.72
2006-10-30,100645,SBI Consumption Opportunities Fund - Regular Plan - Income Distribution cum Capital Withdrawal Option (IDCW),14.61
2006-10-30,100646,UTI - Unit Linked Insurance Plan,15.3851
2006-10-30,100648,UTI - CRTS 81 - Dividend Option,107.5037
2006-10-30,100650,UTI Large Cap Fund - Regular Plan - IDCW,29.36
2006-10-30,100651,UTI Large Cap Fund - Regular Plan - Growth Option,32.81
2006-10-30,100656,UTI - Master Plus Unit Scheme-Growth Option,61.46
2006-10-30,100657,UTI - Master Plus Unit Scheme-Income Option,54.7
2006-10-30,100663,UTI Large & Mid Cap Fund - Regular Plan - IDCW,39.16
2006-10-30,100664,UTI Large & Mid Cap Fund - Regular Plan - Growth Option,42.47
2006-10-30,100668,UTI Flexi Cap Fund - Regular Plan - IDCW,29.09
2006-10-30,100669,UTI - Flexi Cap Fund-Growth Option,31.46
2006-10-30,100678,UTI Children's Hybrid Fund - Regular Plan,14.7947
2006-10-30,100682,UTI Retirement Fund - Regular Plan,19.5775
2006-10-30,100684,UTI Aggressive Hybrid Fund - Regular Plan - Growth,54.92
2006-10-30,100685,UTI Aggressive Hybrid Fund - Regular Plan - IDCW,21.71
2006-10-30,100711,UTI - INDEX SELECT FUND-Income Option,22.41
2006-10-30,100712,UTI - INDEX SELECT FUND-Growth Option,33.22
2006-10-30,100715,DBS Chola Multi-Cap Fund-Dividend Option,14.27
2006-10-30,100716,DBS Chola Multi-Cap Fund-Cumulative Option,17.89
2006-10-30,100723,UTI MMF-Discontinued - Regular Plan -Growth,20.3775
2006-10-30,100724,UTI MMF- Discontinued - Regular Plan - Flexi Dividend Option,17.5838
2006-10-30,100725,UTI MMF- Discontinued - Regular Plan - Periodic Dividend Option,17.468
2006-10-30,100739,UTI MNC Fund - Regular Plan - IDCW,28.26
2006-10-30,100740,UTI - MNC Fund - Regular Plan - Growth Option,34.03
2006-10-30,100741,UTI Medium to Long Duration Fund- Regular Plan - Growth,21.3871
2006-10-30,100742,UTI Medium to Long Duration Fund - Regular Plan - Quarterly IDCW,10.9143
2006-10-30,100748,UTI - Master Index Fund-Income Option,40.9081
2006-10-30,100749,UTI - Master Index Fund-Growth Option,40.9081
2006-10-30,100750,UTI - Master Value Fund-Income Option,18.98
2006-10-30,100751,UTI - Master Value Fund-Growth Option,29.11
2006-10-30,100780,Sundaram Banking & PSU Fund (Formerly Known as Sundaram Banking and PSU Debt Fund) Retail Plan - Monthly Income Distribution cum Capital Withdrawal (IDCW),10.2065
2006-10-30,100781,Sundaram Banking & PSU Fund (Formerly Known as Sundaram Banking and PSU Debt Fund) Retail Plan - Growth,11.0301
2006-10-30,100782,Sundaram Banking & PSU Fund (Formerly Known as Sundaram Banking and PSU Debt Fund) Regular Plan - Daily Reinvestment of Income Distribution cum Capital Withdrawal (IDCW),10.0519
