date,scheme_code,scheme_name,nav
2006-10-30,100784,Sundaram Banking & PSU Fund (Formerly Known as Sundaram Banking and PSU Debt Fund) Regular Plan - Growth,11.1341
2006-10-30,100785,Sundaram Corporate Bond Fund Regular Plan -Income Distribution cum Capital Withdrawal(IDCW),10.2661
2006-10-30,100786,Sundaram Corporate Bond Fund Regular Plan - Income Distribution cum Capital Withdrawal (IDCW ),10.2105
2006-10-30,100787,Sundaram Corporate Bond Fund Regular Plan-Income Distribution cum Capital Withdrawal (IDCW),10.2113
2006-10-30,100788,Sundaram Corporate Bond Fund Regular Plan- Income Distribution cum Capital Withdrawal (IDCW),10.2076
2006-10-30,100789,Sundaram Corporate Bond Fund Regular Plan- Growth,11.007
2006-10-30,100790,Sundaram Corporate Bond Fund Institutional Plan - Income Distribution cum Capital Withdrawal (IDCW),10.2678
2006-10-30,100792,Sundaram Corporate Bond Fund Institutional Plan - Growth,11.0047
2006-10-30,100793,Sundaram Banking & PSU Fund (Formerly Known as Sundaram Banking and PSU Debt Fund) Regular Plan - Income Distribution cum Capital Withdrawal (IDCW),10.2326
2006-10-30,100794,Sundaram Small Cap Fund Regular Plan - Income Distribution cum Capital Withdrawal (IDCW),15.4132
2006-10-30,100795,Sundaram Small Cap Fund Regular Plan - Growth,17.8496
2006-10-30,100796,Sahara Midcap Fund-Growth Plan,16.8158
2006-10-30,100797,Sahara Midcap Fund-Dividend Plan,15.0114
2006-10-30,100798,Sahara Midcap Fund-Auto Payout,16.8158
2006-10-30,100799,Sahara Midcap Fund-Bonus,16.8158
2006-10-30,100800,UTI Growth Sector Funds-UTI - GSF - Brand Value-Income Option,19.86
2006-10-30,100801,UTI Growth Sector Funds-UTI - GSF - Brand Value-Growth Option,25.95
2006-10-30,100802,UTI Software Fund-Growth Option,24.15
2006-10-30,100803,UTI Software Fund-Income Option,22.14
2006-10-30,100804,UTI Energy Fund-Income Option,20.33
2006-10-30,100805,UTI Energy Fund-Growth Option,26.07
2006-10-30,100806,UTI Healthcare Fund - Regular Plan - IDCW,18.8
2006-10-30,100807,UTI Healthcare Fund - Regular Plan - Growth Option,21.32
2006-10-30,100808,UTI Services Industries Fund-Income Option,32.89
2006-10-30,100809,UTI Services Industries Fund-Growth Option,44.5
2006-10-30,100811,UTI - G-Sec Fund-Income,10.3854
2006-10-30,100812,UTI - G-Sec Fund-GrowthN,18.8719
2006-10-30,100813,UTI Overnight Fund - Regular Plan - Periodic IDCW,10.4763
2006-10-30,100814,UTI - Overnight  Fund - Regular Plan - Growth Option,11.4394
2006-10-30,100820,UTI ELSS Tax Saver Fund - Regular Plan - IDCW,18.24
2006-10-30,100821,UTI ELSS Tax Saver Fund - Regular Plan - Growth Option,29.7
2006-10-30,100822,UTI Nifty 50 Index Fund - Regular Plan - Growth Option,24.0125
2006-10-30,100823,UTI Nifty 50 Index Fund - Regular Plan - IDCW,24.0124
2006-10-30,100828,Kotak Liquid-Regular (Dividend),10.0317
2006-10-30,100829,Kotak Liquid-Regular (Growth),14.3833
2006-10-30,100830,Kotak Liquid-Institutional Plan  (Growth),14.5837
2006-10-30,100831,Kotak Liquid Fund -Institutional Plan - (Daily Dividend),12.2281
2006-10-30,100832,Kotak Liquid-Institutional Plan (Weekly Dividend),10.0348
2006-10-30,100833,Kotak Liquid Fund - Regular  - Daily Reinvestment of Income Distribution cum capital withdrawal option,12.2281
2006-10-30,100834,Kotak Liquid Fund Regular Plan Weekly Reinvestment of Income Distribution cum capital withdrawal option Dividend,10.0484
2006-10-30,100835,Kotak Liquid Fund - Regular Plan - Growth,14.671
2006-10-30,100836,Kotak Liquid Fund -Sweep Daily Dividend,10.0071
2006-10-30,100837,Nippon India Liquid Fund - Retail Option - Growth Plan,17.5302
2006-10-30,100838,NIPPON INDIA LIQUID FUND - RETAIL Plan - WEEKLY IDCW OPTION,10.3466
2006-10-30,100842,NIPPON INDIA LIQUID FUND - RETAIL Plan - DAILY IDCW OPTION,15.241
2006-10-30,100843,NIPPON INDIA LIQUID FUND - RETAIL plan - MONTHLY IDCW OPTION,11.0641
2006-10-30,100844,NIPPON INDIA LIQUID FUND - RETAIL Plan - QUARTERLY IDCW OPTION,17.1496
2006-10-30,100845,Reliance Liquid Fund-Cash Plan-Growth Plan,12.7021
2006-10-30,100848,Reliance Liquid Fund-Cash Plan-Weekly Dividend Reinvestment Option,10.9216
2006-10-30,100849,Reliance Liquid Fund-Cash Plan-Daily Dividend Reinvestment Option,11.1411
2006-10-30,100851,Nippon India Liquid Fund -Growth Plan,17.6761
2006-10-30,100852,NIPPON INDIA LIQUID FUND - DAILY IDCW OPTION,15.2857
2006-10-30,100853,NIPPON INDIA LIQUID FUND - WEEKLY IDCW OPTION,15.3105
2006-10-30,100855,NIPPON INDIA LIQUID FUND - MONTHLY IDCW OPTION,15.3949
2006-10-30,100856,Nippon India Corporate Bond Fund - Growth Plan - Growth Option,15.3
2006-10-30,100857,NIPPON INDIA CORPORATE BOND FUND - MONTHLY IDCW Option,10.2819
2006-10-30,100858,NIPPON INDIA CORPORATE BOND FUND - QUARTERLY IDCW Option,10.0832
2006-10-30,100859,Nippon India Corporate Bond Fund - Growth Plan - Bonus Option,10.9291
2006-10-30,100864,LIC MF ELSS Tax Saver-Regular Plan-IDCW,10.9993
2006-10-30,100865,LIC MF ELSS Tax Saver-Regular Plan-Growth,25.0702
2006-10-30,100868,HDFC Liquid Fund - Growth Plan,14.4102
2006-10-30,100872,HDFC Liquid Fund-PREMIUM PLUS- Growth,14.531
2006-10-30,100873,HDFC Liquid Fund-PREMIUM- Growth,14.4999
2006-10-30,100874,HDFC Liquid Fund - IDCW Plan Weekly,10.3241
2006-10-30,100875,HDFC Liquid Fund - IDCW Daily,10.1982
2006-10-30,100876,HDFC Liquid Fund - IDCW Monthly,10.3311
2006-10-30,100877,HDFC Liquid Fund-Premium Plan - Dividend-Daily,12.2598
2006-10-30,100878,HDFC Liquid Fund-Premium Plan - Dividend-Weekly,12.4928
2006-10-30,100881,HDFC Liquid Fund-Premium Plus Plan - Dividend-Weekly,12.4344
2006-10-30,100887,Principal Cash Management-Liquid Option-Dividend Plan,10.1275
2006-10-30,100888,Principal Cash Management-Liquid Option-Growth Plan,14.2866
2006-10-30,100889,Principal Cash Management-Liquid Option-Monthly Dividend,10.0047
2006-10-30,100890,Principal Cash Management-Liquid Option-Institutional - Weekly Dividend Plan,10.0093
2006-10-30,100891,Principal Cash Management-Liquid Option-Institutional - Monthly Dividend Plan,10.005
2006-10-30,100892,Principal Cash Management-Liquid Option-Daily Dividend,10.0022
2006-10-30,100893,Principal Cash Management-Liquid Option-Institutional - Growth Plan,11.9975
2006-10-30,100894,Principal Cash Management-Liquid Option-Institutional - Daily Dividend Plan,10.0022
2006-10-30,100895,Principal Cash Management Fund - Daily Income Distribution CUM Capital Withdrawal,10.0007
2006-10-30,100896,Principal Cash Management Fund - Weekly Income Distribution CUM Capital Withdrawal Option,10.0087
2006-10-30,100897,Principal Cash Management Fund - Monthly Income Distribution CUM Capital Withdrawal Option,10.0046
2006-10-30,100898,Principal Cash Management Fund -Growth Option,11.3211
2006-10-30,100899,HDFC Childrens Fund-Savings,14.891
2006-10-30,100900,HDFC Childrens Fund - Growth Plan,24.537
2006-10-30,100902,Franklin Pharma Fund - Growth,28.05
2006-10-30,100906,DBS Chola Opportunities Fund-Regular Quarterly Dividend,16.6
2006-10-30,100907,DBS Chola Opportunities Fund-Cumulative,25.53
2006-10-30,100915,SBI Contra Fund - Regular Plan - Income Distribution cum Capital Withdrawal Option (IDCW),26.49
2006-10-30,100927,SBI Conservative Hybrid Fund - Regular Plan - Monthly Income Distribution cum Capital Withdrawal Option (IDCW),10.7148
2006-10-30,100928,SBI Conservative Hybrid Fund - Regular Plan - Quarterly Income Distribution cum Capital Withdrawal Option (IDCW),10.6632
2006-10-30,100929,SBI Conservative Hybrid Fund - Regular Plan - Annual Income Distribution cum Capital Withdrawal Option (IDCW),10.9448
2006-10-30,100940,DSP BlackRock Liquidity Fund - Regular Plan - Growth,17.788
2006-10-30,100941,DSP BlackRock Liquidity Fund - Regular Plan Weekly Dividend,12.4068
2006-10-30,100943,DSP BlackRock Liquidity Fund - Regular Plan - Daily Dividend,10.01
2006-10-30,100948,Franklin India Conservative Hybrid Fund - Growth,20.3545
2006-10-30,100949,Franklin India Conservative Hybrid Fund - Plan A - Monthly - IDCW,11.9781
2006-10-30,100950,Franklin India Conservative Hybrid Fund - Plan A - Quarterly - IDCW,11.9023
2006-10-30,100951,Franklin India Conservative Hybrid Fund - Monthly Bonus,14.7208
2006-10-30,100952,ICICI Prudential MIP - Growth,18.5827
2006-10-30,100953,ICICI Prudential MIP - Dividend Monthly,11.6379
2006-10-30,100954,ICICI Prudential MIP - Dividend Quarterly,11.9598
2006-10-30,100955,ICICI Prudential MIP - Dividend Half Yearly,11.7434
2006-10-30,100956,Aditya Birla Tax Plan 98,194.83
2006-10-30,100957,Principal Income Fund-Dividend Plan-Half Yearly,10.5144
2006-10-30,100958,Principal Income Fund-Dividend Plan-Quaterly,10.5247
2006-10-30,100960,Principal Dynamic Bond Fund - Dividend Option -Annual,10.3773
2006-10-30,100961,Principal Dynamic Bond Fund -Dividend Option - Quarterly,11.0077
2006-10-30,100962,Principal Income Fund-Growth Plan-growth,17.2317
2006-10-30,100963,Principal Dynamic Bond Fund - Growth Option,12.1513
2006-10-30,100966,Principal Multi Cap Growth Fund- Half Yearly Income Distribution CUM Capital Withdrawal Option,23.23
2006-10-30,100967,Principal Multi Cap Growth Fund-Growth Option,48.0
2006-10-30,100968,SBI Conservative Hybrid Fund - Regular Plan - Growth,16.5039
2006-10-30,100970,Aditya Birla Sun Life MIP - Regular Plan - Growth,18.9051
2006-10-30,100971,Aditya Birla Sun Life MIP - Regular Plan - Monthly Dividend,11.1532
2006-10-30,100972,Aditya Birla Sun Life MIP - Regular Plan - Monthly Payment,18.9051
2006-10-30,100975,DBS Chola Liquid Fund-Regular Cumulative,14.7025
2006-10-30,100978,DBS Chola Liquid Fund-Daily Dividend Reinvestment Plan,10.0315
2006-10-30,100989,DBS Chola Liquid Fund-Cum -Institutional Plus,14.7863
2006-10-30,100997,HDFC Long Term Advantage Plan - IDCW Plan,43.788
2006-10-30,100998,HDFC Long Term Advantage Plan - Growth Plan,87.713
2006-10-30,100999,SBI Gilt Fund - Regular Plan - Income Distribution cum Capital Withdrawal Option (IDCW),10.1125
2006-10-30,101000,Tata Life Sciences & Technology Fund - Growth,44.6611
2006-10-30,101001,SBI GILT FUND - REGULAR PLAN - GROWTH,16.8902
2006-10-30,101002,SBI CONSTANT MATURITY 10 Year GILT FUND - REGULAR PLAN - GROWTH,14.4506
2006-10-30,101003,SBI Constant Maturity 10 Year Gilt Fund - Regular Plan - Income Distribution cum Capital Withdrawal Option (IDCW),10.0524
2006-10-30,101037,Franklin India Index Tax Fund,29.3903
2006-10-30,101042,Tata Gilt Securities Fund -Regular Plan- Growth Option,22.8436
2006-10-30,101044,Franklin India Floating Rate Fund - IDCW,10.0
2006-10-30,101048,Franklin India Floating Rate Fund - Growth Plan,13.2571
2006-10-30,101049,Tata Gilt Securities Fund - Regular Plan - Payout of IDCW Option,11.7231
2006-10-30,101059,SUNDARAM GILT FUND (DIV. OPTION),10.5359
2006-10-30,101065,quant Mid Cap Fund - Growth Option - Regular Plan,24.2069
2006-10-30,101066,quant Mid Cap Fund - IDCW Option - Regular Plan,13.7411
2006-10-30,101069,quant Aggressive Hybrid Fund-IDCW Option - Regular Plan,14.442
2006-10-30,101070,quant Aggressive Hybrid Fund - Growth Option - Regular Plan,44.602
2006-10-30,101071,quant Multi Asset Allocation Fund - IDCW Option - Regular Plan,13.4139
2006-10-30,101072,quant Multi Asset Allocation Fund-GROWTH OPTION - Regular Plan,14.6603
2006-10-30,101078,JM Liquid Fund (Regular) - Daily IDCW,10.4302
2006-10-30,101081,HDFC Gilt Fund-Short Term-Dividend,10.5046
2006-10-30,101082,HDFC Gilt Fund-Short Term-Growth,13.422
2006-10-30,101083,HDFC Gilt Fund - Growth Plan,15.519
2006-10-30,101084,HDFC Gilt Fund - IDCW Plan,10.2819
2006-10-30,101092,SUNDARAM GILT FUND (Growth. OPTION),13.1738
2006-10-30,101094,Taurus Gilt Fund-Dividend,12.3978
2006-10-30,101095,Taurus Gilt Fund-Growth,12.7194
2006-10-30,101098,ICICI Prudential Child Care Plan Study - Cumulative,18.8659
2006-10-30,101099,Grindlays Cash Fund-Growth,13.4123
2006-10-30,101100,Grindlays Cash Fund-Dividend (Daily),10.5819
2006-10-30,101113,Taurus Short Term Income Fund- Regular Plan - Dividend Option,13.4775
2006-10-30,101114,Taurus Short Term Income Fund- Regular Plan - Growth Option,13.8565
2006-10-30,101116,Principal Government Securities Fund-Investment-Dividend - Half Yearly,11.1368
2006-10-30,101117,Principal Government Securities Fund-Dividend Option - Quarterly,11.2226
2006-10-30,101118,Principal Government Securities Fund-Growth,16.0391
2006-10-30,101119,Principal Government Securities Fund-Dividend Option- Annually,13.1767
2006-10-30,101120,Principal Gilt Fund-Savings-Growth,13.8341
2006-10-30,101121,Principal Gilt Fund-Savings-Dividend,10.2571
2006-10-30,101122,Principal Gilt Fund-Provident-Growth,10.8391
2006-10-30,101123,Principal Gilt Fund-Provident-Haly Yearly,10.1233
2006-10-30,101124,Principal Gilt Fund-Provident-Annual,10.5068
2006-10-30,101126,Principal Gilt Fund-Provident-Annual Rebalancing 2005,10.7927
2006-10-30,101127,ICICI Prudential Children's Fund - Regular Plan,37.88
2006-10-30,101131,DBS Chola Growth Fund-Quarterly Dividend,16.21
2006-10-30,101132,DBS Chola Growth Fund-Cumulative,30.14
2006-10-30,101143,ICICI Prudential Multi-Asset Fund - IDCW,20.2894
2006-10-30,101144,ICICI Prudential Multi-Asset Fund - Growth,59.3099
2006-10-30,101154,BARODA INCOME FUND - Plan A - Growth Option,12.438
2006-10-30,101155,BARODA INCOME FUND - Plan A - Dividend Option,12.438
2006-10-30,101161,Nippon India Multi Cap Fund-Growth Plan-Growth Option,19.9218
2006-10-30,101162,Nippon India Multi Cap Fund-Growth Plan-Bonus Option,19.9218
2006-10-30,101163,NIPPON INDIA MULTI CAP FUND - IDCW Option,18.6916
2006-10-30,101165,ICICI Prudential Short Term Fund - Monthly IDCW,10.827
2006-10-30,101169,SBI Children's Fund - Savings Plan - REGULAR PLAN - GROWTH,16.7199
2006-10-30,101170,Sahara Gilt Fund-Growth,12.1352
2006-10-30,101171,Sahara Gilt Fund-Dividend,11.0975
2006-10-30,101172,ING Vysya Equity Fund-Dividend Option,14.92
2006-10-30,101173,ING Vysya Equity Fund-Growth Option,31.3
2006-10-30,101177,Grindlays Government Securities Fund - IP (Qtr.Dividend),10.2918
2006-10-30,101178,Grindlays Government Securities Fund - ST (Monthly Dividend),10.0432
2006-10-30,101179,Grindlays Government Securities Fund-IP(Annual Dividend),10.531
2006-10-30,101180,Grindlays Government Securities Fund-ST (Quarterly Dividend),10.1822
2006-10-30,101181,JM Medium to Long Duration Fund (Regular) - Bonus Option- Principal Units,11.5982
2006-10-30,101184,LIC MF Liquid Fund-Regular Plan-Daily IDCW,10.9801
2006-10-30,101185,LIC MF Liquid Fund-Regular Plan-Growth,13.1698
2006-10-30,101186,Tata Income Fund- Regular Plan - Periodic Payout of IDCW Option,14.2438
2006-10-30,101187,Baroda BNP Paribas GILT FUND - Regular Plan - Growth Option,11.0742
2006-10-30,101188,Baroda BNP Paribas GILT FUND - Regular Plan - IDCW Option,11.0754
2006-10-30,101190,BOB GILT FUND-PF Plan (Growth),10.4378
2006-10-30,101192,DBS Chola Freedom Income-STF Regular-Semi Annual Dividend,11.4265
2006-10-30,101198,LIC MF BSE Sensex Index Fund-Regular Plan-IDCW,17.7543
2006-10-30,101199,LIC MF BSE Sensex Index Fund-Regular Plan-Growth,27.9413
2006-10-30,101200,LIC MF Nifty 50 Index Fund-Regular Plan-IDCW,15.0012
2006-10-30,101201,LIC MF Nifty 50 Index Fund-Regular Plan-Growth,23.5451
2006-10-30,101202,LIC MF Index Fund-Sensex Advantage-Dividend,13.8413
2006-10-30,101203,LIC MF Index Fund-Sensex Advantage-Growth,27.2071
2006-10-30,101206,SBI OVERNIGHT FUND - REGULAR PLAN - GROWTH,12.5597
2006-10-30,101209,Taurus Large Cap Fund - Regular Plan - Growth,33.59
2006-10-30,101221,ICICI Prudential Money Market Fund Retail Growth (erstwhile Cash Option),12.3354
2006-10-30,101222,Tata Aggressive Hybrid Fund- Regular Plan - Periodic Payout of IDCW Option,38.0084
2006-10-30,101224,Tata Dynamic Bond Fund- Regular Plan - Payout of IDCW Option,10.2639
2006-10-30,101228,ICICI Prudential Multicap Fund - Growth,76.27
2006-10-30,101229,ICICI Prudential Short Term Fund - Institutional Plan - Dividend Monthly,11.0934
2006-10-30,101230,ICICI Prudential Short Term Fund-Institutional Plan-Dividend Fortnightly,11.0534
2006-10-30,101231,ICICI Prudential Short Term Fund-Institutional Growth,13.9577
2006-10-30,101232,Franklin India Short-Term Income Plan-Growth,1335.8118
2006-10-30,101236,Franklin India Short Term Income Plan -  Retail Plan - Monthly - IDCW,1014.3734
2006-10-30,101237,Franklin India Short-Term Income Plan-Weekly Bonus,1053.7112
2006-10-30,101238,Franklin India Short Term Income Plan -  Retail Plan - Quarterly - IDCW,1022.8726
2006-10-30,101242,Franklin India Short Term Income Plan -  Retail Plan - Weekly - IDCW,1095.051
2006-10-30,101244,Franklin India Short-Term Income Plan-Institutional Plan - Growth,1067.3852
2006-10-30,101245,Templeton India Short-Term Income Plan-Institutional Plan - Weekly Dividend,1005.4541
2006-10-30,101246,Franklin India Short-Term Income Plan-Institutional Plan - Monthly Dividend,1047.4979
2006-10-30,101248,Grindlays Cash Fund - Plan B (G) (Institutional Plan),13.4811
2006-10-30,101258,Grindlays Dynamic Bond Fund - GDBF (Annual Dividend),10.5369
2006-10-30,101262,Nippon India Power & Infra Fund-Growth Plan -Growth Option,31.7693
2006-10-30,101263,Nippon India Power & Infra Fund-Growth Plan-Bonus Option,31.7693
2006-10-30,101264,NIPPON INDIA POWER & INFRA FUND - IDCW Option,26.2901
2006-10-30,101265,Principal Hybrid Equity Fund-Growth,21.45
2006-10-30,101266,Principal Hybrid Equity Fund- Monthly Income Distribution CUM Capital Withdrawal,17.27
2006-10-30,101271,LIC MF Children's Fund-Regular Plan-Growth,14.7549
2006-10-30,101279,Grindlays Dynamic Bond Fund - GDBF (Growth),13.2298
2006-10-30,101281,HDFC BSE Sensex Index Fund - Growth Plan,121.4703
2006-10-30,101282,HDFC Index Fund-Sensex Plus( FV-Rs32.161),138.4485
2006-10-30,101288,ING Short Term Income Fund-Growth Option,12.8915
2006-10-30,101294,Birla Sun Life Cash Plus Sweep Plan-Dividend Option,10.0494
2006-10-30,101295,SBI ESG Exclusionary Strategy Fund - Regular Plan - Income Distribution cum Capital Withdrawal Option (IDCW),25.5
2006-10-30,101296,Banking Index Benchmark Exchange Traded Scheme (Bank BeES),570.3856
2006-10-30,101303,DSP Short Term Fund - Regular Plan - Regular Plan - IDCW - Weekly,10.186
2006-10-30,101304,DSP Short Term Fund - Regular Plan - Growth,12.7062
2006-10-30,101305,DSP Short Term Fund - Regular Plan - IDCW,10.5426
2006-10-30,101306,DSP Short Term Fund - IDCW - Monthly,10.3811
2006-10-30,101307,DBS Chola Liquid Fund - Regular Weekly Dividend,11.9599
2006-10-30,101313,Aditya Birla Sun Life Nifty 50 Index Fund -REGULAR - IDCW,21.5751
2006-10-30,101314,Aditya Birla Sun Life Nifty 50 Index Fund - Growth - Regular Plan,39.0157
2006-10-30,101315,Aditya Birla Sun Life Savings Fund-Insititutional Fortnightly Dividend,10.5029
2006-10-30,101316,Aditya Birla Sun Life Savings Fund-Retail Growth,13.5472
2006-10-30,101317,Aditya Birla Sun Life Savings Fund - Growth - Regular Plan,13.6667
2006-10-30,101318,Aditya Birla Sun Life Savings Fund-Retail Fortnightly Dividend,11.2751
2006-10-30,101319,Grindlays Cash Fund - Dividend (Weekly),10.1971
2006-10-30,101325,Nifty Benchmark Exchange Traded Scheme- Nifty BeES,384.5204
2006-10-30,101349,ICICI Prudential Nifty 50 Index Fund - Cumulative Option,33.5352
2006-10-30,101350,ICICI Prudential All Seasons Bond Fund Retail - Cumulative,15.2069
2006-10-30,101351,ICICI Prudential All Seasons Bond Fund - Weekly IDCW,10.5224
2006-10-30,101352,Templeton Floating Rate Income Fund-Short Term Plan-Dividend Option,10.0104
2006-10-30,101353,Templeton Floating Rate Income Fund-Short Term Plan-Growth Option,13.0644
2006-10-30,101354,Templeton Floating Rate Income Fund-Short Term Plan-Institutional Option - Growth,10.7023
2006-10-30,101355,Templeton Floating Rate Income Fund-Short Term Plan-Institutional Option - Dividend,10.0103
2006-10-30,101356,Franklin India Money Market Fund Retail Option - Quarterly - IDCW,10.4159
2006-10-30,101357,Franklin India Money Market Fund - Growth Option,13.0698
2006-10-30,101358,Franklin India Money Market Fund - Institutional Option - Growth,10.6825
2006-10-30,101359,Franklin India Money Market Fund - Institutional Option - Dividend,10.3402
2006-10-30,101361,Canara Robeco Liquid Fund- INSTITUTIONAL-Weekly dividend,10.0486
2006-10-30,101362,Canara Robeco Liquid Fund- INSTITUTIONAL-Growth,13.2529
2006-10-30,101363,Canara Robeco Liquid Fund- INSTITUTIONAL-Daily Dividend Reinvestment,10.041
2006-10-30,101364,Canara Robeco Liquid Fund-Retail-DRI,10.041
2006-10-30,101365,Canara Robeco Liquid Fund-Retail-Growth,13.2403
2006-10-30,101372,Kotak Bond Short Term Plan-(Payout of Income Distribution cum capital withdrawal option),10.0911
2006-10-30,101373,Kotak Bond Short Term Plan-(Growth),13.1324
2006-10-30,101393,Sahara Liquid Fund-Fixed Pricing - Daily Dividend Option,1024.5578
2006-10-30,101394,Sahara Liquid Fund-Fixed Pricing - Growth option,1300.718
2006-10-30,101397,Sahara Liquid Fund-Fixed Pricing -  Weekly Dividend Option,1024.6207
2006-10-30,101398,Sahara Liquid Fund-Fixed Pricing - Monthly Dividend Option,1024.8645
2006-10-30,101399,Sahara Liquid Fund-Variable Pricing - Daily Dividend option,1024.5687
2006-10-30,101400,Sahara Liquid Fund-Variable Pricing - Weekly Dividend Option,1025.3072
2006-10-30,101401,Sahara Liquid Fund-Variable Pricing- Monthly Dividend Option,1025.4718
2006-10-30,101402,Sahara Liquid Fund-Variable Pricing - Growth option,1303.8363
2006-10-30,101403,Sahara Income Fund-Dividend,11.2933
2006-10-30,101404,Sahara Income Fund-Growth,12.5472
2006-10-30,101405,ING Gilt Fund-Growth Option,11.9945
2006-10-30,101406,ING Gilt Fund-Dividend Option,11.9945
2006-10-30,101407,Baroda BNP Paribas LIQUID FUND-Defunct Plan- IDCW Option,11.1638
2006-10-30,101408,Baroda BNP Paribas LIQUID FUND- Defunct Plan -Growth Option,13.0173
2006-10-30,101409,Baroda BNP Paribas LIQUID FUND-Defunct Plan-Daily IDCW Option,10.0364
2006-10-30,101419,Tata Long Term Debt Fund - Regular Plan  -Bonus,12.3086
2006-10-30,101420,JM Floater Short Term Fund - Daily Dividend Option,10.0883
2006-10-30,101421,JM Floater Short Term Fund - Growth Option,11.9804
2006-10-30,101430,HDFC Regular Savings Fund-GROWTH,13.077
2006-10-30,101431,HDFC Regular Savings Fund-Monthly Dividend Option,10.3538
2006-10-30,101455,Grindlays Government Securities Fund - IP (Growth),13.4758
2006-10-30,101456,Grindlays Government Securities Fund - ST (Growth),12.3344
2006-10-30,101458,Grindlays Government Securities Fund-IP(H.Yrly Dividend),10.2896
2006-10-30,101462,Principal Short Term Plan-Dividend,10.1662
2006-10-30,101463,Principal Short Term Plan-Growth,13.1581
2006-10-30,101465,Principal Short Term Debt Fund- Growth Plan,12.2157
2006-10-30,101466,Principal Short Term Debt Fund - Income Distribution CUM Capital Withdrawal Option - Monthly,10.2072
2006-10-30,101467,Principal Income Fund - Short Term Plan-Institutional - Weekly Dividend Plan,10.9369
2006-10-30,101471,Tata Gilt Retirement Plan (28/2/2008) Growth,10.3186
2006-10-30,101472,Sundaram Equity Hybrid Fund Regular Plan - Income Distribution cum Capital Withdrawal (IDCW),15.3011
2006-10-30,101481,HDFC Floating Rate Debt Fund - Retail Growth Option,12.2125
2006-10-30,101482,HDFC Floating Rate Debt Fund - Retail Weekly Div Option,10.1492
2006-10-30,101483,HDFC Floating Rate Debt Fund - Retail Daily Div Option,10.0809
2006-10-30,101484,HDFC Floating Rate Debt Fund - Retail Monthly Div option,10.2126
2006-10-30,101489,Tata Young Citizen Fund [Upto 3 years] Regular Plan,21.162
2006-10-30,101490,Tata Young Citizen Fund [>3 years upto 7 years] Regular Plan,21.162
2006-10-30,101491,Tata Childrens Fund -Regular Plan-Growth Option,21.162
2006-10-30,101498,Principal Equity Savings Fund - Growth Option,14.8883
2006-10-30,101499,Principal Equity Savings Fund - Half Yearly Income Distribution CUM Capital Withdrawal,10.6253
2006-10-30,101500,Principal Equity Savings Fund -Quaterly Income Distribution CUM Capital Withdrawal,10.7004
2006-10-30,101516,Grindlays Dynamic Bond Fund - GDBF (Quarterly Dividend),10.2985
2006-10-30,101519,JM Short Term Fund - Regular Plan - Dividend Option,11.0252
2006-10-30,101520,JM Short Term Fund - Regular Plan - Growth Option,12.9989
2006-10-30,101521,JM Short Term Fund - Growth Option,12.2724
2006-10-30,101524,JM Short Term Fund - Dividend Option,10.3087
2006-10-30,101525,HDFC Nifty 50 Index Fund - Growth Plan,36.7983
2006-10-30,101528,Sahara Growth Fund-Growth,47.423
2006-10-30,101529,Sahara Growth Fund-Dividend,23.9936
2006-10-30,101530,SBI Large & Midcap Fund - Regular Plan - Income Distribution cum Capital Withdrawal Option (IDCW),44.27
2006-10-30,101536,Sundaram Select Focus Regular Plan - Income Distribution cum Capital Withdrawal (IDCW),15.6331
2006-10-30,101537,Sundaram Select Focus Regular Plan - Growth,56.4622
2006-10-30,101538,Sundaram Mid Cap Fund Regular Plan - Income Distribution cum Capital Withdrawal (IDCW),17.268
2006-10-30,101539,Sundaram Mid Cap Fund Regular Plan - Growth,86.9734
2006-10-30,101544,Sundaram Short Term Credit Risk Fund -Dividend,10.3706
2006-10-30,101545,Sundaram Short Term Credit Risk Fund-Appreciation,12.5921
2006-10-30,101547,Tata Short Term Bond Fund- Regular Plan - Monthly Payout of IDCW Option,10.9959
2006-10-30,101548,Tata Short Term Bond Fund -Regular Plan- Growth Option,12.908
2006-10-30,101549,JM Liquid Fund (Regular) - Bonus Option - Principal Units,10.4763
2006-10-30,101550,ING Short Term Income Fund -Dividend Option,11.1726
2006-10-30,101551,SBI Equity Hybrid Fund - Regular Plan - Income Distribution cum Capital Withdrawal Option (IDCW),24.31
2006-10-30,101560,Sundaram Short Term Debt Fund Regular Plan -Income Distribution cum Capital Withdrawal ( IDCW ),10.3011
2006-10-30,101561,Sundaram Short Term Debt Fund Regular Plan- Income Distribution cum Capital Withdrawal (IDCW ),10.302
2006-10-30,101562,Sundaram Short Term Debt Fund Regular Plan- Income Distribution cum Capital Withdrawal (IDCW),10.3062
2006-10-30,101563,Sundaram Short Term Debt Fund Regular Plan - Growth,12.6847
2006-10-30,101564,Sundaram Short Term Debt Fund Regular Plan - Weekly Income Distribution cum Capital Withdrawal (IDCW),11.0058
2006-10-30,101565,Sundaram Short Term Debt Fund Regular Plan - Fortnightly Income Distribution cum Capital Withdrawal (IDCW),10.6483
