date,scheme_code,scheme_name,nav
2007-07-03,100027,Grindlays Super Saver Income Fund-GSSIF-Half Yearly Dividend,10.4111
2007-07-03,100028,Grindlays Super Saver Income Fund-GSSIF-Quaterly Dividend,10.324
2007-07-03,100029,Grindlays Super Saver Income Fund-GSSIF-Growth,17.2633
2007-07-03,100030,Grindlays Super Saver Income Fund-GSSIF-Annual Dividend,10.4391
2007-07-03,100031,Grindlays Super Saver Income Fund-GSSIF - ST-Dividend,10.0915
2007-07-03,100032,Grindlays Super Saver Income Fund-GSSIF - ST-Growth,15.2552
2007-07-03,100033,Aditya Birla Sun Life Large & Mid Cap Fund - Regular Growth,136.52
2007-07-03,100034,Aditya Birla Sun Life Large & Mid Cap Fund -Regular - IDCW,97.94
2007-07-03,100035,Birla Sun Life Freedom Fund-Plan A (Dividend),20.05
2007-07-03,100036,Birla Sun Life Freedom Fund-Plan B (Growth),30.15
2007-07-03,100037,Aditya Birla Sun Life Income Fund - Regular - Quarterly IDCW,10.1366
2007-07-03,100038,Aditya Birla Sun Life Income Fund - Growth - Regular Plan,31.0938
2007-07-03,100041,Aditya Birla Sun Life Liquid Fund -Institutional - IDCW,10.8023
2007-07-03,100042,Aditya Birla Sun Life Liquid Fund-Retail (Growth),20.564
2007-07-03,100043,Aditya Birla Sun Life Liquid Fund-Institutional (Growth),20.715
2007-07-03,100044,Aditya Birla Sun Life Liquid Fund -Retail - IDCW,16.3694
2007-07-03,100046,Aditya Birla Sun Life Liquid Fund -Daily IDCW,10.0195
2007-07-03,100047,Aditya Birla Sun Life Liquid Fund - Growth,12.1773
2007-07-03,100048,Aditya Birla Sun Life Liquid Fund -Institutional - weekly  IDCW,10.8169
2007-07-03,100049,Aditya Birla Sun Life Cash Plus-Institutional - Fortnightly Dividend,10.8467
2007-07-03,100051,Aditya Birla Sun Life Liquid Fund -weekly IDCW,10.032
2007-07-03,100052,Aditya Birla Sun Life Cash Plus-Institutional Premium - Fortnightly Dividend,10.0829
2007-07-03,100053,Aditya Birla Sun Life Cash Plus-Institutional Premium Plan-Monthly Dividend,10.0095
2007-07-03,100054,Aditya Birla Sun Life Gilt Plus - Liquid Plan - Quarterly Dividend - Regular Plan,10.5936
2007-07-03,100055,Aditya Birla Sun Life Gilt Plus - Liquid Plan - Growth - Regular Plan,18.4924
2007-07-03,100056,Aditya Birla Sun Life Gilt Plus - Liquid Plan - Annual Dividend - Regular Plan,11.4507
2007-07-03,100057,Aditya Birla Sun Life Govenment Securities Fund -Regular - Quarterly IDCW,10.3835
2007-07-03,100058,Aditya Birla Sun Life Government Securities Fund  - Growth - Regular Plan,20.9575
2007-07-03,100059,Aditya Birla Sun Life Gilt Plus-PF Plan (Annual Dividend),19.4633
2007-07-03,100060,Aditya Birla Sun Life Constant Maturity 10 Year Gilt Fund - Quarterly Dividend - Regular Plan,10.9685
2007-07-03,100061,Aditya Birla Sun Life Constant Maturity 10 Year Gilt Fund - Growth - Regular Plan,23.7434
2007-07-03,100062,Aditya Birla Sun Life Gilt Plus-Regular Plan (Annual Dividend),22.1292
2007-07-03,100063,Aditya Birla Sun Life MNC Fund - Regular - IDCW,65.01
2007-07-03,100064,Aditya Birla Sun Life MNC Fund - Growth - Regular Plan,129.69
2007-07-03,100065,Aditya Birla Sun Life India Opportunities Fund - Dividend - Regular Plan,23.42
2007-07-03,100066,Aditya Birla Sun Life India Opportunities Fund - Growth - Regular Plan,54.53
2007-07-03,100067,Aditya Birla Sun Life Tax Plan -Regular - IDCW,67.09
2007-07-03,100068,BARODA ELSS 96 - Plan A - IDCW,22.13
2007-07-03,100069,BARODA PIONEER DIVERSIFIED FUND,36.29
2007-07-03,100077,DSP Bond Fund - IDCW,10.7392
2007-07-03,100078,DSP Bond Fund - Growth,25.2738
2007-07-03,100079,DSP Bond Fund - IDCW - Monthly,10.4798
2007-07-03,100080,DSP Flexi Cap Fund - Regular Plan - IDCW,46.113
2007-07-03,100081,DSP Aggressive Hybrid Fund- Regular Plan - Growth,44.076
2007-07-03,100082,DSP Aggressive Hybrid Fund- Regular Plan - IDCW,25.571
2007-07-03,100084,DSP Gilt Fund - Regular Plan - Growth,23.4315
2007-07-03,100085,DSP Gilt Fund - Regular Plan - IDCW,11.6274
2007-07-03,100086,DSP Gilt Fund - Regular Plan - IDCW - Monthly,10.2005
2007-07-03,100087,DSP Savings Fund - Regular Plan - Growth,17.2093
2007-07-03,100088,DSP Savings Fund - Regular Plan - IDCW,11.1496
2007-07-03,100089,DSP Savings Fund - Regular Plan - IDCW - Monthly,10.1166
2007-07-03,100090,DSP BlackRock Technology.com   Fund - Regular Plan - Growth,29.55
2007-07-03,100119,HDFC Balanced Advantage Fund - Growth Plan,55.94
2007-07-03,100120,HDFC Balanced Advantage Fund - IDCW Plan,30.369
2007-07-03,100121,HDFC Balanced Fund - Dividend Option,18.511
2007-07-03,100122,HDFC Balanced Fund - Growth Option,32.761
2007-07-03,100123,HDFC Income Fund - Quarterly IDCW Option,10.1775
2007-07-03,100124,HDFC Income Fund - Growth Option,16.836
2007-07-03,100150,Principal Child Benefit Fund-Super Saver-Future Guard Plan,63.38
2007-07-03,100151,Principal Retail Equity Savings Fund - Growth Option,64.23
2007-07-03,100152,Principal Nifty 100 Equal Weight Fund-Income Distribution CUM Capital Withdrawal,24.1023
2007-07-03,100153,Principal Nifty 100 Equal Weight Fund-Growth,31.0379
2007-07-03,100156,Principal Tax Savings Fund,91.95
2007-07-03,100171,Quant Dynamic Bond-Dividend,10.1483
2007-07-03,100172,Quant Dynamic Bond-Growth,23.0756
2007-07-03,100173,Quant Dynamic Bond-Bonus,12.1539
2007-07-03,100174,quant ELSS Tax Saver Fund - IDCW Option - Regular Plan,14.6595
2007-07-03,100175,quant ELSS Tax Saver Fund - Growth Option - Regular Plan,50.4223
2007-07-03,100176,quant Small Cap Fund - IDCW Option - Regular Plan,17.8807
2007-07-03,100177,quant Small Cap Fund - Growth - Regular Plan,21.1827
2007-07-03,100178,ING Income Fund-Regular Plan -Dividend Option (Quarterly),10.1561
2007-07-03,100179,ING Income Fund-Regular Plan -Dividend Option (Half Yearly),10.3613
2007-07-03,100180,ING Income Fund- Regular Plan - Dividend Option (Annual),10.5055
2007-07-03,100181,ING Income Fund-Regular Plan -Growth Option,18.463
2007-07-03,100182,ING Income Fund-Institutional Plan - Dividend Option (Half Yearly),10.0
2007-07-03,100183,ING Income Fund-Institutional Plan - Dividend Option (Quarterly),10.0
2007-07-03,100184,ING Income Fund-Institutional Plan -Dividend Option (Annual),10.4775
2007-07-03,100185,ING Income Fund-Bonus Option,11.2574
2007-07-03,100186,ING Income Fund-Institutional Bonus Option,11.5505
2007-07-03,100187,ING Income Fund-Institutional Plan - Growth Option,19.2949
2007-07-03,100188,ING Core Equity Fund-Dividend Option,15.9
2007-07-03,100189,ING Core Equity Fund-Growth Option,30.07
2007-07-03,100190,ING Liquid Fund-Regular Growth Option,16.1772
2007-07-03,100191,ING Liquid Fund-Regular Weekly Dividend Option,10.8256
2007-07-03,100192,ING Liquid Fund-Regular Daily Dividend Option,10.7873
2007-07-03,100194,ING Liquid Fund-Auto Sweep Growth Option,10.0
2007-07-03,100195,ING Liquid Fund-Auto Sweep Weekly Dividend Option,10.0
2007-07-03,100196,ING Liquid Fund-Institutional Growth Option,12.014
2007-07-03,100197,ING Liquid Fund-Institutional Weekly Dividend Option,10.0551
2007-07-03,100198,ING Liquid Fund-Institutional Daily Dividend Option,10.0121
2007-07-03,100199,ING Liquid Fund-Super Institutional Growth Option,11.3776
2007-07-03,100200,ING Liquid Fund-Super Institutional Daily Dividend Option,10.0048
2007-07-03,100201,ING Liquid Fund-Super Institutional Weekly Dividend Option,10.0053
2007-07-03,100202,ING Balanced Fund-Dividend Option,13.76
2007-07-03,100203,ING Balanced Fund-Growth Option,19.67
2007-07-03,100218,JM Large Cap Fund (Regular) - IDCW,18.6702
2007-07-03,100219,JM Large Cap Fund (Regular) - Growth Option,41.549
2007-07-03,100220,JM Aggressive Hybrid Fund (Regular) - IDCW,19.4978
2007-07-03,100221,JM Aggressive Hybrid Fund (Regular) -Growth Option,25.6593
2007-07-03,100222,JM Medium to Long Duration Fund (Regular) - Quarterly IDCW,10.3066
2007-07-03,100223,JM Medium to Long Duration Fund (Regular) - Growth Option,29.1317
2007-07-03,100233,JM Liquid Fund (Regular) - Weekly IDCW,10.4318
2007-07-03,100234,JM Liquid Fund - Growth Option,20.9745
2007-07-03,100237,JM High Liquidity Fund-- Institutional Plan - Growth,12.6539
2007-07-03,100238,JM High Liquidity Fund-Institutional Plan - Daily Dividend,10.0159
2007-07-03,100241,JM High Liquidity Fund-- Institutional Plan - Dividend,10.1955
2007-07-03,100243,JM High Liquidity Fund-- Premium Plan - Daily Dividend Option,10.0
2007-07-03,100244,JM Liquid Fund (Regular) - Quarterly IDCW,12.0755
2007-07-03,100245,JM High Liquidity Fund-Super Institutional Plan- Daily Dividend,10.0165
2007-07-03,100246,JM High Liquidity Fund-Super Institutional Plan- Weekly  Dividend,10.0027
2007-07-03,100247,JM Liquid Fund (Regular) - Super Institutional Plan - Growth Option,12.0326
2007-07-03,100249,JM G-Sec Fund - Quarterly Dividend Option,10.2665
2007-07-03,100250,JM G-Sec Fund - Growth Option,21.4767
2007-07-03,100251,JM G-Sec Fund-PF Plan - Growth Plan,22.2606
2007-07-03,100252,JM G-Sec Fund-PF Plan -Dividend Plan,20.3973
2007-07-03,100253,JM G-Sec Fund - Bonus Option - Principal Units,10.4472
2007-07-03,100254,JM Value Fund (Regular) - Growth Option,25.1896
2007-07-03,100261,Kotak Gilt-Savings-Monthly Dividend,10.465
2007-07-03,100262,Kotak Gilt-Savings-Growth,18.4411
2007-07-03,100263,Kotak Gilt-Savings-Annual Dividend,12.332
2007-07-03,100264,Kotak Gilt-Investment Regular-Payout of Income Distribution cum capital withdrawal option,11.4582
2007-07-03,100265,Kotak Gilt-Investment Regular-Growth,23.8207
2007-07-03,100280,Kotak Gilt-Investment  Provident Fund and Trust-Payout of Income Distribution cum capital withdrawal option,10.9064
2007-07-03,100281,Kotak Gilt-Investment  Provident Fund and Trust-Growth,24.1601
2007-07-03,100286,Kotak Aggressive Hybrid Fund - Regular Plan - IDCW - Payout & Reinvestment of Income Distribution cum capital withdrawal option,25.692
2007-07-03,100289,Kotak Tech,10.618
2007-07-03,100290,Kotak MNC,31.691
2007-07-03,100291,Kotak Bond-Deposit-Dividend,11.9216
2007-07-03,100292,Kotak Bond-Deposit-Growth,18.8631
2007-07-03,100298,Kotak Bond Regular Plan Quaterly Payout of Income Distribution cum capital withdrawal option,10.3717
2007-07-03,100299,Kotak Bond Fund - Regular Plan Growth,19.936
2007-07-03,100300,Kotak Bond Fund - Regular Plan - Standard IDCW Option,13.3235
2007-07-03,100301,Kotak Bond Regular Plan Bonus Plan,13.2884
2007-07-03,100312,LIC MF Flexi Cap Fund-Regular Plan-IDCW,12.0481
2007-07-03,100313,LIC MF Flexi Cap Fund-Regular Plan-Growth,21.7773
2007-07-03,100314,LIC MF Medium to Long Duration Fund-Regular Plan-IDCW,10.4434
2007-07-03,100315,LIC MF Medium to Long Duration Fund-Regular Plan-Growth,20.6409
2007-07-03,100316,LIC MF Gilt Fund-Regular Plan-IDCW,11.2369
2007-07-03,100317,LIC MF Gilt Fund-Regular Plan-Growth,19.3343
2007-07-03,100318,LIC MF Gilt Fund-PF Plan-IDCW,11.1489
2007-07-03,100319,LIC MF Gilt Fund-PF Plan-Growth,11.1489
2007-07-03,100321,LIC MF Aggressive Hybrid Fund-Regular Plan-IDCW,10.8044
2007-07-03,100323,LIC MF Aggressive Hybrid Fund-Regular Plan-Growth,45.645
2007-07-03,100325,LIC MF ULIS (5 Yrs. Single Premium)-Regular Plan-IDCW Reinvestment,11.8375
2007-07-03,100332,LIC MF Large Cap Fund-Regular Plan-IDCW,11.1262
2007-07-03,100337,SaharaTax Gain-Dividend,20.0375
2007-07-03,100338,SaharaTax Gain-Growth,22.9668
2007-07-03,100347,Morgan Stanley Growth Fund- Regular Growth Plan,55.62
2007-07-03,100348,ICICI Prudential Large & Mid Cap Fund - IDCW,22.59
2007-07-03,100349,ICICI Prudential Large & Mid Cap Fund - Growth,100.76
2007-07-03,100350,ICICI Prudential Large & Mid Cap Fund - Institutional Option - I - Growth,13.44
2007-07-03,100351,ICICI Prudential FMCG Fund - IDCW,33.93
2007-07-03,100352,ICICI Prudential FMCG Fund - Growth,42.65
2007-07-03,100353,ICICI Prudential ELSS Tax Saver Fund - IDCW,22.52
2007-07-03,100354,ICICI Prudential ELSS Tax Saver Fund - Growth,93.79
2007-07-03,100355,ICICI Prudential Equity & Debt Fund - Monthly IDCW,18.14
2007-07-03,100356,ICICI Prudential Equity & Debt Fund - Growth,36.98
2007-07-03,100357,ICICI Prudential Liquid Fund -Quarterly IDCW,10.7632
2007-07-03,100359,ICICI Prudential Liquid Institutional Plus Fund - Div - Daily,11.8515
2007-07-03,100360,ICICI Prudential Liquid Institutional Plus Fund - Div - Weekly,11.8562
2007-07-03,100361,ICICI Prudential Liquid Fund-Dividend-Institutional Plus - Monthly,11.9298
2007-07-03,100362,ICICI Prudential Liquid Institutional Plus Fund - Growth,19.0315
2007-07-03,100363,ICICI Prudential Technology Fund - Growth,16.86
2007-07-03,100364,ICICI Prudential Long Term Bond Fund - Half Yearly IDCW,10.4358
2007-07-03,100365,ICICI Prudential Long Term Bond Fund - Growth,21.748
2007-07-03,100366,ICICI Prudential Long Term Bond Fund-Institutional Quarterly Dividend,10.1173
2007-07-03,100367,ICICI Prudential Long Term Bond Fund - Quarterly IDCW,10.9192
2007-07-03,100368,ICICI Prudential Gilt Fund - IDCW,10.6989
2007-07-03,100369,ICICI Prudential Gilt Fund - Growth,22.8298
2007-07-03,100370,ICICI Prudential Short Term Gilt Fund - Dividend,10.5467
2007-07-03,100371,ICICI Prudential Short Term Gilt Fund - Growth,18.3568
2007-07-03,100372,ICICI Prudential Short Term Gilt Fund - Half Yearly Dividend,10.1803
2007-07-03,100375,NIPPON INDIA GROWTH MID CAP FUND - IDCW Option,57.63
2007-07-03,100376,Nippon India Growth Mid Cap Fund-Growth Plan-Bonus Option,51.82
2007-07-03,100377,Nippon India Growth Mid Cap Fund-Growth Plan-Growth Option,312.52
2007-07-03,100378,Nippon India Vision Large & Midcap Fund - IDCW Option,53.64
2007-07-03,100379,Nippon India Vision Large & Midcap Fund-GROWTH PLAN-Bonus Option,35.22
2007-07-03,100380,Nippon India Vision Large & Midcap Fund-GROWTH PLAN-Growth Option,210.13
2007-07-03,100383,NIPPON INDIA MEDIUM TO LONG DURATION FUND - MONTHLY IDCW Option,10.9436
2007-07-03,100384,NIPPON INDIA MEDIUM TO LONG DURATION  FUND - QUARTERLY IDCW Option,12.0999
2007-07-03,100385,NIPPON INDIA MEDIUM TO LONG DURATION  FUND - HALF YEARLY IDCW Option,11.3478
2007-07-03,100386,NIPPON INDIA MEDIUM TO LONG DURATION  FUND - ANNUAL IDCW Option,12.3034
2007-07-03,100387,Nippon India Medium to Long Duration  Fund - Growth Plan Growth Option,23.5935
2007-07-03,100388,Nippon India Medium to Long Duration  Fund - Growth Plan Bonus Option,11.1204
2007-07-03,100414,Tata Aggressive Hybrid Fund- Regular Plan - Growth Option,56.485
2007-07-03,100415,Tata Ethical Fund-Regular Plan - Growth Option,54.4683
2007-07-03,100416,Tata Long Term Debt Fund - Regular Plan - Quarterly Dividend,10.3438
2007-07-03,100417,Tata Income Fund-Regular Plan - Half Yearly Payout of IDCW Option,10.9693
2007-07-03,100418,Tata Income Fund -Regular Plan - Growth Option,25.4962
2007-07-03,100470,Franklin India Large Cap Fund - IDCW,41.5596
2007-07-03,100471,Franklin India Large Cap Fund-Growth,144.19
2007-07-03,100472,Franklin India Mid Cap Fund - IDCW,64.2441
2007-07-03,100473,Franklin India Mid Cap Fund-Growth,230.7231
2007-07-03,100474,Tata ELSS Fund- Regular Plan - Payout of IDCW Option,48.7581
2007-07-03,100475,Tata Large Cap Fund -Regular Plan - Growth Option,69.9091
2007-07-03,100476,Taurus Flexi Cap Fund - Regular Plan - Growth,46.95
2007-07-03,100477,Taurus Mid Cap Fund - Regular Plan - Growth,18.68
2007-07-03,100480,Taurus ELSS Tax Saver Fund - Regular Plan - Growth,20.41
2007-07-03,100481,Franklin India Balanced Fund-Growth,39.4302
2007-07-03,100482,Franklin India Balanced Fund-Div,34.0797
2007-07-03,100483,Franklin India Growth Fund,33.9361
2007-07-03,100484,Franklin India Index Fund- NSE Nifty 50 Index Fund - Growth,34.7272
2007-07-03,100485,Franklin India Govt.Sec. Fund-Composite Plan - Growth,24.4284
2007-07-03,100486,Franklin India Govt.Sec. Fund-Composite Plan - Dividend,10.5758
2007-07-03,100487,Franklin India Govt.Sec. Fund-Treasury Plan(Dividend Option),10.5945
2007-07-03,100489,Franklin India Govt.Sec. Fund-Treasury Plan(Growth Option),14.1928
2007-07-03,100490,Franklin India Govt.Sec. Fund-PF Plan - Growth,10.7297
2007-07-03,100491,Franklin India Govt.Sec. Fund-PF Plan - Dividend,10.7297
2007-07-03,100493,Franklin India Government Securities Fund - Growth,16.6622
2007-07-03,100494,Franklin India Government Securities Fund - IDCW,10.4792
2007-07-03,100495,Franklin India Govt.Sec. Fund-Long Term Plan - Bonus,11.6684
2007-07-03,100496,Templeton India Value Fund - Growth Plan,74.8213
2007-07-03,100497,Templeton India Value Fund - IDCW,44.2381
2007-07-03,100498,Franklin India Dynamic Accrual Fund - IDCW,10.4102
2007-07-03,100499,Franklin India Dynamic Accrual Fund-Growth,26.204
2007-07-03,100503,Franklin India Low Duration Fund - Monthly - IDCW,10.3201
2007-07-03,100504,Franklin India Low Duration Fund - Quarterly - IDCW,10.2305
2007-07-03,100505,Templeton Monthly Income Plan-Half Yearly Dividend,12.5572
2007-07-03,100506,Templeton Monthly Income Plan-Growth,20.668
2007-07-03,100519,Franklin India Flexi Cap Fund - IDCW,35.3731
2007-07-03,100520,Franklin India Flexi Cap Fund - Growth,157.7854
2007-07-03,100521,Franklin India Technology Fund - IDCW,23.5139
2007-07-03,100522,Franklin India Technology Fund-Growth,50.5368
2007-07-03,100523,Franklin FMCG Fund - Growth,35.2201
2007-07-03,100524,Franklin INDIA OPPORTUNITIES FUND - IDCW,17.5049
2007-07-03,100525,Franklin India ELSS Tax Saver Fund - IDCW,35.777
2007-07-03,100526,Franklin India ELSS Tax Saver Fund-Growth,141.2776
2007-07-03,100527,Franklin India Corporate Debt Fund - Plan A - Annual - IDCW,10.3973
2007-07-03,100528,Franklin India Corporate Debt Fund - Growth,25.1011
2007-07-03,100529,Franklin India Corporate Debt Fund - Plan B - Monthly - IDCW,13.0561
2007-07-03,100530,Franklin India Corporate Debt Fund - Plan B - Quarterly - IDCW,13.1802
2007-07-03,100531,Franklin India Corporate Debt Fund - Plan B - Half yearly - IDCW,13.3864
2007-07-03,100532,Franklin India Corporate Debt Fund - Monthly Bonus,18.4671
2007-07-03,100535,Franklin India Retirement Fund - IDCW,17.7137
2007-07-03,100536,Franklin India Retirement Fund - Growth,46.0869
2007-07-03,100537,Franklin India Liquid Fund - Regular Plan - Weekly - IDCW,1244.4274
2007-07-03,100538,Franklin India Liquid Fund - Regular Plan - Growth,1900.0875
2007-07-03,100541,Franklin India Liquid Fund - Regular Plan - Daily - IDCW,1512.34
2007-07-03,100542,Franklin India Liquid Fund - Liquid Plan - Weekly Dividend,1000.6511
2007-07-03,100543,Franklin India Liquid Fund - Liquid Plan - Daily IDCW,1000.25
2007-07-03,100544,Franklin India Liquid Fund - Liquid Plan - Growth,1167.8816
2007-07-03,100546,Franklin India Liquid Fund - Super Institutional Plan - Growth,1131.645
2007-07-03,100547,Franklin India Liquid Fund - Super Institutional Plan - Daily - IDCW,1000.25
2007-07-03,100548,Franklin India Liquid Fund - Super Institutional Plan - Weekly - IDCW,1016.238
2007-07-03,100549,Franklin India Aggressive Hybrid Fund - IDCW,22.8393
2007-07-03,100550,Franklin India Aggressive Hybrid Fund - Growth Plan,36.5106
2007-07-03,100551,Templeton India Children’s Asset Plan-Education Plan,26.4834
2007-07-03,100552,Templeton India Children’s Asset Plan-Gift Plan - Growth,33.6476
2007-07-03,100553,Templeton India Children’s Asset Plan-Gift Plan - Dividend,33.6476
2007-07-03,100557,Franklin India Taxshield 98,135.0065
2007-07-03,100558,Franklin India Taxshield 99,74.3363
2007-07-03,100561,Templeton India Money Market Account - Bonus Plan,1.0
2007-07-03,100563,DBS Chola Triple Ace-Regular -Cumulative,23.9912
2007-07-03,100567,DBS Chola Triple Ace-Regular - Quarterly Dividend,11.2961
2007-07-03,100569,DBS Chola Triple Ace-Semi Annual Dividend,11.6093
2007-07-03,100573,DBS Chola Triple Ace-Regular Bonus,13.3304
2007-07-03,100574,DBS Chola Freedom Income -Short Term Fund-Regular-Monthly Dividend,11.0656
2007-07-03,100575,DBS Chola Freedom Income -Short Term Fund-Regular - Cumulative,12.0929
2007-07-03,100576,DBS Chola Freedom Income -Short Term Fund-Cum- Institutional Plan,12.2323
2007-07-03,100579,DBS Chola Gilt-Investment-Quarterly Dividend,10.4759
2007-07-03,100580,DBS Chola Gilt-Investment-Cumulative,19.0465
2007-07-03,100589,Canara Robeco Expo-Income Plan,16.0
2007-07-03,100590,Canara Robeco Expo-Growth Plan,55.4
2007-07-03,100593,CANARA ROBECO ELSS TAX SAVER - REGULAR PLAN -IDCW (Payout),18.31
2007-07-03,100596,CANARA ROBECO GILT FUND - REGULAR PLAN - IDCW (Payout/Reinvestment),10.7633
2007-07-03,100597,CANARA ROBECO GILT FUND - REGULAR PLAN - GROWTH OPTION,18.8589
2007-07-03,100600,CANARA ROBECO CONSERVATIVE HYBRID FUND - REGULAR PLAN - MONTHLY IDCW (Payout/Reinvestment),11.94
2007-07-03,100601,CANARA ROBECO CONSERVATIVE HYBRID FUND - REGULAR PLAN - GROWTH OPTION,20.94
2007-07-03,100602,Sundaram Medium Duration Fund (Formerly Known as Sundaram Medium Term Bond Fund) Regular Plan-Income Distribution cum Capital Withdrawal(IDCW),10.3866
2007-07-03,100603,Sundaram Medium Duration Fund (Formerly Known as Sundaram Medium Term Bond Fund) Regular Plan - Growth,23.1525
2007-07-03,100604,Sundaram Medium Duration Fund (Formerly Known as Sundaram Medium Term Bond Fund) Regular Plan -Growth,12.1879
2007-07-03,100609,Sundaram Medium Duration Fund (Formerly Known as Sundaram Medium Term Bond Fund) Regular Plan- Income Distribution cum Capital Withdrawal(IDCW),10.6373
2007-07-03,100610,Sundaram Medium Duration Fund (Formerly Known as Sundaram Medium Term Bond Fund) Regular Plan -Income Distribution cum Capital Withdrawal (IDCW),10.6391
2007-07-03,100611,Sundaram Medium Duration Fund (Formerly Known as Sundaram Medium Term Bond Fund) Institutional Plan -Growth,11.8802
2007-07-03,100612,Sundaram Growth Fund-Dividend,16.0348
2007-07-03,100613,Sundaram Growth Fund-Growth,73.2989
2007-07-03,100614,Sundaram Value Fund Regular Plan - Income Distribution cum Capital Withdrawal (IDCW),14.0966
2007-07-03,100617,Sundaram Equity Hybrid Fund Regular Plan - Growth,35.8789
2007-07-03,100618,Sundaram Money Fund Retail Plan - Growth,16.0112
2007-07-03,100619,Sundaram Money Fund Retail Plan - Quarterly Reinvestment of Income Distribution cum Capital Withdrawal (IDCW),10.442
2007-07-03,100620,Sundaram Money Fund Retail Plan - Daily Reinvestment of Income Distribution cum Capital Withdrawal (IDCW),10.0953
2007-07-03,100621,Sundaram Money Fund Retail Plan - Weekly Reinvestment of Income Distribution cum Capital Withdrawal (IDCW),10.4077
2007-07-03,100622,Sundaram Money Fund Retail Plan - Fortnightly Reinvestment of Income Distribution cum Capital Withdrawal (IDCW),10.2748
2007-07-03,100623,Sundaram Money Fund Retail Plan - Monthly Income Distribution cum Capital Withdrawal (IDCW),10.1872
2007-07-03,100630,quant Multi Cap Fund-IDCW Option - Regular Plan,14.9155
2007-07-03,100631,quant Multi Cap Fund-GROWTH OPTION - Regular Plan,63.5958
2007-07-03,100638,SBI Medium to Long Duration Fund - Regular Plan - Half Yearly - Income Distribution cum Capital Withdrawal Option (IDCW),10.1527
2007-07-03,100639,SBI Medium to Long Duration Fund-REGULAR PLAN-Growth,19.9466
2007-07-03,100640,SBI Medium to Long Duration Fund-REGULAR PLAN-Bonus,12.0822
2007-07-03,100641,SBI ULTRA SHORT DURATION FUND - REGULAR PLAN - GROWTH,17.1574
2007-07-03,100643,SBI Technology Opportunities Fund - Regular Plan - Income Distribution cum Capital Withdrawal Option (IDCW),29.31
2007-07-03,100644,SBI Healthcare Opportunities Fund - Regular Plan - Income Distribution cum Capital Withdrawal Option (IDCW),31.3
2007-07-03,100645,SBI Consumption Opportunities Fund - Regular Plan - Income Distribution cum Capital Withdrawal Option (IDCW),14.07
2007-07-03,100646,UTI - Unit Linked Insurance Plan,15.0805
2007-07-03,100648,UTI - CRTS 81 - Dividend Option,110.0494
2007-07-03,100650,UTI Large Cap Fund - Regular Plan - IDCW,31.14
2007-07-03,100651,UTI Large Cap Fund - Regular Plan - Growth Option,38.66
2007-07-03,100656,UTI - Master Plus Unit Scheme-Growth Option,72.1
2007-07-03,100657,UTI - Master Plus Unit Scheme-Income Option,55.33
2007-07-03,100663,UTI Large & Mid Cap Fund - Regular Plan - IDCW,41.68
2007-07-03,100664,UTI Large & Mid Cap Fund - Regular Plan - Growth Option,48.25
2007-07-03,100668,UTI Flexi Cap Fund - Regular Plan - IDCW,32.74
2007-07-03,100669,UTI - Flexi Cap Fund-Growth Option,35.34
2007-07-03,100678,UTI Children's Hybrid Fund - Regular Plan,14.0919
2007-07-03,100682,UTI Retirement Fund - Regular Plan,18.9344
2007-07-03,100684,UTI Aggressive Hybrid Fund - Regular Plan - Growth,59.28
2007-07-03,100685,UTI Aggressive Hybrid Fund - Regular Plan - IDCW,21.08
2007-07-03,100711,UTI - INDEX SELECT FUND-Income Option,25.0
2007-07-03,100712,UTI - INDEX SELECT FUND-Growth Option,37.04
2007-07-03,100715,DBS Chola Multi-Cap Fund-Dividend Option,15.39
2007-07-03,100716,DBS Chola Multi-Cap Fund-Cumulative Option,19.31
2007-07-03,100723,UTI MMF-Discontinued - Regular Plan -Growth,21.483
2007-07-03,100724,UTI MMF- Discontinued - Regular Plan - Flexi Dividend Option,17.8029
2007-07-03,100725,UTI MMF- Discontinued - Regular Plan - Periodic Dividend Option,17.6876
2007-07-03,100739,UTI MNC Fund - Regular Plan - IDCW,29.31
2007-07-03,100740,UTI - MNC Fund - Regular Plan - Growth Option,39.11
2007-07-03,100741,UTI Medium to Long Duration Fund- Regular Plan - Growth,22.0463
2007-07-03,100742,UTI Medium to Long Duration Fund - Regular Plan - Quarterly IDCW,10.9201
2007-07-03,100748,UTI - Master Index Fund-Income Option,46.5483
2007-07-03,100749,UTI - Master Index Fund-Growth Option,46.5484
2007-07-03,100750,UTI - Master Value Fund-Income Option,20.87
2007-07-03,100751,UTI - Master Value Fund-Growth Option,32.04
2007-07-03,100780,Sundaram Banking & PSU Fund (Formerly Known as Sundaram Banking and PSU Debt Fund) Retail Plan - Monthly Income Distribution cum Capital Withdrawal (IDCW),10.2508
2007-07-03,100781,Sundaram Banking & PSU Fund (Formerly Known as Sundaram Banking and PSU Debt Fund) Retail Plan - Growth,11.5752
2007-07-03,100782,Sundaram Banking & PSU Fund (Formerly Known as Sundaram Banking and PSU Debt Fund) Regular Plan - Daily Reinvestment of Income Distribution cum Capital Withdrawal (IDCW),10.0519
2007-07-03,100784,Sundaram Banking & PSU Fund (Formerly Known as Sundaram Banking and PSU Debt Fund) Regular Plan - Growth,11.7283
2007-07-03,100785,Sundaram Corporate Bond Fund Regular Plan -Income Distribution cum Capital Withdrawal(IDCW),10.2896
