date,scheme_code,scheme_name,nav
2007-07-13,100027,Grindlays Super Saver Income Fund-GSSIF-Half Yearly Dividend,10.5455
2007-07-13,100028,Grindlays Super Saver Income Fund-GSSIF-Quaterly Dividend,10.4572
2007-07-13,100029,Grindlays Super Saver Income Fund-GSSIF-Growth,17.486
2007-07-13,100030,Grindlays Super Saver Income Fund-GSSIF-Annual Dividend,10.5738
2007-07-13,100031,Grindlays Super Saver Income Fund-GSSIF - ST-Dividend,10.1995
2007-07-13,100032,Grindlays Super Saver Income Fund-GSSIF - ST-Growth,15.4203
2007-07-13,100033,Aditya Birla Sun Life Large & Mid Cap Fund - Regular Growth,139.18
2007-07-13,100034,Aditya Birla Sun Life Large & Mid Cap Fund -Regular - IDCW,99.85
2007-07-13,100035,Birla Sun Life Freedom Fund-Plan A (Dividend),20.6
2007-07-13,100036,Birla Sun Life Freedom Fund-Plan B (Growth),30.99
2007-07-13,100037,Aditya Birla Sun Life Income Fund - Regular - Quarterly IDCW,10.3184
2007-07-13,100038,Aditya Birla Sun Life Income Fund - Growth - Regular Plan,31.6516
2007-07-13,100041,Aditya Birla Sun Life Liquid Fund -Institutional - IDCW,10.8023
2007-07-13,100042,Aditya Birla Sun Life Liquid Fund-Retail (Growth),20.5983
2007-07-13,100043,Aditya Birla Sun Life Liquid Fund-Institutional (Growth),20.7501
2007-07-13,100044,Aditya Birla Sun Life Liquid Fund -Retail - IDCW,16.3694
2007-07-13,100046,Aditya Birla Sun Life Liquid Fund -Daily IDCW,10.0195
2007-07-13,100047,Aditya Birla Sun Life Liquid Fund - Growth,12.198
2007-07-13,100048,Aditya Birla Sun Life Liquid Fund -Institutional - weekly  IDCW,10.8068
2007-07-13,100049,Aditya Birla Sun Life Cash Plus-Institutional - Fortnightly Dividend,10.821
2007-07-13,100051,Aditya Birla Sun Life Liquid Fund -weekly IDCW,10.0225
2007-07-13,100052,Aditya Birla Sun Life Cash Plus-Institutional Premium - Fortnightly Dividend,10.0585
2007-07-13,100053,Aditya Birla Sun Life Cash Plus-Institutional Premium Plan-Monthly Dividend,10.0265
2007-07-13,100054,Aditya Birla Sun Life Gilt Plus - Liquid Plan - Quarterly Dividend - Regular Plan,10.6358
2007-07-13,100055,Aditya Birla Sun Life Gilt Plus - Liquid Plan - Growth - Regular Plan,18.566
2007-07-13,100056,Aditya Birla Sun Life Gilt Plus - Liquid Plan - Annual Dividend - Regular Plan,11.4963
2007-07-13,100057,Aditya Birla Sun Life Govenment Securities Fund -Regular - Quarterly IDCW,10.4267
2007-07-13,100058,Aditya Birla Sun Life Government Securities Fund  - Growth - Regular Plan,21.0447
2007-07-13,100059,Aditya Birla Sun Life Gilt Plus-PF Plan (Annual Dividend),19.5442
2007-07-13,100060,Aditya Birla Sun Life Constant Maturity 10 Year Gilt Fund - Quarterly Dividend - Regular Plan,11.12
2007-07-13,100061,Aditya Birla Sun Life Constant Maturity 10 Year Gilt Fund - Growth - Regular Plan,24.0714
2007-07-13,100062,Aditya Birla Sun Life Gilt Plus-Regular Plan (Annual Dividend),22.4349
2007-07-13,100063,Aditya Birla Sun Life MNC Fund - Regular - IDCW,65.4
2007-07-13,100064,Aditya Birla Sun Life MNC Fund - Growth - Regular Plan,130.46
2007-07-13,100065,Aditya Birla Sun Life India Opportunities Fund - Dividend - Regular Plan,23.29
2007-07-13,100066,Aditya Birla Sun Life India Opportunities Fund - Growth - Regular Plan,54.24
2007-07-13,100067,Aditya Birla Sun Life Tax Plan -Regular - IDCW,68.8
2007-07-13,100068,BARODA ELSS 96 - Plan A - IDCW,22.67
2007-07-13,100069,BARODA PIONEER DIVERSIFIED FUND,37.53
2007-07-13,100077,DSP Bond Fund - IDCW,10.7869
2007-07-13,100078,DSP Bond Fund - Growth,25.3863
2007-07-13,100079,DSP Bond Fund - IDCW - Monthly,10.5264
2007-07-13,100080,DSP Flexi Cap Fund - Regular Plan - IDCW,47.424
2007-07-13,100081,DSP Aggressive Hybrid Fund- Regular Plan - Growth,44.851
2007-07-13,100082,DSP Aggressive Hybrid Fund- Regular Plan - IDCW,26.021
2007-07-13,100084,DSP Gilt Fund - Regular Plan - Growth,23.6665
2007-07-13,100085,DSP Gilt Fund - Regular Plan - IDCW,11.744
2007-07-13,100086,DSP Gilt Fund - Regular Plan - IDCW - Monthly,10.3028
2007-07-13,100087,DSP Savings Fund - Regular Plan - Growth,17.2601
2007-07-13,100088,DSP Savings Fund - Regular Plan - IDCW,11.1825
2007-07-13,100089,DSP Savings Fund - Regular Plan - IDCW - Monthly,10.1465
2007-07-13,100090,DSP BlackRock Technology.com   Fund - Regular Plan - Growth,30.097
2007-07-13,100119,HDFC Balanced Advantage Fund - Growth Plan,57.694
2007-07-13,100120,HDFC Balanced Advantage Fund - IDCW Plan,31.321
2007-07-13,100121,HDFC Balanced Fund - Dividend Option,18.929
2007-07-13,100122,HDFC Balanced Fund - Growth Option,33.502
2007-07-13,100123,HDFC Income Fund - Quarterly IDCW Option,10.3234
2007-07-13,100124,HDFC Income Fund - Growth Option,17.0773
2007-07-13,100150,Principal Child Benefit Fund-Super Saver-Future Guard Plan,65.24
2007-07-13,100151,Principal Retail Equity Savings Fund - Growth Option,66.11
2007-07-13,100152,Principal Nifty 100 Equal Weight Fund-Income Distribution CUM Capital Withdrawal,24.9187
2007-07-13,100153,Principal Nifty 100 Equal Weight Fund-Growth,32.0892
2007-07-13,100156,Principal Tax Savings Fund,93.67
2007-07-13,100171,Quant Dynamic Bond-Dividend,10.2002
2007-07-13,100172,Quant Dynamic Bond-Growth,23.2043
2007-07-13,100173,Quant Dynamic Bond-Bonus,12.2216
2007-07-13,100174,quant ELSS Tax Saver Fund - IDCW Option - Regular Plan,14.7285
2007-07-13,100175,quant ELSS Tax Saver Fund - Growth Option - Regular Plan,50.6643
2007-07-13,100176,quant Small Cap Fund - IDCW Option - Regular Plan,17.9656
2007-07-13,100177,quant Small Cap Fund - Growth - Regular Plan,21.2833
2007-07-13,100178,ING Income Fund-Regular Plan -Dividend Option (Quarterly),10.2042
2007-07-13,100179,ING Income Fund-Regular Plan -Dividend Option (Half Yearly),10.4104
2007-07-13,100180,ING Income Fund- Regular Plan - Dividend Option (Annual),10.5552
2007-07-13,100181,ING Income Fund-Regular Plan -Growth Option,18.5505
2007-07-13,100182,ING Income Fund-Institutional Plan - Dividend Option (Half Yearly),10.0
2007-07-13,100183,ING Income Fund-Institutional Plan - Dividend Option (Quarterly),10.0
2007-07-13,100184,ING Income Fund-Institutional Plan -Dividend Option (Annual),10.5301
2007-07-13,100185,ING Income Fund-Bonus Option,11.3107
2007-07-13,100186,ING Income Fund-Institutional Bonus Option,11.6085
2007-07-13,100187,ING Income Fund-Institutional Plan - Growth Option,19.3919
2007-07-13,100188,ING Core Equity Fund-Dividend Option,16.39
2007-07-13,100189,ING Core Equity Fund-Growth Option,31.01
2007-07-13,100190,ING Liquid Fund-Regular Growth Option,16.205
2007-07-13,100191,ING Liquid Fund-Regular Weekly Dividend Option,10.8316
2007-07-13,100192,ING Liquid Fund-Regular Daily Dividend Option,10.7873
2007-07-13,100194,ING Liquid Fund-Auto Sweep Growth Option,10.0
2007-07-13,100195,ING Liquid Fund-Auto Sweep Weekly Dividend Option,10.0
2007-07-13,100196,ING Liquid Fund-Institutional Growth Option,12.036
2007-07-13,100197,ING Liquid Fund-Institutional Weekly Dividend Option,10.0611
2007-07-13,100198,ING Liquid Fund-Institutional Daily Dividend Option,10.0121
2007-07-13,100199,ING Liquid Fund-Super Institutional Growth Option,11.3988
2007-07-13,100200,ING Liquid Fund-Super Institutional Daily Dividend Option,10.0048
2007-07-13,100201,ING Liquid Fund-Super Institutional Weekly Dividend Option,10.0118
2007-07-13,100202,ING Balanced Fund-Dividend Option,14.15
2007-07-13,100203,ING Balanced Fund-Growth Option,20.22
2007-07-13,100218,JM Large Cap Fund (Regular) - IDCW,19.4515
2007-07-13,100219,JM Large Cap Fund (Regular) - Growth Option,43.2877
2007-07-13,100220,JM Aggressive Hybrid Fund (Regular) - IDCW,20.4641
2007-07-13,100221,JM Aggressive Hybrid Fund (Regular) -Growth Option,26.931
2007-07-13,100222,JM Medium to Long Duration Fund (Regular) - Quarterly IDCW,10.3084
2007-07-13,100223,JM Medium to Long Duration Fund (Regular) - Growth Option,29.137
2007-07-13,100233,JM Liquid Fund (Regular) - Weekly IDCW,10.4363
2007-07-13,100234,JM Liquid Fund - Growth Option,21.0003
2007-07-13,100237,JM High Liquidity Fund-- Institutional Plan - Growth,12.6694
2007-07-13,100238,JM High Liquidity Fund-Institutional Plan - Daily Dividend,10.0159
2007-07-13,100241,JM High Liquidity Fund-- Institutional Plan - Dividend,10.1999
2007-07-13,100243,JM High Liquidity Fund-- Premium Plan - Daily Dividend Option,10.0
2007-07-13,100244,JM Liquid Fund (Regular) - Quarterly IDCW,12.0903
2007-07-13,100245,JM High Liquidity Fund-Super Institutional Plan- Daily Dividend,10.0165
2007-07-13,100246,JM High Liquidity Fund-Super Institutional Plan- Weekly  Dividend,10.0071
2007-07-13,100247,JM Liquid Fund (Regular) - Super Institutional Plan - Growth Option,12.0474
2007-07-13,100249,JM G-Sec Fund - Quarterly Dividend Option,10.2627
2007-07-13,100250,JM G-Sec Fund - Growth Option,21.4688
2007-07-13,100251,JM G-Sec Fund-PF Plan - Growth Plan,22.2542
2007-07-13,100252,JM G-Sec Fund-PF Plan -Dividend Plan,20.3915
2007-07-13,100253,JM G-Sec Fund - Bonus Option - Principal Units,10.4433
2007-07-13,100254,JM Value Fund (Regular) - Growth Option,26.9697
2007-07-13,100261,Kotak Gilt-Savings-Monthly Dividend,10.4212
2007-07-13,100262,Kotak Gilt-Savings-Growth,18.4969
2007-07-13,100263,Kotak Gilt-Savings-Annual Dividend,12.3693
2007-07-13,100264,Kotak Gilt-Investment Regular-Payout of Income Distribution cum capital withdrawal option,11.5598
2007-07-13,100265,Kotak Gilt-Investment Regular-Growth,24.0319
2007-07-13,100280,Kotak Gilt-Investment  Provident Fund and Trust-Payout of Income Distribution cum capital withdrawal option,11.0043
2007-07-13,100281,Kotak Gilt-Investment  Provident Fund and Trust-Growth,24.377
2007-07-13,100286,Kotak Aggressive Hybrid Fund - Regular Plan - IDCW - Payout & Reinvestment of Income Distribution cum capital withdrawal option,26.482
2007-07-13,100289,Kotak Tech,10.603
2007-07-13,100290,Kotak MNC,31.693
2007-07-13,100291,Kotak Bond-Deposit-Dividend,11.9917
2007-07-13,100292,Kotak Bond-Deposit-Growth,18.974
2007-07-13,100298,Kotak Bond Regular Plan Quaterly Payout of Income Distribution cum capital withdrawal option,10.4376
2007-07-13,100299,Kotak Bond Fund - Regular Plan Growth,20.0629
2007-07-13,100300,Kotak Bond Fund - Regular Plan - Standard IDCW Option,13.4083
2007-07-13,100301,Kotak Bond Regular Plan Bonus Plan,13.3729
2007-07-13,100312,LIC MF Flexi Cap Fund-Regular Plan-IDCW,12.5293
2007-07-13,100313,LIC MF Flexi Cap Fund-Regular Plan-Growth,22.6469
2007-07-13,100314,LIC MF Medium to Long Duration Fund-Regular Plan-IDCW,10.2922
2007-07-13,100315,LIC MF Medium to Long Duration Fund-Regular Plan-Growth,20.839
2007-07-13,100316,LIC MF Gilt Fund-Regular Plan-IDCW,11.2909
2007-07-13,100317,LIC MF Gilt Fund-Regular Plan-Growth,19.4273
2007-07-13,100318,LIC MF Gilt Fund-PF Plan-IDCW,11.2026
2007-07-13,100319,LIC MF Gilt Fund-PF Plan-Growth,11.2026
2007-07-13,100321,LIC MF Aggressive Hybrid Fund-Regular Plan-IDCW,11.2319
2007-07-13,100323,LIC MF Aggressive Hybrid Fund-Regular Plan-Growth,47.4509
2007-07-13,100325,LIC MF ULIS (5 Yrs. Single Premium)-Regular Plan-IDCW Reinvestment,12.1595
2007-07-13,100332,LIC MF Large Cap Fund-Regular Plan-IDCW,11.4447
2007-07-13,100337,SaharaTax Gain-Dividend,20.6251
2007-07-13,100338,SaharaTax Gain-Growth,23.6403
2007-07-13,100347,Morgan Stanley Growth Fund- Regular Growth Plan,56.82
2007-07-13,100348,ICICI Prudential Large & Mid Cap Fund - IDCW,23.38
2007-07-13,100349,ICICI Prudential Large & Mid Cap Fund - Growth,104.26
2007-07-13,100350,ICICI Prudential Large & Mid Cap Fund - Institutional Option - I - Growth,13.91
2007-07-13,100351,ICICI Prudential FMCG Fund - IDCW,34.4
2007-07-13,100352,ICICI Prudential FMCG Fund - Growth,43.24
2007-07-13,100353,ICICI Prudential ELSS Tax Saver Fund - IDCW,23.1
2007-07-13,100354,ICICI Prudential ELSS Tax Saver Fund - Growth,96.19
2007-07-13,100355,ICICI Prudential Equity & Debt Fund - Monthly IDCW,18.5
2007-07-13,100356,ICICI Prudential Equity & Debt Fund - Growth,37.71
2007-07-13,100357,ICICI Prudential Liquid Fund -Quarterly IDCW,10.7834
2007-07-13,100359,ICICI Prudential Liquid Institutional Plus Fund - Div - Daily,11.8515
2007-07-13,100360,ICICI Prudential Liquid Institutional Plus Fund - Div - Weekly,11.8627
2007-07-13,100361,ICICI Prudential Liquid Fund-Dividend-Institutional Plus - Monthly,11.9533
2007-07-13,100362,ICICI Prudential Liquid Institutional Plus Fund - Growth,19.069
2007-07-13,100363,ICICI Prudential Technology Fund - Growth,16.88
2007-07-13,100364,ICICI Prudential Long Term Bond Fund - Half Yearly IDCW,10.6225
2007-07-13,100365,ICICI Prudential Long Term Bond Fund - Growth,22.137
2007-07-13,100366,ICICI Prudential Long Term Bond Fund-Institutional Quarterly Dividend,10.3001
2007-07-13,100367,ICICI Prudential Long Term Bond Fund - Quarterly IDCW,11.1145
2007-07-13,100368,ICICI Prudential Gilt Fund - IDCW,10.8532
2007-07-13,100369,ICICI Prudential Gilt Fund - Growth,23.1592
2007-07-13,100370,ICICI Prudential Short Term Gilt Fund - Dividend,10.5778
2007-07-13,100371,ICICI Prudential Short Term Gilt Fund - Growth,18.411
2007-07-13,100372,ICICI Prudential Short Term Gilt Fund - Half Yearly Dividend,10.2104
2007-07-13,100375,NIPPON INDIA GROWTH MID CAP FUND - IDCW Option,59.76
2007-07-13,100376,Nippon India Growth Mid Cap Fund-Growth Plan-Bonus Option,53.73
2007-07-13,100377,Nippon India Growth Mid Cap Fund-Growth Plan-Growth Option,324.04
2007-07-13,100378,Nippon India Vision Large & Midcap Fund - IDCW Option,55.67
2007-07-13,100379,Nippon India Vision Large & Midcap Fund-GROWTH PLAN-Bonus Option,36.55
2007-07-13,100380,Nippon India Vision Large & Midcap Fund-GROWTH PLAN-Growth Option,218.1
2007-07-13,100383,NIPPON INDIA MEDIUM TO LONG DURATION FUND - MONTHLY IDCW Option,11.0917
2007-07-13,100384,NIPPON INDIA MEDIUM TO LONG DURATION  FUND - QUARTERLY IDCW Option,12.2636
2007-07-13,100385,NIPPON INDIA MEDIUM TO LONG DURATION  FUND - HALF YEARLY IDCW Option,11.5013
2007-07-13,100386,NIPPON INDIA MEDIUM TO LONG DURATION  FUND - ANNUAL IDCW Option,12.47
2007-07-13,100387,Nippon India Medium to Long Duration  Fund - Growth Plan Growth Option,23.9129
2007-07-13,100388,Nippon India Medium to Long Duration  Fund - Growth Plan Bonus Option,11.2709
2007-07-13,100414,Tata Aggressive Hybrid Fund- Regular Plan - Growth Option,57.7858
2007-07-13,100415,Tata Ethical Fund-Regular Plan - Growth Option,56.6715
2007-07-13,100416,Tata Long Term Debt Fund - Regular Plan - Quarterly Dividend,10.4195
2007-07-13,100417,Tata Income Fund-Regular Plan - Half Yearly Payout of IDCW Option,11.0495
2007-07-13,100418,Tata Income Fund -Regular Plan - Growth Option,25.6828
2007-07-13,100470,Franklin India Large Cap Fund - IDCW,42.881
2007-07-13,100471,Franklin India Large Cap Fund-Growth,148.7745
2007-07-13,100472,Franklin India Mid Cap Fund - IDCW,65.7255
2007-07-13,100473,Franklin India Mid Cap Fund-Growth,236.0434
2007-07-13,100474,Tata ELSS Fund- Regular Plan - Payout of IDCW Option,49.747
2007-07-13,100475,Tata Large Cap Fund -Regular Plan - Growth Option,72.2574
2007-07-13,100476,Taurus Flexi Cap Fund - Regular Plan - Growth,49.4
2007-07-13,100477,Taurus Mid Cap Fund - Regular Plan - Growth,19.35
2007-07-13,100480,Taurus ELSS Tax Saver Fund - Regular Plan - Growth,20.58
2007-07-13,100481,Franklin India Balanced Fund-Growth,40.0583
2007-07-13,100482,Franklin India Balanced Fund-Div,34.6226
2007-07-13,100483,Franklin India Growth Fund,34.4987
2007-07-13,100484,Franklin India Index Fund- NSE Nifty 50 Index Fund - Growth,35.9033
2007-07-13,100485,Franklin India Govt.Sec. Fund-Composite Plan - Growth,24.5753
2007-07-13,100486,Franklin India Govt.Sec. Fund-Composite Plan - Dividend,10.6394
2007-07-13,100487,Franklin India Govt.Sec. Fund-Treasury Plan(Dividend Option),10.6195
2007-07-13,100489,Franklin India Govt.Sec. Fund-Treasury Plan(Growth Option),14.2263
2007-07-13,100490,Franklin India Govt.Sec. Fund-PF Plan - Growth,10.7943
2007-07-13,100491,Franklin India Govt.Sec. Fund-PF Plan - Dividend,10.7943
2007-07-13,100493,Franklin India Government Securities Fund - Growth,16.7603
2007-07-13,100494,Franklin India Government Securities Fund - IDCW,10.5409
2007-07-13,100495,Franklin India Govt.Sec. Fund-Long Term Plan - Bonus,11.7371
2007-07-13,100496,Templeton India Value Fund - Growth Plan,77.6057
2007-07-13,100497,Templeton India Value Fund - IDCW,45.8843
2007-07-13,100498,Franklin India Dynamic Accrual Fund - IDCW,10.5585
2007-07-13,100499,Franklin India Dynamic Accrual Fund-Growth,26.5772
2007-07-13,100503,Franklin India Low Duration Fund - Monthly - IDCW,10.4306
2007-07-13,100504,Franklin India Low Duration Fund - Quarterly - IDCW,10.34
2007-07-13,100505,Templeton Monthly Income Plan-Half Yearly Dividend,12.6925
2007-07-13,100506,Templeton Monthly Income Plan-Growth,20.8906
2007-07-13,100519,Franklin India Flexi Cap Fund - IDCW,35.9571
2007-07-13,100520,Franklin India Flexi Cap Fund - Growth,160.3903
2007-07-13,100521,Franklin India Technology Fund - IDCW,23.577
2007-07-13,100522,Franklin India Technology Fund-Growth,50.6726
2007-07-13,100523,Franklin FMCG Fund - Growth,35.8365
2007-07-13,100524,Franklin INDIA OPPORTUNITIES FUND - IDCW,18.0805
2007-07-13,100525,Franklin India ELSS Tax Saver Fund - IDCW,36.7097
2007-07-13,100526,Franklin India ELSS Tax Saver Fund-Growth,144.9607
2007-07-13,100527,Franklin India Corporate Debt Fund - Plan A - Annual - IDCW,10.5369
2007-07-13,100528,Franklin India Corporate Debt Fund - Growth,25.438
2007-07-13,100529,Franklin India Corporate Debt Fund - Plan B - Monthly - IDCW,13.2313
2007-07-13,100530,Franklin India Corporate Debt Fund - Plan B - Quarterly - IDCW,13.3571
2007-07-13,100531,Franklin India Corporate Debt Fund - Plan B - Half yearly - IDCW,13.5661
2007-07-13,100532,Franklin India Corporate Debt Fund - Monthly Bonus,18.715
2007-07-13,100535,Franklin India Retirement Fund - IDCW,17.9812
2007-07-13,100536,Franklin India Retirement Fund - Growth,46.783
2007-07-13,100537,Franklin India Liquid Fund - Regular Plan - Weekly - IDCW,1245.6407
2007-07-13,100538,Franklin India Liquid Fund - Regular Plan - Growth,1903.6731
2007-07-13,100541,Franklin India Liquid Fund - Regular Plan - Daily - IDCW,1512.34
2007-07-13,100542,Franklin India Liquid Fund - Liquid Plan - Weekly Dividend,1001.5988
2007-07-13,100543,Franklin India Liquid Fund - Liquid Plan - Daily IDCW,1000.25
2007-07-13,100544,Franklin India Liquid Fund - Liquid Plan - Growth,1170.0068
2007-07-13,100546,Franklin India Liquid Fund - Super Institutional Plan - Growth,1133.9204
2007-07-13,100547,Franklin India Liquid Fund - Super Institutional Plan - Daily - IDCW,1000.25
2007-07-13,100548,Franklin India Liquid Fund - Super Institutional Plan - Weekly - IDCW,1017.279
2007-07-13,100549,Franklin India Aggressive Hybrid Fund - IDCW,23.2032
2007-07-13,100550,Franklin India Aggressive Hybrid Fund - Growth Plan,37.0922
2007-07-13,100551,Templeton India Children’s Asset Plan-Education Plan,26.6008
2007-07-13,100552,Templeton India Children’s Asset Plan-Gift Plan - Growth,34.0262
2007-07-13,100553,Templeton India Children’s Asset Plan-Gift Plan - Dividend,34.0262
2007-07-13,100557,Franklin India Taxshield 98,138.5995
2007-07-13,100558,Franklin India Taxshield 99,76.6664
2007-07-13,100561,Templeton India Money Market Account - Bonus Plan,1.0
2007-07-13,100563,DBS Chola Triple Ace-Regular -Cumulative,24.0247
2007-07-13,100567,DBS Chola Triple Ace-Regular - Quarterly Dividend,11.3118
2007-07-13,100569,DBS Chola Triple Ace-Semi Annual Dividend,11.6259
2007-07-13,100573,DBS Chola Triple Ace-Regular Bonus,13.349
2007-07-13,100574,DBS Chola Freedom Income -Short Term Fund-Regular-Monthly Dividend,11.0929
2007-07-13,100575,DBS Chola Freedom Income -Short Term Fund-Regular - Cumulative,12.1228
2007-07-13,100576,DBS Chola Freedom Income -Short Term Fund-Cum- Institutional Plan,12.2632
2007-07-13,100579,DBS Chola Gilt-Investment-Quarterly Dividend,10.4679
2007-07-13,100580,DBS Chola Gilt-Investment-Cumulative,19.0319
2007-07-13,100589,Canara Robeco Expo-Income Plan,16.25
2007-07-13,100590,Canara Robeco Expo-Growth Plan,56.25
2007-07-13,100593,CANARA ROBECO ELSS TAX SAVER - REGULAR PLAN -IDCW (Payout),19.04
2007-07-13,100596,CANARA ROBECO GILT FUND - REGULAR PLAN - IDCW (Payout/Reinvestment),10.8326
2007-07-13,100597,CANARA ROBECO GILT FUND - REGULAR PLAN - GROWTH OPTION,18.9804
2007-07-13,100600,CANARA ROBECO CONSERVATIVE HYBRID FUND - REGULAR PLAN - MONTHLY IDCW (Payout/Reinvestment),12.19
2007-07-13,100601,CANARA ROBECO CONSERVATIVE HYBRID FUND - REGULAR PLAN - GROWTH OPTION,21.37
2007-07-13,100602,Sundaram Medium Duration Fund (Formerly Known as Sundaram Medium Term Bond Fund) Regular Plan-Income Distribution cum Capital Withdrawal(IDCW),10.4191
2007-07-13,100603,Sundaram Medium Duration Fund (Formerly Known as Sundaram Medium Term Bond Fund) Regular Plan - Growth,23.2249
2007-07-13,100604,Sundaram Medium Duration Fund (Formerly Known as Sundaram Medium Term Bond Fund) Regular Plan -Growth,12.2261
2007-07-13,100609,Sundaram Medium Duration Fund (Formerly Known as Sundaram Medium Term Bond Fund) Regular Plan- Income Distribution cum Capital Withdrawal(IDCW),10.6706
2007-07-13,100610,Sundaram Medium Duration Fund (Formerly Known as Sundaram Medium Term Bond Fund) Regular Plan -Income Distribution cum Capital Withdrawal (IDCW),10.6724
2007-07-13,100611,Sundaram Medium Duration Fund (Formerly Known as Sundaram Medium Term Bond Fund) Institutional Plan -Growth,11.9197
2007-07-13,100612,Sundaram Growth Fund-Dividend,16.5583
2007-07-13,100613,Sundaram Growth Fund-Growth,75.6917
2007-07-13,100614,Sundaram Value Fund Regular Plan - Income Distribution cum Capital Withdrawal (IDCW),14.6134
2007-07-13,100617,Sundaram Equity Hybrid Fund Regular Plan - Growth,36.6245
2007-07-13,100618,Sundaram Money Fund Retail Plan - Growth,16.0293
2007-07-13,100619,Sundaram Money Fund Retail Plan - Quarterly Reinvestment of Income Distribution cum Capital Withdrawal (IDCW),10.4538
2007-07-13,100620,Sundaram Money Fund Retail Plan - Daily Reinvestment of Income Distribution cum Capital Withdrawal (IDCW),10.0953
2007-07-13,100621,Sundaram Money Fund Retail Plan - Weekly Reinvestment of Income Distribution cum Capital Withdrawal (IDCW),10.4097
2007-07-13,100622,Sundaram Money Fund Retail Plan - Fortnightly Reinvestment of Income Distribution cum Capital Withdrawal (IDCW),10.2618
2007-07-13,100623,Sundaram Money Fund Retail Plan - Monthly Income Distribution cum Capital Withdrawal (IDCW),10.1559
2007-07-13,100630,quant Multi Cap Fund-IDCW Option - Regular Plan,14.9334
2007-07-13,100631,quant Multi Cap Fund-GROWTH OPTION - Regular Plan,63.6725
2007-07-13,100638,SBI Medium to Long Duration Fund - Regular Plan - Half Yearly - Income Distribution cum Capital Withdrawal Option (IDCW),10.2507
2007-07-13,100639,SBI Medium to Long Duration Fund-REGULAR PLAN-Growth,20.1393
2007-07-13,100640,SBI Medium to Long Duration Fund-REGULAR PLAN-Bonus,12.199
2007-07-13,100641,SBI ULTRA SHORT DURATION FUND - REGULAR PLAN - GROWTH,17.1841
2007-07-13,100643,SBI Technology Opportunities Fund - Regular Plan - Income Distribution cum Capital Withdrawal Option (IDCW),25.48
2007-07-13,100644,SBI Healthcare Opportunities Fund - Regular Plan - Income Distribution cum Capital Withdrawal Option (IDCW),31.19
2007-07-13,100645,SBI Consumption Opportunities Fund - Regular Plan - Income Distribution cum Capital Withdrawal Option (IDCW),14.15
2007-07-13,100646,UTI - Unit Linked Insurance Plan,15.3296
2007-07-13,100648,UTI - CRTS 81 - Dividend Option,111.9319
2007-07-13,100650,UTI Large Cap Fund - Regular Plan - IDCW,31.95
2007-07-13,100651,UTI Large Cap Fund - Regular Plan - Growth Option,39.66
2007-07-13,100656,UTI - Master Plus Unit Scheme-Growth Option,74.4
2007-07-13,100657,UTI - Master Plus Unit Scheme-Income Option,57.09
2007-07-13,100663,UTI Large & Mid Cap Fund - Regular Plan - IDCW,42.72
2007-07-13,100664,UTI Large & Mid Cap Fund - Regular Plan - Growth Option,49.44
2007-07-13,100668,UTI Flexi Cap Fund - Regular Plan - IDCW,33.35
2007-07-13,100669,UTI - Flexi Cap Fund-Growth Option,36.0
2007-07-13,100678,UTI Children's Hybrid Fund - Regular Plan,14.3302
2007-07-13,100682,UTI Retirement Fund - Regular Plan,19.2085
2007-07-13,100684,UTI Aggressive Hybrid Fund - Regular Plan - Growth,60.94
2007-07-13,100685,UTI Aggressive Hybrid Fund - Regular Plan - IDCW,21.68
2007-07-13,100711,UTI - INDEX SELECT FUND-Income Option,25.68
2007-07-13,100712,UTI - INDEX SELECT FUND-Growth Option,38.05
2007-07-13,100715,DBS Chola Multi-Cap Fund-Dividend Option,15.85
2007-07-13,100716,DBS Chola Multi-Cap Fund-Cumulative Option,19.89
2007-07-13,100723,UTI MMF-Discontinued - Regular Plan -Growth,21.5122
2007-07-13,100724,UTI MMF- Discontinued - Regular Plan - Flexi Dividend Option,17.8161
2007-07-13,100725,UTI MMF- Discontinued - Regular Plan - Periodic Dividend Option,17.6917
2007-07-13,100739,UTI MNC Fund - Regular Plan - IDCW,29.71
2007-07-13,100740,UTI - MNC Fund - Regular Plan - Growth Option,39.65
2007-07-13,100741,UTI Medium to Long Duration Fund- Regular Plan - Growth,22.1887
2007-07-13,100742,UTI Medium to Long Duration Fund - Regular Plan - Quarterly IDCW,10.9906
2007-07-13,100748,UTI - Master Index Fund-Income Option,47.974
2007-07-13,100749,UTI - Master Index Fund-Growth Option,47.974
2007-07-13,100750,UTI - Master Value Fund-Income Option,21.24
2007-07-13,100751,UTI - Master Value Fund-Growth Option,32.6
2007-07-13,100780,Sundaram Banking & PSU Fund (Formerly Known as Sundaram Banking and PSU Debt Fund) Retail Plan - Monthly Income Distribution cum Capital Withdrawal (IDCW),10.2067
2007-07-13,100781,Sundaram Banking & PSU Fund (Formerly Known as Sundaram Banking and PSU Debt Fund) Retail Plan - Growth,11.5958
2007-07-13,100782,Sundaram Banking & PSU Fund (Formerly Known as Sundaram Banking and PSU Debt Fund) Regular Plan - Daily Reinvestment of Income Distribution cum Capital Withdrawal (IDCW),10.0519
2007-07-13,100784,Sundaram Banking & PSU Fund (Formerly Known as Sundaram Banking and PSU Debt Fund) Regular Plan - Growth,11.7508
2007-07-13,100785,Sundaram Corporate Bond Fund Regular Plan -Income Distribution cum Capital Withdrawal(IDCW),10.2592
