date,scheme_code,scheme_name,nav
2022-04-01,119136,Groww Liquid Fund (formerly known as Indiabulls Liquid Fund) - Direct Plan- - Income Distribution cum capital withdrawal Option ( Reinvestment),1001.06
2022-04-01,119137,Groww Liquid Fund (formerly known as Indiabulls Liquid Fund)- Direct Plan- Weekly - Income Distribution cum capital withdrawal Option (Payout & Reinvestment),1000.9333
2022-04-01,119138,Groww Liquid Fund (formerly known as Indiabulls Liquid Fund)- Direct Plan- Fortnightly - Income Distribution cum capital withdrawal Option (Payout & Reinvestment),1001.2254
2022-04-01,119139,Groww Liquid Fund (formerly known as Indiabulls Liquid Fund)- Direct Plan- Monthly - Income Distribution cum capital withdrawal Option (Payout & Reinvestment),1032.1906
2022-04-01,119148,Navi Large Cap Equity Fund-Direct Plan-Growth Option,38.4867
2022-04-01,119149,Navi Large Cap Equity Fund - Direct Plan Normal IDCW Payout,23.6781
2022-04-01,119159,Tata Large Cap Fund- Direct Plan - Payout of IDCW Option,83.9003
2022-04-01,119160,Tata Large Cap Fund -Direct Plan Growth Option,369.5165
2022-04-01,119171,Tata Ethical Fund- Direct Plan - Payout of IDCW Option,171.3262
2022-04-01,119172,Tata Ethical Fund -Direct Plan- Growth Option,312.0945
2022-04-01,119174,Navi 3 IN 1 FUND - Direct Plan Monthly IDCW Payout,24.2003
2022-04-01,119175,Navi 3 IN 1 FUND - Direct Plan Quarterly IDCW Payout,25.0469
2022-04-01,119176,Navi 3 in 1 Fund-Direct Plan-Growth Option,28.8609
2022-04-01,119177,Tata Mid Cap Fund - Direct Plan- IDCW Option,87.3267
2022-04-01,119178,Tata Mid Cap Fund - Direct Plan- Growth Option,264.5227
2022-04-01,119201,Tata Large & Mid Cap Fund Direct Plan - Payout of IDCW Option,69.3109
2022-04-01,119202,Tata Large & MId Cap Fund -Direct Plan- Growth Option,353.9743
2022-04-01,119212,DSP Small Cap Fund - Direct Plan - Growth,119.277
2022-04-01,119213,DSP Small Cap Fund - Direct Plan - IDCW,45.915
2022-04-01,119218,DSP Large & Mid Cap Fund - Direct Plan - Growth,373.15
2022-04-01,119219,DSP Large & Mid Cap Fund - Direct Plan - IDCW,77.961
2022-04-01,119231,Tata Value Fund -Direct Plan Growth Option,215.3249
2022-04-01,119232,Tata Value Fund- Direct Plan -Payout of IDCW-Option A(5%),87.3698
2022-04-01,119233,Tata Value Fund- Direct Plan - Payout of IDCW -Option B(10%),82.9685
2022-04-01,119241,DSP ELSS Tax Saver Fund - Direct Plan - IDCW,58.437
2022-04-01,119242,DSP ELSS Tax Saver Fund - Direct Plan - Growth,87.26
2022-04-01,119243,Tata Infrastructure Fund -Direct Plan -Growth Option,96.7292
2022-04-01,119244,Tata Infrastructure Fund- Direct Plan - Payout of IDCW Option,50.6852
2022-04-01,119247,DSP India T.I.G.E.R. Fund - Direct Plan - Growth,152.248
2022-04-01,119248,DSP India T.I.G.E.R. Fund - Direct Plan - IDCW,31.237
2022-04-01,119249,DSP Large Cap Fund - Direct Plan - IDCW,22.56
2022-04-01,119250,DSP Large Cap Fund - Direct Plan - Growth,299.15
2022-04-01,119251,Tata Retirement Savings Fund- Progressive Plan -Direct Plan-Growth Option,48.1541
2022-04-01,119255,Tata Retirement Savings Fund- Moderate Plan -Direct Plan-Growth Option,47.8564
2022-04-01,119281,Tata ELSS Fund- Direct Plan - Payout of IDCW Option,155.0512
2022-04-01,119282,L&T Overnight Fund - Direct Plan- Monthly IDCW,1065.9593
2022-04-01,119283,L&T Overnight Fund - Direct Plan - Growth,1658.5484
2022-04-01,119284,L&T Overnight Fund - Direct Plan- Daily IDCW,1023.4015
2022-04-01,119285,L&T Overnight Fund - Direct Plan- Weekly IDCW,1001.8089
2022-04-01,119287,Tata S&P BSE Sensex Index Fund - Direct Plan,152.3355
2022-04-01,119288,Tata Nifty 50 Index Fund -Direct Plan,115.2637
2022-04-01,119290,L&T Flexicap Fund-Direct Plan-IDCW,40.516
2022-04-01,119291,L&T Flexicap Fund-Direct Plan-Growth,127.375
2022-04-01,119292,Union Flexi Cap Fund - Direct Plan - Growth Option,35.52
2022-04-01,119293,Union Flexi Cap Fund - Direct Plan - IDCW Option,31.03
2022-04-01,119297,L&T Balanced Advantage Fund-Direct Plan-IDCW,20.143
2022-04-01,119298,L&T Balanced Advantage Fund-Direct Plan-Growth,34.265
2022-04-01,119300,BANK OF INDIA Large & Mid Cap Fund Direct Plan- Bonus,30.97
2022-04-01,119301,Union Liquid Fund - Direct Plan - Daily IDCW Option,1000.7927
2022-04-01,119302,Union Liquid Fund - Direct Plan - Monthly IDCW Option,1001.3851
2022-04-01,119303,Union Liquid Fund - Direct Plan - Growth Option,2051.1696
2022-04-01,119304,Union Liquid Fund - Direct Plan - Weekly IDCW Option,1001.1747
2022-04-01,119305,Union Liquid Fund - Direct Plan - Fortnightly IDCW Option,1001.3799
2022-04-01,119306,Union ELSS Tax Saver Fund - Direct Plan - IDCW Option,43.74
2022-04-01,119307,Union ELSS Tax Saver Fund - Direct Plan - Growth Option,43.74
2022-04-01,119308,L&T India Large Cap Fund - Direct Plan - Growth,43.613
2022-04-01,119312,Tata Childrens Fund-Direct Plan-Growth Option,45.0615
2022-04-01,119314,L&T India Large Cap Fund - Direct Plan- IDCW,22.737
2022-04-01,119333,Baroda BNP Paribas Banking and Financial Services Fund - Direct - Growth Option,30.7859
2022-04-01,119334,Baroda BNP Paribas Banking and Financial Services Fund - Direct - IDCW Option,18.4381
2022-04-01,119346,BANK OF INDIA Large & Mid Cap Fund Direct Plan-Regular IDCW,16.43
2022-04-01,119347,L&T Hybrid Equity Fund - Direct Plan-Growth,40.64
2022-04-01,119348,L&T Hybrid Equity Fund - Direct Plan -IDCW,28.147
2022-04-01,119349,BANK OF INDIA Large & Mid Cap Fund Direct  Plan- Quarterly IDCW,16.67
2022-04-01,119350,BANK OF INDIA Large & Mid Cap Fund Direct Plan-Growth,59.93
2022-04-01,119351,BANK OF INDIA ELSS Tax Saver -Direct Plan- Growth,109.87
2022-04-01,119352,BANK OF INDIA ELSS Tax Saver -Direct Plan-IDCW,43.88
2022-04-01,119353,Baroda BNP Paribas MULTI CAP FUND - Direct Plan - IDCW Option,45.0111
2022-04-01,119354,Baroda BNP Paribas MULTI CAP FUND - Direct Plan - Growth Option,190.6347
2022-04-01,119363,BANK OF INDIA Manufacturing & Infrastructure Fund-Direct Plan-Regular IDCW,30.28
2022-04-01,119364,BANK OF INDIA Manufacturing & Infrastructure Fund-Direct Plan-Growth,32.07
2022-04-01,119365,BANK OF INDIA Manufacturing & Infrastructure Fund-Direct Plan-Quarterly IDCW,31.54
2022-04-01,119368,BANK OF INDIA Liquid Fund- Direct Plan- Daily IDCW,1002.6483
2022-04-01,119369,BANK OF INDIA Liquid Fund- Direct Plan- Growth,2449.4343
2022-04-01,119370,BANK OF INDIA Liquid Fund- Direct Plan- Weekly IDCW,1062.1271
2022-04-01,119397,L&T Large and Midcap Fund-Direct Plan-Growth,75.819
2022-04-01,119398,L&T Large and Midcap Fund- Direct Plan -IDCW,35.137
2022-04-01,119403,L&T India Value Fund-Direct Plan-IDCW,45.322
2022-04-01,119404,L&T India Value Fund-Direct Plan-Growth,63.087
2022-04-01,119412,L&T Infrastructure Fund-Direct Plan-IDCW,25.87
2022-04-01,119413,L&T Infrastructure Fund -Direct Plan-Growth,25.87
2022-04-01,119414,Baroda BNP Paribas LIQUID FUND - DIRECT PLAN - DAILY IDCW OPTION,1002.0849
2022-04-01,119415,Baroda BNP Paribas LIQUID FUND - DIRECT PLAN - GROWTH OPTION,2453.1964
2022-04-01,119416,Baroda BNP Paribas LIQUID FUND - DIRECT PLAN - WEEKLY IDCW OPTION,1219.0382
2022-04-01,119417,L&T  Tax Advantage Fund-Direct Plan-Growth,84.743
2022-04-01,119418,L&T Tax Advantage Fund-Direct Plan-IDCW,33.276
2022-04-01,119433,Aditya Birla Sun Life Large & Mid Cap Fund -Direct - IDCW,184.66
2022-04-01,119436,Aditya Birla Sun Life Large & Mid Cap Fund - Growth - Direct Plan,701.64
2022-04-01,119506,Aditya Birla Sun Life Dividend Yield Fund -DIRECT - IDCW,33.57
2022-04-01,119507,Aditya Birla Sun Life Dividend Yield Fund - Growth - Direct Plan,274.67
2022-04-01,119514,Aditya Birla Sun Life Infrastructure Fund - Growth - Direct Plan,51.78
2022-04-01,119515,Aditya Birla Sun Life Infrastructure Fund -  Direct - IDCW,26.53
2022-04-01,119516,Aditya Birla Sun Life International Equity Fund - Direct - IDCW,31.6988
2022-04-01,119517,Aditya Birla Sun Life International Equity Fund - Growth - Direct Plan,31.6801
2022-04-01,119518,Aditya Birla Sun Life International Equity Fund - Plan B - Growth - Direct Plan,28.1761
2022-04-01,119519,Aditya Birla Sun Life International Equity Fund - Plan B - Direct - IDCW,21.526
2022-04-01,119525,Aditya Birla Sun Life Arbitrage Fund-DIRECT - IDCW,11.2535
2022-04-01,119526,Aditya Birla Sun Life Arbitrage Fund - Growth - Direct Plan,22.7675
2022-04-01,119527,Aditya Birla Sun Life Large Cap Fund-DIRECT - IDCW,77.66
2022-04-01,119528,Aditya Birla Sun Life Large Cap Fund - Growth - Direct Plan,368.49
2022-04-01,119543,Aditya Birla Sun Life ELSS Tax Saver Fund-DIRECT - IDCW,304.83
2022-04-01,119544,Aditya Birla Sun Life ELSS Tax Saver Fund - Growth - Direct Plan,44.2
2022-04-01,119548,Sundaram Value Fund Direct Plan - Income Distribution cum Capital Withdrawal (IDCW),16.196
2022-04-01,119549,Sundaram Value Fund Direct Plan - Growth,154.0624
2022-04-01,119556,Aditya Birla Sun Life Small Cap Fund - Growth - Direct Plan,57.3921
2022-04-01,119557,Aditya Birla Sun Life Small Cap Fund -Direct - IDCW,52.5527
2022-04-01,119563,Aditya Birla Sun Life Focused Fund -Direct - IDCW,46.5631
2022-04-01,119564,Aditya Birla Sun Life Focused Fund - Growth - Direct Plan,99.6969
2022-04-01,119565,Sundaram Large and Midcap Direct Plan - Income Distribution cum Capital Withdrawal (IDCW),27.5304
2022-04-01,119566,Sundaram Large and Midcap Fund Direct Plan - Growth,59.4781
2022-04-01,119567,SBI Arbitrage Opportunities Fund - Direct Plan - Income Distribution cum Capital Withdrawal Option (IDCW),15.4227
2022-04-01,119568,Aditya Birla Sun Life Liquid Fund - Growth - Direct Plan,343.1604
2022-04-01,119569,Aditya Birla Sun Life Liquid Fund -Direct - daily IDCW,100.2053
2022-04-01,119570,Aditya Birla Sun Life Liquid Fund -Direct - weekly IDCW,100.3104
2022-04-01,119571,Aditya Birla Sun Life Liquid Fund -DIRECT - IDCW,186.3088
2022-04-01,119574,SBI Arbitrage Opportunities Fund - Direct Plan - Gr,28.5441
2022-04-01,119575,Aditya Birla Sun Life Commodity Equities Fund - Global Agri Plan -Direct - IDCW,24.3281
2022-04-01,119576,Aditya Birla Sun Life Commodity Equities Fund - Global Agri Plan - Growth - Direct Plan,42.1427
2022-04-01,119581,Sundaram Mid Cap Fund Direct Plan - Growth,744.2615
2022-04-01,119582,Sundaram Mid Cap Fund Direct Plan - Income Distribution cum Capital Withdrawal (IDCW),46.6946
2022-04-01,119585,SBI Large Cap Fund - Direct Plan - Income Distribution cum Capital Withdrawal Option (IDCW),42.6795
2022-04-01,119588,Sundaram Small Cap Fund Direct Plan - Income Distribution cum Capital Withdrawal (IDCW),27.5463
2022-04-01,119589,Sundaram Small Cap Fund Direct Plan - Growth,157.1762
2022-04-01,119590,Aditya Birla Sun Life Consumption Fund -DIRECT - IDCW,39.62
2022-04-01,119591,Aditya Birla Sun Life Consumption Fund - Growth - Direct Plan,147.36
2022-04-01,119594,Sundaram Consumption Fund (Formerly Known asSundaram Rural and Consumption Fund Direct Plan - Income Distribution cum Capital Withdrawal (IDCW),23.0939
2022-04-01,119595,Sundaram Consumption Fund (Formerly Known as Sundaram Rural and Consumption Fund Direct Plan - Growth),59.9582
2022-04-01,119596,Sundaram Financial Services Opportunities Fund Direct Plan - Income Distribution cum Capital Withdrawal (IDCW),24.9486
2022-04-01,119597,Sundaram Financial Services Opportunities Fund Direct Plan - Growth,63.5248
2022-04-01,119598,SBI Large Cap FUND-DIRECT PLAN -GROWTH,65.7623
2022-04-01,119601,Sundaram Global Brand Theme-Equity Active FOF - Direct IDCW,22.9529
2022-04-01,119602,Sundaram Global Brand Theme-Equity Active FOF - Direct Growth,25.8043
2022-04-01,119604,SBI Equity Hybrid Fund - Direct Plan - Income Distribution cum Capital Withdrawal Option (IDCW),64.8271
2022-04-01,119609,SBI EQUITY HYBRID FUND - DIRECT PLAN - Growth,221.5401
2022-04-01,119613,SBI Comma Fund - Direct Plan - Income Distribution cum Capital Withdrawal Option (IDCW),44.3421
2022-04-01,119619,Aditya Birla Sun Life Midcap Fund -DIRECT - IDCW,70.07
2022-04-01,119620,Aditya Birla Sun Life Midcap Fund - Growth - Direct Plan,502.14
2022-04-01,119646,Aditya Birla Sun Life MNC Fund - Growth - Direct Plan,1021.97
2022-04-01,119647,Aditya Birla Sun Life MNC Fund - DIRECT - IDCW,326.96
2022-04-01,119648,Aditya Birla Sun Life Nifty 50 Index Fund - Growth - Direct Plan,176.9302
2022-04-01,119649,Aditya Birla Sun Life Nifty 50 Index Fund -DIRECT - IDCW,18.2926
2022-04-01,119658,Aditya Birla Sun Life Value Fund - Direct - IDCW,54.7626
2022-04-01,119659,Aditya Birla Sun Life Value Fund - Growth - Direct Plan,78.3957
2022-04-01,119660,Aditya Birla Sun Life Tax Plan -DIRECT - IDCW,167.18
2022-04-01,119661,Aditya Birla Sun Life Tax Plan - Direct Plan - Growth Option,53.82
2022-04-01,119695,SBI Infrastructure Fund - Direct Plan - Income Distribution cum Capital Withdrawal Option (IDCW),23.7241
2022-04-01,119700,SBI INFRASTRUCTURE FUND -  DIRECT PLAN - GROWTH,26.8062
2022-04-01,119705,SBI COMMA Fund - DIRECT PLAN - Growth,77.9208
2022-04-01,119708,SBI ESG Exclusionary Strategy Fund - Direct Plan - Income Distribution cum Capital Withdrawal Option (IDCW),63.8085
2022-04-01,119709,SBI ESG Exclusionary Strategy Fund - Direct Plan -Growth,177.7396
2022-04-01,119710,SBI MNC Fund - Direct Plan - Income Distribution cum Capital Withdrawal Option (IDCW),105.9939
2022-04-01,119711,SBI MNC FUND - DIRECT PLAN -GROWTH,296.9303
2022-04-01,119715,SBI Midcap Fund - Direct Plan - Income Distribution cum Capital Withdrawal Option (IDCW),84.5421
2022-04-01,119716,SBI MIDCAP FUND - DIRECT PLAN - GROWTH,149.1208
2022-04-01,119717,SBI Flexicap Fund - Direct Plan - Income Distribution cum Capital Withdrawal Option (IDCW),41.7398
2022-04-01,119718,SBI Flexicap Fund - DIRECT PLAN - Growth Option,83.5077
2022-04-01,119720,SBI Large & Midcap Fund - Direct Plan - Income Distribution cum Capital Withdrawal Option (IDCW),202.8479
2022-04-01,119721,SBI LARGE & MIDCAP FUND -DIRECT PLAN -Growth,389.1801
2022-04-01,119722,SBI ELSS Tax Saver Fund - Direct Plan - Income Distribution cum Capital Withdrawal Option (IDCW),64.363
2022-04-01,119723,SBI ELSS Tax Saver FUND - DIRECT PLAN -GROWTH,233.608
2022-04-01,119724,SBI Contra Fund - Direct Plan - Income Distribution cum Capital Withdrawal Option (IDCW),45.2923
2022-04-01,119727,SBI FOCUSED FUND - DIRECT PLAN -GROWTH,256.185
2022-04-01,119730,SBI Consumption Opportunities Fund - Direct Plan - Income Distribution cum Capital Withdrawal Option (IDCW),146.0221
2022-04-01,119731,SBI Technology Opportunities Fund - Direct Plan - Income Distribution cum Capital Withdrawal Option (IDCW),121.2742
2022-04-01,119732,SBI PSU Fund - DIRECT PLAN - GROWTH,14.4418
2022-04-01,119733,SBI PSU Fund - Direct Plan - Income Distribution cum Capital Withdrawal Option (IDCW),14.4217
2022-04-01,119767,Kotak Aggressive Hybrid Fund - Direct Plan - IDCW - Payout & Reinvestment of Income Distribution cum  capital withdrawal option,27.659
2022-04-01,119768,Kotak Contra Fund - Direct Plan - IDCW -Payout & Re-investment of Income Distribution cum capital withdrawal option- Direct,33.545
2022-04-01,119769,Kotak Contra Fund - Direct Plan - Growth,94.267
2022-04-01,119770,Kotak  Arbitrage Fund - Direct Plan - IDCW -Payout &  Reinvestment of Income Distribution cum capital withdrawal option,11.2009
2022-04-01,119771,Kotak Arbitrage Fund - Direct Plan - Growth,31.6802
2022-04-01,119772,Kotak ELSS Tax Saver Fund-Payout of Income Distribution cum capital withdrawal option - Direct,34.355
2022-04-01,119773,Kotak ELSS Tax Saver Fund-Growth - Direct,82.016
2022-04-01,119774,Kotak Midcap Fund  - Direct Plan - IDCW - Payout & Re-investment of Income Distribution cum capital withdrawal option,47.882
2022-04-01,119775,Kotak Midcap Fund - Direct Plan - Growth,80.368
2022-04-01,119776,Kotak Multi Asset Omni FOF - Direct Payout of Income Distribution cum capital withdrawal option,140.676
2022-04-01,119777,Kotak Multi Asset Omni FOF - Direct Growth - Direct,143.253
2022-04-01,119778,Kotak Global Emerging Market Overseas Equity Omni FOF - Payout of Income Distribution cum capital withdrawal option - Direct,22.416
2022-04-01,119779,Kotak Global Emerging Market overseas Equity Omni FOF - Growth - Direct,22.322
2022-04-01,119782,SBI Healthcare Opportunities Fund - Direct Plan - Income Distribution cum Capital Withdrawal Option (IDCW),170.0058
2022-04-01,119783,SBI HEALTHCARE OPPORTUNITIES FUND - DIRECT PLAN -GROWTH,244.6925
2022-04-01,119790,L&T Liquid Fund - Direct Plan -Growth,2915.2562
2022-04-01,119791,L&T Liquid Fund - Direct Plan -Daily IDCW,1014.4533
2022-04-01,119799,SBI Liquid Fund - Direct Plan - Weekly Income Distribution cum Capital Withdrawal Option (IDCW),1138.4941
2022-04-01,119800,SBI Liquid Fund - DIRECT PLAN -Growth,3333.4218
2022-04-01,119801,L&T Equity Savings Fund- Direct Plan-Quarterly IDCW,15.118
2022-04-01,119802,L&T Equity Savings Fund - Direct Plan-Growth,25.096
2022-04-01,119803,L&T Equity Savings Fund - Direct Plan-Monthly IDCW,14.697
2022-04-01,119804,SBI Liquid Fund - Direct Paln - Fortnightly Income Distribution cum Capital Withdrawal Option (IDCW),1088.5292
2022-04-01,119805,SBI Liquid Fund - Direct Plan - Daily Income Distribution cum Capital Withdrawal Option (IDCW),1075.6614
2022-04-01,119806,L&T Mid Cap Fund-Direct Plan -IDCW,58.46
2022-04-01,119807,L&T Mid Cap Fund-Direct Plan-Growth,222.39
2022-04-01,119826,SBI Nifty Index Fund - Direct Plan - Income Distribution cum Capital Withdrawal Option (IDCW),81.2922
2022-04-01,119827,SBI NIFTY INDEX FUND - DIRECT PLAN - GROWTH,158.2676
2022-04-01,119831,SBI Overnight Fund - Direct Plan - Daily Income Distribution cum Capital Withdrawal Option (IDCW),1074.4666
2022-04-01,119832,SBI Overnight Fund - Direct Plan - Weekly Income Distribution cum Capital Withdrawal Option (IDCW),1097.1881
2022-04-01,119833,SBI OVERNIGHT FUND - DIRECT PLAN - GROWTH,3461.7044
2022-04-01,119834,SBI Focused Fund - Direct Plan - Income Distribution cum Capital Withdrawal Option (IDCW),62.431
2022-04-01,119835,SBI CONTRA FUND - DIRECT PLAN - GROWTH,214.6082
2022-04-01,119861,Tata Liquid Fund- Direct Plan-Growth Option,3360.7858
2022-04-01,119862,Tata Liquid Fund- Direct Plan - Daily Reinvestment of IDCW Option,1001.5187
2022-04-01,119958,Tata Equity Savings Fund-Direct Plan - Monthly Payout of IDCW Option,17.7439
2022-04-01,119959,Tata Equity Savings Fund-Direct Plan - Periodic Payout of IDCWS Option,22.3635
2022-04-01,119960,Tata Equity Savings Fund- Direct Plan- Growth Option,45.7655
2022-04-01,120029,HSBC Large Cap Fund - Direct IDCW,37.3315
2022-04-01,120030,HSBC Large Cap Fund - Direct Growth,339.7134
2022-04-01,120035,HSBC Brazil Fund - Growth Direct,8.2821
2022-04-01,120036,HSBC Brazil Fund - IDCW Direct Plan,8.2757
2022-04-01,120043,HSBC Global Emerging Market Fund - Growth Direct,19.8331
2022-04-01,120044,HSBC Global Emerging Markets Fund - IDCW Direct Plan,17.6111
2022-04-01,120045,HSBC Flexi Cap Fund - Direct IDCW,31.8989
2022-04-01,120046,HSBC Flexi Cap Fund - Direct Growth,143.4578
2022-04-01,120078,HSBC Tax Saver Equity Fund - IDCW Direct Plan,28.7119
2022-04-01,120079,HSBC Tax Saver Equity Fund - Growth Direct,61.5114
2022-04-01,120152,Kotak Large Cap  Fund - Growth - Direct,411.916
2022-04-01,120153,Kotak Large Cap Fund - Payout of Income Distribution cum capital withdrawal option - Direct,54.477
2022-04-01,120157,Kotak Large & Midcap Fund - IDCW-Direct,38.601
2022-04-01,120158,Kotak Large & Midcap Fund - Direct- Growth,218.753
2022-04-01,120163,Kotak-Small Cap Fund - Payout of Income Distribution cum capital withdrawal option - Direct,81.545
2022-04-01,120164,Kotak-Small Cap Fund - Growth - Direct,185.652
2022-04-01,120165,Kotak Flexicap Fund - Payout of Income Distribution cum capital withdrawal option- Direct,35.047
2022-04-01,120166,Kotak Flexicap Fund - Growth - Direct,57.387
2022-04-01,120185,ICICI Prudential US Bluechip Equity Fund - Direct Plan -  IDCW,50.03
2022-04-01,120186,ICICI Prudential US Bluechip Equity Fund - Direct Plan -  Growth,50.03
2022-04-01,120197,ICICI Prudential Liquid Fund - Direct Plan - Growth,315.2882
2022-04-01,120242,ICICI Prudential Multi Sector Passive FOF - Direct Plan - Growth,100.3303
2022-04-01,120243,ICICI Prudential Multi Sector Passive FOF - Direct Plan -  IDCW,91.6262
2022-04-01,120244,ICICI Prudential Banking and Financial Services Fund - Direct Plan -  Growth,90.27
2022-04-01,120245,ICICI Prudential Banking and Financial Services Fund - Direct Plan -  IDCW,57.64
2022-04-01,120248,LIC MF Liquid Fund-Direct Plan-Daily IDCW,1013.6
2022-04-01,120249,LIC MF Liquid Fund-Direct Plan-Growth,3867.1954
2022-04-01,120251,ICICI Prudential Equity & Debt Fund - Direct Plan - Growth,248.75
2022-04-01,120252,ICICI Prudential Equity & Debt Fund - Direct Plan - Monthly IDCW,44.96
2022-04-01,120259,LIC MF ULIS (5 Yrs. Single Premium)-Direct Plan-IDCW Reinvestment,29.5312
2022-04-01,120260,LIC MF Aggressive Hybrid Fund-Direct Plan-IDCW,16.4597
2022-04-01,120261,LIC MF Aggressive Hybrid Fund-Direct Plan-Growth,148.8448
2022-04-01,120263,LIC MF Flexi Cap Fund-Direct Plan-IDCW,24.6396
2022-04-01,120264,LIC MF Flexi Cap Fund-Direct Plan-Growth,70.0373
2022-04-01,120267,LIC MF Large Cap Fund-Direct Plan-Growth,44.7868
2022-04-01,120268,LIC MF Large Cap Fund-Direct Plan-IDCW,28.4961
2022-04-01,120269,LIC MF ELSS Tax Saver-Direct Plan-IDCW,25.9064
2022-04-01,120270,LIC MF ELSS Tax Saver-Direct Plan-Growth,109.6803
2022-04-01,120285,LIC MF Children's Fund-Direct Plan-Growth,25.8206
2022-04-01,120304,UTI-  Liquid Cash Plan - Direct Plan - Growth Option,3488.4007
2022-04-01,120307,LIC MF Nifty 50 Index Fund-Direct Plan-Growth,101.9091
2022-04-01,120308,LIC MF BSE Sensex Index Fund-Direct Plan-Growth,115.2441
2022-04-01,120309,LIC MF Nifty 50 Index Fund-Direct Plan-IDCW,37.5572
2022-04-01,120312,LIC MF BSE Sensex Index Fund-Direct Plan-IDCW,38.6399
2022-04-01,120322,ICICI Prudential Value Fund (erstwhile Value Discovery Fund) - Direct Plan - IDCW,73.3
2022-04-01,120323,ICICI Prudential Value Fund (erstwhile Value Discovery Fund) - Direct Plan - Growth,277.38
2022-04-01,120332,Invesco India Balanced Advantage Fund - Direct Plan - IDCW (Payout / Reinvestment),19.98
2022-04-01,120333,Invesco India Balanced Advantage Fund - Direct Plan - Growth,41.8
2022-04-01,120334,ICICI Prudential Multi-Asset Fund - Direct Plan - Growth,471.5323
2022-04-01,120335,ICICI Prudential Multi-Asset Fund - Direct Plan - IDCW,37.2498
2022-04-01,120348,Invesco India Contra Fund - Direct Plan - Growth,86.02
2022-04-01,120349,Invesco India Contra Fund - Direct Plan - IDCW (Payout / Reinvestment),40.1
2022-04-01,120350,LIC MF Infrastructure Fund-Direct Plan-IDCW,24.8607
2022-04-01,120351,LIC MF Infrastructure Fund-Direct Plan-Growth,25.2351
2022-04-01,120356,Invesco India Large & Mid Cap Fund - Direct Plan - IDCW (Payout / Reinvestment),29.36
2022-04-01,120357,Invesco India Large & Mid Cap Fund - Direct Plan - Growth,58.41
2022-04-01,120364,ICICI Prudential Arbitrage Fund - Direct Plan - Growth,29.3028
2022-04-01,120365,ICICI Prudential Arbitrage Fund - Direct Plan - IDCW,15.5436
2022-04-01,120376,ICICI Prudential Balanced Advantage Fund - Direct Plan -  IDCW,23.84
2022-04-01,120377,ICICI Prudential Balanced Advantage Fund - Direct Plan -  Growth,54.43
2022-04-01,120380,ICICI Prudential MidCap Fund - Direct Plan -  IDCW,40.76
2022-04-01,120381,ICICI Prudential MidCap Fund - Direct Plan -  Growth,174.03
2022-04-01,120384,Invesco India Financial Services Fund - Direct Plan - IDCW (Payout / Reinvestment),44.9
2022-04-01,120385,Invesco India Financial Services Fund - Direct Plan - Growth,87.13
2022-04-01,120388,Axis Liquid Fund - Direct Plan - Daily IDCW,1000.956
2022-04-01,120389,Axis Liquid Fund - Direct Plan - Growth Option,2364.3222
2022-04-01,120390,Axis Liquid Fund - Direct Plan - Weekly IDCW,1002.5998
2022-04-01,120391,Axis Liquid Fund - Direct Plan - Monthly IDCW,1001.5043
2022-04-01,120392,Invesco India Largecap Fund - Direct Plan - Growth,50.71
2022-04-01,120393,Invesco India Largecap Fund - Direct Plan - IDCW (Payout / Reinvestment),26.75
2022-04-01,120394,Invesco India PSU Equity Fund - Direct Plan - IDCW (Payout / Reinvestment),22.57
2022-04-01,120395,Invesco India PSU Equity Fund - Direct Plan - Growth,30.83
2022-04-01,120400,Invesco India Arbitrage Fund - Direct Plan - IDCW (Payout / Reinvestment),14.7536
2022-04-01,120401,Invesco India Arbitrage Fund - Direct Plan - Growth Option,27.1698
2022-04-01,120402,Invesco India Midcap Fund - Direct Plan - IDCW (Payout / Reinvestment),40.01
2022-04-01,120403,Invesco India Midcap Fund - Direct Plan - Growth Option,98.89
2022-04-01,120404,Invesco India Infrastructure Fund - Direct Plan - IDCW (Payout / Reinvestment),28.64
2022-04-01,120405,Invesco India Infrastructure Fund - Direct Plan - Growth Option,35.53
2022-04-01,120406,JM Liquid Fund (Direct) - Growth Option,58.2171
2022-04-01,120407,JM Liquid Fund (Direct) - Weekly IDCW,11.0104
2022-04-01,120408,JM Liquid Fund (Direct) - Quarterly IDCW,33.0521
2022-04-01,120410,JM Liquid Fund (Direct) - Bonus Option - Bonus Option - Principal units,18.732
2022-04-01,120411,JM Liquid Fund (Direct) - Daily IDCW,10.4302
2022-04-01,120412,Invesco India Multicap Fund - Direct Plan - IDCW (Payout / Reinvestment),79.36
2022-04-01,120413,Invesco India Multicap Fund - Direct Plan - Growth Option,87.67
2022-04-01,120416,Invesco India ELSS Tax Saver Fund - Direct Plan - Growth,92.38
2022-04-01,120417,Invesco India ELSS Tax Saver Fund - Direct Plan - IDCW Payout,25.89
2022-04-01,120465,Axis Large Cap Fund - Direct Plan - Growth,50.42
2022-04-01,120466,Axis Large Cap Fund - Direct Plan - IDCW,22.39
2022-04-01,120467,Axis Focused Fund - Direct Plan - IDCW,35.77
2022-04-01,120468,Axis Focused Fund - Direct Plan - Growth Option,48.74
2022-04-01,120472,Axis Gold Fund - Direct Plan - IDCW,16.9741
2022-04-01,120473,Axis Gold Fund - Direct Plan - Growth option,16.9582
2022-04-01,120481,JM Arbitrage Fund (Direct)- IDCW,13.1976
2022-04-01,120482,JM Arbitrage Fund (Direct) - Growth Option,28.0064
2022-04-01,120483,JM Aggressive Hybrid Fund (Direct) - IDCW,40.7846
2022-04-01,120484,JM Aggressive Hybrid Fund (Direct) - Growth Option,73.9773
2022-04-01,120485,JM Value Fund (Direct) - IDCW,38.0898
