date,scheme_code,scheme_name,nav
2022-04-01,100033,Aditya Birla Sun Life Large & Mid Cap Fund - Regular Growth,648.11
2022-04-01,100034,Aditya Birla Sun Life Large & Mid Cap Fund -Regular - IDCW,123.44
2022-04-01,100041,Aditya Birla Sun Life Liquid Fund -Institutional - IDCW,108.0337
2022-04-01,100042,Aditya Birla Sun Life Liquid Fund-Retail (Growth),552.5111
2022-04-01,100043,Aditya Birla Sun Life Liquid Fund-Institutional (Growth),566.9907
2022-04-01,100044,Aditya Birla Sun Life Liquid Fund -Retail - IDCW,163.7104
2022-04-01,100046,Aditya Birla Sun Life Liquid Fund -Daily IDCW,100.205
2022-04-01,100047,Aditya Birla Sun Life Liquid Fund - Growth,340.4705
2022-04-01,100048,Aditya Birla Sun Life Liquid Fund -Institutional - weekly  IDCW,108.1576
2022-04-01,100051,Aditya Birla Sun Life Liquid Fund -weekly IDCW,100.3081
2022-04-01,100063,Aditya Birla Sun Life MNC Fund - Regular - IDCW,162.43
2022-04-01,100064,Aditya Birla Sun Life MNC Fund - Growth - Regular Plan,940.5
2022-04-01,100067,Aditya Birla Sun Life Tax Plan -Regular - IDCW,93.37
2022-04-01,100080,DSP Flexi Cap Fund - Regular Plan - IDCW,50.63
2022-04-01,100081,DSP Aggressive Hybrid Fund- Regular Plan - Growth,229.842
2022-04-01,100082,DSP Aggressive Hybrid Fund- Regular Plan - IDCW,25.849
2022-04-01,100119,HDFC Balanced Advantage Fund - Growth Plan,289.737
2022-04-01,100120,HDFC Balanced Advantage Fund - IDCW Plan,29.176
2022-04-01,100174,quant ELSS Tax Saver Fund - IDCW Option - Regular Plan,32.1248
2022-04-01,100175,quant ELSS Tax Saver Fund - Growth Option - Regular Plan,231.6813
2022-04-01,100176,quant Small Cap Fund - IDCW Option - Regular Plan,107.244
2022-04-01,100177,quant Small Cap Fund - Growth - Regular Plan,134.9873
2022-04-01,100218,JM Large Cap Fund (Regular) - IDCW,19.2822
2022-04-01,100219,JM Large Cap Fund (Regular) - Growth Option,99.3269
2022-04-01,100220,JM Aggressive Hybrid Fund (Regular) - IDCW,18.9754
2022-04-01,100221,JM Aggressive Hybrid Fund (Regular) -Growth Option,67.8424
2022-04-01,100233,JM Liquid Fund (Regular) - Weekly IDCW,11.0078
2022-04-01,100234,JM Liquid Fund - Growth Option,57.7881
2022-04-01,100244,JM Liquid Fund (Regular) - Quarterly IDCW,32.7085
2022-04-01,100247,JM Liquid Fund (Regular) - Super Institutional Plan - Growth Option,33.2253
2022-04-01,100254,JM Value Fund (Regular) - Growth Option,51.4158
2022-04-01,100286,Kotak Aggressive Hybrid Fund - Regular Plan - IDCW - Payout & Reinvestment of Income Distribution cum capital withdrawal option,23.614
2022-04-01,100312,LIC MF Flexi Cap Fund-Regular Plan-IDCW,21.412
2022-04-01,100313,LIC MF Flexi Cap Fund-Regular Plan-Growth,65.4243
2022-04-01,100321,LIC MF Aggressive Hybrid Fund-Regular Plan-IDCW,14.5751
2022-04-01,100323,LIC MF Aggressive Hybrid Fund-Regular Plan-Growth,135.8405
2022-04-01,100325,LIC MF ULIS (5 Yrs. Single Premium)-Regular Plan-IDCW Reinvestment,27.4257
2022-04-01,100332,LIC MF Large Cap Fund-Regular Plan-IDCW,24.6804
2022-04-01,100348,ICICI Prudential Large & Mid Cap Fund - IDCW,22.75
2022-04-01,100349,ICICI Prudential Large & Mid Cap Fund - Growth,541.25
2022-04-01,100351,ICICI Prudential FMCG Fund - IDCW,79.01
2022-04-01,100352,ICICI Prudential FMCG Fund - Growth,330.96
2022-04-01,100353,ICICI Prudential ELSS Tax Saver Fund - IDCW,22.93
2022-04-01,100354,ICICI Prudential ELSS Tax Saver Fund - Growth,599.34
2022-04-01,100355,ICICI Prudential Equity & Debt Fund - Monthly IDCW,30.54
2022-04-01,100356,ICICI Prudential Equity & Debt Fund - Growth,228.53
2022-04-01,100363,ICICI Prudential Technology Fund - Growth,162.82
2022-04-01,100375,NIPPON INDIA GROWTH MID CAP FUND - IDCW Option,75.1365
2022-04-01,100376,Nippon India Growth Mid Cap Fund-Growth Plan-Bonus Option,338.4006
2022-04-01,100377,Nippon India Growth Mid Cap Fund-Growth Plan-Growth Option,2032.8275
2022-04-01,100378,Nippon India Vision Large & Midcap Fund - IDCW Option,46.3709
2022-04-01,100379,Nippon India Vision Large & Midcap Fund-GROWTH PLAN-Bonus Option,139.0724
2022-04-01,100380,Nippon India Vision Large & Midcap Fund-GROWTH PLAN-Growth Option,825.7195
2022-04-01,100414,Tata Aggressive Hybrid Fund- Regular Plan - Growth Option,301.883
2022-04-01,100415,Tata Ethical Fund-Regular Plan - Growth Option,284.778
2022-04-01,100470,Franklin India Large Cap Fund - IDCW,42.5209
2022-04-01,100471,Franklin India Large Cap Fund-Growth,689.8397
2022-04-01,100472,Franklin India Mid Cap Fund - IDCW,69.3698
2022-04-01,100473,Franklin India Mid Cap Fund-Growth,1439.7567
2022-04-01,100474,Tata ELSS Fund- Regular Plan - Payout of IDCW Option,77.9543
2022-04-01,100475,Tata Large Cap Fund -Regular Plan - Growth Option,333.0282
2022-04-01,100476,Taurus Flexi Cap Fund - Regular Plan - Growth,152.76
2022-04-01,100477,Taurus Mid Cap Fund - Regular Plan - Growth,73.36
2022-04-01,100480,Taurus ELSS Tax Saver Fund - Regular Plan - Growth,113.57
2022-04-01,100484,Franklin India Index Fund- NSE Nifty 50 Index Fund - Growth,139.7041
2022-04-01,100496,Templeton India Value Fund - Growth Plan,405.7129
2022-04-01,100497,Templeton India Value Fund - IDCW,74.8244
2022-04-01,100519,Franklin India Flexi Cap Fund - IDCW,47.3631
2022-04-01,100520,Franklin India Flexi Cap Fund - Growth,963.0183
2022-04-01,100521,Franklin India Technology Fund - IDCW,41.4405
2022-04-01,100522,Franklin India Technology Fund-Growth,335.4717
2022-04-01,100524,Franklin INDIA OPPORTUNITIES FUND - IDCW,22.9108
2022-04-01,100525,Franklin India ELSS Tax Saver Fund - IDCW,48.7383
2022-04-01,100526,Franklin India ELSS Tax Saver Fund-Growth,861.4571
2022-04-01,100535,Franklin India Retirement Fund - IDCW,16.7944
2022-04-01,100536,Franklin India Retirement Fund - Growth,159.6062
2022-04-01,100538,Franklin India Liquid Fund - Regular Plan - Growth,4887.7219
2022-04-01,100546,Franklin India Liquid Fund - Super Institutional Plan - Growth,3180.4334
2022-04-01,100549,Franklin India Aggressive Hybrid Fund - IDCW,25.8809
2022-04-01,100550,Franklin India Aggressive Hybrid Fund - Growth Plan,174.4318
2022-04-01,100593,CANARA ROBECO ELSS TAX SAVER - REGULAR PLAN -IDCW (Payout),35.98
2022-04-01,100614,Sundaram Value Fund Regular Plan - Income Distribution cum Capital Withdrawal (IDCW),13.5828
2022-04-01,100630,quant Multi Cap Fund-IDCW Option - Regular Plan,49.6646
2022-04-01,100631,quant Multi Cap Fund-GROWTH OPTION - Regular Plan,433.6629
2022-04-01,100643,SBI Technology Opportunities Fund - Regular Plan - Income Distribution cum Capital Withdrawal Option (IDCW),93.6084
2022-04-01,100644,SBI Healthcare Opportunities Fund - Regular Plan - Income Distribution cum Capital Withdrawal Option (IDCW),139.4058
2022-04-01,100645,SBI Consumption Opportunities Fund - Regular Plan - Income Distribution cum Capital Withdrawal Option (IDCW),113.3817
2022-04-01,100646,UTI - Unit Linked Insurance Plan,32.5995
2022-04-01,100650,UTI Large Cap Fund - Regular Plan - IDCW,42.8552
2022-04-01,100651,UTI Large Cap Fund - Regular Plan - Growth Option,195.4249
2022-04-01,100663,UTI Large & Mid Cap Fund - Regular Plan - IDCW,47.4499
2022-04-01,100664,UTI Large & Mid Cap Fund - Regular Plan - Growth Option,97.4023
2022-04-01,100668,UTI Flexi Cap Fund - Regular Plan - IDCW,167.6375
2022-04-01,100669,UTI - Flexi Cap Fund-Growth Option,246.806
2022-04-01,100678,UTI Children's Hybrid Fund - Regular Plan,30.3326
2022-04-01,100682,UTI Retirement Fund - Regular Plan,34.5471
2022-04-01,100684,UTI Aggressive Hybrid Fund - Regular Plan - Growth,249.7553
2022-04-01,100685,UTI Aggressive Hybrid Fund - Regular Plan - IDCW,33.2285
2022-04-01,100739,UTI MNC Fund - Regular Plan - IDCW,133.8907
2022-04-01,100740,UTI - MNC Fund - Regular Plan - Growth Option,259.6871
2022-04-01,100794,Sundaram Small Cap Fund Regular Plan - Income Distribution cum Capital Withdrawal (IDCW),25.1338
2022-04-01,100795,Sundaram Small Cap Fund Regular Plan - Growth,147.3546
2022-04-01,100806,UTI Healthcare Fund - Regular Plan - IDCW,121.5394
2022-04-01,100807,UTI Healthcare Fund - Regular Plan - Growth Option,157.259
2022-04-01,100813,UTI Overnight Fund - Regular Plan - Periodic IDCW,1485.6008
2022-04-01,100814,UTI - Overnight  Fund - Regular Plan - Growth Option,2883.7379
2022-04-01,100820,UTI ELSS Tax Saver Fund - Regular Plan - IDCW,27.1387
2022-04-01,100821,UTI ELSS Tax Saver Fund - Regular Plan - Growth Option,142.057
2022-04-01,100822,UTI Nifty 50 Index Fund - Regular Plan - Growth Option,117.7449
2022-04-01,100823,UTI Nifty 50 Index Fund - Regular Plan - IDCW,59.3197
2022-04-01,100837,Nippon India Liquid Fund - Retail Option - Growth Plan,4661.9613
2022-04-01,100838,NIPPON INDIA LIQUID FUND - RETAIL Plan - WEEKLY IDCW OPTION,1034.8767
2022-04-01,100842,NIPPON INDIA LIQUID FUND - RETAIL Plan - DAILY IDCW OPTION,1524.4009
2022-04-01,100843,NIPPON INDIA LIQUID FUND - RETAIL plan - MONTHLY IDCW OPTION,1327.3661
2022-04-01,100844,NIPPON INDIA LIQUID FUND - RETAIL Plan - QUARTERLY IDCW OPTION,1214.7471
2022-04-01,100851,Nippon India Liquid Fund -Growth Plan,5164.9347
2022-04-01,100852,NIPPON INDIA LIQUID FUND - DAILY IDCW OPTION,1528.8871
2022-04-01,100853,NIPPON INDIA LIQUID FUND - WEEKLY IDCW OPTION,1531.5315
2022-04-01,100855,NIPPON INDIA LIQUID FUND - MONTHLY IDCW OPTION,1585.0989
2022-04-01,100864,LIC MF ELSS Tax Saver-Regular Plan-IDCW,22.418
2022-04-01,100865,LIC MF ELSS Tax Saver-Regular Plan-Growth,99.7293
2022-04-01,100868,HDFC Liquid Fund - Growth Plan,4152.2137
2022-04-01,100900,HDFC Childrens Fund - Growth Plan,184.975
2022-04-01,100915,SBI Contra Fund - Regular Plan - Income Distribution cum Capital Withdrawal Option (IDCW),35.089
2022-04-01,100948,Franklin India Conservative Hybrid Fund - Growth,68.1868
2022-04-01,100949,Franklin India Conservative Hybrid Fund - Plan A - Monthly - IDCW,12.9545
2022-04-01,100950,Franklin India Conservative Hybrid Fund - Plan A - Quarterly - IDCW,12.1849
2022-04-01,101065,quant Mid Cap Fund - Growth Option - Regular Plan,128.4377
2022-04-01,101066,quant Mid Cap Fund - IDCW Option - Regular Plan,45.4938
2022-04-01,101069,quant Aggressive Hybrid Fund-IDCW Option - Regular Plan,39.5307
2022-04-01,101070,quant Aggressive Hybrid Fund - Growth Option - Regular Plan,286.6783
2022-04-01,101071,quant Multi Asset Allocation Fund - IDCW Option - Regular Plan,75.7322
2022-04-01,101072,quant Multi Asset Allocation Fund-GROWTH OPTION - Regular Plan,82.529
2022-04-01,101078,JM Liquid Fund (Regular) - Daily IDCW,10.4302
2022-04-01,101127,ICICI Prudential Children's Fund - Regular Plan,195.57
2022-04-01,101143,ICICI Prudential Multi-Asset Fund - IDCW,24.8135
2022-04-01,101144,ICICI Prudential Multi-Asset Fund - Growth,438.7628
2022-04-01,101161,Nippon India Multi Cap Fund-Growth Plan-Growth Option,153.3313
2022-04-01,101162,Nippon India Multi Cap Fund-Growth Plan-Bonus Option,153.3313
2022-04-01,101163,NIPPON INDIA MULTI CAP FUND - IDCW Option,42.0816
2022-04-01,101184,LIC MF Liquid Fund-Regular Plan-Daily IDCW,1000.1
2022-04-01,101185,LIC MF Liquid Fund-Regular Plan-Growth,3826.6205
2022-04-01,101198,LIC MF BSE Sensex Index Fund-Regular Plan-IDCW,37.6687
2022-04-01,101199,LIC MF BSE Sensex Index Fund-Regular Plan-Growth,109.8989
2022-04-01,101200,LIC MF Nifty 50 Index Fund-Regular Plan-IDCW,35.8104
2022-04-01,101201,LIC MF Nifty 50 Index Fund-Regular Plan-Growth,97.0747
2022-04-01,101206,SBI OVERNIGHT FUND - REGULAR PLAN - GROWTH,3425.6241
2022-04-01,101209,Taurus Large Cap Fund - Regular Plan - Growth,103.81
2022-04-01,101222,Tata Aggressive Hybrid Fund- Regular Plan - Periodic Payout of IDCW Option,83.286
2022-04-01,101228,ICICI Prudential Multicap Fund - Growth,444.16
2022-04-01,101262,Nippon India Power & Infra Fund-Growth Plan -Growth Option,153.1037
2022-04-01,101263,Nippon India Power & Infra Fund-Growth Plan-Bonus Option,153.1037
2022-04-01,101264,NIPPON INDIA POWER & INFRA FUND - IDCW Option,37.2069
2022-04-01,101271,LIC MF Children's Fund-Regular Plan-Growth,23.6896
2022-04-01,101281,HDFC BSE Sensex Index Fund - Growth Plan,532.1767
2022-04-01,101295,SBI ESG Exclusionary Strategy Fund - Regular Plan - Income Distribution cum Capital Withdrawal Option (IDCW),51.7862
2022-04-01,101313,Aditya Birla Sun Life Nifty 50 Index Fund -REGULAR - IDCW,17.86
2022-04-01,101314,Aditya Birla Sun Life Nifty 50 Index Fund - Growth - Regular Plan,174.771
2022-04-01,101349,ICICI Prudential Nifty 50 Index Fund - Cumulative Option,172.8833
2022-04-01,101407,Baroda BNP Paribas LIQUID FUND-Defunct Plan- IDCW Option,2952.2811
2022-04-01,101408,Baroda BNP Paribas LIQUID FUND- Defunct Plan -Growth Option,3578.0616
2022-04-01,101409,Baroda BNP Paribas LIQUID FUND-Defunct Plan-Daily IDCW Option,1006.0602
2022-04-01,101491,Tata Childrens Fund -Regular Plan-Growth Option,41.3106
2022-04-01,101525,HDFC Nifty 50 Index Fund - Growth Plan,162.9523
2022-04-01,101530,SBI Large & Midcap Fund - Regular Plan - Income Distribution cum Capital Withdrawal Option (IDCW),166.712
2022-04-01,101538,Sundaram Mid Cap Fund Regular Plan - Income Distribution cum Capital Withdrawal (IDCW),43.3752
2022-04-01,101539,Sundaram Mid Cap Fund Regular Plan - Growth,701.1683
2022-04-01,101549,JM Liquid Fund (Regular) - Bonus Option - Principal Units,18.5039
2022-04-01,101551,SBI Equity Hybrid Fund - Regular Plan - Income Distribution cum Capital Withdrawal Option (IDCW),43.4558
2022-04-01,101585,HDFC Equity Savings Fund - GROWTH PLAN,48.616
2022-04-01,101586,HDFC Equity Savings Fund - IDCW PLAN,11.99
2022-04-01,101591,Aditya Birla Sun Life Midcap Fund -REGULAR - IDCW,42.25
2022-04-01,101592,Aditya Birla Sun Life MIDCAP Fund-Growth,463.75
2022-04-01,101593,HSBC Large Cap Fund - Regular IDCW,40.0939
2022-04-01,101594,HSBC Large Cap Fund - Regular Growth,315.4426
2022-04-01,101609,TATA Equity Savings Fund- Regular Plan -Monthly Payout of IDCW option,15.1801
2022-04-01,101635,DSP Large Cap Fund - Regular Plan - Growth,281.196
2022-04-01,101636,DSP Large Cap Fund - Regular Plan - IDCW,20.134
2022-04-01,101659,Tata Nifty 50 Index Fund -Regular Plan,107.4636
2022-04-01,101672,Tata Value Fund - Regular Plan -Growth Option,197.5747
2022-04-01,101705,ICICI Prudential BSE Sensex ETF,645.1204
2022-04-01,101706,ICICI Prudential Multicap Fund - IDCW,25.49
2022-04-01,101714,Tata Liquid Fund- Regular Plan - Daily Reinvestment of IDCW Option,1001.5157
2022-04-01,101737,Aditya Birla Sun Life Dividend Yield Fund -REGULAR - IDCW,18.98
2022-04-01,101738,Aditya Birla Sun Life Dividend Yield Fund - Growth - Regular Plan,256.52
2022-04-01,101746,Tata S&P BSE Sensex Index Fund -Regular Plan,145.4148
2022-04-01,101762,HDFC Flexi Cap Fund - Growth Plan,1030.762
2022-04-01,101763,HDFC Flexi Cap Fund - IDCW Plan,54.883
2022-04-01,101764,HDFC Value Fund - Growth Plan,436.606
2022-04-01,101765,HDFC Value Fund - IDCW Plan,26.319
2022-04-01,101766,Tata Infrastructure Fund-Regular Plan- Growth Option,91.7421
2022-04-01,101823,Tata Large & Mid Cap Fund Regular Plan - Payout of IDCW Option,51.9226
2022-04-01,101824,Tata Large & Mid Cap Fund- Regular Plan - Growth Option,321.9083
2022-04-01,101833,Tata Ethical Fund- Regular Plan - Payout of IDCW Option,116.1377
2022-04-01,101834,UTI - Master Equity Plan Unit Scheme,160.633
2022-04-01,101852,TATA Infrastructure Fund Regular Plan - Payout of IDCW Option,43.5127
2022-04-01,101853,Sundaram Value Fund Regular Plan - Growth,148.1961
2022-04-01,101862,Nippon India Banking & Financial Services Fund-Growth Plan-Growth Option,361.1793
2022-04-01,101863,Nippon India Banking & Financial Services Fund-Growth Plan-Bonus Option,361.1793
2022-04-01,101864,Nippon India Banking & Financial Services Fund - IDCW Option,53.1843
2022-04-01,101906,Tata Equity Savings Fund -Regular Plan-Growth Option,41.6251
2022-04-01,101922,CANARA ROBECO FLEXICAP FUND - REGULAR PLAN - GROWTH OPTION,223.8
2022-04-01,101923,CANARA ROBECO FLEXICAP FUND - REGULAR PLAN - IDCW (Payout/Reinvestment),46.09
2022-04-01,101979,HDFC ELSS Tax saver - Growth Plan,746.424
2022-04-01,101980,HDFC ELSS Tax saver - IDCW Plan,53.872
2022-04-01,102000,HDFC Large Cap Fund - Growth Option - Regular Plan,705.113
2022-04-01,102001,HDFC Large Cap Fund - IDCW Option - Regular Plan,47.976
2022-04-01,102007,UTI-  Liquid Cash Plan- Discontinued -Regular Plan Periodic Dividend Option,1134.5834
2022-04-01,102008,UTI-  Liquid Cash Plan- Discontinued - Regular Plan - Monthly Dividend Option,1097.2742
2022-04-01,102009,UTI-  Liquid Cash Plan- Discontinued - Regular Plan -Growth,3188.8354
2022-04-01,102010,UTI Liquid Fund - Regular Plan - Daily IDCW (Reinvestment),1081.3191
2022-04-01,102011,UTI Liquid Fund - Regular Plan - Monthly IDCW,1033.3212
2022-04-01,102012,UTI-  Liquid Cash Plan - Regular Plan - Growth Option,3467.0914
2022-04-01,102013,UTI Liquid Fund - Regular Plan - Weekly IDCW,1053.2112
2022-04-01,102020,Baroda BNP Paribas MULTI CAP FUND - Regular Plan - Growth Option,175.7902
2022-04-01,102021,Baroda BNP Paribas MULTI CAP FUND - Regular Plan - IDCW Option,43.8826
2022-04-01,102036,Tata Large Cap Fund- Regular Plan - Payout of IDCW Option,72.6125
2022-04-01,102118,Tata Equity Savings Fund- Regular Plan - Periodic Payout of IDCW Option,19.9449
2022-04-01,102133,ICICI Prudential Multi Sector Passive FOF - Growth,96.726
2022-04-01,102134,ICICI Prudential Multi Sector Passive FOF - IDCW,88.0283
2022-04-01,102135,ICICI Prudential Aggressive Hybrid Active FOF - Growth,129.2585
2022-04-01,102136,ICICI Prudential Aggressive Hybrid Active FOF - IDCW,117.9007
2022-04-01,102142,Sundaram Consumption Fund(Formerly Known as Sundaram Rural and Consumption Fund Regular Plan - Growth),56.3033
2022-04-01,102251,HSBC Flexi Cap Fund - Regular IDCW,35.6296
2022-04-01,102252,HSBC Flexi Cap Fund - Regular Growth,132.325
2022-04-01,102266,UTI Children's Equity Fund - Regular Plan - IDCW,59.1384
2022-04-01,102267,UTI Children's Equity Fund - Regular Plan - Growth Option,59.1351
2022-04-01,102272,SBI NIFTY INDEX FUND - REGULAR PLAN - GROWTH,152.3529
2022-04-01,102273,SBI Nifty Index Fund - Regular Plan - Income Distribution cum Capital Withdrawal Option (IDCW),78.165
2022-04-01,102326,Tata Mid Cap Fund-Regular Plan - IDCW Option,66.8972
2022-04-01,102328,Tata Mid Cap Fund Regular Plan- Growth Option,242.1472
2022-04-01,102393,UTI Mid Cap Fund - Regular Plan - IDCW,86.0653
2022-04-01,102394,UTI Mid Cap Fund-Growth Option,181.8757
2022-04-01,102395,UTI Infrastructure Fund-Growth Option,76.2718
2022-04-01,102396,UTI Infrastructure Fund - Regular Plan - IDCW,39.863
2022-04-01,102397,UTI Transportation and Logistics Fund - Regular Plan - IDCW,59.5075
2022-04-01,102398,UTI-Transportation and Logistics  Fund-Growth Option,129.0528
2022-04-01,102401,UTI Banking and Financial Services Fund - Regular Plan - Growth Option,114.4256
2022-04-01,102402,UTI Banking and Financial Services Fund - Regular Plan - IDCW,44.5337
2022-04-01,102414,SBI CONTRA FUND - REGULAR PLAN -GROWTH,202.3548
2022-04-01,102428,Tata Value Fund Regular Plan - Payout of IDCW-Option B(10%),75.0409
2022-04-01,102431,Nippon India Pharma Fund-Growth Plan-Growth Option,290.4922
2022-04-01,102432,Nippon India Pharma Fund-Growth Plan-Bonus Option,290.4922
2022-04-01,102433,NIPPON INDIA PHARMA FUND - IDCW Option,80.6644
2022-04-01,102434,DSP India T.I.G.E.R. Fund - Regular Plan - Growth,144.349
2022-04-01,102435,DSP India T.I.G.E.R. Fund - Regular Plan - IDCW,17.48
2022-04-01,102528,ICICI Prudential MidCap Fund - Growth,159.82
2022-04-01,102529,ICICI Prudential MidCap Fund - IDCW,29.38
2022-04-01,102573,Kotak Multi Asset Omni FOF - Payout of Income Distribution cum capital withdrawal option,132.778
2022-04-01,102574,Kotak Multi Asset Omni FOF - Growth- Regular,136.406
2022-04-01,102594,ICICI Prudential Value Fund (erstwhile Value Discovery Fund) - Growth,256.88
2022-04-01,102595,ICICI Prudential Value Fund (erstwhile Value Discovery Fund) - IDCW,30.24
2022-04-01,102672,Tata Liquid Fund -Regular Plan - Growth Option,3333.3841
2022-04-01,102751,Nippon India Consumption Fund-Growth Plan-Growth Option,113.7931
2022-04-01,102752,Nippon India Consumption Fund-Growth Plan-Bonus Option,113.7931
2022-04-01,102753,NIPPON INDIA CONSUMPTION FUND - IDCW Option,28.3653
2022-04-01,102756,SBI FOCUSED FUND - REGULAR PLAN -GROWTH,234.9157
2022-04-01,102760,HDFC Focused Fund - GROWTH PLAN,117.507
2022-04-01,102761,HDFC Focused Fund - IDCW PLAN,17.526
2022-04-01,102765,SBI Focused Fund - Regular Plan - Income Distribution cum Capital Withdrawal Option (IDCW),42.9678
2022-04-01,102823,SBI HEALTHCARE OPPORTUNITIES FUND - REGULAR PLAN -GROWTH,221.2976
2022-04-01,102846,Nippon India Balanced Advantage Fund-Growth Plan-Growth Option,121.3584
2022-04-01,102847,Nippon India Balanced Advantage Fund-Growth Plan-Bonus Option,121.3584
2022-04-01,102848,NIPPON INDIA BALANCED ADVANTAGE FUND - IDCW Option,28.7844
2022-04-01,102874,Kotak-Small Cap Fund - Payout of Income Distribution cum capital withdrawal option,71.884
2022-04-01,102875,Kotak-Small Cap Fund - Growth,164.77
2022-04-01,102883,Franklin India Large & Mid Cap Fund - Growth Plan,120.3195
2022-04-01,102884,Franklin India Large & Mid Cap Fund - IDCW,17.7184
2022-04-01,102885,SBI EQUITY HYBRID FUND - REGULAR PLAN -Growth,205.0732
2022-04-01,102920,CANARA ROBECO LARGE AND MID CAP FUND - REGULAR PLAN - GROWTH OPTION,159.51
2022-04-01,102921,CANARA ROBECO LARGE AND MID CAP FUND - REGULAR PLAN - IDCW (Payout/Reinvestment),60.85
2022-04-01,102941,SBI MIDCAP FUND - REGULAR PLAN - GROWTH,136.9167
2022-04-01,102942,SBI Midcap Fund - Regular Plan - Income Distribution cum Capital Withdrawal Option (IDCW),55.9447
2022-04-01,102947,HDFC Hybrid Equity Fund - IDCW Plan,14.085
2022-04-01,102948,HDFC Hybrid Equity Fund - Growth Plan,80.337
2022-04-01,103024,SBI LARGE & MIDCAP FUND- REGULAR PLAN -Growth,369.0129
2022-04-01,103025,UTI Dividend Yield Fund - Regular Plan - IDCW,22.3003
2022-04-01,103026,UTI-Dividend Yield Fund.-Growth,107.0045
2022-04-01,103034,SBI MNC FUND - REGULAR PLAN -GROWTH,275.7017
2022-04-01,103039,Kotak Contra Fund - Regular Plan - IDCW - Payout & Re-investment of Income Distribution cum capital withdrawal option,28.804
2022-04-01,103040,Kotak Contra Fund - Regular Plan - Growth,83.563
2022-04-01,103085,Nippon India Value Fund- Growth Plan,124.3268
2022-04-01,103086,NIPPON INDIA VALUE FUND - IDCW Option,31.4147
2022-04-01,103097,UTI Value Fund - Regular Plan - IDCW,29.0752
2022-04-01,103098,UTI Value Fund - Regular Plan - Growth Option,99.7685
2022-04-01,103110,Aditya Birla Sun Life Consumption Fund -Regular - IDCW,32.4
2022-04-01,103111,Aditya Birla Sun Life Consumption Fund-Growth Option,133.68
2022-04-01,103114,SBI MNC Fund - Regular Plan - Income Distribution cum Capital Withdrawal Option (IDCW),84.2245
2022-04-01,103130,HDFC Multi-Asset Fund - IDCW Option,14.598
2022-04-01,103131,HDFC Multi-Asset Fund - Growth Option,47.803
2022-04-01,103140,SBI Overnight Fund - Regular Plan - Weekly Income Distribution cum Capital Withdrawal Option (IDCW),1095.5803
2022-04-01,103145,SBI COMMA Fund - REGULAR PLAN - Growth,73.41
2022-04-01,103146,SBI Comma Fund - Regular Plan - Income Distribution cum Capital Withdrawal Option (IDCW),41.6667
2022-04-01,103149,ICICI Prudential Infrastructure Fund - Growth,84.57
2022-04-01,103150,ICICI Prudential Infrastructure Fund - IDCW,16.84
2022-04-01,103151,Franklin India Opportunities Fund - Growth,112.8156
2022-04-01,103154,Aditya Birla Sun Life Equity Hybrid'95 Fund -Regular - IDCW,160.64
2022-04-01,103155,Aditya Birla Sun Life Equity Hybrid'95 Fund - Regular Plan-Growth,1096.08
2022-04-01,103164,Aditya Birla Sun Life ELSS Tax Saver Fund-Regular - IDCW,159.98
2022-04-01,103165,Aditya Birla Sun Life Flexi Cap Fund -Regular - IDCW,128.63
2022-04-01,103166,Aditya Birla Sun Life Flexi Cap Fund - Growth - Regular Plan,1144.27
2022-04-01,103167,Aditya Birla Sun Life Digital India Fund -Regular - IDCW,45.1
2022-04-01,103168,Aditya Birla Sun Life Digital India Fund - Growth - Regular Plan,138.67
2022-04-01,103173,Aditya Birla Sun Life Large Cap Fund-Regular - IDCW,33.25
2022-04-01,103174,Aditya Birla Sun Life Large Cap Fund-Growth,340.9
2022-04-01,103196,Nippon India ELSS Tax Saver Fund-Growth Plan-Growth Option,78.2783
2022-04-01,103197,NIPPON INDIA ELSS TAX SAVER FUND - IDCW Option,25.9722
2022-04-01,103215,SBI Flexicap Fund - REGULAR PLAN -Growth Option,76.9012
2022-04-01,103216,SBI Flexicap Fund - Regular Plan - Income Distribution cum Capital Withdrawal Option (IDCW),34.4345
2022-04-01,103233,Kotak Large & Midcap Fund - IDCW-Regular,34.516
2022-04-01,103234,Kotak Large & Midcap Fund - Growth-Regular,197.844
2022-04-01,103308,Aditya Birla Sun Life Focused Fund -Regular - IDCW,20.4064
2022-04-01,103309,Aditya Birla Sun Life Focused Fund -Growth Option,91.3597
2022-04-01,103312,ICICI Prudential Exports & Services Fund - Growth,92.81
2022-04-01,103313,ICICI Prudential Exports & Services Fund - IDCW,29.84
2022-04-01,103338,Kotak ELSS Tax Saver Fund-Payout of Income Distribution cum capital withdrawal option,27.296
2022-04-01,103339,Kotak ELSS Tax Saver Fund-Growth,72.936
2022-04-01,103340,ICICI Prudential Liquid Fund - Growth,313.1745
2022-04-01,103347,DSP Liquidity Fund - Regular Plan - Growth,3018.2805
2022-04-01,103348,DSP Liquidity Fund - Regular Plan - IDCW - Weekly,1000.9978
2022-04-01,103349,DSP Liquidity Fund- Regular Plan - IDCW - Daily,1001.0348
2022-04-01,103360,Franklin India Small Cap Fund-Growth,90.0763
2022-04-01,103361,Franklin India Small Cap Fund - IDCW,33.0065
2022-04-01,103389,CANARA ROBECO INFRASTRUCTURE FUND - REGULAR PLAN - IDCW (Payout/Reinvestment),33.55
2022-04-01,103390,CANARA ROBECO INFRASTRUCTURE FUND - REGULAR PLAN - GROWTH OPTION,74.3
2022-04-01,103475,Aditya Birla Sun Life Infrastructure Fund -  Regular - IDCW,17.43
2022-04-01,103476,Aditya Birla Sun Life Infrastructure Fund-Growth,48.31
2022-04-01,103490,Quantum Value Fund - Direct Plan Growth Option,77.29
2022-04-01,103491,Quantum Value Fund - Direct Plan IDCW,77.95
2022-04-01,103504,SBI Large Cap FUND-REGULAR PLAN GROWTH,60.752
2022-04-01,103616,SBI Large Cap Fund - Regular Plan - Income Distribution cum Capital Withdrawal Option (IDCW),34.5614
2022-04-01,103678,Franklin India Dividend Yield Fund-Growth Plan,83.4438
