date,scheme_code,scheme_name,nav
2007-01-12,100027,Grindlays Super Saver Income Fund-GSSIF-Half Yearly Dividend,10.3079
2007-01-12,100028,Grindlays Super Saver Income Fund-GSSIF-Quaterly Dividend,10.2212
2007-01-12,100029,Grindlays Super Saver Income Fund-GSSIF-Growth,16.7618
2007-01-12,100030,Grindlays Super Saver Income Fund-GSSIF-Annual Dividend,10.5342
2007-01-12,100031,Grindlays Super Saver Income Fund-GSSIF - ST-Dividend,10.0322
2007-01-12,100032,Grindlays Super Saver Income Fund-GSSIF - ST-Growth,14.6255
2007-01-12,100033,Aditya Birla Sun Life Large & Mid Cap Fund - Regular Growth,126.58
2007-01-12,100034,Aditya Birla Sun Life Large & Mid Cap Fund -Regular - IDCW,90.81
2007-01-12,100035,Birla Sun Life Freedom Fund-Plan A (Dividend),18.75
2007-01-12,100036,Birla Sun Life Freedom Fund-Plan B (Growth),28.21
2007-01-12,100037,Aditya Birla Sun Life Income Fund - Regular - Quarterly IDCW,10.1259
2007-01-12,100038,Aditya Birla Sun Life Income Fund - Growth - Regular Plan,30.2108
2007-01-12,100041,Aditya Birla Sun Life Liquid Fund -Institutional - IDCW,10.8023
2007-01-12,100042,Aditya Birla Sun Life Liquid Fund-Retail (Growth),19.8244
2007-01-12,100043,Aditya Birla Sun Life Liquid Fund-Institutional (Growth),19.9604
2007-01-12,100044,Aditya Birla Sun Life Liquid Fund -Retail - IDCW,16.3694
2007-01-12,100046,Aditya Birla Sun Life Liquid Fund -Daily IDCW,10.0195
2007-01-12,100047,Aditya Birla Sun Life Liquid Fund - Growth,11.7211
2007-01-12,100048,Aditya Birla Sun Life Liquid Fund -Institutional - weekly  IDCW,10.8068
2007-01-12,100049,Aditya Birla Sun Life Cash Plus-Institutional - Fortnightly Dividend,10.821
2007-01-12,100051,Aditya Birla Sun Life Liquid Fund -weekly IDCW,10.0225
2007-01-12,100052,Aditya Birla Sun Life Cash Plus-Institutional Premium - Fortnightly Dividend,10.0585
2007-01-12,100053,Aditya Birla Sun Life Cash Plus-Institutional Premium Plan-Monthly Dividend,10.0306
2007-01-12,100054,Aditya Birla Sun Life Gilt Plus - Liquid Plan - Quarterly Dividend - Regular Plan,10.6855
2007-01-12,100055,Aditya Birla Sun Life Gilt Plus - Liquid Plan - Growth - Regular Plan,17.9744
2007-01-12,100056,Aditya Birla Sun Life Gilt Plus - Liquid Plan - Annual Dividend - Regular Plan,11.9691
2007-01-12,100057,Aditya Birla Sun Life Govenment Securities Fund -Regular - Quarterly IDCW,10.5576
2007-01-12,100058,Aditya Birla Sun Life Government Securities Fund  - Growth - Regular Plan,20.5567
2007-01-12,100059,Aditya Birla Sun Life Gilt Plus-PF Plan (Annual Dividend),20.5574
2007-01-12,100060,Aditya Birla Sun Life Constant Maturity 10 Year Gilt Fund - Quarterly Dividend - Regular Plan,11.125
2007-01-12,100061,Aditya Birla Sun Life Constant Maturity 10 Year Gilt Fund - Growth - Regular Plan,23.1835
2007-01-12,100062,Aditya Birla Sun Life Gilt Plus-Regular Plan (Annual Dividend),23.2312
2007-01-12,100063,Aditya Birla Sun Life MNC Fund - Regular - IDCW,63.37
2007-01-12,100064,Aditya Birla Sun Life MNC Fund - Growth - Regular Plan,126.43
2007-01-12,100065,Aditya Birla Sun Life India Opportunities Fund - Dividend - Regular Plan,22.92
2007-01-12,100066,Aditya Birla Sun Life India Opportunities Fund - Growth - Regular Plan,53.36
2007-01-12,100067,Aditya Birla Sun Life Tax Plan -Regular - IDCW,58.22
2007-01-12,100068,BARODA ELSS 96 - Plan A - IDCW,26.23
2007-01-12,100069,BARODA PIONEER DIVERSIFIED FUND,30.68
2007-01-12,100077,DSP Bond Fund - IDCW,10.6153
2007-01-12,100078,DSP Bond Fund - Growth,24.7495
2007-01-12,100079,DSP Bond Fund - IDCW - Monthly,10.3912
2007-01-12,100080,DSP Flexi Cap Fund - Regular Plan - IDCW,46.82
2007-01-12,100081,DSP Aggressive Hybrid Fund- Regular Plan - Growth,39.068
2007-01-12,100082,DSP Aggressive Hybrid Fund- Regular Plan - IDCW,22.664
2007-01-12,100084,DSP Gilt Fund - Regular Plan - Growth,22.9593
2007-01-12,100085,DSP Gilt Fund - Regular Plan - IDCW,11.4429
2007-01-12,100086,DSP Gilt Fund - Regular Plan - IDCW - Monthly,10.0741
2007-01-12,100087,DSP Savings Fund - Regular Plan - Growth,16.7573
2007-01-12,100088,DSP Savings Fund - Regular Plan - IDCW,11.055
2007-01-12,100089,DSP Savings Fund - Regular Plan - IDCW - Monthly,10.0627
2007-01-12,100090,DSP BlackRock Technology.com   Fund - Regular Plan - Growth,24.225
2007-01-12,100119,HDFC Balanced Advantage Fund - Growth Plan,49.17
2007-01-12,100120,HDFC Balanced Advantage Fund - IDCW Plan,26.692
2007-01-12,100121,HDFC Balanced Fund - Dividend Option,18.344
2007-01-12,100122,HDFC Balanced Fund - Growth Option,32.472
2007-01-12,100123,HDFC Income Fund - Quarterly IDCW Option,10.193
2007-01-12,100124,HDFC Income Fund - Growth Option,16.6737
2007-01-12,100150,Principal Child Benefit Fund-Super Saver-Future Guard Plan,56.2
2007-01-12,100151,Principal Retail Equity Savings Fund - Growth Option,56.96
2007-01-12,100152,Principal Nifty 100 Equal Weight Fund-Income Distribution CUM Capital Withdrawal,22.4004
2007-01-12,100153,Principal Nifty 100 Equal Weight Fund-Growth,28.9265
2007-01-12,100156,Principal Tax Savings Fund,82.13
2007-01-12,100171,Quant Dynamic Bond-Dividend,10.1528
2007-01-12,100172,Quant Dynamic Bond-Growth,22.6052
2007-01-12,100173,Quant Dynamic Bond-Bonus,11.9066
2007-01-12,100174,quant ELSS Tax Saver Fund - IDCW Option - Regular Plan,15.6563
2007-01-12,100175,quant ELSS Tax Saver Fund - Growth Option - Regular Plan,44.4613
2007-01-12,100176,quant Small Cap Fund - IDCW Option - Regular Plan,17.0958
2007-01-12,100177,quant Small Cap Fund - Growth - Regular Plan,20.2513
2007-01-12,100178,ING Income Fund-Regular Plan -Dividend Option (Quarterly),10.1747
2007-01-12,100179,ING Income Fund-Regular Plan -Dividend Option (Half Yearly),10.3222
2007-01-12,100180,ING Income Fund- Regular Plan - Dividend Option (Annual),10.6633
2007-01-12,100181,ING Income Fund-Regular Plan -Growth Option,18.1266
2007-01-12,100182,ING Income Fund-Institutional Plan - Dividend Option (Half Yearly),10.0
2007-01-12,100183,ING Income Fund-Institutional Plan - Dividend Option (Quarterly),10.0
2007-01-12,100184,ING Income Fund-Institutional Plan -Dividend Option (Annual),10.6839
2007-01-12,100185,ING Income Fund-Bonus Option,11.0523
2007-01-12,100186,ING Income Fund-Institutional Bonus Option,11.284
2007-01-12,100187,ING Income Fund-Institutional Plan - Growth Option,18.8498
2007-01-12,100188,ING Core Equity Fund-Dividend Option,14.72
2007-01-12,100189,ING Core Equity Fund-Growth Option,27.84
2007-01-12,100190,ING Liquid Fund-Regular Growth Option,15.6174
2007-01-12,100191,ING Liquid Fund-Regular Weekly Dividend Option,10.8335
2007-01-12,100192,ING Liquid Fund-Regular Daily Dividend Option,10.7854
2007-01-12,100194,ING Liquid Fund-Auto Sweep Growth Option,10.0
2007-01-12,100195,ING Liquid Fund-Auto Sweep Weekly Dividend Option,10.0
2007-01-12,100196,ING Liquid Fund-Institutional Growth Option,11.5776
2007-01-12,100197,ING Liquid Fund-Institutional Weekly Dividend Option,10.063
2007-01-12,100198,ING Liquid Fund-Institutional Daily Dividend Option,10.0107
2007-01-12,100199,ING Liquid Fund-Super Institutional Growth Option,10.9581
2007-01-12,100200,ING Liquid Fund-Super Institutional Daily Dividend Option,10.0029
2007-01-12,100201,ING Liquid Fund-Super Institutional Weekly Dividend Option,10.0935
2007-01-12,100202,ING Balanced Fund-Dividend Option,12.97
2007-01-12,100203,ING Balanced Fund-Growth Option,18.54
2007-01-12,100218,JM Large Cap Fund (Regular) - IDCW,17.96
2007-01-12,100219,JM Large Cap Fund (Regular) - Growth Option,39.96
2007-01-12,100220,JM Aggressive Hybrid Fund (Regular) - IDCW,17.89
2007-01-12,100221,JM Aggressive Hybrid Fund (Regular) -Growth Option,23.55
2007-01-12,100222,JM Medium to Long Duration Fund (Regular) - Quarterly IDCW,10.2902
2007-01-12,100223,JM Medium to Long Duration Fund (Regular) - Growth Option,28.5235
2007-01-12,100233,JM Liquid Fund (Regular) - Weekly IDCW,10.3846
2007-01-12,100234,JM Liquid Fund - Growth Option,20.2419
2007-01-12,100237,JM High Liquidity Fund-- Institutional Plan - Growth,12.2121
2007-01-12,100238,JM High Liquidity Fund-Institutional Plan - Daily Dividend,10.0159
2007-01-12,100241,JM High Liquidity Fund-- Institutional Plan - Dividend,10.1495
2007-01-12,100243,JM High Liquidity Fund-- Premium Plan - Daily Dividend Option,10.0
2007-01-12,100244,JM Liquid Fund (Regular) - Quarterly IDCW,11.6547
2007-01-12,100245,JM High Liquidity Fund-Super Institutional Plan- Daily Dividend,10.0165
2007-01-12,100246,JM High Liquidity Fund-Super Institutional Plan- Weekly  Dividend,10.1374
2007-01-12,100247,JM Liquid Fund (Regular) - Super Institutional Plan - Growth Option,11.6123
2007-01-12,100249,JM G-Sec Fund - Quarterly Dividend Option,10.2823
2007-01-12,100250,JM G-Sec Fund - Growth Option,21.032
2007-01-12,100251,JM G-Sec Fund-PF Plan - Growth Plan,22.0014
2007-01-12,100252,JM G-Sec Fund-PF Plan -Dividend Plan,20.1599
2007-01-12,100253,JM G-Sec Fund - Bonus Option - Principal Units,10.2308
2007-01-12,100254,JM Value Fund (Regular) - Growth Option,19.17
2007-01-12,100261,Kotak Gilt-Savings-Monthly Dividend,10.44
2007-01-12,100262,Kotak Gilt-Savings-Growth,17.9753
2007-01-12,100263,Kotak Gilt-Savings-Annual Dividend,12.0206
2007-01-12,100264,Kotak Gilt-Investment Regular-Payout of Income Distribution cum capital withdrawal option,11.3157
2007-01-12,100265,Kotak Gilt-Investment Regular-Growth,23.5244
2007-01-12,100280,Kotak Gilt-Investment  Provident Fund and Trust-Payout of Income Distribution cum capital withdrawal option,10.7505
2007-01-12,100281,Kotak Gilt-Investment  Provident Fund and Trust-Growth,23.8147
2007-01-12,100286,Kotak Aggressive Hybrid Fund - Regular Plan - IDCW - Payout & Reinvestment of Income Distribution cum capital withdrawal option,23.922
2007-01-12,100289,Kotak Tech,11.083
2007-01-12,100290,Kotak MNC,27.02
2007-01-12,100291,Kotak Bond-Deposit-Dividend,11.7162
2007-01-12,100292,Kotak Bond-Deposit-Growth,18.5381
2007-01-12,100298,Kotak Bond Regular Plan Quaterly Payout of Income Distribution cum capital withdrawal option,10.385
2007-01-12,100299,Kotak Bond Fund - Regular Plan Growth,19.4316
2007-01-12,100300,Kotak Bond Fund - Regular Plan - Standard IDCW Option,12.9863
2007-01-12,100301,Kotak Bond Regular Plan Bonus Plan,12.9522
2007-01-12,100312,LIC MF Flexi Cap Fund-Regular Plan-IDCW,12.1433
2007-01-12,100313,LIC MF Flexi Cap Fund-Regular Plan-Growth,21.9493
2007-01-12,100314,LIC MF Medium to Long Duration Fund-Regular Plan-IDCW,10.1584
2007-01-12,100315,LIC MF Medium to Long Duration Fund-Regular Plan-Growth,19.8805
2007-01-12,100316,LIC MF Gilt Fund-Regular Plan-IDCW,10.9315
2007-01-12,100317,LIC MF Gilt Fund-Regular Plan-Growth,18.8089
2007-01-12,100318,LIC MF Gilt Fund-PF Plan-IDCW,10.846
2007-01-12,100319,LIC MF Gilt Fund-PF Plan-Growth,10.846
2007-01-12,100321,LIC MF Aggressive Hybrid Fund-Regular Plan-IDCW,12.368
2007-01-12,100323,LIC MF Aggressive Hybrid Fund-Regular Plan-Growth,45.9548
2007-01-12,100325,LIC MF ULIS (5 Yrs. Single Premium)-Regular Plan-IDCW Reinvestment,12.7018
2007-01-12,100332,LIC MF Large Cap Fund-Regular Plan-IDCW,11.2044
2007-01-12,100337,SaharaTax Gain-Dividend,18.595
2007-01-12,100338,SaharaTax Gain-Growth,21.2877
2007-01-12,100347,Morgan Stanley Growth Fund- Regular Growth Plan,51.06
2007-01-12,100348,ICICI Prudential Large & Mid Cap Fund - IDCW,23.19
2007-01-12,100349,ICICI Prudential Large & Mid Cap Fund - Growth,94.7
2007-01-12,100350,ICICI Prudential Large & Mid Cap Fund - Institutional Option - I - Growth,12.56
2007-01-12,100351,ICICI Prudential FMCG Fund - IDCW,35.25
2007-01-12,100352,ICICI Prudential FMCG Fund - Growth,42.03
2007-01-12,100353,ICICI Prudential ELSS Tax Saver Fund - IDCW,28.14
2007-01-12,100354,ICICI Prudential ELSS Tax Saver Fund - Growth,95.6
2007-01-12,100355,ICICI Prudential Equity & Debt Fund - Monthly IDCW,18.43
2007-01-12,100356,ICICI Prudential Equity & Debt Fund - Growth,35.35
2007-01-12,100357,ICICI Prudential Liquid Fund -Quarterly IDCW,10.7541
2007-01-12,100359,ICICI Prudential Liquid Institutional Plus Fund - Div - Daily,11.8515
2007-01-12,100360,ICICI Prudential Liquid Institutional Plus Fund - Div - Weekly,11.8635
2007-01-12,100361,ICICI Prudential Liquid Fund-Dividend-Institutional Plus - Monthly,11.9525
2007-01-12,100362,ICICI Prudential Liquid Institutional Plus Fund - Growth,18.296
2007-01-12,100363,ICICI Prudential Technology Fund - Growth,15.99
2007-01-12,100364,ICICI Prudential Long Term Bond Fund - Half Yearly IDCW,10.5571
2007-01-12,100365,ICICI Prudential Long Term Bond Fund - Growth,21.4779
2007-01-12,100366,ICICI Prudential Long Term Bond Fund-Institutional Quarterly Dividend,10.1615
2007-01-12,100367,ICICI Prudential Long Term Bond Fund - Quarterly IDCW,10.9825
2007-01-12,100368,ICICI Prudential Gilt Fund - IDCW,10.5031
2007-01-12,100369,ICICI Prudential Gilt Fund - Growth,22.2031
2007-01-12,100370,ICICI Prudential Short Term Gilt Fund - Dividend,10.4642
2007-01-12,100371,ICICI Prudential Short Term Gilt Fund - Growth,17.7846
2007-01-12,100372,ICICI Prudential Short Term Gilt Fund - Half Yearly Dividend,10.0582
2007-01-12,100375,NIPPON INDIA GROWTH MID CAP FUND - IDCW Option,58.6
2007-01-12,100376,Nippon India Growth Mid Cap Fund-Growth Plan-Bonus Option,45.46
2007-01-12,100377,Nippon India Growth Mid Cap Fund-Growth Plan-Growth Option,274.18
2007-01-12,100378,Nippon India Vision Large & Midcap Fund - IDCW Option,55.04
2007-01-12,100379,Nippon India Vision Large & Midcap Fund-GROWTH PLAN-Bonus Option,30.95
2007-01-12,100380,Nippon India Vision Large & Midcap Fund-GROWTH PLAN-Growth Option,184.67
2007-01-12,100381,UTI Large Cap Fund-Income Option,17.72
2007-01-12,100382,UTI Large Cap Fund-Growth Option,20.32
2007-01-12,100383,NIPPON INDIA MEDIUM TO LONG DURATION FUND - MONTHLY IDCW Option,11.0431
2007-01-12,100384,NIPPON INDIA MEDIUM TO LONG DURATION  FUND - QUARTERLY IDCW Option,11.869
2007-01-12,100385,NIPPON INDIA MEDIUM TO LONG DURATION  FUND - HALF YEARLY IDCW Option,11.3018
2007-01-12,100386,NIPPON INDIA MEDIUM TO LONG DURATION  FUND - ANNUAL IDCW Option,12.0237
2007-01-12,100387,Nippon India Medium to Long Duration  Fund - Growth Plan Growth Option,23.1484
2007-01-12,100388,Nippon India Medium to Long Duration  Fund - Growth Plan Bonus Option,10.9069
2007-01-12,100414,Tata Aggressive Hybrid Fund- Regular Plan - Growth Option,50.2198
2007-01-12,100415,Tata Ethical Fund-Regular Plan - Growth Option,49.4509
2007-01-12,100416,Tata Long Term Debt Fund - Regular Plan - Quarterly Dividend,10.3495
2007-01-12,100417,Tata Income Fund-Regular Plan - Half Yearly Payout of IDCW Option,10.9041
2007-01-12,100418,Tata Income Fund -Regular Plan - Growth Option,24.7989
2007-01-12,100470,Franklin India Large Cap Fund - IDCW,43.81
2007-01-12,100471,Franklin India Large Cap Fund-Growth,132.07
2007-01-12,100472,Franklin India Mid Cap Fund - IDCW,60.68
2007-01-12,100473,Franklin India Mid Cap Fund-Growth,217.93
2007-01-12,100474,Tata ELSS Fund- Regular Plan - Payout of IDCW Option,44.0385
2007-01-12,100475,Tata Large Cap Fund -Regular Plan - Growth Option,62.4588
2007-01-12,100476,Taurus Flexi Cap Fund - Regular Plan - Growth,43.07
2007-01-12,100477,Taurus Mid Cap Fund - Regular Plan - Growth,16.77
2007-01-12,100480,Taurus ELSS Tax Saver Fund - Regular Plan - Growth,18.11
2007-01-12,100481,Franklin India Balanced Fund-Growth,35.74
2007-01-12,100482,Franklin India Balanced Fund-Div,30.89
2007-01-12,100483,Franklin India Growth Fund,30.62
2007-01-12,100484,Franklin India Index Fund- NSE Nifty 50 Index Fund - Growth,32.2381
2007-01-12,100485,Franklin India Govt.Sec. Fund-Composite Plan - Growth,24.1407
2007-01-12,100486,Franklin India Govt.Sec. Fund-Composite Plan - Dividend,10.7489
2007-01-12,100487,Franklin India Govt.Sec. Fund-Treasury Plan(Dividend Option),10.678
2007-01-12,100489,Franklin India Govt.Sec. Fund-Treasury Plan(Growth Option),13.8168
2007-01-12,100490,Franklin India Govt.Sec. Fund-PF Plan - Growth,10.6034
2007-01-12,100491,Franklin India Govt.Sec. Fund-PF Plan - Dividend,10.6034
2007-01-12,100493,Franklin India Government Securities Fund - Growth,16.4834
2007-01-12,100494,Franklin India Government Securities Fund - IDCW,10.7638
2007-01-12,100495,Franklin India Govt.Sec. Fund-Long Term Plan - Bonus,12.1685
2007-01-12,100496,Templeton India Value Fund - Growth Plan,67.38
2007-01-12,100497,Templeton India Value Fund - IDCW,39.84
2007-01-12,100498,Franklin India Dynamic Accrual Fund - IDCW,10.4766
2007-01-12,100499,Franklin India Dynamic Accrual Fund-Growth,25.6249
2007-01-12,100503,Franklin India Low Duration Fund - Monthly - IDCW,10.2321
2007-01-12,100504,Franklin India Low Duration Fund - Quarterly - IDCW,10.192
2007-01-12,100505,Templeton Monthly Income Plan-Half Yearly Dividend,12.3121
2007-01-12,100506,Templeton Monthly Income Plan-Growth,19.8509
2007-01-12,100519,Franklin India Flexi Cap Fund - IDCW,35.1
2007-01-12,100520,Franklin India Flexi Cap Fund - Growth,141.86
2007-01-12,100521,Franklin India Technology Fund - IDCW,26.49
2007-01-12,100522,Franklin India Technology Fund-Growth,56.93
2007-01-12,100523,Franklin FMCG Fund - Growth,35.54
2007-01-12,100524,Franklin INDIA OPPORTUNITIES FUND - IDCW,16.22
2007-01-12,100525,Franklin India ELSS Tax Saver Fund - IDCW,32.62
2007-01-12,100526,Franklin India ELSS Tax Saver Fund-Growth,128.8
2007-01-12,100527,Franklin India Corporate Debt Fund - Plan A - Annual - IDCW,10.6451
2007-01-12,100528,Franklin India Corporate Debt Fund - Growth,24.9712
2007-01-12,100529,Franklin India Corporate Debt Fund - Plan B - Monthly - IDCW,13.7096
2007-01-12,100530,Franklin India Corporate Debt Fund - Plan B - Quarterly - IDCW,13.8318
2007-01-12,100531,Franklin India Corporate Debt Fund - Plan B - Half yearly - IDCW,14.0204
2007-01-12,100532,Franklin India Corporate Debt Fund - Monthly Bonus,19.3283
2007-01-12,100535,Franklin India Retirement Fund - IDCW,16.912
2007-01-12,100536,Franklin India Retirement Fund - Growth,44.0009
2007-01-12,100537,Franklin India Liquid Fund - Regular Plan - Weekly - IDCW,1245.5197
2007-01-12,100538,Franklin India Liquid Fund - Regular Plan - Growth,1832.8451
2007-01-12,100541,Franklin India Liquid Fund - Regular Plan - Daily - IDCW,1512.34
2007-01-12,100542,Franklin India Liquid Fund - Liquid Plan - Weekly Dividend,1001.5031
2007-01-12,100543,Franklin India Liquid Fund - Liquid Plan - Daily IDCW,1000.25
2007-01-12,100544,Franklin India Liquid Fund - Liquid Plan - Growth,1127.8707
2007-01-12,100546,Franklin India Liquid Fund - Super Institutional Plan - Growth,1089.2303
2007-01-12,100547,Franklin India Liquid Fund - Super Institutional Plan - Daily - IDCW,1000.25
2007-01-12,100548,Franklin India Liquid Fund - Super Institutional Plan - Weekly - IDCW,1017.1803
2007-01-12,100549,Franklin India Aggressive Hybrid Fund - IDCW,23.5705
2007-01-12,100550,Franklin India Aggressive Hybrid Fund - Growth Plan,33.095
2007-01-12,100551,Templeton India Children’s Asset Plan-Education Plan,25.3935
2007-01-12,100552,Templeton India Children’s Asset Plan-Gift Plan - Growth,30.8199
2007-01-12,100553,Templeton India Children’s Asset Plan-Gift Plan - Dividend,30.8199
2007-01-12,100556,Franklin India Taxshield 97,124.49
2007-01-12,100557,Franklin India Taxshield 98,124.92
2007-01-12,100558,Franklin India Taxshield 99,76.41
2007-01-12,100561,Templeton India Money Market Account - Bonus Plan,1.0
2007-01-12,100563,DBS Chola Triple Ace-Regular -Cumulative,23.9003
2007-01-12,100567,DBS Chola Triple Ace-Regular - Quarterly Dividend,11.2533
2007-01-12,100569,DBS Chola Triple Ace-Semi Annual Dividend,11.5653
2007-01-12,100573,DBS Chola Triple Ace-Regular Bonus,13.2799
2007-01-12,100574,DBS Chola Freedom Income -Short Term Fund-Regular-Monthly Dividend,10.9575
2007-01-12,100575,DBS Chola Freedom Income -Short Term Fund-Regular - Cumulative,11.696
2007-01-12,100576,DBS Chola Freedom Income -Short Term Fund-Cum- Institutional Plan,11.8356
2007-01-12,100579,DBS Chola Gilt-Investment-Quarterly Dividend,10.2611
2007-01-12,100580,DBS Chola Gilt-Investment-Cumulative,18.656
2007-01-12,100589,Canara Robeco Expo-Income Plan,21.01
2007-01-12,100590,Canara Robeco Expo-Growth Plan,55.19
2007-01-12,100593,CANARA ROBECO ELSS TAX SAVER - REGULAR PLAN -IDCW (Payout),22.39
2007-01-12,100596,CANARA ROBECO GILT FUND - REGULAR PLAN - IDCW (Payout/Reinvestment),10.3691
2007-01-12,100597,CANARA ROBECO GILT FUND - REGULAR PLAN - GROWTH OPTION,18.1683
2007-01-12,100600,CANARA ROBECO CONSERVATIVE HYBRID FUND - REGULAR PLAN - MONTHLY IDCW (Payout/Reinvestment),11.93
2007-01-12,100601,CANARA ROBECO CONSERVATIVE HYBRID FUND - REGULAR PLAN - GROWTH OPTION,19.69
2007-01-12,100602,Sundaram Medium Duration Fund (Formerly Known as Sundaram Medium Term Bond Fund) Regular Plan-Income Distribution cum Capital Withdrawal(IDCW),10.1576
2007-01-12,100603,Sundaram Medium Duration Fund (Formerly Known as Sundaram Medium Term Bond Fund) Regular Plan - Growth,22.642
2007-01-12,100604,Sundaram Medium Duration Fund (Formerly Known as Sundaram Medium Term Bond Fund) Regular Plan -Growth,11.9182
2007-01-12,100609,Sundaram Medium Duration Fund (Formerly Known as Sundaram Medium Term Bond Fund) Regular Plan- Income Distribution cum Capital Withdrawal(IDCW),10.4029
2007-01-12,100610,Sundaram Medium Duration Fund (Formerly Known as Sundaram Medium Term Bond Fund) Regular Plan -Income Distribution cum Capital Withdrawal (IDCW),10.4046
2007-01-12,100611,Sundaram Medium Duration Fund (Formerly Known as Sundaram Medium Term Bond Fund) Institutional Plan -Growth,11.5784
2007-01-12,100612,Sundaram Growth Fund-Dividend,15.39
2007-01-12,100613,Sundaram Growth Fund-Growth,70.3861
2007-01-12,100614,Sundaram Value Fund Regular Plan - Income Distribution cum Capital Withdrawal (IDCW),15.9764
2007-01-12,100617,Sundaram Equity Hybrid Fund Regular Plan - Growth,33.0648
2007-01-12,100618,Sundaram Money Fund Retail Plan - Growth,15.4613
2007-01-12,100619,Sundaram Money Fund Retail Plan - Quarterly Reinvestment of Income Distribution cum Capital Withdrawal (IDCW),10.0889
2007-01-12,100620,Sundaram Money Fund Retail Plan - Daily Reinvestment of Income Distribution cum Capital Withdrawal (IDCW),10.0953
2007-01-12,100621,Sundaram Money Fund Retail Plan - Weekly Reinvestment of Income Distribution cum Capital Withdrawal (IDCW),10.3207
2007-01-12,100622,Sundaram Money Fund Retail Plan - Fortnightly Reinvestment of Income Distribution cum Capital Withdrawal (IDCW),10.2202
2007-01-12,100623,Sundaram Money Fund Retail Plan - Monthly Income Distribution cum Capital Withdrawal (IDCW),10.1349
2007-01-12,100630,quant Multi Cap Fund-IDCW Option - Regular Plan,16.459
2007-01-12,100631,quant Multi Cap Fund-GROWTH OPTION - Regular Plan,55.8826
2007-01-12,100638,SBI Medium to Long Duration Fund - Regular Plan - Half Yearly - Income Distribution cum Capital Withdrawal Option (IDCW),10.1947
2007-01-12,100639,SBI Medium to Long Duration Fund-REGULAR PLAN-Growth,19.7354
2007-01-12,100640,SBI Medium to Long Duration Fund-REGULAR PLAN-Bonus,11.9544
2007-01-12,100641,SBI ULTRA SHORT DURATION FUND - REGULAR PLAN - GROWTH,16.5271
2007-01-12,100643,SBI Technology Opportunities Fund - Regular Plan - Income Distribution cum Capital Withdrawal Option (IDCW),28.52
2007-01-12,100644,SBI Healthcare Opportunities Fund - Regular Plan - Income Distribution cum Capital Withdrawal Option (IDCW),29.82
2007-01-12,100645,SBI Consumption Opportunities Fund - Regular Plan - Income Distribution cum Capital Withdrawal Option (IDCW),14.73
2007-01-12,100646,UTI - Unit Linked Insurance Plan,15.7007
2007-01-12,100648,UTI - CRTS 81 - Dividend Option,109.1283
2007-01-12,100650,UTI Large Cap Fund - Regular Plan - IDCW,28.2
2007-01-12,100651,UTI Large Cap Fund - Regular Plan - Growth Option,35.02
2007-01-12,100656,UTI - Master Plus Unit Scheme-Growth Option,67.64
2007-01-12,100657,UTI - Master Plus Unit Scheme-Income Option,51.88
2007-01-12,100663,UTI Large & Mid Cap Fund - Regular Plan - IDCW,41.72
2007-01-12,100664,UTI Large & Mid Cap Fund - Regular Plan - Growth Option,45.25
2007-01-12,100668,UTI Flexi Cap Fund - Regular Plan - IDCW,30.71
2007-01-12,100669,UTI - Flexi Cap Fund-Growth Option,33.18
2007-01-12,100678,UTI Children's Hybrid Fund - Regular Plan,15.063
2007-01-12,100682,UTI Retirement Fund - Regular Plan,19.6729
2007-01-12,100684,UTI Aggressive Hybrid Fund - Regular Plan - Growth,56.23
2007-01-12,100685,UTI Aggressive Hybrid Fund - Regular Plan - IDCW,22.23
2007-01-12,100711,UTI - INDEX SELECT FUND-Income Option,23.66
2007-01-12,100712,UTI - INDEX SELECT FUND-Growth Option,35.06
2007-01-12,100715,DBS Chola Multi-Cap Fund-Dividend Option,15.37
2007-01-12,100716,DBS Chola Multi-Cap Fund-Cumulative Option,19.27
2007-01-12,100723,UTI MMF-Discontinued - Regular Plan -Growth,20.6986
2007-01-12,100724,UTI MMF- Discontinued - Regular Plan - Flexi Dividend Option,17.6536
2007-01-12,100725,UTI MMF- Discontinued - Regular Plan - Periodic Dividend Option,17.526
2007-01-12,100739,UTI MNC Fund - Regular Plan - IDCW,29.51
2007-01-12,100740,UTI - MNC Fund - Regular Plan - Growth Option,35.53
2007-01-12,100741,UTI Medium to Long Duration Fund- Regular Plan - Growth,21.5496
2007-01-12,100742,UTI Medium to Long Duration Fund - Regular Plan - Quarterly IDCW,10.8461
2007-01-12,100748,UTI - Master Index Fund-Income Option,44.0975
2007-01-12,100749,UTI - Master Index Fund-Growth Option,44.0975
2007-01-12,100750,UTI - Master Value Fund-Income Option,20.08
2007-01-12,100751,UTI - Master Value Fund-Growth Option,30.8
2007-01-12,100780,Sundaram Banking & PSU Fund (Formerly Known as Sundaram Banking and PSU Debt Fund) Retail Plan - Monthly Income Distribution cum Capital Withdrawal (IDCW),10.1824
2007-01-12,100781,Sundaram Banking & PSU Fund (Formerly Known as Sundaram Banking and PSU Debt Fund) Retail Plan - Growth,11.1745
2007-01-12,100782,Sundaram Banking & PSU Fund (Formerly Known as Sundaram Banking and PSU Debt Fund) Regular Plan - Daily Reinvestment of Income Distribution cum Capital Withdrawal (IDCW),10.0519
2007-01-12,100784,Sundaram Banking & PSU Fund (Formerly Known as Sundaram Banking and PSU Debt Fund) Regular Plan - Growth,11.2926
