date,scheme_code,scheme_name,nav
2007-01-12,102205,SBI Dynamic Bond Fund - REGULAR PLAN - Growth,10.652
2007-01-12,102206,SBI Dynamic Bond Fund - Regular Plan - Income Distribution cum Capital Withdrawal Option (IDCW),10.2298
2007-01-12,102207,SBI MAGNUM NRI FLEXIASSET PLAN-GROWTH,23.4639
2007-01-12,102208,SBI MAGNUM NRI FLEXIASSET PLAN-DIVIDEND,23.4606
2007-01-12,102222,ING Dynamic Duration Fund-Growth Option,11.5366
2007-01-12,102223,ING Dynamic Duration Fund-Annual Dividend Option,10.6493
2007-01-12,102224,ING Dynamic Duration Fund-Monthly Dividend Option,10.1372
2007-01-12,102225,ING Dynamic Duration Fund-Quarterly Dividend Option,10.1735
2007-01-12,102226,ING Dynamic Duration Fund-Half Yearly Dividend Option,10.3066
2007-01-12,102231,ING Dynamic Duration Fund-Bonus Option,11.5366
2007-01-12,102232,ING MIP Fund-Growth Option,12.1947
2007-01-12,102233,ING MIP Fund-Monthly Dividend Option,10.6402
2007-01-12,102234,ING MIP Fund-Quarterly Dividend Option,10.6721
2007-01-12,102235,ING MIP Fund-Half Yearly Dividend Option,10.7293
2007-01-12,102236,ING MIP Fund-Annual Dividend Option,10.988
2007-01-12,102240,ING MIP Fund-Bonus Option,12.1947
2007-01-12,102242,ING Large Cap Equity Fund-Growth Option,20.87
2007-01-12,102243,ING Large Cap Equity Fund-Dividend Option,13.89
2007-01-12,102245,ING Large Cap Equity Fund-Bonus Option,20.87
2007-01-12,102248,ICICI Prudential Gilt Fund Treasury Plan PF Option - Growth,11.3216
2007-01-12,102251,HSBC Flexi Cap Fund - Regular IDCW,19.5926
2007-01-12,102252,HSBC Flexi Cap Fund - Regular Growth,29.4236
2007-01-12,102257,HSBC MIP - Regular -  Dividend - Monthly,10.6178
2007-01-12,102258,HSBC MIP - Regular - Dividend - Quarterly,10.6902
2007-01-12,102259,HSBC MIP - Regular - Growth,12.3357
2007-01-12,102260,HSBC Conservative Hybrid Fund - Regular Monthly IDCW,10.9663
2007-01-12,102261,HSBC Conservative Hybrid Fund - Regular Quarterly IDCW,11.0966
2007-01-12,102262,HSBC Conservative Hybrid Fund - Regular Growth,13.2671
2007-01-12,102263,Tata Gilt Securities Fund RIP ( Bonus),11.4442
2007-01-12,102266,UTI Children's Equity Fund - Regular Plan - IDCW,11.0377
2007-01-12,102267,UTI Children's Equity Fund - Regular Plan - Growth Option,11.0377
2007-01-12,102268,LIC NOMURA MF Floating Rate Fund - Short Term Plan-Growth,11.7626
2007-01-12,102269,LIC NOMURA MF Floating Rate Fund - Short Term Plan-Weekly Dividend,10.1551
2007-01-12,102270,Franklin FMCG Fund - Dividend,22.85
2007-01-12,102271,Franklin Pharma Fund - Dividend,18.37
2007-01-12,102272,SBI NIFTY INDEX FUND - REGULAR PLAN - GROWTH,37.0684
2007-01-12,102273,SBI Nifty Index Fund - Regular Plan - Income Distribution cum Capital Withdrawal Option (IDCW),18.3338
2007-01-12,102280,Tata M I P Plus Fund - Regular Plan-Monthly Dividend,10.5207
2007-01-12,102281,Tata M I P Plus Fund -Regular Plan- Quarterly Dividend,10.5725
2007-01-12,102282,Tata M I P Plus Fund -Regular Plan- Half Yearly Dividend,10.7721
2007-01-12,102283,Tata MIP Plus Fund -Regular Plan - Growth,11.982
2007-01-12,102300,Grindlays Government Securities Fund-Provident fund Plan-Regular- Plan A-Growth/Appreciation,11.0809
2007-01-12,102304,Grindlays Government Securities Fund-Provident fund Plan-Regular- Plan A-Annual Dividend,10.7182
2007-01-12,102305,Grindlays Government Securities Fund-Provident fund Plan-Regular- Plan A-Quarterly Dividend,10.3687
2007-01-12,102306,Grindlays Government Securities Fund-Provident fund Plan-Institutional Plan-Plan B-Growth/Appreciation,11.112
2007-01-12,102311,Grindlays Government Securities Fund-Provident fund Plan-Institutional Plan-Plan B-Quarterly Dividend,10.3611
2007-01-12,102315,ING Tax Savings Fund-Growth Option,27.74
2007-01-12,102316,ING Tax Savings Fund-Dividend Option,18.08
2007-01-12,102317,ING Tax Savings Fund-Bonus Option,27.79
2007-01-12,102320,Franklin India Index Fund - BSE Plan - Growth Plan,39.0416
2007-01-12,102326,Tata Mid Cap Fund-Regular Plan - IDCW Option,28.0714
2007-01-12,102328,Tata Mid Cap Fund Regular Plan- Growth Option,32.4457
2007-01-12,102329,Tata Mid Cap Growth Fund Regular Plan  - Bonus (Growth),28.2516
2007-01-12,102330,ICICI Prudential Regular Savings Fund - Plan - Growth,14.4781
2007-01-12,102331,ICICI Prudential Regular Savings Fund - Plan - Monthly IDCW,12.2222
2007-01-12,102336,Principal Global Opportunities Fund- Income Distribution CUM Capital Withdrawal Option,14.3653
2007-01-12,102337,Principal Global Opportunities Fund-Growth Option,14.3653
2007-01-12,102340,GCF-Plan C-Growth,11.6364
2007-01-12,102341,GCF-Plan C-weekly Dividend,10.0
2007-01-12,102342,GCF-Plan C-Daily Dividend,10.0
2007-01-12,102347,GFRF-Plan C-Growth,11.6481
2007-01-12,102348,GFRF-Plan C-Daily Dividend,10.0
2007-01-12,102363,GSSIF-ST-Plan C-Growth,10.8312
2007-01-12,102364,GSSIF-ST-Plan C-Dividend,10.0292
2007-01-12,102365,GSSIF-ST-Plan D-Growth,10.2528
2007-01-12,102366,GSSIF-ST-Plan D-Dividend,10.022
2007-01-12,102381,ING Gilt Fund Provident Fund - Dynamic Plan-Growth Option,11.4976
2007-01-12,102382,ING Gilt Fund Provident Fund - Dynamic Plan-Growth Auto Income Payout Option,11.4976
2007-01-12,102383,ING Gilt Fund Provident Fund - Dynamic Plan-Half Yearly Dividend Option,10.3562
2007-01-12,102384,ING Gilt Fund Provident Fund - Dynamic Plan-Annual Dividend Option,10.5834
2007-01-12,102387,ING Gilt Fund Provident Fund - Dynamic Plan-Cyclical Series Option 2006,10.4576
2007-01-12,102393,UTI Mid Cap Fund - Regular Plan - IDCW,20.0
2007-01-12,102394,UTI Mid Cap Fund-Growth Option,23.62
2007-01-12,102395,UTI Infrastructure Fund-Growth Option,28.91
2007-01-12,102396,UTI Infrastructure Fund - Regular Plan - IDCW,21.14
2007-01-12,102397,UTI Transportation and Logistics Fund - Regular Plan - IDCW,16.11
2007-01-12,102398,UTI-Transportation and Logistics  Fund-Growth Option,20.14
2007-01-12,102401,UTI Banking and Financial Services Fund - Regular Plan - Growth Option,21.3
2007-01-12,102402,UTI Banking and Financial Services Fund - Regular Plan - IDCW,17.91
2007-01-12,102403,UTI PSU Fund-Income Option,15.17
2007-01-12,102404,UTI PSU Fund-Growth Option,16.72
2007-01-12,102409,Reliance Gilt Securities Fund-Long Term-P F -Plan-Automatic Capital Appreciation Payout,12.6614
2007-01-12,102410,Reliance Gilt Securities Fund-Long Term-P F -Plan-Defined Maturity Debt,12.6614
2007-01-12,102414,SBI CONTRA FUND - REGULAR PLAN -GROWTH,38.32
2007-01-12,102416,ICICI Prudential Fixed Maturity Plan - 1 Year-Series 12-Retail,11.3348
2007-01-12,102421,ICICI Prudential Fixed Maturity Plan - 1 Year-Series 12-Institutional,11.4054
2007-01-12,102422,ICICI Prudential Fixed Maturity Plan - 1 Year-Series 12-Retail Dividend - 1,10.5099
2007-01-12,102423,ICICI Prudential Fixed Maturity Plan - 1 Year-Series 12-Institutional Dividend - 1,10.514
2007-01-12,102424,ICICI Prudential Fixed Maturity Plan - 1 Year-Series 12-Retail Growth - 1,10.5099
2007-01-12,102425,ICICI Prudential Fixed Maturity Plan - 1 Year-Series 12-Institutional Growth - 1,10.5246
2007-01-12,102426,Principal Resurgent India Equity Fund-Growth,74.21
2007-01-12,102427,Principal Resurgent India Equity Fund-Dividend,19.35
2007-01-12,102428,Tata Value Fund Regular Plan - Payout of IDCW-Option B(10%),24.7541
2007-01-12,102431,Nippon India Pharma Fund-Growth Plan-Growth Option,20.4234
2007-01-12,102432,Nippon India Pharma Fund-Growth Plan-Bonus Option,20.4234
2007-01-12,102433,NIPPON INDIA PHARMA FUND - IDCW Option,19.2226
2007-01-12,102434,DSP India T.I.G.E.R. Fund - Regular Plan - Growth,33.371
2007-01-12,102435,DSP India T.I.G.E.R. Fund - Regular Plan - IDCW,23.642
2007-01-12,102441,Franklin India Liquid Fund - Institution-Growth,1152.6146
2007-01-12,102442,Franklin India Liquid Fund - Institutional Plan - Weekly - IDCW,1001.5981
2007-01-12,102443,Franklin India Liquid Fund - Institutional Plan - Daily - IDCW,1000.25
2007-01-12,102445,DSP BlackRock Savings Manager Fund - Conservative - Growth,12.0376
2007-01-12,102446,DSP BlackRock Savings Manager Fund - Conservative - Monthly Dividend,10.3056
2007-01-12,102447,DSP BlackRock Savings Manager Fund - Conservative - Quarterly Dividend,10.441
2007-01-12,102448,DSP Regular Savings Fund- Regular Plan - Growth,13.7857
2007-01-12,102450,DSP Regular Savings Fund - Regular Plan - IDCW - Monthly,10.555
2007-01-12,102451,DSP Regular Savings Fund - Regular Plan - IDCW - Quarterly,10.9737
2007-01-12,102452,HDFC Low Duration  Fund - Growth,15.9746
2007-01-12,102453,HDFC Low Duration  Fund - Weekly IDCW,10.0226
2007-01-12,102478,JM Mid Cap Fund-Dividend,17.9
2007-01-12,102479,JM Mid Cap Fund-Growth,23.37
2007-01-12,102480,JM Large Cap Fund-Dividend,14.44
2007-01-12,102481,JM Large Cap Fund-Growth,18.2
2007-01-12,102482,Sundaram India Leadership Fund-Growth,30.6061
2007-01-12,102483,Sundaram India Leadership Fund-Dividend,14.93
2007-01-12,102491,UTI - GROWTH & VALUE FUND-ANNUAL DIVIDEND,23.75
2007-01-12,102494,UTI - GROWTH & VALUE FUND-GROWTH,58.74
2007-01-12,102495,UTI - GROWTH & VALUE FUND-SEMI ANNUAL DIVIDEND,16.58
2007-01-12,102496,UTI - INDIA ADVANTAGE EQUITY FUND-DIVIDEND,8.61
2007-01-12,102497,UTI - INDIA ADVANTAGE EQUITY FUND-GROWTH,8.61
2007-01-12,102503,SBI  SAVINGS FUND - REGULAR PLAN - GROWTH,11.4454
2007-01-12,102504,SBI Savings Fund - Regular Plan - Income Distribution cum Capital Withdrawal Option (IDCW),10.0963
2007-01-12,102505,SBI CREDIT RISK FUND - REGULAR PLAN - GROWTH,11.3588
2007-01-12,102506,SBI Credit Risk Fund - Regular Plan - Income Distribution cum Capital Withdrawal Option (IDCW),10.281
2007-01-12,102507,OLD-SBI Magnum Income Fund - F R P - Long Term - Inst. (G),11.4674
2007-01-12,102508,SBI Magnum Income Fund - F R P - Long Term - Inst. (D),10.5933
2007-01-12,102509,UTI Gilt Fund - Regular Plan - IDCW,10.6373
2007-01-12,102510,UTI - GILT FUND - Regular Plan - Growth Option,15.1462
2007-01-12,102511,UTI - GILT FUND -Discontinued PF Plan -Dividend Option,10.5904
2007-01-12,102512,UTI - GILT FUND - Discontinued PF Plan - Growth Option,11.2632
2007-01-12,102513,UTI - GILT ADVANTAGE-LONG TERM PF-( PRESCRIBED APPRECIATION AUTO REDEMPTION,11.281
2007-01-12,102514,UTI - GILT FUND - Discontinued PF Plan Prescribed Date Auto Redemption Option,11.267
2007-01-12,102517,UTI - DYNAMIC EQUITY FUND-GROWTH,36.64
2007-01-12,102518,UTI - DYNAMIC EQUITY FUND-DIVIDEND,20.02
2007-01-12,102528,ICICI Prudential MidCap Fund - Growth,29.82
2007-01-12,102529,ICICI Prudential MidCap Fund - IDCW,24.23
2007-01-12,102530,ICICI Prudential MidCap Fund - Institutional Option - I,11.67
2007-01-12,102531,UTI Ultra Short Duration Fund - Regular Plan - Weekly IDCW (Reinvestment),1016.1957
2007-01-12,102532,UTI Ultra Short Duration Fund - Regular Plan - Growth Option,1203.9162
2007-01-12,102533,UTI Conservative Hybrd Fund - Regular Plan - Monthly Payment Option,14.0793
2007-01-12,102534,UTI Conservative Hybrid Fund - Regular Plan - Flexi IDCW,14.0955
2007-01-12,102535,UTI Conservative Hybrid Fund - Regular Plan - Growth Option,14.0955
2007-01-12,102536,UTI Conservative Hybrid Fund - Regular Plan - Monthly IDCW,12.0911
2007-01-12,102538,UTI Low Duration Fund - Discontinued - Annaul Dividend Option,11.3995
2007-01-12,102539,UTI Low Duration Fund - Discontinued Bonus Option,12.4811
2007-01-12,102540,UTI Low Duration Fund - Discontinued Growth Option,18.7236
2007-01-12,102541,UTI Low Duration Fund - Discontinued - Quarterly Dividend Option,11.0554
2007-01-12,102545,UTI Low Duration Fund - Regular Plan - Bonus Option,11.462
2007-01-12,102546,Franklin India Life Stage Fund Of Funds - 50's Plus Floating Rate Plan - IDCW,12.0602
2007-01-12,102547,Franklin India Life Stage Fund of Funds - The 50s Plus Flo (Gro),13.5898
2007-01-12,102556,GFRF Long Term-Plan A-Growth,11.3399
2007-01-12,102557,GFRF Long Term-Plan A-Dividend Quarterly,10.2501
2007-01-12,102558,GFRF Long Term-Plan A-Dividend Annual,10.3387
2007-01-12,102559,GFRF Long Term-Plan A-Dividend Monthly,10.0351
2007-01-12,102560,GFRF Long Term-Plan B-Growth,11.3919
2007-01-12,102561,GFRF Long Term-Plan B-Dividend Quarterly,10.2908
2007-01-12,102573,Kotak Multi Asset Omni FOF - Payout of Income Distribution cum capital withdrawal option,25.861
2007-01-12,102574,Kotak Multi Asset Omni FOF - Growth- Regular,25.861
2007-01-12,102577,DBS Chola Mid Cap Fund-Dividend,15.81
2007-01-12,102578,DBS Chola Mid Cap Fund-Cumulative,27.4
2007-01-12,102585,ICICI Prudential FMP-15 Month - Series 25-Retail Plan-Cumulative Option,11.3152
2007-01-12,102587,ICICI Prudential FMP-15 Month - Series 25-Institutional Plan-Cumulative Option,11.4099
2007-01-12,102590,Kotak Savings Fund -Weekly Weekly Reinvestment of Income Distribution cum capital withdrawal option,10.0396
2007-01-12,102591,Kotak Savings Fund -Growth,11.4973
2007-01-12,102592,Kotak Savings Fund -Monthly Payout of Income Distribution cum capital withdrawal option,10.0603
2007-01-12,102594,ICICI Prudential Value Fund (erstwhile Value Discovery Fund) - Growth,27.87
2007-01-12,102595,ICICI Prudential Value Fund (erstwhile Value Discovery Fund) - IDCW,19.27
2007-01-12,102596,ICICI Prudential Value Discovery Fund - Institutional Option - I - Growth,11.82
2007-01-12,102619,ABN AMRO Flexi Debt Fund-Regular Plan-Growth Option,11.386
2007-01-12,102620,ABN AMRO Flexi Debt Fund-Regular Plan-Quarterly Dividend Option,10.1202
2007-01-12,102621,ABN AMRO Flexi Debt Fund-Regular Plan-Half-Yearly Dividend Option,10.335
2007-01-12,102622,ABN AMRO Flexi Debt Fund-Regular Plan-Daily Dividend Option,10.0001
2007-01-12,102623,ABN AMRO Flexi Debt Fund-Regular Plan-Weekly Dividend Option,10.0022
2007-01-12,102639,ABN AMRO  Equity Fund-Growth Plan,27.75
2007-01-12,102640,ABN AMRO  Equity Fund-Dividend Plan,21.08
2007-01-12,102641,ABN AMRO  Short Term Income Fund-Regular Plan-Growth Option,11.2958
2007-01-12,102642,ABN AMRO  Short Term Income Fund-Regular Plan-Monthly Dividend Option,10.0241
2007-01-12,102643,ABN AMRO  Short Term Income Fund-Regular Plan-Weekly Dividend Option,10.0017
2007-01-12,102644,ABN AMRO  Short Term Income Fund-Institutional Plan-Growth Option,11.4138
2007-01-12,102645,ABN AMRO  Short Term Income Fund-Institutional Plan-Daily Dividend Option,10.0
2007-01-12,102646,ABN AMRO  Short Term Income Fund-Institutional Plan-Monthly Dividend Option,10.0251
2007-01-12,102647,ABN AMRO  Short Term Income Fund-Institutional Plan-Weekly Dividend Option,10.0017
2007-01-12,102652,ABN AMRO  Monthly Income Plan-Regular Plan-Growth Option,13.0587
2007-01-12,102653,ABN AMRO  Monthly Income Plan-Regular Plan-Monthly Dividend Option,11.014
2007-01-12,102654,ABN AMRO  Monthly Income Plan-Regular Plan-Quarterly Dividend Option,10.9274
2007-01-12,102659,DBS Chola Floating Rate Fund-Dividend,10.33
2007-01-12,102660,DBS Chola Floating Rate Fund-Cumulative,11.3634
2007-01-12,102661,BARODA CONSERVATIVE HYBRID FUND - Plan A - Growth Option,11.7059
2007-01-12,102662,BARODA CONSERVATIVE HYBRID FUND - Plan A - Monthly IDCW Option,11.7108
2007-01-12,102663,BARODA CONSERVATIVE HYBRID FUND - Plan A - Quarterly IDCW Option,11.7064
2007-01-12,102670,BARODA PIONEER CHILDREN FUND-GIFT PLAN,10.5607
2007-01-12,102672,Tata Liquid Fund -Regular Plan - Growth Option,11.5031
2007-01-12,102673,Nippon India Floater Fund - Growth Plan-Growth Option,11.4749
2007-01-12,102675,NIPPON INDIA FLOATER FUND - MONTHLY IDCW Option,10.1705
2007-01-12,102676,NIPPON INDIA FLOATER FUND - DAILY IDCW REINVESTMENT Option,10.0622
2007-01-12,102677,NIPPON INDIA FLOATER FUND - WEEKLY IDCW Option,10.077
2007-01-12,102682,Birla Sun Life Fixed Maturity Plan - Quarterly Series II-Dividend,10.0645
2007-01-12,102683,Birla Sun Life Fixed Maturity Plan - Quarterly Series II-Growth,11.5456
2007-01-12,102701,Sundaram Money Fund Institutional Plan - Daily Reinvestment of Income Distribution cum Capital Withdrawal (IDCW),10.0953
2007-01-12,102703,Sundaram Money Fund Institutional Plan - Growth,15.5124
2007-01-12,102704,Sundaram Money Fund Institutional Plan - Monthly Income Distribution cum Capital Withdrawal (IDCW),10.1778
2007-01-12,102705,Sundaram Money Fund Institutional Plan - Quarterly Reinvestment of Income Distribution cum Capital Withdrawal (IDCW),10.3631
2007-01-12,102706,Sundaram Money Fund Institutional Plan - Weekly Reinvestment of Income Distribution cum Capital Withdrawal (IDCW),10.3544
2007-01-12,102711,ING Select Debt Fund-Growth Option,11.0973
2007-01-12,102712,ING Select Debt Fund-Quarterly Dividend Option,10.1404
2007-01-12,102713,ING Select Debt Fund-Half Yearly Dividend Option,10.2679
2007-01-12,102714,ING Select Debt Fund-Annual Dividend Option,10.412
2007-01-12,102715,ING Select Debt Fund-Bonus Option,11.0973
2007-01-12,102716,ING Domestic Opportunities Fund-Growth Option,27.81
2007-01-12,102717,ING Domestic Opportunities Fund-Dividend Option,15.26
2007-01-12,102718,ING Domestic Opportunities Fund-Bonus Option,27.81
2007-01-12,102719,Principal Low Duration Fund - Growth,11.4795
2007-01-12,102720,Principal Floating Rate Fund - FMP-Weekly Dividend,10.0029
2007-01-12,102721,Principal Floating Rate Fund - FMP-Monthly Dividend,10.2564
2007-01-12,102722,Principal Low Duration Fund- Growth Option,11.5169
2007-01-12,102723,Principal Low Duration Fund - Weekly Income Distribution CUM Capital Withdrawal Option,10.0028
2007-01-12,102724,Principal Low Duration Fund- Monthly Income Distribution CUM Capital Withdrawal Option,10.1106
2007-01-12,102725,Principal Floating Rate Fund - SMP-Growth,11.4366
2007-01-12,102726,Principal Floating Rate Fund - SMP-Daily Dividend,10.0007
2007-01-12,102727,Principal Floating Rate Fund - SMP-Weekly Dividend,10.0027
2007-01-12,102728,Principal Floating Rate Fund - SMP-Monthly Dividend,10.173
2007-01-12,102729,Principal Credit Risk Fund - Regular Plan - Growth Option,11.4772
2007-01-12,102730,Principal Floating Rate Fund - SMP-Insti. Daily Dividend,10.0007
2007-01-12,102731,Principal Floating Rate Fund - SMP-Insti. Weekly Dividend,10.0028
2007-01-12,102732,Principal Credit Risk Fund - Regular Plan - Monthly Dividend Option,10.3574
2007-01-12,102733,Standard Chartered All Seasons Bond Fund-Plan A-Dividend - Quarterly,10.2751
2007-01-12,102734,Standard Chartered All Seasons Bond Fund-Plan A-Growth,11.2895
2007-01-12,102735,Standard Chartered All Seasons Bond Fund-Plan A-Dividend - Half Yearly,10.4102
2007-01-12,102736,Standard Chartered All Seasons Bond Fund-Plan A-Dividend - Annual,10.6911
2007-01-12,102741,ICICI Prudential Medium Term Bond Fund - Growth,11.349
2007-01-12,102742,ICICI Prudential Medium Term Bond Fund - Dividend,10.1249
2007-01-12,102743,ICICI Prudential Medium Term Bond Fund-Plan B-Growth,11.4608
2007-01-12,102744,ICICI Prudential Medium Term Bond Fund-Plan B-Dividend,10.1454
2007-01-12,102751,Nippon India Consumption Fund-Growth Plan-Growth Option,24.1347
2007-01-12,102752,Nippon India Consumption Fund-Growth Plan-Bonus Option,24.1347
2007-01-12,102753,NIPPON INDIA CONSUMPTION FUND - IDCW Option,22.6346
2007-01-12,102754,Birla Sun Life Fixed Maturity Plan - Annual Series 1-Dividend,10.1997
2007-01-12,102755,Birla Sun Life Fixed Maturity Plan - Annual Series 1-Growth,11.4403
2007-01-12,102756,SBI FOCUSED FUND - REGULAR PLAN -GROWTH,31.2
2007-01-12,102760,HDFC Focused Fund - GROWTH PLAN,26.129
2007-01-12,102761,HDFC Focused Fund - IDCW PLAN,20.13
2007-01-12,102765,SBI Focused Fund - Regular Plan - Income Distribution cum Capital Withdrawal Option (IDCW),19.17
2007-01-12,102766,Aditya Birla Sun Life Dynamic Bond Fund -Regular - Quarterly IDCW,10.0928
2007-01-12,102767,Aditya Birla Sun Life Dynamic Bond Fund - Growth - Regular Plan,11.282
2007-01-12,102798,ING Treasury Management Fund-Growth Option,11.3806
2007-01-12,102799,ING Treasury Management Fund-Weekly Dividend Option,10.2924
2007-01-12,102800,ING Treasury Management Fund-Quarterly Dividend Option,10.2444
2007-01-12,102801,ING Treasury Management Fund-Half Yearly Dividend Option,10.3819
2007-01-12,102802,ING Treasury Management Fund-Annual Dividend Option,10.6677
2007-01-12,102803,ING Treasury Management Fund-Bonus Option,11.3806
2007-01-12,102804,ING Treasury Management Fund-Daily Dividend Option,10.0383
2007-01-12,102805,Canara Robeco Nifty Index - Regular Plan - Growth,21.8
2007-01-12,102806,Canara Robeco Nifty Index - Regular Plan - Dividend,14.06
2007-01-12,102807,Principal Dividend Yield Fund-Growth Plan,15.88
2007-01-12,102808,Principal Dividend Yield Fund- Half Yearly Income Distribution CUM Capital Withdrawal Plan,12.94
2007-01-12,102813,LIC NOMURA MF Floater MIP - Monthly Dividend,10.1457
2007-01-12,102814,LIC NOMURA MF Floater MIP - Quarterly Dividend,10.1585
2007-01-12,102815,LIC NOMURA MF Floater MIP - Yearly Dividend,11.0678
2007-01-12,102816,LIC NOMURA MF Floater MIP - Growth,12.6404
2007-01-12,102823,SBI HEALTHCARE OPPORTUNITIES FUND - REGULAR PLAN -GROWTH,36.24
2007-01-12,102827,HSBC Floating Rate Fund - Long Term - Regular - Growth,11.2687
2007-01-12,102828,HSBC Floating Rate Fund - Long Term - Regular - Dividend - Monthly,10.0275
2007-01-12,102829,HSBC Floating Rate Fund - Long Term - Growth,11.3182
2007-01-12,102830,HSBC Floating Rate Fund - Long Term - Dividend - Weekly,10.3884
2007-01-12,102831,HSBC Floating Rate Fund - Long Term - Dividend - Monthly,10.0582
2007-01-12,102832,HSBC Floating Rate Fund - Short Term - Regular - Growth,11.291
2007-01-12,102833,HSBC Floating Rate Fund - Short Term - Regular - Dividend - Daily,10.0
2007-01-12,102834,HSBC Floating Rate Fund - Short Term - Regular - Dividend - Weekly,10.0153
2007-01-12,102835,HSBC Floating Rate Fund - Short Term - Inst. - Growth,11.3405
2007-01-12,102836,HSBC Floating Rate Fund - Short Term - Inst. - Dividend - Daily,10.0137
2007-01-12,102837,HSBC Floating Rate Fund - Short Term - Inst. - Dividend - Weekly,10.0463
2007-01-12,102838,HSBC Floating Rate Fund - Short Term - Inst. - Dividend - Monthly,10.0472
2007-01-12,102839,HSBC Floating Rate Fund - Short Term - Inst. Plus - Growth,10.7464
2007-01-12,102840,HSBC Floating Rate Fund - Short Term - Inst. Plus - Dividend - Daily,10.0262
2007-01-12,102846,Nippon India Balanced Advantage Fund-Growth Plan-Growth Option,25.1938
2007-01-12,102847,Nippon India Balanced Advantage Fund-Growth Plan-Bonus Option,25.1938
2007-01-12,102848,NIPPON INDIA BALANCED ADVANTAGE FUND - IDCW Option,23.8914
2007-01-12,102849,Nippon India Dynamic Bond Fund-Growth Plan-Growth Option,11.1904
2007-01-12,102851,NIPPON INDIA DYNAMIC BOND FUND - IDCW Option,11.1904
2007-01-12,102855,Birla Sun Life Fixed Maturity Plan - Annual  Series 3-Dividend,10.1093
2007-01-12,102856,Birla Sun Life Fixed Maturity Plan - Annual  Series 3-Growth,11.4842
2007-01-12,102858,Tata Dividend Yield Fund  Regular Plan -( Div),14.5481
2007-01-12,102859,Tata Dividend Yield Fund Regular Plan,17.7096
2007-01-12,102860,SBI Savings Fund - Regular Plan Weekly Income Distribution cum Capital Withdrawal Option (IDCW),10.1999
2007-01-12,102867,Kotak Flexi-Debt - Regular Plan - Dividend,10.1235
2007-01-12,102868,Kotak Flexi-Debt - Regular Plan - Growth,11.4395
2007-01-12,102869,Kotak Flexi-Debt- Regular Plan - Daily Dividend,10.0311
2007-01-12,102870,Z-OLD-SBI Magnum Inst. Income Fund -  Savings - Wkly(D)(Upto 22/03/07) Renamed as SBI Premier Liquid Fund,10.5759
2007-01-12,102874,Kotak-Small Cap Fund - Payout of Income Distribution cum capital withdrawal option,15.61
2007-01-12,102875,Kotak-Small Cap Fund - Growth,20.347
2007-01-12,102883,Franklin India Large & Mid Cap Fund - Growth Plan,21.21
2007-01-12,102884,Franklin India Large & Mid Cap Fund - IDCW,18.81
2007-01-12,102885,SBI EQUITY HYBRID FUND - REGULAR PLAN -Growth,35.85
2007-01-12,102896,Principal Focussed Advantage Fund-Dividend,16.57
2007-01-12,102897,Principal Focussed Advantage Fund-Growth,16.58
2007-01-12,102900,LIC NOMURA MF Opportunities Fund-Dividend,12.1841
2007-01-12,102901,LIC NOMURA MF Opportunities Fund-Growth,17.5599
2007-01-12,102902,JM Equity & Derivative Fund-Growth-growth option,11.3212
2007-01-12,102903,JM Equity & Derivative Fund-Dividend-dividend option,10.3014
2007-01-12,102904,JM Equity & Derivative Fund-Bonus-Bonus option,10.4831
2007-01-12,102905,Reliance Index Fund-Sensex Plan-Growth Option,20.5724
2007-01-12,102906,Reliance Index Fund-Sensex Plan-Bonus Option,20.5724
2007-01-12,102907,Reliance Index Fund-Sensex Plan-Dividend Option,20.5724
2007-01-12,102908,Reliance Index Fund-Nifty Plan-Growth Option,16.3359
2007-01-12,102909,Reliance Index Fund-Nifty Plan-Bonus Option,16.3359
2007-01-12,102910,Reliance Index Fund-Nifty Plan-Dividend Option,16.3359
2007-01-12,102913,CANARA ROBECO SAVINGS FUND - REGULAR PLAN - GROWTH OPTION,11.26
2007-01-12,102914,CANARA ROBECO SAVINGS FUND - REGULAR PLAN - IDCW (Payout/Reinvestment),10.8294
2007-01-12,102915,CANARA ROBECO SAVINGS FUND - REGULAR PLAN - WEEKLY IDCW (Payout/Reinvestment),10.2622
2007-01-12,102920,CANARA ROBECO LARGE AND MID CAP FUND - REGULAR PLAN - GROWTH OPTION,16.54
2007-01-12,102921,CANARA ROBECO LARGE AND MID CAP FUND - REGULAR PLAN - IDCW (Payout/Reinvestment),14.1
2007-01-12,102922,Canara Robeco Large and Mid Cap Fund -BONUS OPTION,16.54
2007-01-12,102929,Tata Service Industries Fund - Dividend,20.3772
2007-01-12,102930,Tata Service Industries Fund - Appreciation,20.3071
2007-01-12,102931,ING Midcap Fund-Growth Option,17.69
2007-01-12,102932,ING Midcap Fund-Dividend Option,16.18
2007-01-12,102933,ING Midcap Fund-Bonus Option,17.69
2007-01-12,102941,SBI MIDCAP FUND - REGULAR PLAN - GROWTH,23.23
2007-01-12,102942,SBI Midcap Fund - Regular Plan - Income Distribution cum Capital Withdrawal Option (IDCW),19.96
2007-01-12,102947,HDFC Hybrid Equity Fund - IDCW Plan,16.428
2007-01-12,102948,HDFC Hybrid Equity Fund - Growth Plan,18.484
2007-01-12,102951,ABN  AMRO Opportunities Fund-Growth,21.472
2007-01-12,102952,ABN  AMRO Opportunities Fund-Dividend,18.48
2007-01-12,102957,ICICI Prudential Multicap Fund - Institutional Option - I,22.09
2007-01-12,102960,Z-OLD-SBI Magnum Inst. Income Fund -  Savings - Fortnightly(D)(Upto 22/03/07) Renamed as SBI Premier Liquid Fund,10.1157
2007-01-12,102961,Fidelity Equity Fund-Growth Option,21.376
2007-01-12,102962,Fidelity Equity Fund-Dividend Option,18.863
2007-01-12,103001,Kotak Dynamic FOF---Growth,17.244
