date,scheme_code,scheme_name,nav
2024-04-01,100033,Aditya Birla Sun Life Large & Mid Cap Fund - Regular Growth,788.46
2024-04-01,100034,Aditya Birla Sun Life Large & Mid Cap Fund -Regular - IDCW,131.24
2024-04-01,100041,Aditya Birla Sun Life Liquid Fund -Institutional - IDCW,108.023
2024-04-01,100042,Aditya Birla Sun Life Liquid Fund-Retail (Growth),625.9759
2024-04-01,100043,Aditya Birla Sun Life Liquid Fund-Institutional (Growth),642.3808
2024-04-01,100044,Aditya Birla Sun Life Liquid Fund -Retail - IDCW,163.694
2024-04-01,100046,Aditya Birla Sun Life Liquid Fund -Daily IDCW,100.195
2024-04-01,100047,Aditya Birla Sun Life Liquid Fund - Growth,385.7406
2024-04-01,100048,Aditya Birla Sun Life Liquid Fund -Institutional - weekly  IDCW,108.3119
2024-04-01,100051,Aditya Birla Sun Life Liquid Fund -weekly IDCW,100.3124
2024-04-01,100063,Aditya Birla Sun Life MNC Fund - Regular - IDCW,202.01
2024-04-01,100064,Aditya Birla Sun Life MNC Fund - Growth - Regular Plan,1169.68
2024-04-01,100080,DSP Flexi Cap Fund - Regular Plan - IDCW,57.472
2024-04-01,100081,DSP Aggressive Hybrid Fund- Regular Plan - Growth,293.872
2024-04-01,100082,DSP Aggressive Hybrid Fund- Regular Plan - IDCW,27.279
2024-04-01,100119,HDFC Balanced Advantage Fund - Growth Plan,455.092
2024-04-01,100120,HDFC Balanced Advantage Fund - IDCW Plan,37.844
2024-04-01,100174,quant ELSS Tax Saver Fund - IDCW Option - Regular Plan,49.7429
2024-04-01,100175,quant ELSS Tax Saver Fund - Growth Option - Regular Plan,358.1252
2024-04-01,100176,quant Small Cap Fund - IDCW Option - Regular Plan,187.7301
2024-04-01,100177,quant Small Cap Fund - Growth - Regular Plan,236.082
2024-04-01,100218,JM Large Cap Fund (Regular) - IDCW,28.1304
2024-04-01,100219,JM Large Cap Fund (Regular) - Growth Option,144.9065
2024-04-01,100220,JM Aggressive Hybrid Fund (Regular) - IDCW,29.988
2024-04-01,100221,JM Aggressive Hybrid Fund (Regular) -Growth Option,107.2157
2024-04-01,100233,JM Liquid Fund (Regular) - Weekly IDCW,11.0206
2024-04-01,100234,JM Liquid Fund - Growth Option,65.4051
2024-04-01,100244,JM Liquid Fund (Regular) - Quarterly IDCW,37.0198
2024-04-01,100247,JM Liquid Fund (Regular) - Super Institutional Plan - Growth Option,37.597
2024-04-01,100254,JM Value Fund (Regular) - Growth Option,86.806
2024-04-01,100286,Kotak Aggressive Hybrid Fund - Regular Plan - IDCW - Payout & Reinvestment of Income Distribution cum capital withdrawal option,30.812
2024-04-01,100312,LIC MF Flexi Cap Fund-Regular Plan-IDCW,27.4602
2024-04-01,100313,LIC MF Flexi Cap Fund-Regular Plan-Growth,87.0199
2024-04-01,100321,LIC MF Aggressive Hybrid Fund-Regular Plan-IDCW,15.4486
2024-04-01,100323,LIC MF Aggressive Hybrid Fund-Regular Plan-Growth,170.5958
2024-04-01,100325,LIC MF ULIS (5 Yrs. Single Premium)-Regular Plan-IDCW Reinvestment,32.1997
2024-04-01,100332,LIC MF Large Cap Fund-Regular Plan-IDCW,29.7242
2024-04-01,100348,ICICI Prudential Large & Mid Cap Fund - IDCW,29.25
2024-04-01,100349,ICICI Prudential Large & Mid Cap Fund - Growth,837.5
2024-04-01,100351,ICICI Prudential FMCG Fund - IDCW,90.94
2024-04-01,100352,ICICI Prudential FMCG Fund - Growth,452.73
2024-04-01,100353,ICICI Prudential ELSS Tax Saver Fund - IDCW,23.88
2024-04-01,100354,ICICI Prudential ELSS Tax Saver Fund - Growth,801.77
2024-04-01,100355,ICICI Prudential Equity & Debt Fund - Monthly IDCW,40.13
2024-04-01,100356,ICICI Prudential Equity & Debt Fund - Growth,338.72
2024-04-01,100363,ICICI Prudential Technology Fund - Growth,172.69
2024-04-01,100375,NIPPON INDIA GROWTH MID CAP FUND - IDCW Option,104.5365
2024-04-01,100376,Nippon India Growth Mid Cap Fund-Growth Plan-Bonus Option,552.4488
2024-04-01,100377,Nippon India Growth Mid Cap Fund-Growth Plan-Growth Option,3318.6134
2024-04-01,100378,Nippon India Vision Large & Midcap Fund - IDCW Option,59.707
2024-04-01,100379,Nippon India Vision Large & Midcap Fund-GROWTH PLAN-Bonus Option,205.1765
2024-04-01,100380,Nippon India Vision Large & Midcap Fund-GROWTH PLAN-Growth Option,1218.1972
2024-04-01,100414,Tata Aggressive Hybrid Fund- Regular Plan - Growth Option,394.5967
2024-04-01,100415,Tata Ethical Fund-Regular Plan - Growth Option,358.6114
2024-04-01,100470,Franklin India Large Cap Fund - IDCW,44.9976
2024-04-01,100471,Franklin India Large Cap Fund-Growth,887.6128
2024-04-01,100472,Franklin India Mid Cap Fund - IDCW,87.9963
2024-04-01,100473,Franklin India Mid Cap Fund-Growth,2198.0921
2024-04-01,100474,Tata ELSS Fund- Regular Plan - Payout of IDCW Option,88.3635
2024-04-01,100475,Tata Large Cap Fund -Regular Plan - Growth Option,448.6197
2024-04-01,100476,Taurus Flexi Cap Fund - Regular Plan - Growth,206.58
2024-04-01,100477,Taurus Mid Cap Fund - Regular Plan - Growth,112.29
2024-04-01,100480,Taurus ELSS Tax Saver Fund - Regular Plan - Growth,163.05
2024-04-01,100484,Franklin India Index Fund- NSE Nifty 50 Index Fund - Growth,179.1145
2024-04-01,100496,Templeton India Value Fund - Growth Plan,645.0581
2024-04-01,100497,Templeton India Value Fund - IDCW,100.6857
2024-04-01,100519,Franklin India Flexi Cap Fund - IDCW,61.9308
2024-04-01,100520,Franklin India Flexi Cap Fund - Growth,1408.5486
2024-04-01,100521,Franklin India Technology Fund - IDCW,47.0597
2024-04-01,100522,Franklin India Technology Fund-Growth,459.102
2024-04-01,100524,Franklin INDIA OPPORTUNITIES FUND - IDCW,34.0472
2024-04-01,100525,Franklin India ELSS Tax Saver Fund - IDCW,62.0975
2024-04-01,100526,Franklin India ELSS Tax Saver Fund-Growth,1276.1207
2024-04-01,100535,Franklin India Retirement Fund - IDCW,17.4732
2024-04-01,100536,Franklin India Retirement Fund - Growth,195.1312
2024-04-01,100537,Franklin India Liquid Fund - Regular Plan - Weekly - IDCW,1244.2967
2024-04-01,100538,Franklin India Liquid Fund - Regular Plan - Growth,5461.4316
2024-04-01,100541,Franklin India Liquid Fund - Regular Plan - Daily - IDCW,1509.3204
2024-04-01,100546,Franklin India Liquid Fund - Super Institutional Plan - Growth,3600.9746
2024-04-01,100547,Franklin India Liquid Fund - Super Institutional Plan - Daily - IDCW,1000.0
2024-04-01,100548,Franklin India Liquid Fund - Super Institutional Plan - Weekly - IDCW,1023.9934
2024-04-01,100549,Franklin India Aggressive Hybrid Fund - IDCW,29.8388
2024-04-01,100550,Franklin India Aggressive Hybrid Fund - Growth Plan,237.2444
2024-04-01,100593,CANARA ROBECO ELSS TAX SAVER - REGULAR PLAN -IDCW (Payout),44.96
2024-04-01,100614,Sundaram Value Fund Regular Plan - Income Distribution cum Capital Withdrawal (IDCW),15.6131
2024-04-01,100630,quant Multi Cap Fund-IDCW Option - Regular Plan,72.3898
2024-04-01,100631,quant Multi Cap Fund-GROWTH OPTION - Regular Plan,632.9981
2024-04-01,100643,SBI Technology Opportunities Fund - Regular Plan - Income Distribution cum Capital Withdrawal Option (IDCW),106.3554
2024-04-01,100644,SBI Healthcare Opportunities Fund - Regular Plan - Income Distribution cum Capital Withdrawal Option (IDCW),218.036
2024-04-01,100645,SBI Consumption Opportunities Fund - Regular Plan - Income Distribution cum Capital Withdrawal Option (IDCW),164.1655
2024-04-01,100646,UTI - Unit Linked Insurance Plan,36.5063
2024-04-01,100650,UTI Large Cap Fund - Regular Plan - IDCW,50.3846
2024-04-01,100651,UTI Large Cap Fund - Regular Plan - Growth Option,242.2125
2024-04-01,100663,UTI Large & Mid Cap Fund - Regular Plan - IDCW,71.8334
2024-04-01,100664,UTI Large & Mid Cap Fund - Regular Plan - Growth Option,147.4551
2024-04-01,100668,UTI Flexi Cap Fund - Regular Plan - IDCW,180.0478
2024-04-01,100669,UTI - Flexi Cap Fund-Growth Option,272.3308
2024-04-01,100678,UTI Children's Hybrid Fund - Regular Plan,35.8092
2024-04-01,100682,UTI Retirement Fund - Regular Plan,43.6119
2024-04-01,100684,UTI Aggressive Hybrid Fund - Regular Plan - Growth,345.6306
2024-04-01,100685,UTI Aggressive Hybrid Fund - Regular Plan - IDCW,40.8513
2024-04-01,100739,UTI MNC Fund - Regular Plan - IDCW,180.8706
2024-04-01,100740,UTI - MNC Fund - Regular Plan - Growth Option,350.8068
2024-04-01,100794,Sundaram Small Cap Fund Regular Plan - Income Distribution cum Capital Withdrawal (IDCW),32.7785
2024-04-01,100795,Sundaram Small Cap Fund Regular Plan - Growth,222.5255
2024-04-01,100806,UTI Healthcare Fund - Regular Plan - IDCW,174.6589
2024-04-01,100807,UTI Healthcare Fund - Regular Plan - Growth Option,225.9905
2024-04-01,100813,UTI Overnight Fund - Regular Plan - Periodic IDCW,1671.6465
2024-04-01,100814,UTI - Overnight  Fund - Regular Plan - Growth Option,3244.8764
2024-04-01,100820,UTI ELSS Tax Saver Fund - Regular Plan - IDCW,34.0723
2024-04-01,100821,UTI ELSS Tax Saver Fund - Regular Plan - Growth Option,178.351
2024-04-01,100822,UTI Nifty 50 Index Fund - Regular Plan - Growth Option,152.1197
2024-04-01,100823,UTI Nifty 50 Index Fund - Regular Plan - IDCW,76.6377
2024-04-01,100833,Kotak Liquid Fund - Regular  - Daily Reinvestment of Income Distribution cum capital withdrawal option,1222.81
2024-04-01,100835,Kotak Liquid Fund - Regular Plan - Growth,4840.8437
2024-04-01,100837,Nippon India Liquid Fund - Retail Option - Growth Plan,5214.2836
2024-04-01,100838,NIPPON INDIA LIQUID FUND - RETAIL Plan - WEEKLY IDCW OPTION,1036.6408
2024-04-01,100842,NIPPON INDIA LIQUID FUND - RETAIL Plan - DAILY IDCW OPTION,1524.28
2024-04-01,100843,NIPPON INDIA LIQUID FUND - RETAIL plan - MONTHLY IDCW OPTION,1328.7076
2024-04-01,100844,NIPPON INDIA LIQUID FUND - RETAIL Plan - QUARTERLY IDCW OPTION,1217.1173
2024-04-01,100851,Nippon India Liquid Fund -Growth Plan,5844.7997
2024-04-01,100852,NIPPON INDIA LIQUID FUND - DAILY IDCW OPTION,1528.74
2024-04-01,100853,NIPPON INDIA LIQUID FUND - WEEKLY IDCW OPTION,1534.0101
2024-04-01,100855,NIPPON INDIA LIQUID FUND - MONTHLY IDCW OPTION,1586.5631
2024-04-01,100864,LIC MF ELSS Tax Saver-Regular Plan-IDCW,26.9081
2024-04-01,100865,LIC MF ELSS Tax Saver-Regular Plan-Growth,128.1407
2024-04-01,100868,HDFC Liquid Fund - Growth Plan,4698.8317
2024-04-01,100874,HDFC Liquid Fund - IDCW Plan Weekly,1032.7947
2024-04-01,100875,HDFC Liquid Fund - IDCW Daily,1019.82
2024-04-01,100876,HDFC Liquid Fund - IDCW Monthly,1028.0572
2024-04-01,100900,HDFC Childrens Fund - Growth Plan,258.022
2024-04-01,100915,SBI Contra Fund - Regular Plan - Income Distribution cum Capital Withdrawal Option (IDCW),58.7532
2024-04-01,100948,Franklin India Conservative Hybrid Fund - Growth,80.9806
2024-04-01,100949,Franklin India Conservative Hybrid Fund - Plan A - Monthly - IDCW,13.0966
2024-04-01,100950,Franklin India Conservative Hybrid Fund - Plan A - Quarterly - IDCW,12.1704
2024-04-01,101065,quant Mid Cap Fund - Growth Option - Regular Plan,214.784
2024-04-01,101066,quant Mid Cap Fund - IDCW Option - Regular Plan,76.3537
2024-04-01,101069,quant Aggressive Hybrid Fund-IDCW Option - Regular Plan,55.332
2024-04-01,101070,quant Aggressive Hybrid Fund - Growth Option - Regular Plan,401.1433
2024-04-01,101071,quant Multi Asset Allocation Fund - IDCW Option - Regular Plan,113.9739
2024-04-01,101072,quant Multi Asset Allocation Fund-GROWTH OPTION - Regular Plan,124.3378
2024-04-01,101078,JM Liquid Fund (Regular) - Daily IDCW,10.4302
2024-04-01,101127,ICICI Prudential Children's Fund - Regular Plan,282.11
2024-04-01,101143,ICICI Prudential Multi-Asset Fund - IDCW,31.2403
2024-04-01,101144,ICICI Prudential Multi-Asset Fund - Growth,639.994
2024-04-01,101161,Nippon India Multi Cap Fund-Growth Plan-Growth Option,248.6682
2024-04-01,101162,Nippon India Multi Cap Fund-Growth Plan-Bonus Option,248.6682
2024-04-01,101163,NIPPON INDIA MULTI CAP FUND - IDCW Option,57.3528
2024-04-01,101184,LIC MF Liquid Fund-Regular Plan-Daily IDCW,1000.1751
2024-04-01,101185,LIC MF Liquid Fund-Regular Plan-Growth,4329.591
2024-04-01,101198,LIC MF BSE Sensex Index Fund-Regular Plan-IDCW,47.2959
2024-04-01,101199,LIC MF BSE Sensex Index Fund-Regular Plan-Growth,137.9866
2024-04-01,101200,LIC MF Nifty 50 Index Fund-Regular Plan-IDCW,45.5948
2024-04-01,101201,LIC MF Nifty 50 Index Fund-Regular Plan-Growth,123.5975
2024-04-01,101206,SBI OVERNIGHT FUND - REGULAR PLAN - GROWTH,3849.7382
2024-04-01,101209,Taurus Large Cap Fund - Regular Plan - Growth,142.55
2024-04-01,101222,Tata Aggressive Hybrid Fund- Regular Plan - Periodic Payout of IDCW Option,87.2825
2024-04-01,101228,ICICI Prudential Multicap Fund - Growth,681.11
2024-04-01,101262,Nippon India Power & Infra Fund-Growth Plan -Growth Option,313.6057
2024-04-01,101263,Nippon India Power & Infra Fund-Growth Plan-Bonus Option,313.6057
2024-04-01,101264,NIPPON INDIA POWER & INFRA FUND - IDCW Option,64.6158
2024-04-01,101271,LIC MF Children's Fund-Regular Plan-Growth,29.692
2024-04-01,101281,HDFC BSE Sensex Index Fund - Growth Plan,676.2786
2024-04-01,101295,SBI ESG Exclusionary Strategy Fund - Regular Plan - Income Distribution cum Capital Withdrawal Option (IDCW),65.3465
2024-04-01,101313,Aditya Birla Sun Life Nifty 50 Index Fund -REGULAR - IDCW,22.9473
2024-04-01,101314,Aditya Birla Sun Life Nifty 50 Index Fund - Growth - Regular Plan,224.5518
2024-04-01,101349,ICICI Prudential Nifty 50 Index Fund - Cumulative Option,223.0352
2024-04-01,101407,Baroda BNP Paribas LIQUID FUND-Defunct Plan- IDCW Option,3346.7127
2024-04-01,101408,Baroda BNP Paribas LIQUID FUND- Defunct Plan -Growth Option,4056.0869
2024-04-01,101491,Tata Childrens Fund -Regular Plan-Growth Option,54.6458
2024-04-01,101525,HDFC Nifty 50 Index Fund - Growth Plan,210.2307
2024-04-01,101530,SBI Large & Midcap Fund - Regular Plan - Income Distribution cum Capital Withdrawal Option (IDCW),235.1966
2024-04-01,101538,Sundaram Mid Cap Fund Regular Plan - Income Distribution cum Capital Withdrawal (IDCW),59.6993
2024-04-01,101539,Sundaram Mid Cap Fund Regular Plan - Growth,1115.8105
2024-04-01,101549,JM Liquid Fund (Regular) - Bonus Option - Principal Units,20.9429
2024-04-01,101551,SBI Equity Hybrid Fund - Regular Plan - Income Distribution cum Capital Withdrawal Option (IDCW),53.7968
2024-04-01,101585,HDFC Equity Savings Fund - GROWTH PLAN,60.043
2024-04-01,101586,HDFC Equity Savings Fund - IDCW PLAN,12.786
2024-04-01,101591,Aditya Birla Sun Life Midcap Fund -REGULAR - IDCW,51.95
2024-04-01,101592,Aditya Birla Sun Life MIDCAP Fund-Growth,651.48
2024-04-01,101593,HSBC Large Cap Fund - Regular IDCW,45.3027
2024-04-01,101594,HSBC Large Cap Fund - Regular Growth,426.5289
2024-04-01,101609,TATA Equity Savings Fund- Regular Plan -Monthly Payout of IDCW option,16.5746
2024-04-01,101635,DSP Large Cap Fund - Regular Plan - Growth,392.752
2024-04-01,101636,DSP Large Cap Fund - Regular Plan - IDCW,23.73
2024-04-01,101659,Tata Nifty 50 Index Fund -Regular Plan,138.2178
2024-04-01,101672,Tata Value Fund - Regular Plan -Growth Option,306.8928
2024-04-01,101705,ICICI Prudential BSE Sensex ETF,826.4975
2024-04-01,101706,ICICI Prudential Multicap Fund - IDCW,32.59
2024-04-01,101714,Tata Liquid Fund- Regular Plan - Daily Reinvestment of IDCW Option,1001.5157
2024-04-01,101737,Aditya Birla Sun Life Dividend Yield Fund -REGULAR - IDCW,26.0
2024-04-01,101738,Aditya Birla Sun Life Dividend Yield Fund - Growth - Regular Plan,400.72
2024-04-01,101746,Tata S&P BSE Sensex Index Fund -Regular Plan,183.9302
2024-04-01,101762,HDFC Flexi Cap Fund - Growth Plan,1619.697
2024-04-01,101763,HDFC Flexi Cap Fund - IDCW Plan,70.683
2024-04-01,101764,HDFC Value Fund - Growth Plan,622.487
2024-04-01,101765,HDFC Value Fund - IDCW Plan,31.595
2024-04-01,101766,Tata Infrastructure Fund-Regular Plan- Growth Option,169.4146
2024-04-01,101823,Tata Large & Mid Cap Fund Regular Plan - Payout of IDCW Option,75.5597
2024-04-01,101824,Tata Large & Mid Cap Fund- Regular Plan - Growth Option,468.7564
2024-04-01,101833,Tata Ethical Fund- Regular Plan - Payout of IDCW Option,146.1604
2024-04-01,101834,UTI - Master Equity Plan Unit Scheme,202.2509
2024-04-01,101852,TATA Infrastructure Fund Regular Plan - Payout of IDCW Option,80.3024
2024-04-01,101853,Sundaram Value Fund Regular Plan - Growth,195.5085
2024-04-01,101862,Nippon India Banking & Financial Services Fund-Growth Plan-Growth Option,516.5305
2024-04-01,101863,Nippon India Banking & Financial Services Fund-Growth Plan-Bonus Option,516.5305
2024-04-01,101864,Nippon India Banking & Financial Services Fund - IDCW Option,64.2455
2024-04-01,101906,Tata Equity Savings Fund -Regular Plan-Growth Option,49.254
2024-04-01,101922,CANARA ROBECO FLEXICAP FUND - REGULAR PLAN - GROWTH OPTION,291.99
2024-04-01,101923,CANARA ROBECO FLEXICAP FUND - REGULAR PLAN - IDCW (Payout/Reinvestment),56.46
2024-04-01,101979,HDFC ELSS Tax saver - Growth Plan,1172.104
2024-04-01,101980,HDFC ELSS Tax saver - IDCW Plan,69.223
2024-04-01,101996,HDFC Overnight Fund - Growth Option,3523.4547
2024-04-01,101997,HDFC Overnight Fund - IDCW Option (Daily),1042.66
2024-04-01,102000,HDFC Large Cap Fund - Growth Option - Regular Plan,1033.907
2024-04-01,102001,HDFC Large Cap Fund - IDCW Option - Regular Plan,57.787
2024-04-01,102007,UTI-  Liquid Cash Plan- Discontinued -Regular Plan Periodic Dividend Option,1138.3985
2024-04-01,102008,UTI-  Liquid Cash Plan- Discontinued - Regular Plan - Monthly Dividend Option,1076.2479
2024-04-01,102009,UTI-  Liquid Cash Plan- Discontinued - Regular Plan -Growth,3574.421
2024-04-01,102010,UTI Liquid Fund - Regular Plan - Daily IDCW (Reinvestment),1086.4613
2024-04-01,102011,UTI Liquid Fund - Regular Plan - Monthly IDCW,1045.9077
2024-04-01,102012,UTI-  Liquid Cash Plan - Regular Plan - Growth Option,3927.4269
2024-04-01,102013,UTI Liquid Fund - Regular Plan - Weekly IDCW,1054.4958
2024-04-01,102020,Baroda BNP Paribas MULTI CAP FUND - Regular Plan - Growth Option,245.564
2024-04-01,102021,Baroda BNP Paribas MULTI CAP FUND - Regular Plan - IDCW Option,52.8969
2024-04-01,102036,Tata Large Cap Fund- Regular Plan - Payout of IDCW Option,97.7504
2024-04-01,102118,Tata Equity Savings Fund- Regular Plan - Periodic Payout of IDCW Option,23.5951
2024-04-01,102133,ICICI Prudential Multi Sector Passive FOF - Growth,140.1582
2024-04-01,102134,ICICI Prudential Multi Sector Passive FOF - IDCW,109.2009
2024-04-01,102142,Sundaram Consumption Fund(Formerly Known as Sundaram Rural and Consumption Fund Regular Plan - Growth),81.6381
2024-04-01,102251,HSBC Flexi Cap Fund - Regular IDCW,41.7336
2024-04-01,102252,HSBC Flexi Cap Fund - Regular Growth,185.1942
2024-04-01,102266,UTI Children's Equity Fund - Regular Plan - IDCW,73.5341
2024-04-01,102267,UTI Children's Equity Fund - Regular Plan - Growth Option,73.5297
2024-04-01,102272,SBI NIFTY INDEX FUND - REGULAR PLAN - GROWTH,196.0539
2024-04-01,102273,SBI Nifty Index Fund - Regular Plan - Income Distribution cum Capital Withdrawal Option (IDCW),100.5876
2024-04-01,102326,Tata Mid Cap Fund-Regular Plan - IDCW Option,102.7434
2024-04-01,102328,Tata Mid Cap Fund Regular Plan- Growth Option,372.2384
2024-04-01,102393,UTI Mid Cap Fund - Regular Plan - IDCW,120.7614
2024-04-01,102394,UTI Mid Cap Fund-Growth Option,255.1967
2024-04-01,102395,UTI Infrastructure Fund-Growth Option,128.3405
2024-04-01,102396,UTI Infrastructure Fund - Regular Plan - IDCW,67.0763
2024-04-01,102397,UTI Transportation and Logistics Fund - Regular Plan - IDCW,108.0324
2024-04-01,102398,UTI-Transportation and Logistics  Fund-Growth Option,234.2882
2024-04-01,102401,UTI Banking and Financial Services Fund - Regular Plan - Growth Option,155.1219
2024-04-01,102402,UTI Banking and Financial Services Fund - Regular Plan - IDCW,60.3726
2024-04-01,102414,SBI CONTRA FUND - REGULAR PLAN -GROWTH,338.8179
2024-04-01,102428,Tata Value Fund Regular Plan - Payout of IDCW-Option B(10%),107.9802
2024-04-01,102431,Nippon India Pharma Fund-Growth Plan-Growth Option,433.821
2024-04-01,102432,Nippon India Pharma Fund-Growth Plan-Bonus Option,433.821
2024-04-01,102433,NIPPON INDIA PHARMA FUND - IDCW Option,110.4521
2024-04-01,102434,DSP India T.I.G.E.R. Fund - Regular Plan - Growth,270.052
2024-04-01,102435,DSP India T.I.G.E.R. Fund - Regular Plan - IDCW,27.627
2024-04-01,102442,Franklin India Liquid Fund - Institutional Plan - Weekly - IDCW,1054.7184
2024-04-01,102443,Franklin India Liquid Fund - Institutional Plan - Daily - IDCW,1000.0
2024-04-01,102528,ICICI Prudential MidCap Fund - Growth,244.15
2024-04-01,102529,ICICI Prudential MidCap Fund - IDCW,37.57
2024-04-01,102573,Kotak Multi Asset Omni FOF - Payout of Income Distribution cum capital withdrawal option,193.826
2024-04-01,102574,Kotak Multi Asset Omni FOF - Growth- Regular,199.122
2024-04-01,102594,ICICI Prudential Value Fund (erstwhile Value Discovery Fund) - Growth,397.19
2024-04-01,102595,ICICI Prudential Value Fund (erstwhile Value Discovery Fund) - IDCW,37.19
2024-04-01,102672,Tata Liquid Fund -Regular Plan - Growth Option,3771.1276
2024-04-01,102751,Nippon India Consumption Fund-Growth Plan-Growth Option,171.695
2024-04-01,102752,Nippon India Consumption Fund-Growth Plan-Bonus Option,171.695
2024-04-01,102753,NIPPON INDIA CONSUMPTION FUND - IDCW Option,36.2234
2024-04-01,102756,SBI FOCUSED FUND - REGULAR PLAN -GROWTH,295.7648
2024-04-01,102760,HDFC Focused Fund - GROWTH PLAN,186.668
2024-04-01,102761,HDFC Focused Fund - IDCW PLAN,22.756
2024-04-01,102765,SBI Focused Fund - Regular Plan - Income Distribution cum Capital Withdrawal Option (IDCW),54.0978
2024-04-01,102823,SBI HEALTHCARE OPPORTUNITIES FUND - REGULAR PLAN -GROWTH,346.1193
2024-04-01,102846,Nippon India Balanced Advantage Fund-Growth Plan-Growth Option,156.2262
2024-04-01,102847,Nippon India Balanced Advantage Fund-Growth Plan-Bonus Option,156.2262
2024-04-01,102848,NIPPON INDIA BALANCED ADVANTAGE FUND - IDCW Option,32.3234
2024-04-01,102874,Kotak-Small Cap Fund - Payout of Income Distribution cum capital withdrawal option,96.53
2024-04-01,102875,Kotak-Small Cap Fund - Growth,221.264
2024-04-01,102883,Franklin India Large & Mid Cap Fund - Growth Plan,158.2214
2024-04-01,102884,Franklin India Large & Mid Cap Fund - IDCW,19.5946
2024-04-01,102885,SBI EQUITY HYBRID FUND - REGULAR PLAN -Growth,253.8725
2024-04-01,102920,CANARA ROBECO LARGE AND MID CAP FUND - REGULAR PLAN - GROWTH OPTION,213.9
2024-04-01,102921,CANARA ROBECO LARGE AND MID CAP FUND - REGULAR PLAN - IDCW (Payout/Reinvestment),76.82
2024-04-01,102941,SBI MIDCAP FUND - REGULAR PLAN - GROWTH,205.0249
2024-04-01,102942,SBI Midcap Fund - Regular Plan - Income Distribution cum Capital Withdrawal Option (IDCW),83.7757
2024-04-01,102947,HDFC Hybrid Equity Fund - IDCW Plan,16.001
2024-04-01,102948,HDFC Hybrid Equity Fund - Growth Plan,104.796
2024-04-01,103024,SBI LARGE & MIDCAP FUND- REGULAR PLAN -Growth,520.5983
2024-04-01,103025,UTI Dividend Yield Fund - Regular Plan - IDCW,28.9472
2024-04-01,103026,UTI-Dividend Yield Fund.-Growth,146.5425
2024-04-01,103034,SBI MNC FUND - REGULAR PLAN -GROWTH,340.1835
2024-04-01,103039,Kotak Contra Fund - Regular Plan - IDCW - Payout & Re-investment of Income Distribution cum capital withdrawal option,44.637
2024-04-01,103040,Kotak Contra Fund - Regular Plan - Growth,129.498
2024-04-01,103085,Nippon India Value Fund- Growth Plan,192.9957
2024-04-01,103086,NIPPON INDIA VALUE FUND - IDCW Option,41.4806
2024-04-01,103097,UTI Value Fund - Regular Plan - IDCW,39.927
2024-04-01,103098,UTI Value Fund - Regular Plan - Growth Option,137.0054
2024-04-01,103110,Aditya Birla Sun Life Consumption Fund -Regular - IDCW,39.25
2024-04-01,103111,Aditya Birla Sun Life Consumption Fund-Growth Option,184.06
2024-04-01,103114,SBI MNC Fund - Regular Plan - Income Distribution cum Capital Withdrawal Option (IDCW),103.9231
2024-04-01,103130,HDFC Multi-Asset Fund - IDCW Option,16.031
2024-04-01,103131,HDFC Multi-Asset Fund - Growth Option,61.77
2024-04-01,103140,SBI Overnight Fund - Regular Plan - Weekly Income Distribution cum Capital Withdrawal Option (IDCW),1231.1448
2024-04-01,103145,SBI COMMA Fund - REGULAR PLAN - Growth,92.9298
2024-04-01,103146,SBI Comma Fund - Regular Plan - Income Distribution cum Capital Withdrawal Option (IDCW),52.7478
2024-04-01,103149,ICICI Prudential Infrastructure Fund - Growth,167.84
2024-04-01,103150,ICICI Prudential Infrastructure Fund - IDCW,28.11
2024-04-01,103151,Franklin India Opportunities Fund - Growth,200.6521
2024-04-01,103154,Aditya Birla Sun Life Equity Hybrid'95 Fund -Regular - IDCW,170.05
2024-04-01,103155,Aditya Birla Sun Life Equity Hybrid'95 Fund - Regular Plan-Growth,1323.69
2024-04-01,103164,Aditya Birla Sun Life ELSS Tax Saver Fund-Regular - IDCW,181.31
2024-04-01,103165,Aditya Birla Sun Life Flexi Cap Fund -Regular - IDCW,148.79
2024-04-01,103166,Aditya Birla Sun Life Flexi Cap Fund - Growth - Regular Plan,1511.73
2024-04-01,103167,Aditya Birla Sun Life Digital India Fund -Regular - IDCW,44.17
2024-04-01,103168,Aditya Birla Sun Life Digital India Fund - Growth - Regular Plan,155.52
2024-04-01,103173,Aditya Birla Sun Life Large Cap Fund-Regular - IDCW,38.86
2024-04-01,103174,Aditya Birla Sun Life Large Cap Fund-Growth,456.15
2024-04-01,103196,Nippon India ELSS Tax Saver Fund-Growth Plan-Growth Option,110.9938
2024-04-01,103197,NIPPON INDIA ELSS TAX SAVER FUND - IDCW Option,33.2212
2024-04-01,103215,SBI Flexicap Fund - REGULAR PLAN -Growth Option,97.573
2024-04-01,103216,SBI Flexicap Fund - Regular Plan - Income Distribution cum Capital Withdrawal Option (IDCW),43.6909
2024-04-01,103225,quant Liquid Fund - Growth Option - Regular Plan,37.9761
2024-04-01,103226,quant Liquid Fund-Daily IDCW Option - Regular Plan,12.8656
2024-04-01,103227,quant Liquid Fund - Weekly IDCW Option - Regular Plan,13.5
2024-04-01,103228,quant Liquid Fund - Monthly IDCW Option - Regular Plan,15.1711
2024-04-01,103233,Kotak Large & Midcap Fund - IDCW-Regular,50.603
2024-04-01,103234,Kotak Large & Midcap Fund - Growth-Regular,290.054
2024-04-01,103308,Aditya Birla Sun Life Focused Fund -Regular - IDCW,23.7793
2024-04-01,103309,Aditya Birla Sun Life Focused Fund -Growth Option,121.6508
2024-04-01,103312,ICICI Prudential Exports & Services Fund - Growth,137.51
2024-04-01,103313,ICICI Prudential Exports & Services Fund - IDCW,36.74
2024-04-01,103338,Kotak ELSS Tax Saver Fund-Payout of Income Distribution cum capital withdrawal option,38.446
2024-04-01,103339,Kotak ELSS Tax Saver Fund-Growth,102.728
2024-04-01,103340,ICICI Prudential Liquid Fund - Growth,354.4461
