date,scheme_code,scheme_name,nav
2026-02-19,100033,Aditya Birla Sun Life Large & Mid Cap Fund - Regular Growth,918.54
2026-02-19,100034,Aditya Birla Sun Life Large & Mid Cap Fund -Regular - IDCW,133.78
2026-02-19,100041,Aditya Birla Sun Life Liquid Fund -Institutional - IDCW,108.023
2026-02-19,100042,Aditya Birla Sun Life Liquid Fund-Retail (Growth),708.3426
2026-02-19,100043,Aditya Birla Sun Life Liquid Fund-Institutional (Growth),726.9061
2026-02-19,100044,Aditya Birla Sun Life Liquid Fund -Retail - IDCW,163.694
2026-02-19,100046,Aditya Birla Sun Life Liquid Fund -Daily IDCW,100.195
2026-02-19,100047,Aditya Birla Sun Life Liquid Fund - Growth,436.4962
2026-02-19,100048,Aditya Birla Sun Life Liquid Fund -Institutional - weekly  IDCW,108.3071
2026-02-19,100051,Aditya Birla Sun Life Liquid Fund -weekly IDCW,100.3167
2026-02-19,100063,Aditya Birla Sun Life MNC Fund - Regular - IDCW,221.89
2026-02-19,100064,Aditya Birla Sun Life MNC Fund - Growth - Regular Plan,1284.73
2026-02-19,100080,DSP Flexi Cap Fund - Regular Plan - IDCW,64.147
2026-02-19,100081,DSP Aggressive Hybrid Fund- Regular Plan - Growth,357.244
2026-02-19,100082,DSP Aggressive Hybrid Fund- Regular Plan - IDCW,28.562
2026-02-19,100119,HDFC Balanced Advantage Fund - Growth Plan,529.668
2026-02-19,100120,HDFC Balanced Advantage Fund - IDCW Plan,38.272
2026-02-19,100174,quant ELSS Tax Saver Fund - IDCW Option - Regular Plan,51.1734
2026-02-19,100175,quant ELSS Tax Saver Fund - Growth Option - Regular Plan,368.5215
2026-02-19,100176,quant Small Cap Fund - IDCW Option - Regular Plan,190.4362
2026-02-19,100177,quant Small Cap Fund - Growth - Regular Plan,239.465
2026-02-19,100218,JM Large Cap Fund (Regular) - IDCW,30.2908
2026-02-19,100219,JM Large Cap Fund (Regular) - Growth Option,156.0385
2026-02-19,100220,JM Aggressive Hybrid Fund (Regular) - IDCW,32.8375
2026-02-19,100221,JM Aggressive Hybrid Fund (Regular) -Growth Option,117.4064
2026-02-19,100233,JM Liquid Fund (Regular) - Weekly IDCW,11.0066
2026-02-19,100234,JM Liquid Fund - Growth Option,73.8715
2026-02-19,100244,JM Liquid Fund (Regular) - Quarterly IDCW,41.812
2026-02-19,100247,JM Liquid Fund (Regular) - Super Institutional Plan - Growth Option,42.4717
2026-02-19,100254,JM Value Fund (Regular) - Growth Option,93.5845
2026-02-19,100286,Kotak Aggressive Hybrid Fund - Regular Plan - IDCW - Payout & Reinvestment of Income Distribution cum capital withdrawal option,37.335
2026-02-19,100312,LIC MF Flexi Cap Fund-Regular Plan-IDCW,31.088
2026-02-19,100313,LIC MF Flexi Cap Fund-Regular Plan-Growth,98.5163
2026-02-19,100321,LIC MF Aggressive Hybrid Fund-Regular Plan-IDCW,15.4006
2026-02-19,100323,LIC MF Aggressive Hybrid Fund-Regular Plan-Growth,195.455
2026-02-19,100325,LIC MF ULIS (5 Yrs. Single Premium)-Regular Plan-IDCW Reinvestment,35.8506
2026-02-19,100332,LIC MF Large Cap Fund-Regular Plan-IDCW,33.5877
2026-02-19,100348,ICICI Prudential Large & Mid Cap Fund - IDCW,30.36
2026-02-19,100349,ICICI Prudential Large & Mid Cap Fund - Growth,1034.76
2026-02-19,100351,ICICI Prudential FMCG Fund - IDCW,81.45
2026-02-19,100352,ICICI Prudential FMCG Fund - Growth,440.66
2026-02-19,100353,ICICI Prudential ELSS Tax Saver Fund - IDCW,22.93
2026-02-19,100354,ICICI Prudential ELSS Tax Saver Fund - Growth,941.72
2026-02-19,100355,ICICI Prudential Equity & Debt Fund - Monthly IDCW,44.29
2026-02-19,100356,ICICI Prudential Equity & Debt Fund - Growth,407.45
2026-02-19,100363,ICICI Prudential Technology Fund - Growth,182.68
2026-02-19,100375,NIPPON INDIA GROWTH MID CAP FUND - IDCW Option,124.5412
2026-02-19,100376,Nippon India Growth Mid Cap Fund-Growth Plan-Bonus Option,713.7783
2026-02-19,100377,Nippon India Growth Mid Cap Fund-Growth Plan-Growth Option,4287.6971
2026-02-19,100378,Nippon India Vision Large & Midcap Fund - IDCW Option,61.5223
2026-02-19,100379,Nippon India Vision Large & Midcap Fund-GROWTH PLAN-Bonus Option,249.3169
2026-02-19,100380,Nippon India Vision Large & Midcap Fund-GROWTH PLAN-Growth Option,1480.2606
2026-02-19,100414,Tata Aggressive Hybrid Fund- Regular Plan - Growth Option,443.5673
2026-02-19,100415,Tata Ethical Fund-Regular Plan - Growth Option,370.8928
2026-02-19,100470,Franklin India Large Cap Fund - IDCW,43.4619
2026-02-19,100471,Franklin India Large Cap Fund-Growth,1035.0242
2026-02-19,100472,Franklin India Mid Cap Fund - IDCW,92.7109
2026-02-19,100473,Franklin India Mid Cap Fund-Growth,2730.7382
2026-02-19,100474,Tata ELSS Fund- Regular Plan - Payout of IDCW Option,102.4842
2026-02-19,100475,Tata Large Cap Fund -Regular Plan - Growth Option,515.674
2026-02-19,100476,Taurus Flexi Cap Fund - Regular Plan - Growth,221.1
2026-02-19,100477,Taurus Mid Cap Fund - Regular Plan - Growth,115.89
2026-02-19,100480,Taurus ELSS Tax Saver Fund - Regular Plan - Growth,177.98
2026-02-19,100484,Franklin India Index Fund- NSE Nifty 50 Index Fund - Growth,205.4374
2026-02-19,100496,Templeton India Value Fund - Growth Plan,732.6638
2026-02-19,100497,Templeton India Value Fund - IDCW,96.4715
2026-02-19,100519,Franklin India Flexi Cap Fund - IDCW,67.5518
2026-02-19,100520,Franklin India Flexi Cap Fund - Growth,1638.3245
2026-02-19,100521,Franklin India Technology Fund - IDCW,40.6892
2026-02-19,100522,Franklin India Technology Fund-Growth,472.124
2026-02-19,100524,Franklin INDIA OPPORTUNITIES FUND - IDCW,36.7136
2026-02-19,100525,Franklin India ELSS Tax Saver Fund - IDCW,61.8512
2026-02-19,100526,Franklin India ELSS Tax Saver Fund-Growth,1463.7379
2026-02-19,100535,Franklin India Retirement Fund - IDCW,16.6995
2026-02-19,100536,Franklin India Retirement Fund - Growth,219.9419
2026-02-19,100537,Franklin India Liquid Fund - Regular Plan - Weekly - IDCW,1244.9464
2026-02-19,100538,Franklin India Liquid Fund - Regular Plan - Growth,6109.2529
2026-02-19,100541,Franklin India Liquid Fund - Regular Plan - Daily - IDCW,1509.2342
2026-02-19,100546,Franklin India Liquid Fund - Super Institutional Plan - Growth,4078.9662
2026-02-19,100547,Franklin India Liquid Fund - Super Institutional Plan - Daily - IDCW,1000.0
2026-02-19,100548,Franklin India Liquid Fund - Super Institutional Plan - Weekly - IDCW,1034.6087
2026-02-19,100549,Franklin India Aggressive Hybrid Fund - IDCW,29.1031
2026-02-19,100550,Franklin India Aggressive Hybrid Fund - Growth Plan,271.0558
2026-02-19,100593,CANARA ROBECO ELSS TAX SAVER - REGULAR PLAN -IDCW (Payout),48.78
2026-02-19,100614,Sundaram Value Fund Regular Plan - Income Distribution cum Capital Withdrawal (IDCW),15.9508
2026-02-19,100630,quant Multi Cap Fund-IDCW Option - Regular Plan,66.2525
2026-02-19,100631,quant Multi Cap Fund-GROWTH OPTION - Regular Plan,579.3166
2026-02-19,100643,SBI Technology Opportunities Fund - Regular Plan - Income Distribution cum Capital Withdrawal Option (IDCW),120.6012
2026-02-19,100644,SBI Healthcare Opportunities Fund - Regular Plan - Income Distribution cum Capital Withdrawal Option (IDCW),265.6648
2026-02-19,100645,SBI Consumption Opportunities Fund - Regular Plan - Income Distribution cum Capital Withdrawal Option (IDCW),175.3299
2026-02-19,100646,UTI - Unit Linked Insurance Plan,41.4997
2026-02-19,100650,UTI Large Cap Fund - Regular Plan - IDCW,54.151
2026-02-19,100651,UTI Large Cap Fund - Regular Plan - Growth Option,274.8031
2026-02-19,100663,UTI Large & Mid Cap Fund - Regular Plan - IDCW,89.8432
2026-02-19,100664,UTI Large & Mid Cap Fund - Regular Plan - Growth Option,184.4237
2026-02-19,100668,UTI Flexi Cap Fund - Regular Plan - IDCW,202.1095
2026-02-19,100669,UTI - Flexi Cap Fund-Growth Option,305.7003
2026-02-19,100678,UTI Children's Hybrid Fund - Regular Plan,40.4535
2026-02-19,100682,UTI Retirement Fund - Regular Plan,50.6714
2026-02-19,100684,UTI Aggressive Hybrid Fund - Regular Plan - Growth,413.4437
2026-02-19,100685,UTI Aggressive Hybrid Fund - Regular Plan - IDCW,41.4206
2026-02-19,100739,UTI MNC Fund - Regular Plan - IDCW,200.4012
2026-02-19,100740,UTI - MNC Fund - Regular Plan - Growth Option,388.6872
2026-02-19,100794,Sundaram Small Cap Fund Regular Plan - Income Distribution cum Capital Withdrawal (IDCW),32.6858
2026-02-19,100795,Sundaram Small Cap Fund Regular Plan - Growth,255.679
2026-02-19,100806,UTI Healthcare Fund - Regular Plan - IDCW,216.9111
2026-02-19,100807,UTI Healthcare Fund - Regular Plan - Growth Option,280.6602
2026-02-19,100813,UTI Overnight Fund - Regular Plan - Periodic IDCW,1867.7894
2026-02-19,100814,UTI - Overnight  Fund - Regular Plan - Growth Option,3625.6126
2026-02-19,100820,UTI ELSS Tax Saver Fund - Regular Plan - IDCW,39.2056
2026-02-19,100821,UTI ELSS Tax Saver Fund - Regular Plan - Growth Option,205.221
2026-02-19,100822,UTI Nifty 50 Index Fund - Regular Plan - Growth Option,175.383
2026-02-19,100823,UTI Nifty 50 Index Fund - Regular Plan - IDCW,88.3577
2026-02-19,100833,Kotak Liquid Fund - Regular  - Daily Reinvestment of Income Distribution cum capital withdrawal option,1239.2315
2026-02-19,100835,Kotak Liquid Fund - Regular Plan - Growth,5473.4196
2026-02-19,100837,Nippon India Liquid Fund - Retail Option - Growth Plan,5830.0723
2026-02-19,100838,NIPPON INDIA LIQUID FUND - RETAIL Plan - WEEKLY IDCW OPTION,1034.3168
2026-02-19,100842,NIPPON INDIA LIQUID FUND - RETAIL Plan - DAILY IDCW OPTION,1524.28
2026-02-19,100843,NIPPON INDIA LIQUID FUND - RETAIL plan - MONTHLY IDCW OPTION,1331.4985
2026-02-19,100844,NIPPON INDIA LIQUID FUND - RETAIL Plan - QUARTERLY IDCW OPTION,1224.4969
2026-02-19,100851,Nippon India Liquid Fund -Growth Plan,6609.7308
2026-02-19,100852,NIPPON INDIA LIQUID FUND - DAILY IDCW OPTION,1528.74
2026-02-19,100853,NIPPON INDIA LIQUID FUND - WEEKLY IDCW OPTION,1530.5552
2026-02-19,100855,NIPPON INDIA LIQUID FUND - MONTHLY IDCW OPTION,1590.4571
2026-02-19,100864,LIC MF ELSS Tax Saver-Regular Plan-IDCW,31.4052
2026-02-19,100865,LIC MF ELSS Tax Saver-Regular Plan-Growth,150.0177
2026-02-19,100868,HDFC Liquid Fund - Growth Plan,5314.568
2026-02-19,100874,HDFC Liquid Fund - IDCW Plan Weekly,1031.4986
2026-02-19,100875,HDFC Liquid Fund - IDCW Daily,1019.82
2026-02-19,100876,HDFC Liquid Fund - IDCW Monthly,1030.6167
2026-02-19,100900,HDFC Childrens Fund - Growth Plan,290.862
2026-02-19,100915,SBI Contra Fund - Regular Plan - Income Distribution cum Capital Withdrawal Option (IDCW),67.6457
2026-02-19,100948,Franklin India Conservative Hybrid Fund - Growth,92.1282
2026-02-19,100949,Franklin India Conservative Hybrid Fund - Plan A - Monthly - IDCW,12.9503
2026-02-19,100950,Franklin India Conservative Hybrid Fund - Plan A - Quarterly - IDCW,12.0272
2026-02-19,101065,quant Mid Cap Fund - Growth Option - Regular Plan,195.2754
2026-02-19,101066,quant Mid Cap Fund - IDCW Option - Regular Plan,69.4211
2026-02-19,101069,quant Aggressive Hybrid Fund-IDCW Option - Regular Plan,58.7374
2026-02-19,101070,quant Aggressive Hybrid Fund - Growth Option - Regular Plan,425.8575
2026-02-19,101071,quant Multi Asset Allocation Fund - IDCW Option - Regular Plan,149.2304
2026-02-19,101072,quant Multi Asset Allocation Fund-GROWTH OPTION - Regular Plan,162.7924
2026-02-19,101078,JM Liquid Fund (Regular) - Daily IDCW,10.4302
2026-02-19,101127,ICICI Prudential Children's Fund - Regular Plan,326.33
2026-02-19,101143,ICICI Prudential Multi-Asset Fund - IDCW,35.8855
2026-02-19,101144,ICICI Prudential Multi-Asset Fund - Growth,820.2108
2026-02-19,101161,Nippon India Multi Cap Fund-Growth Plan-Growth Option,297.1807
2026-02-19,101162,Nippon India Multi Cap Fund-Growth Plan-Bonus Option,297.1807
2026-02-19,101163,NIPPON INDIA MULTI CAP FUND - IDCW Option,63.0518
2026-02-19,101184,LIC MF Liquid Fund-Regular Plan-Daily IDCW,1000.1751
2026-02-19,101185,LIC MF Liquid Fund-Regular Plan-Growth,4895.2467
2026-02-19,101198,LIC MF BSE Sensex Index Fund-Regular Plan-IDCW,52.7694
2026-02-19,101199,LIC MF BSE Sensex Index Fund-Regular Plan-Growth,153.9559
2026-02-19,101200,LIC MF Nifty 50 Index Fund-Regular Plan-IDCW,51.7964
2026-02-19,101201,LIC MF Nifty 50 Index Fund-Regular Plan-Growth,140.4088
2026-02-19,101206,SBI OVERNIGHT FUND - REGULAR PLAN - GROWTH,4297.1961
2026-02-19,101209,Taurus Large Cap Fund - Regular Plan - Growth,160.13
2026-02-19,101222,Tata Aggressive Hybrid Fund- Regular Plan - Periodic Payout of IDCW Option,90.3998
2026-02-19,101228,ICICI Prudential Multicap Fund - Growth,800.2
2026-02-19,101262,Nippon India Power & Infra Fund-Growth Plan -Growth Option,349.1524
2026-02-19,101263,Nippon India Power & Infra Fund-Growth Plan-Bonus Option,349.1524
2026-02-19,101264,NIPPON INDIA POWER & INFRA FUND - IDCW Option,60.7144
2026-02-19,101271,LIC MF Children's Fund-Regular Plan-Growth,31.7334
2026-02-19,101281,HDFC BSE Sensex Index Fund - Growth Plan,765.4349
2026-02-19,101295,SBI ESG Exclusionary Strategy Fund - Regular Plan - Income Distribution cum Capital Withdrawal Option (IDCW),75.6123
2026-02-19,101313,Aditya Birla Sun Life Nifty 50 Index Fund -REGULAR - IDCW,26.3701
2026-02-19,101314,Aditya Birla Sun Life Nifty 50 Index Fund - Growth - Regular Plan,258.0476
2026-02-19,101349,ICICI Prudential Nifty 50 Index Fund - Cumulative Option,256.5414
2026-02-19,101407,Baroda BNP Paribas LIQUID FUND-Defunct Plan- IDCW Option,3782.0353
2026-02-19,101408,Baroda BNP Paribas LIQUID FUND- Defunct Plan -Growth Option,4583.7642
2026-02-19,101491,Tata Childrens Fund -Regular Plan-Growth Option,58.6828
2026-02-19,101525,HDFC Nifty 50 Index Fund - Growth Plan,241.908
2026-02-19,101530,SBI Large & Midcap Fund - Regular Plan - Income Distribution cum Capital Withdrawal Option (IDCW),294.2564
2026-02-19,101538,Sundaram Mid Cap Fund Regular Plan - Income Distribution cum Capital Withdrawal (IDCW),65.8443
2026-02-19,101539,Sundaram Mid Cap Fund Regular Plan - Growth,1422.5172
2026-02-19,101549,JM Liquid Fund (Regular) - Bonus Option - Principal Units,23.6539
2026-02-19,101551,SBI Equity Hybrid Fund - Regular Plan - Income Distribution cum Capital Withdrawal Option (IDCW),64.7637
2026-02-19,101585,HDFC Equity Savings Fund - GROWTH PLAN,67.893
2026-02-19,101586,HDFC Equity Savings Fund - IDCW PLAN,12.844
2026-02-19,101591,Aditya Birla Sun Life Midcap Fund -REGULAR - IDCW,54.91
2026-02-19,101592,Aditya Birla Sun Life MIDCAP Fund-Growth,787.35
2026-02-19,101593,HSBC Large Cap Fund - Regular IDCW,43.6099
2026-02-19,101594,HSBC Large Cap Fund - Regular Growth,492.2988
2026-02-19,101609,TATA Equity Savings Fund- Regular Plan -Monthly Payout of IDCW option,17.5607
2026-02-19,101635,DSP Large Cap Fund - Regular Plan - Growth,477.644
2026-02-19,101636,DSP Large Cap Fund - Regular Plan - IDCW,26.525
2026-02-19,101659,Tata Nifty 50 Index Fund -Regular Plan,158.3886
2026-02-19,101672,Tata Value Fund - Regular Plan -Growth Option,353.4682
2026-02-19,101705,ICICI Prudential BSE Sensex ETF,942.0236
2026-02-19,101706,ICICI Prudential Multicap Fund - IDCW,32.22
2026-02-19,101714,Tata Liquid Fund- Regular Plan - Daily Reinvestment of IDCW Option,1001.5157
2026-02-19,101737,Aditya Birla Sun Life Dividend Yield Fund -REGULAR - IDCW,26.47
2026-02-19,101738,Aditya Birla Sun Life Dividend Yield Fund - Growth - Regular Plan,458.02
2026-02-19,101746,Tata S&P BSE Sensex Index Fund -Regular Plan,207.2169
2026-02-19,101762,HDFC Flexi Cap Fund - Growth Plan,2071.173
2026-02-19,101763,HDFC Flexi Cap Fund - IDCW Plan,82.101
2026-02-19,101764,HDFC Value Fund - Growth Plan,764.188
2026-02-19,101765,HDFC Value Fund - IDCW Plan,35.585
2026-02-19,101766,Tata Infrastructure Fund-Regular Plan- Growth Option,166.8984
2026-02-19,101823,Tata Large & Mid Cap Fund Regular Plan - Payout of IDCW Option,81.4499
2026-02-19,101824,Tata Large & Mid Cap Fund- Regular Plan - Growth Option,505.293
2026-02-19,101833,Tata Ethical Fund- Regular Plan - Payout of IDCW Option,151.1691
2026-02-19,101834,UTI - Master Equity Plan Unit Scheme,230.144
2026-02-19,101852,TATA Infrastructure Fund Regular Plan - Payout of IDCW Option,79.1106
2026-02-19,101853,Sundaram Value Fund Regular Plan - Growth,223.7121
2026-02-19,101862,Nippon India Banking & Financial Services Fund-Growth Plan-Growth Option,669.7757
2026-02-19,101863,Nippon India Banking & Financial Services Fund-Growth Plan-Bonus Option,669.7757
2026-02-19,101864,Nippon India Banking & Financial Services Fund - IDCW Option,71.0165
2026-02-19,101906,Tata Equity Savings Fund -Regular Plan-Growth Option,56.3245
2026-02-19,101922,CANARA ROBECO FLEXICAP FUND - REGULAR PLAN - GROWTH OPTION,341.88
2026-02-19,101923,CANARA ROBECO FLEXICAP FUND - REGULAR PLAN - IDCW (Payout/Reinvestment),59.54
2026-02-19,101979,HDFC ELSS Tax saver - Growth Plan,1435.862
2026-02-19,101980,HDFC ELSS Tax saver - IDCW Plan,76.741
2026-02-19,101996,HDFC Overnight Fund - Growth Option,3930.1565
2026-02-19,101997,HDFC Overnight Fund - IDCW Option (Daily),1042.66
2026-02-19,102000,HDFC Large Cap Fund - Growth Option - Regular Plan,1163.257
2026-02-19,102001,HDFC Large Cap Fund - IDCW Option - Regular Plan,53.273
2026-02-19,102007,UTI-  Liquid Cash Plan- Discontinued -Regular Plan Periodic Dividend Option,1135.22
2026-02-19,102008,UTI-  Liquid Cash Plan- Discontinued - Regular Plan - Monthly Dividend Option,1067.6924
2026-02-19,102009,UTI-  Liquid Cash Plan- Discontinued - Regular Plan -Growth,4032.9081
2026-02-19,102010,UTI Liquid Fund - Regular Plan - Daily IDCW (Reinvestment),1169.8808
2026-02-19,102011,UTI Liquid Fund - Regular Plan - Monthly IDCW,1114.7471
2026-02-19,102012,UTI-  Liquid Cash Plan - Regular Plan - Growth Option,4444.2694
2026-02-19,102013,UTI Liquid Fund - Regular Plan - Weekly IDCW,1053.0502
2026-02-19,102020,Baroda BNP Paribas MULTI CAP FUND - Regular Plan - Growth Option,281.9466
2026-02-19,102021,Baroda BNP Paribas MULTI CAP FUND - Regular Plan - IDCW Option,51.4299
2026-02-19,102036,Tata Large Cap Fund- Regular Plan - Payout of IDCW Option,112.3602
2026-02-19,102118,Tata Equity Savings Fund- Regular Plan - Periodic Payout of IDCW Option,26.9829
2026-02-19,102133,ICICI Prudential Multi Sector Passive FOF - Growth,168.8634
2026-02-19,102134,ICICI Prudential Multi Sector Passive FOF - IDCW,131.5658
2026-02-19,102135,ICICI Prudential Aggressive Hybrid Active FOF - Growth,224.0323
2026-02-19,102136,ICICI Prudential Aggressive Hybrid Active FOF - IDCW,173.6671
2026-02-19,102142,Sundaram Consumption Fund(Formerly Known as Sundaram Rural and Consumption Fund Regular Plan - Growth),92.3342
2026-02-19,102251,HSBC Flexi Cap Fund - Regular IDCW,44.6673
2026-02-19,102252,HSBC Flexi Cap Fund - Regular Growth,217.6159
2026-02-19,102266,UTI Children's Equity Fund - Regular Plan - IDCW,83.361
2026-02-19,102267,UTI Children's Equity Fund - Regular Plan - Growth Option,83.3559
2026-02-19,102272,SBI NIFTY INDEX FUND - REGULAR PLAN - GROWTH,225.2646
2026-02-19,102273,SBI Nifty Index Fund - Regular Plan - Income Distribution cum Capital Withdrawal Option (IDCW),115.5734
2026-02-19,102326,Tata Mid Cap Fund-Regular Plan - IDCW Option,122.892
2026-02-19,102328,Tata Mid Cap Fund Regular Plan- Growth Option,445.2351
2026-02-19,102393,UTI Mid Cap Fund - Regular Plan - IDCW,140.6837
2026-02-19,102394,UTI Mid Cap Fund-Growth Option,297.2973
2026-02-19,102395,UTI Infrastructure Fund-Growth Option,144.1319
2026-02-19,102396,UTI Infrastructure Fund - Regular Plan - IDCW,75.3296
2026-02-19,102397,UTI Transportation and Logistics Fund - Regular Plan - IDCW,133.7395
2026-02-19,102398,UTI-Transportation and Logistics  Fund-Growth Option,290.0385
2026-02-19,102401,UTI Banking and Financial Services Fund - Regular Plan - Growth Option,203.3765
2026-02-19,102402,UTI Banking and Financial Services Fund - Regular Plan - IDCW,79.1531
2026-02-19,102414,SBI CONTRA FUND - REGULAR PLAN -GROWTH,390.1017
2026-02-19,102428,Tata Value Fund Regular Plan - Payout of IDCW-Option B(10%),118.3151
2026-02-19,102431,Nippon India Pharma Fund-Growth Plan-Growth Option,506.0229
2026-02-19,102432,Nippon India Pharma Fund-Growth Plan-Bonus Option,506.0229
2026-02-19,102433,NIPPON INDIA PHARMA FUND - IDCW Option,109.2726
2026-02-19,102434,DSP India T.I.G.E.R. Fund - Regular Plan - Growth,322.81
2026-02-19,102435,DSP India T.I.G.E.R. Fund - Regular Plan - IDCW,27.978
2026-02-19,102442,Franklin India Liquid Fund - Institutional Plan - Weekly - IDCW,1055.2985
2026-02-19,102443,Franklin India Liquid Fund - Institutional Plan - Daily - IDCW,1000.0
2026-02-19,102528,ICICI Prudential MidCap Fund - Growth,316.99
2026-02-19,102529,ICICI Prudential MidCap Fund - IDCW,41.08
2026-02-19,102573,Kotak Multi Asset Omni FOF - Payout of Income Distribution cum capital withdrawal option,253.047
2026-02-19,102574,Kotak Multi Asset Omni FOF - Growth- Regular,259.962
2026-02-19,102594,ICICI Prudential Value Fund (erstwhile Value Discovery Fund) - Growth,486.75
2026-02-19,102595,ICICI Prudential Value Fund (erstwhile Value Discovery Fund) - IDCW,41.11
2026-02-19,102672,Tata Liquid Fund -Regular Plan - Growth Option,4266.2959
2026-02-19,102751,Nippon India Consumption Fund-Growth Plan-Growth Option,187.6301
2026-02-19,102752,Nippon India Consumption Fund-Growth Plan-Bonus Option,187.6301
2026-02-19,102753,NIPPON INDIA CONSUMPTION FUND - IDCW Option,33.9096
2026-02-19,102756,SBI FOCUSED FUND - REGULAR PLAN -GROWTH,372.1857
2026-02-19,102760,HDFC Focused Fund - GROWTH PLAN,239.337
2026-02-19,102761,HDFC Focused Fund - IDCW PLAN,24.334
2026-02-19,102765,SBI Focused Fund - Regular Plan - Income Distribution cum Capital Withdrawal Option (IDCW),68.076
2026-02-19,102823,SBI HEALTHCARE OPPORTUNITIES FUND - REGULAR PLAN -GROWTH,421.7258
2026-02-19,102846,Nippon India Balanced Advantage Fund-Growth Plan-Growth Option,180.9033
2026-02-19,102847,Nippon India Balanced Advantage Fund-Growth Plan-Bonus Option,180.9033
2026-02-19,102848,NIPPON INDIA BALANCED ADVANTAGE FUND - IDCW Option,32.3741
2026-02-19,102874,Kotak-Small Cap Fund - Payout of Income Distribution cum capital withdrawal option,106.993
2026-02-19,102875,Kotak-Small Cap Fund - Growth,245.246
2026-02-19,102883,Franklin India Large & Mid Cap Fund - Growth Plan,188.4081
2026-02-19,102884,Franklin India Large & Mid Cap Fund - IDCW,21.4974
2026-02-19,102885,SBI EQUITY HYBRID FUND - REGULAR PLAN -Growth,305.6253
2026-02-19,102920,CANARA ROBECO LARGE AND MID CAP FUND - REGULAR PLAN - GROWTH OPTION,246.62
2026-02-19,102921,CANARA ROBECO LARGE AND MID CAP FUND - REGULAR PLAN - IDCW (Payout/Reinvestment),80.1
2026-02-19,102941,SBI MIDCAP FUND - REGULAR PLAN - GROWTH,233.4562
2026-02-19,102942,SBI Midcap Fund - Regular Plan - Income Distribution cum Capital Withdrawal Option (IDCW),95.3935
2026-02-19,102947,HDFC Hybrid Equity Fund - IDCW Plan,16.293
2026-02-19,102948,HDFC Hybrid Equity Fund - Growth Plan,118.388
2026-02-19,103024,SBI LARGE & MIDCAP FUND- REGULAR PLAN -Growth,651.3167
2026-02-19,103025,UTI Dividend Yield Fund - Regular Plan - IDCW,34.1605
2026-02-19,103026,UTI-Dividend Yield Fund.-Growth,181.4981
2026-02-19,103034,SBI MNC FUND - REGULAR PLAN -GROWTH,353.3708
2026-02-19,103039,Kotak Contra Fund - Regular Plan - IDCW - Payout & Re-investment of Income Distribution cum capital withdrawal option,53.461
2026-02-19,103040,Kotak Contra Fund - Regular Plan - Growth,155.095
2026-02-19,103085,Nippon India Value Fund- Growth Plan,229.5084
2026-02-19,103086,NIPPON INDIA VALUE FUND - IDCW Option,42.6088
2026-02-19,103097,UTI Value Fund - Regular Plan - IDCW,49.6428
2026-02-19,103098,UTI Value Fund - Regular Plan - Growth Option,170.3441
2026-02-19,103110,Aditya Birla Sun Life Consumption Fund -Regular - IDCW,39.21
2026-02-19,103111,Aditya Birla Sun Life Consumption Fund-Growth Option,210.3
2026-02-19,103114,SBI MNC Fund - Regular Plan - Income Distribution cum Capital Withdrawal Option (IDCW),107.952
2026-02-19,103130,HDFC Multi-Asset Fund - IDCW Option,18.415
2026-02-19,103131,HDFC Multi-Asset Fund - Growth Option,76.531
2026-02-19,103140,SBI Overnight Fund - Regular Plan - Weekly Income Distribution cum Capital Withdrawal Option (IDCW),1374.2278
2026-02-19,103145,SBI COMMA Fund - REGULAR PLAN - Growth,113.3133
2026-02-19,103146,SBI Comma Fund - Regular Plan - Income Distribution cum Capital Withdrawal Option (IDCW),64.3179
2026-02-19,103149,ICICI Prudential Infrastructure Fund - Growth,196.22
2026-02-19,103150,ICICI Prudential Infrastructure Fund - IDCW,27.63
2026-02-19,103151,Franklin India Opportunities Fund - Growth,255.949
2026-02-19,103154,Aditya Birla Sun Life Equity Hybrid'95 Fund -Regular - IDCW,175.51
2026-02-19,103155,Aditya Birla Sun Life Equity Hybrid'95 Fund - Regular Plan-Growth,1545.18
2026-02-19,103164,Aditya Birla Sun Life ELSS Tax Saver Fund-Regular - IDCW,200.82
2026-02-19,103165,Aditya Birla Sun Life Flexi Cap Fund -Regular - IDCW,160.03
2026-02-19,103166,Aditya Birla Sun Life Flexi Cap Fund - Growth - Regular Plan,1857.55
2026-02-19,103167,Aditya Birla Sun Life Digital India Fund -Regular - IDCW,38.3
2026-02-19,103168,Aditya Birla Sun Life Digital India Fund - Growth - Regular Plan,154.37
2026-02-19,103173,Aditya Birla Sun Life Large Cap Fund-Regular - IDCW,39.62
2026-02-19,103174,Aditya Birla Sun Life Large Cap Fund-Growth,532.3
2026-02-19,103196,Nippon India ELSS Tax Saver Fund-Growth Plan-Growth Option,130.3345
2026-02-19,103197,NIPPON INDIA ELSS TAX SAVER FUND - IDCW Option,33.8538
2026-02-19,103215,SBI Flexicap Fund - REGULAR PLAN -Growth Option,110.2966
2026-02-19,103216,SBI Flexicap Fund - Regular Plan - Income Distribution cum Capital Withdrawal Option (IDCW),49.3882
2026-02-19,103225,quant Liquid Fund - Growth Option - Regular Plan,42.7745
2026-02-19,103226,quant Liquid Fund-Daily IDCW Option - Regular Plan,12.7075
2026-02-19,103227,quant Liquid Fund - Weekly IDCW Option - Regular Plan,14.4908
2026-02-19,103228,quant Liquid Fund - Monthly IDCW Option - Regular Plan,15.2112
2026-02-19,103233,Kotak Large & Midcap Fund - IDCW-Regular,61.965
2026-02-19,103234,Kotak Large & Midcap Fund - Growth-Regular,355.177
2026-02-19,103308,Aditya Birla Sun Life Focused Fund -Regular - IDCW,25.2121
2026-02-19,103309,Aditya Birla Sun Life Focused Fund -Growth Option,147.668
2026-02-19,103312,ICICI Prudential Exports & Services Fund - Growth,166.04
2026-02-19,103313,ICICI Prudential Exports & Services Fund - IDCW,37.42
